{"username": "ICC", "words": {"test": 466, "live": 284, "ash": 262, "follow": 239, "series": 213, "win": 188, "sri": 175, "south": 175, "day": 173, "cricket": 165, "birthday": 155, "take": 147, "wicket": 137, "score": 131, "match": 125, "west": 113, "make": 110, "century": 107, "new": 104, "today": 93, "side": 91, "lead": 88, "bat": 88, "victory": 84, "get": 82, "ball": 80, "time": 77, "report": 77, "world": 76, "captain": 76, "run": 72, "go": 72, "smith": 69, "fifty": 68, "game": 67, "team": 67, "start": 64, "play": 61, "toss": 59, "look": 56, "player": 56, "happy": 55, "men": 54, "batsman": 51, "year": 51, "cup": 48, "lose": 47, "zimbabwe": 43, "finish": 42, "see": 41, "performance": 41, "think": 40, "need": 40, "squad": 39, "action": 39, "set": 38, "come": 38, "bowl": 37, "lunch": 37, "end": 36, "home": 36, "chase": 35, "joe": 35, "way": 34, "record": 34, "session": 34, "rain": 34, "watch": 33, "bowling": 33, "average": 33, "coach": 33, "ben": 32, "career": 31, "hundred": 31, "preview": 31, "batting": 30, "debut": 30, "hit": 29, "skipper": 29, "khan": 29, "give": 29, "oval": 29, "qualifier": 28, "top": 28, "opener": 28, "return": 27, "partnership": 27, "tri": 27, "star": 26, "bowler": 26, "head": 26, "seal": 25, "tour": 25, "put": 25, "root": 25, "tea": 25, "keep": 25, "yesterday": 24, "rounder": 24, "man": 23, "half": 23, "archer": 23, "beat": 22, "crease": 22, "tomorrow": 22, "find": 22, "pick": 22, "championship": 22, "agarwal": 22, "country": 22, "knock": 22, "fight": 22, "work": 22, "break": 22, "warner": 21, "require": 21, "stand": 21, "hat": 20, "trick": 20, "cricketer": 20, "trail": 20, "league": 20, "spinner": 20, "want": 19, "order": 19, "moment": 19, "form": 19, "full": 19, "old": 19, "guinea": 18, "part": 18, "become": 18, "help": 17, "level": 17, "reduce": 17, "opening": 17, "leave": 17, "field": 17, "bear": 16, "class": 16, "turn": 16, "claim": 15, "finch": 15, "sweep": 15, "philander": 15, "dean": 15, "strike": 15, "continue": 15, "say": 15, "news": 15, "stream": 15, "add": 14, "breakthrough": 14, "bring": 14, "quinton": 14, "hasan": 14, "perry": 14, "retain": 14, "praise": 13, "lot": 13, "catch": 13, "trophy": 12, "know": 12, "total": 12, "mark": 12, "back": 12, "saw": 12, "holder": 12, "rory": 12, "winner": 11, "talk": 11, "open": 11, "feature": 11, "pat": 11, "brilliant": 11, "format": 11, "resume": 11, "summer": 11, "marsh": 11, "taker": 11, "broad": 11, "place": 10, "restrict": 10, "kapp": 10, "try": 10, "post": 10, "experience": 10, "caption": 10, "guess": 10, "lord": 10, "front": 10, "name": 10, "result": 10, "unbeaten": 10, "begin": 10, "abandon": 10, "josh": 10, "injury": 9, "arm": 9, "rest": 9, "qualify": 9, "power": 9, "first": 9, "week": 9, "effort": 9, "pair": 9, "pant": 9, "group": 9, "position": 9, "history": 9, "read": 9, "legend": 9, "haul": 9, "round": 9, "super": 9, "declare": 9, "winning": 9, "story": 9, "loss": 9, "secure": 9, "slip": 9, "battle": 9, "cross": 9, "jack": 9, "best": 8, "use": 8, "big": 8, "member": 8, "target": 8, "style": 8, "one": 8, "appearance": 8, "conclusion": 8, "scorer": 8, "centurion": 8, "love": 8, "shah": 8, "retire": 8, "dream": 8, "remove": 8, "reach": 8, "spot": 8, "trouble": 8, "raj": 8, "title": 8, "global": 8, "lee": 8, "streak": 8, "colin": 8, "remain": 8, "extend": 8, "leach": 8, "maxwell": 7, "face": 7, "party": 7, "maiden": 7, "morning": 7, "focus": 7, "excite": 7, "spare": 7, "move": 7, "tournament": 7, "opportunity": 7, "former": 7, "gain": 7, "table": 7, "bad": 7, "campaign": 7, "ton": 7, "show": 7, "thriller": 7, "enjoy": 7, "pacer": 7, "keeper": 7, "improve": 7, "two": 7, "development": 7, "hour": 7, "good": 7, "singh": 7, "defeat": 7, "second": 7, "beth": 7, "number": 7, "woman": 7, "approach": 6, "chance": 6, "five": 6, "pressure": 6, "stage": 6, "wow": 6, "feel": 6, "light": 6, "hamza": 6, "advantage": 6, "build": 6, "captaincy": 6, "trap": 6, "right": 6, "bit": 6, "ground": 6, "semi": 6, "dhoni": 6, "prove": 6, "retirement": 6, "stop": 6, "achievement": 6, "champion": 6, "board": 6, "fall": 6, "sune": 6, "white": 6, "plan": 6, "batter": 6, "cut": 6, "scoring": 6, "bounce": 6, "hope": 6, "well": 5, "mean": 5, "felt": 5, "clash": 5, "count": 5, "choose": 5, "vice": 5, "rank": 5, "three": 5, "plenty": 5, "jersey": 5, "life": 5, "wrap": 5, "do": 5, "eye": 5, "rate": 5, "age": 5, "silva": 5, "step": 5, "laura": 5, "may": 5, "hand": 5, "thrill": 5, "highest": 5, "spin": 5, "struggle": 5, "dale": 5, "contest": 5, "hut": 5, "sport": 5, "talent": 5, "halfway": 5, "milestone": 5, "save": 5, "peter": 5, "surat": 5, "memory": 5, "spell": 5, "da": 5, "complete": 5, "fixture": 5, "update": 5, "duck": 5, "happen": 5, "interval": 5, "line": 5, "pull": 5, "roach": 5, "decision": 4, "convert": 4, "breaking": 4, "receive": 4, "quick": 4, "could": 4, "inspiration": 4, "swing": 4, "hong": 4, "body": 4, "sam": 4, "wishing": 4, "something": 4, "travis": 4, "middle": 4, "picture": 4, "fire": 4, "camp": 4, "delivery": 4, "van": 4, "amir": 4, "replace": 4, "martin": 4, "selection": 4, "remember": 4, "medal": 4, "amy": 4, "leadership": 4, "beauty": 4, "stay": 4, "hold": 4, "resistance": 4, "jess": 4, "leg": 4, "amaze": 4, "fan": 4, "lance": 4, "magic": 4, "carry": 4, "anything": 4, "list": 4, "inspire": 4, "season": 4, "superb": 4, "servant": 4, "stadium": 4, "fifth": 4, "dominate": 4, "whilst": 4, "everything": 4, "confirm": 4, "person": 4, "fell": 4, "meet": 4, "repeat": 4, "wash": 4, "delay": 4, "somerset": 4, "hall": 4, "impact": 4, "bow": 4, "event": 4, "towards": 4, "wade": 4, "force": 4, "sarkar": 4, "urn": 4, "shot": 4, "ross": 4, "seamer": 3, "selector": 3, "sort": 3, "close": 3, "warm": 3, "join": 3, "celebrate": 3, "current": 3, "blaze": 3, "walk": 3, "rutherford": 3, "fly": 3, "situation": 3, "alive": 3, "panel": 3, "nothing": 3, "family": 3, "care": 3, "rebuild": 3, "people": 3, "fast": 3, "mike": 3, "enforce": 3, "landmark": 3, "row": 3, "draft": 3, "passion": 3, "staff": 3, "smash": 3, "drive": 3, "canada": 3, "guard": 3, "allan": 3, "track": 3, "past": 3, "fare": 3, "assignment": 3, "visit": 3, "national": 3, "manager": 3, "miss": 3, "competition": 3, "fitness": 3, "medium": 3, "epic": 3, "dad": 3, "challenge": 3, "amla": 3, "job": 3, "dig": 3, "getter": 3, "technique": 3, "luck": 3, "perform": 3, "flow": 3, "mignon": 3, "bid": 3, "recover": 3, "sizzle": 3, "consistency": 3, "survive": 3, "six": 3, "let": 3, "defend": 3, "blast": 3, "month": 3, "shine": 3, "silverwood": 3, "key": 3, "balance": 3, "worry": 3, "appointment": 3, "check": 3, "heather": 3, "graham": 3, "final": 3, "question": 3, "send": 3, "scalp": 3, "duo": 3, "dismiss": 3, "host": 3, "display": 3, "zaman": 3, "decide": 3, "comeback": 3, "partner": 3, "expect": 3, "north": 3, "point": 3, "quality": 3, "pace": 3, "relive": 3, "like": 3, "cook": 3, "wait": 3, "burl": 3, "award": 3, "county": 3, "role": 3, "contract": 3, "combination": 3, "fame": 3, "ask": 3, "push": 3, "call": 3, "example": 3, "responsibility": 3, "shirt": 3, "course": 3, "confidence": 3, "grow": 3, "combine": 3, "kyle": 3, "hopefully": 3, "huge": 3, "draw": 3, "seven": 3, "sir": 3, "jimmy": 3, "hero": 3, "third": 3, "pursuit": 3, "brother": 2, "forward": 2, "lata": 2, "intensity": 2, "switch": 2, "president": 2, "massive": 2, "agar": 2, "withdraw": 2, "replacement": 2, "tye": 2, "holly": 2, "absence": 2, "concern": 2, "bishop": 2, "discuss": 2, "surprise": 2, "spend": 2, "stint": 2, "amelia": 2, "jeff": 2, "represent": 2, "charge": 2, "red": 2, "term": 2, "culture": 2, "abu": 2, "consolidate": 2, "debutant": 2, "hurt": 2, "bouncer": 2, "initiative": 2, "victim": 2, "attack": 2, "respond": 2, "textbook": 2, "gif": 2, "priority": 2, "counterattack": 2, "soil": 2, "cap": 2, "recent": 2, "speak": 2, "double": 2, "grace": 2, "prince": 2, "gun": 2, "academy": 2, "logie": 2, "photo": 2, "anil": 2, "everyone": 2, "control": 2, "suspend": 2, "tick": 2, "jenny": 2, "growth": 2, "agree": 2, "heart": 2, "triple": 2, "future": 2, "welcome": 2, "kit": 2, "shoulder": 2, "international": 2, "premier": 2, "setup": 2, "smile": 2, "profile": 2, "seat": 2, "shield": 2, "master": 2, "thing": 2, "city": 2, "figure": 2, "penultimate": 2, "march": 2, "whitewash": 2, "fill": 2, "smriti": 2, "sink": 2, "black": 2, "dominance": 2, "process": 2, "daily": 2, "settle": 2, "border": 2, "heartbreak": 2, "tony": 2, "cheer": 2, "task": 2, "discipline": 2, "bob": 2, "provide": 2, "incoming": 2, "involve": 2, "legendary": 2, "dismissal": 2, "moor": 2, "chief": 2, "executive": 2, "produce": 2, "aspire": 2, "success": 2, "gate": 2, "answer": 2, "excited": 2, "venue": 2, "tell": 2, "frustrate": 2, "finishing": 2, "collapse": 2, "opposition": 2, "equal": 2, "referee": 2, "realize": 2, "sight": 2, "chosen": 2, "clinch": 2, "drawn": 2, "scare": 2, "wrist": 2, "mood": 2, "shastri": 2, "farewell": 2, "brett": 2, "shape": 2, "surrey": 2, "expectation": 2, "reality": 2, "announce": 2, "persistent": 2, "stress": 2, "plane": 2, "momentum": 2, "feeling": 2, "idea": 2, "august": 2, "anyone": 2, "cause": 2, "thank": 2, "lock": 2, "park": 2, "wish": 2, "interest": 2, "concede": 2, "cooper": 2, "dutch": 2, "encounter": 2, "knight": 2, "night": 2, "mentor": 2, "energy": 2, "wonder": 2, "steven": 2, "weather": 2, "fought": 2, "heap": 2, "oes": 2, "redemption": 2, "latest": 2, "drizzle": 2, "lift": 2, "drill": 2, "reply": 2, "tonight": 2, "lane": 2, "beginning": 2, "pass": 2, "episode": 2, "arena": 2, "review": 2, "failure": 2, "mir": 2, "taken": 2, "management": 2, "change": 2, "morgan": 2, "pollard": 2, "tweet": 2, "tribute": 2, "bench": 2, "dust": 2, "assessment": 2, "karma": 2, "couple": 2, "incredible": 2, "savour": 2, "four": 2, "pad": 2, "upcoming": 2, "consistent": 2, "left": 2, "ethic": 2, "chapter": 2, "drama": 2, "achieve": 2, "feat": 2, "concussion": 2, "substitute": 2, "blackwood": 2, "storm": 2, "belief": 2, "believe": 2, "hop": 1, "roller": 1, "coaster": 1, "wed": 1, "case": 1, "blueprint": 1, "anam": 1, "amin": 1, "ameen": 1, "opt": 1, "thanks": 1, "confirmed": 1, "ramp": 1, "jordan": 1, "mighty": 1, "barras": 1, "sacrifice": 1, "signature": 1, "leap": 1, "neb": 1, "turner": 1, "manage": 1, "emulate": 1, "proof": 1, "enough": 1, "ruthless": 1, "madeline": 1, "penna": 1, "ferling": 1, "elbow": 1, "ken": 1, "doubt": 1, "samson": 1, "schedule": 1, "russel": 1, "hip": 1, "enthral": 1, "strengthen": 1, "touch": 1, "scale": 1, "kick": 1, "getting": 1, "hanif": 1, "union": 1, "dear": 1, "impression": 1, "goal": 1, "brad": 1, "teenage": 1, "done": 1, "crack": 1, "lungi": 1, "brink": 1, "shy": 1, "ule": 1, "lay": 1, "boycott": 1, "reminder": 1, "castle": 1, "wrest": 1, "domination": 1, "rightmost": 1, "cameo": 1, "welsh": 1, "dot": 1, "sun": 1, "bash": 1, "burst": 1, "roll": 1, "phoebe": 1, "overcome": 1, "king": 1, "angler": 1, "seize": 1, "mission": 1, "emerald": 1, "isle": 1, "quarter": 1, "bill": 1, "festival": 1, "led": 1, "band": 1, "cover": 1, "accustom": 1, "patel": 1, "spectacle": 1, "billy": 1, "royal": 1, "interim": 1, "betty": 1, "lewis": 1, "sit": 1, "sweeper": 1, "none": 1, "cool": 1, "trio": 1, "clock": 1, "food": 1, "onus": 1, "hud": 1, "riot": 1, "yeah": 1, "montage": 1, "volume": 1, "dev": 1, "girl": 1, "mantelpiece": 1, "brain": 1, "meant": 1, "structure": 1, "tit": 1, "whatever": 1, "knockout": 1, "enthusiasm": 1, "hearten": 1, "foot": 1, "gas": 1, "promise": 1, "maintain": 1, "piece": 1, "nail": 1, "bite": 1, "metropolis": 1, "rise": 1, "defence": 1, "joshi": 1, "great": 1, "cent": 1, "ten": 1, "matter": 1, "rout": 1, "defense": 1, "variety": 1, "flower": 1, "coaching": 1, "bend": 1, "merchant": 1, "lone": 1, "support": 1, "mirror": 1, "image": 1, "tag": 1, "deb": 1, "travel": 1, "mel": 1, "excellence": 1, "hunt": 1, "hospitality": 1, "reception": 1, "ace": 1, "train": 1, "calf": 1, "rule": 1, "claw": 1, "steady": 1, "journey": 1, "mind": 1, "shut": 1, "depart": 1, "lea": 1, "notch": 1, "waugh": 1, "unstoppable": 1, "department": 1, "highlight": 1, "slide": 1, "avoid": 1, "potato": 1, "farm": 1, "farmer": 1, "toe": 1, "seam": 1, "edition": 1, "disposal": 1, "bother": 1, "regret": 1, "backing": 1, "son": 1, "information": 1, "decider": 1, "ary": 1, "devastate": 1, "morne": 1, "whose": 1, "practice": 1, "eight": 1, "ninth": 1, "grit": 1, "determination": 1, "bay": 1, "stunning": 1, "fade": 1, "tail": 1, "stump": 1, "sniff": 1, "disarray": 1, "nine": 1, "barrier": 1, "high": 1, "problem": 1, "voice": 1, "baa": 1, "prowess": 1, "nig": 1, "grip": 1, "flyer": 1, "nelson": 1, "direct": 1, "basil": 1, "vigil": 1, "company": 1, "resilient": 1, "caught": 1, "counter": 1, "response": 1, "breathe": 1, "select": 1, "command": 1, "struck": 1, "guide": 1, "disturb": 1, "almost": 1, "would": 1, "ray": 1, "dar": 1, "dom": 1, "kexy": 1, "impetus": 1, "bang": 1, "decent": 1, "ability": 1, "moody": 1, "western": 1, "invitational": 1, "exit": 1, "outfit": 1, "fortress": 1, "bank": 1, "replicate": 1, "salma": 1, "contribute": 1, "pool": 1, "bottom": 1, "sew": 1, "dog": 1, "thrash": 1, "intimidate": 1, "fiery": 1, "gear": 1, "mona": 1, "babu": 1, "showcase": 1, "option": 1, "poise": 1, "ave": 1, "effect": 1, "video": 1, "wally": 1, "ura": 1, "breakout": 1, "vote": 1, "ser": 1, "rent": 1, "lifting": 1, "dimension": 1, "excitement": 1, "forty": 1, "blazing": 1, "terrific": 1, "wilt": 1, "brilliance": 1, "thrilling": 1, "lightning": 1, "fierce": 1, "competitor": 1, "laud": 1, "deserve": 1, "spoilsport": 1, "decade": 1, "succeed": 1, "economy": 1, "bade": 1, "spirit": 1, "renowned": 1, "chair": 1, "dress": 1, "singing": 1, "stuff": 1, "successor": 1, "priest": 1, "anna": 1, "island": 1, "boy": 1, "confident": 1, "conquer": 1, "reward": 1, "pope": 1, "recall": 1, "waller": 1, "click": 1, "era": 1, "phiz": 1, "predominantly": 1, "abandoned": 1, "rainfall": 1, "chip": 1, "scun": 1, "fracture": 1, "please": 1, "initial": 1, "gosh": 1, "annoy": 1, "air": 1, "faith": 1, "accord": 1, "tie": 1, "aspiration": 1, "ax": 1, "exciting": 1, "contact": 1, "meeting": 1, "catching": 1, "pay": 1, "equation": 1, "tackle": 1, "physical": 1, "disability": 1, "miller": 1, "fielder": 1, "single": 1, "increase": 1, "topic": 1, "fearless": 1, "generation": 1, "harmer": 1, "beaten": 1, "console": 1, "forehand": 1, "lat": 1, "ambrose": 1, "iron": 1, "chink": 1, "out": 1, "fashion": 1, "crown": 1, "blister": 1, "rod": 1, "din": 1, "spread": 1, "lost": 1, "overnight": 1, "cast": 1, "china": 1, "admire": 1, "system": 1, "ba": 1, "complicated": 1, "analysis": 1, "hesitation": 1, "peach": 1, "fizz": 1, "undefeated": 1, "recipient": 1, "rapid": 1, "book": 1, "dowd": 1, "laker": 1, "chahar": 1, "harry": 1, "remodel": 1, "pringle": 1, "childhood": 1, "idol": 1, "act": 1, "road": 1, "cruise": 1, "ket": 1, "finalist": 1, "nation": 1, "someone": 1, "mig": 1, "demolish": 1, "vain": 1, "absolute": 1, "carnage": 1, "mammoth": 1, "elect": 1, "anchor": 1, "gaw": 1, "brisk": 1, "hang": 1, "roulette": 1, "snap": 1, "steal": 1, "everybody": 1, "wear": 1, "trip": 1, "glory": 1, "dive": 1, "square": 1, "tidy": 1, "stroke": 1, "seventh": 1, "fern": 1, "elite": 1, "calk": 1, "mutual": 1, "admiration": 1, "society": 1, "flu": 1, "gore": 1, "robin": 1, "thow": 1, "fud": 1, "absorb": 1, "brutal": 1, "sil": 1, "blow": 1, "machine": 1, "dose": 1, "motivation": 1, "ahead": 1, "edge": 1, "originally": 1, "cling": 1, "gallery": 1, "grill": 1, "autograph": 1, "accolade": 1, "surpass": 1, "stretcher": 1, "showing": 1, "hate": 1, "respect": 1, "fact": 1, "bent": 1, "reprieve": 1, "regain": 1, "strong": 1, "every": 1, "gill": 1, "sorry": 1, "gaz": 1, "bracken": 1, "fortunate": 1, "comfortable": 1, "include": 1, "outing": 1, "sense": 1, "buy": 1, "business": 1, "attempt": 1, "legacy": 1, "kim": 1, "garth": 1, "progress": 1, "fault": 1, "fine": 1, "clark": 1, "regular": 1, "split": 1, "finger": 1, "singer": 1, "pain": 1, "bond": 1, "maw": 1, "thwart": 1, "clean": 1, "earn": 1, "mile": 1, "register": 1, "watching": 1, "fillip": 1, "ride": 1, "genius": 1, "outfield": 1, "vision": 1, "strength": 1, "kind": 1, "cost": 1, "assess": 1, "wake": 1, "amount": 1, "bucket": 1, "scrap": 1, "destination": 1, "pitching": 1, "outside": 1, "umpire": 1, "stead": 1, "weave": 1, "definition": 1, "perpetuate": 1, "transmigration": 1, "determine": 1, "nature": 1, "existence": 1, "odds": 1, "unlock": 1, "obtain": 1, "status": 1, "blade": 1, "account": 1, "ongoing": 1, "bailey": 1, "icon": 1, "beloved": 1, "even": 1, "deliver": 1, "peace": 1, "got": 1, "note": 1, "jet": 1, "finally": 1, "carter": 1, "relentless": 1, "pump": 1, "mar": 1, "nick": 1, "tactic": 1, "short": 1, "maker": 1, "youngster": 1, "inside": 1, "trailing": 1, "wot": 1, "minute": 1, "simply": 1, "training": 1, "ship": 1, "bannerman": 1, "dempster": 1, "excuse": 1, "swinger": 1, "slow": 1, "bird": 1, "superman": 1, "attitude": 1, "quote": 1, "glad": 1, "brand": 1, "hell": 1, "sleepless": 1, "spoken": 1, "ultimate": 1, "biter": 1, "gaun": 1, "forget": 1, "ill": 1, "veteran": 1, "pip": 1, "mould": 1, "hey": 1, "ring": 1, "prepare": 1, "relationship": 1, "glass": 1, "bravo": 1, "enterprising": 1, "scintillate": 1, "beach": 1, "pau": 1, "courtesy": 1, "invention": 1, "present": 1, "headband": 1, "golden": 1, "continental": 1, "republic": 1, "turkey": 1, "succession": 1, "millionth": 1, "surge": 1, "thumb": 1, "jap": 1, "fit": 1, "pioneer": 1, "nil": 1, "firstly": 1, "amazing": 1, "house": 1, "grind": 1, "grab": 1, "willie": 1, "clive": 1, "sabina": 1, "advice": 1, "contain": 1, "armer": 1, "safe": 1, "mandate": 1, "mock": 1, "obituary": 1, "sporting": 1, "fear": 1, "dash": 1, "restore": 1, "long": 1, "astonishing": 1, "create": 1, "environment": 1, "clint": 1, "search": 1, "swift": 1, "blood": 1, "tay": 1, "gorgeous": 1, "shake": 1, "page": 1, "fold": 1, "depend": 1, "told": 1, "youth": 1, "abbas": 1, "arise": 1, "certainly": 1, "female": 1, "anti": 1, "corruption": 1, "tribunal": 1, "hearing": 1, "classic": 1, "emotion": 1, "pry": 1, "convincing": 1, "kiss": 1, "peck": 1, "cheek": 1, "somehow": 1, "transition": 1, "phase": 1, "cod": 1, "preach": 1, "press": 1, "patience": 1, "rattle": 1, "room": 1, "resumption": 1, "learn": 1, "weigh": 1, "debate": 1, "surround": 1, "together": 1, "nip": 1, "carve": 1, "performer": 1, "axe": 1, "slew": 1, "pavilion": 1, "came": 1, "describe": 1, "butcher": 1, "creep": 1, "pup": 1, "predict": 1, "sum": 1, "reft": 1, "camera": 1, "away": 1, "pitch": 1, "else": 1, "guy": 1, "stopping": 1, "ankle": 1, "ree": 1, "clear": 1, "throwback": 1, "grey": 1, "sky": 1, "recognition": 1, "bridge": 1, "preparation": 1, "tenth": 1, "jay": 1, "buzz": 1, "installment": 1, "football": 1, "nat": 1, "invent": 1, "frighten": 1, "purpose": 1, "gracefully": 1, "asset": 1, "hug": 1, "celebration": 1}, "tweets": "#OnThisDay in 2000, Sri Lanka recorded their biggest ODI victory (by runs), in the Sharjah Champions Trophy final.\n\nA Chaminda Vaas-led attack bowled India out for 54 to set up a 245-run win. https://t.co/H53x8qpTfW Happy birthday, Greg Blewett \ud83c\udf89 \ud83c\udf89 \n\nThe former Australia batsman loved playing against England \u2013 three of his four Test centuries came in Ashes contests! https://t.co/faTfykRuo2 Two-time @cricketworldcup winner \ud83c\udfc6 \nTest-best of 380 \ud83d\udc4f \ud83d\udc4f \n40 international tons \ud83d\udcaf \n\nHappy birthday, Matthew Hayden! https://t.co/dv79XbWLBb The rapid Lockie Ferguson made his return from injury on Sunday, taking 3/32 against the England XI \ud83d\ude80 \n\nWho else is looking forward to watching him play in the T20I series? https://t.co/8KUdHVX6Yu Bismah Maroof hit a 50-ball 70* to help Pakistan win their second T20I against Bangladesh. \n\nhttps://t.co/Snil97JCHc Glenn Maxwell doing Glenn Maxwell things \ud83c\udfcf \ud83d\ude2e https://t.co/GY6D17a0tu Papua New Guinea hopped on an emotional roller coaster on Sunday \u2013 and it ended with them sealing a place at next year's @T20WorldCup!\n\n#T20WorldCup https://t.co/xWDXPfR0tN Australia will be without the services of their left-arm seamer, who will be attending his brother's wedding.\n\nhttps://t.co/yIdny3uzpf \ud83d\udcac \"With the T20s in New Zealand, it wasn\u2019t a case of, 'What do you think about resting?' It was, 'You\u2019re rested.'\"\n\nEngland chief selector Ed Smith undertakes a new approach ahead of the #NZvENG T20I series \ud83d\udc47\n\nhttps://t.co/Kzf0wcClpu \ud83d\udcac \"We didn't know what sort of wicket it would be. We didn't want to take a chance.\"\n\nSri Lanka batsman Bhanuka Rajapaksa defends Lasith Malinga's decision to bowl first in Adelaide \u2b07\ufe0f\n\nhttps://t.co/5CNCjA5Z8A \ud83d\udde3\ufe0f \"We ought to be positive with the bat. I think the way forward is exactly that.\"\n\nDavid Warner wants Australia to use the Adelaide win as a blueprint on how to approach T20I cricket \ud83d\udc47\n\nhttps://t.co/USPa4IrmM0 Results from day four of the 2019 Emerging Teams Asia Cup:\n\n1\ufe0f\u20e3 India beat Pakistan by seven wickets \n2\ufe0f\u20e3 Sri Lanka beat Bangladesh by four wickets\n\nIndia and Sri Lanka will face off in the tournament final on Tuesday \ud83c\udfc6 https://t.co/YxDK6ExrFJ PAKISTAN WIN BY 15 RUNS!\n\nThe hosts have taken the three-match series 2-0 \ud83c\udfc6\n\nPakistan now have 13 victories in 14 women's T20Is against Bangladesh \ud83d\ude4c https://t.co/jyl6hEv6Ai A solid partnership between Fargana Hoque and Lata Mondal here \u2013 they have added 32 runs for the seventh wicket.\n\nBangladesh are 125/6 after 17 overs, and require 43 runs in 18 balls. \n\n#PAKvBAN https://t.co/Wh09NDFd4c OUT!\n\nBig wicket for Pakistan and for Sadia Iqbal, as Sanjida Islam is dismissed for a well-made 45. \n\nBangladesh are 84/4 after 12 overs.\n\n#PAKvBAN https://t.co/R346AdkRIG Five overs into the chase, Bangladesh are 25/2. Anam Amin and Diana Baig have taken two quick wickets for the hosts. \n\nRumana Ahmed has joined opener Sanjida Islam in the middle.\n\n#PAKvBAN https://t.co/2HP13Ooxd1 Pakistan finish on 167/3 as skipper Bismah Maroof top-scores with an unbeaten 70. This is her career-best score in T20I cricket \ud83d\ude4c\n\nCan \ud83c\udde7\ud83c\udde9 chase it down or will \ud83c\uddf5\ud83c\uddf0 seal the series with a win today?\n\n#PAKvBAN https://t.co/CUHjTtxlme And the Pakistan skipper has joined the party! \n\nBismah Maroof brings up her tenth T20I half-century with a six \ud83d\udc4f\n\nThe hosts are 143/2 with two overs to go. https://t.co/PpQh7ineiM 5\ufe0f\u20e30\ufe0f\u20e3*\n\nJaveria Khan scores her sixth T20I half-century in 39 balls \u2013 can she convert it into her maiden \ud83d\udcaf in the format?\n\n#PAKvBAN https://t.co/J3js7pjw1E WICKET!\n\nLata Mondal strikes for Bangladesh as Sidra Ameen is dismissed for 19.\n\nSkipper Bismah Maroof joins Javeria Khan at the crease.\n\n#PAKvBAN https://t.co/1xX3DQ2NGU Bangladesh opt to bowl in the second women's T20I against Pakistan in Lahore.\n\nCan the visitors level the three-match series or will Pakistan claim an unassailable 2-0 lead today?\n\n#PAKvBAN https://t.co/I7NnpiOXpU What are they talking about? \ud83e\udd14 https://t.co/15xt8np3Mg David Warner and Aaron Finch in #AUSvSL yesterday:\n\n\ud83d\udc49 164 runs\n\ud83d\udc49 18 fours\n\ud83d\udc49 7 sixes\n\ud83d\udc49 122-run opening stand \ud83d\udca5 https://t.co/5S4mbMTSK5 ICYMI \ud83d\udc47  https://t.co/I0TedDSLWT #OnThisDay in 1986, Abdul Qadir ripped through the West Indies middle order in the first Test in Faisalabad.\n\nWindies closed the day on 43/9 before being finished off for 53 the following morning.\n\nPakistan won by 186 runs and Qadir finished with 6/16 \ud83d\udc4f https://t.co/oaDjgxpRU5 ICYMI: Praise has come from all over the world for Papua New Guinea, who have qualified for the @T20WorldCup \ud83c\udf89  https://t.co/Jv8WAsAkMX England won the first warm-up game of their tour of New Zealand thanks to 78* from Jonny Bairstow. https://t.co/4FuL2ePGIC RT @T20WorldCup: CONFIRMED: Ireland will join PNG in Australia for the #T20WorldCup! https://t.co/665dhLspGF \ud83d\udcac \"I was an over away last time. Obviously it was meant to be. But when the time comes next year and that intensity starts to ramp up, I'm sure I'll be fully switched on.\"\n\nChris Jordan has set his sights on next year's @T20WorldCup \ud83d\udc40  https://t.co/DweVLkYGeA Papua New Guinea have qualified for the @T20WorldCup!\n\nSome of the game's greats have heaped praise on them \ud83d\udc47  https://t.co/Jv8WAsAkMX Warner's first T20I hundred led Australia to a record-breaking win over Sri Lanka.\n\n#AUSvSL | MATCH REPORT \ud83d\udc47 \n\nhttps://t.co/60NGpxEMqw RT @T20WorldCup: The moment PNG qualified for the #T20WorldCup!\n\nLook how much it means to them! https://t.co/F2PM64vAcn \ud83c\uddf5\ud83c\uddec\u2708\ufe0f\ud83c\udde6\ud83c\uddfa @Cricket_PNG are off to the #T20WorldCup Australia!\n\nCongratulations to the Mighty Barras! \ud83d\udcaa https://t.co/Hda6evHHPp \"I felt that if I can sacrifice the gloves, I can give my best for a long time.\" \n\n\ud83c\udde7\ud83c\udde9's Mushfiqur Rahim wants to focus on his batting in Tests.\n\nhttps://t.co/I0TedDSLWT David Warner celebrated his maiden T20I hundred with his signature leap \ud83d\ude4c \n\nHis 56-ball 100* featured 10 fours and four sixes \ud83d\udd25 \n\n#AUSvSL https://t.co/PHUvkZLPcr West Indies have named two uncapped players in their 14-member squad for the upcoming women's ODIs against India.\n\nDETAILS \ud83d\udc47\nhttps://t.co/VBXVpBvkxb \u2705 ICC Player of the Year in 2012\n\u2705 Player of the Match in the 2014 @T20WorldCup final\n\u2705 Current President of the MCC\n\nWe could go on and on.\n\n\ud83c\udf82 Happy birthday @KumarSanga2! https://t.co/xyjfTjEnRG The Emerging Teams Asia Cup is on! Here's how the teams fared in yesterday's games \ud83d\udc47\n\n\ud83d\udd38 India cruised to a comprehensive 32-run win over Sri Lanka.\n\ud83d\udd38 Murshida Khatun's fifty helped Bangladesh seal a 65-run win over Pakistan. https://t.co/PuUVqFoVOx For his blazing 56-ball 100*, David Warner is adjudged Player of the Match \ud83d\udc4f\n\n#AUSvSL https://t.co/CJX2JlHbRq Australia record their biggest T20I win (by runs) in Adelaide!\n\nThey restrict Sri Lanka to 99/9 to set up a massive 134-run victory in the first #AUSvSL clash.\n\n\ud83d\udcdd SCORECARD: https://t.co/C0puszBAjz https://t.co/0GbBjT3nEB RT @T20WorldCup: It's a MASSIVE day of action in the #T20WorldCup Qualifier! \n\n\ud83d\udd38 5 matches \n\ud83d\udd38 6 T20 World Cup spots up for grabs\n\ud83d\udd38 Top team\u2026 \u261d\ufe0f Danushka Gunathilaka\n\u261d\ufe0f Bhanuka Rajapaksa\n\nPat Cummins takes two in two to reduce Sri Lanka to 14/3 in four overs. The visitors need 220 runs more to win. \n\nFollow #AUSvSL live \ud83d\udc47\nhttps://t.co/C0puszBAjz https://t.co/uoXSqBaTPk A brilliant 100* from David Warner and quick fifties from Aaron Finch and Glenn Maxwell power Australia to 233/2 \u2013 their highest T20I total at home. \n\nCan Sri Lanka chase down the target?\n\nFollow #AUSvSL live \ud83d\udc47\nhttps://t.co/C0puszBAjz https://t.co/uoazb6d3vq David Warner doubles his birthday celebrations with a maiden T20I \ud83d\udcaf\n\nHe brings up his century on the last ball of the innings!\n\n#AUSvSL https://t.co/3vgklhKb0t Fifty up for Glenn Maxwell! \n\nThe Australia batsman brings up his seventh T20I fifty off just 22 balls \ud83d\udd25\n\nFollow #AUSvSL live \ud83d\udc47\nhttps://t.co/C0puszBAjz https://t.co/hcDQTuqj9Z First breakthrough for Sri Lanka! \n\nLakshan Sandakan breaks the opening stand, sends back Aaron Finch for 64.\n\nGlenn Maxwell is the new man in.\n\nFollow #AUSvSL live \ud83d\udc47\nhttps://t.co/C0puszBAjz https://t.co/iRXCY3MPlV David Warner joins the party!\n\nHe brings up his half-century in style with a six \u2013 his 14th fifty in T20Is.\n\nFollow the action live \ud83d\udc47\nhttps://t.co/C0puszBAjz https://t.co/MwQUNF9hYq Aaron Finch is on \ud83d\udd25\n\nHe brings up his 10th T20I fifty off just 31 balls, in the first #AUSvSL T20I in Adelaide. \n\nFollow the action live \ud83d\udc47\nhttps://t.co/C0puszBAjz https://t.co/JgOsMud5JP Skipper Aaron Finch and David Warner have started well for Australia in Adelaide.\n\nThe hosts are 52/0 after five overs.\n\nFollow #AUSvSL live \ud83d\udc47\nhttps://t.co/C0puszBAjz https://t.co/p3koIj6GUv RT @ICCLive: 1st T20I. Sri Lanka XI: D Gunathilaka, BKG Mendis, B Rajapaksa, MDKJ Perera, O Fernando, D Shanaka, W Hasaranga, L Sandakan, L\u2026 RT @ICCLive: 1st T20I. Australia XI: A Finch, D Warner, S Smith, G Maxwell, A Turner, A Carey, A Agar, P Cummins, M Starc, K Richardson, A\u2026 Sri Lanka have opted to bowl in the first #AUSvSL T20I in Adelaide! https://t.co/Vs1ULQBci9 Watch all the highlights from yesterday's exciting ICC Men's @T20WorldCup games \ud83d\udc47\n\n#IREvNGR \u25b6\ufe0f https://t.co/NpgFK9Y0Cm\n#BERvNED \u25b6\ufe0f https://t.co/Mzyo9KiiW1\n#NAMvSIN \u25b6\ufe0f https://t.co/x4Oteyijck https://t.co/A9iQVLTDSj 6\ufe0f\u20e34\ufe0f\u20e35\ufe0f\u20e38\ufe0f\u20e3 Test runs\n4\ufe0f\u20e39\ufe0f\u20e39\ufe0f\u20e30\ufe0f\u20e3 ODI runs\n1\ufe0f\u20e37\ufe0f\u20e39\ufe0f\u20e32\ufe0f\u20e3 T20I runs\nand counting!\n\nHappy birthday @davidwarner31 \ud83c\udf82 https://t.co/zfTQC58XhR Happy birthday to one of Australia's finest Test captains, Mark Taylor! https://t.co/JlTIbersRM Sydney Sixers' Marizanne Kapp claimed a hat-trick in the @WBBL yesterday!\n\nWhat's the best hat-trick you've seen? https://t.co/gmIBISVe9h ICYMI: England will be touring Sri Lanka early next year \ud83d\udc47  https://t.co/PWI1NeUNFM ICYMI:\n\ud83d\udcac \"I look at current captains like Kane Williamson and Virat Kohli, and how well they manage their own form along with bringing results to the team. I'll try to emulate them.\" https://t.co/467l51rDuR Proof that superheroes are real! \ud83e\uddb8 https://t.co/bIpMmc1TtR The first #AUSvSL T20I begins tomorrow, but who's best placed to claim victory?\n\nMATCH PREVIEW \ud83d\udc47  https://t.co/lOKciRODex Tamim Iqbal has withdrawn himself from Bangladesh's tour of India due to personal reasons. https://t.co/3iL6z1QDJ5 England's new faces are getting ready for the #NZvENG T20I series \ud83d\ude03\n\nWho do you want to see receive their maiden England \ud83e\udde2 next week? https://t.co/0hXVdzGgN9 \ud83c\uddf5\ud83c\uddf0 win by 14 runs!\n\nRumana Ahmed's 50 wasn't enough for \ud83c\udde7\ud83c\udde9 \n\n#PAKvBAN https://t.co/MDoQ4hG89c ICYMI: Sean Abbott has been called in as a replacement for injured Andrew Tye for the #AUSvSL T20I series.\n\nhttps://t.co/tHq2a9G3BV Bangladesh have restricted Pakistan to 126/7 in the first T20I!\n\nJahanara Alam was the star, finishing with 4/17.\n\nCan the Tigers chase this down?\n\n#PAKvBAN https://t.co/k0qcElVqdL RT @T20WorldCup: Ireland win! \n\nRuthless performance from them. They won by eight wickets and with 83 balls to spare \u2013 it's the fifth-quick\u2026 The first #PAKvBAN women's T20I is under way! \n\nThe hosts have lost two early wickets but skipper Bismah Maroof and Omaima Sohail are rebuilding the innings.\n\nFollow the action live \ud83d\udc47\n\n\ud83d\udcfd\ufe0f WATCH: https://t.co/WHUZLLq9VY https://t.co/C4ptDrHdzJ All smiles ahead of an exciting #AUSvSL T20I series! \n\nWho do you think will take the \ud83c\udfc6 home? https://t.co/DrlzSWp6HG \"Any time you walk out and play for Australia it\u2019s a great honour and to be back playing here in Australia, I\u2019m excited.\"\n\nhttps://t.co/uMTVeKVkBu \u261d\ufe0f Madeline Penna\n\u261d\ufe0f Nicola Hancock\n\u261d\ufe0f Holly Ferling\n\nMarizanne Kapp took a hat-trick for Sydney Sixers in their #WBBL clash against Melbourne Stars.\n\nCould this be a preview of what is to come at next year's ICC Women's @T20WorldCup that happens in the same conditions? \ud83d\udc40 https://t.co/VRDOqrN3oq \"I give 120% for the team in every single match, and I don't see why there would be any added pressure on me just because I'm the captain.\"\n\nPakistan's newly appointed T20I captain Babar Azam seeks inspiration from modern-day greats.\n\nhttps://t.co/467l51rDuR Australia fast bowler Andrew Tye has been ruled out of the #AUSvSL T20I series due to elbow injury.\n\nAaron Finch has been cleared to play in the first T20I.\n\nFind out more \ud83d\udc47\nhttps://t.co/tHq2a9G3BV ICYMI: Afghanistan have made massive changes to their limited-overs squads for their upcoming series against West Indies.\n\nFind out more \ud83d\udc47\n\nhttps://t.co/EZTTPUddL6 #OnThisDay in 1952, Pakistan completed their maiden Test victory, in just their second ever Test match!\n\nFazal and Nazar Mahmood were the stars, taking 12/94 and scoring 124* respectively, as their side surged to victory over India by an innings and 43 runs. https://t.co/dwdCQDrbQQ His Test career started badly, with just 12 runs coming in his first seven innings, but he went onto play 177 times for New Zealand and made five international centuries.\n\nHappy birthday, Ken Rutherford! https://t.co/lWxiISP3Yk ICYMI \ud83d\udc47\nhttps://t.co/LS01jw4x0o Changes to ODI squad: 7\ufe0f\u20e3\nChanges to T20I squad: 5\ufe0f\u20e3\n\n#AFGvWI\n\nhttps://t.co/EZTTPUddL6 Abhimanyu Mithun's got a hat-trick on his birthday!\n\nA special effort on a special day for the 30-year-old, whose three wickets in three balls helped Karnataka claim the 2019 Vijay Hazare Trophy! https://t.co/XuQm3tQdzq 29,606 runs and 61 centuries for India between this pair \ud83d\ude4c\n\nIf you could only pick one, who would you choose? \ud83e\udd14 https://t.co/5ZlRnaMzec Pakistan and Bangladesh's three-match T20I series starts tomorrow. Who are you backing?\n\nHere's what the teams are playing for \u2b07\ufe0f https://t.co/hvGDaSz3OK \"The two guys who are vice-captains, Alex Carey and Pat Cummins, both are well-placed to lead.\"\n\nAaron Finch might be in doubt for the T20I against Sri Lanka on Sunday, but he says his potential absence will not be a concern for Australia \ud83d\udc47\n\nhttps://t.co/PBmAKPtxpb @graynics @sambillings \ud83d\udd25 RT @T20WorldCup: PNG are flying high. \n\nThey've beaten Singapore by 43 runs and are now in with a real chance of qualifying for the #T20Wor\u2026 \"I made it very clear post-World Cup that we are moving on and giving opportunities to youngsters.\"\n\nMSK Prasad explains the selections of Rishabh Pant and Sanju Samson for the #INDvBAN T20Is \ud83d\udc47\n\nhttps://t.co/tgRRdTG1n4 Both groups are extremely close going into the last 12 games of the #T20WorldCup Qualifier group stage \ud83d\ude35\n\nHere's why the next seven days are vital for all sides \ud83d\udc47\n\nhttps://t.co/i3c5I8EVgO We are 3\ufe0f\u20e30\ufe0f\u20e3 games into the #T20WorldCup Qualifier!\n\nIan Bishop and Preston Mommsen discuss the surprise performers in the tournament so far \ud83d\udc47 https://t.co/KvZX51u3Al 1st Test: \ud83c\udfdf\ufe0f Galle \u279e 6\ufe0f\u20e30\ufe0f\u20e3 #WTC21 points\n2nd Test: \ud83c\udfdf\ufe0f Colombo \u279e 6\ufe0f\u20e30\ufe0f\u20e3 #WTC21 points\n\n#SLvENG tour schedule here \ud83d\udc47\n\nhttps://t.co/PWI1NeUNFM \ud83d\udc55 \u279c 224 international appearances \n\ud83c\udfcf \u279c 5771 runs\n\u261d\ufe0f \u279c 51 wickets\n\ud83d\udcaf \u279c Four centuries\n\nHis 123 and 56* against Pakistan in Lahore took Sri Lanka to the final of the 1999 Asian Test Championship \ud83d\udc4f\n\nHappy birthday, Russel Arnold! https://t.co/GGhHppU6Jl Details \u2b07\ufe0f\n\nhttps://t.co/LS01jw4x0o Kane Williamson has been ruled out of the five-match T20I series against England with a hip injury \ud83e\udd15 https://t.co/AYi8Vkpp0P \ud83d\udc9b https://t.co/3vP9OldYR5 1\ufe0f\u20e32\ufe0f\u20e35\ufe0f\u20e3 international appearances  \ud83c\uddee\ud83c\uddf3 \n2\ufe0f\u20e34\ufe0f\u20e35\ufe0f\u20e3 wickets \u261d\ufe0f \n\nHappy birthday, Umesh Yadav  \ud83c\udf89 \ud83c\udf89 https://t.co/kL1794KQPF This has surely gone for four! Just have a look at that bat swing  \ud83d\udc4f \ud83d\udc4f https://t.co/Q1dJ3rC01P Thursday saw another enthralling day of action at the @T20WorldCup Qualifier, where there were wins for Hong Kong, Papua New Guinea, UAE and Scotland.\n\n#T20WorldCup https://t.co/XGEyGlIipI \ud83e\udd33 \ud83d\udc4d https://t.co/SaNkaGrV6G \"He now will also have the opportunity to spend more time strengthening his body and his situation will be reviewed by the medical team again in the upcoming weeks for further updates.\u201d\n\nhttps://t.co/IUtWvwQ28e Virat Kohli has been rested from the three-match T20I series against Bangladesh.\n\nhttps://t.co/ksb79ntBWI England have touched down in New Zealand!\n\nOn a scale of 0 to Sam Billings, how excited are you for their five-match T20I series?\n\n#NZvENG https://t.co/h0rUzGLF0J In his last international appearance, Lockie Ferguson picked up three wickets against England in the #CWC19 final.\n\nHe will now take on the World Champions in two warm-up games ahead of the #NZvENG T20I series \ud83d\udc47\n\nhttps://t.co/9muFUCZX9u Marcus Stoinis scored a 44-ball 45 and picked up three wickets in Western Australia's win over Victoria yesterday. He was adjudged Player of the Match \ud83d\udc3b\n\nWhat a performance from Australia's top-ranked player in the @MRFWorldwide ODI Rankings for all-rounders \ud83d\udc4f https://t.co/5FzhxNHWBk Wow \ud83d\ude2e\n\nPNG have put themselves in pole position in Group A, ending Netherlands' unbeaten run.\n\nThe @T20WorldCup Qualifier is heading for a thrilling conclusion! https://t.co/52pLkY2siu \u2b50 Nepal's highest run-scorer in international cricket\n\u2b50 Nepal's first and only centurion in T20I cricket\n\u2b50 Nepal's first and only centurion in ODI cricket\n\nHappy birthday to the trailblazing Paras Khadka! https://t.co/MXsyk6dGWA \ud83e\udde2 35 Tests\n\ud83c\udfcf 1209 runs\n\ud83d\udcaf Three centuries\n\u270a 86 catches\n\ud83e\udde4 11 stumpings\n\nHe was a part of all three Tests in India's recent sweep over South Africa!\n\nWishing Wriddhiman Saha a very happy 35th birthday \ud83c\udf70 https://t.co/KUD7IDEc9Q RT @T20WorldCup: 50 for Sesan Adedeji!\n\nHe becomes the first Nigerian man to score a T20I half-century \ud83d\ude4c \n\n#T20WorldCup | #UAEvNGR | FOLLOW\u2026 The switch-hit is very much alive and kicking \ud83c\udfcf\ud83d\udd01\n\nWhat do you think, @KP24? \ud83d\ude04 https://t.co/3oFrnIlsVn \ud83d\udc55 127 international appearances\n\u261d\ufe0f 161 Test wickets at 24.27\n\u261d\ufe0f 118 ODI wickets at 26.50\n\nHe was an integral part of our commentary panel for #CWC19 \ud83c\udf99\ufe0f\n\nHappy birthday, Ian Bishop! \ud83c\udf82 https://t.co/k5WgRZvk3E \ud83d\udcac \"Getting to play in the conditions where the T20 World Cup will be, there\u2019s nothing better than that.\"\n\nCan her maiden stint at the #WBBL05 help Amelia Kerr ahead of the 2020 #T20WorldCup?\n\nhttps://t.co/b3Vbwe55b9 #OnThisDay in 1969, Hanif and Sadiq Mohammad became only the second pair of brothers to open the batting in Test cricket \ud83d\udc65\ud83c\udfcf\n\n#OnThisDay in 1976, Sadiq and Mushtaq Mohammad became only the second pair of brothers to score centuries in the same Test innings \ud83d\udc65\ud83d\udcaf\n\nWhat a family \ud83e\udd2f https://t.co/Ze18KpaDnV ICYMI \ud83d\udc47  https://t.co/6Eu6E3AAdw ICYMI \ud83d\udc40  https://t.co/aLAoMFpU1l Happy birthday to Jeff Wilson \ud83c\udf82 \n\nHe is the most recent player to represent New Zealand in both cricket and rugby union \ud83d\udc4f https://t.co/mKNkcFx9MB Agarwal 2\ufe0f\u20e31\ufe0f\u20e35\ufe0f\u20e3 \nKohli 2\ufe0f\u20e35\ufe0f\u20e34\ufe0f\u20e3*\nRohit 2\ufe0f\u20e31\ufe0f\u20e32\ufe0f\u20e3 \n\nOnly the second time ever that three players from one team have scored a double hundred in a series \u270c\ufe0f https://t.co/XVc5Cgv3B2 ICYMI \ud83d\udc47  https://t.co/Yl8jFtvafu Lauren Agenbag has made history \ud83d\udc4f \n\nREAD MORE \ud83d\udc47  https://t.co/3f2gvkD2pF Oh dear \ud83d\ude48\n\nWho's just been wided here? \ud83d\udc47 https://t.co/w9nwEbH5dI When Adam Zampa arrived at the crease South Australia needed 49 from 27 balls.\n\nHe left unbeaten on 35 from 14 to see his side home with two balls to spare \ud83d\udc4f https://t.co/0psyPF3rP0 \ud83d\udc4f\ud83d\udc4f\ud83d\udc4f https://t.co/048he7NzVY Rohit Sharma, who top-scored in the #INDvSA Test series, has left an impression on skipper Virat Kohli. https://t.co/kujWPw2czq \"It's certainly a big goal for me, and I don\u2019t care what format it is, I just love playing for Australia.\"\n\nhttps://t.co/aLAoMFpU1l Former India captain Sourav Ganguly becomes the first cricketer in 65 years to take charge as full-time BCCI president.\n\nFind out more \ud83d\udc47\n\nhttps://t.co/Yl8jFtvafu Vernon Philander swaps places with Ravichandran Ashwin to move into the \ud83d\udd1d five in the latest @MRFWorldwide ICC Test Player Rankings for all-rounders.\n\nFull rankings: https://t.co/x3zvUhSWg0 https://t.co/d9pfZX1MOv \u2197\ufe0f Rohit Sharma storms into the top 10\n\u2197\ufe0f Ajinkya Rahane surges to No.5\n\nAfter sweeping the #INDvSA series, India batsmen make significant gains in the latest @MRFWorldwide ICC Test Player Rankings for batting.\n\nFull rankings: https://t.co/x3zvUhSWg0 https://t.co/s82fYixQFw What do you think they're discussing? \ud83d\ude00 https://t.co/pN2XIZmf0F #OnThisDay in 1989, West Indies legend Viv Richards returned his career-best bowling figures of 6/41, after scoring a 42-ball 44, in a World Series match against India in Delhi.\n\nWest Indies won that game by 20 runs. https://t.co/vhyE9gOSSI Red-ball cricket might be England Test skipper Joe Root's main focus, but he is not giving up on his T20I ambitions.\n\nFind out more \ud83d\udc47\n\nhttps://t.co/6Eu6E3AAdw \"We have a lot of experience out of the Test team. Right now it's about finding personalities.\" \n\n\ud83c\uddff\ud83c\udde6 captain Faf du Plessis is focussed on identifying potential long-term individuals to rebuild his team. \n\nhttps://t.co/80U3yEJLku \ud83d\udeeb England have arrived in New Zealand \ud83d\udeec\n\nHow excited are you for the #NZvENG series? https://t.co/GoQrxw0VDe \"It\u2019s something to be happy about for us, that we\u2019ve created a culture where people don\u2019t think about themselves and put the team first.\"\n\nhttps://t.co/tNAWnjrbPv 6\ufe0f\u20e36\ufe0f\u20e3 Tests\n1\ufe0f\u20e32\ufe0f\u20e36\ufe0f\u20e3 ODIs\n3\ufe0f\u20e34\ufe0f\u20e3 T20Is\nPlenty of runs and some unforgettable catches, too! \n\nHappy birthday, Brad Haddin  \ud83c\udf89 \ud83c\udf89 https://t.co/gnJEGZaEUa ICYMI \u2b07\ufe0f \nhttps://t.co/uAIjNyV7lI 3\ufe0f\u20e34\ufe0f\u20e30\ufe0f\u20e3 runs \naverage:  8\ufe0f\u20e35\ufe0f\u20e3 \n\nMayank Agarwal was incredibly impressive in his first home Test series \ud83c\udfc6 \n\n#INDvSA https://t.co/FnaTqVxfkJ Pakistan have three teenage seamers in their Test squad for the upcoming tour of Australia: Shaheen Afridi, Musa Khan and Naseem Shah  \ud83d\ude2e \n\nWhich other young fast bowlers should people be looking out for over the next few years? https://t.co/TR0m2Ys7x7 Jersey, Namibia and Netherlands all recorded wins at the @T20WorldCup Qualifier today  \ud83d\udc4f \ud83d\udc4f \n\nUAE collapsed from 60/0 to 112 all out against Jersey \u2013 a phenomenal bowling performance!\n\n#UAEvJSY SCORECARD \u27a1\ufe0f https://t.co/tKDNJkMyIj https://t.co/pReHSzDKWF Happy birthday to former England fast bowler Mike Hendrick!\n\nHendrick took 122 wickets for his country between 1973 and 1981 and famously collected figures of 4/15 against Pakistan at the 1979 @cricketworldcup \ud83c\udfc6 https://t.co/VyP0FjtQU7 RT @T20WorldCup: JERSEY HAVE DONE IT!\n\nA sensational victory over the hosts in Abu Dhabi.\n\n#T20WorldCup https://t.co/G8kvuV40to After sweeping the #INDvSA series, India further consolidate their No.1 position in the ICC World Test Championship table, with 240 points.\n\nFull table \ud83d\udc49 https://t.co/xsau9k6Mbu https://t.co/2DqvdjsF3g \"At the moment, I probably have not given myself the best opportunity, but I feel like runs aren't too far away.\"\n\nDespite his modest returns in the opening matches of #SheffieldShield, Travis Head is hopeful of Test return.\n\nhttps://t.co/sUrjNz13Tk A fantastic performance from Namibia to beat Scotland \ud83d\udc4f\ud83d\udc4f\n\n#T20WorldCup https://t.co/aBPnbQ7xT5 #OnThisDay in 1999, Azhar Mahmood's brilliant returns of 5/28 powered Pakistan to an 88-run victory in the Sharjah Champions Trophy final over Sri Lanka. https://t.co/1yiRwMSxEM \ud83d\udc49 3 matches\n\ud83d\udc49 529 runs \n\ud83d\udc49 132.25 average\n\nWhat a cracking start Rohit Sharma has had to his career as a Test opener! It has taken him past Don Bradman for an average of 99.84 in the format at home \ud83e\udd2f\n\n#INDvSA https://t.co/YKKdH29OGF Pakistan make some surprise inclusions to their squad for the upcoming Test series in Australia. What do you make of the fresh faces?\n\nhttps://t.co/cRWvdSPoth #NewCoverPic https://t.co/Alm7J5XTD4 India completed their 11th consecutive Test series victory at home in style with their biggest win over South Africa in the final #INDvSA Test.\n\nMatch report \ud83d\udc47\nhttps://t.co/uAIjNyV7lI \ud83d\udd38 212 runs\n\ud83d\udd38 255 balls\n\ud83d\udd38 28 fours\n\ud83d\udd38 6 sixes\n\nFor his exceptional knock in the final #INDvSA Test, Rohit Sharma is adjudged the Player of the Match. https://t.co/6ATHSghbkr A historic win for India as they record their first Test series sweep against South Africa.  \ud83d\udc4f\n\n#INDvSA https://t.co/i6RpdLjbmT \u261d\ufe0f Theunis de Bruyn\n\u261d\ufe0f Lungi Ngidi\n\nDebutant Shahbaz Nadeem picks up the final two wickets in consecutive balls as India seal an innings-and-202-runs victory over South Africa on day four in Ranchi.\n\nSCORECARD: https://t.co/AEYe6hGC3o https://t.co/ibzpsobzlN Play gets underway on day four in Ranchi, with India on the brink of recording their first series sweep against South Africa.\n\nThe visitors are 132/8, still 203 runs shy of the hosts' first-innings total.\n\nFollow #INDvSA live \ud83d\udc47\nhttps://t.co/AEYe6hGC3o https://t.co/RYONjKGPdk Happy birthday to @owaisshah203!\n\n\ud83d\udc55 94 England caps\n\ud83c\udfcf 2450 runs\n\u261d\ufe0f 7 wickets https://t.co/Jn8KbosHL0 \ud83d\udc40\ud83d\udcf9 Watch the best moments from Monday's #T20WorldCup Qualifier matches: \n\n#SCOvPNG \ud83d\udc49 https://t.co/9UULaB3Ule\n#HKvUAE \ud83d\udc49 https://t.co/svBttWyO3A\n#IREvOMA \ud83d\udc49 https://t.co/RXhnC5SvEA\n#KENvBER \ud83d\udc49https://t.co/By6FOmQtT0\n#CANvNGR  \ud83d\udc49 https://t.co/32VYnJ5hls https://t.co/MSapUEJeaI \"That's probably the fastest you've run in your life!\" \n\n\ud83d\ude02\ud83d\ude02 https://t.co/nFQBb2GqmW Mohammed Shami's figures so far in South Africa's second innings \ud83d\udc47 \ud83d\udc4f \n\n#INDvSA https://t.co/1bhr9f61M9 ICYMI \ud83d\udc40  https://t.co/kQ1gV9WfPb Who do you know who bats like this? \ud83d\ude05 https://t.co/WlPj6D78cm Who's that hiding behind the stumps? \ud83e\udd14 https://t.co/R68gdQwyqY Kohli's men need only two more wickets to wrap up a 3-0 series victory \ud83d\udc47\n\n#INDvSA https://t.co/x136h4He4p RT @T20WorldCup: JUST IN: UAE have withdrawn Ashfaq Ahmed from their #T20WorldCup Qualifier squad. While no formal charges have been laid a\u2026 \ud83d\udc49 108 Tests\n\ud83d\udc49 36 ODIs\n\ud83d\udc49 9,196 international runs\n\nHe finished his Test career with 8,114 runs, averaging 47.72, and made a career-best 246* at Leeds in 1967 against India.\n\nHappy birthday to former England batsman Geoffrey Boycott. https://t.co/cgDiX3yEdt Caption this \ud83d\udc47 https://t.co/f7zbHN84mW Bad light brings an end to the day, South Africa eight down.\n\nThey still need 203 runs to make India bat again \ud83d\udc40 \n\n#INDvSA | SCORECARD \ud83d\udc49 https://t.co/AEYe6hGC3o https://t.co/epAeZzkMoJ Another wicket for Umesh Yadav after tea, but Linde is hitting back!\n\nDean Elgar has retired hurt after being struck by a Yadav bouncer just before tea.\n\n\ud83c\uddff\ud83c\udde6 are 65/5.\n\n#INDvSA | LIVE \ud83d\udc49 https://t.co/AEYe6hGC3o https://t.co/GVmz8sezf7 \ud83e\udd2f https://t.co/ibSW079q4m Mitchell Starc served a timely reminder of his red-ball capabilities with a match-winning haul in New South Wales' #SheffieldShield clash against Tasmania.\n\nFind out more \ud83d\udc47\nhttps://t.co/kQ1gV9WfPb Castled \ud83c\udff0 \n\nThree early wickets for Shami!\n\n\ud83c\uddff\ud83c\udde6 are 26/4 at tea.\n\n#INDvSA | LIVE \ud83d\udc49 https://t.co/AEYe6hGC3o https://t.co/T5VWHUnxYO All out!\n\nSouth Africa are finished off for 162, the wickets shared across the Indian bowlers.\n\nWith a lead of 335, will Kohli enforce the follow-on?\n\n#INDvSA | LIVE \ud83d\udc49 https://t.co/AEYe6hGC3o https://t.co/pmPwCa3mWT \"Whenever the team has been in a difficult situation, he's come and rescued us.\"\n\nHe may have scored his maiden double-hundred, but Rohit Sharma was all praise for Ajinkya Rahane, crediting him with wresting the initiative from South Africa.\n\nhttps://t.co/ujPmf4XRWQ Nicola Carey starred with both bat and ball in Hobart Hurricanes' five-wicket win over Melbourne Stars in #WBBL05.\n\nFind out more \ud83d\udc47\nhttps://t.co/LeZJVRI3Gq \u261d\ufe0f Dane Piedt\n\u261d\ufe0f Kagiso Rabada\n\nSouth Africa lose two quick wickets after lunch. They are 130/8, trailing by 367.\n\nLIVE \ud83d\udc49 https://t.co/AEYe6hGC3o https://t.co/7KR4gpchNl \ud83d\udc40 https://t.co/P1kFNObLmr The home team continue their domination in the final #INDvSA Test.\n\nSouth Africa lose four wickets in the first session as they head to lunch on day three on 129/6.\n\nLive updates: https://t.co/AEYe6hGC3o https://t.co/JRkvQ21rGi Temba Bavuma becomes Shahbaz Nadeem's first Test victim, after Jadeja removes Zubayr Hamza for 62.\n\nTwo massive wickets for India!\n\nLIVE \ud83d\udc49 https://t.co/AEYe6hGC3o https://t.co/cZPAxXiMZ9 Zubayr Hamza brings up his maiden Test half-century off just 56 balls on day three of the Ranchi Test.\n\nHe reaches the landmark in style, with a six!\n\nLIVE \ud83d\udc49 https://t.co/AEYe6hGC3o https://t.co/A7IG2CuDvL Brilliant start for India! \n\nUmesh Yadav strikes in the first over of day three as Faf du Plessis departs for just 1. \n\nTemba Bavuma is the new man in. \n\nLIVE \ud83d\udc49 https://t.co/AEYe6hGC3o https://t.co/dj38mRuo7H Day three of the final #INDvSA Test is underway! \n\nSouth Africa resume the day on 9/2, with Zubayr Hamza and skipper Faf du Plessis in the middle. \n\nCan the visitors put up a fight today?\n\nLIVE \ud83d\udc49 https://t.co/AEYe6hGC3o https://t.co/eEZschOtCc #OnThisDay in 1851, George Ulyett was born.\n\nHe played in the first ever Test match for England!\n\nUlyett, pictured with the rest of the squad, is the rightmost player in the back row. https://t.co/kvIPNBRqho 1\ufe0f\u20e30\ufe0f\u20e3 balls\n5\ufe0f\u20e3 sixes\n3\ufe0f\u20e31\ufe0f\u20e3 runs\n\nUmesh Yadav's cameo for India against South Africa was the fastest 30-plus score in Test history \ud83d\udca5\n\n#INDvSA https://t.co/2VoGKgghCo ICYMI \ud83d\udc47  https://t.co/240ysMkIWM \ud83d\udc55 208 ODIs\n\ud83c\udfcf 5346 runs\n\nHappy birthday to former Australia batsman Damien Martyn \ud83c\udf82 https://t.co/om3MQgvEtA The Hundred's inaugural draft is done and dusted.\n\nSome big names went unsold \ud83d\udc47  https://t.co/WTflA2dcxU ICYMI \ud83d\udc40  https://t.co/IAcD6swKeK Mitchell Starc and Steve Smith are going to be reunited at Welsh Fire!\n\nAfter the first round of #TheHundred draft, which player are you most looking forward to watching play 100-ball cricket? https://t.co/2WrJV3rR9J It's time!\n\n#TheHundred draft starts now, who would be your first pick? https://t.co/8UHBLkX7J5 India pressed home their advantage on day two of #INDvSA \ud83d\udc47  https://t.co/240ysMkIWM Guess who... \ud83e\udd14\n\n#INDvSA https://t.co/Dot0YP0SUN #SpiritOfCricket https://t.co/CuMk33GwrQ What a game, and what passion from the Singapore team \ud83d\ude4c\n\n#T20WorldCup | #BERvSIN https://t.co/a1dDbchccy When you score your first Test century at home in over three years \ud83d\ude05\n\n#INDvSA https://t.co/ekvQXZrq3h After splendid performances in the Women's Cricket Super League, she was called up to the England squad last year.\n\nShe was a part of their successful 2018 Women's #T20WorldCup campaign, where they made the final. \n\nHappy 22nd birthday to Kirstie Gordon \ud83c\udf82 https://t.co/UT8VyNKEhn \ud83d\udcac \"I aspired to be in the Big Bash and now I'm playing in it. It felt like a dream.\"\n\nTwo 16-year-olds featured in the #WBBL05 opener in Sydney yesterday!\n\nhttps://t.co/mH6QbTJQRP All smiles in the India camp after the second day at Ranchi \ud83d\ude01 https://t.co/NxnsiYDSJU That's stumps at Ranchi!\n\n\ud83c\uddee\ud83c\uddf3 497/9 dec (116.3 overs)\n\ud83c\uddff\ud83c\udde6 9/2 (5 overs)\n\nWhat was your favourite moment of the second day?\n\n#INDvSA \ud83d\udcdd\ud83d\udc47\nhttps://t.co/AEYe6hGC3o Bad light stops play after a ferocious start by India's new-ball attack!\n\nThey've reduced South Africa to 9/2 after five overs.\n\n#INDvSA \ud83d\udcdd\ud83d\udc47\nhttps://t.co/AEYe6hGC3o https://t.co/T4Qk5QD7zM Ryan Harris \u279e Bowling coach\nMike Hussey \u279e \u2753\n\nWith one eye on the 2020 #T20WorldCup at home, Australia make changes to their backroom staff \ud83d\udc47\n\nhttps://t.co/IAcD6swKeK India declare on 497/9\n\nUmesh Yadav gave them an extraordinary late burst, smashing five sixes in 10 balls \ud83d\udca5\n\nHow can South Africa respond?\n\n#INDvSA \ud83d\udcdd\ud83d\udc47\nhttps://t.co/AEYe6hGC3o https://t.co/Qk7Aa4YOqC 5\ufe0f\u20e30\ufe0f\u20e3 and out for Ravindra Jadeja!\n\nIt's been another splendid innings from the all-rounder, and he's helped drive India past 450.\n\n#INDvSA \ud83d\udcdd\ud83d\udc47\nhttps://t.co/AEYe6hGC3o https://t.co/Ueytmn9KOf We are 100 overs into the Indian innings now. \n\nRavindra Jadeja and Wriddhiman Saha have added 30 runs after Rohit Sharma's wicket.\n\nThe hosts are 400/5.\n\nFollow #INDvSA LIVE \ud83d\udc49 https://t.co/AEYe6hGC3o https://t.co/t5VkO0BbXC \ud83d\udca5 200 FOR ROHIT SHARMA \ud83d\udca5\n\nHe's recorded three double centuries in ODI cricket, and now he has one in Tests too \ud83d\udc40\n\nWhat a knock this has been from the India opener!\n\nFollow #INDvSA LIVE \ud83d\udc49 https://t.co/AEYe6hGC3o https://t.co/6lz80LHK4C LUNCH in Ranchi \ud83e\udd57\n\nIndia are 357/4 with Ravindra Jadeja and Rohit Sharma at the crease. \n\nSharma is unbeaten on 199* \ud83d\udc40\n\nFollow #INDvSA LIVE \ud83d\udc49 https://t.co/AEYe6hGC3o https://t.co/YyimxNLyB4 RT @T20WorldCup: #T20WorldCup Qualifier \u2013 Day 3\ufe0f\u20e3\n\nMatch 10 \u279d Papua New Guinea v Namibia, Dubai\nMatch 11 \u279d Canada v Jersey, Abu Dhabi\nMatch\u2026 150 up for Rohit Sharma. His Test batting average in India is over 100 right now \ud83e\udd2f\n\nThe hosts are on a roll in Ranchi. \n\nFollow #INDvSA LIVE \ud83d\udc49 https://t.co/AEYe6hGC3o https://t.co/lAdhIOw4v8 \ud83d\udea8 11th TEST CENTURY \ud83d\udea8\n\nAfter three years and 16 Tests against seven different opponents,\n\nAjinkya Rahane finally has his fourth Test hundred in India! \ud83d\ude4c\n\nFollow #INDvSA LIVE \ud83d\udc49 https://t.co/AEYe6hGC3o https://t.co/T6VJeF3TE1 Rohit Sharma and Ajinkya Rahane take guard for India on day two of the final Test against South Africa.\n\nThe hosts are 224/3. Rahane is 17 runs short of an 11th Test century \ud83d\udcaf\n\nFollow #INDvSA LIVE \ud83d\udc49 https://t.co/AEYe6hGC3o https://t.co/jfdaP8CISa \u27a1\ufe0f 330 Test wickets \ud83d\ude2e \n\u27a1\ufe0f Average of 22.25 \ud83e\udd2f \n\nHappy birthday Allan Donald \ud83c\udf82 https://t.co/5ZWH55MD62 8\ufe0f\u20e35\ufe0f\u20e38\ufe0f\u20e36\ufe0f\u20e3 Test runs at a strike rate of 8\ufe0f\u20e32\ufe0f\u20e3 \ud83e\udd2f \n\nHappy birthday to Virender Sehwag! https://t.co/3p8Ubilmi4 Phoebe Litchfield made her @WBBL debut yesterday at just 16 years old \ud83d\ude2e https://t.co/LjuyhRSPSy India batting coach, Vikram Rathour, had plenty of praise for India's new Test opener after yet another ton \ud83d\udcaf \ud83d\udc47  https://t.co/bn7dSGmjjs Which bowler has the most passionate celebrations? https://t.co/ts1w1o4sxT Textbook \ud83d\udcd6 https://t.co/svTDN5KVAL Three early wickets were overcome by a century from Rohit Sharma on day one of #INDvSA \ud83d\udc47 \n https://t.co/L43CCz4z5j #OnThisDay in 1873, one of USA's greatest cricketers of all time, Bart King, was born!\n\nHe featured in 65 first-class games, claiming 415 wickets at an exceptional average of 15.66.\n\nHis \"angler\" delivery, shown below, was notoriously difficult to face \ud83d\udc40 https://t.co/xkaiCNnOiX Guess who \ud83e\udd14\n\n#INDvSA https://t.co/2ItJ2uAkAl He has represented \ud83c\uddf3\ud83c\uddf1 in 37 ODIs and 14 T20Is, and was a part of the team that won a thriller against England in the 2009 @T20WorldCup group stage at Lord's.\n\nHappy birthday to one of Netherlands' finest all-rounders, Daan van Bunge! https://t.co/n6Kb95gKnX GIF game strong @cricketinjersey \ud83d\ude02 https://t.co/T4YkoQgJSw That's stumps at Ranchi! Play will start 30 minutes early tomorrow due to the lost time today \u23f0\n\nCan Ajinkya Rahane bring up his 11th Test hundred?\n\n#INDvSA \ud83d\udcdd\ud83d\udc47\nhttps://t.co/AEYe6hGC3o https://t.co/c8NXtRkaPr \"Winning is very important, but building a positive culture is my top priority.\"\n\nAzhar Ali is keen on Test captaincy \ud83d\udc47\n\nhttps://t.co/CWg748Qe3W Bad light has halted play at Ranchi with India in a strong position!\n\nThe hosts are 224/3, with Ajinkya Rahane 83* and Rohit Sharma 117*.\n\n#INDvSA \ud83d\udcdd \ud83d\udc47\nhttps://t.co/AEYe6hGC3o https://t.co/wxauD0tQyE TEA on day one \ud83c\udf75\n\nRohit Sharma (108*) and Ajinkya Rahane (74*) have brought India back on track with a sensational counterattack in that session. \n\nTheir partnership is now worth 166 \ud83d\udc4f\n\n#INDvSA LIVE \ud83d\udc47\nhttps://t.co/AEYe6hp0EO https://t.co/0RVxG6FGRu What an innings this is from Rohit Sharma! \ud83d\udc4f\n\nHe brings up his third Test hundred of this series \u2013 his sixth in the format \u2013 with a six. \n\n#INDvSA LIVE \ud83d\udc47\nhttps://t.co/AEYe6hGC3o https://t.co/VByRqGLiUz Ajinkya Rahane joins the party in Ranchi!\n\nThe India batsman reaches his 21st Test fifty from 70 balls, on day one of the final #INDvSA Test. \n\nFollow the action live \ud83d\udc47 \nhttps://t.co/AEYe6hGC3o https://t.co/6GwylF1SQ1 Fifty up for Rohit Sharma! \n\nThe India opener brings up his 11th Test fifty in style with a four. How many more can he add from here? \n\n#INDvSA LIVE \ud83d\udc47\nhttps://t.co/AEYe6hGC3o https://t.co/FYkcDUGFbt \u261d\ufe0f Dion Stovell\n\u261d\ufe0f Kamau Leverock\n\u261d\ufe0f Deunte Darrell\n\nPNG's Norman Vanua claims a hat-trick in match five of the ICC Men's #T20WorldCup Qualifier \ud83d\udc4f https://t.co/fE8nvYMfsD South Africa snared three big wickets in the first session of day one of the Ranchi Test.\n\nRohit Sharma and Ajinkya Rahane take India to 71/3 at lunch. \n\n#INDvSA LIVE \ud83d\udc47\nhttps://t.co/AEYe6hGC3o https://t.co/j5JhNZa6Ya \"It\u2019s the one global trophy that has eluded the men\u2019s team so far and we won\u2019t get a better opportunity than on home soil next year.\"\n\nCan Australia seize home advantage at next year's men's #T20WorldCup?\n\nhttps://t.co/A9Z5Gu6Uaf Big wicket for South Africa! \n\nVirat Kohli becomes Anrich Nortje's first Test victim as the paceman traps the Indian skipper in front for 12.\n\n#INDvSA LIVE \ud83d\udc47\nhttps://t.co/AEYe6hGC3o https://t.co/E57MvnM1zD What a start for South Africa! \ud83d\ude4c\n\nKagiso Rabada has claimed the crucial wickets of Mayank Agarwal and Cheteshwar Pujara.\n\nIndia are 17/2 after 10 overs. \n\n#INDvSA LIVE \ud83d\udc47\nhttps://t.co/AEYe6hGC3o https://t.co/t9c2fgzcPb An early breakthrough for South Africa!\n\nKagiso Rabada gets the big wicket of opener Mayank Agarwal, who falls for 10.\n\n#INDvSA LIVE \ud83d\udc47\nhttps://t.co/AEYe6hGC3o https://t.co/TyxqcEmw90 Their mission is to qualify for the @T20WorldCup, but the men from the emerald isle will have one eye on the  @rugbyworldcup with @IrishRugby facing New Zealand in today's quarter-final \u2618\ufe0f\ud83d\udc40 https://t.co/iSKSA4j3S5 RT @ICCLive: 3rd Test. South Africa XI: D Elgar, Q de Kock, Z Hamza, F du Plessis, T Bavuma, H Klaasen, G Linde, D Piedt, K Rabada, A Nortj\u2026 RT @ICCLive: 3rd Test. India XI: R Sharma, M Agarwal, C Pujara, V Kohli, A Rahane, R Jadeja, W Saha, R Ashwin, S Nadeem, U Yadav, M Shami h\u2026 Congratulations to wicket-keeper batsman Heinrich Klaasen and spinner George Linde, who are making their Test debuts for South Africa. \ud83d\udc4f\n\nFollow #INDvSA live \ud83d\udc47\nhttps://t.co/AEYe6hGC3o https://t.co/ahbK5KdcFo India captain Virat Kohli has won the toss and opted to bat in the final #INDvSA Test in Ranchi. https://t.co/86lK9gUfRL RT @ICCLive: 3rd Test. Toss won by India, who chose to bat https://t.co/DCpKGPH3ei #INDvSA Spinner Shahbaz Nadeem receives his maiden Test cap from India skipper Virat Kohli. \ud83d\udc4f\n\n#INDvSA https://t.co/t7bWronEE1 ICYMI \ud83d\udc47  https://t.co/Vc5hdf7du2 #OnThisDay in 1900, Bill Ponsford was born.\n\nOne of only two batsmen to have struck two quadruple centuries \ud83e\udd2f\n\nHe is on the right, on his way out to bat at Scarborough Cricket Festival. https://t.co/LgxaHAYWs4 ICYMI \ud83d\udc40  https://t.co/GTFDEdRhRQ Congratulations to Mis-e Ainak Knights! \ud83c\udf89 \n\nLed by captain @MohammadNabi007, they beat Band-e Amir Dragons by 4 wickets to claim the Shpageeza Cricket League 2019 \ud83c\udfc6 https://t.co/W7MXVy7Vyv Shahbaz Nadeem has been called up by India as cover for Kuldeep Yadav \ud83d\udc47  https://t.co/Vc5hdf7du2 \ud83d\udcac \"I saw them in the West Indies and I must say, what I was accustomed to in the past, in the '90s and early part of the 21st century, this is a little bit exceptional, this is pretty special.\"\n\nA Windies legend had serious praise for India's quicks \ud83d\udc47  https://t.co/A2d7yqK6G4 ICYMI: Azhar Ali and Babar Azam to replace Sarfaraz Ahmed as Pakistan's Test and T20I captains respectively.\n\nhttps://t.co/ACD90tCcGJ What a game, and what a start to the @T20WorldCup Qualifier \ud83d\ude4c https://t.co/pPOnR45odS Recent Test form (latest first):\n\n\ud83c\uddee\ud83c\uddf3 \u279c \ud835\udce6 \ud835\udce6 \ud835\udce6 \ud835\udce6 \ud835\udcd3 \n\ud83c\uddff\ud83c\udde6 \u279c \ud835\udcdb \ud835\udcdb \ud835\udcdb \ud835\udcdb \ud835\udce6\n\nHow will the teams fare in the final #INDvSA Test? PREVIEW \ud83d\udc47\n\nhttps://t.co/aZ21w4wN7E \ud83d\udcac \"I really want to give it a good go. I think I've got some attributes that can help some guys.\"\n\nJeetan Patel is ready for his England assignment \ud83d\udc47\n\nhttps://t.co/GTFDEdRhRQ Details \ud83d\udc47\n\nhttps://t.co/ACD90tkBi9 JUST IN: Sarfaraz Ahmed has been removed as Pakistan's Test and T20I captain. Azhar Ali and Babar Azam will replace him. https://t.co/3OhXWYbrCG \ud83d\udc55 35 international appearances\n\u261d\ufe0f 89 wickets\n\nOn his debut, he returned match figures of 16/136 against West Indies, at just 19 years of age!\n\nHappy 51st birthday to India's Narendra Hirwani \ud83c\udf82 https://t.co/UcC1rCUkXk Finch \ud83c\udde6\ud83c\uddfa \u279d \"The #T20WorldCup is going to be a great spectacle.\"\nKohli \ud83c\uddee\ud83c\uddf3 \u279d \"The @T20WorldCup in 2020 is a big focus for us.\"\nWilliamson \ud83c\uddf3\ud83c\uddff \u279d \"To be a year out from another ICC World Cup is exciting.\"\n\nCaptains speak a year ahead of the #T20WorldCup \ud83d\udc47\n\nhttps://t.co/zsyp3pkHkN Exactly one year to go until the Men's @T20WorldCup begins! https://t.co/91hsLEpKhZ \ud83d\udc55 75 \ud83c\udde6\ud83c\uddfa caps\n\u261d\ufe0f 126 wickets\n\nHappy birthday Nathan Hauritz! https://t.co/GrPRJ2UDVj #OnThisDay in 1854, Billy Murdoch was born.\n\nHis 211 against England in 1884 was the first Test double hundred \ud83d\udcaf\ud83d\udcaf \n\nMurdoch is stood second from the right, between WG Grace and Prince Ranji \ud83d\udc40 https://t.co/sTKxkBiBdp ICYMI \ud83d\udc47  https://t.co/guN0CNiaoH Just 12 hours to go until the @WBBL returns! https://t.co/C2ODiOOOBX A royal visit today for @TheRealPCB's National Cricket Academy \ud83d\udc51 https://t.co/Nv0JNXJnKS ICYMI \ud83d\udc47  https://t.co/EcehMwBZUq ICYMI \ud83d\udc40  https://t.co/EksxTkEqjG The @T20WorldCup Qualifier starts tomorrow!\n\nHere's the low-down \ud83d\udc47  https://t.co/llZvolh0aY Sri Lanka have named their squad for the three-match T20I series in Australia \ud83d\udc47  https://t.co/8d4CGNj4Bb #OnThisDay 11 years ago, @sachin_rt became the leading run-scorer in Tests \ud83d\udc4f \ud83d\udc4f https://t.co/hvtFABD53o Aiden Markram has been ruled out of the third Test with a wrist injury \ud83d\udc47  https://t.co/oxZkqesbva \ud83d\udc55 64 international appearances\n\ud83c\udfcf 600 runs\n\u261d\ufe0f 31 wickets\n\nRepresented India at the ICC Women's @cricketworldcup 2009 and 2013 \ud83c\udfc6\n\nHappy birthday, Reema Malhotra! https://t.co/WNb7aGn5Gl Interim head coach: Gus Logie\nTeam manager: Evril Betty Lewis\n\nCWI has made changes to the West Indies women backroom staff \ud83d\udc47\n\nhttps://t.co/guN0CNiaoH He played in just seven Tests, but scored 582 runs at 52.90 \ud83d\ude4c\n\nHis 206 against \ud83c\udff4\udb40\udc67\udb40\udc62\udb40\udc65\udb40\udc6e\udb40\udc67\udb40\udc7f in 1949 was the first Test double century by a New Zealand batsman \ud83d\udcaf\ud83d\udcaf\n\n#OnThisDay in 1917, the great Martin Donnelly was born. In this photo, he's sitting on the ground, first from the right \ud83d\udc47 https://t.co/RpIGIm0pZZ RT @T20WorldCup: Here are the previews for all #T20WorldCup Qualifier teams:\n\n\ud83d\udca5 GROUP A \ud83d\udca5\n\n\ud83c\udff4\udb40\udc67\udb40\udc62\udb40\udc73\udb40\udc63\udb40\udc74\udb40\udc7f \u2013 https://t.co/K1zi1CLa66\n\ud83c\uddf3\ud83c\uddf1 \u2013 https://t\u2026 2014: ICC Men's @T20WorldCup \u279d final\n2015: ICC Men's @CricketWorldCup \u279d semi-final\n2016: ICC Men's T20 WC \u279d semi-final\n2017: ICC Champions Trophy \u279d final\n2019: ICC Men's CWC \u279d semi-final\n\nGanguly wants \ud83c\uddee\ud83c\uddf3 to win trophies in 'big tournaments' \ud83d\udc47\n\nhttps://t.co/EksxTkEqjG Happy birthday Anil Kumble!\n\n6\ufe0f\u20e31\ufe0f\u20e39\ufe0f\u20e3 Test wickets \ud83d\udc4f \n3\ufe0f\u20e33\ufe0f\u20e37\ufe0f\u20e3 ODI wickets \ud83d\udc4f https://t.co/ZVq3pqqOSK 1\ufe0f\u20e30\ufe0f\u20e37\ufe0f\u20e3 runs\n3\ufe0f\u20e3 wickets\n1\ufe0f\u20e3 Men's @CricketWorldCup final \ud83c\udfc6 \n\nHappy birthday to Aravinda de Silva, Player of the Match in the 1996 World Cup final against Australia! https://t.co/q3CSGttO9E 6\ufe0f\u20e34\ufe0f\u20e36\ufe0f\u20e31\ufe0f\u20e3 ODI runs\n2\ufe0f\u20e34\ufe0f\u20e35\ufe0f\u20e3 international wickets\n\nHappy birthday @MHafeez22 \ud83c\udf82 https://t.co/3Fi3sj5Ch5 ICYMI: https://t.co/yX7nB3MccI Who is the best sweeper in the modern game? https://t.co/KeAtAiLtif ICYMI:\n\nNathan Lyon is targeting selection for the @T20WorldCup \ud83d\udc47  https://t.co/T7EiSheAVB \ud83d\udcac \"I am like everyone else but I control my emotions better than some of the other individuals. I also feel angry at times, disappointed. But what is important is that none of these feelings are constructive.\"\n\nDhoni opens up on being 'Captain Cool' \ud83d\udc47  https://t.co/EcehMwBZUq ICYMI \ud83d\udc47  https://t.co/ySHDMTuqxP A trio of UAE players have been provisionally suspended from cricket.\nhttps://t.co/yX7nB3MccI After missing the opening round of matches in Bangladesh's domestic first-class competition, the clock is ticking for Mustafizur Rahman to prove his fitness for the India tour.\n\nhttps://t.co/emf9V3wakO It's #WorldFoodDay \ud83c\udf72\n\nWhat\u2019s your favourite food to enjoy while watching the cricket? https://t.co/og41tDphNN Rabada says he isn't sure if South Africa can be put under any more pressure than they were in the first two #INDvSA Tests, calls on the team's youngsters to take the onus.\n\nhttps://t.co/HUD4q4LlJB ICYMI: England all-rounder Jenny Gunn announced her retirement from international cricket.\n\nDetails: https://t.co/AHfdlIhE4r https://t.co/boKn8kMH0v RT @T20WorldCup: \ud83d\udcf8\ud83e\udd23\ud83d\udea3\u200d\u2642\ufe0f\ud83c\udfc9\ud83d\udd7a\ud83c\udfc3\u200d\u2642\ufe0f \n\nThe #T20WorldCup Qualifier media day was an absolute riot!  \n\nWho's ready for the tournament starting Frida\u2026 My friends: you okay?\nMe: yeah I\u2019m fine.\nMy headphones:\n\nEpic #CWC19 final montage\n0:35 \u2501\u274d\u2500\u2500\u2500\u2500\u2500\u2500\u2500\u2500 -03:08\n            \u21bb     \u22b2  \u2161  \u22b3     \u21ba\n volume: \u2581\u2582\u2583\u2584\u2585\u2586\u2587 100% https://t.co/PejQxKq4uU #NewCoverPic https://t.co/9F4sYFbUPM #OnThisDay in 1995, West Indies legend Brian Lara smashed 169 \u2013 his highest ODI score \u2013 off 129 balls in the Sharjah Champions Trophy match against Sri Lanka.\n\nHis masterclass featured 15 fours and four sixes. \ud83d\udd25 https://t.co/mSfiSyJChc He may be Australia's leading spinner in Test cricket after Shane Warne, but the growth won't stop for Nathan Lyon until he calls it a day.\n\nhttps://t.co/T7EiSheAVB #OnThisDay in 1978, one of the greatest all-rounders of all time made his Test debut.\n\nHe went on to have a glorious career, finishing with 5,248 runs and 434 wickets.\n\nWhat's your favourite Kapil Dev moment? https://t.co/scWoCuAjU7 She has 111 international caps to her name and has made two of India's three fastest ODI half-centuries \ud83d\udcaa\n\nHappy birthday, Veda Krishnamurthy \ud83c\udf89 https://t.co/7LSh2qDy5s 25534 international runs \ud83d\udca5\n577 international wickets \ud83d\udd25\n338 international catches \ud83d\ude4c\n\nHappy birthday to Jacques Kallis, perhaps the greatest all-rounder in cricket's history \ud83c\udf89 https://t.co/61DK8zo0uh When you realise there's no international cricket for the next two days vs. when you remember the @T20WorldCup Qualifier starts on Friday \ud83d\ude29\ud83d\ude04 https://t.co/P8l2AkNHB5 ICYMI \u2b07\ufe0f \nhttps://t.co/LCkNCjanzc Agree with these selections?\n\nhttps://t.co/ySHDMTcPGh \"As a small girl I always said I wanted to put a World Cup medal next to my dad's European Cup winner's medal, and there are now three of them next to his medal on the mantelpiece!\"\n\nhttps://t.co/ZTmq7gC94a \"He's proved to the world that there's nothing you can't do if you put your heart and brain into it.\"\n\nHere's what your achievement meant to the Kenyan cricket team, @EliudKipchoge. https://t.co/9V9ldwF1FA \"It was always going to be a difficult challenge taking on the top team in the world - certainly under their own conditions - in India at a time when we have introduced a new team structure.\"\n\nhttps://t.co/AbWByJJUGf 3\ufe0f\u20e3 Triple world champion\n\ud83d\udcaf The only England player to reach a century of T20I caps\n\nCongratulations on a fantastic career, Jenny Gunn \ud83d\udc4f\n\n#ThankYouJenny https://t.co/tWbjJgW1jh Paras Khadka, who led Nepal to their first-ever ODI series win earlier this year, has stepped down as captain. \n\nFULL STORY \u2b07\ufe0f \nhttps://t.co/LCkNCjanzc \ud83d\udc49 18 Tests \n\ud83d\udc49 92 ODIs\n\ud83d\udc49 23 T20Is\n\nHe represented West Indies between 2003 and 2015, claiming 195 international wickets. \n\nHappy birthday to Ravi Rampaul. https://t.co/rabytPmPgB South Africa's Marizanne Kapp has moved up six positions to No.2 in the latest @MRFWorldwide ICC Women's ODI Player Rankings for all-rounders.\n\nIndia's Shikha Pandey makes it to the top 10!\n\nFull rankings: https://t.co/mNfBWKrKDL https://t.co/oX54VNoPmM \u2197\ufe0f  Marizanne Kapp\n\u2197\ufe0f  Shabnim Ismail\n\nSouth Africa may have lost 3-0 to India, but their players have made gains in the latest @MRFWorldwide ICC Women's ODI Player Rankings for bowling.\n\nFull rankings: https://t.co/mNfBWKrKDL https://t.co/mjlSMR71Ea New Zealand's Amy Satterthwaite moves up to No.1 spot in the latest @MRFWorldwide ICC Women's ODI Rankings for batting. \n\nSouth Africa's Laura Wolvaardt storms into the top 10!\n\nFull rankings: https://t.co/mNfBWKrKDL https://t.co/PNrpEr7HGQ #OnThisDay in 2017, openers Quinton de Kock and Hashim Amla helped South Africa chase down 279 to set up a record 10-wicket win in an ODI against Bangladesh.\n\nTheir unbeaten 282-run stand is the highest partnership for any wicket by \ud83c\uddff\ud83c\udde6 batsmen. https://t.co/FsXqMhJUeh \"I\u2019m at a stage where I know how to look after myself. I\u2019ve found what works for me and what doesn\u2019t.\"\n\nJofra Archer looks back on personal learnings from a golden English summer and spells out the team's ambitions for the future.\n\nhttps://t.co/8Tit5dkheI \ud83d\udd39 18 ODIs\n\ud83d\udd39 12 T20Is\n\nEarlier this year, she returned her career-best figures of 4/34 in an ODI against West Indies in Dubai.\n\nHappy birthday to Pakistan pacer Diana Baig. https://t.co/QwYZeXEEIu \"Whatever he is doing right now is certainly working and the team is responding to his leadership.\"\n\nShane Watson is impressed with what he has seen of Virat Kohli as a captain so far.\n\nhttps://t.co/7uMRkW61UR #OnThisDay in 2000, New Zealand won the ICC KnockOut trophy by beating India in a thrilling final by four wickets in Nairobi.\n\nChris Cairns' brilliant 102* helped his side chase down 265 with only two balls remaining. https://t.co/wK14lRM0J1 No. 1\ufe0f\u20e3 in the MRF Tyres T20I Batting Rankings \ud83c\udfc6 \n\nHappy birthday to Pakistan vice-captain @babarazam258! https://t.co/kDSGeRb2xy ICYMI: https://t.co/pNZCLsCrkh That's Mitch Marsh on his way out to bat, but who's behind him? \ud83e\udd14 https://t.co/2Zwmt5046g ICYMI:\n\nIndia beat South Africa by an innings to take the series with a match to spare. https://t.co/8usjoD4eaO Welcome back @ZimCricketv! \ud83d\ude4c https://t.co/N3iqRuUqe7 Who is the best keeper in international cricket at the moment? https://t.co/dejcsKuLur BREAKING: Phil Simmons has been appointed head coach of the West Indies men's side. https://t.co/ut6sFiBn1Q ICYMI:\n\n\ud83d\udcac \"Even at his age, with his youthful enthusiasm, he's got lots of areas he can improve, and that's heartening for him and for us. At the moment, he's doing a great job.\"\n\nJustin Langer has plenty of praise for the Aussie captain \ud83d\udc47  https://t.co/IOl0jze3j9 Following the conclusion of the ICC Board meetings today, Zimbabwe and Nepal have been readmitted as ICC Members. https://t.co/t9KIlEhQE7 \ud83d\udcac \"We're not going to take the foot off the gas in the third Test, we're looking for a result again, and hopefully make it 3-0.\"\n\nVirat Kohli is promising to maintain the intensity despite having already won the series \ud83d\udc47  https://t.co/i8pDK0QPev India came out on top of South Africa in a thriller!\n\n#INDvSA MATCH REPORT \ud83d\udc47  https://t.co/5EzYEqqNAQ It's a batsman's most important piece of kit, but how is a cricket bat made?\n\nWe had a look behind the scenes at @graynics to find out \ud83d\udc40 https://t.co/2XRDSYzyH4 What nail-biting win for India!\n\nSouth Africa were dismissed for 140 to lose by six runs, handing India a 3-0 series win. Jemimah Rodrigues' first international wicket sealed the victory \u261d\ufe0f \n\n#INDvSA SCORECARD \u2b07\ufe0f\nhttps://t.co/1kSvxPNbUb https://t.co/6D28EsEbIp Massive wicket for India - Marizanne Kapp has fallen for 29 off the bowling of Deepti Sharma to leave South Africa 119/7. \n\nFollow #INDvSA live \u2b07\ufe0f\nhttps://t.co/1kSvxPNbUb https://t.co/HeXcmiFjRI Having fully recovered from a shoulder injury, Mahmudullah has resumed full bowling duties.\n\nHe bowled 39 overs across two innings for Dhaka Metropolis in the NCL and returned figures 6/80.\n\nhttps://t.co/pNZCLsCrkh @MRFWorldwide Find all the updates here: https://t.co/kQBAqv2QmP https://t.co/u1XVApf9NY \u2b06\ufe0f Ashwin\n\u2b07\ufe0f Philander\n\nAfter taking six wickets in India's win over South Africa in Pune, R Ashwin has continued his rise in the @MRFWorldwide ICC Test Rankings for bowlers. https://t.co/1whGqEfnxk South Africa in real trouble now! Deepti Sharma and Rajeshwari Gayakwad have struck twice in four balls to reduce the visitors to 54/4 in chase of 147!\n\nFollow #INDvSA live \u2b07\ufe0f\nhttps://t.co/1kSvxPNbUb https://t.co/jIFrboykGO India have made a promising start to their defence of a modest 146. Mansi Joshi and Ekta Bisht have picked up one wicket each and South Africa are 31/2.\n\nFollow #INDvSA live \u2b07\ufe0f \nhttps://t.co/1kSvxPNbUb https://t.co/mu7G6L2May \"The beauty of Tim Paine is he will keep getting better. At the moment, he's doing a great job.\"\n\n\ud83c\udde6\ud83c\uddfa coach Justin Langer is pleased with Paine's leadership and believes he will keep improving.\n\nhttps://t.co/IOl0jze3j9 India bowled out for 146. South Africa's bowlers were clinical today \u2013 Kapp led the way with three wickets, while Ismail and Khaka took two each.\n\nFollow #INDvSA live \u2b07\ufe0f \nhttps://t.co/1kSvxPNbUb https://t.co/XQakFXXZHc Marizanne Kapp has dismissed Harmanpreet Kaur for 38 to break a promising 49-run stand between her and Shikha Pandey for the seventh wicket. \n\nPandey (29*) is playing a superb hand though.\n\nFollow #INDvSA live \u2b07\ufe0f\nhttps://t.co/1kSvxPNbUb https://t.co/xIZRG9udQl South Africa continue to make inroads. Skipper Sune Luus strikes in her first over, reducing India to 71/6.\n\nHarmanpreet Kaur is batting on 20. Can she dig her side out of trouble?\n\nFollow #INDvSA live \u2b07\ufe0f\nhttps://t.co/1kSvxPNbUb https://t.co/BeMmVL9RpU Umesh Yadav has played only six of India's 19 Tests since the start of 2018, but he isn't discouraged.\n\n\"I know I have to be ready when I get my chance. For that, it's important to stay positive, keep playing the game, and stay focused.\"\n\nhttps://t.co/CgxD28sgfv India are in deep trouble at 39/4 as Marizanne Kapp gets rid of Mithali Raj for her second wicket. \n\nFollow #INDvSA live \u2b07\ufe0f\nhttps://t.co/1kSvxQ4MLJ https://t.co/HqejJ7CSWu International matches: 497\nRuns: 17671\n\ud83d\udcafs: 39\n\nHe was also the highest run-getter in the 2009 @T20WorldCup.\n\nHappy birthday, Tillakaratne Dilshan! https://t.co/mxfRHbaxZW \ud83c\udf82 Happy birthday to Ashton Agar, who holds the record for the highest score by a No.11 in Tests! https://t.co/YSyWFneJQG Great start for South Africa! Shabnim Ismail and Marizanne Kapp have struck in their first overs respectively. India 5/2 after 2 overs.\n\nFollow #INDvSA live \u2b07\ufe0f \nhttps://t.co/1kSvxPNbUb https://t.co/lbOYINvszB India have won the toss and opted to bat first in the third and final ODI.\nWill \ud83c\uddee\ud83c\uddf3 make it 3-0 today or will \ud83c\uddff\ud83c\udde6 hit back?\n\nFollow #INDvSA live \u2b07\ufe0f \nhttps://t.co/1kSvxPNbUb https://t.co/mJjgyTgnCW One of only four players to have scored centuries in five consecutive Tests \ud83d\udc4f \n\nHappy birthday Gautam Gambhir \ud83c\udf82 https://t.co/JfPkXuAmzT Caption this \ud83d\udde3\ufe0f\n\n#INDvSA https://t.co/v7uUIKLhj7 Happy birthday to one of only two Australians to have scored a century in all three formats...\n\nGlenn Maxwell! https://t.co/0YSprKED6R ICYMI:\n\nBarbados Tridents won their second CPL title \ud83c\udfc6  https://t.co/3K6tJ8BP0l 1\ufe0f\u20e31\ufe0f\u20e3 consecutive home series wins \ud83c\udf89 \n\nEven @ashwinravi99 can't count that on his fingers!\n\n#INDvSA https://t.co/uCqoknfMA3 ICYMI:\n\nSouth Africa have called up uncapped George Linde to replace Keshav Maharaj.\n\n#INDvSA https://t.co/vS0Un6PHH4 India wrapped up a dominant victory, and a series win along with it.\n\n#INDvSA MATCH REPORT \ud83d\udc47  https://t.co/8usjoD4eaO Congratulations Barbados Tridents, Caribbean Premier League 2019 champions \ud83c\udfc6\ud83c\udf89\ud83d\udc4f https://t.co/VvABqSx8q7 In seven Test appearances, he has made 466 runs at an average of 42.36.\n\nEarlier this year, he played brilliant knocks of 111 and 53* in the Kingston Test against West Indies.\n\nHappy birthday to India batsman Hanuma Vihari! https://t.co/xPMzaXci4E \"I spoke to Broady about the one he bowled me at Lord's and he said to me it's probably one of the best balls he's ever bowled.\"\n\nAustralia opener David Warner reflects on his Ashes 2019 struggles.\n\nhttps://t.co/0SgaVCHSSI What a Test match for this man and his team \ud83d\ude4c\n\n#INDvSA https://t.co/4ul30wmFz7 India win by an innings and 137 runs, sealing the series against South Africa and maintaining their 100 per cent World Test Championship record \ud83d\udc4f\n\nWhat a performance from Virat Kohli's men \ud83d\udcaa\n\n#INDvSA https://t.co/zvYg1kfIaP India are closing in on a series victory against South Africa in Pune!\n\nStanding in their way once again are Keshav Maharaj and Vernon Philander. The Proteas are 172/7 and need 154 runs to make the hosts bat again.\n\n#INDvSA \ud83d\udc47\nhttps://t.co/9BbEbVI5BA https://t.co/BKFktVAUz5 Ajinkya Rahane takes a brilliant catch to get rid of Temba Bavuma, who falls for 38.\n\nIndia have reduced South Africa to 125/6.\n\nFollow #INDvSA live \ud83d\udc47\nhttps://t.co/MO1tirNpXK https://t.co/zyJpnjorip \ud83d\udd39 18 Tests\n\ud83d\udd39 83 ODIs\n\ud83d\udd39 180 wickets \n\nIn 1994, the fast bowler's brilliant ten-wicket haul in the Sydney Test helped South Africa seal a thrilling five-run win over Australia.\n\nHappy birthday to Fanie de Villiers! https://t.co/7vtnXr2VKf Day 4 | Lunch \ud83c\udf7d\ufe0f\n\nSouth Africa lose Dean Elgar and Faf du Plessis shortly before lunch as India reduce the visitors to 74/4 in the first session.\n\nWill we have a result today? Can \ud83c\uddff\ud83c\udde6 put up a fight?\n\n#INDvSA live updates \ud83d\udc47\nhttps://t.co/MO1tirNpXK https://t.co/EiDjEYJlKy \"We are going to need guys to put up their hand no matter which way the result goes.\"\n\nTemba Bavuma wants South Africa to take inspiration from the Philander-Maharaj fightback.\n\nhttps://t.co/bVAmxyK9Um What a start!\n\nAiden Markram bags a pair as Ishant Sharma strikes with the second ball on day four.\n\n#INDvSA live \ud83d\udc47\nhttps://t.co/MO1tirNpXK https://t.co/tOvG0uW8pF Day four of the second #INDvSA Test is underway in Pune!\n\nAfter routing South Africa for 275, India have enforced the follow-on, still holding a 326-run first-innings lead.\n\nFollow the action live \ud83d\udc47\nhttps://t.co/MO1tirNpXK https://t.co/OLyu8gSXtx Caption this \ud83e\udd18 https://t.co/prtM6jrnXA ICYMI: https://t.co/tnrR8D6YFY Youngest player to represent New Zealand in T20Is \u2705 \nYoungest international double-centurion ever \u2705 \nHighest score in women's ODIs \u2705\n\nHappy birthday to Amelia Kerr \ud83c\udf82 https://t.co/AJl5Trwud4 Who played the most extravagant leave you've seen? https://t.co/ikkHFAEzBB \ud83d\udcac \"Philander batted beautifully. I thought his defense technique against both spin and fast bowling is wonderful.\"\n\nRavi Ashwin had nothing but praise for Vernon Philander's efforts \ud83d\udc47  https://t.co/7GHB2AaIdg James Pattinson's bowling:\nRight-arm fast-medium \u274e \nRight-arm off-spin \u2705 \n\nThe opening bowler has been trying out some spin during Victoria's match against South Australia \ud83d\ude02 https://t.co/TERctlxAF2 After 12 years in a variety of roles, Andy Flower is leaving the English coaching setup.\n\nHe picked out some of his highlights \ud83d\udc47  https://t.co/LJO4fGBbzc \"We want to play our part in assisting getting international cricket back in Pakistan.\"\n\nIreland are keen on touring Pakistan next year \ud83d\udc47 \nhttps://t.co/NfwTh0BrSW Philander and Maharaj shared a 109-run partnership but couldn't stop India finishing off the South African innings by stumps.\n\n#INDvSA DAY TWO REPORT \ud83d\udc47  https://t.co/tnrR8D6YFY That's the end of the innings and the day!\n\nAshwin takes the final wicket and South Africa are all out 275. Rabada is the last man to go and Philander is left unbeaten on 44. Maharaj is the top-scorer with his valiant knock of 72. \n\nFollow #INDvSA LIVE \u25b6\ufe0f https://t.co/MO1tirvOza https://t.co/q4ahE1acrq Bend it like... Steve Smith \u26bd https://t.co/EHPXtgX9SO Fifty for Keshav Maharaj!\n\nPlenty of fight being shown by Maharaj and Vernon Philander. \n\n#INDvSA https://t.co/uhKzZYRPL6 Batting Average \ud83e\udd2f \nIn Tests \u279d 47.72\nIn First-class cricket \u279d 71.64\nIn Ranji Trophy \u279d 98.35\n\n#OnThisDay in 1911, one of India's most fluent batsmen, Vijay Merchant was born. https://t.co/a6TK7D8lkB \u2615 Tea time in Pune!\n\nSouth Africa score 61 runs for loss of two wickets in the second session.\n\nPhilander and Maharaj are fighting hard, but the visitors are still 204 runs away from avoiding the follow-on.\n\nFollow #INDvSA LIVE \u25b6\ufe0f https://t.co/MO1tirNpXK https://t.co/bZcKPSTnTR BIG WICKET \u261d\ufe0f \n\nThe South African skipper's resistance ends on 64 as Ashwin picks up his second wicket.\n\nThe visitors are 167/8, trailing by 434 runs.\n\nFollow #INDvSA LIVE \u25b6\ufe0f https://t.co/MO1tirNpXK https://t.co/BJ8esLhHMf #NewCoverPic https://t.co/O8ZoBImvR5 Senuran Muthusamy survives only two overs after the lunch break. He departs for 7 as Jadeja traps him in front.\n\nSouth Africa are 139/7.\n\nFollow #INDvSA LIVE \u25b6\ufe0f https://t.co/MO1tirNpXK https://t.co/4DYmV7OQ6u \ud83c\udf72 Lunch time in Pune on day three!\n\nFaf du Plessis is the lone man fighting as South Africa lose three wickets for 100 runs in the first session. They still trail India by 465 runs.\n\nFollow #INDvSA LIVE \u25b6\ufe0f https://t.co/MO1tirNpXK https://t.co/jDglGqju83 21st Test fifty for Faf du Plessis! With 8 fours and a maximum, how good is he looking \ud83d\udcaa \n\nFollow #INDvSA LIVE \u25b6\ufe0f https://t.co/MO1tirNpXK https://t.co/r19eDdOQOS The South African skipper Faf du Plessis is looking to rebuild with support from Quinton de Kock.\n\nThe visitors are 84/5 in 30 overs.\n\nFollow #INDvSA LIVE \u25b6\ufe0f https://t.co/MO1tirNpXK https://t.co/O9stUJUlKB Umesh Yadav gets his third wicket as de Bruyn goes for 30. South Africa in trouble at 53/5.\n\nFollow #INDvSA LIVE \u25b6\ufe0f https://t.co/MO1tirNpXK https://t.co/D6Vdqm4aqw WICKET \u261d\ufe0f \n\nAnrich Nortje's resistance does not last long on the morning of day three as Kohli holds onto a sharp catch off Shami in the slips.\n\nSouth Africa are 41/4.\n\nFollow #INDvSA LIVE \u25b6\ufe0f https://t.co/MO1tirNpXK https://t.co/wW0Y4Sh4SM \ud83c\uddee\ud83c\uddf3 have plenty to smile about. They lead by 565 runs in the second Test.\n\n\ud83c\uddff\ud83c\udde6 are struggling on 36/3 but with Faf du Plessis and  Quinton de Kock still to come, they would be hoping to fight back.\n\nFollow #INDvSA LIVE \u25b6\ufe0f https://t.co/MO1tirNpXK https://t.co/vjuJLtZnWk Mirror image \ud83d\udc65 https://t.co/RWaqRS36aL ICYMI:\n\nKohli breaks records with Test-best double ton.\n\n#INDvSA DAY TWO REPORT \ud83d\udc47  https://t.co/nlzyVUe0qf Profile picture \ud83d\ude00 vs tagged picture \ud83d\ude29 https://t.co/DeB4erM3FW Who else needs a seat after a long day in the field? \ud83d\ude4b\u200d\u2642\ufe0f \n\n#INDvSA https://t.co/rfGcnl1mVT ICYMI:\n\n\u2b06\ufe0f Jess Jonassen\n\u2b06\ufe0f Alyssa Healy https://t.co/ML7LmdxTcV Caption this! https://t.co/VVJvldhJoC ICYMI: https://t.co/hDgIln9RgP With his 254* today, @imVkohli has become the fastest player to 21000 international runs \ud83d\udc4f \n\nHe reached the mark in 38 fewer innings than the previous record-holder, @sachin_rt!\n\n#INDvSA https://t.co/xiv3tOQiF6 India recorded a comfortable five-wicket victory over South Africa to seal a series win.\n\n#INDvSA MATCH REPORT \ud83d\udc47  https://t.co/VLpHPtvnt6 India built a huge lead on day two, and then made early inroads into the South African batting.\n\n#INDvSA DAY TWO REPORT \ud83d\udc47  https://t.co/nlzyVUe0qf Leg one completed \u2705 \n\nNow the Women's Global Development Squad travel from \ud83d\udeeb Melbourne \u27a1\ufe0f \ud83d\udeec Hobart.\n\nBest of luck to them in their two games against the combined Hobart Hurricanes \ud83c\udf2a\ufe0f and Tasmanian Tigers \ud83d\udc2f side! https://t.co/vS9eh5WkSj \ud83d\udde3\ufe0f \"We have watched these players, but to really come out and perform against the best T20I side in the world, it was amazing.\"\n\nAshantha de Mel heaped praise on Sri Lanka youngsters after their performance in Pakistan \ud83d\udc47\n\nhttps://t.co/hDgIln9RgP The end of a dream day for India!\n\nThey have reduced South Africa to 36/3 at stumps, still trailing by 565 runs.\n\n#INDvSA SCORECARD \u25b6\ufe0f https://t.co/MO1tirNpXK https://t.co/Mzo3r1x9aY Harmanpreet Kaur guides India to victory!\n\nThe hosts win by five wickets as Kaur finishes unbeaten on 39 from just 27 balls. \n\n#INDvSA SCORECARD \ud83d\udc47\nhttps://t.co/lBYx2aTNOg https://t.co/XByT3u3OQT \ud83d\udd39 125 runs\n\ud83d\udd39 221 balls\n\ud83d\udd39 19 fours\n\nDavid Warner was on \ud83d\udd25 in the Sheffield Shield today!\n\nhttps://t.co/irD7vrntWb Ravindra Jadeja falls for 91 and India have declared on 601/5.\n\nVirat Kohli finishes unbeaten on 254. What an innings. \n\nFollow #INDvSA LIVE \u25b6\ufe0f https://t.co/MO1tirNpXK https://t.co/7qwuFlLc6i The runs continue to flow. \n\nVirat Kohli has passed his Test best.\n\n#INDvSA https://t.co/7OT6sr2Oau Mithali Raj has passed fifty for India and is enjoying a very productive partnership with Punam Raut. \n\nFollow the action live \ud83d\udc47\nhttps://t.co/lBYx2aTNOg https://t.co/Znpmxc2lqU Ravindra Jadeja has scored his 12th Test fifty! \n\nIndia are on top in Pune.\n\nFollow #INDvSA LIVE \u25b6\ufe0f https://t.co/MO1tirNpXK https://t.co/oZ8FgM96Lt 2\ufe0f\u20e30\ufe0f\u20e30\ufe0f\u20e3*\n\nVirat Kohli registers his seventh double hundred in Tests. He also reaches 7000 runs in the format.\n\nMaster \ud83d\ude4c\n\nFollow #INDvSA LIVE \u25b6\ufe0f https://t.co/MO1tirNpXK https://t.co/JgfLVIbJu1 TEA in Pune \ud83c\udf75\n\nVirat Kohli is unbeaten on 194, and India look dangerous at 473/4.\n\nFollow #INDvSA LIVE \u25b6\ufe0f https://t.co/MO1tirNpXK https://t.co/bh7QvN8k4q India women have started slow in the chase, but haven't lost any wickets yet.\n\nThe hosts are 20/0 after five overs.\n\nFollow the action live \ud83d\udc47\nhttps://t.co/lBYx2aTNOg https://t.co/ycFKbGpdRg 150 for Virat Kohli \ud83d\udc4f\n\nWhat a batsman, what a player!\n\nFollow #INDvSA LIVE \u25b6\ufe0f https://t.co/MO1tirNpXK https://t.co/mM3QLMHDHN WICKET!\n\nAjinkya Rahane walks. Maharaj makes the breakthrough for South Africa \u261d\ufe0f\n\nFollow #INDvSA LIVE \u25b6\ufe0f https://t.co/MO1tirNpXK https://t.co/Wx4K1bdl1n A quick 44 from Mignon du Preez helps South Africa women finish on 247/6.\n\n\ud83c\uddff\ud83c\udde6's Laura Wolvaardt top-scored with a 98-ball 69, while \ud83c\uddee\ud83c\uddf3's Shikha Pandey, Ekta Bisht and Poonam Yadav picked up two wickets apiece. \n\nSCORECARD \u25b6\ufe0f https://t.co/lBYx2aTNOg https://t.co/vfyGFNNgBD \ud83e\udd57 LUNCH in Pune!\n\nIndia's session. Virat Kohli (104*) and his Ajinkya Rahane (58*) have looked excellent in the middle. The hosts are 356/3.\n\n#INDvSA SCORECARD \u25b6\ufe0f https://t.co/MO1tirNpXK https://t.co/4FiRXbCQkE South Africa women are 160/3 after 37 overs. They were going strong at 127/1, but then lost two wickets within five overs.\n\nShikha Pandey claimed both the scalps!\n\nFollow the action live \ud83d\udc47\nhttps://t.co/lBYx2aTNOg https://t.co/NmABuOp8ts 1\ufe0f\u20e30\ufe0f\u20e30\ufe0f\u20e3 *\n\n\ud83d\udc49 26th Test century\n\ud83d\udc49 69th international century\n\ud83d\udc49 12th Test century in India\n\nVirat Kohli \ud83d\udc4f\ud83d\udc4f \n\nFollow #INDvSA LIVE \u25b6\ufe0f https://t.co/MO1tirNpXK https://t.co/SJjBXizM19 20th Test half-century for Ajinkya Rahane!\n\nThis is his third 50-plus score in four Tests \ud83d\ude4c\n\nFollow #INDvSA LIVE \u25b6\ufe0f https://t.co/MO1tirNpXK https://t.co/RAyZXwN5cx #OnThisDay in 2002, the extraordinary Sharjah Test between Pakistan and Australia began. \ud83c\uddf5\ud83c\uddf0 were bowled out for 59 and 53, as \ud83c\udde6\ud83c\uddfa won by an innings and 198 runs!\n\nThe Test was over in just two days \ud83e\udd2f\n\nWhich Warnie were you after the game? \ud83d\ude05 https://t.co/ymd8U2S0lO 50* \n\n15th ODI half-century for Laura Wolvaardt. It has been an impressive knock from the South Africa opener \ud83d\udc4f\n\nFollow the action live \ud83d\udc47\nhttps://t.co/lBYx2aTNOg https://t.co/yOiZkSljKs DRINKS in Pune! \n\nIndia were wicketless in the first hour of play, with both Kohli and Rahane looking good. The score is 314/3. \n\nFollow #INDvSA LIVE \ud83d\udc47\nhttps://t.co/MO1tirNpXK https://t.co/ZusOLzDSX2 South Africa women are 46/0 after 10 overs.\n\nOpeners Laura Wolvaardt and Lizelle Lee are at the crease. The visitors have looked good so far.\n\nFollow the action live \ud83d\udc47\nhttps://t.co/lBYx2aTNOg https://t.co/fWuIUOWVOR India start day two of the second Test with Virat Kohli (63*) and Ajinkya Rahane (18*) at the crease. \n\nThe hosts are 273/3. How many runs can they get from here?\n\nFollow #INDvSA LIVE \ud83d\udc47\nhttps://t.co/MO1tirNpXK https://t.co/cUMV5kYozX India have opted to bowl in the second women's ODI against South Africa in Vadodara.\n\nFollow the action live \ud83d\udc47\nhttps://t.co/lBYx2aTNOg https://t.co/7pOF4ZOiTQ Thumbs up if you were pleased with this man's knock yesterday \ud83d\udc4d\n\nIs Test ton No. 26 on its way? \ud83e\udd14\n\n#INDvSA https://t.co/n6lmGAMhCZ Mayank Agarwal hit his second century in as many Tests, while Virat Kohli was at his imperious best, but the the excellence of Kagiso Rabada kept South Africa just about in the hunt on the first day of the second Test at Pune.\n\n#INDvSA REPORT \ud83d\udc47\nhttps://t.co/lYcrsmfGCY Tests: 2\ufe0f\u20e33\ufe0f\u20e3 \nWickets: 1\ufe0f\u20e31\ufe0f\u20e33\ufe0f\u20e3\nAverage: 2\ufe0f\u20e33\ufe0f\u20e3.5\ufe0f\u20e32\ufe0f\u20e3\nBest: 7\ufe0f\u20e3/1\ufe0f\u20e31\ufe0f\u20e37\ufe0f\u20e3\n\nWhat a bowler!\n\nHappy birthday, Ryan Harris \ud83e\udd8f https://t.co/umYuHzfCzs Her three ODI five-wicket hauls is a @WHITE_FERNS record \ud83d\udd90\ufe0f \n\nHappy birthday, Holly Huddleston \ud83c\udf82 https://t.co/od1kPwrJzJ Highlights of Australia's record streak of 18 wins in women's ODIs in photos \ud83d\udcf8\n\nhttps://t.co/j3YPM75JNZ Guess who \ud83d\udc40 https://t.co/lQEoOnx56L Caption this \ud83c\udfa4\ud83c\udfa4\n\n#INDvSA https://t.co/DnEXv55U4i \"To experience the hospitality of Pakistan is a great thing.\"\n\nSri Lanka coach Rumesh Ratnayake is pleased with the reception \ud83c\uddf1\ud83c\uddf0 received in \ud83c\uddf5\ud83c\uddf0 and hopes other countries will follow their lead.\nhttps://t.co/p4EsYUDZms @SportsCenter \"No way, you cannot do that Ben Stokes!\"\n\nhttps://t.co/rpN04OxVTk South Africa ace paceman Dale Steyn was all praise for the Australia star batsman Steve Smith. https://t.co/2ri9YA5GQx India finish day one on 273/3 \u2013 it's been a strong day for the hosts. \n\nMayank Agarwal hit 108, while Virat Kohli finishes the day at the crease unbeaten on 63. \n\n#INDvSA SCORECARD \ud83d\udc47 \nhttps://t.co/MO1tirNpXK https://t.co/wJptHKbMdt #NewCoverPic https://t.co/jn5RqaqzH3 England fast bowler James Anderson to train at Manchester City's home ground in a bid to recover from his prolonged calf injury.\n\nDetails \ud83d\udc47\nhttps://t.co/PB2b9S1fAn Mayank Agarwal follows up his double ton in Visakhapatnam with another superb century in Pune.\n\nIndia are closing in on the 200-run mark. What should South Africa do to stop them?\n\nFollow #INDvSA live \ud83d\udc47 \nhttps://t.co/MO1tirNpXK https://t.co/8Q6drdYOx2 \u2615 It's Tea time in Pune!\n\nRabada breaks the 138-run second-wicket stand by dismissing Pujara for 58 but Agarwal is rapidly approaching his second Test ton.\n\nIndia cruising on 168/2 in 53 overs.\n\nFollow #INDvSA live \ud83d\udc47 \nhttps://t.co/MO1tirNpXK https://t.co/uS691M1qhm South Africa's @kappie777 has stormed into the top five in the latest @MRFWorldwide ICC Women's ODI Player Rankings for all-rounders.\n\nFull rankings: https://t.co/M0I1Yjs5Fi https://t.co/Ik6lSRhCjq 22nd Test fifty for Cheteshwar Pujara \ud83d\udc4f \n\nWill he be able to convert this into a three-figure score?\n\nFollow #INDvSA live \ud83d\udc47 \nhttps://t.co/MO1tirNpXK https://t.co/X47PFYeNcc Jess Jonassen secures top spot as she swaps places with Megan Schutt. \ud83c\udde6\ud83c\uddfa continue to rule the latest @MRFWorldwide ICC Women's ODI Player Rankings for bowling.\n\nFull rankings: https://t.co/13fU9egaN1 https://t.co/HPpHVuvbAA \u2197\ufe0f Alyssa Healy\n\u2197\ufe0f Meg Lanning\n\nAfter their ODI series sweep over Sri Lanka, Australia players sizzle in the latest @MRFWorldwide ICC Women's ODI Player Rankings for batting.\n\nFull rankings: https://t.co/jMaQLEZDnD https://t.co/CN0hhVhFPu #OnThisDay in 2003, Australia opener Matthew Hayden scored the then highest individual Test score of 380, in Perth. \n\nHis 437-ball knock is still the second-highest Test score by a batsman in an innings. \ud83d\ude4c https://t.co/YCLNkVyNsU Mayank Agarwal gets his fourth Test fifty and has now put up a 76-run stand with Cheteshwar Pujara.\n\nIndia are 101/1 after 34 overs.\n\nFollow #INDvSA live \ud83d\udc47 \nhttps://t.co/MO1tirNpXK https://t.co/P7oZ8O4C4o \"I'm very happy that I don't have to play Test matches against him ever again.\"\n\nSouth Africa paceman Dale Steyn has hailed Steve Smith for his impeccable consistency in Test cricket.\n\nhttps://t.co/2TcWCpm78o \ud83c\udf5b Lunch time!\n\nAgarwal and Pujara bring up the fifty partnership after Rohit's wicket. India look strong on 77/1 after 25 overs.\n\nCan South Africa claw their way back in the second session?\n\n#INDvSA live \ud83d\udc47 \nhttps://t.co/MO1tirNpXK https://t.co/IPseAJH2eh Vernon Philander so far today: 7-1-8-0 \ud83d\udd25 \n\n#INDvSA live \ud83d\udc47 \nhttps://t.co/MO1tirNpXK https://t.co/pOFNCMNReT The New Zealand paceman made 43 Test and 78 ODI appearances, claiming 219 international wickets.\n\nHe returned match-winning figures of 10/144 in New Zealand's first-ever away Test win over England.\n\nHappy birthday, Lance Cairns! https://t.co/MRrWTO7e9B The Rohit Sharma magic fails to work this time. He is out for 14.\n\nIndia are 25/1 after 10 overs.\n\n#INDvSA live \ud83d\udc47 \nhttps://t.co/MO1tirNpXK https://t.co/cZBu8NFFxe Steady start for the hosts after first 30 minutes of play.\n\nA few appeals and LBW shouts had the openers troubled, but they have managed to survive. India are 14/0 in 7 overs.\n\n#INDvSA live \ud83d\udc47 \nhttps://t.co/MO1tirNpXK https://t.co/QLNmhIDRMV \ud83c\uddee\ud83c\uddf3 have won the toss and elected to bat. Will they carry on their batting form from the previous Test? Or do \ud83c\uddff\ud83c\udde6 have a better plan to counterattack this time?\n\nFollow the second #INDvSA Test live \ud83d\udc47 \nhttps://t.co/MO1tirNpXK https://t.co/sPbIubxhAH ICYMI: Oshada Fernando's blazing fifty and disciplined bowling helped Sri Lanka set up a 13-run win over Pakistan. \n\n#PAKvSL REPORT \ud83d\udc47\nhttps://t.co/XIv4tTBdDq Can South Africa level the series or will India make it 2-0 in Pune?\n\nThe second Test preview \ud83d\udc47 \nhttps://t.co/MabQVIUvn5 Six matches\nSix innings\nTwo half-centuries\nAn average of 45.80\n\nSurendran Chandramohan has enjoyed the start of his ODI career for Singapore.\n\nFind out about his amazing journey to the Singapore national team \ud83d\udc47 https://t.co/7r5AmCC9Ie \"My mind was saying keep going, but my body had shut down and wouldn't let me do anything.\"\n\nAfter an incredible 2019 Ashes series, Steve Smith was ready for a well-earnt rest!\nhttps://t.co/9QQdzUcR6M An ODI debut to remember for Priya Punia.\n\n#INDvSA 1st ODI report \ud83d\udc47 \nhttps://t.co/U2iekqmE5P \u261d\ufe0f Antonius Staal\n\u261d\ufe0f Colin Ackermann\n\u261d\ufe0f Roelof van der Merwe\n\nOman's Khawar Ali took a hat-trick for his country against Netherlands today as his side went on to win the game by seven wickets \ud83d\udd25 https://t.co/fnTJ2f3rXl \ud83d\ude4c #SpiritOfCricket \ud83d\ude4c https://t.co/vrC7vQjfPy ICYMI \ud83d\udc47 \nhttps://t.co/Utp3C7svig \ud83d\udea8 Sri Lanka win the final T20I and win the series 3-0! \ud83d\udea8\n\nOshada Fernando hit 78* and a very disciplined performance from the Sri Lankan bowlers saw Pakistan fall 13 runs short \ud83d\udd25 https://t.co/hF2wRV4PtV Fifty for Haris Sohail!\n\nBabar Azam has departed and the required run-rate is almost 10.\n\n#PAKvSL https://t.co/5CTD9wBARN Pakistan require 85 runs to win from 60 balls in the final T20I, they have nine wickets in-hand.\n\nCan they do it?\n\nSCORECARD \u27a1\ufe0f https://t.co/5sBsE17y6S https://t.co/95RX1piezK Pakistan require 148 to win the final T20I of the series.\n\nSri Lanka's Oshada Fernando the star for his side hitting a 48-ball 78 \ud83d\udc4f \n\nSCORECARD \u27a1\ufe0f https://t.co/5sBsE17y6S https://t.co/Ol62QTm7Ee First T20I appearance \u2705 \nFirst T20I half-century \u2705 \n\nGood going from Sri Lanka's Oshada Fernando \ud83d\udc4f https://t.co/lEA4WpNgoj A good start with the ball from Pakistan, Mohammad Amir currently has figures of 2/7 from two overs \ud83d\udd25 \n\nSri Lanka 72/4 after 10 overs! https://t.co/6kffNbCWKH RT @T20WorldCup: That feeling when you walk into the @MCG for the first time... \ud83d\ude32\n\n@ThailandCricket https://t.co/27gXVjUJR9 Sri Lanka have won the toss and will bat first in the final T20I of the series between Pakistan and Sri Lanka.\n\n#PAKvSL \u27a1\ufe0f https://t.co/5sBsE17y6S https://t.co/UYPwxIlvxT 1st T20I: \ud83c\uddf1\ud83c\uddf0\n2nd T20I: \ud83c\uddf1\ud83c\uddf0\n3rd T20I: \u2753\n\nWill the visitors sweep the series or will Pakistan turn things around in the final T20I today?\n\n#PAKvSL PREVIEW \ud83d\udc47\nhttps://t.co/HUFbSW9dOL 1\ufe0f\u20e38\ufe0f\u20e3 and counting.\n\n#NewCoverPic https://t.co/DWt27QiS6g India win the first ODI against South Africa by eight wickets \ud83d\udcaa\n\nPriya Punia was the star, notching 75* on debut to see her side home \ud83d\udc4f\n\n#INDvSA SCORE \ud83d\udc47\nhttps://t.co/KihdZlkt6O https://t.co/6zAbyNGspc The wicket-keeper batsman has represented Sri Lanka in 64 matches, scoring 2,151 runs, including a career-best 154* against India in 2009.\n\nHe also has 128 catches and 33 stumpings to his name.\n\nHappy birthday Prasanna Jayawardene! https://t.co/JBRAXaGn2J A half-century on ODI debut for Priya Punia \ud83d\udc4f\n\nIndia are closing in on victory over South Africa.\n\n#INDvSA LIVE \ud83d\udc47\nhttps://t.co/KihdZlkt6O https://t.co/fgp68oYJDR #OnThisDay in 1987, Australia sealed a thrilling victory over India in an exciting World Cup contest.\n\nGeoff Marsh's brilliant 110 powered \ud83c\udde6\ud83c\uddfa to 270/6 before Steve Waugh claimed the last wicket of Maninder Singh on the penultimate ball to set up a memorable one-run win. https://t.co/NOT2cE5IaH 5\ufe0f\u20e30\ufe0f\u20e3*\n\nJemimah Rodrigues brings up her second ODI half-century in 62 balls.\n\nWhat a knock it has been from the teenager!\n\nFollow #INDvSA live \ud83d\udc47\nhttps://t.co/KihdZlkt6O https://t.co/67375cxr3a ICC Women's Global Development Squad's @hmrowey was on \ud83d\udd25 against Victoria XI! https://t.co/bsKygZbnIs Disciplined bowling and an Alyssa Healy masterclass led Australia to a record win in Brisbane, beating Sri Lanka by nine wickets in the final #AUSvSL ODI. \n\nREPORT \ud83d\udc47\nhttps://t.co/sV9SPc2QOh Australia in Women's ODIs since March 2018:\n\n\ud83c\uddee\ud83c\uddf3 \u279d \ud835\udce6\n\ud83c\uddee\ud83c\uddf3 \u279d \ud835\udce6\n\ud83c\uddee\ud83c\uddf3 \u279d \ud835\udce6\n\ud83c\uddf5\ud83c\uddf0 \u279d \ud835\udce6\n\ud83c\uddf5\ud83c\uddf0 \u279d \ud835\udce6\n\ud83c\uddf5\ud83c\uddf0 \u279d \ud835\udce6\n\ud83c\uddf3\ud83c\uddff \u279d \ud835\udce6\n\ud83c\uddf3\ud83c\uddff \u279d \ud835\udce6\n\ud83c\uddf3\ud83c\uddff \u279d \ud835\udce6\n\ud83c\udff4\udb40\udc67\udb40\udc62\udb40\udc65\udb40\udc6e\udb40\udc67\udb40\udc7f \u279d \ud835\udce6\n\ud83c\udff4\udb40\udc67\udb40\udc62\udb40\udc65\udb40\udc6e\udb40\udc67\udb40\udc7f \u279d \ud835\udce6\n\ud83c\udff4\udb40\udc67\udb40\udc62\udb40\udc65\udb40\udc6e\udb40\udc67\udb40\udc7f \u279d \ud835\udce6\n\ud83c\udf34 \u279d \ud835\udce6\n\ud83c\udf34 \u279d \ud835\udce6\n\ud83c\udf34 \u279d \ud835\udce6\n\ud83c\uddf1\ud83c\uddf0 \u279d \ud835\udce6\n\ud83c\uddf1\ud83c\uddf0 \u279d \ud835\udce6\n\ud83c\uddf1\ud83c\uddf0 \u279d \ud835\udce6\n\nUnstoppable.\n\n#AUSvSL | @AusWomenCricket https://t.co/VwFLvmFWWT Marizanne Kapp scored a fighting 64-ball 54 before India bowled South Africa out for 164 in the first #INDvSA ODI in Vadodara.\n\nCan the hosts chase down the target?\n\nFollow the action live \ud83d\udc47\nhttps://t.co/KihdZlkt6O https://t.co/ri07ZqFQT3 Australia sweep #AUSvSL ODI series 3-0!\n\nA brilliant 112* from Alyssa Healy and fifty from Rachael Haynes power their side to a comprehensive nine-wicket win over Sri Lanka.\n\nThis is Australia's 18th women's ODI win in a row \ud83d\udd25\n\nSCORECARD \ud83d\udc47\nhttps://t.co/2VxQijCbYb https://t.co/7INNg9mmcu Fifty up for Rachael Haynes!\n\nThe Australia opener brings up her third consecutive fifty-plus score in this #AUSvSL ODI series \ud83d\udd25\n\nLive updates \ud83d\udc47\nhttps://t.co/2VxQijCbYb https://t.co/BCCRx7Tzt0 India have reduced South Africa to 89/4!\n\nDeepti Sharma gets the big wicket of Laura Wolvaardt, who falls for 39.\n\nFollow #INDvSA 1st ODI live \ud83d\udc47\nhttps://t.co/nY2fERKr5r https://t.co/Vdr5bP1maA Alyssa Healy reaches her fifty in Brisbane!\n\nThe Australia opener is leading from the front, bringing up a quick 31-ball half-century \u2013 her 11th in ODIs.\n\nFollow #AUSvSL live \ud83d\udc47\nhttps://t.co/2VxQijCbYb https://t.co/9Mjlce1nvb \"We failed overall, we are struggling in every department.\"\n\nHead coach Misbah-ul-Haq reflects on Pakistan's defeat to Sri Lanka in the first two T20Is of the ongoing #PAKvSL series.\n\nhttps://t.co/K1fa4g66Gq Sri Lanka opener Chamari Athapaththu's fighting century lifts her side to 195/8 in the final ODI in Brisbane.\n\nCan the visitors defend the total? Will Australia sweep the series? \n\nLive updates \ud83d\udc47\nhttps://t.co/2VxQijCbYb https://t.co/RLVEsZKtly Toss news from Vadodara!\n\nSouth Africa skipper Sune Luus has opted to have a bat in the first #INDvSA women's ODI.\n\nLIVE: https://t.co/nY2fERKr5r https://t.co/AO5vcjrZCq Hundred up for Chamari Athapaththu! \ud83d\udc4f\n\nThe Sri Lanka opener brings up her fifth ODI century \u2013 her second against Australia \u2013 in the final #AUSvSL match in Brisbane.\n\nFollow the action live \ud83d\udc47\nhttps://t.co/2VxQijCbYb https://t.co/yPGZnftGsO ICYMI:\n https://t.co/MgfPSX183W Chamari Athapaththu has brought up a brisk half-century, but half of \ud83c\uddf1\ud83c\uddf0's batters are already in the hut with the total just past 100. \ud83c\udde6\ud83c\uddfa bowlers have been on \ud83d\udd25 in the third ODI. https://t.co/1G20BrXTcy The Women's Global Development Squad have been having a blast in Melbourne!\n\nThey play their first game against a combined Melbourne Stars and Melbourne Renegades side today. https://t.co/PZMWBDx0nt Good luck to everyone competing at the @INASsport Global Games in Brisbane this month!\n \nEspecially good luck to those cricketers representing their countries and the sport in the games!\n\n#Brisbane2019 https://t.co/Ux2eaYmfnc \ud83d\udcac \"Winning a World Cup medal with your country would be a big highlight.\"\n\nDale Steyn has big plans for next year's #T20WorldCup! https://t.co/lGK65r4bOj 1\ufe0f\u20e34\ufe0f\u20e32\ufe0f\u20e3 and 1\ufe0f\u20e31\ufe0f\u20e33\ufe0f\u20e3 in ODIs \ud83d\udc4f \n1\ufe0f\u20e31\ufe0f\u20e38\ufe0f\u20e3 in a Test \ud83d\udc4f \n1\ufe0f\u20e32\ufe0f\u20e34\ufe0f\u20e3 in a T20I \ud83d\udc4f \n\nKevin O'Brien joins an elite list. https://t.co/o1f8VqTIGI They slid to a series defeat yesterday, but can Pakistan avoid the whitewash when they play Sri Lanka tomorrow?\n\n#PAKvSL https://t.co/P1HlsAfo2M Which cricketer would you love to have a selfie with \ud83e\udd33 https://t.co/fxG8eydFwN \ud83d\udcaf Centurions from India\n\ud83d\udcaf Centurions from South Africa\n\ud83d\udcaf Centurions from Australia\n\nThe latest instalment of #OnTheUp is filled with \u2013 you guessed it right \u2013 hundreds!\n\nhttps://t.co/lJ98yshzZD ICYMI: https://t.co/6c4svoV2pJ \ud83d\udcac \"I lived on a potato farm in a very small place in England called Pidley. My dad was a farmer and I had an older brother. We used to play cricket for hours.\"\n\nThe inspiring story of Charlotte Edwards, in her own words \ud83d\udc47\n\nhttps://t.co/e727gF2GZI Smriti Mandhana, the No.1 batter in the @MRFWorldwide Women's ODI Rankings, has been ruled out of India's ODI series against South Africa with a fractured toe.\n\nSeam-bowling all-rounder Pooja Vastrakar has been called up as her replacement. https://t.co/fwwgGR5B0b \ud83d\udc55 69 international appearances\n\ud83c\udfcf 1695 runs\n\ud83c\udfc6 Represented Bangladesh at ICC Men's @CricketWorldCup 2011\n\nHappy birthday Raqibul Hasan! \ud83c\udf70 https://t.co/jlohNMEmfG Australia pacer Jason Behrendorff will play no further part in the 2019-20 season.\n\nDetails \ud83d\udc47\n\nhttps://t.co/SZrq7zRROg \"I never thought I would get the opportunity, I am truly grateful for it.\"\n\nFind out about the ECB City Cup \ud83d\udc47 https://t.co/gQrZZgzg8q \ud83d\udcac \"It's tough and probably is not going to sink in for a while. At the same time, to get to a final like that and put on a performance like that, hopefully, we can inspire the next set of Black Caps.\"\n\nLockie Ferguson on the #CWC19 final \ud83d\udc47\n\nhttps://t.co/JaCx3IJLaj An important series \ud83d\ude4c\n\n#PAKvSL https://t.co/o92xrDKKwG IN: Steve Smith, David Warner, Mitchell Starc\nOUT: \u2753\n\nDetails \ud83d\udc47\n\nhttps://t.co/5oxLL7i92N Happy birthday Fawad Alam!\n\nThe Pakistan batsman averages 41.66 in three Test matches and 40.25 in 38 ODI appearances \ud83d\udc4f https://t.co/R3ILGwsLfM Marcus Harris in\n\nThe 2019 #Ashes \ud83d\udc49 58 runs at 9.66\nThe 2018-19 Sheffield Shield \ud83d\udc49 1188 runs at 69.88\n\nCan he turn things around and shine once again in the Australian domestic competition this year?\n\nhttps://t.co/DKYmYHbVDm Australia in women's ODIs since November 2017:\n\nPlayed \u25b6\ufe0f 17\nWon \u25b6\ufe0f 17\n\nDominance \ud83d\udcaa https://t.co/eWYmtZXoW8 A superb all-round team performance helped Sri Lanka seal the T20I series over Pakistan.\n\nReport \ud83d\udc47 \nhttps://t.co/f82bdoecCK #OnThisDay in 1987, the fourth edition of the men's Cricket World Cup got underway in Hyderabad!\n\nJaved Miandad made a century and passed 4,000 ODI runs in the process.\n\nCan you remember who went on to win the trophy? \ud83c\udfc6 https://t.co/5JfUygsw8P \ud83c\udfcf Tests \u2013 79\n\ud83c\udfcf Runs \u2013 6149\n\ud83c\udfcf Average \u2013 48.41\n\nHe scored a century on Test debut at 19 years of age, and remains Australia men's youngest centurion in international cricket \ud83d\udcaf\n\nHappy 91st birthday to Neil Harvey, an all-time great \ud83d\ude4c https://t.co/BSV4CHxgRI The match-winners \ud83c\udf1f \n\n#PAKvSL https://t.co/cRbE6jrzRM Jess Jonassen's ODI career:\n\n6\ufe0f\u20e37\ufe0f\u20e3 caps\n1\ufe0f\u20e30\ufe0f\u20e31\ufe0f\u20e3 wickets\n2\ufe0f\u20e30\ufe0f\u20e3.5\ufe0f\u20e39\ufe0f\u20e3 bowling average\n\nOnly three women have taken more ODI wickets for Australia, and she's only 26 \ud83d\udc4f https://t.co/ynf1F3nzuI #OnThisDay in 2012 West Indies won the T20 World Cup, beating Sri Lanka in the final \ud83c\udfc6 \n\nWhere did you watch the final? https://t.co/BlGVAsrkXm Just some of the exciting talent Chris Silverwood will have at his disposal as head coach of the England men's team! https://t.co/S47vCSUVnm Day three of the Oman T20I series saw Nepal and Ireland secure victories.\n\nDaily wrap \ud83d\udc47 \nhttps://t.co/G3huO9Xsdt #NewCoverPic https://t.co/62KkePD9qO Sri Lanka win and seal the T20I series!\n\nWanindu Hasaranga took three wickets in an over to put his side in the driving seat, Sri Lanka going on to win by 35 runs.\n\nNuwan Pradeep also recorded figures of 4/25 \ud83d\udd25 \n\n#PAKvSL https://t.co/eGJavLgBUZ Imad Wasim departs for 47, his top score in T20Is and with that surely the game is now out of Pakistan's reach.\n\nIsuru Udana with the key wicket \ud83d\ude4c \n\nPakistan require 56 runs from the final 4 overs! https://t.co/TfaQ5smdJn Three wickets in four balls for Wanindu Hasaranga as he bowls Sarfaraz Ahmed!\n\nPakistan in all sorts of bother at 52/5.\n\n#PAKvSL https://t.co/75ZESAj4HG Wanindu Hasaranga has two wickets in two balls!\n\nFirst he gets Ahmed Shehzad bowled and then Umar Akmal is trapped lbw.\n\nBack-to-back first ball dismissals for Akmal on his return to the Pakistan side \ud83d\ude2c \n\n#PAKvSL https://t.co/OrsCVOixX1 What a start from Sri Lanka \ud83d\udd25 \n\nPakistan slip to 19/2 after 4 overs.\n\nSCORECARD \u27a1\ufe0f https://t.co/ky227OiPEO https://t.co/Z5WdQ3MXn8 Sri Lanka set Pakistan 183 to win the second T20I.\n\nHow much will Sri Lanka come to regret losing three wickets to run outs? https://t.co/gyJd4lDOPm The second T20I is in the balance at the halfway stage of the Sri Lanka innings!\n\nThe visiting side are 80/2\n\nSCORECARD \u27a1\ufe0f https://t.co/ky227OiPEO https://t.co/DI4ZWuXyI6 Sri Lanka have won the toss and will bat first in the second T20I.\n\nCan Pakistan level the series or will Sri Lanka take an unassailable 2-0 lead? https://t.co/f0kPaSdf45 He scored his country's first ever Test century and now he has scored their first ever T20I \ud83d\udcaf \n\nHis blazing 62-ball 124 powered his side to 208/5 \u2013 their third highest T20I total \u2013 against Hong Kong \ud83d\udd25 \n\nWhat an amazing servant Kevin O'Brien has been to Irish cricket \ud83d\ude4c https://t.co/ffltoQB0Ea \"Both are experienced players, and once they settle in, they will perform. I give my full backing for them as a captain.\"\n\n\ud83c\uddf5\ud83c\uddf0 skipper Sarfaraz Ahmed is not worried about his underperforming players just yet \ud83d\udc47\n\nhttps://t.co/sON8QwN8M9 RT @T20WorldCup: #OnThisDay in 2012, West Indies clinched their maiden #T20WorldCup title with a 36-run victory over Sri Lanka \ud83d\udd7a https://t.\u2026 More information on Chris Silverwood's appointment as Head Coach of the England men's side \ud83d\udc47 \nhttps://t.co/9QrYGFZzNV \ud83d\udea8 Just in \ud83d\udea8 \n\nChris Silverwood has been appointed Head Coach of the England's men team!\n\nWhat do you make of that appointment England fans? https://t.co/eZswO7uLqF \ud83c\udde6\ud83c\uddfa consolidate their lead at the top in both @MRFWorldwide ICC Women's ODI and T20I Team Rankings \ud83d\ude4c \n\nHow have the other teams performed? Check out the latest rankings update \u2b07\ufe0f \nhttps://t.co/0uGPG22iOS Australia extend their winning streak in ODIs to 17 games \ud83e\udd2f\n\nWhat a performance from the hosts, they have sealed the three-match series 2-0 \ud83d\udc4f\n\n#AUSvSL SCORECARD \u25b6\ufe0f https://t.co/qllCrZl3Rw https://t.co/XsVHzGbHbZ FIRST international wicket for Heather Graham. Achini Kulasuriya is dismissed for 1.\n\nAustralia need just one wicket to win the series!\n\nFollow #AUSvSL LIVE \ud83d\udc47\nhttps://t.co/qllCrZl3Rw https://t.co/JdG8YcP22S #OnThisDay in 2004, Michael Clarke scored a century against India on his Test debut in Bangalore. https://t.co/8XPBDbCCC8 Sri Lanka are 123/4 after 30 overs, with Nilakshi de Silva and skipper Shashikala Sririwardene at the crease.\n\nJess Jonassen has figures of 2/20 in her four overs so far.\n\nFollow #AUSvSL LIVE \ud83d\udc47\nhttps://t.co/qllCrZl3Rw https://t.co/OkoAYShF9e When you make your international debut ... \ud83d\ude00\n\n#AUSvSL | @AusWomenCricket https://t.co/3cyXThtsE8 Anushka Sanjeewani and Harshitha Madavi have stitched an unbeaten 50-run partnership for the second wicket.\n\nIt has been a gritty batting performance from Sri Lanka so far.\n\nFollow #AUSvSL LIVE \ud83d\udc47\nhttps://t.co/qllCrZl3Rw https://t.co/Rg1FtV48in \ud83d\udc55 218 international appearances\n\ud83c\udfcf 5347 runs\n\ud83d\udc46 67 wickets\n\nRepresented New Zealand in \n\u25b6\ufe0f ICC Women's @CricketWorldCup 2013 and 2017\n\u25b6\ufe0f ICC Women's @T20WorldCup 2009, 2010, 2012, 2016 and 2018\n\nHappy birthday to the incredible Amy Satterthwaite \ud83c\udf82 https://t.co/x5qBYWvwkg Sri Lanka have started well in the chase, but Australia are keeping the pressure on. \n\nThe visitors are 23/0 in seven overs, with Chamari Athapaththu and Anushka Sanjeewani at the crease.\n\nFollow #AUSvSL LIVE \ud83d\udc47\nhttps://t.co/qllCrZl3Rw https://t.co/zv4V77mVRP Electing to bat first, Australia put up 282/8 in 50 overs. Haynes led the way with her maiden international century, before Sri Lanka fought back with six wickets in the last 10 overs.\n\nCan \ud83c\uddf1\ud83c\uddf0 make it 1-1? Or will \ud83c\udde6\ud83c\uddfa extend their 16-game winning streak in ODIs? https://t.co/8zHS8tld4q Sri Lanka have pulled things back with three wickets in two overs, and Perry, Haynes and Gardner are back in the hut.\n\nAustralia are 252/5 with five overs to go. How many can they get from here? \n\nFollow #AUSvSL LIVE\ud83d\udc47\nhttps://t.co/qllCrZl3Rw https://t.co/d0xwl7O02x \ud83d\udcaf Maiden international hundred for Rachael Haynes. What an innings it has been!\n\nAustralia are rampant in Brisbane \u2013 they reach 225/2 in 41 overs.\n\nFollow #AUSvSL LIVE\ud83d\udc47\nhttps://t.co/qllCrZCEJ4 https://t.co/NnNPFOQqYH \ud83c\uddf5\ud83c\uddf0 and \ud83c\uddf1\ud83c\uddf0 do battle again later today.\n\nSecond T20I preview \ud83d\udc47 \nhttps://t.co/8hFwIKVTAb Rachael Haynes gets her 12th ODI fifty and despite losing Alyssa Healy, Australia are looking good to post a big total in the second ODI.\n\nThey are 155/1 in 28 overs.\n\n#AUSvSL \ud83d\udc47\nhttps://t.co/qllCrZl3Rw https://t.co/D2hc4IijNY 311 Test wickets\n282 ODI wickets\n\nHappy birthday to one of India's greatest ever seam bowlers, Zaheer Khan! https://t.co/syKMeayUzg Let's play \ud83e\udd1d\n\nMeg Lanning has won the toss and elected to bat first at the Allan Border Field in Brisbane!\n\nCan Australia seal the series or will Sri Lanka take it to a decider?\n\n#AUSvSL \ud83d\udc47\nhttps://t.co/qllCrZl3Rw https://t.co/Gc9r340h3S #NewCoverPic https://t.co/sGei7r5Ttk #Squadgoals https://t.co/ma6whl9aRy 1\ufe0f\u20e3.9\ufe0f\u20e36\ufe0f\u20e3 metres tall\n3\ufe0f\u20e30\ufe0f\u20e39\ufe0f\u20e3 Test wickets\n\nHe was one of South Africa's most feared bowlers and had a devastating partnership with Dale Steyn for years \ud83e\udd1c\ud83e\udd1b\n\nHappy birthday Morne Morkel! https://t.co/Ur4xlug3ns Sri Lanka captain Dasun Shanaka signs the T20 Honours Board of the Gaddafi Stadium, Lahore \u270d\ufe0f \n\nHis side won the first T20I by 64 runs \ud83d\udd25 https://t.co/9QfFkyRYx5 \u201cWe've got to improve on our spinners taking 4-5 wickets in the second innings.\"\n\nFaf du Plessis has identified where his side must improve ahead of the second Test.\n\n#INDvSA\nhttps://t.co/nWTk080i2O Whose performance impressed you in the first T20I between Pakistan and Sri Lanka yesterday?\n\n#PAKvSL https://t.co/628VlZe4OR Wins today for Nepal and Oman in the T20I series!\n\nNepal beat Hong Kong by four wickets and Oman beat Ireland by 43 runs.\n\nDaily wrap \ud83d\udc47 \nhttps://t.co/Axzcsr9InW India secured a 203-run victory over South Africa in the first Test in Visakhapatnam.\n\nMohammed Shami (5/35) and Ravindra Jadeja (4/87) were the stars of the final day.\n\n#INDvSA REPORT \ud83d\udc47\n\nhttps://t.co/Nn5HyC4tfy Some valuable match practice for the Bangladesh players ahead of their Test series against India.\nhttps://t.co/KiTs36MCzS Lockie Ferguson on the #CWC19 Final: \"It's surreal honestly. To look back on it is tough. It's probably not going to sink in for a while.\"\n\nWATCH: New Zealand's tearaway on World Cup heartbreak and bowling rockets \ud83d\udc40 https://t.co/EhyWN0mUBY \ud83d\udc49 80 international appearances\n\ud83d\udc49 3868 runs\n\ud83d\udc49 160 wickets\n\ud83d\udc49 Eight centuries\n\n16660 first-class runs \ud83d\udc4f\n\n#OnThisDay in 1946, Tony Greig was born \ud83d\ude4c https://t.co/Zdkm1HedJw 1\ufe0f\u20e37\ufe0f\u20e36\ufe0f\u20e3+1\ufe0f\u20e32\ufe0f\u20e37\ufe0f\u20e3=3\ufe0f\u20e30\ufe0f\u20e33\ufe0f\u20e3\n\nOnly five Indians have scored more in a single Test match \ud83d\udd90\ufe0f\n\nRohit Sharma is Player of the Match \ud83d\udc4f\n\n#INDvSA https://t.co/uhoMPPDWZo \ud83d\udc55 99 international appearances\n\ud83c\udfcf 2044 runs\n\ud83c\udfc6 ICC Women's @T20WorldCup champion: 2010, 2014, 2018\n\ud83c\udfc5 ICC Women's @CricketWorldCup champion: 2013\n\nHappy birthday to Australia's Elyse Villani \ud83c\udf82 https://t.co/H9kjKRwQqd Shami takes the final wicket \u2013 his fifth of the innings \u2013 and closes out a big win for India. That's 40 more ICC World Test Championship points in their kitty!\n\n#INDvSA SCORECARD \ud83d\udc47\nhttps://t.co/dCGJ4Pcug5 https://t.co/HlTk4dU3Kz Mohammed Shami makes the breakthrough! Dane Piedt plays a drive away from the body and chops on at 56. That marks the end of the record ninth-wicket stand at 91.\n\n\ud83c\uddee\ud83c\uddf3 are just a wicket away!\n\nFollow #INDvSA LIVE \ud83d\udc47\nhttps://t.co/dCGJ4Pcug5 https://t.co/NzSdigPcAC Fifty for Dane Piedt! It's been a knock of grit and determination from the \ud83c\uddff\ud83c\udde6 No.10. Can he make this a big one?\n\nFollow #INDvSA LIVE \ud83d\udc47\nhttps://t.co/dCGJ4Pcug5 https://t.co/q0rA5QlOMK Piedt and Muthuswamy have brought up South Africa's highest ninth-wicket partnership against India, giving the visitors something to cheer about.\n\nThey are now 142/8, the current pair contributing 72 to that!\n\nFollow #INDvSA LIVE \ud83d\udc47 \nhttps://t.co/dCGJ4Pcug5 https://t.co/mYbllTsAJi Australia women in ODIs since January 2018:\n\nPlayed \u27a4 16\nWon \u27a4 16\n\nCan they extend their winning streak against Sri Lanka?\n\nhttps://t.co/1XzgQq6Se7 LUNCH! Shami and Jadeja were the stars of that session with three wickets apiece.\n\nBut, Piedt and Muthuswamy have resisted with an unbroken 47-run partnership. How much longer will they keep \ud83c\uddee\ud83c\uddf3 at bay?\n\nFollow #INDvSA LIVE \ud83d\udc47 \nhttps://t.co/dCGJ4Pcug5 https://t.co/2GIiOfMmQh India fans right now... \n\n#INDvSA https://t.co/O1HgWGmQbq What an over by Jadeja!\n\n26.1: Stunning catch off his own bowling to remove Markram\n26.4: Traps Philander in front\n26.5: Traps Maharaj in front\n\nSouth Africa are 70/8, staring at a big defeat.\n\nFollow #INDvSA LIVE \ud83d\udc47\nhttps://t.co/dCGJ4Pcug5 https://t.co/PMeB7TNStB Some more Shami magic as he gets rid of Quinton de Kock now. Each of his three victims has been bowled.\n\nSouth Africa's hopes are rapidly fading! Half their batsmen are back in the hut.\n\nFollow #INDvSA LIVE \ud83d\udc47\nhttps://t.co/dCGJ4Pcug5 https://t.co/Wa60redOIg Mohammed Shami's got one to tail in and Faf du Plessis has lost his off stump, having shouldered arms. South Africa are 52/4.\n\nIndia can sniff victory!\n\nFollow #INDvSA LIVE \ud83d\udc47\nhttps://t.co/dCGJ4Pcug5 https://t.co/20OfIFb1CS The South African top-order is in disarray! After Ashwin bowled Theunis de Bruyn, Mohammed Shami's gone past Temba Bavuma's defences. The visitors are 20/3!\n\nFollow #INDvSA LIVE \ud83d\udc47\nhttps://t.co/dCGJ4Pcug5 https://t.co/j9R3jtEQOW \ud83d\udea8 350 Test wickets for Ravichandran Ashwin \ud83d\udea8 \n\nHe has dismissed Theunis de Bruyn to become the joint-fastest to the milestone alongside Muttiah Muralitharan \u2013 in just 66 matches!\n\nFollow #INDvSA LIVE \ud83d\udc47\nhttps://t.co/dCGJ4Pcug5 https://t.co/I8XVEaBiLZ South Africa have their task cut out. They've to bat out 98 overs if they are to save the first Test, and they've already lost Dean Elgar!\n\nAn exciting fifth day awaits.\n\nFollow #INDvSA LIVE \ud83d\udc47\nhttps://t.co/dCGJ4Pcug5 https://t.co/aPv6WNE4se \ud83d\udd39 One day left\n\ud83d\udd39 Nine wickets to get\n\ud83d\udd39 40 WTC points to be earned\n\nPujara feels confident India's spinners can get the better of South Africa on day five.\n\nhttps://t.co/oDGTQgcrip His efforts might not have resulted in victory yesterday, but how exciting is Mohammad Hasnain? \ud83d\udcaa\n\n19 years old and playing just his second T20I, he breached the 90mph barrier to claim the second T20I hat-trick by a Pakistani \ud83d\udd25\n\n#PAKvSL https://t.co/akiR4Yw8xx ICYMI \ud83d\udc47 \nhttps://t.co/2NDZp4reD3 #OnThisDay Richie Benaud was born!\n\nAn all-rounder, captain of his country and one of cricket's most famous voices \ud83d\ude4c https://t.co/MWJ0BhXU8d So. Many. High. Fives. \ud83d\ude4b https://t.co/u5OV1u94Ua No.8 v No.1 in the @MRFWorldwide T20I Team Rankings?\n\nNo problem for Sri Lanka, who, after seven games without a win in the format, have now recorded back-to-back victories for the first time since March 2018!\n\n#PAKvSL https://t.co/fiGqaoV6Mb Sri Lanka secure their first win of their tour of Pakistan \ud83d\udc4f\n\n#PAKvSL \ud83d\udc47\nhttps://t.co/zQfKjWBqEj https://t.co/sqmtTAXWL7 \ud83c\uddf5\ud83c\uddf0\ud83d\udde3\ufe0f\n\nEven with their team struggling, the fans are still in full voice \ud83d\udcaa\n\n#PAKvSL https://t.co/p2zgf6qRDk \ud83d\ude4c\n\n#PAKvSL https://t.co/KNb8vGXroU Pakistan are fighting back \ud83d\udcaa\n\nThe fourth-wicket stand is now 35* and they require 109 off the last 10 overs.\n\nWhich way is this game headed?\n\n#PAKvSL \ud83d\udc47\nhttps://t.co/zQfKjWBqEj https://t.co/thx4aC3QBk Rohit Sharma made it back-to-back centuries in his first match as India's Test opener.\n\nReport \ud83d\udc47\nhttps://t.co/KWlwZWk5cA No hat-trick for Nuwan Pradeep, but at 15/2, Pakistan are up against it early on!\n\nHow can they respond?\n\n#PAKvSL \ud83d\udc47\nhttps://t.co/zQfKjWBqEj https://t.co/mSku5JdPK2 Two in two balls! Nuwan Pradeep is on a hat-trick!\n\n#PAKvSL https://t.co/2YqI7W62xn Sri Lanka set Pakistan 166 to win the first T20I!\n\nMohammad Hasnain took a hat-trick in just his second T20I \ud83d\udd25 \n\n#PAKvSL https://t.co/lLnSSgRyxu HATTRICK FOR MOHAMMAD HASNAIN!!!! https://t.co/PcbdPJCrHC Sri Lanka have just lost Danushka Gunathilaka for 57 but will be pleased with the start to their innings in the first T20I!\n\n\ud83c\uddf1\ud83c\uddf0 84/1 after 10 overs https://t.co/QcGMnFGQVJ Danushka Gunathilaka follows up his century in the final ODI with a fifty in the first T20I of the series!\n\n#PAKvSL \u27a1\ufe0f https://t.co/zQfKjWBqEj https://t.co/DVWxFZ2gmf \ud83d\udea8 Question time \ud83d\udea8\n\nWho was the last Indian batsman to hit centuries in both innings of a Test match before Rohit Sharma did in this Test match against South Africa? https://t.co/WxOLWTqUV7 Pakistan win the toss and bowl first in Lahore!\n\nThe first T20I of the series gets underway in just under half an hour. https://t.co/9YsBUsuiqX The \ud83c\uddff\ud83c\udde6 pacer has featured in 177 international matches, taking 225 wickets.\n\nShe is South Africa's leading wicket-taker in both women's ODIs and T20Is.\n\nHappy birthday, Shabnim Ismail! https://t.co/0j9BXYAe1R Stumps!\n\nSouth Africa finish the day 11/1, they require another 384 runs to win the first Test, India require nine wickets.\n\nWhat will tomorrow bring? https://t.co/hbqMnuhHO5 India make the perfect start!\n\nRavindra Jadeja dismisses first innings centurion Dean Elgar lbw.\n\nSouth Africa 5/1 with 8\ufe0f\u20e3 overs remaining today. https://t.co/Q1CW1pzuse India declare on 323/4!\n\nSouth Africa require 3\ufe0f\u20e39\ufe0f\u20e35\ufe0f\u20e3 runs to win the first Test with just over a day remaining.\n\nHow do you see the first Test match finishing?\n\n#INDvSA https://t.co/BpQuNXPbDL In the last 10 overs India have scored 94 runs for the loss of two wickets \ud83d\udd25 \n\nSCORECARD \u27a1\ufe0f https://t.co/dCGJ4Pcug5 https://t.co/fXEVbtU3zd The #PAKvSL T20I series begins today at Lahore's Gaddafi Stadium.\n\nWho do you think will win this trophy? https://t.co/N5xwlUvoD3 1\ufe0f\u20e37\ufe0f\u20e36\ufe0f\u20e3 in the first innings\n1\ufe0f\u20e32\ufe0f\u20e37\ufe0f\u20e3 in the second innings\n\nRohit Sharma has made a fine start to his career at the top of the Indian batting order! https://t.co/etlLDVKTlb A complete performance from \ud83c\udde6\ud83c\uddfa gave them 1-0 lead in the three-match ODI series against \ud83c\uddf1\ud83c\uddf0\n\nIt was Australia's 15th ICC Women's Championship win in 16 matches!\n\n#AUSvSL REPORT \ud83d\udc47\nhttps://t.co/xCc79zn7bJ Rohit Sharma now has most sixes for India in a:\n\nTest \u279c 10* v South Africa, Visakhapatnam 2019 \nODI \u279c 16 v Australia, Bangalore 2013\nT20I \u279c 10 v Sri Lanka, Indore 2017\n\n#INDvSA SCORECARD \u25b6\ufe0f https://t.co/dCGJ4Pcug5 https://t.co/VWIVKD4ufd \ud83c\udf75 TEA in Visakhapatnam.\n\nBoth Rohit Sharma and Cheteshwar Pujara recorded half-centuries in that session. Their partnership has now crossed 150.\n\nIndia lead by 246 runs.\n\nFollow #INDvSA LIVE \ud83d\udc47\nhttps://t.co/dCGJ4Pcug5 https://t.co/xhxYZP7D6U \ud83e\udd2f Rohit Sharma's Test average in India has now crossed 1\ufe0f\u20e30\ufe0f\u20e30\ufe0f\u20e3\n\nFollow #INDvSA LIVE \ud83d\udc47\nhttps://t.co/dCGJ4Pcug5 https://t.co/qlhWWm4qcE \ud83d\udca5 50 \ud83d\udca5\n\nRohit Sharma follows up his century in the first innings with his 11th Test half-century \ud83d\udc4f\n\nFollow #INDvSA LIVE \ud83d\udc47\nhttps://t.co/dCGJ4Pcug5 https://t.co/Bh2uI0zO4E Rohit Sharma and Cheteshwar Pujara have taken India to 52/1 in 20 overs.\n\nSouth Africa have bowled with discipline, but they need a wicket soon. Who can give them the breakthrough?\n\nFollow #INDvSA LIVE \ud83d\udc47\nhttps://t.co/dCGJ4Pcug5 https://t.co/4PPW5bAa4G Australia bowl Sri Lanka out for 124 to set up a big 157-run win in the first IWC #AUSvSL ODI in Brisbane. \n\n\ud83d\udcdd SCORECARD \ud83d\udc47\nhttps://t.co/nl9vtckawu https://t.co/4kHzlGlxTP \ud83e\udd57 LUNCH in Visakhapatnam.\n\nIndia are 35/1 after 14 overs, leading South Africa by 106 runs.\n\n#INDvSA SCORECARD \ud83d\udc47\nhttps://t.co/dCGJ4Pcug5 https://t.co/w0Jo3PaOdz The hosts are 23/1 after 10 overs, with Rohit Sharma and Cheteshwar Pujara at the crease. \n\n\ud83c\uddee\ud83c\uddf3's lead is extended to 94.\n\nFollow LIVE \ud83d\udc47\nhttps://t.co/dCGJ4Pcug5 https://t.co/8fgPKvK8PE The Australia batsman made 27 Test appearances, scoring 2,061 runs at an average of 46.84, to go with his 36 wickets.\n\nIn February 1996, he made a career-best 307 against England at the MCG.\n\nHappy birthday Bob Cowper! https://t.co/T5C643QPAN \u261d\ufe0f Anushka Sanjeewani\n\u261d\ufe0f Harshitha Madhavi\n\u261d\ufe0f Chamari Athapaththu\n\nAustralia have reduced Sri Lanka to 46/3 after 13 overs. The visitors need 236 more runs to win.\n\nFollow #AUSvSL live \ud83d\udc47\nhttps://t.co/nl9vtckawu https://t.co/5QZsqEPjXU A spirited performance from the lower order means South Africa reach 431, just 71 short of India's first innings total.\n\nDean Elgar top-scored for the visitors with 160, while R Ashwin claimed seven wickets for the hosts.\n\n#INDvSA SCORECARD \u25b6\ufe0f https://t.co/dCGJ4Pcug5 https://t.co/c9fb2NdrCw South Africa's fightback on day three means we have a contest at our hands in Visakhapatnam!\n\nKeshav Maharaj and Senuran Muthusamy are at the crease for \ud83c\uddff\ud83c\udde6 on day four. The visitors trail by 117 runs.\n\nFollow #INDvSA LIVE \ud83d\udc47\nhttps://t.co/dCGJ4Pcug5 https://t.co/1qmAVaRKcO Rachael Haynes, Meg Lanning and Beth Mooney made fifties as Sri Lanka restrict Australia to 281/8 in the first IWC #AUSvSL ODI\n\nCan \ud83c\uddf1\ud83c\uddf0 chase down the target?\n\n#AUSvSL LIVE \ud83d\udc47\nhttps://t.co/nl9vtckawu https://t.co/1CZjidjGpy \ud83d\udde3\ufe0f \"It may be my best hundred I have had for South Africa, especially playing against the prowess of India.\"\n\nDean Elgar was pleased with his \ud83d\udcaf against India in Visakhapatnam \ud83d\udc47\n\nhttps://t.co/xWq6uf3L1w Sri Lanka get their fourth wicket!\n\nThe partnership between Ellyse Perry and Beth Mooney comes to an end as Perry is run out for 19.\n\n#AUSvSL LIVE \ud83d\udc47\nhttps://t.co/nl9vtckawu https://t.co/cn78nIG6iP One of India's most exciting young talents \ud83d\udca5 \n\nHappy birthday Washington Sundar! https://t.co/I078NdOLC7 Rachael Haynes joins the party in Brisbane!\n\nThe Australia opener also reaches her fifty \u2013 her 11th in ODIs \u2013 off 67 balls. \ud83d\udc4f\n\n#AUSvSL LIVE \ud83d\udc47\nhttps://t.co/nl9vtckawu https://t.co/7vsSEkiA3V Fifty up for Meg Lanning! \n\nThe Australia skipper brings up her 14th ODI half-century in the first #AUSvSL match in Brisbane.\n\n#AUSvSL \ud83d\udc47\nhttps://t.co/nl9vtckawu https://t.co/OJDzQR4O8u He scored 3807 runs and took 362 wickets in Test cricket!\n\n3709 runs and 182 ODI wickets and was Pakistan's 1992 World Cup winning captain \ud83d\udc4f \n\nHappy birthday Imran Khan! https://t.co/T0YP7to5hP Achini Kulasuriya provided Sri Lanka with an early breakthrough, sending Alyssa Healy back for eight. \n\nAustralia are 46/1 after 10 overs.\n\nFollow #AUSvSL live \ud83d\udc47\nhttps://t.co/nl9vtckawu https://t.co/RfMgR5euEw The Allan Border Field is looking \ud83d\ude0d\n\nMeg Lanning has won the toss and elected to bat in the first ODI against Sri Lanka. Big total incoming? \ud83e\udd14\n\n#AUSvSL \ud83d\udc47\nhttps://t.co/nl9vtckawu\n\nhttps://t.co/EMsJiWySCI Having dominated the T20Is, \ud83c\udde6\ud83c\uddfa will look to carry that form into the ICC Women's Championship ODIs too.\n\nHow will Sri Lanka fare in the first game? https://t.co/iZjLKHFfD0 Happy birthday Mashrafe Mortaza!\n\nThe bowler has been playing international cricket since 2001 and in that time has taken 386 wickets for his country across all formats \ud83d\ude4c https://t.co/BbipoMEeqA Who do you think will win the T20I series between Pakistan and Sri Lanka?\n\n#PAKvSL https://t.co/TPqRFvlPjr South Africa finished their tour of India with a comprehensive victory over India.\n\nReport \ud83d\udc47 \nhttps://t.co/0dMeiyWgyV Not usually what we mean when we say 'bowling over the wicket'!\n\n#Fridayfeeling https://t.co/2368EMEOeR Dean Elgar and Quinton de Kock posted centuries for South Africa but late wickets ensured India's grip on the first Test remained tight!\n\nDay three report \ud83d\udc47 \nhttps://t.co/EfOlWiiNhd South Africa bowl India out for 70!\n\nNadine de Klerk took three wickets after Lizelle Lee smashed 84 in the first innings \ud83d\udd25 https://t.co/XnkG4Gki2m India have slipped to 13/5 with Shabnim Ismail and Nadine de Klerk both taking two wickets for South Africa \ud83d\udd25 https://t.co/Hc2nAJpGeH What a start from South Africa and Shabnim Ismail!\n\nShe has taken two wickets in two balls and the hosts are 9/2 after 3 overs. https://t.co/19GVL8kVHo South Africa post 175/3 from their 20 overs.\n\nLizelle Lee top scored with 84 and Sune Luus made 62!\n\nWho will win this one? https://t.co/f5uP6Y6S3c The South Africa captain also reaches her half-century!\n\nSouth Africa 115/0 after 12.3 overs. https://t.co/yo3gV8PLIv Lizelle Lee passes fifty for South Africa \ud83d\udcaa \n\nA strong start from the visiting team \ud83d\udd25 https://t.co/64Az2NcIVM Lizelle Lee and Sune Luus has got South Africa off to a flyer!\n\nAt the end of the Powerplay South Africa are 57/0.\n\nSCORECARD \u27a1\ufe0f https://t.co/vJNuZ6OoYP https://t.co/eBzlEoe6yt The first Indian to 100 T20I appearances \ud83d\udc4f \n\nA fine achievement from Harmanpreet Kaur \ud83d\ude4c https://t.co/4kN9MlPSdQ Sune Luus has won the toss in the sixth T20I between India and South Africa!\n\n\ud83c\uddff\ud83c\udde6 will bat first.\n\nSCORECARD \u27a1\ufe0f https://t.co/vJNuZ6OoYP https://t.co/IyFsFmINZ4 #WorldSmileDay\n\nWho has the best smile in world cricket? https://t.co/aBwDhiPUwy Stumps on day three of #INDvSA!\n\nSouth Africa finish the day 385/8.\n\nEarlier in the day Dean Elgar and Quinton de Kock hit centuries whilst Ravichandran Ashwin took five wickets for India and Ravindra Jadeja claimed his 200th Test scalp. https://t.co/tQlI0IEByv Back in the Test side and back in the wickets!\n\nRavichandran Ashwin dismisses Vernon Philander to claim his fifth wicket of the innings \ud83d\udc4f \n\n#INDvSA https://t.co/wydhEfyGxY Nelson strikes as de Kock departs for 111!\n\nSouth Africa have slipped to 370/7, trailing India by 132 runs.\n\n#INDvSA https://t.co/pZfwenqMY5 \"You look at the list and I'm thrilled with the names involved.\"\n\n\ud83c\udff4\udb40\udc67\udb40\udc62\udb40\udc65\udb40\udc6e\udb40\udc67\udb40\udc7f Test captain Joe Root is keen to welcome a new coach into the set-up and aims to direct greater priority towards the longest format.\n\nhttps://t.co/4sZudLYUHO Test century number five for Quinton de Kock \ud83d\udc4f \n\n#INDvSA LIVE \u27a1\ufe0f https://t.co/dCGJ4Pcug5 https://t.co/xyHpi2nWhh 200 Test match wickets for Ravindra Jadeja \ud83d\udc4f \n\nHe becomes the 10th Indian bowler to reach the milestone. https://t.co/htJJIqLOBF \ud83d\udea8 WICKET \ud83d\udea8\n\nDean Elgar's marathon innings comes to an end as Ravindra Jadeja gets the crucial breakthrough for India!\n\n#INDvSA https://t.co/eIa4a8oYwS Dean Elgar brings up 1\ufe0f\u20e35\ufe0f\u20e30\ufe0f\u20e3\n\nWhat an innings it's been so far!\n\n#INDvSA https://t.co/bJgC2lP9oa In 20 Tests for \ud83c\udde6\ud83c\uddfa, he scored five \ud83d\udcafs, two of which were doubles. His 130* against \ud83c\udf34 in 2015 made him the oldest to score a century on debut.\n\nHe was 35 years and 242 days then and turns 40 today. Happy birthday, Adam Voges! https://t.co/fSXdgR8370 South Africa have avoided the follow on!\n\nHow close can they get to India's total?\n\n#INDvSA \ud83d\udc47\nhttps://t.co/dCGJ4Pcug5 https://t.co/uD8KvEBFbS Legendary all-rounder Basil D'Oliveira was born #OnThisDay in 1931. In 44 Tests for \ud83c\udff4\udb40\udc67\udb40\udc62\udb40\udc65\udb40\udc6e\udb40\udc67\udb40\udc7f, he scored 2484 runs at 40.06 and claimed 47 wickets!\n\nThe Test series between England and South Africa is named after him. https://t.co/FnNMXDdQKu Dean Elgar (127*) continues his vigil at Visakhapatnam and Quinton de Kock (45*) has given him good company since Faf du Plessis' dismissal.\n\nThe current partnership is worth 83, but \ud83c\uddee\ud83c\uddf3 have taken the second new ball. \ud83d\udc40 \n\n#INDvSA LIVE \ud83d\udc47\nhttps://t.co/dCGJ4Pcug5 https://t.co/sdJGvaBFxG ICYMI\n\nPeter Moor scored a 60-ball 92* to power Zimbabwe to a table-topping eight-wicket win against Singapore in the sixth match of the T20I tri-series.\n\nhttps://t.co/adlhIf2OeC Former Zimbabwe cricketer Gus Mackay, who has vast administrative experience, has been named Cricket Scotland chief executive. He has ambitious plans for the game's growth in the country.\n\nhttps://t.co/308YpG30JD Dean Elgar brings up a resilient \ud83d\udcaf with a six! It's the first hundred by a South African in India since 2010.\n\n#INDvSA LIVE \ud83d\udc47\nhttps://t.co/dCGJ4Pcug5 https://t.co/Uf62QKKHXZ Ashwin has \ud83c\uddff\ud83c\udde6 skipper du Plessis caught at leg-slip for 55, breaking a 115-run stand!\n\nThe visitors are 178/5, still trailing by 324 runs!\n\n#INDvSA LIVE \ud83d\udc47\nhttps://t.co/dCGJ4Pcug5 https://t.co/YgDpPQQvuf The young wicket-keeper batsman has represented India in 43 matches across formats, and already has Test \ud83d\udcafs in England and Australia!\n\nHappy birthday, Rishabh Pant! https://t.co/w7hRQ7B2WK South Africa were in trouble at 63/4, but Dean Elgar (76*) and Faf du Plessis (48*) have since counter-attacked, taking the score past 150 without further loss. Elgar even hit Jadeja for 16 runs in one over!\n\nThat will be lunch!\n\n#INDvSA LIVE \ud83d\udc47\nhttps://t.co/dCGJ4Pcug5 https://t.co/duo6Hx99f4 #OnThisDay in 1996, Shahid Afridi played a \ud83e\udd2f knock against Sri Lanka!\n\nPromoted to bat at No.3, he smashed 102 off just 40 balls. His 37-ball \ud83d\udcaf was the fastest ODI century at that time. \n\nHis innings was studded with 11 sixes \ud83d\udc4f https://t.co/72LGYeu2qj \ud83c\uddee\ud83c\uddf3 captain Harmanpreet Kaur's match-winning 32-ball 34 against \ud83c\uddff\ud83c\udde6 yesterday made her only the second Indian woman to go past 2000 runs in T20Is \ud83d\udc4f \n\nCan you name the other? https://t.co/2tI47mfzNz Ishant Sharma produced an in-seamer to dismiss Temba Bavuma early, but Faf du Plessis and Dean Elgar are looking positive.\n\nSouth Africa are 92/4, still trailing by 410 runs.\n\n#INDvSA LIVE \ud83d\udc47\nhttps://t.co/dCGJ4Pcug5 https://t.co/RYmxKjk5Uu \"Sabiya's story is so inspiring. Everything she does, everything she's been through, even her passion for the game \u2013 I aspire to be like her when I'm older.\"\n\nSabiya Takey is living her dream  \ud83d\udc4f \ud83d\udc4f https://t.co/8BDQ55FJmN South Africa resume day two at 39/3 in response to India's 502/7.\n\nWill the visiting batsmen put up resistance or will the home team's spinners continue to breathe \ud83d\udd25 ?\n\n#INDvSA SCORECARD \ud83d\udc47\nhttps://t.co/dCGJ4Pcug5 https://t.co/qNTAsLsPc5 Mark Coles has left his position as Pakistan Women's head coach due to family responsibilities.\n\nhttps://t.co/7kUDazH4um Mohammad Amir has moved up to a career-best bowling position in the @MRFWorldwide ICC Men's ODI Player Rankings  \ud83c\udd99 \n\nFULL STORY \ud83d\udc47 \nhttps://t.co/5d3oSqut1A A host of England Test players and domestic stars have been selected by teams in The Hundred. \n\nFULL STORY \ud83d\udc47 \nhttps://t.co/RvbleMgGEP A commanding display from India saw South Africa finish day two on 39/3, trailing India by 463 runs. \n\nREPORT \ud83d\udc47 \nhttps://t.co/qpcKnCjeWM Peter Moor was in fine form for Zimbabwe on Thursday!\n\nThe batsman struck 92 from 60 balls to guide his side to an eight-wicket win over Singapore  \ud83d\udc4f \ud83d\udc4f \n\n#SINvZIM https://t.co/RXbNd6HEDG \ud83d\udcac \"I watch videos of legends from different countries to help myself improve the game. Most recently I am following Misbah-ul-Haq and Younis Khan.\"\n\nAbid Ali on how he learns from the best \ud83d\udc47\n\nhttps://t.co/G5j2n90Oia Another win for India! \n\nHarmanpreet Kaur guides her side in their chase of 99 with a 32-ball 34 to seal a five-wicket victory. \n\nSCORECARD \u2b07\ufe0f \nhttps://t.co/Qmr77NB39u https://t.co/5mtdYPzbdk South Africa are restricted to 98/8 after 20 overs.\n\nSix South Africa batters reached double-figures, but no one was able to go past 17. Radha Yadav was the pick of the bowlers with figures of 3/23. \n\nSCORECARD \u2b07\ufe0f \nhttps://t.co/Qmr77NB39u https://t.co/9rNE118w1T \ud83c\udfc6 @cricketworldcup \u2705 \n\ud83c\udfc6 @T20WorldCup \u2705\n\ud83c\udfc6 Retaining the Ashes \u2705\n\nCharlotte Edwards reflects on England's incredible success in 2009  \ud83d\udc4f \ud83d\udc4f https://t.co/bSoyQVjNOn India have won the toss and will field first in the fifth T20I against South Africa!\n\nThe hosts currently lead the series 2-0. \n\nSCORECARD \u2b07\ufe0f \nhttps://t.co/Qmr77NB39u https://t.co/bNdqXQtaXF ICYMI: The Women's Global Development Squad to tour Australia was announced earlier today.\n\nDetails \ud83d\udc49 https://t.co/Zs2j3r1evC https://t.co/zy6YdNpt9G STUMPS!\n\nR Ashwin and Ravi Jadeja's early strikes leave South Africa three down, trailing by 463, after Mayank Agarwal stars with maiden Test (double) century. \n\n#INDvSA SCORECARD \ud83d\udc47\nhttps://t.co/dCGJ4Pcug5 https://t.co/5IcVWehE0D THROUGH THE GATE \ud83c\udfaf\n\nA beauty from Ashwin has Markram's stumps disturbed. India have their first breakthrough.\n\nFollow #INDvSA live \ud83d\udc47\nhttps://t.co/dCGJ4Pcug5 https://t.co/kIErlDLdeH \"The last two games were really complete. That\u2019s the sort of cricket we want to be playing all the time.\"\n\nAustralia's Alyssa Healy reflects on her team's performance after their sweep of Sri Lanka.\n\nhttps://t.co/sZ7AhfpToz Almost immediately, with 502/7 on the board!\n\nWhat an effort from Virat Kohli's men \ud83d\udc4f\n\n#INDvSA 5\ufe0f\u20e30\ufe0f\u20e30\ufe0f\u20e3 up for India!\n\nWhen will the hosts declare?\n\n#INDvSA LIVE \ud83d\udc47\nhttps://t.co/dCGJ4Pcug5 https://t.co/EU3qRPAis0 India begin the final session of the day at 450/5. How many can they get from here?\n\nHanuma Vihari and Ravindra Jadeja are at the crease.\n\nFollow #INDvSA live \ud83d\udc47\nhttps://t.co/dCGJ4Pcug5 https://t.co/q4E7N77CdP Pakistan captain Bismah Maroof will lead the Women\u2019s Global Development Squad for a tour of Australia.\n\nDETAILS \ud83d\udc47\n\nhttps://t.co/CperLNP6R3 Two wickets in three overs!\n\nElgar dismisses Agarwal for 215. South Africa are fighting back \ud83d\udc4a\n\nFollow #INDvSA live \ud83d\udc47\nhttps://t.co/dCGJ4Pcug5 https://t.co/C7ym6rc1bn 2\ufe0f\u20e30\ufe0f\u20e30\ufe0f\u20e3* \u2013 WHAT A KNOCK!\n\nMayank Agarwal brings up his maiden Test double century \ud83d\udcaf\ud83d\udcaf\n\nThis is the 52nd 200-plus score for India in Test cricket \ud83d\ude4c\n\nFollow #INDvSA live \ud83d\udc47\nhttps://t.co/dCGJ4Pcug5 https://t.co/we1MTcJJOT Pakistan paceman Mohammad Amir storms into the top 10 of the @MRFWorldwide ICC Men's ODI Rankings for bowlers.\n\nFull rankings \ud83d\udc47\nhttps://t.co/su8ZcgGSZr https://t.co/cFmg1Fl5j1 Out \u261d\ufe0f \n\nSenuran Muthuswamy gets his maiden Test wicket and it's of the Indian captain. What a moment for the young spinner. South Africa fighting back!\n\nFollow the action live \ud83d\udc47\nhttps://t.co/dCGJ4Pcug5 https://t.co/IWQ7p6eeTM The New Zealand paceman featured in 15 Tests and 22 ODIs. In the 1979-80 Test series against West Indies, he claimed 18 wickets at an impressive average of 20.61.\n\nHappy birthday Gary Troup! https://t.co/Pbf0b1gSSd WICKET! \u261d\ufe0f\n\nPhilander strikes on the first ball of the session, and Pujara is gone for 6. Virat Kohli is the new batsman in. \n\nFollow #INDvSA live \ud83d\udc47\n https://t.co/dCGJ4Pcug5 https://t.co/OFw3ES6ODB South Africa make the first breakthrough!\n\nKeshav Maharaj picks up the prized scalp of Rohit Sharma, who falls for 176. \n\nIndia are 317/1. https://t.co/NOZnqoJ0ig \ud83d\ude4c 3\u20e30\u20e30\u20e3 \ud83d\ude4c\n\nIndia openers Rohit Sharma and Mayank Agarwal bring up a brilliant 300-run stand \u2013 the highest for any wicket against South Africa in India. https://t.co/TtgL6xV7Ve She has represented New Zealand in 19 ODIs and 18 T20Is. She returned her best ODI figures of 3/22 against Pakistan in the 2017 ICC Women's World Cup.\n\nHappy birthday Hannah Rowe! https://t.co/U8HH9OGNV2 What an innings!\n\nRohit Sharma brings up his 150 off 224 balls in the first session of day two of the Visakhapatnam Test. \n\nFollow the action live \ud83d\udc47\nhttps://t.co/dCGJ4Pcug5 https://t.co/Z3ahgzbohf India opener Mayank Agarwal brings up his maiden Test hundred in Visakhapatnam! \ud83d\udc4f\n\n#INDvSA LIVE \ud83d\udc47\nhttps://t.co/dCGJ4Pcug5 https://t.co/tPanfR6VLk Day two of the first #INDvSA Test is under way! \n\nIndia resume on 202/0, with openers Rohit Sharma and Mayank Agarwal in the middle. \n\nFollow the action live \ud83d\udc47\n https://t.co/dCGJ4Pcug5 https://t.co/yNIwhCDy3B Can Rohit turn his hundred into a huge score when play gets underway?\nhttps://t.co/SigcGRv6Bi Fakhar Zaman, Abid Ali, and Haris Sohail ensured ODI cricket's return to Karachi continued to go joyously for Pakistan.\n\n#PAKvSL REPORT \ud83d\udc47\nhttps://t.co/iUmjuFm6of Happy birthday Ben Laughlin!\n\nKeep celebrating your wickets with passion \ud83d\udca5 https://t.co/FqhhUjHfrM Would Nathan Lyon be in your T20 World Cup squad, Australia fans?\nhttps://t.co/S4fjF6dYtH #OnThisDay in 1921, Ray Lindwall, regarded as one of the greatest fast bowlers of all time, was born.\n\nThe Australian took 228 wickets in 61 Tests at an average of just 23.03 \ud83d\udc4f https://t.co/l1c1PQ2oSI Guess who \ud83d\udc40 https://t.co/o3NKBwuQwk A very exciting opportunity awaits for Pakistan's Nida Dar!\n\nFind out more \ud83d\udc47 \nhttps://t.co/2CwvIxhQyB A stunning performance from Alyssa Healy with the bat today \ud83d\udc4f \n\n#AUSvSL report \ud83d\udc47 \nhttps://t.co/hdHxTECUz9 The series having seemingly been decided, India 2-0 up with a game to play, it's all to play for once more after an additional T20I against South Africa was confirmed.\nhttps://t.co/l00DI3Nu1F \"If I do get the cap then I want to be opening the batting for England for as many years as possible.\"\n\nDo you think Dom Sibley is the answer to \ud83c\udff4\udb40\udc67\udb40\udc62\udb40\udc65\udb40\udc6e\udb40\udc67\udb40\udc7f's opening woes in Tests?\nhttps://t.co/7OxfXnuZ9O These fans are loving ODI cricket being back in Karachi \ud83c\uddf5\ud83c\uddf0 \ud83d\ude4c\n\n#PAKvSL https://t.co/JcDSC2jZ8I 7\ufe0f\u20e34\ufe0f\u20e3 runs\n6\ufe0f\u20e37\ufe0f\u20e3 balls\n1\ufe0f\u20e30\ufe0f\u20e3 fours\n\nPlayer of the Match: Abid Ali \ud83d\udc4f\n\n#PAKvSL https://t.co/c4gT9JzLTt Pakistan win by five wickets and seal the series 2-0 \ud83d\udc4f\n\nThe return of ODI cricket to Karachi has been truly special \ud83d\ude4c\n\n#PAKvSL SCORE \u27a1\ufe0f https://t.co/E2CBrDz9LN https://t.co/HcqK1T5eFl Pakistan announced a 16-man squad for their upcoming T20I series against Sri Lanka.\n\nSee who made the cut \ud83d\udc47 \nhttps://t.co/uwtCML6jNk Day one report from #INDvSA \ud83d\udc47 \nhttps://t.co/9Dk7AP1sFY 181/1 \u27a1\ufe0f 189/3\n\nPakistan need 109 runs off 111 balls. Is the Sri Lankan comeback on?\n\n#PAKvSL \ud83d\udc47\nhttps://t.co/E2CBrDz9LN https://t.co/Av6OF7FvGZ #SpiritOfCricket https://t.co/pRoOQ7KeXY Fakhar Zaman reaches fifty!\n\nHe has just lost his opening partner Abid Ali for 74, but Babar Azam has joined him at the crease.\n\n\ud83c\uddf5\ud83c\uddf0 require 169 runs to win from 114 balls. https://t.co/AhEsIqvG8A Fifty for Abid Ali!\n\nA great return to the ODI side for him \ud83d\udc4f \n\n#PAKvSL \u27a1\ufe0f https://t.co/E2CBrDz9LN https://t.co/sRgogW2GoX #NewCoverPic https://t.co/3Yzitgetu9 Sri Lanka post 297/9 \ud83d\ude4c \n\nDanushka Gunathilaka top-scored with 133, the fifth highest individual ODI score for Sri Lanka against Pakistan!\n\nDasun Shanaka provided some late-order impetus with a 24-ball 43 \ud83d\udd25 \n\n#PAKvSL \u27a1\ufe0f https://t.co/E2CBrDz9LN https://t.co/VJbe939Adv Second ODI century for Danushka Gunathilaka \ud83d\udd25 \n\nWhat score do you want to see Sri Lanka fans? https://t.co/Xop6cF2y7A Sri Lanka will be happy with their efforts halfway through their innings.\n\nDanushka Gunathilaka is well set on 74* \ud83d\udc4f \n\n\ud83c\uddf1\ud83c\uddf0 122/2 https://t.co/DTp25KB367 Fifty for Sri Lanka's Danushka Gunathilaka \ud83d\udc4f \n\nThe visitors have made a solid start with the bat in the third ODI.\n\n#PAKvSL \u27a1\ufe0f https://t.co/E2CBrDz9LN https://t.co/WYln92K28V \ud83d\udea8 Stumps on day one of #INDvSA \ud83d\udea8 \n\nA fantastic day for India who close on 202/0, South Africa will be looking for early wickets tomorrow.\n\nScorecard \u27a1\ufe0f https://t.co/E2CBrDz9LN https://t.co/Bhy0EVS2gU News from the toss in Karachi!\n\nSri Lanka have won the toss and will bat first.\n\n#PAKvSL \u27a1\ufe0f https://t.co/E2CBrDz9LN https://t.co/k69NSCd3BK Rohit Sharma averages 98.22 in Test cricket in India!\n\nOnly one batsman has a better home Test record than him (minimum 10 innings), can you name that player? https://t.co/uJC44RNv0k ICYMI\n\nThe HITMAN is back with a bang \ud83d\udca5\n\nRohit Sharma gets his first Test ton as an opener! https://t.co/DsLfnGCzca Play has been delayed in Visakhapatnam due to rain!\n\nIndia going well on 202/0.\n\nScorecard \u27a1\ufe0f https://t.co/dCGJ4Pcug5 https://t.co/6k8xIWcHEZ \ud83c\udf72 Lunch in Visakhapatnam\n\nIndia are 91/0 and Rohit Sharma has scored his first Test fifty as an opener. \n\nFollow the first #INDvSA Test live \ud83d\udc47 \nhttps://t.co/dCGJ4Pcug5 https://t.co/VCaz6rxzsM Alyssa Healy has just scored the fastest T20I hundred by an Australian \ud83d\ude4c https://t.co/Ie6EN5q0TB A decent first hour for India. They are 37/0 in 15 overs.\n\nBig day for Rohit Sharma and he is looking good on 17*\n\nFollow the first #INDvSA Test live \ud83d\udc47 \nhttps://t.co/dCGJ4Pcug5 https://t.co/MJPlnARDMf What a start for Australia! They have lost Beth Mooney but Alyssa Healy is in a \ud83e\udd2f form\n\nShe has just got her 10th T20I fifty in 25 balls \ud83d\ude2e https://t.co/eRhaAAMumx \ud83d\udc55 \u2013 84 international appearances\n\u261d\ufe0f \u2013 112 wickets\n\ud83c\udfc5 \u2013 On the Lord's Honours Board\n\n\u21a9\ufe0f\u21aa\ufe0f \u2013 An ability to swing the ball both ways\n\nHappy birthday to India's Praveen Kumar \ud83c\udf82 https://t.co/uS7Fl5oVNT Another exciting game to keep a track of!\n\n\ud83c\udde6\ud83c\uddfa have elected to bat first in the third T20I against \ud83c\uddf1\ud83c\uddf0. Who do you think will top the scoring charts today? https://t.co/tlGbL8lBSB \ud83c\uddee\ud83c\uddf3 have won the toss and opted to bat.\n\nFollow the first #INDvSA Test live \ud83d\udc47 \nhttps://t.co/dCGJ4Pcug5 https://t.co/veIFwWs7P4 India fans, how do you expect Rohit Sharma to go at the top of the order?\n\nhttps://t.co/0FI592pDb6 Happy birthday Tom Moody!\n\nThe Australian all-rounder played both Test and ODI cricket for his country and has since coached Sri Lanka, Western Australia and Kings XI Punjab. https://t.co/kTKdIA1srs Excited BBL fans?\n\nhttps://t.co/oF6FTQQMyO Celebrate wickets like Imran Tahir and Nicholas Pooran \ud83d\udca5 https://t.co/JKZf7pdbnJ Match 1\ufe0f\u20e3: NLCB Challenge \u2013 \ud83d\uddd3\ufe0f 10 October\nMatch 2\ufe0f\u20e3: Courts Invitational \u2013 \ud83d\uddd3\ufe0f 12 October\n\nDetails \ud83d\udc47\n\nhttps://t.co/Igs22lp29q #NewCoverPic https://t.co/gRVm8RO1gq India seal a series win over South Africa!\n\nThe hosts win by 51 runs \u2013 Poonam Yadav starred with the ball, taking 3/13 from her three overs as South Africa finished their 17 overs on 89/7. \n\nSCORECARD \u27a1\ufe0f https://t.co/mcrUA8BCaM https://t.co/JisAd779ps India finish with 140/4 from their 17 overs!\n\nCan South Africa level the series?\n\nSCORECARD \u27a1\ufe0f https://t.co/mcrUA8BCaM https://t.co/aVvHGDOGhY What an innings from 15-year-old Shafali Verma! \n\nShe has just been dismissed for 46 on just her second T20I appearance for India \ud83d\udd25\n\nWhat an achievement and what a player she is going to be \ud83d\udc4f\nhttps://t.co/DcU7sdhC63 News from the game in Surat!\n\nThe match will now be 17 overs a side, South Africa have won the toss and will bowl first.\n\nSCORECARD \u27a1\ufe0f https://t.co/mcrUA8Td2k https://t.co/yE9x5KVYU0 The toss has been delayed in the fourth T20I between India and South Africa.\n\nWe will bring updates when we have them! https://t.co/6Hi9YsFtPn Some lovely bowling actions being developed here!\n\nWhat's your earliest cricketing memory? https://t.co/nuXQRRsspn \"I was trying to hold back my tears. It was so depressing.\"\n\nIndia spinner Yuzvendra Chahal reflects on India's #CWC19 exit. \n\nhttps://t.co/T4lnE9KlR0 How will the new-look South African side fare against a formidable Indian outfit in their backyard?\n\n\ud83c\uddee\ud83c\uddf3 v \ud83c\uddff\ud83c\udde6 1st Test preview \ud83d\udc47\n\nhttps://t.co/rg3kcLZ7ta The North Sydney Oval will remain Australia's fortress \ud83d\udcaa\n\nThe venue is set to host at least one women's international match every year for the next four years! https://t.co/iAt61bdxzz \"I think he\u2019s got enough credits in the bank. We know how good a player he is\" \u2013 Tim Paine\n\nhttps://t.co/lnplX3RjyA \"Ashwin has got a lot of variations and Jadeja keeps it simple but the key is consistency.\"  \n\nKeshav Maharaj hopes to replicate the consistency of India's experienced spin twins.\n\nhttps://t.co/nVvm4sEhRZ Virat Kohli confirms that Rishabh Pant has been left out of India's first Test against South Africa. Wriddhiman Saha will keep wickets instead.\n\nIndia fans, what do you make of the selection?\n\n#INDvSA https://t.co/LnNIOIpmuL \ud83d\udd39 32 ODIs\n\ud83d\udd39 65 T20Is\n\nThe Bangladesh all-rounder led her side to their first Women's T20 Asia Cup title in 2018. \n\nHappy birthday Salma Khatun! https://t.co/VS2vPkLfBU \"I think every single person in this squad can contribute at any point in time.\"\n\nAlyssa Healy is happy with the quality of Australia's talent pool.\n\nhttps://t.co/8iR1rZU4nV The former Pakistan batsman made 41 Test appearances, scoring 2,991 runs at an average of 40.41.\n\nIn his debut series, he made 508 runs at 56.44, which also featured one century and four fifties.\n\nHappy birthday Saeed Ahmed! https://t.co/3NA04lca91 Pakistan and Sri Lanka made sure ODI cricket's return to Karachi was a thrilling one, but it was the hosts who ran out victorious to take a 1-0 lead in the series.\n\n#PAKvSL REPORT \ud83d\udc47\nhttps://t.co/spZFhD3Arf \"When I went in to bat in the West Indies, I told myself that I'm not going to think about the three-figure mark, and I'm going to enjoy batting.\"\n\nCan Ajinkya Rahane build on his good form when India take on South Africa?\n\nREAD \ud83d\udc47\nhttps://t.co/WWsqZTupxK India will be looking to carry on their recent, excellent Test form whilst South Africa will be looking to get their World Test Championship campaign off to a good start!\n\nhttps://t.co/antxEqHWv8 On Alyssa Healy's 100th T20I appearance Australia put in a dominant performance to seal their T20I series against Sri Lanka.\n\nReport \ud83d\udc47 \nhttps://t.co/gSNY78fycn Congratulations on a fine achievement @ahealy77 \ud83d\udc4f https://t.co/LBUZmfaBhV Started from the bottom now we're here!\n\nWhat do you think @tdpaine36, @stevesmith49? https://t.co/W51gBhZXkt ICYMI \ud83d\udc47 \nhttps://t.co/qXUjjhOCUz West Indies off-spinner Kraigg Brathwaite's bowling action has been found to be legal. \n\nDETAILS \ud83d\udc47\n\nhttps://t.co/g14SRKSg2E Pakistan certainly stretched Sri Lanka today \ud83d\ude05\n\n#PAKvSL | #SpiritOfCricket https://t.co/h69J5JvvxY Pakistan mark ODI cricket's return to Karachi with a win \ud83d\ude4c\n\n#PAKvSL SCORE \u27a1\ufe0f https://t.co/eD0ONn9xh0 https://t.co/ATerDYFRts \ud83d\udd1f-1\ufe0f\u20e3-5\ufe0f\u20e31\ufe0f\u20e3-5\ufe0f\u20e3 \n\nWith the penultimate ball of his spell, Usman Shinwari completes his second ODI five-for \ud83d\udd90\ufe0f\n\nWhat an effort \ud83d\udc4f\n\n#PAKvSL https://t.co/B1Opk0LvBE Dasun Shanaka follows two balls later!\n\nIs that the game sewn up for Pakistan?\n\nFollow #PAKvSL live \u27a1\ufe0f https://t.co/eD0ONn9xh0 There's the breakthrough Pakistan needed - Shehan Jayasuriya falls for 96!\n\nA heartbreaking end for the Sri Lankan, but a superb innings nonetheless - he's doubled his ODI run tally in a single knock, and given his side a chance when they seemed dead and buried \ud83d\udcaa\n\n#PAKvSL https://t.co/sB2tuDwrZ1 Happy birthday Hiruka Fernando!\n\nThe all-rounder hit 1015 ODI runs and claimed 12 ODI wickets for Sri Lanka. https://t.co/Go2W2Bj7wn Shehan Jayasuriya and Dasun Shanaka's partnership, which currently stands at 166*, is Sri Lanka's highest sixth-wicket stand in ODIs, going past the 159 put on by Chamara Kapugedera and Chamara Silva against West Indies in 2008 \ud83d\udcc8 \n\nWhat an effort after the tourists were 28/5 \ud83d\ude4c https://t.co/lXo4WSbaZ7 Dasun Shanaka follows Shehan Jayasuriya to fifty!\n\nFollow #PAKvSL \u27a1\ufe0f https://t.co/eD0ONn9xh0 https://t.co/8nVG8OeZ0d Maiden ODI half-century for Shehan Jayasuriya \ud83d\udc4f \n\nHim and Dasun Shanaka are keeping Sri Lanka's slim hopes of victory alive! https://t.co/TiMLSlkb89 Halfway through Sri Lanka's run-chase.\n\nThe visitors have rebuilt to 98/5 having been 28/5!\n\nWill Sri Lanka continue to frustrate Pakistan or can the hosts take the final five wickets?\n\nSCORECARD \u27a1\ufe0f https://t.co/eD0ONn9xh0 https://t.co/MTn4DoG7N3 What a return to the Pakistan team for Usman Shinwari!\n\nHe has taken three early wickets, reducing Sri Lanka to 22/4 after eight overs.\n\nSCORECARD \u27a1\ufe0f https://t.co/eD0ONn9xh0 https://t.co/I63wwwnsIP Only Saeed Anwar and Mohammad Yousuf have more ODI centuries for Pakistan than Babar Azam now! https://t.co/eS6r3BycuN Pakistan post 305/7 from their 50 overs!\n\nWho will go 1-0 up in the ODI series?\n\nSCORECARD \u27a1\ufe0f https://t.co/eD0ONn9xh0 https://t.co/Ut9GWymPBE What a player, what an innings!\n\nBabar Azam reaches his 11th ODI \ud83d\udcaf \n\nThe first ODI century at the National Stadium since 2009 \ud83d\ude4c https://t.co/FIUEangkG8 Second half-century of the Pakistan innings as Babar Azam reaches fifty!\n\nPakistan are well set to make a big score in the second ODI.\n\nSCORECARD \u27a1\ufe0f https://t.co/eD0ONn9xh0 https://t.co/JMvbf1ljqL \ud83d\udea8 Australia win \ud83d\udea8 \n\nThey thrash Sri Lanka by nine wickets with Erin Burns finishing 30* and Beth Mooney 28* \ud83d\udd25 \n\nAlyssa Healy's 100th T20I ends in a comfortable victory! https://t.co/3QfVV7UR61 Pakistan lose their second wicket as Fakhar Zaman departs having passed fifty!\n\nAfter 25 overs they are 123/2 with Babar Azam and Haris Sohail at the crease.\n\n#PAKvSL LIVE \u27a1\ufe0f https://t.co/eD0ONn9xh0 https://t.co/7Ru1HcjBAL Alyssa Healy has Australia off to yet another fast start!\n\nSCORECARD \u27a1\ufe0f https://t.co/oRS6OfCmXZ https://t.co/E2fCGPXEnq A stunning performance with the ball from Australia!\n\nSri Lanka end their 20 overs on 84/8.\n\nSCORECARD \u27a1\ufe0f https://t.co/oRS6OfCmXZ https://t.co/LddGgrGgVH A good start from the Australian bowlers!\n\nSri Lanka 38/3 after 10 overs.\n\nSCORECARD \u27a1\ufe0f https://t.co/oRS6OfCmXZ https://t.co/7DbsMBpap6 There will be cricket in Karachi today!\n\nPakistan have won the toss and they will bat first.\n\n#PAKvSL LIVE \u27a1\ufe0f https://t.co/jcW873T4rm https://t.co/Lf8gtoR1zj Alyssa Healy becomes only the second woman from Australia, after Ellyse Perry, to make 100 T20I appearances. https://t.co/Z52zYCPUqK News from the toss in Sydney!\n\nSri Lanka have won the toss and they will bat first.\n\nSCORECARD \u27a1\ufe0f https://t.co/oRS6OfCmXZ https://t.co/fMWDAxycB5 ICYMI: \"I'll be trying to get back into the mindset of run in and bowl fast and intimidate with pace.\"\n\nThe fiery Mitchell Starc is gearing up for \ud83c\udde6\ud83c\uddfa's long home season \ud83d\udd25 \nhttps://t.co/uQUDAdnp6Z RT @cricketworldcup: \ud83d\udd39 237* runs\n\ud83d\udd39 163 balls\n\ud83d\udd39 24 fours\n\ud83d\udd39 11 sixes\n\nOn @Martyguptill's 33rd birthday, relive this \ud83e\udd2f innings from the 2015 I\u2026 \u2747\ufe0f Women's Cricket Super League\n\u2747\ufe0f WBBL\n\u2747\ufe0f Women's IPL\n\n\ud83c\uddf1\ud83c\uddf0 captain Chamari Athapaththu wants to use her global T20 experience to inspire her team to come good against Australia.\nhttps://t.co/G4zyQFdDC0 \ud83d\udc49 26 ODIs\n\ud83d\udc49 11 T20Is\n\nThe India batter was a member of the squad that reached the 2017 ICC Women's World Cup final.\n\nHappy birthday Mona Meshram! https://t.co/6Wvu9bABU8 \"I want to showcase my batting skills and prove that I can play as an all-rounder.\"\n\n\ud83c\uddf5\ud83c\uddf0 spinner Shadab Khan wants to become a regular all-round option in the national side \ud83d\udc47 \nhttps://t.co/EqtLNYGCXs The former India wicket-keeper batsman made 41 international appearances. In 138 first-class matches, he has 8,209 runs at an average of 48.57, and has gone on to be a successful coach.\n\nHappy birthday Chandrakant Pandit! https://t.co/AfsNaz5dtJ ICYMI: Further rain left India Women's T20I series against South Africa Women poised at 1-0 heading into the fourth game of the tour.\n\nhttps://t.co/fJVoR7x2W7 Can Australia go 2-0 up in their T20I series against Sri Lanka?\n\nOr will the visitors level the series? https://t.co/0pKb017U95 ODI runs: 6626 - 4th most for \ud83c\uddf3\ud83c\uddff \nODI best: 237* \ud83d\ude4c \nODI bat ave: 42.20 \ud83d\udc4f \n\nHappy birthday Martin Guptill! https://t.co/kvyTXTlIrl The first T20I between Australia Women and Sri Lanka Women was a high-scoring affair!\n\nReport \ud83d\udc47 \nhttps://t.co/Afbv0sOBhG Pakistan fans!\n\nWho would you like to see in the playing XI for tomorrow's ODI against Sri Lanka? https://t.co/jADAoCFPFr What a day for Singapore, who secured their first victory over Zimbabwe and just their fourth win in T20Is!\n\nTim David and Manpreet Singh both hit 41 and Amjad Mahboob then took 2/20 from his four overs to seal the historic result \ud83d\udd25\ud83d\udc4f\n\n#SINvZIM REPORT \ud83d\udc47 \nhttps://t.co/lqK6YEFsJN Singapore secure a thrilling four-run victory over Zimbabwe.\n\nThe visitors were cruising at 140/3 but after captain Sean Williams fell for a 35-ball 66, a middle-order collapse, helped by some tight bowling, sees Singapore to victory! https://t.co/92lg04NrXs \"That innings totally changed my career and totally changed women's cricket in Sri Lanka.\"\n\nChamari Atapattu talks Mignon du Preez through her 178* v Australia at #WWC17. Could her 113 today against the same opposition have a similar effect?\n\nFULL VIDEO \ud83d\udc47\nhttps://t.co/jmo0mS4ZCw https://t.co/RAUAWS9enX \ud83d\udea8 Match abandoned in Surat \ud83d\udea8 \n\nThe third T20I between India and South Africa has been abandoned due to the rain.\n\nThe two sides meet again on Tuesday! https://t.co/ZlPbhXNaaW Singapore post 181/9!\n\nCan Zimbabwe chase down their total or will the Singapore bowlers be celebrating? https://t.co/QOGguz5fwO \ud83e\udde2 79 international caps\n\u261d\ufe0f 87 wickets\n\u2618\ufe0f Represented Ireland in the Women's Cricket World Cup in 2000\n\ud83c\udfc6 ICC Women's #T20WorldCup appearances in 2016, 2018\n\nHappy birthday, Ciara Metcalfe \ud83c\udf82 https://t.co/Q1Ziu0LGy3 The toss has been delayed in Surat ahead of India's third T20I against South Africa, due to rain.\n\nUpdates to follow. https://t.co/K2IbGf7fKU 1\ufe0f\u20e3: Virat Kohli \ud83c\udd9a Kagiso Rabada\n2\ufe0f\u20e3: Dean Elgar \ud83c\udd9a Ravi Ashwin\n3\ufe0f\u20e3: \u2753\n4\ufe0f\u20e3: \u2753\n5\ufe0f\u20e3: \u2753\n\n#INDvSA\n\nhttps://t.co/atc8KbXUgF He played just nine international games, but scored 22,346 runs in first-class cricket \ud83d\ude4c\n\nWith one century and five half-centuries in eight games, he averaged 42.06 in Test cricket \ud83c\udfcf\n\nHappy birthday to England's David Steele \ud83c\udf70 https://t.co/FTOkNbjj7v In 1986, the former England batsman scored centuries in three consecutive Tests of an Ashes series, equalling Jack Hobbs' and Wally Hammond's streak.\n\nHe has also officiated in 514 international matches as ICC match referee.\n\nHappy birthday Chris Broad! https://t.co/anS5HDklN7 \ud83c\udded\ud83c\uddf0 Babar Hayat 2016\n\ud83c\udde7\ud83c\udde9 Tamim Iqbal 2016\n\ud83c\udde6\ud83c\uddea Shaiman Anwar 2017\n\ud83c\uddf0\ud83c\uddfc Ravija Sandaruwan 2019\n\ud83c\uddf5\ud83c\uddec Tony Ura 2019\n\ud83c\uddea\ud83c\uddf8 Awais Ahmed 2019\n\ud83c\udde8\ud83c\udde6 Ravinderpal Singh 2019\n\ud83c\uddf3\ud83c\udde6 JP Kotze 2019\n\ud83c\uddf7\ud83c\uddf4 Sivakumar Periyalwar 2019\n\ud83c\udde8\ud83c\uddff Sudesh Wickramasekara 2019\n\ud83c\udde6\ud83c\uddf9 Bilal Zalmai 2019\n\n\ud83c\uddf3\ud83c\uddf5 PARAS KHADKA 2019 \ud83d\udc4f\n\n(2/2) Maiden centurions in men's T20Is for:\n\ud83c\udf34 Chris Gayle, 2007\n\ud83c\uddf3\ud83c\uddff Brendon McCullum 2010\n\ud83c\uddee\ud83c\uddf3 Suresh Raina 2010\n\ud83c\uddf1\ud83c\uddf0 Mahela Jayawardene 2010\n\ud83c\uddff\ud83c\udde6 Richard Levi 2012\n\ud83c\udff4\udb40\udc67\udb40\udc62\udb40\udc73\udb40\udc63\udb40\udc74\udb40\udc7f Richie Berrington 2012\n\ud83c\udde6\ud83c\uddfa Aaron Finch 2013\n\ud83c\udff4\udb40\udc67\udb40\udc62\udb40\udc65\udb40\udc6e\udb40\udc67\udb40\udc7f Alex Hales 2014\n\ud83c\uddf5\ud83c\uddf0 Ahmed Shehzad 2014\n\ud83c\udde6\ud83c\uddeb Mohammad Shahzad 2016\n\n(1/2) https://t.co/vwy1bFL2MA 1\ufe0f\u20e3 Best match \u2013 \u2753\n2\ufe0f\u20e3 Top moment \u2013 \u2753\n3\ufe0f\u20e3 Most surprising result \u2013 \u2753\n4\ufe0f\u20e3 Best breakout player \u2013 \u2753\n5\ufe0f\u20e3 Best player \u2013 \u2753\n\nVOTE for your favourites from an unforgettable English summer \ud83d\udc47 Australia win the first T20I!\n\nSkipper Chamari Athapaththu led Sri Lanka's fight with a record 113 but the visitors fell 41 short of Australia's 217/4.\n\n\ud83d\udcdd SCORECARD \ud83d\udc47\n\nhttps://t.co/830Oy1NgCD https://t.co/74SeR0REnt Chamari Athapaththu's innings from 50 to 113:\n\n6\ufe0f\u20e3 1 . 6\ufe0f\u20e3 1 6\ufe0f\u20e3 . 4 1 4 6\ufe0f\u20e3 2 4 1 4 4 1 . 4 2 6\ufe0f\u20e3 W\n\nWhat. A. Knock. \ud83d\udd25\ud83d\udd25\n\n#AUSvSL https://t.co/Fc6r1nmqKo Athapaththu yesterday: \"Play freely, play positive.\"\n\nAthapaththu today: \ud83d\udcaf \u2013 first Sri Lanka woman to score a hundred in T20Is.\n\n\ud83c\uddf1\ud83c\uddf0 skipper walks her talk! https://t.co/2Xd22uOvXR The Sri Lanka captain is leading from the front in Sydney! \n\nChamari Athapaththu brings up her fifty, lifting her side to 96/2 in 13 overs. \n\n#AUSvSL LIVE \ud83d\udc47\nhttps://t.co/830Oy1NgCD https://t.co/QfitrAXHEQ \u261d\ufe0f Yashoda Mendis\n\u261d\ufe0f Anushka Sanjeewani\n\nTwo wickets for Australia in the first 10 overs! The hosts have reduced Sri Lanka to 62/2. \n\n#AUSvSL LIVE \ud83d\udc47\nhttps://t.co/830Oy1NgCD https://t.co/xKBD25gidE \"The Test championship brings in a new dimension. It is a new sort of excitement for players.\"\n\nVernon Philander is excited about the upcoming #INDvSA Test series.\n\nhttps://t.co/AZVpWKXR1J Beth Mooney's brilliant 113 and quick forties from Alyssa Healy and Ashleigh Gardner power Australia to 217/4.\n\nCan Sri Lanka chase down the target? https://t.co/UNiRdn0fP9 WHAT AN INNINGS! \ud83d\udd25\n\nAustralia batter Beth Mooney brings up her second T20I \ud83d\udcaf in the first #AUSvSL T20I in Sydney. \n\nLIVE: https://t.co/830Oy1NgCD https://t.co/4Oo9EYJCo9 Fifty up for Beth Mooney!\n\nThe Australia opener brings up her fourth T20I half-century in the #AUSvSL opener at North Sydney Oval.\n\nFollow the action live \ud83d\udc47\nhttps://t.co/830Oy1NgCD https://t.co/vXLVzL4WLm \u261d\ufe0f \u2013 First spinner to 300 Test wickets\n5\ufe0f\u20e3 \u2013 18 five-wicket hauls\n\ud83c\udf34 \u2013 Best figures of 11/157\n\u2b50 \u2013 Over 1000 first-class wickets\n\nHappy birthday to the legendary Lance Gibbs \ud83d\ude4c https://t.co/f5VEcskA5g Oshadhi Ranasinghe picks up the prized scalp of Alyssa Healy, who falls after a blazing knock. \n\nAustralia are 77/1 after seven overs.\n\n#AUSvSL LIVE \ud83d\udc47\nhttps://t.co/830Oy1NgCD https://t.co/hIcGaFEI5Z When you realize it's Sunday today \ud83d\ude0e\ud83c\udf1e\n\n@rashidi_jr_268 | #CPL19 https://t.co/BTuBCIubv3 Australia have opted to bat in the first women's T20I against Sri Lanka at North Sydney Oval.\n\n#AUSvSL LIVE \ud83d\udc47\n\nhttps://t.co/830Oy1NgCD https://t.co/eHn5PUFviG \"We've got to keep working hard to make sure we stay No.1.\"\n\nAustralia captain Meg Lanning wants her \"world-class\" team to dominate world cricket.\n\nhttps://t.co/RzkmagVaam \ud83d\udcac \"We've got really high expectations for ourselves internally and where we want to get to as a team and how dominant we want to be in world cricket.\"\n\n~ \ud83c\udde6\ud83c\uddfa's Rachael Haynes https://t.co/UBJWoo3Xcq Happy birthday, Mominul Haque!\n\nHe has the highest batting average (41.47) for any Bangladesh batsman in Test cricket who has played at least five Tests \ud83d\ude4c https://t.co/r878Mm2oQo Guess who \ud83d\udc40 https://t.co/lFGacAzKlq Paras Khadka became the 49th player to hit a T20I century earlier today!\n\nHis match-winning innings also made Nepal the 26th country to have a T20I centurion. https://t.co/ArqGqM48Mr Sarah Taylor retires with the third most stumpings in all international cricket, behind only MS Dhoni and Kumar Sangakkara \ud83d\udc4f https://t.co/PH6feM6aAI The best opening batsman in Test cricket right now is _________? \ud83c\uddee\ud83c\uddf3 and \ud83c\uddff\ud83c\udde6 begin their Test series on Wednesday.\n\nWhen the sides last played five-day cricket, South Africa came out on top with a 2-1 series victory. Will India turn the tables?\n\n#INDvSA https://t.co/8OXFEi00Qa Nepal win by nine wickets.\n\nCaptain Paras Khadka finishes on 106* off 52 balls! https://t.co/6SymdyfRPI A massive six from Tim David to finish the \ud83c\uddf8\ud83c\uddec innings, taking them to 151/3.\n\nThe skipper ends on 64* from 44 balls \ud83d\udc4f \n\nCan Nepal chase this? https://t.co/6kDZtXPPEE \u2b50 Highest score batting at No.7 or lower in women's Tests\n\u2b50 50 international wickets\n\u2b50 The first woman to play in the Bradford Premier League\n\nHappy birthday to Kathryn Leng, a trailblazer in English cricket \ud83d\ude4c https://t.co/VFDanR0CaE Alastair Cook and trophies \u2013 a familiar sight \ud83e\udd37 https://t.co/Y6zwJr8jXg Singapore have won the toss and chosen to bat first.\n\nCan they repeat their performance from July when they beat today's opponents \ud83c\uddf3\ud83c\uddf5 by 82 runs?\n\nSTREAM \ud83d\udc47 \nhttps://t.co/TZG4AugRbW https://t.co/ajIbOKqF8W \ud83d\udc49 52 Tests\n\ud83d\udc49 158 ODIs\n\ud83d\udc49 5279 international runs\n\ud83d\udc49 Player of Match v Pakistan in Sharjah, 1986, for his terrific fielding, despite neither batting nor bowling \ud83e\udd2f\n\nTeams coached: \ud83c\udde8\ud83c\udde6 \ud83c\udf34 \ud83c\udde7\ud83c\uddf2\n\nWishing West Indies' Gus Logie a very happy birthday \ud83c\udf89 https://t.co/IjskkhgR0U \ud83d\udcac \"We all know they are the best team in the world, they've beaten England in the Ashes and West Indies in their home.\"\n\nChamari Athapaththu urges her side to not wilt under Australia's brilliance and play \"freely\" \ud83d\udc47\n\nhttps://t.co/SecSxM6KLf You played a big part, @Sarah_Taylor30 \ud83d\ude4c\n\nCongratulations on an incredible career \ud83d\udc4f https://t.co/5GeDnz1pgC 3\ufe0f\u20e3 T20Is\n3\ufe0f\u20e3 ODIs\n\nLet the games begin \ud83d\udd25 https://t.co/LVUgirL8E5 \ud83d\udc55 86 international appearances\n\ud83c\udfcf 4717 runs\n\u261d\ufe0f 40 wickets\n\n1975 &amp; 1979 \u2013 a part of two ICC Men's @cricketworldcup campaigns\n\nHappy birthday to Pakistan's Majid Khan \ud83c\udf82 https://t.co/MAoiJvmSel #OnThisDay in 2018, India completed a thrilling last-ball victory over Bangladesh to clinch the Asia Cup \ud83c\udfc6\n\nDespite missing out on the title, \ud83c\udde7\ud83c\udde9's Liton Das was adjudged Player of the Match for his 121 off 117 balls \ud83d\ude4c https://t.co/Rc8EepR9xe \u26a1 \"Lightning-fast behind the stumps\"\n\ud83d\udc4a \"A fierce competitor\"\n \ud83c\udfc6 \"A champion both on and off the field\"\n\nTeammates and rivals came together to laud Sarah Taylor's terrific career after she announced her international retirement \ud83d\ude4c https://t.co/L5MplLjxbH Sushma Verma last represented India against England in April 2018.\n\n#WIvIND squad and fixtures \ud83d\udc47\n\nhttps://t.co/yci9P0NWsE The second ODI between Pakistan and Sri Lanka at Karachi has been rescheduled from Sunday 29 September to Monday 30 September due to the rain which washed out the first ODI.\n\nHave you ever heard of rain so heavy it washes out a game two days away?!\n\nhttps://t.co/ZTIhgcJc1O ICYMI: Happy with this appointment, \ud83c\udde6\ud83c\uddeb fans?\n\nhttps://t.co/IeWWY7gzsq \"I felt like I was still playing pretty well. I felt like I was in a good place.\"\n\nDid Usman Khawaja deserve to be dropped during England and Australia's drawn Ashes series?\n\nhttps://t.co/dphccSpshP ICYMI\n\nhttps://t.co/FnSZE5AHb8 ICYMI: ODI cricket's return to Karachi will have to wait after rain played spoilsport in the first ODI between Pakistan and Sri Lanka.\n\nhttps://t.co/nGAaHq7U9C They were given a real scare, but in the end a vital partnership between Richmond Mutumbami and Ryan Burl guided Zimbabwe to victory over Nepal.\n\nReport \ud83d\udc47\nhttps://t.co/EGjMjF5Fnu 6\ufe0f\u20e35\ufe0f\u20e33\ufe0f\u20e33\ufe0f\u20e3 international runs - second-most for England women\n2\ufe0f\u20e33\ufe0f\u20e32\ufe0f\u20e3 international dismissals - the most in women's cricket\n3\ufe0f\u20e3 world titles\n3\ufe0f\u20e3 ICC Women's T20I Cricketer of the Year awards\n1\ufe0f\u20e3 ICC Women's ODI Cricketer of the Year award\n\nSarah Taylor: all-time great \ud83d\udc4f https://t.co/nuuIREBqrh What an innings from Richmond Mutumbami!\n\nIn the first T20I of the Singapore tri-series against Nepal, Zimbabwe needed 51 runs from six overs, and the game was in the balance. Three overs and 47 runs later, it was all but done, with Zimbabwe eventual victors by five wickets. https://t.co/4l5oCvY7fb Details \ud83d\udc47\nhttps://t.co/IeWWY7gzsq #NewCoverPic https://t.co/p1RuIh7D0d We've heard of fast bowlers feeling a bit stiff at the end of a long season, but this is unprecedented @petersiddle403 \ud83d\ude02 https://t.co/gMOq1cpzNi Details \ud83d\udc47\nhttps://t.co/FnSZE5AHb8 The first ODI between Pakistan and Sri Lanka at Karachi has been abandoned due to rain \ud83d\ude1e\n\nIt's the first time an ODI has ever been washed out at the venue. As you can see, it was a bit wet...\n\n#PAKvSL https://t.co/mWGYrAzL3x JUST IN: Former South Africa all-rounder Lance Klusener has been appointed as Afghanistan's head coach. https://t.co/2mQa6kvKVG JUST IN: Triple world champion Sarah Taylor has announced her retirement from international cricket.\n\nCongratulations on a stellar career \ud83d\udc4f https://t.co/3jONmZCndC \"This is a good team, but Virat needs to bring back the wrist-spinners\"\n\nIn lead up to the @T20WorldCup, Ganguly feels it is important that the Kuldeep-Chahal pair are brought back in \ud83c\uddee\ud83c\uddf3's T20I setup.\n\nhttps://t.co/7lQtXyHycc Mood.\n\n#PAKvSL https://t.co/ITnMvzyVun Unfortunately, rain is set to delay the start of the first men's ODI in Karachi in over a decade \u2614\ud83d\ude1e\n\n#PAKvSL UPDATES \u27a1\ufe0f https://t.co/jcW874aFiU https://t.co/VshZx4svfl The #PAKvSL ODI series gets underway in Karachi today!\n\nWho do you think will take the \ud83c\udfc6 home? https://t.co/vgY0ZZd12o In 16 ODIs and 32 T20Is for \ud83c\uddf1\ud83c\uddf0, she has scored 451 runs and taken 15 wickets.\n\nIn the 2018 Women's T20 Asia Cup, she was Sri Lanka's highest wicket-taker!\n\nHappy birthday Nilakshi de Silva! https://t.co/C07nbSI3Qf \"He is going to be a match-winner [as Test opener] as well, and we are going to give him time\"\n\n\ud83c\uddee\ud83c\uddf3 coach Ravi Shastri feels Rohit Sharma has it in him to succeed at the top of the order in red-ball cricket.\n\nhttps://t.co/iQWj6LWEIh He represented New Zealand in 8 Tests and 121 ODIs between 1990 and 1999, and picked up 113 ODI wickets at a superb economy of 3.76!\n\nHappy birthday to @BLACKCAPS selector Gavin Larsen! https://t.co/eXFbqqxLDB ICYMI: Essex won their eighth County Championship title, their second in three seasons, on a thrilling final day against Somerset.\n\nhttps://t.co/b76f16JJgb You guessed right! It's @Bazmccullum, who turns 38 today.\n\nHe still holds the record for the fastest Test century (in terms of balls taken), and was inspirational as he led New Zealand to the #CWC15 final.\n\nHappy birthday! https://t.co/Zp63vXlZkX Debut: 1993\nRuns: 40,826\n100s: 96\n\ud83c\udff4\udb40\udc67\udb40\udc62\udb40\udc65\udb40\udc6e\udb40\udc67\udb40\udc7f caps: 202\n\nMarcus Trescothick, a Somerset and England legend, bade farewell to professional cricket yesterday.\n\n#ThankYouTres https://t.co/x2yBOsxKrk Ajinkya Rahane: \"He has worked so hard and if he gets an opportunity, I am sure he will do well. We all know the quality he has \u2013 special talent.\"\n\nDo you agree that Rohit Sharma should open the batting against South Africa?\n\nhttps://t.co/Xa4YvwVuqU \ud83e\udd14 https://t.co/wtobch2UlD ICYMI: \u2614\u2614\ud83d\ude1e\ud83d\ude1e\n\nhttps://t.co/O4IhmfJ7Li Congratulations @EssexCricket, the 2019 County Championship champions \ud83c\udfc6 https://t.co/h7flbgKecP \"They showed the fighting spirit that Irish teams have been renowned for, so it is great to see that coming through particularly in the newer members of the squad\" - Chair of the national men\u2019s selectors Andrew White on Ireland's tri-series performance.\n\nhttps://t.co/BHNzzxs6gC Did you know Brett Lee dressed as a \ud83d\udc26 for an Australian singing show? Catch this and more \ud83e\udd2f stuff in our latest #OnTheUp \u2b07\ufe0f \nhttps://t.co/OAhVvbirJO The second T20I at Surat between India Women and South Africa Women has been abandoned without a ball bowled.\n\nUs right now: https://t.co/aISTcVmPaJ Rain has delayed the toss in the second T20I between India Women and South Africa Women at Surat \u2614\n\nHere's hoping the conditions improve soon \ud83e\udd1e\n\n#INDvSA https://t.co/C1QBeYTzxo Well said \ud83d\udc4f https://t.co/d6kkIpsyKd After nine years in the position, Greg Chappell retires from his position as CA's national talent manager.\n\nGraham Manou has been named as his successor in the role.\n\nhttps://t.co/GIjSvrj0wi \u2747\ufe0f 173 international appearances\n\u2747\ufe0f 7394 runs across formats\n\u2747\ufe0f First England player to score three successive ODI tons\n\nHappy Birthday to a fine batsman and 2019 World Cup winner, Jonny Bairstow \ud83c\udf89 https://t.co/QHQH6g9dfN After two years on the international sidelines, Rachel Priest has won back her @WHITE_FERNS contract \ud83d\udd25\n\nAnna Peterson makes a comeback too, while two youngsters have signed their maiden contracts.\n\nhttps://t.co/kKLur9cL66 Pakistan's ODI against Sri Lanka in Karachi on Friday will be special for two reasons:\n\ud83d\udd38 Their first ODI at home since May 2015\n\ud83d\udd38 Misbah's first match as international coach\n\nWhich team will come out on top?\n\n#PAKvSL Preview \ud83d\udc47\n\nhttps://t.co/OnPRMzTEBh RT @vanuatu_cricket: We love them, do you? \u263a\ufe0f\ud83c\udf3a\nBrings meaning to the 'island way' in every way shape and form, and boy do these smiles comp\u2026 South Africa are feeling confident in lead up to their Test series against India.\n\n#INDvSA https://t.co/yasLHM5jMa \"It's all looking at the bigger picture and making sure that our team is improving and getting to where we want to be.\"\n\nDefending champions \ud83c\udde6\ud83c\uddfa are getting ready for the upcoming @T20WorldCup says vice-captain Rachael Haynes \u2b07\ufe0f \nhttps://t.co/hCgdblNwIl \"If we can conquer those challenges it will be really rewarding.\"\n\n\ud83c\uddff\ud83c\udde6 opener Aiden Markram knows that conditions in India will be tough, but he's looking forward to the challenge \ud83d\udcaa\n\nhttps://t.co/zIU96Jhz0J ICYMI: The latest @MRFWorldwide ICC Men's T20I Rankings saw some major updates.\n\nCheck it out \ud83d\udc47\nhttps://t.co/DX80kHAdvr https://t.co/L1DkDPUF9h Happy birthday, Ian Chappell!\n\nHe scored 14 Test centuries in 75 matches at a very impressive average of 42.42 \ud83d\udc4f https://t.co/zFPbI592jZ With Australia beginning their T20I series against Sri Lanka in just over a month, which opening combination would you use at the top of their order? https://t.co/xzVhZLGkZa Dad: How did you get out today?\n\nMe: I got an amazing delivery, it swung in and was just too good for me! https://t.co/Mu6xbm2zQ5 Ollie Pope celebrates his recall to the England Test squad with a century for Surrey in their game against Nottinghamshire! https://t.co/DIKKseCA4T ICYMI \ud83d\udc47 \nhttps://t.co/935bs6UqaR It's \ud83c\udd70\ufe0f\n\nDid you get it right? https://t.co/N66pq6L36t What do you think of the @vanuatu_cricket kit? \ud83c\udf3a\n\n#RoadToCWC23 https://t.co/O6bXj8L30W \ud83c\udfcf 41 international matches\n\ud83c\udfc6 Three ICC Men's @cricketworldcup appearances\n\ud83c\uddff\ud83c\uddfc \ud83c\uddf3\ud83c\udde6 Former Zimbabwe and Namibia head coach\n\nWishing Andy Waller a very happy birthday \ud83c\udf70 https://t.co/fZwI8kGLoO I make this face when _______\n\nWhich cricket match made you do this? https://t.co/cL6rE1nyk4 \ud83d\udc49 168 international appearances\n\ud83d\udc49 5,746 runs\n\nThe former England batter holds the record for the highest individual score at Lord's. In 2018, she was inducted into the ICC Hall of Fame.\n\nHappy birthday, Claire Taylor! https://t.co/36OioVNXb2 \ud83d\udcf8 When you try to click a serious photo...\n\nExpectation \ud83c\udd9a Reality https://t.co/VQqaP6gp1w @cricketworldcup Batsman 1: You're out \ud83d\ude20\n\nBatsman 2: No, you're out \ud83d\ude24 https://t.co/veYoYmoPcn \"We look forward to the fans being behind us when we start a new era in Pakistan cricket.\"\n\n\ud83c\uddf5\ud83c\uddf0 players ask fans to come out in large numbers for the #PAKvSL series.  \n\nhttps://t.co/Dq7o5G865M @MRFWorldwide Find the latest @MRFWorldwide ICC T20I Rankings here: https://t.co/DX80kHiC6R https://t.co/7ZIEnsXTQK Richie Berrington \u2197\ufe0f\nKevin O'Brien \u2197\ufe0f\n\nThe \ud83c\udff4\udb40\udc67\udb40\udc62\udb40\udc73\udb40\udc63\udb40\udc74\udb40\udc7f and \u2618\ufe0f all-rounders sizzle in the latest @MRFWorldwide ICC Men's T20I Rankings! https://t.co/re5JtwnX0S Another Afghanistan spinner makes it to the top 10!\n\n@Mujeeb_R88 has jumped 29 places to No.9 in the latest @MRFWorldwide ICC Men's T20I Ranking for bowlers. https://t.co/upJdPbEuej Spot the ball \ud83d\ude09 https://t.co/V3H3PHIz2P \"Will just try and get some big runs. That's my plan.\"\n\nAustralia batsman Aaron Finch wants to give his Test career \"one more push\".\n\nhttps://t.co/O3rh6XJfXB \ud83c\udfc6 \ud83e\udd1d\n\n#NewCoverPic https://t.co/gAfpsz1cUI #OnThisDay in 2018, Afghanistan spinners produced a special performance against India in the Asia Cup, to hold the eventual champions to a tie \ud83e\udd1d\n\nSCORECARD \u25b6\ufe0f https://t.co/QOBmNShq3d https://t.co/Y3wpAyuMmT Australia announce squads for their first home assignment of the summer with one eye on the ICC Women's @T20WorldCup.\n\nDetails \ud83d\udc47\n\nhttps://t.co/5bsl4QMpZD ICYMI \ud83d\udc47 \nhttps://t.co/bXZSBfg2ME Happy birthday to one of India's finest bowlers Bishan Bedi!\n\nThe left-arm spinner took 266 Test match wickets in 67 Test matches. https://t.co/TOUuIhRdE8 3\ufe0f\u20e3 - Maidens bowled by Deepti Sharma in India's win over South Africa in the first T20I. No other Indian cricketer has ever bowled as many in a T20I innings.\n\nAt one point, her figures read 3-3-0-3 \ud83d\ude31\nhttps://t.co/y9z1ne2Cup Happy birthday Tim Zoehrer!\n\nPredominantly a wicket-keeper batsman, Zoehrer also took 38 first class wickets for Western Australia. https://t.co/TtqebYyzpj What is it with Jack Leach and 10th-wicket partnerships?\n\nThe England international helped his county side Somerset from 144/9 to 203 all out. https://t.co/V1Qd1r5v21 Caption this \ud83d\udc40 https://t.co/VtOVscFB9S It was an unfortunate end to the tri-series between Bangladesh and Afghanistan.\n\nRead more \ud83d\udc47 \nhttps://t.co/RwJf8ksAFM WOW what a performance from Deepti Sharma!\n\nIn her side's victory today she recorded figures of 4-3-8-3 \ud83d\udd25 https://t.co/DSIyNLobuY A valiant half-century from Mignon du Preez isn't enough to see South Africa to victory over India!\n\nThey lose by 11 runs, giving India a 1-0 lead in the five-match series. https://t.co/46IBPI2jwh Poonam Yadav has just taken two wickets in two balls for India!\n\nSouth Africa are 51/5 after ten overs of their innings.\n\nScorecard \u27a1\ufe0f https://t.co/Rj4hAPIliR https://t.co/Tv4flUwh55 Deepti Sharma currently has figures of 2-2-0-2 \ud83d\udd25 \n\nSouth Africa in trouble at 33/3 chasing 131 for victory in the first T20I.\n\nScorecard \u27a1\ufe0f https://t.co/Rj4hAPIliR https://t.co/kArQuTlEMx \ud83d\udea8 MATCH ABANDONED \ud83d\udea8 \n\nPersistent rainfall means the final of the tri-series between Bangladesh and Afghanistan has been abandoned.\n\nThe trophy will be shared between the two sides! https://t.co/n38p9SSNDo India finish on 130/8, Harmanpreet Kaur top-scoring with 43, and Shabnim Ismail and Nadine de Klerk chipping in with five wickets between them.\n\nWill the hosts defend this, or are you backing South Africa to chase this down?\n\n#INDvSA SCORE \ud83d\udc47\nhttps://t.co/Rj4hAPIliR https://t.co/B9vgCrADtW The situation at Dhaka \ud83d\ude1e\n\n#BANvAFG UPDATES \ud83d\udc47\nhttps://t.co/gOk35O1dFZ https://t.co/Bk2SCun3tt Sune Luus has won the toss and South Africa will bat first in the first T20I against India!\n\nFor the hosts, 15-year-old Shafali Verma will make her international debut, while Nonkululeko Mlaba will play her maiden game for the Proteas.\n\n#INDvSA SCORE \ud83d\udc47\nhttps://t.co/Rj4hAPIliR https://t.co/MPD7H0TjnG DETAILS \ud83d\udc47 \nhttps://t.co/bXZSBfg2ME Bad news, cricket fans \u2614\n\nThe toss in the tri-series final between Bangladesh and Afghanistan has been delayed due to rain.\n\nUPDATES \u27a1\ufe0f https://t.co/gOk35O1dFZ https://t.co/r2cM5vDRqf JUST IN: Jasprit Bumrah, the @MRFWorldwide No.3 ranked Test bowler in the world, has been ruled out of India's Test series against South Africa with a \"minor stress fracture in his lower back\". Umesh Yadav will replace him in the squad. https://t.co/Ck3Fuq2QmZ \ud83d\udde3\ufe0f \"It's been a good year for myself and to get that call is really pleasing.\"\n\nDominic Sibley can't wait to get into Test cricket action.\n\nhttps://t.co/pDiBTBd0FW #BANvAUS Tests:\nInitial plan \ud83d\uddd3\ufe0f \u279e February 2020\nPostponed plan \ud83d\uddd3\ufe0f \u279e \u2753\n\n#BANvAUS T20Is\nInitial plan \ud83d\uddd3\ufe0f \u279e October 2019\nPostponed plan \ud83d\uddd3\ufe0f \u279e \u2753\n\nhttps://t.co/r23I3cJ4el \ud83d\udcac \"He's difficult, and those idiosyncrasies, where he lets the ball go and turns his body, gosh, that would annoy me.\u201d\n\nHadlee \ud83c\udd9a Smith, that would have been a battle for the ages! \ud83d\udd25\n\nhttps://t.co/T5IMtv6UgI Stress levels in India #OnThisDay in 2007:\n\n       \u2588         \u3000\u3000\n       \u2588\n       \u2588\n       \u2588\n       \u2588\n       \u2588                              \uff3f\n\n\"In the air...\"       \"Sreesanth takes it!\" https://t.co/TH79RIdPU5 Bridgetown witnessed a low-scoring #CPL19 thriller as Jamaica beat Barbados by five runs.\n\nGlenn Phillips top-scored with the bat. Will we see him play for \ud83c\uddf3\ud83c\uddff in the @T20WorldCup next year?\n\nhttps://t.co/Uz69AAFm2J \ud83d\udde3\ufe0f \"I'm pretty consistent, so I'm going to keep it pretty simple and do what I've always done.\"\n\nAustralia's Adam Zampa had a tough #CWC19, but he hasn't lost faith in his process \ud83d\udc47\n\nhttps://t.co/63O33CpYHB Bangladesh won three of their four league games in the T20I tri-series, but the best is yet to come, according to Russell Domingo \ud83d\udc40\n\n#BANvAFG\n\nhttps://t.co/OZA0O3Gyxy \ud83c\udd70\ufe0f 154 international appearances\n\ud83c\udfcf 6302 runs\n\ud83d\udcaf 13 centuries\n\n\ud83c\udfc6 1983 ICC Men's @cricketworldcup winner \ud83d\udc4f\n\nHappy birthday to India's Mohinder Amarnath \ud83c\udf82 https://t.co/vm5OkTQ5kT Recent form in T20Is:\n\n\ud83c\udde7\ud83c\udde9 \u279d W W L W L\n\ud83c\udde6\ud83c\uddeb \u279d L L W W W\n\n#BANvAFG tri-series final PREVIEW \ud83d\udc47\n\nhttps://t.co/OtscWDL7Dy Chase runs, not rainbows \ud83d\ude09 https://t.co/1c7TMu52F2 ICYMI \ud83d\udc47\nhttps://t.co/ycfZaERCgC Back in May, in one of the most exciting ODIs of all time, she claimed 2/49 with the ball before striking 71 as Pakistan tied with South Africa \ud83d\ude2e\n\nHappy birthday, Aliya Riaz \ud83c\udf89 https://t.co/GISz2GLhaH \ud83d\ude31\ud83d\ude31\ud83d\ude31 \n\nTasmania needed five runs to win with five wickets and 11 overs in hand against Victoria in Australian List A cricket. They lost by one run.\n\nThe most incredible collapse since______?\n\nhttps://t.co/wNc4Su52yx The first time New Zealand played Scotland in Scotland, this is what cricket kits looked like \ud83d\udd7a\n\nWho's looking forward to next year's ODI between the sides?\n\n#SCOvNZ https://t.co/KY9ehlF0oJ \"My aspiration is that Jonny becomes a top, top Test match batsman.\"\n\nHe was axed from England's squad to tour New Zealand today, but could the best of Bairstow in Test cricket be yet to come?\n\n#NZvENG\n\nhttps://t.co/cR0bz06u5T Exciting news, \ud83c\udff4\udb40\udc67\udb40\udc62\udb40\udc73\udb40\udc63\udb40\udc74\udb40\udc7f &amp; \ud83c\uddf3\ud83c\uddff fans \ud83d\ude4c\n\nhttps://t.co/PihnIfRXOu \ud83d\udea8 JUST IN \ud83d\udea8\n\nJonny Bairstow has been dropped from England's Test squad for their tour of New Zealand, with new-look groups named to contest the Test and T20I series.\n\nFULL SQUADS \ud83d\udc47\nhttps://t.co/crNy0KCVTY JUST IN: Virat Kohli reprimanded for inappropriate physical contact during third \ud83c\uddee\ud83c\uddf3 v \ud83c\uddff\ud83c\udde6 T20I.\n\n#INDvSA \n\nhttps://t.co/ycfZaERCgC \u2708\ufe0f\u27a1\ufe0f\ud83c\uddf3\ud83c\uddff\ud83e\udd14 \n\nEngland will announce their squads to tour New Zealand in exactly one hour's time \ud83d\udd51\n\nWho would you like to see on the plane?\n\n#ENGvNZ https://t.co/Ciw5baQ0uF In their last meeting, \ud83c\udde7\ud83c\udde9 defeated \ud83c\udde6\ud83c\uddeb in a T20I game for the first time since 2014.\n\nCan the hosts extend their winning momentum in the tri-series final or will the visitors bounce back to claim the title?\n\n#BANvAFG preview \ud83d\udc47\nhttps://t.co/OtscWDL7Dy \"He will remain one of the most loved cricketers.\"\n\nFormer India Test opener Madhav Apte passes away at 86. \n\nREAD: https://t.co/GkJXBmrwp4 https://t.co/FN4NCbma9e \"Coming into the series, we worked really hard on our catching and fielding. It is a good feeling to see everything coming together.\"\n\nSouth Africa T20I captain Quinton de Kock is pleased to see that his team's hard-work is paying off \u2b07\ufe0f \nhttps://t.co/cwRbngGDms \u2022 40 Tests\n\u2022 15 ODIs\n\u2022 2,254 international runs\n\nIn 1983, against Pakistan in Jalandhar, he made a career-best 201, which was at the time the slowest Test double-century in terms of time spent.\n\nHappy birthday, Anshuman Gaekwad! https://t.co/B4qdUGcX1b \"Our idea is to take the toss out of the equation and play the best combination.\" \n\n\ud83c\uddee\ud83c\uddf3 captain Virat Kohli wants his team to tackle challenging situations and be \"unfazed\" by the impact of toss.\n\nhttps://t.co/7ScmuE7L9p In August this year, the first ever T20 Physical Disability World Cricket Series was played. Here's a behind the scenes look at it \ud83d\udc47 https://t.co/n66yOzYjRG The New Zealand fast bowler has featured in 66 ODIs and 50 T20Is, claiming 114 international wickets.\n\nShe returned a career-best 4/27 in an ODI against Sri Lanka at the 2013 Women's @cricketworldcup.\n\nHappy birthday @LTahuhu! https://t.co/1BeDBVOWN2 South Africa's David Miller becomes only the second player to complete 50 catches in T20Is as a fielder \ud83d\udc4f \n\nCan you name the first? https://t.co/3DtfMTB8iJ Happy birthday Ambati Rayudu!\n\nThe Indian batsman has scored 1694 ODI runs for his country at an average of 47.05 \ud83d\udc4f https://t.co/YYbGOa3g4M Happy birthday to former Pakistan captain and wicket-keeper Moin Khan!\n\nHe took 147 dismissals for his country, can you name the three wicket-keepers who have taken more for Pakistan? https://t.co/T2t5kI1ind Dominic Sibley's first-class numbers this year:\n\n\ud83d\udd38 Innings \u2192 25\n\ud83d\udd38  Runs \u2192 1,575\n\ud83d\udd38  Highest \u2192 244\n\ud83d\udd38  Average \u2192 68.47\n\nIs he ready to open for \ud83c\udff4\udb40\udc67\udb40\udc62\udb40\udc65\udb40\udc6e\udb40\udc67\udb40\udc7f in Tests?\n\nhttps://t.co/bOQ4M7MU5d South Africa were in fine form in the third T20I today!\n\nReport \ud83d\udc47 \nhttps://t.co/a1ObHkH6DZ Happy birthday to New Zealand opening batsman Jeet Raval! https://t.co/uoo5ZLXpY8 South Africa win by 9-wickets and level the T20I series!\n\nCaptain Quinton de Kock led by example with 79* after his bowlers restricted India to 134.\n\n#INDvSA https://t.co/6843LpOvg3 Congratulations @QuinnyDeKock69 \ud83d\udc4f https://t.co/asqTvNhNsB Fifty for de Kock.\n\n#INDvSA \ud83d\udc47 \nhttps://t.co/0ty4PZXAOf https://t.co/S2zgWQ4qoD Leading by example \ud83d\udcaa \n\nQuinton de Kock approaches his half-century and South Africa require 59 runs to win from 10 overs!\n\nScorecard \u27a1\ufe0f https://t.co/0ty4PZXAOf https://t.co/bhPBu5Tlz4 Quinton de Kock is turning it on in Bengaluru!\n\nHe's hit two maximums in three balls off Navdeep Saini \ud83d\udc40 https://t.co/aVdjMw6ofu Thumbs up for the South African bowling attack!\n\nThey restrict India to 134/9.\n\nCan they level the series? https://t.co/kVUIWcNwht What a performance so far from the South African bowlers!\n\nIndia 99/6 after 15 overs, Beuran Hendricks has 2/9 from 3 overs \ud83d\udc4f \n\nScorecard \u27a1\ufe0f https://t.co/0ty4PZXAOf https://t.co/H7ZCEVUegS \ud83d\udea8 VIRAT KOHLI OUT FOR SINGLE FIGURES IN A T20I \ud83d\udea8 \n\nKagiso Rabada with the wicket \ud83d\udd25 https://t.co/dqNu84Px6m Just as Shikhar Dhawan was beginning to up the run-rate he falls to Tabraiz Shamsi!\n\nIndia 66/2 after 8 overs, as Rishabh Pant joins Virat Kohli at the crease.\n\nScorecard \u27a1\ufe0f https://t.co/0ty4PZXAOf https://t.co/EVaIHSaW67 India captain Virat Kohli wins the toss and his side will bat first in the third T20I against South Africa.\n\nFollow #INDvSA \u27a1\ufe0f https://t.co/0ty4PZXAOf https://t.co/EfzI0bG4MF \"A big target for us is increasing the number of youngsters with disabilities choosing cricket as their sport.\"\n\nIn the latest instalment of ICC 360, we delved into an important topic \ud83d\udc47\n\nhttps://t.co/pC7CT0YLIv \ud83d\udcac \"We cannot continue to play the fearless and expressive cricket that we did before.\"\n\nAiden Markram wants \ud83c\uddff\ud83c\udde6 youngsters to step up and take responsibility ahead of the #INDvSA Test series \ud83d\udc47\n\nhttps://t.co/CA3VhXprK3 Most of you got it right!\n\nIt's @darensammy88 and @KieronPollard55 \ud83e\udd1d https://t.co/CPLQwIGvbx \ud83d\udcac \"We play hard, even though we have young players in our squad, we not going to stand back to anyone.\"\n\nSouth Africa vice-captain speaks ahead of the final #INDvSA T20I \ud83d\udc47\n\nhttps://t.co/PWPXiAPYEF \u25aa\ufe0f Over 10,000 international runs\n\u25aa\ufe0f 21 international centuries\n\u25aa\ufe0f Average of 45.36 in Tests \ud83d\udc4f\n\n#OnThisDay in 1962, Martin Crowe, one of the greatest batsmen of his generation, was born \ud83d\ude4c https://t.co/K6PG3KbaZn Rishabh Pant will be the man in focus as India take on South Africa in the third T20I in Bengaluru.\n\n#INDvSA preview \u2b07\ufe0f\n\nhttps://t.co/u5lMSrbCQg Guess who? \ud83d\udc65 https://t.co/8Ntvlz0rNF \ud83c\udde6\ud83c\uddeb lost their final league game against \ud83c\udde7\ud83c\udde9 in the T20I tri-series, but this news is perhaps cause for greater concern ahead of the final \ud83d\udc47 \n\nhttps://t.co/fyDXuhsffJ \ud83c\udfc6 An all-round display from skipper Simon Harmer took Essex to their maiden T20 Blast title after a dramatic final against Worcestershire!\n\n#FinalsDay Report \ud83d\udc47\n\nhttps://t.co/OmCusIUKAh \ud83c\udd70\ufe0f 97 international appearances\n\ud83c\udfcf 3074 runs\n\nTeams represented: \u2618\ufe0f\ud83c\udff4\udb40\udc67\udb40\udc62\udb40\udc65\udb40\udc6e\udb40\udc67\udb40\udc7f\n\nCurrent head coach of the Ireland women's team \ud83d\ude4c\n\nHappy birthday, Ed Joyce \ud83c\udf82 https://t.co/8F1nANfFSF Happy birthday to one of Sri Lanka's finest batsman! \n\nThilan Samaraweera scored 5462 Test match runs with a highest score of 231 \ud83d\ude4c https://t.co/2dFzrKqtg9 #ShotOfTheDay https://t.co/a2zMU4IlU5 Before today, Bangladesh hadn't beaten Afghanistan in a T20I since 2014. They had Shakib Al Hasan to thank that, heading into the tri-series final, that streak was broken.\n\n#BANvAFG REPORT \ud83d\udc47\nhttps://t.co/CDEDsS2BbN #SpiritOfCricket\n\nWorcestershire's Hamish Rutherford and Daryl Mitchell console Nottinghamshire's Ben Duckett after Notts lost their T20 Blast semi-final by one run. https://t.co/LpKjDHIPbK Shakib Al Hasan with the bat today:\n\n7\ufe0f\u20e30\ufe0f\u20e3 runs\n8\ufe0f\u20e3 fours\n1\ufe0f\u20e3 six\n\nThe rest of Bangladesh's batsmen:\n\n6\ufe0f\u20e33\ufe0f\u20e3 runs\n1\ufe0f\u20e3 four\n1\ufe0f\u20e3 six\n\nHe's now Bangladesh's leading T20I runscorer, and also became the first man from his country to take 350 T20 wickets.\n\nWhat a player!\n\n#BANvAFG https://t.co/HaQ1rHmDuF \ud83c\udfbe\ud83c\udfcf\ud83e\udd14 \n\nWhat do you make of @rashidkhan_19's forehand technique @Wimbledon? \n\nhttps://t.co/YBXg8T7LaT Bangladesh win!\n\nAfif Hossain takes 2/9 from 3 overs and captain Shakib smashes 70* to see his side to victory \ud83d\udc4f https://t.co/aVIwLkSUoS Fifty for Bangladesh's skipper!\n\nIt's going to be a close finish in Chattogram, Bangladesh are five wickets down requiring 39 runs from 32 balls.\n\nhttps://t.co/djNuvPhMuz https://t.co/vF9hVukDDc Bangladesh require 77 runs from 60 balls.\n\nThe experienced duo of Shakib Al Hasan and Mushfiqur Rahim are at the crease, will they see their side to victory?\n\nMatch centre \u27a1\ufe0f https://t.co/djNuvPhMuz https://t.co/3DsDVrhvV1 Bangladesh restrict Afghanistan to 138/7.\n\nAfif Hossain, the star with the ball, finishing with figures of 2/9 from 3 overs!\n\nScorecard \ud83d\udc47 \nhttps://t.co/djNuvPhMuz https://t.co/79XqCNMvdZ Afghanistan lose two wickets in three balls!\n\nThey're 75/2 after 10 overs.\n\nMatch centre \u27a1\ufe0f https://t.co/djNuvPhMuz https://t.co/qSnnEdG28p A stunning start to the Australian summer for Marcus Stoinis!\n\nHe smashed an unbeaten 101 from just 58 balls as his Western Australia side set Victoria 387 to win \ud83d\udd25 https://t.co/nprFxyHl56 Bangladesh host Afghanistan in the final game of the tri-series today.\n\nBangladesh have won the toss and will bowl first!\n\nScorecard \u27a1\ufe0f https://t.co/djNuvPhMuz https://t.co/Wyp4eeAvBY One of the greatest fast bowlers of all time, he made 98 Test and 176 ODI appearances, claiming 630 wickets at an average of 22.11.\n\nIn 2011, he was inducted into the ICC Hall of Fame.\n\nHappy birthday to West Indies legend Curtly Ambrose! https://t.co/GtoGpyMnU8 The former England paceman was a vital member of the side that regained the Ashes in 1985.\n\nIn that series, he featured in two Tests, claiming 17 wickets at an average of just 10.88.\n\nHappy birthday Richard Ellison! https://t.co/AZKbB9gb9H \"I'm not worried about not being picked for the last two T20I series. I see this as an opportunity to do well in Tests.\"\n\nhttps://t.co/10sqdODvQJ Both Bangladesh and Afghanistan will look to iron out chinks when they lock horns in their last T20I tri-series outing before the final.\n\n#BANvAFG PREVIEW \ud83d\udc47\nhttps://t.co/H8QvLZZtfZ \u2022 462 international matches\n\u2022 19,321 runs\n\nThe hard-hitting West Indies batsman holds the record for most sixes in international cricket and also has the most T20 runs.\n\nHappy birthday @henrygayle! https://t.co/adPjSplsKc \"To lead the team to the win in my last game was really special.\"\n\nHamilton Masakadza bid goodbye to international cricket with an emotional win over Afghanistan.\n\nhttps://t.co/PbPErfA5HR Sri Lanka named their squads for their ODI and T20I series in Australia!\n\nhttps://t.co/peuxqQAnkb Zimbabwe won their final match of the tri-series against Afghanistan as Hamilton Masakadza finished his international career in style!\n\nReport \ud83d\udc47 \nhttps://t.co/lCDhN0mtVM #SpiritOfCricket https://t.co/5deRuy2ibN 7\ufe0f\u20e31\ufe0f\u20e3 with the bat today for Zimbabwe's Hamilton Masakadza as he bowed out of international cricket with a win!\n\n- 2223 Test runs with a top score of 1\ufe0f\u20e35\ufe0f\u20e38\ufe0f\u20e3 \n- 5658 ODI runs with a top score of 1\ufe0f\u20e37\ufe0f\u20e38\ufe0f\u20e3* \n\nAn outstanding servant to Zimbabwe cricket \ud83d\udc4f https://t.co/R8UnHykkZ3 What has been your favourite Jofra Archer moment in an England shirt so far? https://t.co/csqMrJKF1t The tri-series final between Ireland and Scotland ended in thrilling fashion!\n\nRead the report \ud83d\udc47 \nhttps://t.co/7DyS0RlQKo ICYMI \ud83d\udc47 \nhttps://t.co/iPdouBrHP4 \ud83d\udea8 Just in \ud83d\udea8\n\nEngland all-rounder Moeen Ali is taking an indefinite break from red-ball cricket.\n\nMore to follow. https://t.co/YHLvWDqh5Z Jofra Archer is one of six England players to receive a contract for all formats of cricket.\n\nFind out more \ud83d\udc47\nhttps://t.co/tvaX2LKwiG Maiden ODI century for Namibia's JP Kotze!\n\nHis side are going well in their ICC Men's Cricket World Cup League 2 fixture against USA.\n\nWatch live \u27a1\ufe0f https://t.co/zRX65Iugd5 https://t.co/4JJlI5ck16 \ud83d\udea8 Ireland win a thriller! \ud83d\udea8 \n\nScotland looked on course for victory but a wonderful fightback from the Ireland bowlers sees them to a one-run victory! https://t.co/tlfnwT3nMr \ud83d\udea8Zimbabwe win! \ud83d\udea8 \n\nThe perfect send-off for captain Hamilton Masakadza who has played his last game for his country today!\n\nHis side win by seven wickets \ud83d\udc4f https://t.co/Gx9cDTTKzt A crucial half-century from Scotland opener Matthew Cross! https://t.co/cUU7p8DFQK Fifty for Scotland's captain for the day, Richie Berrington!\n\nWill he lead his side to the tri-series trophy?\n\n#IREvSCO \ud83d\udc47 \n\ud83d\uddd2\ufe0f https://t.co/sqeUjSE80O\n\ud83d\udcf9 https://t.co/zdjcJnpXM1 https://t.co/YNNky9NQvW A 27-ball fifty for Zimbabwe's captain!\n\nFollow the second innings \u27a1\ufe0f https://t.co/z8kDBoBYxo https://t.co/8WRlUuNirR Brendan Taylor departs but Zimbabwe make a solid start to their run-chase.\n\nCaptain Hamilton Masakadza is still at the crease on 23*!\n\nScorecard \ud83d\udc47 \nhttps://t.co/z8kDBoBYxo https://t.co/UU7OIrbALL Afghanistan slip from 115/2 in the 12th over to 155/8 from their 20 overs.\n\nChris Mpofu took four wickets for his side \ud83d\udc4f \n\nCan Zimbabwe secure their first win of the tri-series?\n\n#AFGvZIM scorecard \ud83d\udc47 \nhttps://t.co/z8kDBoBYxo https://t.co/UILOVs348V Ireland set Scotland 187 to win, Kevin O'Brien top-scored with 63!\n\nThe winner of this match will be crowned champions of the tri-series \ud83c\udfc6 \n\nWho do you think will win?\n\nFollow the second innings \ud83d\udc47\n\ud83d\uddd2\ufe0f https://t.co/sqeUjSE80O\n\ud83d\udcf9 https://t.co/e00Mb2VrLS https://t.co/F2dtrCzZr1 Afghanistan lose four wickets in just 18 balls as Zimbabwe fight back \ud83d\udcaa \n\nScorecard \u27a1\ufe0f https://t.co/z8kDBoBYxo https://t.co/P1HjF5NqNF Maiden T20I half-century for Rahmanullah Gurbaz!\n\nHe's made quite a start to international cricket \ud83d\ude4c \n\n#AFGvZIM scorecard \ud83d\udc47\nhttps://t.co/z8kDBoBYxo https://t.co/AGpSP1WV1q A blistering half-century for Ireland's experienced all-rounder!\n\n#IREvSCO live \ud83d\udc47\n\ud83d\uddd2\ufe0f https://t.co/sqeUjSE80O \n\ud83d\udcf9 https://t.co/e00Mb2VrLS https://t.co/0SseUBenfx Runs are flowing in both Chattogram and Malahide so far!\n\nAfghanistan are 55/0 after six overs \ud83d\udc49 https://t.co/z8kDBoBYxo\nIreland are 76/1 after six overs \ud83d\udc49 https://t.co/kAUQXINaeH https://t.co/J1kvzMGsTV It's the final match of the tri-series between Ireland, Scotland and the Netherlands!\n\nToday's game sees hosts Ireland take on Scotland.\n\nScotland have won the toss and will bowl first.\n\nMatch centre \u27a1\ufe0f https://t.co/kAUQXINaeH\nLive stream \u27a1\ufe0f https://t.co/e00Mb2VrLS https://t.co/43PrjaZWYS News from the toss in the game between Afghanistan and Zimbabwe.\n\nAfghanistan have won the toss and they will bat first!\n\nScorecard \ud83d\udc47 \nhttps://t.co/oYqo41cEU2 https://t.co/o6PaRk4fHk \ud83d\udc49 74 Test wickets\n\ud83d\udc49 15 ODI wickets\n\nA special debut, as he got to be a part of New Zealand's first-ever Test win against England \ud83d\ude4c\n\nHappy birthday, Stephen Boock \ud83c\udf70 https://t.co/EeFYuxaJqA \ud83d\udd39 53 ODIs\n\ud83d\udd39 66 T20Is\n\ud83d\udd39 73 international wickets\n\nWishing \ud83c\uddf1\ud83c\uddf0's Udeshika Prabodhani a very happy birthday \ud83c\udf89 https://t.co/I73vx89c8z 1. Steve Smith\n.\n.\n.\n.\n.\n.\n.\n.\n.\n.\n.\n.\n\ud83d\udc40\ud83d\udc46 https://t.co/sFsoxDl0wY \ud83c\udfa9 Rod Marsh\n\ud83c\udfa9 Bruce Yardley\n\ud83c\udfa9 Geoff Lawson\n\n#OnThisDay in 1982, \ud83c\uddf5\ud83c\uddf0's Jalal-ud-Din claimed the first-ever hat-trick in ODI cricket against Australia \ud83d\udc4f https://t.co/SXe7i5mxAK \ud83d\udcac \"Thailand will play their first ICC event in Australia next year. Teams like that need to be encouraged. That is something we need to do more to spread women\u2019s cricket around the world.\"\n\nMore from Mithali Raj \ud83d\udc47\n\nhttps://t.co/SYcF3Be6bn \ud83d\udde3\ufe0f \"Our next step will be to put up a better performance to win against Afghanistan, which would give us more confidence ahead of the final.\"\n\nMahmudullah's take on the final league match between \ud83c\udde7\ud83c\udde9 and \ud83c\udde6\ud83c\uddeb before the tri-series final \ud83d\udc47\n\nhttps://t.co/SveJmjJvkw Zimbabwe's T20I record against Afghanistan: \n\nPlayed \u279d 8\ufe0f\u20e3\nLost \u279d 8\ufe0f\u20e3\n\n#AFGvZIM PREVIEW \ud83d\udc47\n\nhttps://t.co/iwDbjFL7om \ud83c\udfcf 60 Tests\n\ud83c\udfcf 250 ODIs\n\ud83c\udfcf 9879 international runs\n\nCurrent head coach of the \ud83c\uddf5\ud83c\uddf0 under-19 side \n\nHappy birthday, Ijaz Ahmed \ud83c\udf82 https://t.co/8sqcA064lM RT @cricketworldcup: Navneet Dhaliwal led from the front with a brilliant knock of 140 to help Canada beat Malaysia by 206 runs in the CWC\u2026 230 international wickets at a combined bowling average of 15.70  \ud83d\udc4f \ud83d\udc4f \nTop of the @MRFWorldwide T20I Bowling Rankings  \ud83d\udd1d \nThe youngest Test skipper of all time  \ud83d\udc4d \n\nHe really is phenomenal. \n\nHappy birthday, @rashidkhan_19! https://t.co/rwrwPzfgTR \"I became a Dhoni fan overnight. I think he cast a spell on me.\"\n\nMeet MS Dhoni's super fan: Saravanan Hari. https://t.co/sd7KsuFjFX Since a spirited Thailand sealed their spot in the Women's #T20WorldCup, interest in the game has only grown in the country. \n\nU19 girls showed massive interest in turning up for trials for the OBOR Cup to be held in China in November! \n\n#GlobalGame #FutureStars https://t.co/17I0kjuRKB ICYMI \u2b07\ufe0f \n\nhttps://t.co/qc1lhGkCk0 Hamza Tahir starred with the ball as Scotland cruised to a comfortable six-wicket win over Netherlands on Thursday. \n\nhttps://t.co/CmMDqrWZIc \"I have always admired New Zealand cricket and to work in the system is going to be very exciting.\"\n\nhttps://t.co/kVXvF9dPZM Victory for Scotland  \ud83c\udff4\udb40\udc67\udb40\udc62\udb40\udc73\udb40\udc63\udb40\udc74\udb40\udc7f \n\nAn emphatic one too \u2013 they've chased down 124 with 40 balls to spare  \ud83d\udc4f \ud83d\udc4f \n\n#SCOvNED SCORECARD \u2b07\ufe0f \nhttps://t.co/YNRR1v8SLq https://t.co/xng83ZJmuF Netherlands finish their 20 overs on 123/9. \n\nHamza Tahir led the way for Scotland with excellent figures of 4/30! Bas de Leede top-scored for Netherlands with 30 from 36 balls. \n\nWATCH LIVE STREAM \u2b07\ufe0f \nhttps://t.co/jmAKtd1ILz https://t.co/uN4AbqNhdK Sri Lanka's tour of Pakistan is to go ahead as planned, SLC have confirmed. \n\nhttps://t.co/qc1lhGkCk0 Sri Lanka bowler Akila Dananjaya has been banned from bowling in international cricket for 12 months. \n\nFULL STORY \u2b07\ufe0f \nhttps://t.co/3sXzaJIDuq \"Complicated technique, but extremely organised mindset.\"\n\n@sachin_rt  has had his say on Steve Smith's extraordinary Ashes series. What do you make of his analysis? \ud83e\udd14\nhttps://t.co/L7sOKN4hYR Netherlands have won the toss and will bat first against Scotland in the fifth T20I of the tri-series also featuring Ireland. \n\nLooks to be a lovely day at Malahide!\n\nWATCH LIVE STREAM \u2b07\ufe0f \nhttps://t.co/jmAKtd1ILz\n\nhttps://t.co/EkY5wZ0G6k \"I had no hesitation in accepting the role full-time.\"\n\nIreland great Ed Joyce has been confirmed as head coach of the women's team \ud83d\udc4f \n\nhttps://t.co/NkOAjT4qdj \ud83c\uddff\ud83c\udde6 were 88/1 after 11.1 overs, but lost four wickets for 41 runs in the next seven overs.\n\n\"That's where we failed a bit in our batting cause,\" conceded Temba Bavuma, after the loss to \ud83c\uddee\ud83c\uddf3 in the second T20I.\n\nhttps://t.co/IOISJxqOEj 3\u20e3 matches\n1\u20e30\u20e38\u20e3 runs \n5\u20e34\u20e3 average \n\nAfter her brilliant performance in the #WIvAUS T20I series, Australia opener @ahealy77 climbs to No.7 in the @MRFWorldwide ICC Women's T20I Rankings for batters. https://t.co/YTKmWz4M53 After their clean-sweep of West Indies in the T20I series, several Australian players have made noteworthy gains in the @MRFWorldwide ICC Women's T20I Rankings.\n\nhttps://t.co/idFVb4R1j6 RANKINGS UPDATE\n\nAustralia spinner @JJonassen21 storms into top 10, moving up 24 positions to No.4 in the latest @MRFWorldwide ICC Women's T20I Rankings for bowlers. https://t.co/Ar1zHsXxMM \"Joe Root is always the prized wicket... so I was pretty happy with that one.\"\n\n\ud83c\udde6\ud83c\uddfa quick Pat Cummins on that peach to remove the \ud83c\udff4\udb40\udc67\udb40\udc62\udb40\udc65\udb40\udc6e\udb40\udc67\udb40\udc7f captain for a golden duck in the fourth #Ashes Test at Old Trafford. https://t.co/EUt50q0UCD Was this your favourite Yuvraj innings? https://t.co/9ynHXx8qHJ The fastest men to 50 T20I wickets (in terms of matches played):\n\n1\ufe0f\u20e3: Ajantha Mendis \u2013 26 \n2\ufe0f\u20e3: Rashid Khan/Imran Tahir \u2013 31\n4\ufe0f\u20e3: Mustafizur Rahman \u2013 33\n\n'The Fizz' became the fourth-quickest man to 50 T20I wickets during \ud83c\udde7\ud83c\udde9's clash against \ud83c\uddff\ud83c\uddfc yesterday. https://t.co/R4BA6M0gEK ODI series: 3-0 \u2714\ufe0f\nT20I series: 3-0 \u2714\ufe0f\n\n\ud83c\udde6\ud83c\uddfa finished their Caribbean tour undefeated after registering a comfortable nine-wicket win in the final T20I.\n\nREPORT \ud83d\udc47\n\nhttps://t.co/viqOD2qZao Overs: 3\ufe0f\u20e36\ufe0f\u20e3\u23fa\ufe0f2\ufe0f\u20e3 \nMaidens: 1\ufe0f\u20e32\ufe0f\u20e3\nRuns conceded: 8\ufe0f\u20e36\ufe0f\u20e3 \nWickets: 1\ufe0f\u20e37\ufe0f\u20e3 \n\ud83e\udd2f \nhttps://t.co/0DmvCW2b0e For her \ud83d\udd25 performance with the ball, @JJonassen21 is adjudged Player of the Match.\n\n#WIvAUS https://t.co/JvBgE2hZR0 Australia complete a 3-0 series sweep over West Indies with a comfortable nine-wicket win in the third and final women's T20I. \n\nSCORECARD: https://t.co/B2kdJ5Wxej https://t.co/Ui6SF3Nyal 22 and counting. \n\nNo cricketer has passed 50 more times in T20Is than Virat Kohli. https://t.co/w965wAUFdH Australia are just 30 runs away from victory in the third and final women's T20I against West Indies.\n\nFollow the action live \ud83d\udc47\nhttps://t.co/B2kdJ5Wxej https://t.co/MJL2xm7y98 A number of records were broken in Netherlands' high-scoring win over Ireland at Malahide.\n\nREPORT \u2b07\ufe0f \nhttps://t.co/FIVK28GnW6 Bangladesh sealed a spot in the tri-series final with a comfortable victory over Zimbabwe. Their opponents in the final will be Afghanistan.\n\nREPORT \u2b07\ufe0f \n\nhttps://t.co/EBCcDCIhsH Virat Kohli was in imperious form with the bat yet again today in Mohali.\n\nREPORT \u2b07\ufe0f \nhttps://t.co/IRvbgvcw3q Tests: 53.14\nODIs: 60.31\nT20Is: 50.85\n\nVirat Kohli once again averages over 50 in all three international formats \ud83e\udd2f https://t.co/3R8GnYwtvE Mahmudullah was the recipient of the Player of the Match award in Bangladesh's victory over Zimbabwe \ud83d\udc4f \ud83d\udc4f \n\nHis rapid 62 helped his side to a comfortable victory that booked them a place in the tri-series final against Afghanistan next week.\n\n#BANvZIM https://t.co/07oNfdubsL Another record broken!\n\nVirat Kohli has now scored more runs in men's T20Is than any other cricketer \ud83d\udc4f \ud83d\udc4f https://t.co/1fBBGJjyOQ What is it about Virat Kohli and T20I run chases in Mohali? \ud83e\udd37\u200d\u2642\ufe0f \n\nHe finishes on 72* as India beat South Africa by seven wickets with an over to spare!\n\n#INDvSA https://t.co/IMfFFzn2wY 50 for Virat Kohli!\n\nIndia are inching closer to victory. Just another 26 needed from the last 23 balls.\n\n#INDvSA | FOLLOW LIVE \u2b07\ufe0f\nhttps://t.co/41fL88xUlU https://t.co/xbx8fFn98C Bangladesh complete an impressive 39-run victory over Zimbabwe!\n\nThe result means that Afghanistan and Bangladesh will contest the tri-series final next Tuesday.\n\nShafiul Islam ended with career-best T20I figures of 3/36 \ud83d\udc4f \ud83d\udc4f https://t.co/6oAbK0wGx5 Records, records everywhere!\n\nBen Cooper and Max O'Dowd combined to score the joint-highest ever partnership for \ud83c\uddf3\ud83c\uddf1 in T20I cricket. They put on 144 for the second wicket at Malahide \ud83d\ude4c\n\nIt equals Sterre Kalis and Denise van Deventer's effort against \ud83c\udde9\ud83c\uddea earlier this year! https://t.co/R9wYKbLL12 The Dutch win a thriller at Malahide!\n\nBen Cooper's 91*, the third-highest score by a Dutch cricketer in T20Is, takes them home with five balls to spare.\n\nA great game of cricket. https://t.co/ADEvof2OuB History made in England!\n\nKyle Abbott has just taken astonishing match figures of 17/86 for Hampshire against Somerset in the County Championship \ud83e\udd2f \n\nThey're the best match figures in first-class cricket since Jim Laker's 19/90 in 1956. https://t.co/gGvfPw8U3L An excellent performance from India in the field restricts South Africa to 149/5.\n\nDeepak Chahar was impressive for the hosts, picking up figures of 2/22 from his four overs \ud83d\ude4c \n\n#INDvSA | FOLLOW LIVE \u2b07\ufe0f \nhttps://t.co/41fL88xUlU https://t.co/d3rZ9rAOp9 Bangladesh are on fire in the field \ud83d\udd25 \ud83d\udd25 \ud83d\udd25 \n\nThey've reduced Zimbabwe to 2/2 after the first nine balls of their run chase.\n\nA long way back for them now. \n\n#BANvZIM | FOLLOW LIVE \u2b07\ufe0f \nhttps://t.co/4sMDZkYmpk https://t.co/swcBSJBq9a Aaaand he's out four balls later. \n\nVirat Kohli takes a stunning catch as Navdeep Saini makes the important breakthrough for India. https://t.co/0lhK1OYVYe What a way to mark your T20I captaincy debut!\n\n@QuinnyDeKock69 moves to 50 as South Africa look well placed against India in Mohali.\n\n#INDvSA | FOLLOW LIVE \u2b07\ufe0f \nhttps://t.co/41fL88xUlU https://t.co/dPBkR0rBzc Bangladesh get up to 175/7 at the end of their innings! \n\nWill Zimbabwe be able to chase it down? \n\n#BANvZIM | FOLLOW LIVE \u2b07\ufe0f \nhttps://t.co/4sMDZkYmpk https://t.co/cAcx9aahXt Ireland finish their innings on 181/7 from their 20 overs. \n\n19-year old Harry Tector top-scored with 60, his highest score yet in international cricket \ud83d\udc4a\n\n#IREvNED https://t.co/ABpXzf8H6e A half-century for Mahmudullah!\n\nHis fourth in T20I cricket \ud83d\ude4c \n\n#BANvZIM | FOLLOW LIVE \u2b07\ufe0f \nhttps://t.co/4sMDZkYmpk https://t.co/JqRmzVFDJj Quinton de Kock has made a good start with the bat on his T20I captaincy debut!\n\nHe's moved to 26 off 17 balls in Mohali. \n\n#INDvSA | FOLLOW LIVE \u2b07\ufe0f \nhttps://t.co/41fL88xUlU https://t.co/yJ4FIQedOv Bangladesh are going well against Zimbabwe in Chattogram.\n\nThey're 83/3 after 10 overs \u2013 Liton Das impressing with a 22-ball 38 \ud83d\udc4f \ud83d\udc4f \n\n#BANvZIM | FOLLOW LIVE \u2b07\ufe0f \nhttps://t.co/4sMDZkYmpk https://t.co/wEz9xtE0gi \ud83c\uddee\ud83c\uddf3 have won the toss and they will bowl first against \ud83c\uddff\ud83c\udde6 in Mohali!\n\nAnrich Nortje, Temba Bavuma and Bjorn Fortuin all make their T20I debuts for the visitors.\n\nFOLLOW LIVE \u2b07\ufe0f \nhttps://t.co/41fL88xUlU https://t.co/mIkphd2shJ Zimbabwe have won the toss and they will field first in their tri-series encounter against Bangladesh!\n\nWill they pick up their first win of the series today in Chattogram?\n\n#BANvZIM | FOLLOW LIVE \u2b07\ufe0f \nhttps://t.co/4sMDZkYmpk https://t.co/6TfXIj4rwk Ireland have won the toss and elected to bat against Netherlands in the 4th T20I of the tri-series, also involving Scotland.\n\nThe Netherlands must win to keep their hopes of topping the table alive!\n\nWATCH LIVESTREAM \ud83d\udc40\nhttps://t.co/KwY5n24dpb\n\nhttps://t.co/BVAPozLTof The legendary Richard Hadlee, who helped Stuart Broad remodel his action, was impressed by the Englishman's returns in the #Ashes. https://t.co/8tc8gao5TZ \ud83d\udc49 30 Tests\n\ud83d\udc49 44 ODIs\n\ud83d\udc49 114 wickets \n\nHe was a vital member of England's 1992 World Cup campaign and returned 3/22 in the final.\n\nHappy birthday Derek Pringle! https://t.co/C88hQmfjN8 RT @T20WorldCup: St Kitts and Nevis Patriots' Carlos Brathwaite in the Super Over against Trinbago Knight Riders in #CPL last night \ud83d\udc40\n\nWith\u2026 One of England's finest strike bowlers, he played 219 matches, claiming 467 international wickets.\n\nHe is still England's second-highest wicket-taker in ODIs, with 234 scalps.\n\nHappy birthday Darren Gough! https://t.co/FqTPYR9vTM Stuart Broad, who was England's leading wicket-taker in the #Ashes, has won the praise of his childhood idol and mentor Richard Hadlee.\n\nhttps://t.co/8CPi13i8Fu After the first game was washed out, \ud83c\uddee\ud83c\uddf3 and \ud83c\uddff\ud83c\udde6 will look to get the act on the road in Mohali today.\n\n#INDvSA 2nd T20I Preview \u2b07\ufe0f\n\nhttps://t.co/uQnoD9LqwV \"Hopefully, captaincy gives me the positive energy and I give the best I can.\"\n\nQuinton de Kock is ready for his new leadership responsibility.\n\nhttps://t.co/7VCx2hgRAm \"If we focus on what we need to do, everything will take care of itself. They are under pressure.\"\n\nZimbabwe are yet to win a game in the tri-series, but Sean Williams feels they can get off the mark when they take on Bangladesh today.\n\nhttps://t.co/WO32p8cUkb ICYMI: UAE and Jersey have named their squads for the ICC Men's #T20WorldCup Qualifier. \n\n\ud83c\udde6\ud83c\uddea : https://t.co/kln54B2buC\n\ud83c\uddef\ud83c\uddea : https://t.co/O0dSGt93Sd https://t.co/sgmYJxLgho #OnThisDay in 1997, Sourav Ganguly recorded his best ODI figures when he took 5-16 against Pakistan! https://t.co/zauck9IFS7 What Ravichandran Ashwin spell of bowling is your favourite? https://t.co/6GN4vtAuAt It was a high-scoring T20I in Malahide, as Ireland and Scotland did battle!\n\nReport \ud83d\udc47 \nhttps://t.co/xlICafLuIC No wonder they're all smiles, USA cruise to a five-wicket victory over Namibia!\n\nSteven Taylor had a fine all-round game, taking 4/23 with the ball then hitting 43 with the bat \ud83d\udc4f https://t.co/pHAcXH4Fcw USA are closing in on victory over Namibia!\n\nThey're 77/2 after 20 overs.\n\nFollow the second innings \ud83d\udc47 \n\ud83d\udcf9: https://t.co/LqKjcmg5EO https://t.co/OtQ8ZE3KEt 1.\n2.\n3.\n4. Steve Smith \ud83d\udd12 \n5.\n6.\n7.\n8.\n9.\n10.\n11.\n\nComplete your combined #Ashes XI! https://t.co/v4N0FCbvs4 USA bowl Namibia out for 121.\n\nSteven Taylor the star with the ball recording figures of 4/23 \ud83d\udc4f \n\nWho will star for USA with the bat today?\n\n#USAvNAM live \ud83d\udc47 \nScorecard \u27a1\ufe0fhttps://t.co/04Xws6McrI\nLive stream \u27a1\ufe0fhttps://t.co/LqKjcmg5EO https://t.co/ihWA314kzY Ireland win \ud83d\udc4f \n\nThat is their first win of the tri-series after their first game was abandoned due to rain.\n\nAndrew Balbirnie smashed 64 with a strike-rate of 200 and Gareth Delany struck his maiden T20I fifty! https://t.co/ZlYWMgx2xU A third T20I fifty for Andy Balbirnie!\n\nIreland are cruising towards victory in Malahide. https://t.co/chaJXhJkVG Me: Get in, take a few balls and assess conditions\n\nAlso me: If it is full, smash it for six! https://t.co/yLuGNMZgd4 Promoted to the top of the order due to the absence of Paul Stirling, Gareth Delany has hit his maiden T20I half-century!\n\nIt's just his third T20I \ud83d\udd25\ud83d\udc4f \n\nIreland 95/1 after just 7 overs!\n\nScorecard \u27a1\ufe0fhttps://t.co/TX9QKQ6X6L\nLive stream \u27a1\ufe0f https://t.co/eJtl6P5jt4 https://t.co/ZGuRG2LaNO USA and Namibia are in ICC CWC League 2 action today!\n\nNamibia captain Gerhard Erasmus has won the toss and his side will bat first.\n\nMatch centre \u27a1\ufe0f https://t.co/04Xws6McrI\nLive stream \u27a1\ufe0f https://t.co/LqKjcmg5EO https://t.co/t4WlKZNlG1 Scotland set Ireland 194 to win!\n\nCalum MacLeod top scores with 72, whilst Boyd Rankin takes 3/29 for Ireland.\n\nFollow the Ireland innings \ud83d\udc47 \nScorecard \u27a1\ufe0fhttps://t.co/TX9QKQ6X6L\nLive stream \u27a1\ufe0f https://t.co/eJtl6P5jt4 https://t.co/1MVEFKEWJh An entertaining half-century for Calum MacLeod!\n\nScotland 138/4 as they approach the final five overs of their innings. https://t.co/aBrXpniHOZ With the first T20I washed out, India and South Africa will hope for better weather and an exciting contest when they meet for the second game in Mohali.\n\n#INDvSA preview \u2b07\ufe0f \nhttps://t.co/uQnoD9LqwV Ireland get the big wicket of Scotland's George Munsey for 34!\n\nScotland 50/2 after 5 overs.\n\nScorecard \u27a1\ufe0fhttps://t.co/TX9QKQ6X6L\nLive stream \u27a1\ufe0f https://t.co/eJtl6P5jt4 https://t.co/rgmopnPO2r Ireland take on Scotland in the third game of T20I tri-series today!\n\nScotland captain Kyle Coetzer has won the toss and his side will bat first.\n\nScorecard \u27a1\ufe0fhttps://t.co/TX9QKQ6X6L\nLive stream \u27a1\ufe0f https://t.co/eJtl6P5jt4 https://t.co/JBy2VYbdx8 #NewCoverPic\n\nChampion \ud83d\udcaa https://t.co/AHXcO4Qbmy \u2022 79 matches\n\u2022 2,120 international runs\n\nAn attacking opening batter, she scored 309 runs at 77.25, including four half-centuries in the 2003-04 home ODI series against New Zealand.\n\nHappy birthday to Jaya Sharma! https://t.co/PUURPvcIg3 Find out how the Women's Global Development Squad initiative offers players from developing cricket countries a chance to experience high-quality cricket \u2b07\ufe0f https://t.co/mzk9dLwDB8 Bangladesh clinched a hard-fought three-wicket victory in their first tri-series clash against Zimbabwe.\n\nCan they repeat their winning performance? Will Zimbabwe bounce back?\n\n#BANvZIM Preview \ud83d\udc47 \nhttps://t.co/Sw67tpRCyt \"All I wanted to do was have an impact and help England win as many matches as possible.\"\n\nBen Stokes looks back at an incredible English summer.\n\nhttps://t.co/GHLJpqTd9d \"T20s have changed the game a whole heap.\"\n\nSuzie Bates and Stafanie Taylor discuss the impact of the shortest format on women's cricket \ud83d\udc47 https://t.co/Brv1MvMv9f \"It's overcast and there's a bit of green. We'll have a bowl.\" https://t.co/60fm1cI1QJ A collective team performance helped Australia take an unassailable 2-0 lead against West Indies in the three-match Women\u2019s T20I series.\n\nReport \ud83d\udc47 \nhttps://t.co/68VVadHut4 \ud83d\udc49 86 international appearances\n\ud83d\udc49 84 wickets\n\ud83d\udc49 2,078 runs\n\ud83d\udc49 #CWC19 finalist\n\nHappy birthday to New Zealand all-rounder, @JimmyNeesh, who turns 29 today! https://t.co/iUZjfEgMmC ICYMI: A 56-ball 127* from George Munsey saw Scotland claim a 58-run victory over Netherlands in their opening fixture of the tri-nation series in Ireland.\n\n#SCOvNED REPORT \ud83d\udc47\n\nhttps://t.co/lQk1UrnszB 5\ufe0f\u20e3 in 5\ufe0f\u20e3 wins for Australia Women on the Caribbean tour \ud83c\udf89 \n\nAlyssa Healy leads the visitors to a nine-wicket victory with 58* in the 2nd T20I after bowlers restrict West Indies Women to 97/9.\n\nScorecard \u2013\u2013\u2013&gt; https://t.co/Ws2NlMgxWK https://t.co/Oes0udM1VY Alyssa Healy continues her superb form with a fantastic fifty. Australia Women are only a few runs away from a victory in the second T20I and clinching the series.\n\nFollow: https://t.co/Ws2NlMgxWK https://t.co/0HsrGkchEq Find someone who looks at you the way Marnus Labuschagne looks at the urn... \ud83e\udd29\n\n#Ashes https://t.co/vlV5aOcULS 3\ufe0f\u20e34\ufe0f\u20e32\ufe0f\u20e3 Test wickets\n1\ufe0f\u20e35\ufe0f\u20e30\ufe0f\u20e3 ODI wickets\n2\ufe0f\u20e33\ufe0f\u20e32\ufe0f\u20e3 T20 wickets\n\nHappy birthday to Ravi Ashwin! \ud83c\udf82 https://t.co/PPRajrdzcC 7\ufe0f\u20e3 innings\n7\ufe0f\u20e37\ufe0f\u20e34\ufe0f\u20e3 runs\n1\ufe0f\u20e31\ufe0f\u20e30\ufe0f\u20e3\u23fa\ufe0f5\ufe0f\u20e37\ufe0f\u20e3 average\n2\ufe0f\u20e31\ufe0f\u20e31\ufe0f\u20e3 high score\n3\ufe0f\u20e3 hundreds\n\nJust how good is this man? https://t.co/L3zjs61dcS Looking for the next Ashes Test like... \ud83d\udc40 \n\n#ENGvAUS https://t.co/MiG2xZvTm6 Happy birthday to former \ud83c\udff4\udb40\udc67\udb40\udc62\udb40\udc73\udb40\udc63\udb40\udc74\udb40\udc7f captain Gavin Hamilton!\n\n\u2705 38 ODIs\n\u2705 1231 international runs\n\u2705 World Cup fifties against \ud83c\udde7\ud83c\udde9 and \ud83c\uddf5\ud83c\uddf0 \n\nWho has he just smacked away here? \ud83d\udc47 https://t.co/vquDaqdtkg A huge win for \ud83c\udff4\udb40\udc67\udb40\udc62\udb40\udc73\udb40\udc63\udb40\udc74\udb40\udc7f as they demolish \ud83c\uddf3\ud83c\uddf1 by 58 runs!\n\nPieter Seelaar's 96* is in vain as Munsey's 127* and Coetzer's 89 dominate the Dutch.\n\n#SCOvNED https://t.co/2PvTGwPEb3 \"This is an example of where the game was and where it is now. This couldn't have happened even five years ago, so the opportunities now are amazing.\"\n\nCharlotte Edwards on the Women's Global Development Squad.\n\nhttps://t.co/24XmvJfEhs Absolute carnage in Dublin, George Munsey hitting 14 6\ufe0f\u20e3 s in his 56-ball 127*!\n\n\ud83c\udff4\udb40\udc67\udb40\udc62\udb40\udc73\udb40\udc63\udb40\udc74\udb40\udc7f post a mammoth 252/3!\n\n#SCOvNED | STREAM \ud83d\udc47 \nhttps://t.co/597ZPg0mL3 https://t.co/sL05SYXnrV What a tournament it was!\n\n#CWC19 was the most watched ICC event ever! \ud83c\udf89 \n\nhttps://t.co/V4vG5FkBKE 1\ufe0f\u20e3 Steve Smith's inspiring redemption\n2\ufe0f\u20e3 Ben Stokes' incredible summer\n3\ufe0f\u20e3 \u2753\n4\ufe0f\u20e3 \u2753\n5\ufe0f\u20e3 \u2753\n\nFive takeaways from the 2019 #Ashes \ud83d\udc47\n\nhttps://t.co/h4orbQMVMo \ud83c\uddf3\ud83c\uddf1 win the toss and elect to bowl at Malahide!\n\nWill it be them or \ud83c\udff4\udb40\udc67\udb40\udc62\udb40\udc73\udb40\udc63\udb40\udc74\udb40\udc7f who get off to a winning start in the tri-series?\n\n#SCOvNED | STREAM \ud83d\udc47 \nhttps://t.co/597ZPg0mL3 https://t.co/6Xotb5baBs \"The only expectation from Rishabh is that he read situations well.\"\n\nVirat Kohli has demanded more responsibility from Rishabh Pant \ud83d\udc47 \nhttps://t.co/Lbb9sEoscq #NewCoverPic https://t.co/UWmG1ezAL1 Two of the stars of a brilliant series of cricket, well played \ud83d\udc4f \ud83d\udc4f https://t.co/cG8NKL6ku3 \ud83d\udd39 41 Tests\n\ud83d\udd39 147 ODIs\n\ud83d\udd39 6,354 international runs\n\ud83d\udd39 46 wickets\n\nThe anchor in \ud83c\uddf1\ud83c\uddf0's batting order from 1985 to 1996 \ud83d\udcaa\n\nHappy birthday, Asanka Gurusinha \ud83c\udf82 https://t.co/rFrEd7BxkW \u261d\ufe0f Shakib Al Hasan\n\u261d\ufe0f Mashrafe Mortaza\n\u261d\ufe0f Alok Kapali\n\n#OnThisDay in the 2007 ICC #T20WorldCup against Bangladesh, Brett Lee took the first ever hat-trick in T20Is \ud83d\ude31 https://t.co/VPyUr9aHjB \ud83c\uddff\ud83c\udde6 164 international appearances\n\ud83c\udfcf 2,227 runs\n\ud83d\udcab ICC's Chief Executive from 2012 to 2019\n\nHappy birthday to our very own David Richardson \ud83c\udf70 https://t.co/bRk9KwLSND \ud83c\udff4\udb40\udc67\udb40\udc62\udb40\udc65\udb40\udc6e\udb40\udc67\udb40\udc7f's Jos Buttler and Rory Burns have taken giant leaps in the @MRFWorldwide ICC Test Rankings for batting after the #Ashes. \n\nMatthew Wade has also gained big after his \ud83d\udcaf at The Oval. \n\nLatest rankings \u25b6\ufe0f https://t.co/kQBAqvkrLp https://t.co/lb94Pna8KB Steve Smith and Pat Cummins retain the top spots in @MRFWorldwide ICC Test Rankings. Huge gains for other #Ashes participants.\n\nDetails \ud83d\udc47 \nhttps://t.co/5wV6SJXEsf 4\ufe0f\u20e3 Tests\n2\ufe0f\u20e32\ufe0f\u20e3 wickets\n2\ufe0f\u20e3 six-fors \n\nJofra Archer debuted at No.83 and has now jumped 46 places to No.37 on @MRFWorldwide ICC Test Bowling Rankings \ud83d\ude4c \nLatest rankings \u25b6\ufe0f https://t.co/kQBAqvkrLp https://t.co/yqsg0k5rSH \"As a whole series, we had a heap of good moments in a country where Australia hasn't had a lot of success for a long time. We can be proud of that.\"\n\nTim Paine is proud of the way Australia have played in the 2019 #Ashes \u2b07\ufe0f \nhttps://t.co/mP3gAw6GWt \u2747\ufe0f ICC Women's ODI Cricketer of the Year in 2013 &amp; 2016\n\u2747\ufe0f ICC Women's T20I Cricketer of the Year in 2016\n\u2747\ufe0f Most runs for New Zealand Women in ODIs\n\u2747\ufe0f Most runs in Women's T20Is\n\nWhat a rockstar! Happy birthday, Suzie Bates \ud83c\udf89 https://t.co/1B36Y7NpK4 \ud83d\udcac \"I want to be at the front of that, I want to be leading it and hopefully be the man to bring the Ashes back to England.\"\n\nJoe Root's take on the 2021-22 #Ashes \ud83d\udc47\n\nhttps://t.co/SEbDyIVAwA Afghanistan have broken their own record of the longest winning streak in Men's T20I cricket \ud83d\ude4c https://t.co/k4kX20Y3VG Suzie Bates and Stafanie Taylor on the changes in women's cricket over the last few years and the upcoming ICC Women's @T20WorldCup 2020 \u2b07\ufe0f \nhttps://t.co/cgVbVOjr0Q \ud83e\udd1d https://t.co/W40GpS5w7E When you realise the Ashes are over \ud83d\ude10 https://t.co/Zzt5zzvsW7 \ud83d\ude0e https://t.co/dfX2qZV4sk Afghanistan continued their fine T20I form with victory over Bangladesh!\n\nReport \ud83d\udc47 \n\nhttps://t.co/xOKq3Jd5xZ Series drawn 2\ufe0f\u20e3- 2\ufe0f\u20e3 \n\nThe #Ashes will return to Australia! https://t.co/gBGBGCJCpM The @MRFWorldwide No.1 ranked best batsman and bowler in the world! https://t.co/mQloesAcLK The 2019 #Ashes came to an end today!\n\nDay four report \ud83d\udc47 \nhttps://t.co/mHOJTazHdQ The end of an amazing series!\n\nWhat was your favourite moment of the 2019 #Ashes? https://t.co/Re9hqwEodM England win the Test match by 135 runs!\n\nThe Ashes will go back to Australia but the series is drawn 2-2! https://t.co/ixE513yBTw England require just one wicket to draw the 2019 #Ashes!\n\nhttps://t.co/Op8d6I1Gph https://t.co/D1sVJa7SeM \ud83d\udcaf https://t.co/c0qpBlsrNF Matthew Wade reaches his century!\n\nHis second hundred of the series \ud83d\udc4f https://t.co/XPZFYk5NP9 Afghanistan win by 25 runs! \n\nThey have now won 12 consecutive T20Is, beating their own record in men's cricket! \ud83d\udc4f \ud83d\udc4f \n\nFour wickets for Mujeeb and an unbeaten 84 from Mohammad Nabi proved too much for Bangladesh.\n\n#BANvAFG https://t.co/9X04fdVWuQ Tea at The Oval and England are on top in the final #Ashes Test!\n\nAustralia 167/5\n\nScorecard \ud83d\udc47 \nhttps://t.co/Op8d6I1Gph https://t.co/OgsFx90pS8 Match abandoned at Malahide.\n\nPersistent drizzle has prevented \u2618\ufe0f and \ud83c\uddf3\ud83c\uddf1 from taking to the field, but Netherlands will be back tomorrow to try again for their match against Scotland.\n\n#IREvNED https://t.co/hRqkjBOcX0 Match abandoned between India and South Africa.\n\nThe rain proves too much in the end and so now the teams will look forward to the 2nd T20I in Mohali on Wednesday.\n\n#INDvSA https://t.co/ahOgKBkRIS A battling half-century for Matthew Wade!\n\nAustralia 142/4 https://t.co/tq2QBaR8JA Mohammad Nabi's brilliant 54-ball 84* and a brisk 40 from Asghar Afghan lift Afghanistan to 164/6.\n\nMohammad Saifuddin finishes with 4/33.\n\nSCORECARD: https://t.co/Wj28PlXTx9 https://t.co/KwxG4jVRJq Fifty up for Mohammad Nabi!\n\nThe Afghanistan batsman brings up his fourth T20I half-century in Dhaka. \n\nFollow #BANvAFG live \ud83d\udc47\nhttps://t.co/Wj28PlGi8z https://t.co/uZParPjBBU The end of a magical #Ashes series for Steve Smith \ud83d\udc4f https://t.co/g08V7heS6Z \ud83d\udea8 THIS IS NOT A DRILL \ud83d\udea8 \n\nEngland have dismissed Steve Smith for under 80!\n\nScorecard \u27a1\ufe0f https://t.co/Op8d6I1Gph https://t.co/vwTh6mpPLv Rain delaying the toss for #INDvSA in Dharamsala as well. https://t.co/accIeaB3w0 A delayed toss at Malahide for #IREvNED.\n\nDrizzle hanging around the ground and keeping the covers on for the time being. https://t.co/np8ZnYNlvv What a start for Bangladesh! \n\nAfghanistan have lost their openers early in the third match of the Bangladesh T20I tri-series. \n\n#BANvAFG LIVE \ud83d\udc47\nhttps://t.co/Wj28PlXTx9 https://t.co/RDI1fApdXU Run-scorer roulette \ud83d\ude4c \n\n1. Play the GIF \u25b6\ufe0f \n2. Snap a screengrab \ud83d\udcf1 \n3. Reply to show the world who will top score tonight! \ud83d\udd2e \n\n#INDvSA https://t.co/QILnlTL73z The #INDvSA T20I series gets underway today.\n\nWhich of these players do you expect to steal the show in game one? https://t.co/aYPOPGs3f2 Afghanistan have won the toss and are batting first in the third match of the Bangladesh T20I tri-series. \n\nFollow #BANvAFG live \ud83d\udc47\nhttps://t.co/Wj28PlXTx9 https://t.co/TRXAD741aV RT @ICCLive: Match 3. Toss won by Afghanistan, who chose to bat https://t.co/B6k449vq9E #BANvAFG Harris, Warner &amp; Labuschagne \u261d\ufe0f \n\nBut....\n\nSteve Smith is still at the crease for Australia \ud83d\udc40 \n \nAustralia 68/3 at Lunch. https://t.co/b70VOaHvEm It's the question on everybody's lips, how do you dismiss Steve Smith?\n\nWell we put it to the No.1 @MRFWorldwide ICC Test Match bowler and Smith's teammate, Pat Cummins to tell us how to do it! https://t.co/3eQ2Vxn6gb In seven Tests for South Africa, he claimed 41 wickets at 15.02. He later enjoyed a stint as an ICC Match Referee.\n\nHappy birthday, Mike Procter! https://t.co/BqRxf4gTKq England make their first breakthrough!\n\nHarris is bowled by a Stuart Broad beauty \ud83d\udd25 \n\n#Ashes scorecard \u27a1\ufe0f https://t.co/Op8d6I1Gph https://t.co/ewId0IeAn4 England bowled out for 329.\n\nAustralia require 399 to win! https://t.co/iA3XWlgREE England lead by 382 runs with 2 wickets in hand. How many more will they add?\n\nFollow day four of the #Ashes fifth Test \u2b07\ufe0f \nhttps://t.co/Op8d6I1Gph https://t.co/rm3P86s0xA \"It would have been nice to get to that milestone today, having worked so hard. Hopefully, I have impressed the selectors.\"\n\nJoe Denly's 94 in the second innings has helped England build up a solid lead \u2b07\ufe0f \nhttps://t.co/hXlSyPPkqI Afghanistan have won each of the 11 T20Is they have played in the last 2 years. Can they keep their winning streak intact when they face Bangladesh in the third game of the tri-series?\n\nPreview \u2b07\ufe0f\nhttps://t.co/ItjfWuNmFA Retirement of stalwarts and new leadership have South Africa wearing a thin look. How will they perform in the first T20I against India?\n\nPreview \ud83d\udc47\n\nhttps://t.co/OLyzo21s1w Australian all-rounder @JJonassen21 takes a special trip down memory lane for a look back at her earliest and fondest cricket memories. https://t.co/3D38ShYpzV Australia Women continued their winning momentum in Barbados and took 1-0 lead in three match-T20I series against West Indies Women.\n\nReport \ud83d\udc47\nhttps://t.co/tp928qzIlz #OnThisDay in 1955, one of the world's greatest spinners Abdul Qadir was born. His record 9/56 in the 1987 Lahore Test against England still stands as the best bowling figures in an innings for Pakistan. https://t.co/R8SDo4xal8 \"Like I said, it's exciting times - new skipper, new players and a lot of young, fresh faces.\"\n\nhttps://t.co/heSeg84zKL Megan Schutt (3/31) and Meg Lanning (54*) star as Australia Women clinch the T20I opener against West Indies Women by 6 wickets. https://t.co/GSAmKkRHCQ 1\ufe0f\u20e30\ufe0f\u20e37\ufe0f\u20e3 runs\n4\ufe0f\u20e30\ufe0f\u20e3 balls \n\nWhat an incredible partnership between Mohammad Nabi and Najibullah Zadran for Afghanistan yesterday \ud83d\ude4c https://t.co/4IbR5IIYkC 2\ufe0f\u20e32\ufe0f\u20e32\ufe0f\u20e3 from  1\ufe0f\u20e36\ufe0f\u20e38\ufe0f\u20e3 balls  \ud83d\udc4f \ud83d\udc4f \n\nHe played one of the great Test innings against England in 2002, but that was just one of his 27 international tons!\n\nHappy birthday, Nathan Astle! https://t.co/9Ef5VsbegV Hands up if you're the leading run-scorer in the 2019 #Ashes \ud83d\ude4b\u200d\u2642\ufe0f https://t.co/a6M8sgku1m She captained New Zealand to @cricketworldcup glory in 2000 and averaged 144.33 with the bat in Test cricket \ud83d\udc4f \ud83d\udc4f \n\nHappy birthday, Emily Drumm! https://t.co/vhivXAcDuf Guess who \ud83d\udc40 https://t.co/NgAHadCpp4 Joe Denly and Ben Stokes both helped England build a commanding lead on day three of the fifth Ashes Test at The Oval. \n\n#Ashes REPORT \u2b07\ufe0f \nhttps://t.co/TxTlh9aNDW Seven sixes from seven consecutive balls \u2013 Najibullah Zadran and Mohammad Nabi smashed the ball to all parts to help Afghanistan defeat Zimbabwe on Saturday. \n\nhttps://t.co/bZUMPsXfxY Caption this! https://t.co/qjsyKujFus Stumps at The Oval!\n\nEngland will resume tomorrow 313/8 with Jofra Archer and Jack Leach at the crease.\n\nThey lead Australia by 382 runs, Joe Denly (94) and Ben Stokes (67) the stars with bat adding 127 for the fourth wicket \ud83d\udc4f https://t.co/UoB6foTLP9 \ud83d\udc4f\ud83d\udc4f\ud83d\udc4f @marnus3cricket and @stevesmith49! https://t.co/RBFwJPiybg Back-to-back amazing catches from Australia!\n\nSteve Smith takes the first one at second slip diving to his right to remove Woakes.\n\nMarnus Labuschagne then takes a diving catch running forward from deep square-leg.\n\nScorecard \u27a1\ufe0f https://t.co/Op8d6I1Gph https://t.co/R2eqTXyidb A comfortable 28-run victory for Afghanistan!\n\nA tidy performance from the bowlers but the star of the show was Najibullah Zadran with his unbeaten 69, a knock that featured six sixes. \n\n#AFGvZIM SCORECARD \u2b07\ufe0f \nhttps://t.co/cB9DTPraND https://t.co/qwW6d0Yo0k England lost Ben Stokes 67 and Joe Denly for 94 but Jonny Bairstow and Jos Buttler have looked to be positive from the beginning of their innings.\n\nAshes scorecard \u27a1\ufe0f https://t.co/Op8d6I1Gph https://t.co/ZeuhLqQ9KS England's session at The Oval.\n\nThey lose no further wickets as both Denly and Stokes pass fifty with their partnership passing 100!\n\nScorecard \ud83d\udc47 \nhttps://t.co/Op8d6I1Gph https://t.co/Sch5wUGL0C His golden summer continues.\n\n50 more for Ben Stokes today \ud83d\udc4f \n\n#Ashes https://t.co/xh7DxAnLDo An incredible stand of 107 from Mohammad Nabi and Najibullah Zadran takes Afghanistan to 197/5 after 20 overs. \n\nNajibullah finishes unbeaten on 69 from just 30 balls!\n\n#AFGvZIM \ud83d\udc47 \nhttps://t.co/cB9DTPraND https://t.co/E7HSzxfDqd 1\ufe0f\u20e30\ufe0f\u20e3 international centuries\nTest-best of  2\ufe0f\u20e30\ufe0f\u20e35\ufe0f\u20e3 \n1992 @cricketworldcup winner  \ud83c\udfc6 \n\nHappy birthday, Aamer Sohail! https://t.co/c8igBU5IgS AFGHANISTAN HAVE JUST HIT SEVEN SIXES IN SEVEN BALLS!\n\nNajibullah has gone to fifty in rapid style and Mohammad Nabi is smashing it too \ud83d\udc4f \ud83d\udc4f \n\n#AFGvZIM https://t.co/qBoQZswdGk Three half-centuries in six innings for England's Joe Denly \ud83d\udc4f \n\n\ud83c\udff4\udb40\udc67\udb40\udc62\udb40\udc65\udb40\udc6e\udb40\udc67\udb40\udc7f 111/2\n\n#Ashes https://t.co/VW9mDCW5eM Afghanistan have slowed after a blistering start to their innings!\n\nRahmanullah Gurbaz who is just 17 smashed 43 from 24 balls \ud83d\udd25\ud83d\udc4f \n\n\ud83c\udde6\ud83c\uddeb 60/2 after 7 overs\n\n#AFGvZIM \ud83d\udc47 \nhttps://t.co/cB9DTPraND https://t.co/p9nsKnUWEq His international career saw him hit Test centuries for both Australia and South Africa  \ud83d\udc4f \ud83d\udc4f \n\nHappy birthday, Kepler Wessels! https://t.co/QBoWFtlBiV Zimbabwe have won the toss and will field first in their tri-series match against Afghanistan!\n\nCan Zimbabwe bounce back from yesterday's defeat to Bangladesh?\n\n#AFGvZIM SCORECARD \u2b07\ufe0f \nhttps://t.co/cB9DTPraND https://t.co/exR8i2uIZ7 England lose Joe Root on the stroke of Lunch!\n\nJoe Denly remains 37* while Nathan Lyon has taken both wickets to fall so far today.\n\n#Ashes scorecard \u27a1\ufe0f https://t.co/Op8d6I1Gph https://t.co/tn58UaJfCx Highest seventh-wicket partnership in Women's ODIs with Tsukigawa (104*) \u2714\ufe0f\nPlayer of the Tournament in the 2010 #T20WorldCup \u2714\ufe0f\n\nHappy birthday to @WHITE_FERN's Nicola Browne \ud83c\udf70 https://t.co/TE8UxiiERb \ud83d\udde3\ufe0f \"If he succeeds, it might result in being able to successfully chase down targets that we haven't achieved in the past.\"\n\nSanjay Bangar's take on Rohit Sharma as a Test opener \ud83d\udc47\n\nhttps://t.co/xZUfB1jagB Here we go!\n\nDay three of the final #Ashes Test at The Oval.\n\nWhat will today bring?\n\nFollow day three live \u27a1\ufe0f https://t.co/Op8d6I1Gph https://t.co/7enFjkGKV9 \u25aa\ufe0f 39 Tests \n\u25aa\ufe0f 75 ODIs\n\u25aa\ufe0f Over 10,000 first-class runs \ud83d\udc4f\n\u25aa\ufe0f Part of @emirates Elite Panel of ICC Match Referees\n\nHappy birthday to Jeff Crowe, a legend of New Zealand cricket \ud83d\ude4c https://t.co/nf766lXzEH \"The funnest part of junior cricket was having to play with and against the boys. It was always funny to see their reactions when I got them out\" \ud83d\ude1b\n\nIn the latest ICC 360 episode, @JJonassen21 speaks of her fondest cricket memories \u2b07\ufe0f\n\nhttps://t.co/AK8pT7calK RT @T20WorldCup: Australia in the #T20WorldCup: \n\n2007 \u27a4 Semi-final\n2009 \u27a4 Round 1\n2010 \u27a4 Runners-up\n2012 \u27a4 Semi-final\n2014 \u27a4 Super 10\n2016\u2026 Mutual admiration society \ud83d\udc81\n\n#Ashes https://t.co/brKJJrWHJN Smith got out for his lowest score of the #Ashes on day two at The Oval \u2013 \"only\" 80 \ud83d\ude0f\n\nAnd that was only because he'd caught the flu! \ud83e\udd12\n\nhttps://t.co/CNeTW1lNgu Results in their last five T20Is:\n\n\ud83c\uddff\ud83c\uddfc \u2794 L W L W L \n\ud83c\udde6\ud83c\uddeb \u2794 W W W W W\n\n#AFGvZIM PREVIEW \ud83d\udc47\n\nhttps://t.co/M1pMYK0wxv Afif Hossain, 19 years old and playing his second T20I, proved the match-winner in Bangladesh's T20I against Zimbabwe.\n\n#BANvZIM REPORT \ud83d\udc47 \n\nhttps://t.co/103b3PVbe1 A half-century from Aaron Jones and a three-wicket haul from Karima Gore took USA to victory in their first-ever home ODI \ud83d\udc4f\n\nThe hosts won by five runs (DLS) against Papua New Guinea in their opening fixture of Cricket World Cup League 2. \n\nScorecard \u25b6\ufe0f https://t.co/qbbirrLCDk https://t.co/vDIxWRPZEU The most familiar sight of this year's Ashes? https://t.co/LGj3azGRwi Mood \ud83d\ude06 https://t.co/tVFLEBGpww Career-best with the ball in the red ball arena \ud83d\udc4f https://t.co/l1QehJP7tD Jofra Archer and Steve Smith were the main men for their sides yet again, but this time it was England who emerged with the advantage.\n\n#Ashes report \ud83d\udc47 \nhttps://t.co/k3s2TAQs9G \ud83d\udd39 62 Tests\n\ud83d\udd39 71 ODIs\n\ud83d\udd39 6655 international runs\n\nHappy birthday to Robin Smith \ud83d\udc4f https://t.co/fCvhO9THOW USA have finished on 251/9 against PNG in the first ODI of their CWC League Two campaign, but rain has delayed the start of the chase.\n\n#USAvPNG SCORE \ud83d\udc47\nhttps://t.co/qbbirrLCDk https://t.co/ZyMNfYnidy Steve Smith has hit 10 consecutive scores of 50 against England in Test match cricket!\n\nNo one has ever hit as many in a row against a single opposition \ud83d\udd25 \n\nWhat an amazing player he is \ud83d\udc4f https://t.co/Azh2PjJYyG ICYMI \ud83d\udc47 \nhttps://t.co/fuD6IqlQ7k Another absorbing day of Test cricket at The Oval \ud83d\ude4c \n\nEngland finish 9/0, after Joe Denly was dropped in the last over of the day and Rory Burns was given out lbw last ball of the day, which was overturned on review!\n\n#Ashes cricket \ud83d\ude0d https://t.co/74o5FQE7Ct \ud83d\udea8Bangladesh win! \ud83d\udea8\n\nAt 60/6 they looked in all sorts of trouble but Afif Hossain hit his maiden T20I half-century in just his second game and Mosaddek Hossain 30* as the pair added 82 for the seventh wicket \ud83d\udc4f \n\nFinal scorecard \u27a1\ufe0f https://t.co/31dBmhs6pe https://t.co/hGuNyuUb16 WHAT A CATCH FROM RORY BURNS \ud83d\ude31 \n\nArcher finishes with six wickets and Australia are all out for 225, trailing England by 69.\n\nScorecard \ud83d\udc47 \nhttps://t.co/Op8d6I1Gph https://t.co/qBs9KpW8sk A second Test match five-wicket haul for Jofra Archer! https://t.co/ppE3SZEJ4g It's going to be a thriller in Dhaka!\n\nDespite being 60/6, Bangladesh are now 104/6 and require 41 runs from the last 5 overs.\n\nAfif Hossain has smashed 27* from 13 balls \ud83d\udd25 \n\nScorecard \u27a1\ufe0f https://t.co/31dBmhs6pe https://t.co/UNWAI5ga5j \ud83d\udea8 THIS IS NOT A DRILL \ud83d\udea8 \n\nChris Woakes has dismissed Steve Smith for 'just' 80, his lowest score of the series!\n\nEngland on course for a big first innings lead at The Oval.\n\nFollow the #Ashes live \ud83d\udc47\nhttps://t.co/Op8d6I1Gph https://t.co/4rYNRuXc1D Three wickets in five balls for Zimbabwe and Bangladesh are struggling in Dhaka!\n\n\ud83c\udde7\ud83c\udde9 28/3 after 4 overs.\n\nCan the experienced duo of Shakib and Mahmudullah save their side?\n\nhttps://t.co/31dBmhs6pe https://t.co/4fv61Hd8BH Steve Smith's scores since shirt numbers were introduced into Test cricket\n\n1\ufe0f\u20e34\ufe0f\u20e32\ufe0f\u20e3 &amp;  1\ufe0f\u20e34\ufe0f\u20e34\ufe0f\u20e3 \ud83d\udc49 Edgbaston\n9\ufe0f\u20e32\ufe0f\u20e3 \ud83d\udc49 Lord's\n2\ufe0f\u20e31\ufe0f\u20e31\ufe0f\u20e3 &amp;  8\ufe0f\u20e32\ufe0f\u20e3 \ud83d\udc49 Old Trafford\n7\ufe0f\u20e35\ufe0f\u20e3 * \ud83d\udc49 The Oval\n\nNot one score below his shirt number \ud83d\udc4f\ud83d\udc4f\ud83d\udc4f https://t.co/1YPZqGygzf TWO WICKETS IN TWO BALLS FOR SAM CURRAN!!!!!\n\nhttps://t.co/Op8d6I1Gph https://t.co/ihWcBLdXkv Zimbabwe recover from 63/5 to set Bangladesh 145 to win the first T20I of the tri-series!\n\nRyan Burl top scored with a brutal 57*.\n\nCan Bangladesh chase down this total? https://t.co/lgnczQqa6W Play has been delayed in Dhaka due to a floodlight failure!\n\nZimbabwe 136/5 with an over of their innings remaining.\n\n#BANvZIM https://t.co/Sil0x4Quil Ryan Burl is on fire!\n\nHe moves from 13* off 19 balls to 54* from 28 balls \ud83d\ude31 \n\nHis half-century includes 5x4 &amp; 4x6 \ud83d\udd25 \n\nScorecard \u27a1\ufe0f https://t.co/31dBmhs6pe https://t.co/XDCCDwLyhM Tea at The Oval.\n\nIt's the same story for England's bowlers they've taken regular wickets but cannot remove Steve Smith!\n\n\ud83c\udde6\ud83c\uddfa 147/4 https://t.co/e5qU2wYyDf Big blow for Zimbabwe as captain Hamilton Masakadza departs for 34!\n\nMohammad Saifuddin with the key wicket on his first appearance for Bangladesh since #CWC19.\n\n#BANvZIM live \u27a1\ufe0f https://t.co/31dBmhs6pe https://t.co/gUPDkBoR4Z The least surprising thing to happen today?\n\nMore runs for Australia's run-machine \ud83d\udc4f https://t.co/KkNw5NcduM USA take on Papua New Guinea today.\n\nUSA are batting first and are currently 33/2 after 7 overs!\n\nWatch live \u27a1\ufe0f https://t.co/QbIlkSy12C https://t.co/Jqlk47itNS Good news from Dhaka!\n\nBangladesh have won the toss and elected to bowl first.\n\nThe game will be 18-overs a side. https://t.co/jx4VoQtdUD Frustrating start to the tri-series in Dhaka where rain has delayed the beginning of Bangladesh v Zimbabwe. https://t.co/pHnARc4NSG England make their first breakthrough after Lunch as Archer has Labuschagne lbw!\n\n#Ashes \u27a1\ufe0f https://t.co/Op8d6I1Gph https://t.co/eWgJQwyLdf Here's your dose of daily motivation from @mir_sana05 \ud83d\udc4f https://t.co/tQOPDoqag9 Ahead of their three ODIs and three T20Is against Sri Lanka, Pakistan have announced Sarfaraz Ahmed will captain the side and Babar Azam will be his vice-captain. https://t.co/HvWvHrD48R \ud83d\udcac \"Now when I talk to people, they say, 'We are so proud of the team. We want our daughters to be a part of this team.'\"\n\nWhat an inspiration Sana Mir has been to aspiring cricketers across the world \ud83d\ude4c\n\nhttps://t.co/v11Tl8axlC Lunch on day two at The Oval.\n\nJofra Archer struck early twice but Marnus Labuschagne and Steve Smith have ensured Australia go into Lunch just two wickets down.\n\n\ud83c\udde6\ud83c\uddfa 55/2 https://t.co/aCbApffyIh England make a fast start!\n\nDavid Warner tries to cut Jofra Archer but gets an edge to Jonny Bairstow!\n\nOriginally it was given not out but Joe Root reviews and Warner goes.\n\n#Ashes \u27a1\ufe0f https://t.co/Op8d6I1Gph https://t.co/oUqraFuPet \ud83c\udfdf\ufe0f \"I remember clinging to the gallery grill asking for Javagal Srinath's autograph.\"\n\nAnother day, another accolade for Virat Kohli \ud83d\ude4c\n\nhttps://t.co/Ru8xiAEowV England 294 all out and Mitchell Marsh takes his maiden five-wicket haul in Test cricket! https://t.co/FrGJx7zTx8 Buttler goes for a valuable 70, bowled by Cummins!\n\nEngland now 294/9, can Stuart Broad and Jack Leach add some crucial more runs?\n\n#Ashes \ud83d\udc47 \nhttps://t.co/Op8d6HK50H https://t.co/lUyp8KhC4O Can Australia take the final two wickets quickly or can England surpass 300?\n\n#Ashes live \u27a1\ufe0f https://t.co/Op8d6HK50H https://t.co/nyGVM0WwS1 4\ufe0f\u20e3 4\ufe0f\u20e3 4\ufe0f\u20e3 4\ufe0f\u20e3 6\ufe0f\u20e3 4\ufe0f\u20e3\n\nWho remembers when Craig McMillan smashed Younis Khan for 26 runs in the 2001 Hamilton Test? \ud83d\udd25\n\nHappy birthday to the @BLACKCAPS batsman, who scored over 7800 international runs! https://t.co/qd2qEIUq4f When you realize it's Friday today... \ud83c\udf89\n\n#Ashes | #FridayFeeling https://t.co/POJCm6dVA3 \u279d 61 international appearances\n\u279d 1943 runs\n\u279d 31 wickets\n\nTeams coached: \ud83c\udde6\ud83c\uddea \ud83c\udde7\ud83c\udde9 \ud83c\uddf1\ud83c\uddf0\n\nA very happy 51st birthday to Chandika Hathurusingha \ud83c\udf82 https://t.co/ohWBQ9EVfo The West Indies all-rounder was carried off the field in a stretcher. \n\nDetails:\n\nhttps://t.co/aIiKzmOKCj RT @T20WorldCup: Bangladesh's best showing at the #T20WorldCup was back in 2007, when they made the Super 8.\n\nNew head coach Russell Doming\u2026 \ud83d\udde3\ufe0f \u201cMost of Australia hate me. But hopefully, they can respect me for the fact I keep coming back.\u201d\n\nMitchell Marsh on what it took to return to the \ud83c\udde6\ud83c\uddfa XI:\n\nhttps://t.co/7UuApcbSLB A new-look Bangladesh side under Russell Domingo are turning their sights towards the @T20WorldCup in Australia next year. \n\n#BANvZIM PREVIEW \u2b07\ufe0f \n\nhttps://t.co/LUSVVW8uqM 7\ufe0f\u20e30\ufe0f\u20e38\ufe0f\u20e3 Test wickets  \ud83d\udc4f \ud83d\udc4f \n2\ufe0f\u20e39\ufe0f\u20e33\ufe0f\u20e3 ODI wickets  \ud83d\udc4f \ud83d\udc4f \n@cricketworldcup winner  \ud83d\udc4f \ud83d\udc4f \n\nHappy birthday to @ShaneWarne, one of the greatest cricketers of all time! https://t.co/8wQcObXmrf \ud83e\udd1c\ud83e\udd1b https://t.co/CFDdjPz1el With her 58* against West Indies yesterday, 27-year-old Meg Lanning went past Karen Rolton as the leading Australian women's run-scorer across formats \ud83d\udd25 https://t.co/tEK02JaMNy Day one of the final #Ashes Test was an eventful one!\n\nReport \ud83d\udc47 \nhttps://t.co/Fzxgiekgo7 Happy birthday Sir Wes Hall!\n\nThe West Indian fast bowler took 1\ufe0f\u20e39\ufe0f\u20e32\ufe0f\u20e3 Test wickets at an average of 26.38 \ud83d\udd25 https://t.co/J6yjyKadjC Stumps at the end of a very entertaining day at The Oval!\n\nEngland finish the day 271/8.\n\nMitchell Marsh took four wickets whilst Root made fifty and Buttler finished 64*. https://t.co/IFSecMm3ev Fifty for Jos Buttler, his first of the series!\n\nHe's doing his best to push England towards a competitive score on what looks a good wicket. https://t.co/cSsyz4bEnt Stokes \u261d\ufe0f \nBairstow \u261d\ufe0f \nCurran \u261d\ufe0f \nWoakes \u261d\ufe0f \n\nMitchell Marsh has proven an inspired selection for Australia today! https://t.co/Hzwf2oLz6m It's all happening at The Oval!\n\nAustralia have taken two wickets in four overs and it could have been a third had Pat Cummins not overstepped!\n\nSam Curran the lucky batsman getting the reprieve \ud83d\ude31 \n\nFollow #ENGvAUS \ud83d\udc47 \nhttps://t.co/Op8d6I1Gph https://t.co/EoHACCGKYB It's Tea at The Oval and honours are even so far in the fifth Ashes Test!\n\nEngland are 169/3, captain Joe Root is 57*.\n\nScorecard \u27a1\ufe0f https://t.co/Op8d6I1Gph https://t.co/DJNkOvxNcS Another landmark reached by an England batsman!\n\n4000 runs in the Test arena for Jonny Bairstow \ud83d\udc4f https://t.co/pPGdvNlgjk Test half-century number 4\ufe0f\u20e35\ufe0f\u20e3 for Joe Root!\n\nCan he score his first century of the series today? https://t.co/8xZ2eOxehU #OnThisDay in 2005, Kevin Pietersen hit his maiden Test century and helped England regain the Ashes for the first time in 16 years!\n\nWhat's your favourite memory from that incredible series? https://t.co/mm6YmJrtIc Strong start from Australia after the interval.\n\nHazlewood dismissed Rory Burns for 47 and England are 107/2!\n\n#Ashes live \ud83d\udc47 \nhttps://t.co/Op8d6I1Gph https://t.co/4XDvLqqCZU A fine achievement from the England captain \ud83d\udc4f https://t.co/cBe6ftB54D \ud83d\udc49 T20I hat-trick v India in 2018\n\ud83d\udc49 ODI hat-trick v West Indies in 2019\n\nIn the final #WIvAUS ODI, Australia pacer @megan_schutt created history by becoming the first woman to claim two international hat-tricks. https://t.co/cCHSWm6t2S Lunch at The Oval!\n\nHaving been put into bat England will be happy going into Lunch 86/1.\n\nRory Burns &amp; Joe Root have added 59 for the second wicket.\n\n#Ashes scorecard \u27a1\ufe0f https://t.co/Op8d6I1Gph https://t.co/B889lyAPMT \"Every time we go out there, we want to win.\"\n\nAfter sweeping the #WIvAUS ODI series, Australia Women captain Meg Lanning wants her team to follow a similar attacking approach in the T20Is.\n\nhttps://t.co/S6tGYXotyh JUST IN: Shubman Gill could be in line to make his Test debut against South Africa next month.\n\nFULL SQUAD \u2b07\ufe0f \nhttps://t.co/fWXnTg5iQb What number in the @MRFWorldwide ICC Test Match Player Rankings are you @patcummins30?\n\n1\ufe0f\u20e3 https://t.co/6OpkOPkDeR 32 ODIs\n28 T20Is\n40 international wickets\n\nIn February 2017 against Australia, the @WHITE_FERNS spinner became the first woman from New Zealand to claim a hat-trick in T20Is.\n\nHappy birthday @AnnaPeterson06! https://t.co/LtxabiBdBK An early scare for Rory Burns who is given out LBW but his review is a good one and he survives!\n\nFollow the final #Ashes Test \u27a1\ufe0f https://t.co/Op8d6I1Gph https://t.co/i61quenB2R Sorry not sorry Gaz... https://t.co/mgoi3wKIjn Tim Paine has won the toss and Australia will bowl first!\n\nPeter Siddle comes into the Australia side in place of Mitchell Starc. \n\n#Ashes LIVE \u2b07\ufe0f \nhttps://t.co/Op8d6I1Gph https://t.co/RollBFpvpF Ellyse Perry \u2197\ufe0f\nAlyssa Healy \u2197\ufe0f\nMegan Schutt \ud83d\udd1d\n\nAfter the conclusion of the #WIvAUS ODI series, players gain big in the latest @MRFWorldwide ICC Women's ODI Player Rankings.\n\nDETAILS \ud83d\udc47\n\nhttps://t.co/cuGVcwXFx6 Ellyse Perry, Alyssa Healy and Stafanie Taylor have moved \u2b06\ufe0f in the latest @MRFWorldwide ICC Women's ODI Batting Rankings after their exploits in the #WIvAUS ODI series. https://t.co/xAUKXlMlJJ \ud83d\ude00\ud83d\udc10 https://t.co/aOEy2tMQrt Nov 2018, Antigua: \ud83c\udde6\ud83c\uddfa clinch Women's T20 World Cup\nSep 2019, Antigua: \ud83c\udde6\ud83c\uddfa complete clean sweep of \ud83c\udf34 to become first team to qualify for 2021 Women's World Cup\n\n\ud83d\udc4f\ud83d\udc4f\ud83d\udc4f https://t.co/74eGrx9cjH What is \ud83c\udde6\ud83c\uddfa captain Tim Paine expecting of Mitchell Marsh?\n\n\"That level of fitness where you can bowl 25-30 overs and then come out and score a \ud83d\udcaf\"\n\n#Ashes\n\nhttps://t.co/o5nz2FnS8i The India pacer played five Tests, 116 ODIs and 41 T20Is and claimed 108 international wickets.\n\nWith 14 scalps, she finished as the second-highest wicket-taker at the 2005 Women's @cricketworldcup.\n\nHappy birthday Amita Sharma! https://t.co/YRhoILRgF7 \"The guys are fully aware that this Test is bigger \u2013 it's our grand final.\"\n\nAustralia skipper Tim Paine has his eyes set on an away #Ashes series win.\n\nhttps://t.co/AeN1JyExbz The left-arm paceman made 140 international appearances for Australia and picked up 205 wickets, including 46 ODI scalps in 2006. \n\nHappy birthday to Nathan Bracken, who turns 42 today. https://t.co/KmDvYwwmQ3 \"It's one of those games which you\u2019ll look back on and really have appreciated being involved in.\"\n\n@BLACKCAPS captain Kane Williamson feels \"fortunate\" to have been a part of an exciting #CWC19 final. https://t.co/7vWL0rxGgR What combination of bowlers will Australia use in the final #Ashes Test? https://t.co/hijuhTGVrb Schutt, Healy and Lanning help Australia to comfortable victory.\n\nReport \ud83d\udc47 \nhttps://t.co/W0C03BjmcJ In Mitchell Marsh's last Test appearance against England he made  1\ufe0f\u20e30\ufe0f\u20e31\ufe0f\u20e3!\n\nExcited to see him in action tomorrow? https://t.co/3HJ6P5Rlu3 How impressed have you been with these two during the #Ashes? https://t.co/cx8FTNh4Y9 Australia win by eight wickets and secure a 3-0 series victory in their ODI series against West Indies!\n\nMegan Schutt took a hat-trick with the ball whilst Alyssa Healy and captain Meg Lanning both hit half-centuries \ud83d\udd25 https://t.co/0YkeN4kIMz ODI half-century N0.13 for the Australian skipper \ud83d\udd25\ud83d\udc4f \n\nHer side is cruising to victory! https://t.co/ayzkR9UJN2 Cheer up @CurranSM, you're making your #Ashes debut tomorrow! https://t.co/6PSbbcDBVP What a knock Alyssa Healy!\n\nShe races to her half-century from just 27 balls, hitting 10x4 and 1x6 \ud83d\udc4f https://t.co/QQtmMRMREJ Alyssa Healy is flying in Antigua, Australia are 40/0 after five overs and Healy has 33 of the runs \ud83d\udd25 \n\nHer partner Rachael Haynes is 1*!\n\nWatch live \u27a1\ufe0f https://t.co/jE3FpGfrkG https://t.co/fE04plTULb West Indies set Australia 181 to win!\n\nMegan Schutt was the star with the ball taking a hattrick from the last three balls of the West Indies innings \ud83d\udd25 \n\nWho do you think will win the final ODI?\n\nWatch the Australia run-chase \ud83d\udc47 \nhttps://t.co/jE3FpGfrkG https://t.co/uXXHI11R7O MEGAN SCHUTT HAS TAKEN A HATTRICK IN ANTIGUA!!!! Guess who \ud83d\udc40\u26bd https://t.co/LN0BzkXaRx 25 overs gone in the first innings in Antigua and West Indies have battled to 71/2.\n\nFollow #WIvAUS live \u27a1\ufe0f https://t.co/IkMqaswRs3 https://t.co/5uz2zyQpwy What an incredible all-rounder Ellyse Perry is!\n\n150 ODI wickets \u2705 \n52.94 ODI batting average \ud83d\udd25 https://t.co/HZOFkoq4u6 1st Test: \ud83c\udde6\ud83c\uddfa \n2nd Test: \ud83e\udd1d \n3rd Test: \ud83c\udff4\udb40\udc67\udb40\udc62\udb40\udc65\udb40\udc6e\udb40\udc67\udb40\udc7f \n4th Test: \ud83c\udde6\ud83c\uddfa \n5th Test: \u2753 \n\n#Ashes Preview \ud83d\udc47 \nhttps://t.co/YAnXQXYVXI Stafanie Taylor has won the toss for West Indies in Antigua and her side will bat first against Australia.\n\nCan West Indies get their first win of the series today?\n\n#WIvAUS https://t.co/q9EAHUBVQc Mitch Marsh has been included in Australia's 12-man squad for the fifth Ashes Test at The Oval.  Travis Head misses out after playing the first four Tests of the series.\n\n#Ashes https://t.co/4yOYltZuRu JUST IN: Sam Curran has been named in the England XI for the final Test of the 2019 #Ashes. https://t.co/vfP4v0z1j3 James Anderson is not thinking about retirement any time soon! https://t.co/cmXG1TTtma Introducing: Paine Management \ud83d\ude0e https://t.co/BPcmeFKCD8 The left-arm spinner made 46 international appearances for India and has 61 wickets to his name.\n\nHis match figures of 7/76 in the Mumbai Test powered India to a famous 13-run win over Australia in 2004.\n\nHappy birthday @kartikmurali! https://t.co/E3Df89lMLA #OnThisDay in 2018, England's leading Test run-scorer, Alastair Cook, bid goodbye to international cricket.\n\nHe made 147 in his final outing as England completed their 4-1 Test series win over India, at The Oval. https://t.co/PGQ9k0nNBn \"It's quite simple what they do, but it's really effective because they do it so consistently.\"\n\nEngland quick James Anderson was lavish in his praise for his Australian counterparts \ud83d\udd3d \nhttps://t.co/FHKjtgeDMd \"Guys are still thinking about it, trying to make sense of it.\"\n\nIn the latest ICC Cricket 360 episode, @BLACKCAPS skipper Kane Williamson reflects on the unforgettable #CWC19 final. \n\nhttps://t.co/RPc0BNVxtg \ud83e\udd39\u200d\u2642\ufe0f https://t.co/avTO66JXl7 Steve Smith's run-fest, Afghanistan's historic Test victory, and Jimmy Neesham at his usual best \u2013 it was a happening week in cricket. Catch it all in the latest #OnTheUp \ud83d\udc47 \nhttps://t.co/2ZJdIdkOPt He might have scored just one international hundred, but it was the first-ever Test century from an Indian cricketer!\n\nHappy birthday to Lala Amarnath, who led \ud83c\uddee\ud83c\uddf3 to their first Test series win against Pakistan and was also the captain in their first tour to Australia \ud83d\ude4c https://t.co/5nVOurEWgq \"But the reality is I really love sport, and sport is my real job.\"\n\nThe incredible story of @PavelFlorin13  \ud83c\uddf7\ud83c\uddf4 https://t.co/484PRUWFlm \ud83d\udde3\ufe0f \"There is a good feeling in the group, buy they know there is still unfinished business.\"\n\nCan head coach Justin Langer help Australia win the 2019 #Ashes at The Oval? https://t.co/VfjIraMeta #OnThisDay in 1985 Sri Lanka secured their first Test win at the fourteenth attempt!\n\nThey beat India by 149 runs with Rumesh Ratnayake taking 5/49. https://t.co/etlf6nEIXb David Warner's #Ashes so far:\n\n2\ufe0f\u20e3 &amp;  8\ufe0f\u20e3 at Edgbaston\n3\ufe0f\u20e3 &amp;  5\ufe0f\u20e3 at Lord's\n6\ufe0f\u20e31\ufe0f\u20e3 &amp;  0\ufe0f\u20e3 at Headingley\n0\ufe0f\u20e3&amp; 0\ufe0f\u20e3 at Old Trafford\n\nCan he turn his form around in the final Test at The Oval? https://t.co/eJTeAaNmqA ICYMI \ud83d\udc47 \n\nhttps://t.co/mZt978f8V3 West Indies have been forced to make a change to their squad ahead of their final ODI against Australia.\n\nhttps://t.co/JeqYt4mL7m Can England secure some valuable World Test Championship points and level the #Ashes at The Oval? https://t.co/AiY3CVoUSq Back to work for the Australian team ahead of the final #Ashes Test! https://t.co/CyDj8v6eVc #OnThisDay last year Sir Alastair Cook hit a century in his final Test appearance for England! https://t.co/OxkUh2FK6y On @Eoin16's 33rd birthday, relive this glorious moment when he became the first England captain to lift the men's @cricketworldcup \ud83c\udfc6 in July this year. https://t.co/x3USx2S7Jz When you win the Ashes and retain your top ranking \ud83d\udc4d\n\n#Ashes | @stevesmith49 https://t.co/Z6Gw7oFTVC 23 ODIs\n31 T20Is\n1,005 international runs\n\nIn January 2016, the stylish India batsman's maiden ODI hundred \u2013 an 81-ball 104* \u2013 helped his side chase down Australia's 330 with just two balls to spare.\n\nHappy birthday @im_manishpandey! https://t.co/TwjPWToecy \ud83e\udde2 330 international appearances \n\ud83c\udfcf 9,858 runs \n\ud83c\udfc6 World Cup-winning captain \n\nEoin Morgan's legacy was sealed when he led England to their maiden @cricketworldcup title earlier this year!\n\nHappy birthday, @Eoin16! https://t.co/MsuJjNyXsX After the conclusion of the ICC Women's #T20WorldCup Qualifier, Scotland's Bryce sisters move up in the latest @MRFWorldwide ICC Women's T20I Player Rankings. https://t.co/6uAUPfdtXt Kim Garth \u2197\ufe0f\nSarah Bryce \u2197\ufe0f\nKathryn Bryce \u2197\ufe0f\nEimear Richardson \u2197\ufe0f\n\nPlayers sizzle in the latest @MRFWorldwide ICC Women's T20I Player Rankings, after the conclusion of the ICC Women's #T20WorldCup Qualifier. \n\nhttps://t.co/HLmZCIfs8Z \u25fe Steve Smith &amp; Pat Cummins retain their \ud83d\udd1d positions\n\u25fe Afghanistan players make big gains \ud83d\udc4f\n\n@MRFWorldwide ICC Test Rankings after #BANvAFG and the fourth #Ashes Test \u2b07\ufe0f\n\nhttps://t.co/fcld2lmvQj \ud83d\udca5 After their historic win over Bangladesh, the Afghanistan players have taken big leaps in the @MRFWorldwide ICC Test Rankings! https://t.co/V6WWWgMzAz Bangladesh have announced a 13-member squad for the upcoming home tri-series against Afghanistan and Zimbabwe. \n\nDETAILS \ud83d\udc47\n\nhttps://t.co/AMhRKJF3iO Afghanistan all-rounder @MohammadNabi007, who made his final Test appearance in the #BANvAFG one-off match, said he is proud of his team's progress in the longest format.\n\nhttps://t.co/IqB8fTuJCf \"I got out the first ball and it was my fault. I should have taken more responsibility\" \u2013 Shakib Al Hasan.\n\nhttps://t.co/31PZYDyvcS #OnThisDay in 1872, KS Ranjitsinhji, widely regarded as one the sport's finest, was born.\n\n\u2022 He played 15 Tests for England, and scored 989 runs at a fine 44.95.\n\n\u2022 In 307 first-class games, he scored 24,692 at 56.37, including a top-score of 285*. https://t.co/JFIakVOxQB \"Cricket has seen me grow as a person, as a player, as a captain.\"\n\nLast week, India's @M_Raj03 announced her retirement from T20I cricket. https://t.co/nURkBSyO59 \ud83c\udfcf Most runs for Australia in women's ODIs\n\ud83c\udfcf Batting average of over 45 in both ODI and Test cricket\n\ud83c\udfcf Two-time @cricketworldcup winning captain\n\nHappy birthday, Belinda Clark! https://t.co/LzfVEK9mTI Ellyse Perry's last seven innings for Australia across all formats:\n\n116\n76*\n7*\n47*\n60*\n33*\n112*\n\n\ud83e\udd2f https://t.co/jAvLVvx9Nh Regular captain Dane van Niekerk misses the India tour through injury.\n\nhttps://t.co/Cp7raGxD4m \"The legend Nabi, who has played his last Test, has helped me and other young spinners a lot.\"\n\nRashid Khan dedicated his Player of the Match award to Mohammad Nabi, who was playing in his last Test match after Afghanistan's win over Bangladesh.\n\nhttps://t.co/Ei1HNETXEe \ud83d\udcaa https://t.co/xS5oDJ2KFd Pollard, who hasn't played an ODI since October 2016, takes over from Jason Holder who first captained the side in 2015.\n\nhttps://t.co/R2riBAjVio JUST IN: Kieron Pollard has been named as the new West Indies ODI and T20I captain. https://t.co/LMGKuWdFTM \ud83d\udde3\ufe0f \"I split my finger in the first innings and \u2026 it's probably like a singer losing their vocals.\"\n\nLyon opens up on how he battled through pain to help \ud83c\udde6\ud83c\uddfa retain the #Ashes.\n\nhttps://t.co/BnhMaxWybF \ud83d\udc69 \ud83d\ude34 \ud83c\udfcf \n\nEllyse Perry reveals the special bond she shares with her cricket bat after scoring \ud83d\udcaf against \ud83c\udf34!\n\n#WIvAUS\n\nhttps://t.co/d4iQf7maw7 If you could ask @patcummins30 any question, what would it be?\n\nTweet them in, and we could pick yours when we catch up with the #Ashes-winning pace star in London tomorrow! \ud83e\udd29 #AskPat https://t.co/xjNs998ltH Rain threatened to thwart \ud83c\udde6\ud83c\uddeb's plans, but @rashidkhan_19 took the lead in cleaning up the \ud83c\udde7\ud83c\udde9 lower-order in 17.2 overs to earn his side an unforgettable 224-run win.\n\n#BANvAFG Report \ud83d\udc47 \n\nhttps://t.co/HWMDw8ERNQ Afghanistan went the extra mile to make sure @MohammadNabi007 will take back fond memories from his final day as a Test cricketer \ud83d\udc4f \n\n#BANvAFG https://t.co/shrttJ6vJp Afghanistan were able to give Mohammad Nabi a memorable farewell from Test cricket, and Rashid Khan paid the 34-year-old a rich tribute after the game \ud83d\udc4f \n\n#BANvAFG https://t.co/tHu57n02B2 Afghanistan have registered their second Test win in just their third Test match.\n\nThey are the joint quickest team to the landmark, equalling Australia who picked up their second Test victory all the way back in 1879.\n\n#BANvAFG https://t.co/ko3BoULhbj \ud83d\udd25 Youngest captain to win a Test\n\ud83d\udd25 Picked up 11 wickets in the match\n\ud83d\udd25 Scored a half-century too\n\nWhat a star, Rashid Khan, who is Player of the Match! https://t.co/9P0jOM1not WHAT. A. FINISH.\n\nAfghanistan will enjoy that for a long time! https://t.co/fO98U8SWEX Rashid Khan claims the final wicket \u2013 that of Soumya Sarkar \u2013 as Afghanistan secure a 224-run victory!\n\nWhat a brilliant performance by the captain, who finishes with 11 wickets for the match \ud83d\udd25 \n\nFollow #BANvAFG blog for live updates \u23ec\nhttps://t.co/kHXVx32oOc https://t.co/RNBDXvWd2K Watching Rashid like...\n#BANvAFG https://t.co/np8SF0tHU4 England have named an unchanged 13-man squad for the final #Ashes Test at The Oval. https://t.co/Hiw89UfmIt Taijul Islam has been trapped in front by Rashid Khan \u2013 that's his fifth wicket of the innings and 10 for the match!\n\nAfghanistan are one wicket away!\n\nFollow #BANvAFG blog for live updates \u23ec\nhttps://t.co/kHXVx32oOc https://t.co/HMMokY0vDt WICKET!\n\nRashid Khan strikes for Afghanistan again, and the visitors now need only two wickets! Mehidy Hasan the latest to fall.\n\nFollow #BANvAFG blog for live updates \u23ec\nhttps://t.co/kHXVx32oOc https://t.co/60VpMobR5C \ud83c\udde6\ud83c\uddeb need three wickets for a famous win, but there's just 10 overs of play left for the day!\n\nCan they pull it off, or will \ud83c\udde7\ud83c\udde9 hold out?\n\nFollow #BANvAFG blog for live updates \u23ec\nhttps://t.co/kHXVx32oOc https://t.co/uUg8odtpV3 Afghanistan's push for victory receives a huge fillip with Zahir Khan removing Shakib Al Hasan first ball after a lengthy rain delay!\n\nFollow #BANvAFG blog for live updates \u23ec\nhttps://t.co/kHXVx32oOc https://t.co/k0NLxGoox4 Australia skipper Tim Paine is enjoying being on a ride with genius Steve Smith. \n\n#Ashes https://t.co/PM33Sq9fXo Update: The rain has stopped. Covers are off. Tea has been taken and groundsmen are working hard to get the outfield ready. https://t.co/3Z2AZ2mufz \"The vision is to keep the consistency level going and keep an eye on developing the bench strength\" \u2013 Ravi Shastri\n\nhttps://t.co/dNOeArMzgn She has represented India in 58 internationals, including two Test wins in England in 2006 and 2014. Her 58 ODI dismissals is third-highest among all Indian wicket-keepers in the format.\n\nHappy birthday to Karuna Jain \ud83c\udf89 https://t.co/XDBpDX4sVC \ud83c\udf27\ufe0f\ud83c\udf27\ufe0f\ud83c\udf27\ufe0f\n\nA start-stop kind of day in Chittagong as rain interrupts play after 2.1 overs of action.\n\nFollow #BANvAFG blog for live updates \u23ec\nhttps://t.co/kHXVx32oOc https://t.co/6vht17SryW #OnThisDay in 1994, Sachin Tendulkar scored his first ODI hundred, against Australia in Colombo...\n\n... and the rest is history!\n\nWhich is your favourite @sachin_rt ODI hundred? https://t.co/hV9cnkTRp3 \ud83c\udde7\ud83c\udde9 need 262 runs to win\n\ud83c\udde6\ud83c\uddeb need four wickets to win\n\nWho will come out on top today?\n\nFollow #BANvAFG day five live \ud83d\udc47\nhttps://t.co/kHXVx32oOc https://t.co/K98H7WRH8V Update: Play to resume at 1pm local time! https://t.co/tokOQcAobr \"Bowling at Steve Smith in his form is difficult.\"\n\nEngland captain Joe Root said missed chances to dismiss the Australian batsman cost them the Old Trafford Test.\n\nhttps://t.co/rMYLOTirpE Good news from Chittagong!\n\nIt has stopped raining and the field is being assessed \ud83e\udd1e\n\n#BANvAFG live updates \ud83d\udc47\nhttps://t.co/kHXVx32oOc https://t.co/UcEwZw1gSY \"My dream as a cricketer was to come here and win an #Ashes\" \u2013 Tim Paine after Australia retained the urn with a win over England at Old Trafford.\n\nhttps://t.co/TUXXjzF9UG #OnThisDay in 1853, Fred Spofforth, one of Australia's most fearsome pace bowlers, was born.\n\nHe made 18 Test appearances for his country, taking 94 wickets at an average of 18.41, and he was also the first bowler to claim a Test hat-trick. https://t.co/6CIr6A1JCS The start of day five of the #BANvAFG Test has been delayed due to \ud83c\udf27\ufe0f\n\nFollow the blog for live updates \ud83d\udc47\nhttps://t.co/kHXVx32oOc https://t.co/8P204zXwEo Caption this...\n\n#Ashes https://t.co/nyJwuwLliH Guess who \ud83e\udd14\n\n#Ashes https://t.co/acmJ6Fiy5N Just waking up \ud83c\udde6\ud83c\uddfa fans?\n\nHere's what you missed \ud83d\udc47\nhttps://t.co/ym5R3XdsoV 4\ufe0f\u20e3 50+ scores\n8\ufe0f\u20e3 bowlers\n6\ufe0f\u20e3 wicket takers\n\nAustralia's series-sealing victory over West Indies was a true team effort!\n\n#WIvAUS REPORT \ud83d\udc47\nhttps://t.co/eeVjcozPjv Party time for Australia \ud83c\udf7e\ud83d\udd7a\ud83c\udf89\n\n#Ashes https://t.co/TBOSPSOxWY Steve Smith, of course, is Player of the Match.\n\nWhat a phenomenal comeback he's had!\n\n#Ashes https://t.co/arBv548gYo Women's Ashes \u2705\nMen's Ashes \u2705\n\nIt's been quite a summer for Australian teams in England.\n\n#Ashes https://t.co/4q4OqL9iIj #NewCoverPic https://t.co/sNar2raYTL \"I didn't think it would be this emotional. The amount of work that's tried to go on in to retain the Ashes has been enormous and I'm really proud of this group and how we bounced back from Headingley\" - Tim Paine\n\n#Ashes https://t.co/nPTV6kzCCO \"It feels amazing to know the urn is coming home. I've been here a few times when things haven't gone our way. This was always one to tick off my bucket list. It's extremely satisfying\" - Steve Smith\n\n#Ashes https://t.co/wVvUCxOeDJ England fought hard, but Australia were just too good.\n\nA superb, dramatic final day ends with the tourists having won by 185 runs.\n\n#Ashes scorecard \ud83d\udc47\nhttps://t.co/zrb0K55IBc https://t.co/ZH45ItuUxm RT @JofraArcher: Ashes to ashes and dust to dust \ud83c\udfb5 Australia have retained the men's Ashes!\n\n#Ashes | #ENGvAUS https://t.co/ExLUMukTRn An unbeaten century from Ellyse Perry has taken Australia past 300 in the second ODI against West Indies!\n\nCan the hosts chase this down?\n\nWatch #WIvAUS live \ud83d\udc40\nhttps://t.co/0sSxfNGfFM https://t.co/SihhzN1dJo England are still scrapping at Old Trafford!\n\nHeadingley hero Jack Leach has made his highest score of the series, and Australia still need two wickets to win.\n\nFollow the #Ashes live \ud83d\udc47\nhttps://t.co/zrb0K55IBc https://t.co/ijJNcmDfX8 HUGE MOMENT!\n\nJosh Hazlewood gets Jos Buttler after 111 balls of resistance. Australia are now just three wickets away from retaining the Ashes!\n\nFollow the #Ashes live \ud83d\udc47\nhttps://t.co/zrb0K55IBc https://t.co/QOdrgtzQmY Australia need four wickets in the final session to retain the Ashes, but if England can survive, the destination of the urn will be decided at The Oval.\n\nIt's all set to be another thriller at Old Trafford!\n\nFollow the #Ashes live \ud83d\udc47\nhttps://t.co/zrb0K55IBc https://t.co/5pjbs4iPiR Australia have surged to 123/2 in 25 overs at Antigua!\n\nAlyssa Healy blitzed yet another half-century, and Ellyse Perry is well set. What can the tourists make from here?\n\nWatch #WIvAUS live \ud83d\udc40\nhttps://t.co/0sSxfNGfFM https://t.co/H5RwVhTnl2 ICYMI: After a terrific spin-bowling performance in Chattogram, Afghanistan are just four wickets away from their second Test victory in three games.\n\n#BANvAFG day four report \u2b07\ufe0f\n\nhttps://t.co/QzuLE5IHFQ Pitching \u21db Outside off \ud83d\udd34\nImpact \u21db In-line \ud83d\udd34\nWickets \u21db Umpire's call \ud83d\udfe1\n\nJonny Bairstow falls! Australia are just four wickets away... \ud83d\udc40\n\nFollow #Ashes LIVE \ud83d\udd3d\nhttps://t.co/zrb0K4O7cC https://t.co/Hf5Ksazu0T Alyssa Healy has just hit three fours and one six in a single over \ud83e\udd2f \n\nAustralia are 33/0 after six overs against West Indies.  \n\nSCORECARD \ud83d\udcdd \u2013 https://t.co/WL0EtTxGLc\nLIVE STREAM \ud83d\udcf9 \u2013 https://t.co/0sSxfNGfFM https://t.co/aOHv3sFd7w The partnership between Jonny Bairstow and Jos Buttler has crossed 40. \n\nCan they take England to \u2615\ufe0f without further hiccups?\n\nFollow #Ashes LIVE \u25b6\ufe0f https://t.co/zrb0K55IBc https://t.co/GpCdvPWiOm BIG NEWS from Antigua: Meg Lanning is out of the 2nd ODI, Rachael Haynes will lead in her stead. \n\nAustralia have opted to bat first, Erin Burns makes her debut for the visitors. \n\n#WIvAUS https://t.co/RnZykk5X1j \u201cI want to be the best in the world.\"\n\nUnfazed by the Bumrah, Archer hype, Kagiso Rabada wants to claim a place of his own \ud83d\udc47 \nhttps://t.co/byhBtK5mME \u2794 Promoted to the \ud83d\udd1d of the batting order\n\u2794 Gets a crucial 5\ufe0f\u20e30\ufe0f\u20e3 \n\nThird Test half-century for Joe Denly \u2013 can he convert it into his maiden \ud83d\udcaf?\n\nFollow #Ashes LIVE \u2b07\ufe0f\nhttps://t.co/zrb0K55IBc https://t.co/juU57iKA1f England fans right now \ud83d\ude2e\n\n#Ashes https://t.co/FB0Xw9Doah Brathwaite had earlier been reported for a suspect bowling action in August 2017 but was cleared following an independent assessment.\n\nhttps://t.co/eqCW9QGO7J \ud83d\udc47 https://t.co/YVcIURAbkQ @patcummins30 Add another \ud835\udc16 to that \ud83d\udc40\n\nStokes is gone for 1 \u2013 huge wicket for the visitors! \n\nAustralia are six wickets away from retaining the Ashes. \n\nFollow #Ashes LIVE \ud83d\udd3d\nhttps://t.co/zrb0K4O7cC Pat Cummins in this Test so far:\n\n\ud83d\udca5 32 overs\n\ud83d\udca5 8 maidens\n\ud83d\udca5 6 wickets\n\n#Ashes | @patcummins30 https://t.co/xG3Kinkqhq Through the gate! \ud83c\udfaf\n\nJason Roy is bowled by Pat Cummins, and Australia have their first wicket of the day. \n\nFollow #ASHES live \ud83d\udc47\nhttps://t.co/zrb0K55IBc https://t.co/HDCHsbiyHt STUMPS on day four. Play is called off early due to \ud83c\udf27\ufe0f\n\nAfghanistan need four wickets to win tomorrow, Bangladesh need 262 runs. Shakib Al Hasan (39*) and Soumya Sarkar (0*) will take guard for the hosts. \n\n#BANvAFG SCORECARD \u2b07\ufe0f\nhttps://t.co/kHXVx32oOc https://t.co/2yJPHl3Gzc A few close calls, but no wickets for Australia on the fifth morning yet. Jason Roy and Joe Denly have dug in. \n\nFollow #Ashes LIVE \u25b6\ufe0f https://t.co/zrb0K55IBc https://t.co/XOL8hqkAft Fastest to 13 ODI centuries:\n\nHashim Amla: 83 innings\nMeg Lanning: 76 innings \ud83d\udc4f\ud83d\udc4f\n\n#WIvAUS\n\nhttps://t.co/Sf4epaKA6h Mohammad Nabi dismisses Shadman Islam soon after tea. Afghanistan are just five wickets away from a victory.\n\n#BANvAFG live blog: https://t.co/kHXVx32oOc https://t.co/IiaJTWlvqh When you don't have to worry about bowling England out and can enjoy Day 5 instead \ud83d\ude1d\n\n#Ashes | @petersiddle403 https://t.co/09vwLHQXOg Day 5, Old Trafford, Manchester, 4th Test\n\nTo win: Australia need 8 wickets, England need 365 more.\n\nAll three results are possible \ud83e\udd37\u200d\u2642\ufe0f \n\nFollow the #Ashes live \ud83d\udc47\nhttps://t.co/zrb0K55IBc https://t.co/NGCSePMVgf Rashid Khan continues to weave his magic. Bangladesh lose two more. Can Shakib save this for the home side?\n\n#BANvAFG live blog: https://t.co/kHXVx32oOc https://t.co/Dgctqr7h1a #OnThisDay two years ago, James Anderson became the first England bowler to take 500 Test wickets when he dismissed West Indies' Kraigg Brathwaite at Lord's \ud83d\udc4f https://t.co/FgRkYM6DnK Zahir Khan has dismissed Liton Das and Mosaddek Hossain after lunch. Bangladesh are 52/2 and still need 346 more.\n\n#BANvAFG live blog: https://t.co/kHXVx32oOc https://t.co/HYy8RoH0wW \u2022 243 international appearances\n\u2022 6,921 runs\n\u2022 A World Cup-winning wicket-keeper batsman\n\nHappy birthday to England's Jos Buttler, who turns 29 today! https://t.co/8KNHOIbqCr Steve Smith: \"Textbook shot, say what?\"\n\n#Ashes https://t.co/il2cdiwWIF Liton Das and Shadman Islam start steadily to take Bangladesh to 30/0 at lunch.\n\nThe hosts need 368 more to win.\n\n#BANvAFG live blog: https://t.co/kHXVx32oOc https://t.co/cg4ltSoaJG karma [noun]\nkar\u00b7ma | \\ \u02c8k\u00e4r-m\u0259 also \u02c8k\u0259r-  \\\nDefinition of karma\noften capitalized : the force generated by a person's actions held in Hinduism and Buddhism to perpetuate transmigration and in its ethical consequences to determine the nature of the person's next existence. https://t.co/tv2UmTd1TI \"We know it will be difficult but as Ben Stokes showed last week, anything is possible.\"\n\nEngland head coach Trevor Bayliss agrees that the odds are in Australia's favour but a couple of hundreds can help them save the Test \u2b07\ufe0f \nhttps://t.co/QiETaZGcUh His 82 is both the second-highest score of this Test by any player (behind his own 211), but also Steve Smith's lowest score of this entire #Ashes series \ud83e\udd2f https://t.co/kgMSTif9V3 Bangladesh bowl Afghanistan out for 260!\n\nRashid Khan's men have set the hosts a target of 398 to win the one-off #BANvAFG Test.\n\nFollow the action live \ud83d\udc47\nhttps://t.co/kHXVx32oOc https://t.co/TrU7jaZiuS Afghanistan resume day four of the #BANvAFG Test on 237/8, leading Bangladesh by 374, with Afsar Zazai and Yamin Ahmadzai in the middle.\n\nFollow the action live \ud83d\udc47 \nhttps://t.co/kHXVx32oOc https://t.co/lVW6s31xbi Steve Smith believes Australia have already unlocked what they need to do to win the Manchester Test and retain the #Ashes.\n\nhttps://t.co/8sE4cCw45C The start of day four of the one-off #BANvAFG Test has been delayed due to rain. \n\nFollow our blog for live updates \ud83d\udc47\nhttps://t.co/kHXVx32oOc https://t.co/BtQxtxrKqv Steve Smith in the 2019 #Ashes \n\n1\ufe0f\u20e34\ufe0f\u20e34\ufe0f\u20e3 \n1\ufe0f\u20e34\ufe0f\u20e32\ufe0f\u20e3 \n9\ufe0f\u20e32\ufe0f\u20e3 \n2\ufe0f\u20e31\ufe0f\u20e31\ufe0f\u20e3 \n8\ufe0f\u20e32\ufe0f\u20e3 \n\nIncredible. https://t.co/jIt9LUB9kV \"It was my dream as well to help Afghanistan obtain Test status and that dream is realised now.\"\n\nhttps://t.co/IYAo3VOVFr The \ud83d\udcaf T20I wickets club \ud83d\udcaa\n\n1\u20e31\u20e35\u20e3 Anisa Mohammed (West Indies)\n1\u20e30\u20e34\u20e3 Lasith Malinga (Sri Lanka)\n1\u20e30\u20e33\u20e3 Ellyse Perry (Australia) https://t.co/DMmDfNgoza Another day of Ashes cricket resulted in more runs from the blade of Steve Smith.\n\n#Ashes REPORT \u2b07\ufe0f \nhttps://t.co/NTujKetNDa England finish on 18/2 \u2013 Australia need eight wickets tomorrow to retain the Ashes. \nIt's been another strong day for the visitors. \n\n#Ashes SCORECARD \ud83d\udc47\nhttps://t.co/zrb0K55IBc https://t.co/YrJEKFG5Bg What a start for Australia!\n\nPat Cummins picks up two wickets in two balls from his opening over \ud83d\udc4f \ud83d\udc4f \n\n#Ashes https://t.co/axreKKVk7N Australia have declared on 186/6, setting England a target of 383. \n\nSteve Smith was Australia's star once again, hitting 82 from just 92 balls. What a cricketer. \n\nFollow the #Ashes live \ud83d\udc47\nhttps://t.co/zrb0K55IBc https://t.co/jgm7EFlfqx \"AUSTRALIA! AUSTRALIA! AUSTRALIA!\"\n\nDoes anyone know where Bangladesh and Thailand are going next February?\n\n#T20WorldCup https://t.co/09sHLYpfMl A 70-run win that will live long in the memory  \ud83d\udc4f \ud83d\udc4f https://t.co/SDWxmwuaca \ud83e\udd2f https://t.co/yDNtzcLtnn RT @T20WorldCup: Here's how the groups for the #T20WorldCup shape up \ud83d\udc47 https://t.co/O2V9UqTSHd They just can't get him out. \n\nSteve Smith moves to fifty once again. \n\n#Ashes https://t.co/gsePj2blUV Brilliant bowling from Jofra Archer and Stuart Broad in that session. \n\nAustralia go to tea on 63/4, but they still lead by 259. \n\nFollow the #Ashes live \ud83d\udc47\nhttps://t.co/zrb0K55IBc https://t.co/vrxuktDLqt New Zealand spinner Mitchell Santner has stormed into the top 10, cruising up to No.5 in the latest @MRFWorldwide ICC T20I Bowler Rankings. https://t.co/57yuXHkX9B What an effort!\n\nThe last day of the #T20WorldCup Qualifier has been one to savour! https://t.co/eOVgcujp9t David Warner struggles to open his account yet again! Paceman Stuart Broad has dismissed him for another duck in Manchester.\n\nThe Australian's numbers in the #Ashes so far: 2, 8, 3, 5, 65, 0, 0, 0. https://t.co/JgYNOkZCmv Australia have bowled England out for 301!\n\nOpener Rory Burns and skipper Joe Root made fifties while Jos Buttler contributed with a 65-ball 41.\n\nFollow the #Ashes live \ud83d\udc47\nhttps://t.co/zrb0K55IBc https://t.co/slcZAPpizn JUST IN: Afghanistan all-rounder @MohammadNabi007 is set to retire from Test cricket after the conclusion of the ongoing one-off #BANvAFG Test. https://t.co/4KbGwFj6yn Australia picked up three wickets in the first session of day four of the Manchester Test. \n\nEngland are 278/8 at lunch, trailing by 219.\n\n#Ashes live blog: https://t.co/zrb0K55IBc https://t.co/FJMRCd9Kpb Afghanistan recovered from being 4/2 in the second innings to extend their lead over Bangladesh to 374 at the end of day three.\n\n\ud83d\udcdd #BANvAFG report \ud83d\udc47\nhttps://t.co/lJDPgYnFOl \ud83d\udc46 Jonny Bairstow\n\ud83d\udc46 Ben Stokes\n\nAustralia paceman Mitchell Starc has picked up two crucial wickets. \n\nEngland are 248/7.\n\nFollow the #Ashes live \ud83d\udc47\nhttps://t.co/zrb0K55IBc https://t.co/Lm7ZHNOtEU Fifties from Ibrahim Zadran and Asghar Afghan help Afghanistan finish day three of the one-off #BANvAFG Test on 237/8, leading by 374.\n\nSCORECARD \ud83d\udc47\nhttps://t.co/kHXVx32oOc https://t.co/Vk9fqfSF3M Day four of the Manchester Test is under way.\n\nEngland resume on 200/5, trailing Australia by 297, with Ben Stokes and Jonny Bairstow in the middle.\n\nFollow the #Ashes live \u2b07\ufe0f\nhttps://t.co/zrb0K55IBc https://t.co/9Bv7AYKYLg The competition for the third and seventh places is on! https://t.co/xz5RM7klra Fifties from Asghar Afghan and Ibrahim Zadran help Afghanistan extend their lead to 293 runs at tea \u2615\ufe0f\n\nThey are 156/4.\n\nLive blog: https://t.co/kHXVx32oOc https://t.co/x46pDYHlLI Tim Southee \u2197\ufe0f\nLasith Malinga \u2197\ufe0f\nMitchell Santner \u2197\ufe0f\n\nAfter the conclusion of #SLvNZ T20I series, players from \ud83c\uddf1\ud83c\uddf0 and \ud83c\uddf3\ud83c\uddff gain big in the latest @MRFWorldwide ICC T20I Player Rankings.\n\nhttps://t.co/nsS7xigXJH Asghar Afghan joins the party! \n\nHe brings up his third Test fifty in Chittagong. Can he convert this into a hundred today? \n\nFollow #BANvAFG live \ud83d\udc47\nhttps://t.co/kHXVx32oOc https://t.co/KlXtFk0hac A fifty on debut for Ibrahim Zadran!\n\nThe 17-year-old Afghanistan batsman brings up his half-century off 117 balls on day three of the #BANvAFG one-off Test.\n\nFollow the action live \ud83d\udc47\nhttps://t.co/kHXVx32oOc https://t.co/3uX5kLvKHi The former Australia skipper made 125 international appearances for his country and has 3,700 runs to his name.\n\nHe also led his side in two ICC Men's @T20WorldCup in 2012 and 2014.\n\nHappy birthday to George Bailey, who turns 37 today! https://t.co/ZOp7FJLxiS Josh Hazlewood has 16 wickets at 16.50 so far this #Ashes! \n\nHe credits it to the work he put in while he was on the sidelines, recovering from injury. \n\nhttps://t.co/pBl1Yh5Ypm LUNCH \ud83c\udf7d\ufe0f \n\nAfghanistan end the first session of day three on 56/3, ahead by 193 runs. \n\nWhat do you think is a winning lead?\n\nFollow #BANvAFG \u2b07\ufe0f\nhttps://t.co/kHXVx32oOc https://t.co/jUMFZJssLl Legendary wrist-spinner, Pakistan icon, England's nemesis, beloved mentor and inspiration to many \u2013 remembering Abdul Qadir. \n\nhttps://t.co/96Rrk0vR5L It's all happening at Chattogram!\n\nShakib Al Hasan takes two in two, including the first-innings centurion Rahmat Shah! Fightback from Bangladesh? \n\nFollow #BANvAFG \u2b07\ufe0f\nhttps://t.co/kHXVx32oOc https://t.co/KIOja2YqFK \u2705 Youngest Test skipper\n\u2705 Half-century\n\u2705 Five wickets \n\ud83d\udc4f\ud83d\udc4f  \n\nA brilliant Test captaincy debut for Rashid Khan! He takes the last wicket, bowling out Bangladesh for 205 in their first innings. The hosts trail by 137 runs.  \n\nFollow #BANvAFG \u2b07\ufe0f\nhttps://t.co/kHXVx32oOc https://t.co/5vUszFIkeO Afghanistan have struck in the first over on day three! Bangladesh have lost their ninth wicket without adding to their overnight 194!\n\nCan Shakib's men fight back? \n\nFollow #BANvAFG live \u2b07\ufe0f\nhttps://t.co/kHXVx32oOc https://t.co/H5IvcVJAIE Adored.\n\n#SLvNZ https://t.co/0W6pqHSlMG Josh Hazlewood was Australia's star on day three of the Old Trafford Test. \n\n#Ashes REPORT \u2b07\ufe0f \nhttps://t.co/DF4SrycRlv How good has Josh Hazlewood been in the 2019 #Ashes?\n\nEven having missed the first game, he is two away from being the leading wicket taker in the series and he claimed all four wickets to fall on the third day at Old Trafford.\n\nWill he complete a second five-for of the series? https://t.co/h6PillteKO Lasith Malinga stunned New Zealand with four wickets in four balls to help deliver victory for his side in the third T20I. \n\n#SLvNZ REPORT \u2b07\ufe0f \nhttps://t.co/QWMEBlSJMi Rashid Khan showed his class with both bat and ball on day two of the one-off Test against Bangladesh. \n\n#BANvAFG REPORT \u2b07\ufe0f \n\nhttps://t.co/aHGIqc3FB3 Another big score incoming from this man tomorrow?\n\n#Ashes https://t.co/YgXcqbH4x5 And that will be stumps!\n\nA solid reply from England for the most part, underpinned by a big stand between Joe Root and Rory Burns, but Australia's late strikes mean they remain in with a chance of retaining the Ashes at Old Trafford.\n\n#Ashes | #ENGvAUS https://t.co/b1WEiwLstk The players are leaving the field due to bad light. \n\nEngland are 200/5 with Josh Hazlewood responsible for four of those wickets. \n\n#Ashes SCORECARD \ud83d\udc47\nhttps://t.co/zrb0K55IBc https://t.co/utF3xrAyRx Abdul Qadir, the legendary Pakistan leg-spinner, has passed away at the age of 63. May he rest in peace. https://t.co/Kl0Vox35Qu #NewCoverPic https://t.co/x3vgHmb2dL New Zealand have been bowled out for 88 \u2013 Sri Lanka win by 37 runs!\n\nAnd Lasith Malinga was at the heart of the victory, taking his fifth international hat-trick. Fifth. Wow. \n\n#SLvNZ SCORECARD \u2b07\ufe0f \nhttps://t.co/1QfPSX5Pt0 https://t.co/rNhntMLZFZ The runs continue to flow for England as Joe Root now moves to fifty. \n\nFollow the #Ashes live \ud83d\udc47\nhttps://t.co/zrb0K55IBc https://t.co/9zcCavihjd Malinga takes his fifth wicket!\n\nHe really is something else. What a bowler. \n\nFollow the action live \ud83d\udc47\nhttps://t.co/1QfPSX5Pt0 https://t.co/rc3jQOlf4U And Ross Taylor goes!\n\nHE'S GOT FOUR IN FOUR!\n\nIt's not even the first time he's done this! \n\n#SLvNZ https://t.co/ruvS6ITPLC HAT TRICK FOR LASITH MALINGA!\n\nINCREDIBLE!\n\n#SLvNZ https://t.co/SIdk07l3SI England go to tea on 125/2 \u2013 they lost just one wicket in the session. \n\nRory Burns is unbeaten on 62, while Joe Root is three runs away from another Test half-century. \n\nFollow the #Ashes live \ud83d\udc47\nhttps://t.co/zrb0K55IBc https://t.co/H8J19HxdCl Sri Lanka have been restricted to a total of 125/8 by New Zealand. \n\nMitchell Santner was particularly excellent for the @BLACKCAPS, returning figures of 3/12 from four overs. \n\nFollow the action live \ud83d\udc47\nhttps://t.co/1QfPSX5Pt0 https://t.co/Tv21XzYebo Rory Burns goes to fifty for the third time this series \ud83d\udc4f \ud83d\udc4f \n\n#Ashes https://t.co/YPIJJcB0GY After losing an early wicket, Rory Burns and Joe Root have steadied the innings in Manchester. \n\nEngland are 70/2, trailing by 427. \n\nFollow the #Ashes live \ud83d\udc47\nhttps://t.co/zrb0K55IBc https://t.co/QmIet34RJm Sri Lanka have opted to bat in the final #SLvNZ T20I in Pallekele. \n\nWill the hosts finish the series on a winning note? Or will New Zealand sweep it 3-0? \n\nFollow the action live \ud83d\udc47\nhttps://t.co/1QfPSX5Pt0 https://t.co/UPyeeF18Lo RT @ICCLive: 3rd T20I. Sri Lanka XI: MDKJ Perera, WIA Fernando, N Dickwella, D Shanaka, I Udana, D Gunathilaka, W Hasaranga, L Madushanka,\u2026 RT @ICCLive: 3rd T20I. New Zealand XI: H Rutherford, C Munro, T Seifert, C de Grandhomme, R Taylor, D Mitchell, M Santner, S Kuggeleijn, T\u2026 RT @ICCLive: 3rd T20I. Toss won by Sri Lanka, who chose to bat https://t.co/7FndnU1dBH #SLvNZ An early wicket for Australia! \n\nJosh Hazlewood gets rid of nightwatchman Craig Overton, who falls for five. \n\nFollow the #Ashes live \ud83d\udc47\nhttps://t.co/zrb0K55IBc https://t.co/UBRf8t0jeT Finally, play is underway at Old Trafford!\n\nCan England bounce back after a tough day yesterday?\n\nFollow the #Ashes live \ud83d\udc47\nhttps://t.co/zrb0K55IBc https://t.co/Nkie3BDBQk It's been another excellent day for Afghanistan, but Bangladesh have battled hard in the last hour.\n\nThe hosts finish on 194/8, with an unbroken ninth-wicket stand between Mosaddek Hossain (44*) and Taijul Islam (14*) worth 48. \n\n#BANvAFG SCORECARD \u2b07\ufe0f\nhttps://t.co/kHXVx32oOc https://t.co/3DZB84G8wm Rain has delayed the start of play on day three at Old Trafford \ud83c\udf27\ufe0f \n\n#Ashes https://t.co/WsS9j0L4el \"I see a lot of potential in this particular group of cricketers\"\n\nBob Carter is excited to take over as @WHITE_FERNS coach.\n\nhttps://t.co/YaJX5TecKX He's out to Mohammad Nabi \u2013 Bangladesh are seven down!\n\nFollow #BANvAFG live \u2b07\ufe0f\nhttps://t.co/kHXVx2KNpC https://t.co/L1xIcZlaPN Half-century for Mominul Haque \ud83d\udc4f \ud83d\udc4f \n\nCan he help Bangladesh get back on track?\n\nFollow #BANvAFG live \u2b07\ufe0f\nhttps://t.co/kHXVx2KNpC https://t.co/RRF9Wv5JKI Since July 2015, only Joe Root has scored more centuries than Steve Smith in Tests in England. \ud83d\udca5 \n#Ashes https://t.co/Hy0iQthEKS \ud83c\udde6\ud83c\uddeb captain Rashid Khan has come to the party, taking three massive wickets to leave \ud83c\udde7\ud83c\udde9 reeling at 88/5 at tea! The hosts are still trailing by 254 runs!\n\nFollow #BANvAFG live \u2b07\ufe0f\nhttps://t.co/kHXVx2KNpC https://t.co/xBAt9MVhip A huge congratulations \ud83d\ude4c\n\nWe'll see you down under at the @T20WorldCup! \ud83c\udde6\ud83c\uddfa https://t.co/Xjwv8uqEl7 Just when Bangladesh were beginning to dig in, Mohammad Nabi has broken through with the dismissal of Soumya Sarkar. Afghanistan's spinners have been relentless with their areas.\n\nFollow #BANvAFG live \u2b07\ufe0f\nhttps://t.co/kHXVx2KNpC https://t.co/swfS3wEXIX England find themselves under the pump after Smith's 211, but Jonny Bairstow is hopeful that the hosts can repeat the fight-back they showed at Headingley.\n\nhttps://t.co/cAZDg6ezZs Steve Smith is now the highest run-getter in 2019. Here's the monthly break-up!\nJan: 0\nFeb: 0\nMar: 0\nApr: 0\nMay: 0\nJun: 0\nJul: 0\nAug: 378 runs in 3 innings\nSep: 211 runs in 1 innings \ud83d\udd25 https://t.co/uZbNcU2NPq \"They can\u2019t hit my pad or nick me off. It softens up the ball too.\"\n\nSteve Smith was unfazed by \ud83c\udff4\udb40\udc67\udb40\udc62\udb40\udc65\udb40\udc6e\udb40\udc67\udb40\udc7f's short-ball tactics during his epic #Ashes knock of 211.\n\nhttps://t.co/3JRKQgIe8h Yamin Ahmadzai dismissed Shadman Islam for a duck after Afghanistan posted 342 in the first session. The Bangladesh batsmen have their task cut out.\n\nFollow #BANvAFG live \u2b07\ufe0f\nhttps://t.co/kHXVx2KNpC https://t.co/UC2N3FKraK ICYMI\n\n\ud83d\udcafs from Alyssa Healy and Meg Lanning, and an all-round effort from Ellyse Perry helped Australia to a 178-run victory in the first IWC ODI against West Indies.\n\nhttps://t.co/3HRiCnicPO Bangladesh have dismissed Afghanistan for 342, but not before captain Rashid Khan scored an entertaining 51, featuring two fours and three sixes! He'll look to work his magic with the ball now.\n\nFollow #BANvAFG live \u2b07\ufe0f\nhttps://t.co/kHXVx2KNpC https://t.co/QGUFYUW9Ih Taijul Islam struck early with the wickets of Asghar Afghan (92) and Afsar Zazai (41), but Afghanistan have gone past their highest-ever Test total! Can Bangladesh cut them short of 350?\n\nFollow #BANvAFG live \u2b07\ufe0f \nhttps://t.co/kHXVx2KNpC https://t.co/baHHQ0uRaz Steve Smith's dominance over England's bowlers continued on day two at Old Trafford. \n\n#Ashes REPORT \u2b07\ufe0f \nhttps://t.co/5MWgb7rg1D Afghanistan resume the second day at 271/5, with Asghar Afghan batting on 88. Can he become his country's second century-maker after Rahmat Shah opened the books yesterday?\n\nFollow #BANvAFG live \u2b07\ufe0f \nhttps://t.co/kHXVx32oOc https://t.co/LsNMTwIbWV \ud83c\udde6\ud83c\uddfa's Alyssa Healy and Meg Lanning made hundreds and stitched up a record 225-run stand to set up a huge 178-run victory against \ud83c\udf34 in the first ODI.\n\n#WIvAUS https://t.co/wUumUNS9Vr 15-year-old Shafali Verma has received her maiden senior international call-up, for India's upcoming series against South Africa.\n\nWhat a moment for the youngster \ud83d\ude4c\n\nSee who else made the cut \ud83d\udc47\n\nhttps://t.co/n7mwWDAqbF #ShotOfTheDay | #Ashes https://t.co/LXohQI7lky Chasing 309 to win the first ODI, West Indies have slipped to 23/4 inside eight overs, with Ellyse Perry claiming three scalps.\n\nWatch the chase live \ud83d\udc47\nhttps://t.co/AQL1x6mZkt https://t.co/6nFtOK37B4 Meg Lanning tons up too, for the 13th time in ODI cricket!\n\nWhat. A. Player.\n\n#WIvAUS https://t.co/limdijdIeZ Century for Alyssa Healy, off just 94 balls!\n\nShe's helped Australia to a dominant position after they lost Rachael Haynes to the first delivery of the innings.\n\nWATCH #WIvAUS LIVE \ud83d\udc47\nhttps://t.co/NWJRislaLq https://t.co/5WKL0fjVxS Australia prise out Joe Denly before stumps!\n\nEngland end on 23/1, trailing by 474, and facing an uphill struggle to keep their #Ashes dream alive.\n\n#ENGvAUS SCORECARD \ud83d\udc47\nhttps://t.co/zrb0K55IBc https://t.co/ZNOQAc6wOT West Indies captain Stafanie Taylor has won the toss and chosen to bowl in the first of three ICC Women's Championship ODIs against Australia.\n\nFOLLOW #WIvAUS LIVE \ud83d\udc47\nhttps://t.co/5fWIMebGuQ https://t.co/QCIYXCykVZ Australia have declared on 497/8 after some late hitting from Nathan Lyon and Mitchell Starc!\n\nEngland's new-look opening pair of Rory Burns and Joe Denly will face a tricky 40-minute spell tonight. Can they survive to the close?\n\nFollow the #Ashes live \ud83d\udc47\nhttps://t.co/zrb0K55IBc https://t.co/QjA2ZP8nL0 Steve Smith brings up a superb double hundred \ud83d\udcaa \n\nIt's his third in Test cricket and his third against England. His Test average is now above 65 \ud83d\ude31 \n\nSimply incredible \ud83e\udd2f \n\n#Ashes https://t.co/2em9HHM9SP Thailand are going to the @T20WorldCup and they can't wait to get there!\n\n#T20WorldCup https://t.co/9uzC01sLPa \"We're the West Indies, there\u2019s never a time we're not ready.\"\n\nFighting talk from West Indies' skipper ahead of her side's series against Australia \ud83d\udcaa\n\nREAD \ud83d\udc47\n\nhttps://t.co/K0dihDfHg9 A fantastic achievement!\n\nIt's the first time Thailand have qualified for any Cricket World Cup, men's or women's, in any format \ud83d\udc4f\n\nHistory has been made in Dundee! https://t.co/8cPJpUI9bN That's tea, and a dominant session for Australia. They have added 124 runs without loss since lunch, with captain Tim Paine having made his first half-century of the series, and Steve Smith nearing a double-century.\n\nFollow the #Ashes live \ud83d\udc47\nhttps://t.co/zrb0K55IBc https://t.co/TfDeVbdIJW \ud83d\udde3\ufe0f \"It would be great for us to have such training opportunities for girls with PSL teams as all the teams have top players.\"\n\nJaveria Khan has an idea for the Pakistan Super League \ud83d\udc47\n\nhttps://t.co/vR1Mj2l1jH Ben Stokes has gone off injured, Steve Smith has his highest score of the series, and his partnership with Tim Paine has crossed 100.\n\nAre the Ashes slipping away from England?\n\nFollow the #Ashes live \ud83d\udc47\nhttps://t.co/zrb0K55IBc https://t.co/fKGIdPbV5A ICC #T20WorldCup Qualifier 2019 final: Bangladesh \ud83c\udd9a _________\n\nWhich team will join \ud83c\udde7\ud83c\udde9 in Women's @T20WorldCup 2020? Follow live \ud83d\udc47 https://t.co/0cT7G0Ffg6 Steve Smith (138*) and Tim Paine (28*) have taken the Australian total past 300. Their partnership is now worth 80* \ud83d\ude4c\n\nFOLLOW #Ashes live \u2b07\ufe0f\nhttps://t.co/zrb0K55IBc https://t.co/wbmPvO1DE9 Steve Smith in #Ashes 2019:\n\n\ud83d\udd39 3 Tests\n\ud83d\udd39 479 runs\n\ud83d\udd39 3 centuries\n\ud83d\udd39 1 fifty\n\ud83d\udd39 159.66 average \ud83e\udd2f\n\nFOLLOW LIVE \u25b6\ufe0f https://t.co/zrb0K55IBc https://t.co/6OiqRr94WD 26th Test hundred for Steve Smith \u2013 what a player! \n\nFOLLOW #Ashes live \ud83d\udc47\nhttps://t.co/zrb0K55IBc https://t.co/oF91qkVxgC Teams in the ICC Women's #T20WorldCup 2020:\n\nAustralia\nEngland\nIndia\nNew Zealand\nPakistan\nSouth Africa\nSri Lanka\nWest Indies\n\nBANGLADESH \ud83d\udc4f\ud83d\udc4f\ud83d\udc4f https://t.co/6ZLqeI2hqh RT @T20WorldCup: BANGLADESH QUALIFY FOR THE #T20WORLDCUP! https://t.co/0qcmNdAEa4 STUMPS: Afghanistan finish on 271/5. Asghar (88*) and Afsar (35*) will take guard for the visitors tomorrow.\n\nEarlier in the day, Rahmat became \ud83c\udde6\ud83c\uddeb's first Test centurion. Nayeem was the pick of the \ud83c\udde7\ud83c\udde9 bowlers with figures of 2/43.\n\n#BANvAFG SCORECARD \u25b6\ufe0f https://t.co/kHXVx32oOc https://t.co/eoUgmPGcH4 \ud83d\udc49 33 (30)\n\ud83d\udc49 3/18\n\ud83d\udc49 Player of the Match \ud83c\udfc5 \n\n@JimmyNeesh got @TKRiders off to a great start in the first match of #CPL2019! https://t.co/XWmXvHCpik Jon-Jon Trevor Smuts \u274c\nGeorge Linde \u2714\ufe0f\n\nDetails \ud83d\udc47\n\nhttps://t.co/ICEhWHOQcO Like yesterday, Stuart Broad has begun with \ud83d\udd25 \n\nHe dismisses Travis Head for 19. Australia are four down. \n\nFOLLOW #Ashes live \ud83d\udc47\nhttps://t.co/zrb0K55IBc https://t.co/6S5NtI9b1e DRINKS \ud83e\udd64\n\nAfghanistan lost two quick wickets after Rahmat Shah's \ud83d\udcaf but Asghar Afghan (62*) and Afsar Zazai (12*) have steadied the ship since then. \n\nNayeem Hasan has taken both wickets for \ud83c\udde7\ud83c\udde9 in this session!\n\nFOLLOW #BANvAFG live \u25b6\ufe0f https://t.co/kHXVx32oOc https://t.co/QpHlLxQQn5 Day two of the Manchester Test is under way. Steve Smith and Travis Head are at the crease for Australia. \n\nStuart Broad and Jofra Archer begin the proceedings for the hosts.\n\nFOLLOW #Ashes live \ud83d\udc47\nhttps://t.co/zrb0K55IBc https://t.co/k4rJ3xQ9kk First Test centurions for \u2013\n\n\ud83c\udde6\ud83c\uddfa \u2794 Charles Bannerman\n\ud83c\udde7\ud83c\udde9 \u2794 Aminul Islam\n\ud83c\udff4\udb40\udc67\udb40\udc62\udb40\udc65\udb40\udc6e\udb40\udc67\udb40\udc7f \u2794 WG Grace\n\ud83c\uddee\ud83c\uddf3 \u2794 Lala Amarnath\n\ud83c\udf40 \u2794 Kevin O'Brien\n\ud83c\uddf3\ud83c\uddff \u2794 Stewie Dempster\n\ud83c\uddf5\ud83c\uddf0 \u2794 Nazar Mohammad\n\ud83c\uddff\ud83c\udde6 \u2794 Jimmy Sinclair\n\ud83c\uddf1\ud83c\uddf0 \u2794 Sidath Wettimuny\n\ud83c\udf34 \u2794 Clifford Roach\n\ud83c\uddff\ud83c\uddfc \u2794 Dave Houghton\n\n\ud83c\udde6\ud83c\uddeb \u2794 RAHMAT SHAH \ud83d\udc4f\ud83d\udc4f https://t.co/aeeA9L9M13 TEA in Chattogram \ud83c\udf75\n\nAfter a wicketless session, Afghanistan are 191/3. There have been a few tight calls in the middle, but Rahmat Shah (97*) and Asghar Afghan (48*) have preserved their wickets. \n\n#BANvAFG Scorecard \u25b6\ufe0f https://t.co/kHXVx32oOc https://t.co/icKd8GTggB RT @T20WorldCup: They're underway at Forthill!\n\nIreland are batting first with a place in the #T20WorldCup on the line.\n\n#BANvIRE | WATCH \ud83d\udc47\u2026 \ud83d\udcac \"I can't give an excuse that I'm too young or I'm too small.\"\n\nHappy 19th birthday to \ud83c\uddee\ud83c\uddf3's Jemimah Rodrigues, one of the most exciting young cricketers today \ud83d\udc4f\n\n#HappyBirthday | @JemiRodrigues https://t.co/bdtYyl8aa2 Overton's first day of Test cricket on home soil was \"special\", as was that \ud83d\udc4c in-swinger that befuddled Labuschagne. \n\nhttps://t.co/s6swC7t9OB Against Bangladesh today, \ud83c\udde6\ud83c\uddeb's @rashidkhan_19 became the youngest man to lead in a Test match \ud83d\ude4c\n\n#BANvAFG https://t.co/uBCOK0tzpQ The winners from today's games qualify for the 2020 #T20WorldCup \ud83c\udfc6\n\nFollow @T20WorldCup for live stream and updates \ud83d\udcf2 https://t.co/StS82WB6rB Third Test fifty for Rahmat Shah!\n\nAfghanistan's Mr. Consistent refuses to slow down \ud83d\ude4c\n\n#BANvAFG LIVE \u2b07\ufe0f \nhttps://t.co/kHXVx32oOc https://t.co/w50WUo9Jyk #BANvAFG is Paul Wilson's first Test as an umpire. \n\nCongratulations to the Australian \ud83d\udc4f https://t.co/LvEVX6aqx5 How most batsmen see them.\n\ud83c\udd9a\nHow Steve Smith sees them. https://t.co/i9WqQwkQRr LUNCH \ud83c\udf7d\ufe0f \n\nAfghanistan lost their openers to Taijul Islam, before Mahmudullah struck in the last ball of the morning session. The visitors go to lunch on 77/3.  \n\n#BANvAFG live \u2b07\ufe0f \nhttps://t.co/kHXVx32oOc https://t.co/QOH8zOAMzc \"I've never played a game where you've played with no bails.\"\n\nHere's Marnus Labuschagne's assessment of the first day's play at Old Trafford \ud83d\udc47\n\n#ENGvAUS #Ashes\n\nhttps://t.co/MQ3Ohp4bMh Taijul Islam becomes only the third Bangladesh bowler to take 100 wickets in Tests! \n\nThe left-arm spinner bowls Ihsanullah to reach the milestone in his 25th Test. \n\n#BANvAFG live \u2b07\ufe0f \nhttps://t.co/kHXVx32oOc https://t.co/X6a5lsKDpi There's a vacant spot in Australia's top order. Should it be Ashleigh Gardner's during the tour of West Indies?\n\nhttps://t.co/sy0jiNbQ0t RT @ICCLive: Only Test. Afghanistan XI: Ihsanullah, I Zadran, R Shah, H Shahidi, A Afghan, M Nabi, A Zazai, R Khan, Y Ahmadzai, Q Ahmad, Z\u2026 RT @ICCLive: Only Test. Bangladesh XI: S Sarkar, S I Anik, M Haque, M Rahim, S Al Hasan, Mahmudullah, L Das, M Hossain, M Hasan, T Islam, N\u2026 It's Rashid Khan's first Test as captain! \n\nHe has won the toss and Afghanistan will bat in the one-off Test against Bangladesh in Chattogram. \n\nFollow #BANvAFG live \u2b07\ufe0f \nhttps://t.co/kHXVx32oOc https://t.co/hSF3p6N71s Happy birthday, Mohammad Rafique!\n\nThe left-arm spinner was the first Bangladesh cricketer to take 100 Test wickets and also took 125 ODI wickets for the national side  \ud83d\udc4f \ud83d\udc4f https://t.co/vDQHKHQ2kR 48 appearances for India  \ud83d\udc4f \ud83d\udc4f \n144 international wickets  \ud83d\udc4f \ud83d\udc4f \nTest-best match figures of 10/89  \ud83d\udc4f \ud83d\udc4f \n\nHappy birthday, Pragyan Ojha! https://t.co/cS9w7MSP6j Is it a bird? Is it a plane? No, it's Ben Stokes - but even England's Superman couldn't catch that one!\n\n#ShotOfTheDay | #Ashes https://t.co/HK5GbU9QZx Steve Smith and Marnus Labuschagne both struck half-centuries on a rainy opening day in Manchester. \n\n#Ashes REPORT \u2b07\ufe0f \nhttps://t.co/P8nfRFCAPB Stumps. \n\nIt's been a rainy day in Manchester, and Australia finish it on 170/3. \n\nSteve Smith and Marnus Labuschagne led the way for the visitors with half-centuries, while Stuart Broad picked up two early wickets. \n\n#Ashes LIVE \u2b07\ufe0f \nhttps://t.co/zrb0K55IBc https://t.co/uQU2D8M5vm The covers are on at Old Trafford \ud83c\udf27\ufe0f \n\n#Ashes https://t.co/Eku8xrqZjd Tea. \n\nCraig Overton dismissed Marnus Labuschagne with a beauty, but Steve Smith remains, unbeaten on 60.\n\nAustralia are 170/3.\n\n#Ashes LIVE \u2b07\ufe0f \nhttps://t.co/zrb0K55IBc https://t.co/UX8fwkda4e Another innings, another half-century for Steve Smith. He's returned in some style. \n\n#Ashes LIVE \u2b07\ufe0f \nhttps://t.co/zrb0K55IBc https://t.co/D13N3fltEq It will be the ultimate battle of spinners when Bangladesh take on Afghanistan in the one-off Test in Chittagong tomorrow.\n\nPreview \ud83d\udd3d \nhttps://t.co/Fos3qfkn7H He really does love batting!\n\n#Ashes https://t.co/0HBSEuanfH And now the players are coming back on! https://t.co/LvUL1gf3Uq It's raining again at Old Trafford  \ud83d\ude14 \u2614 \n\n#Ashes https://t.co/zDUjQ2SSta Marnus Labuschagne in the 2019 #Ashes\n\n5\ufe0f\u20e39\ufe0f\u20e3 \n7\ufe0f\u20e34\ufe0f\u20e3 \n8\ufe0f\u20e30\ufe0f\u20e3 \n5\ufe0f\u20e30\ufe0f\u20e3 and counting.\n\nWhat a series he's having. \n\n#Ashes LIVE \u2b07\ufe0f \nhttps://t.co/zrb0K55IBc https://t.co/kToqtrJI04 It's cleared up, and we're set to resume play in 10 minutes! \n\n#Ashes https://t.co/1VJx5crsbL Brings back a few memories from the @cricketworldcup!\n\nhttps://t.co/TOhRMCLt9H https://t.co/7M5uduaWkl Rain means the start of the second session has been delayed. \n\n#Ashes SCORECARD \u2b07\ufe0f \nhttps://t.co/zrb0K55IBc https://t.co/i13mynTvDl 2\ufe0f\u20e32\ufe0f\u20e30\ufe0f\u20e3 international games\n2\ufe0f\u20e37\ufe0f\u20e32\ufe0f\u20e3 wickets\n5\ufe0f\u20e34\ufe0f\u20e38\ufe0f\u20e32\ufe0f\u20e3 runs\n\nHappy Birthday to one of South Africa's finest all-rounders \ud83d\udd25 https://t.co/nrduI2CMdV Marnus Labuschagne and Steve Smith, finally batting together in this Ashes series, and they've been brilliant. \n\nAustralia are 98/2 at lunch. \n\n#Ashes LIVE \u2b07\ufe0f \nhttps://t.co/zrb0K55IBc https://t.co/vP3ol1cqFM \"I have seen guys working unbelievably hard in the last two weeks. I have been pleased with their energy, attitude and work ethics.\"\n\nRussell Domingo, Bangladesh's newly appointed coach, is looking forward to his first assignment \ud83d\udc47 \nhttps://t.co/yZnS1hBDWZ Two wickets in the opening hour for England but now they've got to try get this man out.\n\n#Ashes LIVE \u2b07\ufe0f \nhttps://t.co/zrb0K4O7cC https://t.co/4pB3Q079TQ Brilliant start from Stuart Broad!\n\nHe's removed both of Australia's openers and the visitors are 28/2!\n\n#Ashes LIVE \u2b07\ufe0f \nhttps://t.co/zrb0K55IBc https://t.co/NUIg9xr2SN This aged well \ud83d\ude2c\n#Ashes https://t.co/xgKGrTXCvO Tim Paine has won the toss and Australia will bat first in the fourth Ashes Test at Old Trafford!\n\nMitchell Starc is back in the Australia line-up.\n\n#Ashes https://t.co/qykwNlA6vw A quote tweet for this QT \ud83e\udd70 https://t.co/vtzI2th8lG One hour to go \ud83d\udd5e \n\n#Ashes https://t.co/TN7yBct9vi Steve Smith\nBefore Test rankings update v After Test rankings update \ud83d\ude0f https://t.co/tG3Z8VSwir Misbah and Waqar have both been appointed on a three-year contract.\n\nDetails \ud83d\udc47 \nhttps://t.co/bfPlZ3Dtqt BREAKING: Misbah-ul-Haq has been named Pakistan\u2019s head coach and chief selector and Waqar Younis as the bowling coach. https://t.co/r7qLwEcJqI \"Glad with the brand of cricket we've played and this is how I want the team to play going forward.\"\n\nLasith Malinga is backing his young team despite their T20I series loss against New Zealand \u2b07\ufe0f \nhttps://t.co/Mr1U20fPgQ \"I haven\u2019t lost a hell of a lot of sleep thinking about my captaincy, but I have lost a bit of sleep thinking how we\u2019re going to get Stokes out.\"\n\nTim Paine has had quite a few sleepless nights since the Headingley loss \ud83d\udc47 \nhttps://t.co/TV1nJho96J Spoken like a true captain \ud83d\ude4c https://t.co/2rCwqP3HS4 Look who's ready for the 'Ultimate Test' \ud83d\udc40 https://t.co/XFfMiaTNs3 Thailand are just one win away from the @T20WorldCup!\n\nAfter their nail-biter against Ireland, the Thai players bowed to all four sides of the ground \ud83d\ude4f https://t.co/X0h8eamAkO Mithali Raj's T20I career saw her take part in six @T20WorldCup campaigns. Here's how she performed at them \u2b07\ufe0f \n\nhttps://t.co/qxBNtCP1sb ICYMI \u2b07\ufe0f \nhttps://t.co/d4po5ePxwf \u201cI am looking forward to the next chapter with Ireland, with a busy year in 2020 and the @T20WorldCup Qualifier coming up it is an exciting time to be a part of.\u201d\n\nhttps://t.co/7LKcixdRtU Colin de Grandhomme is in excellent form with the bat. \n\n#SLvNZ REPORT \u2b07\ufe0f \nhttps://t.co/YXQhF6GAuN A moment they'll never forget \ud83d\udc4f\ud83d\udc4f https://t.co/ehmtjnwyiv RT @T20WorldCup: That result at Forthill means that Papua New Guinea are now just one win away from the T20 World Cup!\n\n#T20WorldCup https:\u2026 An incredible drama-filled last over featured two wickets, but New Zealand have sealed victory!\n\nTom Bruce and Colin de Grandhomme both hit fifties and the @BLACKCAPS have sealed a series win. \n\n#SLvNZ LIVE \ud83d\udc47\nhttps://t.co/wYMBCTwtBP https://t.co/RcRxy5Xbn7 Colin de Grandhomme has gone to fifty! What an innings this has been so far \ud83d\udc4f \ud83d\udc4f \n\n#SLvNZ LIVE \ud83d\udc47\nhttps://t.co/wYMBCTwtBP https://t.co/P86IIald2u New Zealand restrict Sri Lanka to 161/9, Niroshan Dickwella the top-scorer with a 30-ball 39. \n\nWill that total be enough for Sri Lanka to get back in the series?\n\n#SLvNZ LIVE \ud83d\udc47\nhttps://t.co/wYMBCTwtBP https://t.co/EXZaCEsPGb ICYMI: Rishabh Pant is now the fastest Indian to 50 Test dismissals. He overtook MS Dhoni, who took 15 Tests to achieve the feat \ud83d\ude4c https://t.co/nMidTSFBLU At the halfway stage of their innings, Sri Lanka are 69/2.\n\nHow far can they get from here?\n\n#SLvNZ LIVE \ud83d\udc47\nhttps://t.co/wYMBCTwtBP https://t.co/6fWAer6R9P What a game, and what a performance from Thailand!\n\n#IREvTHA | #T20WorldCup https://t.co/MAyLoL3368 England have confirmed that Craig Overton will take Chris Woakes' place in their XI for the fourth #Ashes Test at Old Trafford.\n\nGood decision? https://t.co/mxuxl6Jo1w Sri Lanka have won the toss and will bat first in the second T20I against New Zealand.\n\nCan they level the series in Pallekele?\n\n#SLvNZ LIVE \ud83d\udc47\nhttps://t.co/wYMBCTwtBP https://t.co/UCEi835ybu Justin Langer says he felt \"physically ill\" after \ud83c\udde6\ud83c\uddfa's dramatic defeat at Headingley, but is confident his side can \"fight back from it.\"\n\nWhat's your take?\n\nhttps://t.co/xrHzAvh1Kb JUST IN: Zimbabwe captain Hamilton Masakadza, who made his international debut back in 2001, has announced he will retire from international cricket after his side's upcoming T20I series against Bangladesh and Afghanistan. https://t.co/IiunhAk1Sa A young Sri Lankan side led by the veteran Lasith Malinga will look to level the series after a five-wicket loss in the first T20I.\n\nPreview \u2b07\ufe0f\nhttps://t.co/zu5Gs2fz0o \ud83d\udd19\ud83d\udd1b\ud83d\udd1d \n\n#NewCoverPic https://t.co/dCrVnKcdXF Jasprit Bumrah has jumped 4\ufe0f\u20e3 places to claim the No.3 spot in the @MRFWorldwide ICC Test bowling rankings \ud83d\udc4f https://t.co/x0KZXZriEE It didn't take @stevesmith49 too long to find his way back to No.1 on the @MRFWorldwide ICC Test batting rankings!\n\n@ajinkyarahane88 has made some significant strides too \ud83d\udc4f https://t.co/UJ7aezeosR \"I wish to retire from T20Is to focus my energies on readying myself for the 2021 Women's @cricketworldcup.\"\n\nBowing out from the shortest format, @M_Raj03 declares that she still has big ambitions in ODIs.\n\nhttps://t.co/baEixWmRUv Two of the very best!\n\nIn the latest @MRFWorldwide ICC Test batting rankings, Steve Smith has pipped Virat Kohli to become No.1! \ud83d\udc40 https://t.co/eH1DxAmvar @MRFWorldwide Jasprit Bumrah and Jason Holder break into the top 5 of @MRFWorldwide ICC Test bowling rankings \ud83d\udc47\n\nhttps://t.co/yFguBlrHxu Steve Smith has climbed to No.1 in the @MRFWorldwide ICC Test batting rankings, just one point ahead of Virat Kohli! \ud83d\udd25\n\nDetails \ud83d\udc47 \n\nhttps://t.co/d4po5ePxwf With 2364 runs at 37.52, including 17 fifties, she finishes as the most prolific T20I run-scorer for \ud83c\uddee\ud83c\uddf3 in the women's game! BREAKING: Mithali Raj calls curtains on an illustrious T20I career! https://t.co/iNfcSbdeHM \ud83d\udde3\ufe0f \"He's moulded his discipline, his work ethic, the way he trains, the way he takes care of his diet.\"\n\nKohli sheds light on what makes Bumrah so good!\n\nhttps://t.co/QOISq7PV4I Hey Virat, where are India in the World Test Championship table? \u261d\ufe0f\n\n#WIvIND https://t.co/wzYG1eqisl The Women's Cricket Super League ended after a run of four seasons. Here's a look at the tournament over the years \ud83d\udcf8 \ud83d\udd3d \nhttps://t.co/tDzzKOU4fq India cemented top spot in the World Test Championship table with victory against West Indies in Jamaica.\n\n#WIvIND REPORT \ud83d\udc47\nhttps://t.co/43axIyjGdj Australia ring in key changes to the squad as they prepare for the crucial fourth #Ashes Test in Manchester.\n\nPreview \ud83d\udc47\n\nhttps://t.co/056JQqigX0 Behind the line, @JofraArcher! https://t.co/dy7F2rbLQ7 Ben Stokes' Headingley masterclass, Jack Leach's special relationship with his glasses, a much-anticipated debut and a world record \u2013 it's all happening in the latest #OnTheUp.\n\nhttps://t.co/yPZS5cAIfZ \ud83e\udd14 https://t.co/SdI5xLMwzu Virat Kohli now has more Test wins (28) than any other Indian captain \ud83c\udfc6\n\n#WIvIND https://t.co/AQKUD1c9HT India wrap up victory by 257 runs!\n\nThey claim a series whitewash and another 60 World Test Championship points from the encounter.\n\n#WIvIND https://t.co/jSB7cYsXc7 All of a sudden India are three wickets from victory!\n\nVirat Kohli brilliantly runs out Sharmarh Brooks before Ravindra Jadeja nicks off Jahmar Hamilton first ball.\n\n#WIvIND LIVE \ud83d\udc47 \nhttps://t.co/EnMtwluiaz https://t.co/nQcfe1KvfL A maiden Test half-century for Sharmarh Brooks, and West Indies' first individual fifty-plus score of the series!\n\nIt's been a battling, gritty knock so far in tough conditions. Can he continue to test India?\n\n#WIvIND LIVE \ud83d\udc47 \nhttps://t.co/EnMtwluiaz https://t.co/D1AVnaBtLi What a shot!  \ud83d\udc4f \ud83d\udc4f https://t.co/zADvc88B4d It's been a hard-fought first session in Jamaica!\n\nIndia are two wickets closer to victory, but Shamarh Brooks and concussion substitute Jermaine Blackwood have combined to frustrate the visitors.\n\n#WIvIND LIVE \ud83d\udc47 \nhttps://t.co/EnMtwluiaz https://t.co/3gzeazf1Sj Darren Bravo, who retired hurt earlier in the West Indies innings, is to be replaced by Jermaine Blackwood as a concussion substitute. \n\n#WIvIND LIVE\ud83d\udc47 \nhttps://t.co/EnMtwluiaz https://t.co/WM2IzcEGge The fourth day of the second Test between India and West Indies is underway!\n\nIndia need eight wickets for victory, while West Indies are 45/2 in pursuit of 468. \n\n#WIvIND LIVE\ud83d\udc47 \nhttps://t.co/EnMtwluiaz https://t.co/lpHc2yxULH Happy birthday Chris Tremlett!\n\nWho remembers his stunning Ashes tour in Australia in 2010-11, where he took 18 wickets in three Test matches? https://t.co/HA50ZmvMwn 1\u20e3: The return of Charlotte Edwards\n2\u20e3: Smriti Mandhana's arrival\n3\u20e3: \u2753\n4\u20e3: \u2753\n5\u20e3: \u2753\n\nFive highlights from the Women's Cricket Super League \ud83d\udc47\n\nhttps://t.co/R8comroFcW Your leading men's T20I wicket-taker, Lasith Malinga!\n\nThe master \ud83d\ude4c https://t.co/cRaMnczSUP Serial winner \ud83e\udd37 https://t.co/qfwsHjAdtm ICYMI: 64* from Ajinkya Rahane and 53* from Hanuma Vihari helped India set a mighty target of 468 for West Indies on day three of the second Test. \n\n#WIvIND REPORT \u2b07\ufe0f\n\nhttps://t.co/nV8UQRkwDK RT @T20WorldCup: An enterprising 78* from skipper Heather Knight and a scintillating 22-ball 39* from Deepti Sharma saw Western Storm clinc\u2026 #Ashes https://t.co/OgVcBB0QvL https://t.co/T4EjGK2x5e Cricket on the beach looks \ud83d\udc4c https://t.co/3pau0konVH ICYMI: New Zealand claimed a five-wicket victory over Sri Lanka in the first T20I in Pallekele, courtesy a 79-run stand between Ross Taylor and Colin de Grandhomme. \n\n#SLvNZ MATCH REPORT \ud83d\udc47\n\nhttps://t.co/l7PcP17A5w Invention \ud83d\ude4c https://t.co/dzCuDWRZQB Happy birthday Ishant Sharma!\n\nWhat a great early birthday present this was \ud83d\udd25 https://t.co/WEnyK1gofn The headband look.\n\nDoes it get a \u2705 or a \u274c from you? https://t.co/Kjbh03BF8x Stumps and day three belongs to India.\n\nThey will require eight wickets to win the second Test match as West Indies finish the day 45/2, chasing 468 for victory! https://t.co/nQw9yFOMAe \ud83d\udea8 India declare on 168/4 \ud83d\udea8 \n\nWest Indies require 468 runs to win! https://t.co/77HgtnaB9g 8\ufe0f\u20e31\ufe0f\u20e3\n1\ufe0f\u20e30\ufe0f\u20e32\ufe0f\u20e3\n2\ufe0f\u20e34\ufe0f\u20e3\n5\ufe0f\u20e33\ufe0f\u20e3*\n\nIt is fair to say Ajinkya Rahane is enjoying India's tour of the West Indies! \n\nHe goes past fifty for the third time in four innings as his side's lead edges towards 4\ufe0f\u20e35\ufe0f\u20e30\ufe0f\u20e3 https://t.co/kGR8A4HkJH Hundred in the first innings, fifty in the second!\n\nHanuma Vihari is in the form of his life \ud83d\udd25 \n\nScorecard \ud83d\udc47 \nhttps://t.co/EnMtwluiaz https://t.co/EMevNq8KSC A dramatic session comes to an end in Kingston!\n\nTwo wickets in two balls reduced India to 36/3 and at Tea they are 73/4, leading by 372 runs.\n\nScorecard \ud83d\udc47 \nhttps://t.co/EnMtwluiaz https://t.co/g5nUGiNE0S Lasith Malinga &amp; Wanindu Hasaranga between them 8-0-44-4,\n\nThe rest of the Sri Lanka bowlers 12-0-122-1 \ud83d\ude10 \n\nSri Lanka fans, would you make any changes to the playing XI? https://t.co/rA99CrGSR6 KEMAR ROACH HAS TWO WICKETS IN TWO BALLS INCLUDING VIRAT KOHLI FOR A GOLDEN DUCK! https://t.co/YkkBQfJU5o Well done, Austria on winning the Continental Cup \ud83c\udfc6 \n\nThey defended 195 against Czech Republic in the final. The five-team T20 event concluded today. A huge congratulations to the finalists and Luxembourg, Romania, Turkey for making their Men's T20I debuts in the tournament. https://t.co/OidAzLWtQH \ud83d\udea8 NEW ZEALAND WIN \ud83d\udea8\n\nde Grandhomme &amp; Taylor added 79 for the fourth wicket before both fell in quick succession.\n\nMitchell &amp; Santner see the Blackcaps to a five-wicket victory \ud83d\udc4f \n\nScorecard \ud83d\udc47 \nhttps://t.co/q6UMYmmYRp https://t.co/jf4kvJUqHe Happy Birthday, Shakera Selman!\n\nIn November last year, she bowled the one millionth recorded delivery in women's internationals in West Indies' win over Sri Lanka in the 2018 #T20WorldCup https://t.co/t816JaaAvF It has now started raining in Pallekele and play has been delayed in #SLvNZ. Taylor falls lbw to Wanindu Hasaranga!\n\nNew Zealand now require 31 runs from 19 balls.\n\nWho is winning this one?\n\nScorecard \u27a1\ufe0f https://t.co/q6UMYmmYRp https://t.co/hxzU4vvDNS Lunch in Kingston!\n\nA disciplined start from the West Indies bowlers means India go into the break 16/1.\n\nScorecard \ud83d\udc47 \nhttps://t.co/EnMtwluiaz https://t.co/N0RHBqNKBh The leading wicket-taker in T20I history!\n\nCongratulations Lasith Malinga \ud83d\udc4f https://t.co/mj2oVbUz7c Good start with the ball from Sri Lanka!\n\nNew Zealand are 62/3 after 10 overs and require another 113 runs to win.\n\nFOLLOW #SLvNZ LIVE \ud83d\udc47\nhttps://t.co/q6UMYmmYRp https://t.co/fvaeyE8tkM ICYMI \ud83d\udc47 \nhttps://t.co/Ht8ZM1UiRe \ud83d\udc4d indeed Jasprit!\n\nAnother sensational bowling performance from the India bowlers sees West Indies bowled out for 117!\n\nIndia have not enforced the follow-on and will bat again, what do you think to that decision India fans? https://t.co/uy8mUHt8W3 Despite losing wickets in the middle overs, late surge has propelled Sri Lanka to 174/4 in 20 overs.\nCan New Zealand chase this down?\n\nFollow #SLvNZ live \ud83d\udc47 \nhttps://t.co/q6UMYmmYRp https://t.co/ba5DI6QMMX New Zealand World Cup hero Lockie Ferguson has been ruled out of the T20I series against Sri Lanka with a fractured thumb and will return home \ud83d\ude22 https://t.co/TqUBGT9315 Fifth T20I fifty for Kusal Mendis! Sri Lanka are 89/2 after 12 overs.\n\nFollow #SLvNZ live \ud83d\udc47 \nhttps://t.co/q6UMYmmYRp https://t.co/T0JfY2D0d7 West Indies are still 329 runs behind India's first innings total. Hattrick hero Jasprit Bumrah has taken 6 out of the 7 wickets lost by the home side. Can he add more to that tally?\n\nFollow #WIvIND LIVE \ud83d\udc47 \nhttps://t.co/EnMtwluiaz https://t.co/CnQvDZuuwm Kusal Mendis and Kusal Perera have given Sri Lanka a fantastic start. They are 37/0 after four overs.\n\nFollow #SLvNZ live \ud83d\udc47 \nhttps://t.co/q6UMYmmYRp https://t.co/Cnk221I4TH Sri Lanka have won the toss and decided to bat first! Wanidu Hasaranga makes his T20I debut for the home side. https://t.co/JaP6CXOM1c \ud83c\udf27\ufe0f\u2614\ufe0f https://t.co/OrBk0F7PLS This man needs three more scalps to become the first bowler to take 100 wickets in T20Is. How many will he take in the first #SLvNZ T20I today? https://t.co/A0SBSMegGP A victory to savour \ud83d\udc4f and the biggest moment of the #T20WorldCup Qualifier so far! https://t.co/nQvm6ApoxE 1\ufe0f\u20e30\ufe0f\u20e3 Tests\n9\ufe0f\u20e37\ufe0f\u20e3 ODIs\n1\ufe0f\u20e38\ufe0f\u20e32\ufe0f\u20e3 International wickets\n\nStill the holder of the best bowling figures in an innings in women's Test cricket.\n\nHappy Birthday to Neetu David, who turns 42 today. https://t.co/JUuZfd9iQY \"It's a difficult decision. Look at Jaddu, his record is fabulous. You have to see what he brings to the table.\"\n\nhttps://t.co/kwatizM1QG \u201cAll I was thinking about was how to get a big score.\"  \n\nIndia batsman Hanuma Vihari reflects on an \"emotional\" first Test hundred.\n\nhttps://t.co/5Dzs1Qnac2 What an honour \ud83d\ude4c\n\nA fitting tribute to the pioneer of women\u2019s cricket and the first woman to be inducted in ICC Hall of Fame. https://t.co/Rbq10aZsG9 On the opening day of the ICC Women's @T20WorldCup Qualifier: \n\n\ud83c\uddf9\ud83c\udded beat \ud83c\uddf3\ud83c\uddf1 by 30 runs \n\u2618\ufe0f beat \ud83c\uddf3\ud83c\udde6 by 7 wickets\n\ud83c\udff4\udb40\udc67\udb40\udc62\udb40\udc73\udb40\udc63\udb40\udc74\udb40\udc7f beat \ud83c\uddfa\ud83c\uddf8 by 30 runs\n\nThe Bangladesh v PNG game was abandoned due to \ud83c\udf27\ufe0f and has been rescheduled for 2 September. \n\nhttps://t.co/ONxoab8niL Indian bowlers to have claimed a hat-trick in Test cricket: \n\n\ud83c\udfa9 Harbhajan Singh v Australia in 2001\n\ud83c\udfa9 Irfan Pathan v Pakistan in 2006\n\ud83c\udfa9 Jasprit Bumrah v West Indies in 2019\n\nWhich one's your favourite? https://t.co/hwuhLDtxmK Sri Lanka and New Zealand are all set to lock horns in the first T20I in Pallekele, with one eye on next year\u2019s ICC Men's #T20WorldCup in Australia.\n\n#SLvNZ preview \ud83d\udc47\nhttps://t.co/yT2mVl1IDY \"I will do the best I can in the one-dayers against India A and hopefully find a place in the Test team.\"\n\n\ud83c\uddff\ud83c\udde6 wicket-keeper batsman Heinrich Klaasen wants to make the most of his opportunities. \n\nhttps://t.co/GuUnUk3Hdy \ud83d\udcdd ICYMI: Bumrah claimed his first Test hat-trick to reduce West Indies to 87/7, after Vihari's maiden ton powered India to 416.\n\n#WIvIND Day 2 report \ud83d\udc47\nhttps://t.co/WeFYqqwk5f ICYMI: Eoin Morgan is having a special summer. \n\nhttps://t.co/CFvc9RHcpH Well played, Matthew Wade  \u270d\ufe0f \ud83d\udc4f https://t.co/SeUG2VWpMc What's @ABdeVilliers17 up to here? https://t.co/0D6b1PkWAm Stumps and what a day it has been for India!\n\nFirstly Hanuma Vihari made his maiden Test century followed by Ishant Sharma's first Test fifty.\n\nThen Jasprit Bumrah took a hat-trick and reduced West Indies to 13/4.\n\nWest Indies are 87/7 after India were bowled out for 416! https://t.co/aOHu1AC4RV Caption this @Martyguptill \ud83d\udc40 https://t.co/NvQCvj7SXb What a bowler Jasprit Bumrah is \ud83d\ude4c https://t.co/TDAeoBxgnl Wow... Just wow Jasprit Bumrah!\n\nWhat a stunning performance, he has all five wickets to fall and West Indies are 22/5 \ud83e\udd2f https://t.co/1sMtbYwn3F \ud83d\udea8 JASPRIT BUMRAH HAS JUST TAKEN A HATTRICK!! \ud83d\udea8 \n\n#WIvIND LIVE \ud83d\udc47 \nhttps://t.co/EnMtwlLT27 https://t.co/sgcFFUhSSw Tea was taken at the conclusion of the India innings.\n\nWest Indies have now got their first innings underway and lost two early wickets, follow it live \ud83d\udc47 \nhttps://t.co/EnMtwlLT27 https://t.co/GiesZOmzTs End of the India innings!\n\nThey are bowled out for 416 with Hanuma Vihari top scoring with 111, his maiden Test century \ud83d\udc4f \n\nJason Holder took five wickets for West Indies. https://t.co/dEpgOu7zlY Maiden Test fifty for Ishant Sharma!\n\nIndia have passed 400 and the eighth wicket partnership is now over 100.\n\nScorecard \ud83d\udc47 \nhttps://t.co/EnMtwlLT27 https://t.co/56IGZPiyr2 \ud83d\udc49 \ud83d\ude04 https://t.co/CKhEs9wYLA A maiden Test century for Hanuma Vihari!\n\nHe's battled hard \u2013 it's come from 197 balls.\n\nFollow #WIvIND \ud83d\udc47 \nhttps://t.co/EnMtwlLT27 https://t.co/peRzDyUkFk That's the end of the opening session \u2013 India are 336/7 with Hanuma Vihari unbeaten on 84.\n\nFollow #WIvIND \ud83d\udc47 \nhttps://t.co/EnMtwluiaz https://t.co/BnypASyxZy RT @T20WorldCup: You can watch #SCOvUSA in the #T20WorldCup Qualifier live!\n\nScotland finished their seven overs with a score of 60/3 - we\u2026 RT @T20WorldCup: Amazing!\n\nThe Thai players celebrate their win with some fans who live in a house that overlooks the Abroath ground \ud83c\udf89 \n\n#T\u2026 50 for Hanuma Vihari!\n\nThat's his third in Test cricket  \ud83d\udc4f \ud83d\udc4f \n\nFollow #WIvIND \ud83d\udc47 \nhttps://t.co/EnMtwluiaz https://t.co/EOvOCeNdpM What a start to day two!\n\nJason Holder has bowled Rishabh Pant for 27 from the first ball bowled. \n\nFollow #WIvIND \ud83d\udc47 \nhttps://t.co/EnMtwluiaz https://t.co/a3LcyuPDgm When you score your third Test half-century in just four games \ud83d\udc4d\n\n#WIvIND https://t.co/vjuDcCEiwz \ud83d\udde3\ufe0f \"The pressure is always there even if you defend.\"\n\nMayank Agarwal admits it was a grind against West Indies bowlers on Friday \ud83d\udc47\n\nhttps://t.co/Otp4BtMzaj RT @T20WorldCup: Thailand's captain Sornnarin Tippoch is full of confidence going into her country's opening fixture in the #T20WorldCup Qu\u2026 One of those memories being this unbelievable grab \ud83d\udc4f\ud83d\udc4f\n\nAll the best with your next chapter, @danielweston83!\n\nhttps://t.co/XrKFQlDJGI https://t.co/YDvF7W33qS \u21e8 15 Tests\n\u21e8 61 ODIs \n\u21e8 114 international wickets\n\n12 wickets in eight games at #CWC 1992 \ud83d\udcaa\n\nWishing New Zealand's Willie Watson a very happy birthday \ud83c\udf82 https://t.co/JLqx47OrVn Happy birthday Clive Lloyd!\n\nIs he the finest captain the West Indies have had? https://t.co/VAB5wsVxtq \u2b50 Muttiah Muralitharan's 16/220 \n\u2b50 Sanath Jayasuriya's 213\n\n#OnThisDay in 1998, Sri Lanka completed a memorable 10-wicket victory over England at The Oval \ud83d\udc4f https://t.co/5CM9oIPjDL 8\u20e3 teams\n2\u20e3 #T20WorldCup places up for grabs \ud83d\ude4c\n\nThe ICC Women's @T20WorldCup Qualifier begins today in Scotland!\n\nhttps://t.co/NtnKQT4MvT Meet the match officials for the Women's #T20WorldCup Qualifier! The tournament will feature an all-female umpiring panel for the first time! \n\nFollow @T20WorldCup for all updates. https://t.co/4Mt4z3Upk5 \ud83d\udd39 296 internationals\n\ud83d\udd39 551 wickets\n\ud83d\udd39 13 five-wicket hauls\n\n1\ufe0f\u20e33\ufe0f\u20e3 wickets in the Kolkata Test against Pakistan in 1999 \ud83d\udc4f\n\nHappy 50th birthday to India's Javagal Srinath \ud83c\udf89 https://t.co/SCDSyqJ2Gu Pakistan \ud83c\udd9a Bangladesh\n3\ufe0f\u20e3 T20Is\n2\ufe0f\u20e3 ODIs \n\ud83c\udfdf\ufe0f Gaddafi Stadium, Lahore\n\nDetails \ud83d\udc47\n\nhttps://t.co/VcJTFxBY6d ICYMI: Fifties from Virat Kohli and Mayank Agarwal saw India reach 264/5 on day one at Sabina Park. Jason Holder claimed three wickets for West Indies. \n\n#WIvIND REPORT \ud83d\udc47\n\nhttps://t.co/3Ojt9cM4rq \"Playing straight, keeping my eyes level, getting my front pad out of the way.\" \n\nMitchell Marsh scored 74 with the bat and returned 1/33 with the ball in Australia's tour match against Derbyshire \ud83c\udfcf\n\nDo you want to see him in the fourth #Ashes Test? https://t.co/WGzZfTLyBG Happy birthday Chris Rogers!\n\nThe opening batsman scored 2015 Test runs for Australia, hitting five centuries. https://t.co/vnwwXEeNVo Could this man be at the top of the Australian order for the fourth Test?\n\nHe opened the batting on day two of his side's tour game against Derbyshire! https://t.co/rv2Fbo8166 Bangladesh have announced their squad for the one-off Test against Afghanistan. \n\nhttps://t.co/Mpj0b5X2SX Good to see you back in action @stevesmith49  \ud83d\udcaa https://t.co/c9HiqI3T9o Stumps at Kingston!\n\nIndia finish 264/5.\n\nAdvantage India?\nhttps://t.co/JvbpWtNBD5 That feeling when you get the @MRFWorldwide No.1 ranked Test batsman in the world out! https://t.co/nfWn4fRDPM Huge wicket for West Indies!\n\nWest Indies captain Jason Holder removes his opposite number Virat Kohli for 76.\n\nFollow #WIvIND \ud83d\udc47 \nhttps://t.co/EnMtwluiaz https://t.co/ZqELw2mOGf \ud83d\udc40 on the ball! https://t.co/9Sklmz9AFc Tea!\n\nIndia go into the interval 157/3, which side do you think is the happier? https://t.co/x4tM2PtG2y Another fifty for Mr Consistent.\n\nIndia have lost the wicket of Agarwal but Kohli and Ajinkya Rahane have now added 34 for the fourth wicket!\n\nScorecard \ud83d\udc47 \nhttps://t.co/EnMtwluiaz https://t.co/P7yjeLESlI ICYMI \ud83d\udc47 \nhttps://t.co/3OAuhdjHRh Fifty for Mayank Agarwal!\n\nHis third half-century for India, can he get that maiden \ud83d\udcaf?\n\n#WIvIND live \u27a1\ufe0f https://t.co/EnMtwluiaz https://t.co/oP01JxglWO Lunch on day one of the second Test between West Indies and India!\n\nIndia going into the interval 72/2, with Mayank Agarwal and Virat Kohli at the crease.\n\nEarlier debutant Rahkeem Cornwall took his first Test wicket \ud83d\udc4f https://t.co/tc7kqzNaiR #SpiritofCricket\n\nNathan Lyon gives Hamidullah Qadri of Derbyshire some advice during Australia's tour game! https://t.co/hWPNP8XNme Time for the second Test between India and West Indies!\n\nWest Indies have won the toss and will bowl first.\n\nFOLLOW #WIvIND \nhttps://t.co/EnMtwluiaz https://t.co/5J0t1OMtgr James Anderson has been ruled out of the rest of the Ashes. \n\n#Ashes https://t.co/bPRgh3yaLm Jason Holder for West Indies since his Test debut: \n\nSecond highest-run getter \u2714\ufe0f\nThird-highest wicket-taker \u2714\ufe0f\nMost overs bowled \u2714\ufe0f\n\n#WIvIND\n\nhttps://t.co/FQpIQVwUGH The #WIvInd battle resumes in Kingston today.\n\nWhich of these players do you expect to shine in the 2nd Test? \ud83d\udc40 https://t.co/jDzpVNxs7S How's this for #FlashbackFriday, @BrettLee_58? \ud83d\ude04 https://t.co/43k5tsKraU Look who's back in action before the fourth #Ashes Test \ud83d\udc40 https://t.co/HoDr4jKi5w \"I think Lyon in the last two Tests alone has got [Stokes] out five or six times had we held our catches or referred our lbws.\"\n\nCaptain Paine backs his off-spinner to 'contain' the rampaging \ud83c\udff4\udb40\udc67\udb40\udc62\udb40\udc65\udb40\udc6e\udb40\udc67\udb40\udc7f all-rounder.\n\nhttps://t.co/sIgGA17RcA \ud83d\udde3\ufe0f \"It took me two years to get that 10th hundred.\"\n\n@ajinkyarahane88 reflects on his match-winning performance in the first #WIvIND Test \ud83d\udc47\n\nhttps://t.co/6kLREs0Y2q Rashid Khan has 18 wickets in nine limited-overs matches at 15.05 against Bangladesh, but Tests are a different ball game, insists Shadman Islam.\n\nhttps://t.co/mKsI3TxMU3 #OnThisDay in 2016, England hit 444/3 against Pakistan, a record total in men's ODIs \ud83d\udc4f \ud83d\udc4f \n\nThe record lasted two years \u2013 England broke it again in 2018! https://t.co/o6BqfbxJ7r #OnThisDay in 2017, Bangladesh beat Australia for the first time in Test cricket!\n\nShakib Al Hasan was the star, hitting 84 in the first innings before taking 10 wickets in the match. https://t.co/gs2kQp0PsH Mitchell Starc took three wickets in an over against Derbyshire on Thursday!\n\nAustralia fans, would you like to see the left-armer back in the side for the fourth Ashes Test? https://t.co/A6ruwUKURC \"I thought I had messed the series up, not just the game but the series, so I was actually very, very relieved that we are still alive and fighting.\"\n\nhttps://t.co/VqKqGjXA3r What are your favourite memories of watching Ajantha Mendis play for Sri Lanka? https://t.co/lXXseZtXn9 Safe hands from @Martyguptill! https://t.co/y7LQBinKr9 India have announced their squad for the T20I series against South Africa in September. \n\nhttps://t.co/YQYFUsTST9 Jasprit Bumrah's Test record:\n\n1\ufe0f\u20e31\ufe0f\u20e3 matches\n5\ufe0f\u20e35\ufe0f\u20e3 wickets\nBBI: 6\ufe0f\u20e3/ 3\ufe0f\u20e33\ufe0f\u20e3 \nBowling average: 2\ufe0f\u20e30\ufe0f\u20e3.6\ufe0f\u20e33\ufe0f\u20e3 \n\n\ud83d\udc4f \ud83d\udc4f \ud83d\udc4f \n\n#WIvIND https://t.co/AWWppLFIzt If West Indies are to bounce back and level the series, the mandate is simple, really: step up and put some runs on the board.\n\n#WIvIND 2nd Test Preview \ud83d\udc47\n\nhttps://t.co/NgTXzs83Rb Ajantha Mendis, who retired from all cricket yesterday, took the world by storm with his variations in his early years.\n\nHere's one of his \ud83d\udc4c performances \ud83d\udc47 https://t.co/Oxod9JiHuO #OnThisDay in 1882, Australia defeated England by 7 runs at The Oval and a mock obituary of English cricket appeared in the Sporting Times.\n\nAnd the #Ashes were born! https://t.co/EWt0jjB9LO \"I thought I had messed the series up, not just the game but the series.\"\n\nJofra Archer feared \ud83c\udff4\udb40\udc67\udb40\udc62\udb40\udc65\udb40\udc6e\udb40\udc67\udb40\udc7f's #Ashes hopes were dashed after he was dismissed at Headingley.\n\nhttps://t.co/VqKqGjXA3r Jason Roy in the #Ashes so far:\nInnings - 6\ufe0f\u20e3\nRuns - 5\ufe0f\u20e3 7\ufe0f\u20e3\nAvg - 9\ufe0f\u20e3 . 5\ufe0f\u20e3 0\ufe0f\u20e3\nCan a move to the middle-order restore his form?\n\nhttps://t.co/nxaKqkxGU9 \"The ebbs and flows of the game made it such a good one for the spectators. It was just unfortunate we came out on the other side of it.\"\n\nMartin Guptill reflects on New Zealand\u2019s loss in the epic 2019 World Cup final \u2b07\ufe0f \nhttps://t.co/DEAHOI62sa \ud83d\udcaa https://t.co/OelfvwmPEa Take a bow Lizelle Lee!\n\nThe South African opening batter hit a 17-ball half-century for the Surrey Stars yesterday which was the quickest in Women's Cricket Super League history \ud83d\udd25 https://t.co/3VIvoBuSn5 #OnThisDay in 2017 Shai Hope completed twin centuries in a Test match for the West Indies and led his side to a famous five-wicket victory over England at Headingley! https://t.co/wVQsABzVKf The Women's @T20WorldCup Qualifier warm-ups start in Scotland later on today!\n\nWho do you think will qualify for the main event in February 2020? https://t.co/1QUm2Mkwaj #OnThisDay Aaron Finch hit 1\ufe0f\u20e35\ufe0f\u20e36\ufe0f\u20e3 against England in a T20I in 2013!\n\nAt the time it was the highest score in a T20I, though Finch has since broken his own record with a knock of 172 against Zimbabwe! https://t.co/yk3mTGqprg Long day @Uz_Khawaja? https://t.co/kk4YQsYyBH Aaron Finch hit his seventh T20 \ud83d\udcaf yesterday!\n\nOnly Chris Gayle - who has an astonishing 21 hundreds - has more tons in the format than Finch. https://t.co/PHYPITGIi2 Tim Paine will be rested for Australia's tour fixture against Derbyshire starting tomorrow.\n\nUsman Khawaja will captain the side and Steve Smith will also play! https://t.co/CewAVygEJz \ud83d\udea8 JUST IN \ud83d\udea8 \n\nAjantha Mendis has retired from all forms of cricket!\n\nThe Sri Lankan spinner took 288 wickets for his country across the three formats. https://t.co/ZwABGqvRWf Who else is excited to see Jofra Archer bowl to Steve Smith again? \ud83d\ude4b\u200d\u2642\ufe0f\n\nhttps://t.co/lNiUD1lSwM With Rahul Dravid taking over the National Cricket Academy, Sitanshu Kotak and Paras Mhambrey have been named head coaches of the India A and U19 teams, respectively \u2b07\ufe0f \nhttps://t.co/370VjSwtz7 \"I will be looking to create a positive and enjoyable environment, which enables belief to grow within the team.\"\n\nFormer Australia quick Clint McKay is all set for his coaching role with Vanuatu.\n\nhttps://t.co/yWIkEkmCIf IN: Keemo Paul\nOUT: Miguel Cummins\n\nThe \ud83c\udf34 squad for the second #WIvIND Test:\n\nhttps://t.co/ehvcyEWM3r \"We want to get more game-time in conditions we are not used to.\"\n\nTemba Bavuma wants South Africa to use their 'A' side experience to acclimatise themselves to Indian conditions before the main tour \ud83d\udc47 \nhttps://t.co/SxyEIeQYgV Australia Women captain Meg Lanning weighs in on the Headingley drama. https://t.co/xl7viR4Xmo For a moment, Ben Stokes was a more popular search than Taylor Swift!\n\nThere's no Bad Blood here Tay but Stokesy's knock was the greatest Love Story. A Gorgeous innings we couldn't believe in our Wildest Dreams! Shake It Off, your wiki page is Out Of The Woods \ud83d\ude43\n\n\ud83d\udcca @chartrdaily https://t.co/2lQNccGoVL \"I firmly believe I can take my game to another level.\"\n\nElyse Villani last played a T20I in November 2018, but is keen to work her way back into the national fold.\n\nhttps://t.co/r1m0eRVKyq \ud83d\ude0d\nhttps://t.co/q2cDxfsXJZ Mithali Raj talks about her T20I future, India's young talent and their approach towards fitness.\n\nhttps://t.co/HvBU7oeS4d Trent Boult in Tests this year:\nInnings 8\ufe0f\u20e3 \nWickets 2\ufe0f\u20e31\ufe0f\u20e3 \nAvg 2\ufe0f\u20e31\ufe0f\u20e3.2\ufe0f\u20e33\ufe0f\u20e3 \nEcon 3\ufe0f\u20e3.3\ufe0f\u20e33\ufe0f\u20e3 \n\nNo wonder Brilliant Boult has broken into the top 5 of the @MRFWorldwide ICC Test Bowling Rankings \ud83d\ude0d https://t.co/wP6KHlnb4T Happy birthday Lasith Malinga!\n\nWhat was your favourite Malinga moment? https://t.co/BvlrWyv5fx #OnThisDay Muttiah Muralitharan made his Test debut for Sri Lanka!\n\nHe went on to take 800 Test wickets for his country \ud83d\udc4f https://t.co/SpmARyMDHC \"He's good at varying his lengths, depending on the surfaces and batsmen.\"\n\nLots of praise for India's Jasprit Bumrah after his performance in the first Test! \n\nhttps://t.co/LGfpQ1chu8 The ICC Women\u2019s T20 World Cup Qualifiers get underway in Scotland this week!\n\nGroup A preview \u27a1\ufe0f https://t.co/i9w30Rl6M3\nGroup B preview \u27a1\ufe0f https://t.co/Hs0SpwBo5Z https://t.co/EpCahWTwmJ Which England cricketer is this? https://t.co/Asi7wQNXOu Told you so \ud83d\ude09 https://t.co/b4SFcEVDWk Your favourite game of the ICC World Test Championship so far has been _______________________? https://t.co/2jkhBHxlR2 First Test \u21e2 Drawn\nSecond Test \u21e2 Won by 6 wickets\n\n#OnThisDay in 2005, England women regained the #Ashes after 42 years \ud83c\udf89 https://t.co/VDpYoIOo7Z Ijaz Ahmed, who led Pakistan to the final of the ICC U19 World Cup in 2010, has been appointed as head coach of the youth team once again on a three-year term \u2b07\ufe0f \nhttps://t.co/uVFKjUEOyH \u261d\ufe0f Niroshan Dickwella\n\u261d\ufe0f Kusal Mendis\n\u261d\ufe0f Lahiru Thirimanne\n\u261d\ufe0f Milinda Siriwardana\n\u261d\ufe0f Akila Dananjaya\n\n#OnThisDay in 2017, Jasprit Bumrah took his first five-wicket haul in ODIs, returning 5/27, in India\u2019s six-wicket win over Sri Lanka in Pallekele. https://t.co/b1tanEetS1 Sri Lanka captain Dimuth Karunaratne rued his side's shot-selection in the second #SLvNZ, which New Zealand won by an innings and 65 runs.\n\nhttps://t.co/Rxwe9gRihM Jasprit Bumrah has jumped 9\ufe0f\u20e3 places to break into the top 10 of @MRFWorldwide ICC Men's Test Bowling Rankings \ud83d\ude31 https://t.co/o9NCrtqpWR \u2197\ufe0f Dimuth Karunaratne \n\u2197\ufe0f Joe Root \n\nSri Lanka and England Test skippers move up in the @MRFWorldwide ICC Men's Test Batting Rankings while New Zealand's Tom Latham storms into the \ud83d\udd1d 10! https://t.co/ayoOePxT2P \u2b06\ufe0f Trent Boult, Jasprit Bumrah, Kemar Roach\n\u2b07\ufe0f Mohammad Abbas, Ravindra Jadeja\n\nBoult has broken into the \ud83d\udd1d 5 while Bumrah has stormed into the \ud83d\udd1d 10 of the @MRFWorldwide ICC Test bowling rankings. https://t.co/NR79qjCTEa @MRFWorldwide Full details here\ud83d\udc47\nhttps://t.co/WVffvL7HHi Arise, Sir Ben Stokes!\n\nFollowing his Headingley heroics, the star England all-rounder is now No.2 in the @MRFWorldwide ICC Men's Test All-Rounder Rankings. https://t.co/Prxm2WjFCC \ud83c\udfcf \ud83d\udd01 \u26bd\ufe0f\n\n\"Certainly, Ben Stokes can play centre-half for us next week.\"\n\nThe England star all-rounder has impressed @NUFC manager Steve Bruce with his Headingley heroics. \n\nhttps://t.co/hsVevGSJoT Sri Lanka v New Zealand Test series:\n\n2012\n1st Test in Galle: \ud83c\uddf1\ud83c\uddf0 won\n2nd Test in Colombo: \ud83c\uddf3\ud83c\uddff won\n\n2019\n1st Test in Galle: \ud83c\uddf1\ud83c\uddf0 won\n2nd Test in Colombo: \ud83c\uddf3\ud83c\uddff won https://t.co/bIroL7Djye \"I was watching the World Cup final as a fan and that showed that anything is possible.\" \n\nJack Leach said Ben Stokes' #CWC19 heroics gave him hope for an improbable Headingley win. \n\nhttps://t.co/D4nj6UUSGR Test cricket \ud83d\udda4\n\n#Ashes | #SLvNZ | #WIvIND https://t.co/Ep7R2o3sgV Happy birthday to Pakistan's Mohammad Yousuf!\n\n7530 Test runs at an average of 52.29 \n9720 ODI runs at an average of 41.71 \n\nOne of the greats \ud83d\udc4f https://t.co/pxZovDkWhM #OnThisDay in 1908, Donald Bradman was born!\n\nHis Test record with the bat \ud83d\udc47 \n\n\u25b6\ufe0f 6996 runs\n\u25b6\ufe0f 334 top score\n\u25b6\ufe0f 99.94 average\n\u25b6\ufe0f 29 Test centuries\n\nThe greatest ever? https://t.co/ckVdcmKyfF What a servant to New Zealand cricket this man has been! https://t.co/2wGD9ySq08 New Zealand leveled their Test series with Sri Lanka earlier today!\n\nFinal day report \ud83d\udc47 \n\nhttps://t.co/jkeOBBZhRf A fair result?\n\nWhat was your favourite moment of the #SLvNZ Test series? https://t.co/S5BhkdE7mn Guess who \ud83d\udc40 https://t.co/9thMthoWXJ West Indies captain Jason Holder rued his team's failure with the bat as they went down to India by 318 runs in the first #WIvIND Test.\n\nhttps://t.co/GYwgLoLa38 She represented Australia in 92 internationals, scoring 3,009 runs including a career-best 156* in an ODI against Pakistan in 1997.\n\nShe was the first female cricketer to score a century at Lord's.\n\nHappy Birthday, Lisa Keightley! https://t.co/duT832jWDq Pair of Hong Kong players banned for life and a third suspended for five years after ICC Anti-Corruption Tribunal hearing.\n\nhttps://t.co/nU8CSI23Ch New Zealand win!\n\nThey put in a complete performance with bat and ball to win the second Test by an innings and 65 runs.\n\n#SLvNZ scorecard \ud83d\udc47 \nhttps://t.co/vHUIvrr8E6 https://t.co/uQNnX14Oag Virat Kohli says management of players' workloads will be key for India to win the World Test Championship.\n\nREAD \ud83d\udc47\n\nhttps://t.co/3woTM8Ijz5 2\ufe0f\u20e35\ufe0f\u20e30\ufe0f\u20e3 Test wickets for Tim Southee \ud83d\udc4f \n\nWhat a servant he's been for New Zealand cricket over the years - he now has the most wickets by a Black Caps bowler against Sri Lanka in Tests!\n\n#SLvNZ https://t.co/uj460VQhMN Relive England's winning moments from the Headingley classic in pictures \ud83d\udcf8\n\n\u27a1\ufe0f https://t.co/3myxLH6GSK https://t.co/Sg6G0A9mOS New Zealand have reduced Sri Lanka to 33/5 at Lunch on day five of the second and final Test.\n\nCan the visitors pull this off? Will the home side fight back?\n\n#SLvNZ LIVE: https://t.co/vHUIvrr8E6 https://t.co/k7SQrIWI0S No \"sulking\" or getting \"caught in the emotion\" \u2013 skipper Tim Paine wants Australia to move on from the Headingley heartbreak. \n\n#Ashes \n\nhttps://t.co/PUwESjfTuo \u261d\ufe0f Lahiru Thirimanne\n\u261d\ufe0f Kusal Perera\n\nThe Sri Lanka openers are back in the hut and New Zealand are absolutely pumped in Colombo! \n\nFollow the #SLvNZ action live \ud83d\udc47\nhttps://t.co/vHUIvrr8E6 https://t.co/fe15kirB4r New Zealand declare on 431/6!\n\nBJ Watling remains unbeaten on 105 while Tim Southee contributes with a quick 24* off just 10  \ud83d\udc40\n\nFollow #SLvNZ live \ud83d\udc47\n https://t.co/vHUIvrr8E6 https://t.co/H38M9kBenX BJ Watling brings up his seventh Test \ud83d\udcaf in style with a four in Colombo! \n\n#SLvNZ live \ud83d\udc47\n https://t.co/vHUIvrr8E6 https://t.co/rXBpDztrYN The #SLvNZ Test day five is under way!\n\nNew Zealand have lost Colin de Grandhomme on the second ball for 83.\n\nLive updates: https://t.co/vHUIvrr8E6 https://t.co/2GgXdBN9Pc \"It probably matches the World Cup, to be honest\" \u2013 England star Ben Stokes revels in his Headingley heroics.  \n\n#Ashes \n\nhttps://t.co/Ks7DXtyQCe 8\u20e3 overs\n3\u20e3 maidens\n7\u20e3 runs\n5\u20e3 wickets\n\nIndia pacer @Jaspritbumrah93 was on \ud83d\udd25 against West Indies! https://t.co/KDOAr2Zt2p Australia skipper Tim Paine lauded Ben Stokes for his Headingley heroics. \n\n#Ashes https://t.co/rgM1Zz2prY Ajinkya Rahane scored his first Test hundred in over two years before Jasprit Bumrah blew away the Windies top order to secure a convincing win for India.\n\nREPORT \u2b07\ufe0f \nhttps://t.co/5yELcYetlL Can New Zealand force a result on the final day in Colombo?\n\nThe report from day four \u2b07\ufe0f \nhttps://t.co/HmQ49bLtbu For his 183 runs scored across the Test, Ajinkya Rahane is the Player of the Match!\n\n#WIvIND https://t.co/JFo8pknnBv Wingardium Leviosa \ud83e\uddd9\u200d\u2642\ufe0f https://t.co/QfT14Casw5 An incredible day of Test cricket.\n\nWest Indies are bowled out for 100 and India win the Test by 318 runs!\n\n#WIvIND https://t.co/S7AZyd5nHb \"That was the best kiss I've ever had.\" \u2013 Ben Stokes after Jack Leach gave him a peck on the cheek \ud83d\ude06 \n\n#Ashes https://t.co/5DSfi04foR Wow.\n\nJasprit Bumrah has figures of 8-4-7-5 \ud83d\ude31 \n\nWest Indies are in serious trouble.\n\n#WIvIND Live \ud83d\udd3d \nhttps://t.co/egvDo7fncD https://t.co/8lW4POFVHi The India opening bowlers are on fire!\n\nIshant Sharma and Jasprit Bumrah have combined to leave West Indies 15/5 in their pursuit of 419.\n\n#WIvIND Live \ud83d\udd3d \nhttps://t.co/egvDo7fncD https://t.co/MPsZqUfHUL England scored 67 in their first innings yet somehow emerged from Leeds with the Ashes still alive.\n\nThe report on a historic day of Test cricket \u2b07\ufe0f \nhttps://t.co/1nqB7rKdaU #NewCoverPic https://t.co/goVXVFYnwy India declare!\n\nThey've left West Indies needing 419 to win the Test.\n \nA tough ask but as we've seen today, anything is possible.\n\n#WIvIND Live \ud83d\udd3d \nhttps://t.co/egvDo7fncD https://t.co/DybJsGknzC Century for Ajinkya Rahane!\n\nHis first Test hundred in over two years \ud83d\udc4f \ud83d\udc4f \n\n#WIvIND https://t.co/rp8ilgUPeE Kusal Perera &amp; Vishwa Fernando: 78* v South Africa\n\nBen Stokes &amp; Jack Leach: 76* v Australia\n\nThe two largest 10th wicket partnerships in winning run chases have taken place in 2019.\n\n#Ashes https://t.co/DXq6ynKu9s \"It\u2019s a transition phase for South African cricket.\"  \n\nAshwell Prince said that the team will require time to get over the recent retirements of Hashim Amla and Dale Steyn.\n\nhttps://t.co/SiMbN57rhf RT @ICC: Me talking about my work\n\u25b6 \ud83d\udd18\u2500\u2500\u2500\u2500\u2500\u2500\u2500\u2500 00:10\n\nMe talking about my life\n\u25b6 \ud83d\udd18\u2500\u2500\u2500\u2500\u2500\u2500\u2500\u2500 05:20\n\nMe talking about the #Ashes\n\u25b6 \ud83d\udd18\u2500\u2500\u2500\u2500\u2500\u2500\u2500\u2500 14\u2026 Hands up if you're the Player of the Match \u270b \n\n#Ashes https://t.co/iooy8zqZLH The best 1* you'll ever see.\n\n#Ashes https://t.co/xBoTvV2VXi Has a cricketer ever had such an influential couple of months?\n\n#Ashes https://t.co/ZO1dUlwQNL Ben Stokes is having quite a good summer, isn't he?\n\n#Ashes https://t.co/wbIHjOW9rO ENGLAND HAVE WON BY ONE WICKET!\n\n#ASHES This is extraordinary.\n\nEngland need two runs to win, Australia need one wicket.\n\n#Ashes https://t.co/DNFGoTUoZh England need eight to win.\n\nAustralia need one wicket to retain the urn.\n\nCricket is brilliant, isn't it?\n\n#Ashes https://t.co/ed4s9CoD94 4\ufe0f\u20e3 6\ufe0f\u20e3 6\ufe0f\u20e3 2\ufe0f\u20e3 1\ufe0f\u20e3 0\ufe0f\u20e3  in that last over!\n\nEngland need 18 to win!\n\n#Ashes https://t.co/DFIizlxpfL 100 for Ben Stokes!\n\nWhat an extraordinary summer he is having.\n\n#Ashes https://t.co/Kfk2bFe8u6 Ben Stokes, you ridiculous cricketer!\n\n#Ashes\n\nhttps://t.co/JfoCQUQrSn 11 runs off the bat of Ben Stokes in that Pat Cummins over and England need 37 more runs to win!\n\n#Ashes https://t.co/wwr64jHnE5 13 runs in an over!\n\nEngland need 49 runs to win, could they pull it off?\n\n#Ashes https://t.co/9ys3BZxyBt Two wickets in three balls for Australia and they are now just one wicket away from retaining the Ashes!\n\n#Ashes https://t.co/9CQ33mnCwe \ud83d\udc40\n\n#Ashes https://t.co/2FO5xBa5WN Preach \ud83d\ude4c\n#Ashes https://t.co/AD4d7fl63I When the going gets tough, the tough gets going.\n\nFollow the #Ashes live \ud83d\udc47\nhttps://t.co/w5m79RTGIu https://t.co/hFAmnHbTo8 Meanwhile in Antigua, Roston Chase has claimed his third wicket. The Indian skipper departs for 51. \n\n#WIvIND Live \ud83d\udd3d \nhttps://t.co/egvDo7fncD https://t.co/rpm77IUnzh 7\ufe0f\u20e3 wickets down but Ben Stokes is still giving Australia a good fight.\n\nCan England save the #Ashes from here?\n\nFollow\ud83d\udc47\nhttps://t.co/w5m79RTGIu https://t.co/D9oklNNgPV \u2747\ufe0f A lead of 260 runs\n\u2747\ufe0f Unbeaten 104-run fourth-wicket stand\n\u2747\ufe0f Two stalwarts at the crease\n\nCan Kohli &amp; Rahane press India's advantage and bat West Indies out of the first Test?\n\n#WIvIND Live \ud83d\udd3d \nhttps://t.co/egvDo7fncD https://t.co/JtClut7ebh England 6 down \ud83d\ude31 \nAnd just like that Australia are back in the game...\n\nFollow the #Ashes live \ud83d\udc47\nhttps://t.co/w5m79RTGIu https://t.co/MCNGgzI58v And a breakthrough!\n\nHazlewood has broken the 86-run stand between Stokes and Bairstow. The match hangs in balance again.\n\nFollow the #Ashes live \ud83d\udc47\nhttps://t.co/w5m79RTGIu https://t.co/wTCOjXi0Eh \u201cJust need to keep my head down and show some patience.\" \n\nhttps://t.co/lIF9d1HGYR Stumps: The light is not good enough to continue \ud83d\ude22 \n\nGrandhomme (83*) and Watling (81*) have pushed New Zealand's lead to a solid 138. Tomorrow promises to be a big day. Can they pull off a win here?\n\n#SLvNZ SCORE \ud83d\udc47\nhttps://t.co/vHUIvrr8E6 https://t.co/aoNDyS3upt Lunch at Headingley \ud83e\udd58 \n\nThey lost Joe Root within the first 30 minutes but Stokes and Bairstow have denied the Australian bowlers any more chances.\n\nEngland need 121 more.\n\nFollow the #Ashes live \ud83d\udc47\nhttps://t.co/w5m79RTGIu https://t.co/YZvjiJI4LS New Zealand batsmen are back on the field after a small \u2614\ufe0f delay and this man is going strong!\n\n#SLvNZ https://t.co/VhNIstxpys LEGEND\ud83d\ude4c\n\n#Ashes https://t.co/3wRhEvqndA New Zealand's lead has crossed 100, so has their sixth-wicket partnership.\n\nAnd Colin de Grandhomme is playing an absolute masterclass here \ud83d\ude0d \n\nFollow #SLvNZ live \ud83d\udc47\nhttps://t.co/vHUIvrr8E6 https://t.co/zZehzeAuMh This happened a few overs ago \ud83d\ude31 \n\nBut it has not rattled Ben Stokes, who continues to drive England forward as they cross the halfway mark.\n\nFollow the #Ashes live \ud83d\udc47\nhttps://t.co/w5m79RTGIu https://t.co/7jCwqAmakW What a G.O.A.T \ud83d\udc10 \n\nNathan Lyon has gone past Dennis Lillee to become the third highest Test wicket-taker for Australia!\n#Ashes https://t.co/Jpd1iZMCAN Lyon dismisses Root for 77! England 160/4 after 78 overs. \n\nFollow the #Ashes live \ud83d\udc47\nhttps://t.co/w5m79RTGIu https://t.co/IlPhTUq4I2 Tom Latham falls shortly before the \u2615 break on 154. New Zealand are 295/5, leading by 51, on day four of the Colombo Test.\n\nFollow #SLvNZ live \ud83d\udc47\nhttps://t.co/vHUIvrr8E6 https://t.co/GhiIMQW5N9 \ud83d\udc49 England need 203 runs to win\n\ud83d\udc49 Australia need seven wickets to win\n\nDay four of the Headingley Test is set to get underway. Who do you think will win the Test? \n\nFollow the #Ashes live \ud83d\udc47\nhttps://t.co/w5m79RTGIu https://t.co/bza37k6hp3 WHAT AN INNINGS!\n\nTom Latham brings up his 1\u20e35\u20e30\u20e3 on day four of the second #SLvNZ Test in Colombo. Will we see him score a double-hundred today? https://t.co/PvfcibvKRc Fifty up for BJ Watling! \n\nThe New Zealand batsman brings up his 18th Test fifty in Colombo. \n\nFollow #SLvNZ live \ud83d\udc47\nhttps://t.co/vHUIvrr8E6 https://t.co/7KElBPR8dd Good news coming in from Colombo!\n\nThe \ud83c\udf1e is out and play is set to resume shortly. \n\n#SLvNZ LIVE: https://t.co/vHUIvrr8E6 https://t.co/KfXmzFYhr6 \"We are in a very good position and there is a lot of belief in the changing room.\" \n\n#Ashes \n\nhttps://t.co/2CruDoEN7G The first session has been entirely lost to rain, and the earliest we can hope for resumption is at 1pm local time in Colombo.\n\nFollow #SLvNZ blog for more updates \ud83d\udc47\nhttps://t.co/vHUIvrr8E6 https://t.co/qTLKvXgdHe Caption this \ud83d\udc40 https://t.co/4rmkKoV1hx \ud83c\udf27\ufe0f\ud83c\udf27\ufe0f\ud83c\udf27\ufe0f\n\nStart of day four of the second #SLvNZ Test has been delayed due to rain in Colombo. \n\nFollow our blog for live updates \ud83d\udc47\nhttps://t.co/vHUIvrr8E6 https://t.co/MgW7OBXayS ICYMI: Unbeaten fifties from Ajinkya Rahane and Virat Kohli helped India take control in Antigua as they extended their lead to 260.\n\n#WIvIND Day 3 report \ud83d\udc47\nhttps://t.co/SVKcUkl1oW \"Playing against the swinging ball in different conditions and learning to put big runs on the board built my confidence.\"\n\n#Ashes\n\nhttps://t.co/ywiavkOof2 Joe Root hit an unbeaten 75 on day three to keep England's hopes of an incredible win alive. \n\n#ASHES REPORT \u2b07\ufe0f \nhttps://t.co/ZUyTgVv6dU Virender Sehwag has weighed in on the debate surrounding MS Dhoni's future. \n\nhttps://t.co/WxjqVWxO44 Tom Latham starred on day three of the first Test between Sri Lanka and New Zealand. \n\n#SLvNZ REPORT \u2b07\ufe0f \nhttps://t.co/SJCdGp2yUK That's stumps. \n\nIndia finish on 185/3 with a very healthy lead of 260, and they have these two to thank for much of that.\n\n#WIvIND SCORECARD \ud83d\udc47\nhttps://t.co/egvDo7fncD https://t.co/w1fPlM1MZW 50 for Virat Kohli \u2013 India are looking very dominant now. \n\n#WIvIND LIVE \ud83d\udc47\nhttps://t.co/egvDo7fncD https://t.co/JmJwDtp9i0 Ajinkya Rahane goes to fifty for the second time in the match \ud83d\udc4f \n\nHe's played very well alongside Virat Kohli. \n\n#WIvIND LIVE \ud83d\udc47\nhttps://t.co/egvDo7fncD https://t.co/ocVn4nKBGP Tea. \n\nIndia are 98/3 at the break, with Roston Chase picking up two wickets. The visitors have a lead of 173. \n\n#WIvIND LIVE \ud83d\udc47\nhttps://t.co/egvDo7fncD https://t.co/f0hWhjqUSv A fascinating day of Test cricket. \n\nEngland finish on 156/3, 203 runs away from what would be a simply incredible victory. Joe Root remains unbeaten on 75. \n\n#ENGvAUS LIVE \ud83d\udc47\nhttps://t.co/w5m79RTGIu https://t.co/ndsdC8jWzl A second Test fifty for Joe Denly \ud83d\udc4f \ud83d\udc4f \n\nDenly and Root have now added 122 together. This has been an excellent partnership for England. \n\n#ENGvAUS LIVE \ud83d\udc47\nhttps://t.co/w5m79RTGIu https://t.co/2atDVemsJr 50 for Joe Root \ud83d\udc4f \ud83d\udc4f \n\nCan England pull this off?\n\n#ENGvAUS LIVE \ud83d\udc47\nhttps://t.co/w5m79RTGIu https://t.co/06mAkUrpJp Lunch. \n\nIndia's openers have seen their side to 14/0 after the visitors took the two final wickets to end the West Indies innings. \n\nIndia have a lead of 89. \n\n#WIvIND LIVE \ud83d\udc47\nhttps://t.co/egvDo7fncD https://t.co/afgJCBLnPZ Things are starting to look up for England. \n\nJoe Root and Joe Denly have put on 75 together \u2013 at tea, England are 90/2.\n\n#ENGvAUS LIVE \ud83d\udc47\nhttps://t.co/w5m79RTGIu https://t.co/mKUey9q9FX That's the end of the West Indies innings. \n\nMiguel Cummins falls for a 45-ball duck and the hosts finish on 222, trailing India by 75 runs. No wickets for him today but Ishant Sharma led the way for the visitors, taking 5/43.\n\n#WIvIND LIVE \ud83d\udc47\nhttps://t.co/egvDo7fncD https://t.co/44kWVooyJZ \ud83d\udc4c with the ball\n\ud83d\udd25 with the bat \n\u26a1 in the field\n\nA very happy 22nd birthday to India's Deepti Sharma! \ud83c\udf89 https://t.co/5eHe8j3Zmo Play is all set to get underway on Day 3 between West Indies and India at Antigua!\n\nThe hosts are 189/8, trailing by 108 runs. Can they get somewhere near India's first innings total, or will the tourists nip out the last two quickly?\n\n#WIvIND LIVE \ud83d\udc47\nhttps://t.co/egvDo7fncD https://t.co/LJ9NRiEfB3 \ud83d\udd39 96 games\n\ud83d\udd39 140 wickets\n\ud83d\udd39 India's leading wicket-taker in T20Is \ud83d\ude4c\n\nHappy birthday, Poonam Yadav \ud83c\udf70 https://t.co/p4GSKVyeR5 #NewCoverPic https://t.co/mI7OEPzYau New Zealand reach stumps on 196/4 after a hard-fought day of Test cricket!\n\nThey trail by 48 runs, with Tom Latham ending on 111*. Can the @BLACKCAPS carve out a big lead tomorrow, or will Sri Lanka haul them in?\n\n#SLvNZ SCORE \ud83d\udc47\nhttps://t.co/vHUIvrr8E6 https://t.co/gmG4gWIJO4 England have reached the interval 11/0, needing a further 348 runs to keep their #Ashes dream alive.\n\nIs there any hope for the hosts?\n\n#ENGvAUS LIVE \ud83d\udc47\nhttps://t.co/w5m79RTGIu https://t.co/jJxjFNWZ39 Tom Latham brings up his 10th Test hundred!\n\nSince he made his debut, only David Warner has scored more than 2000 Test runs and averaged more than Latham opening the batting. What a consistent performer he's been for the @BLACKCAPS \ud83d\udc4f\n\n#SLvNZ https://t.co/bKEkt7dfP7 \"His record as one of the best all-rounders in the world speaks for itself and he also has extensive coaching experience.\"\n\nLance Klusener joins \ud83c\uddff\ud83c\udde6 support staff \ud83d\udc47\n\nhttps://t.co/5K12kJErjJ Sri Lanka bring the axe down on a high-profile all-rounder, as part of a slew of changes to their last previous T20I squad. Find out more:\n\nhttps://t.co/8nXfZIFGDO Day 3\ufe0f\u20e3 is underway at Headingley! \n\nAustralia begin at 171/6, with Marnus Labuschagne and James Pattinson at the crease. \n\nHow many can they get?\n\nFollow #Ashes LIVE \ud83d\udc49 https://t.co/w5m79RTGIu https://t.co/4LMXMhpWTw Tom Latham brings up his 16th Test half-century in 95 balls. Impressive effort from by the New Zealand opener \ud83d\udc4f \n\nMeanwhile, Taylor has returned to the pavilion after being dismissed by Embuldeniya for a 43-ball 23. \n\nFollow #SLvNZ LIVE \u25b6\ufe0f https://t.co/vHUIvrr8E6 https://t.co/mI50L77NgM New Zealand are 49/2 after 18 overs, with Jeet Raval and Kane Williamson back in the hut. \n\nDilruwan Perera and Lahiru Kumara have been amongst the wickets for Sri Lanka.\n\nFollow #SLvNZ LIVE \u25b6\ufe0f https://t.co/vHUIvrr8E6 https://t.co/l5NtFY5aea Me talking about my work\n\u25b6 \ud83d\udd18\u2500\u2500\u2500\u2500\u2500\u2500\u2500\u2500 00:10\n\nMe talking about my life\n\u25b6 \ud83d\udd18\u2500\u2500\u2500\u2500\u2500\u2500\u2500\u2500 05:20\n\nMe talking about the #Ashes\n\u25b6 \ud83d\udd18\u2500\u2500\u2500\u2500\u2500\u2500\u2500\u2500 14:43:54 Fastest Indians to 50 Test wickets:\n\n\ud83d\udd38 R Ashwin \u279c 9 matches\n\ud83d\udd38 Anil Kumble \u279c 10 matches\n\ud83d\udd38 Narendra Hirwani \u279c 11 matches\n\ud83d\udd38 Harbhajan Singh \u279c 11 matches\n\ud83d\udd38 JASPRIT BUMRAH \u279c 11 matches \ud83d\udc4f\n\n#WIvIND https://t.co/fXKIxeJ7LJ LUNCH: Jeet Raval and Tom Latham played out two overs for New Zealand before the break.\n\nSri Lanka were all out for 244. What do you make of their total?\n\nFollow #SLvNZ LIVE \u25b6\ufe0f https://t.co/vHUIvrr8E6 https://t.co/gvdMgNffCM \ud83d\udca5 CENTURY \ud83d\udca5\n\nFifth Test \ud83d\udcaf for Dhananjaya de Silva. \n\nWhat a knock it has been from him! Came in at 93/4, and has now taken Sri Lanka past the 230-run mark \ud83d\udc4f\n\nFollow #SLvNZ LIVE \u25b6\ufe0f https://t.co/vHUIvrr8E6 https://t.co/HPZfES1GRi Ravindra Jadeja and Ishant Sharma in Antigua: \n\nWith the bat \u25b6\ufe0f 60-run partnership\nWith the ball \u25b6\ufe0f 6 wickets\n\n#WIvIND\n\nhttps://t.co/ppDEpwE34X No \ud83c\udf27\ufe0f on the third morning! \n\nSri Lanka have added 12 runs to their overnight total. The hosts are 156/6 after 70 overs.\n\nFollow #SLvNZ LIVE \u25b6\ufe0f https://t.co/vHUIvrr8E6 https://t.co/wle6sFsDiC ICYMI: 5/42 from Ishant Sharma helped India reduce West Indies to 189/8 on day two of the first Test in Antigua. \n\n#WIvIND REPORT \ud83d\udc47\n\nhttps://t.co/w5kbCerFmT Australia pacers on the bench at Headingley: \n\nMitchell Starc \u279d 211 Test wickets\nPeter Siddle \u279d 219 Test wickets\nMichael Neser \u279d 140 first-class wickets\n\n\ud83e\udd2f\n\nhttps://t.co/Fm0FdDEecl Your favourite Kumar Sangakkara Test innings was ________________________? https://t.co/Ix6RCLyo4b #OnThisDay in 2015 Kumar Sangakkara played his final Test for Sri Lanka.\n\nHe finished his career with 12,400 runs at an average of 57.40 and a top-score of 319 \ud83d\ude4c https://t.co/5ya8tZJAJK Use one emoji to describe Josh Hazlewood's Ashes so far \ud83d\udc47 https://t.co/JpruiNZlOA Josh Hazlewood took five wickets as England were bowled out for 67 on day two of the Headingley Test. \n\n#ASHES REPORT \u2b07\ufe0f \nhttps://t.co/w6E3Zy8sXU That's the end of the day, and what a brilliant session that was for India. \n\nIshant Sharma has five wickets to his name and West Indies are 189/8, trailing India by 108 runs. \n\n#WIvIND SCORECARD \ud83d\udc47 \nhttps://t.co/egvDo7fncD https://t.co/kObQZ9M98J 5\ufe0f\u20e3 wickets for Ishant Sharma!\n\nBrilliant bowling from the India seamer \ud83d\udc4f \ud83d\udc4f \n\n#WIvIND https://t.co/B675oei8BR \ud83d\udd39 71 Tests\n\ud83d\udd39 4288 runs\n\ud83d\udd39 8 centuries\n\n\ud83d\udd39 A special 1\ufe0f\u20e37\ufe0f\u20e33\ufe0f\u20e3* that powered England to victory in a 315-run chase in the 2001 #Ashes \ud83d\ude4c\n\nHappy birthday, Mark Butcher \ud83c\udf82 https://t.co/vNC2qNqRQW Tea. \n\nWest Indies are 82/3, a wicket each for Mohammed Shami, Ishant Sharma and Ravindra Jadeja. \n\nFollow #WIvIND \ud83d\udc47 \nhttps://t.co/egvDo7fncD https://t.co/AFWYMSsnE3 Redemption for 2015?\n\n#Ashes https://t.co/7Oubrq96V2 Day two belongs to Australia at Headingley!\n\nThey finish 171/6 with Marnus Labuschagne 52 not out, they lead England by 283 runs.\n\nEarlier today England were bowled out for 67. https://t.co/ZwnzGGUJO2 Fifty for Marnus Labuschagne!\n\nHe has settled straight into this Australia side \ud83d\udc4f\n\n#Ashes live \u27a1\ufe0f https://t.co/w5m79RTGIu https://t.co/8ZZ5sW3JH7 Shami gets the breakthrough!\n\nFollow #WIvIND \ud83d\udc47 \nhttps://t.co/egvDo7fncD https://t.co/caXpUTruet Only 29.3 overs were sent down at the P Sara Oval on another rain-marred day. \n\nReport \ud83d\udc47\n\nhttps://t.co/3WFk0oiO9S India have been bowled out for 297 on day two of the first Test against West Indies!\n\nLunch has now been taken, Kemar Roach the pick of the bowlers with four wickets.\n\nScorecard \ud83d\udc47 \nhttps://t.co/egvDo7fncD https://t.co/BPf52whQgn Fifty for Ravindra Jadeja as India creep towards 300! https://t.co/fftPY5e6Mh Tea!\n\nAt the end of the second session Australia are 82/3, leading England by 194 runs.\n\nScorecard \ud83d\udc47 \nhttps://t.co/w5m79RTGIu https://t.co/fp2oWgldGJ West Indies v India day two is underway!\n\nIndia resuming 203/6 with Rishabh Pant and Ravindra Jadeja at the wicket.\n\nFollow it live \ud83d\udc47\nhttps://t.co/egvDo7fncD https://t.co/pogrceNAlz Five wickets for Josh Hazlewood!\n\nAn outstanding spell of fast bowling from the Australian fast bowler.\n\n#Ashes https://t.co/kY8YHWeIZS England have been bowled out for 67!\n\nWhat a performance from the Australian bowlers today, five wickets for Josh Hazlewood.\n\n#Ashes https://t.co/NMDHfzmkZz #OnThisDay in 2015, Michael Clarke retired from international cricket.\n\n3\ufe0f\u20e39\ufe0f\u20e34\ufe0f\u20e3 games\n1\ufe0f\u20e37\ufe0f\u20e31\ufe0f\u20e31\ufe0f\u20e32\ufe0f\u20e3 runs\n2\ufe0f\u20e3 ICC Cricket World Cup trophies \ud83c\udfc6\n\nWhat are your favourite 'Pup' memories? \ud83d\ude4c https://t.co/VvOqMiyRZU Lunch at Headingley!\n\nAustralia have dominated this morning with England 54/6 at the interval.\n\nScorecard \ud83d\udc47 \nhttps://t.co/w5m79RTGIu https://t.co/D640LWc1FE \ud83d\udea8JUST IN \ud83d\udea8 \n\nPakistan have announced they will play Sri Lanka in Pakistan in three ODI's and three T20I's!\n\nThe ODI's will be played in Karachi and the T20I's in Lahore. https://t.co/ejJdRNM58f New faces \u2794 Heather Graham &amp; Erin Burns\nOmissions \u2794 \u2753 \n\nAustralia Women's 14-member squad for the West Indies tour \ud83d\udc47\n\nhttps://t.co/5sqL3ZKTRG Play has been abandoned for the day in Colombo!\n\nSri Lanka will resume on 144/6 tomorrow. https://t.co/fOlUFTsWx7 Day two of the third Ashes Test is underway!\n\nWill Jason Roy be in the runs today?\n\n#Ashes live \ud83d\udc47 \nhttps://t.co/w5m79SbhA2 https://t.co/XeHqtUEOUj The players have stayed inside since Lunch, with rain being relentless.\n\nNew Zealand looked \ud83d\udcaa in the morning session, and Sri Lanka are 144/6 after 66 overs.\n\nFOLLOW #SLvNZ LIVE \u25b6\ufe0f https://t.co/vHUIvr9xfw https://t.co/7BM5VWpX4Y \ud83d\udde3\ufe0f \"He\u2019s got a lot of fight in him, and it was great to talk through our innings out in the middle.\"\n\nDavid Warner is impressed with new batting partner, Marnus Labuschagne \ud83d\udc47\n\nhttps://t.co/GGGcfXNiFO Jofra Archer in Test cricket so far:\n\n\u27a4 3 innings\n\u27a4 61.1 overs\n\u27a4 16 maidens\n\u27a4 11 wickets\n\u27a4 12.36 average \ud83d\udc4f\n\nhttps://t.co/OJRdbUbQdg Meanwhile, Tim Southee has reached a different milestone: 5\u20e30\u20e30\u20e3 international wickets for the pacer, the third-highest haul for a New Zealand bowler, after Vettori (696) and Hadlee (589) \ud83d\udc4f\n\nSri Lanka are 143/6 after 65 overs. \n\nFOLLOW #SLvNZ LIVE \u25b6\ufe0f https://t.co/vHUIvr9xfw Trent Boult is the third New Zealand bowler to cross 250 Test wickets.\n\nCan Tim Southee achieve the feat in this Test?\n\nFOLLOW #SLvNZ LIVE \u25b6\ufe0f https://t.co/vHUIvr9xfw https://t.co/xBhMJh7wSl Ajinkya Rahane's last Test \ud83d\udcaf came more than two years ago.\n\nHowever, he has crossed 5\ufe0f\u20e30\ufe0f\u20e3 six times since then. What do you make of his recent numbers?\n\n#WIvIND \n\nhttps://t.co/PJAzxAbClp After Day 1 in\n\nLeeds: \ud83c\udde6\ud83c\uddfa 179 \u2013 all-out\nAntigua: \ud83c\uddee\ud83c\uddf3 \u2013 203/6\nColombo: \ud83c\uddf1\ud83c\uddf0 \u2013 85/2\n\nPredict results for the three Tests \ud83d\udc40\n\n#Ashes: _________\n#WIvIND: _________ \n#SLvNZ: ________ https://t.co/cGbsSVlWk2 After his match-winning 92 against Botswana on Thursday, Stephen Baard is now Namibia's leading run-scorer in T20I cricket \ud83d\udc4f\n\n\ud83c\uddf3\ud83c\udde6 have taken an unassailable 3-0 lead in the four-match series! https://t.co/7MC6WsYoFK West Indies enjoyed a solid first day in Antigua, reducing India to 203/6. \n\n#WIvIND REPORT \u2b07\ufe0f \nhttps://t.co/IvO8l3SLby Jofra Archer was superb for England on day one of the third Ashes Test at Headingley, taking 6/45. \n\n#ASHES REPORT \u2b07\ufe0f \nhttps://t.co/k4aikYaFf7 Rain has brought an end to the day's play. \n\nIndia finish on 203/6. Ajinkya Rahane led the way for the batting side with his knock of 81, while Kemar Roach was the pick of the bowlers, taking 3/34.\n\n#WIvIND | SCORECARD \u2b07\ufe0f \nhttps://t.co/egvDo7fncD https://t.co/64CEkB0yGD The covers have come on in Antigua \u2602\ufe0f \n\nIndia are currently 203/6. \n\n#WIvIND | FOLLOW \u2b07\ufe0f \nhttps://t.co/egvDo7fncD https://t.co/SUm1nDthja Australia are bowled out for 179!\n\nJofra Archer finishes with figures of 6/45 \u2013 an outstanding display of fast bowling.\n\n#Ashes https://t.co/2SGowEvAPH It's currently tea in Antigua. India are 134/4 with Ajinkya Rahane having gone to his 18th Test half-century. \n\n#WIvIND | FOLLOW \u2b07\ufe0f \nhttps://t.co/egvDo7fncD https://t.co/HvMqm2SDqh How good is Jofra Archer?!\n\nHe has his first five-wicket haul in Test cricket \ud83d\ude4c \n\n#ASHES FOLLOW \ud83d\udc47\nhttps://t.co/w5m79RTGIu https://t.co/GlTXzAII8W https://t.co/5vDQo5nFmP https://t.co/qQMThcPRhi What a start to the Test match!\n\nRahul and Rahane help India recover to 68/3 at the lunch interval after they fell to 25/3 early on day one. \n\n#WIvIND | FOLLOW \u2b07\ufe0f \nhttps://t.co/egvDo7fncD https://t.co/HvfIRasTor An impressive start from West Indies' bowlers in Antigua \u2013 India are currently 36/3 after 15 overs. \n\nFOLLOW \u2b07\ufe0f \nhttps://t.co/egvDo7fncD https://t.co/XIqA05rEFT Rohit Sharma \u274c \nRavichandran Ashwin \u274c\nHanuma Vihari \u2705 \nRavindra Jadeja \u2705 \n\nThoughts, India fans?\n\nFULL INDIA TEAM \u2b07\ufe0f \nhttps://t.co/egvDo7fncD https://t.co/xSfheI6DCm West Indies win the toss and they will bowl first in the opening Test of their series against India.\n\nShamarh Brooks will debut for the home side.\n\nFOLLOW \u2b07\ufe0f \nhttps://t.co/egvDo7fncD https://t.co/QxHasfSQMa RT @T20WorldCup: A six-camera live-stream will be available for 10 games at the ICC Women's #T20WorldCup Qualifier, while video highlights\u2026 Can @imVkohli equal @msdhoni's record for most Test wins for India, in Antigua?\n\nFollow the #WIvIND first Test \ud83d\udc47 \nhttps://t.co/3z2aj65t5H https://t.co/iGCHHj3qJ6 Sri Lanka are 85/2 at the end of the first day in Colombo.\n\nWho do you think are on top?\n\nREPORT \u2b07\ufe0f \nhttps://t.co/CgqWbcIjsE \ud83c\uddf5\ud83c\uddf0's 17-day pre-season camp starts in Lahore today and camp head Misbah-ul-Haq wants the players to focus on \ud83e\udd57 and \ud83d\udcaa \nhttps://t.co/dEgBPmg3OE This is adorable \ud83d\ude0d https://t.co/GpFm8NVsuD Bad light has forced the players from the field in Colombo.\n\nColin de Grandhomme struck to remove Kusal Mendis, but Dimuth Karunaratne is still there, one away from his half-century.\n\nSri Lanka are 85/2 at stumps.\n\n#SLvNZ SCORE \ud83d\udc47\nhttps://t.co/vHUIvrr8E6 https://t.co/tRYVFfuezr Jofra Archer strikes seconds before the rain resumes!\n\nMarcus Harris, on #Ashes debut, nicks off for 8, and the rest of the players join him in leaving the pitch.\n\n#ENGvAUS UPDATES \ud83d\udc47\nhttps://t.co/w5m79RTGIu https://t.co/zRidBX0AK3 Who else wants Rahkeem Cornwall to play his first Test today? https://t.co/2kzF72lMfa Play is about to start at Headingley, meaning this guy is about to have his first bat in #Ashes cricket.\n\nHow do you think he'll get on?\n\n#ENGvAUS LIVE \ud83d\udc47\nhttps://t.co/w5m79RTGIu https://t.co/Su57hZsmFB Play has resumed, with the rain stopping as suddenly as it started!\n\n#SLvNZ Bad news from Colombo \ud83d\ude1e \n\nThe rain has returned and the start of the final session has been delayed \u2614\n\n#SLvNZ UPDATES \u2b07\ufe0f \nhttps://t.co/vHUIvr9xfw https://t.co/IILvp1lhvr More rain has delayed the start of play at Headingley \u2614\n\n#Ashes updates \ud83d\udc47\nhttps://t.co/w5m79RTGIu https://t.co/YIlrmDdzJI A late change for West Indies ahead of their #WTC21 opener: Keemo Paul has been ruled out with an injury to his left ankle and Miguel Cummins has joined the 13-member squad. https://t.co/Phczw0TcTM Sri Lanka claim the honours in the opening session of the second Test against New Zealand!\n\nThey are one down, with Dimuth Karunaratne and Kusal Mendis well set.\n\nFOLLOW #SLvNZ LIVE \u2b07\ufe0f \nhttps://t.co/vHUIvrr8E6 https://t.co/efgOyXNVgv England have won the toss and will bowl first at Headingley!\n\nThe hosts are unchanged, while for the tourists, Marcus Harris, Marnus Labuschagne, and James Pattinson come in for Cameron Bancroft, Steve Smith, and Peter Siddle.\n\n#Ashes live \ud83d\udc47\nhttps://t.co/w5m79RTGIu https://t.co/g7ikbui3lO Rain has delayed the toss at Headingley in the third #Ashes Test.\n\n#ENGvAUS updates \ud83d\udc47\nhttps://t.co/Kj09ve41aD https://t.co/lupEe9xjXO Somerville strikes! Sri Lanka lose Thirimanne but captain Karunaratne is looking steady. \n\nThe hosts are 29/1 after the first 15 overs in Colombo.\n\nFOLLOW #SLvNZ LIVE \u2b07\ufe0f \nhttps://t.co/vHUIvrr8E6 https://t.co/sF23jT4REe #OnThisDay in 2009, Jonathan Trott became the 18th English batsman to score a century on his Test debut! https://t.co/IybYXHW6TC #OnThisDay in 2011, England completed a 4-0 series victory over India and became the No.1 ranked Test side! https://t.co/lk4QPwwfuz Today in #WTC21\n\n\ud83d\udc49 #SLvNZ\n\ud83d\udc49 #ENGvAUS\n\ud83d\udc49 #WIvIND\n\nTest cricket \ud83c\udfcf\ud83d\udc9e https://t.co/2DUz6QxcuO The covers are off and we will have a game in Colombo! \n\nSri Lanka have won the toss and will bat first in the second Test. \n\nFOLLOW #SLvNZ LIVE \u2b07\ufe0f \nhttps://t.co/vHUIvrr8E6 https://t.co/Ubvd7TXjMS Good news! The weather is clearing up in Colombo! https://t.co/W7Fg3VMntw India begin their #WTC21 campaign today against West Indies! \n\nThey're No.1 on the @MRFWorldwide ICC Test Team Rankings. Can they soon get to the top on the Championship table as well? \n\n#WIvIND https://t.co/McPQVGnv1C \"Steve Smith missing this game might be the prod Davey needs.\"\n\nAustralia captain Tim Paine is expecting David Warner to \ud83d\udd25 in the third #Ashes Test at Headingley \u2b07\ufe0f \nhttps://t.co/PRJbPC1s9q Will it be Rohit Sharma or Hanuma Vihari in the XI today? \n\nVirat Kohli wasn't giving too much away, but he had praise for both players. \n\n#WIvIND\n\nhttps://t.co/2k0h00fwqe #Throwback to 2012\n\ud83d\udcaf from Ross Taylor and Kane Williamson\n1\ufe0f\u20e3 5\ufe0f\u20e3 wickets in the match for Tim Southee and Trent Boult\n\ud83c\udfc6 shared\n\n\ud83c\uddf3\ud83c\uddff bounced back from their 1st Test defeat against \ud83c\uddf1\ud83c\uddf0 and won the 2nd Test by 167 runs in Colombo. Will we see a repeat? https://t.co/R5IyWQImDj Grey skies and rain in Colombo \ud83c\udf27\ufe0f\u2614 \n\nThe start of the second Sri Lanka v New Zealand Test has been delayed.\n\n#SLvNZ | #WTC21 https://t.co/p2ovUKAtFz \ud83c\udf27\ufe0f\n\n#SLvNZ | #WTC21 https://t.co/15NvlBImsQ Recognition for two outstanding Indian cricketers \ud83d\udc47\nhttps://t.co/pQ6GYgkMxp #OnThisDay last year, India beat England at Trent Bridge with Virat Kohli making scores of 97 and 103. \n\nJos Buttler also made his maiden Test century! https://t.co/Cv8n8MBbmf Who do you think will be West Indies' key player in their Test series against India? \ud83e\udd14 \n\n#WIvIND https://t.co/dicNvZ999h Headingley awaits.\n\n#Ashes https://t.co/BJ3NS2kOcQ West Indies start their ICC World Test Championship campaign today!\n\n\ud83c\udf34 fans, how do you think they'll fare? \n\n#WTC21 https://t.co/02a46SadQM Preparation \u2705 \n\nCan Sri Lanka make it 2-0 or will New Zealand level the series? https://t.co/3O8ICMncLf Oman seal a four-wicket victory against Papua New Guinea in Aberdeen!\n\nA superb seventh-wicket stand of 71 between Suraj Kumar and Mohammad Nadeem saw them home after they slipped to 136/6 \ud83d\udc4f\n\n#OMAvPNG SCORECARD \ud83d\udc47\nhttps://t.co/nxIoestk1V https://t.co/Bn9kJmMn5k Jason Holder in home Test series for West Indies:\n\n- Batting average = 44.69\n- Highest score = 202*\n- Bowling average = 22.49\n- Best figures = 6/59\n\nThat is some record the West Indian skipper has \ud83d\udc4f https://t.co/9XoMC33oFO Oman are going well in their pursuit of Papua New Guinea's 206.\n\nThey are 117/2 at the halfway stage of their innings!\n\nWatch \u27a1\ufe0f https://t.co/WfwMGPGXru https://t.co/HlzpGHiSnz Edgbaston \u2013 \ud83c\udde6\ud83c\uddfa win\nLord's \u2013 draw\nHeadingley \u2013 \u2753\n\nAustralia will be without the services of their star batsman Steve Smith in Leeds. Advantage England?\n\n3rd #Ashes Test preview \ud83d\udc47\n\nhttps://t.co/R3oFbFdmBj A useful tenth wicket partnership of 35 sees Papua New Guinea set Oman 207 to win.\n\nJay Odedra the pick of the Oman bowlers taking 4/31!\n\nWatch the second innings \u27a1\ufe0f https://t.co/WfwMGPGXru https://t.co/pAvtnHBM5S \ud83d\udcfd\ufe0f WATCH: Former India star and 2011 @cricketworldcup winner Yuvraj Singh takes a walk down memory lane and reflects on his glorious career.\n\nhttps://t.co/kheLk6d3xc It's Oman v Papua New Guinea in the ICC CWC League 2 today.\n\nOman won the toss and elected to field first.\n\nCan Oman make it three wins from four or will Papua New Guinea secure their first win?\n\nWatch live \u27a1\ufe0fhttps://t.co/WfwMGPGXru https://t.co/HImjG3zXuq \"Hopefully we can put this very good Sri Lanka team under some pressure\" \u2013 Ross Taylor ahead of the second #SLvNZ Test.\n\nhttps://t.co/VkmGTUeFB3 RT @T20WorldCup: The first century on T20I debut was scored by Canada's Ravinderpal Singh earlier this week!\n\nCheck out the highlights from\u2026 2012: Galle \u2013 \ud83c\uddf1\ud83c\uddf0 win | Colombo \u2013 \ud83c\uddf3\ud83c\uddff win\n2019: Galle \u2013 \ud83c\uddf1\ud83c\uddf0 win | Colombo \u2013 ?\n\nWill the @BLACKCAPS bounce back to level the series again? \n#SLvNZ Preview \ud83d\udc47 \n\nhttps://t.co/CD0nmC0Edw Marnus Labuschagne \ud83d\udcf8\n\n\ud83d\ude10  \ud83d\udc49  \ud83d\ude00 https://t.co/iYtesARrqt West Indies and India are all set to start their ICC World Test Championship campaign in Antigua.\n\n#WIvIND 1st Test preview \ud83d\udc47\n\nhttps://t.co/Ywca9GjpTO England have the \"best seven batters\" available for the third #Ashes Test, but the batting order may need tweaking, admits Trevor Bayliss.\n\nhttps://t.co/GSFK0ZpyBt 1\ufe0f\u20e30\ufe0f\u20e31\ufe0f\u20e3* off 4\ufe0f\u20e33\ufe0f\u20e3 deliveries!\n\nNamibia batsman JP Kotze slammed the fourth-fastest century in T20I cricket against Botswana on Tuesday \ud83d\udc4f https://t.co/8s5e2eVcK2 \ud83d\udcab Magic from Steve Smith\n\ud83d\udd2e Spells from Jimmy Neesham\n1\ufe0f\u20e31\ufe0f\u20e3 years of Virat Kohli\n\nCatch this week's \ud83c\udfcf buzz on social media in the next installment of #OnTheUp:\n\nhttps://t.co/R2uVyBZve4 There could be up to five Test debutants for Afghanistan when they take on Bangladesh in a one-off Test match in September.\n\nhttps://t.co/CXhBWzq9ZK Happy birthday Simon Katich!\n\nIn 5\ufe0f\u20e36\ufe0f\u20e3Test matches he scored 4188 runs, averaging 45.03, hitting 10 centuries in that time. https://t.co/GXYW4K5wNN Scotland finished the opening round of ICC Cricket World Cup League Two with a win as they defeated Papua New Guinea by 38 runs.\n\nReport \ud83d\udc47 \nhttps://t.co/2X5uRjeaiV The Blackcaps back doing what they love most... a football warm-up! https://t.co/rXKcH8dsAP ICYMI \ud83d\udc47 \nhttps://t.co/djmIEUuLnw \ud83d\udc40 on the \u26bd https://t.co/lphRAPvteT West Indies legend Brian Lara is working closely with the team at a camp in Antigua ahead of the first #WIvIND Test. https://t.co/VDoX5LL2rL Look who is back in action England fans \ud83d\udc47 https://t.co/WQmqYRVyW6 The England team were back to work earlier today!\n\n#Ashes https://t.co/EyGCCfdhn1 Scotland win!\n\nA dominant performance with bat and ball sees the hosts to victory in their ICC Men's Cricket World Cup League 2 game against Papua New Guinea. https://t.co/fXNMTL4zji \ud83d\udea8ICYMI \ud83d\udea8\n\nEngland women are looking for a new head coach \ud83d\udc47 \n\nhttps://t.co/aGJKYK3ooB JUST IN\n\nEngland women's coach Mark Robinson is stepping down as head coach after four years in charge of the side. https://t.co/pFPRLPAprE Happy birthday Nat Sciver!\n\nNot many players invent their own shot, how many of you can play the 'Natmeg'? https://t.co/2opX5bNMvC 31 overs gone in the Papau New Guinea innings.\n\nThey require 130 to win from 114 balls, whilst Scotland require six wickets.\n\nWatch live \u27a1\ufe0f https://t.co/qR9ZrXXlOk https://t.co/8kpz6Dz8lS Could we see this man return to action in the third Ashes Test?\n\n#Ashes https://t.co/wMPWieKsNh Sri Lanka flying towards the second Test! https://t.co/hqo9iBoVWt Scotland post 242 in their innings against Papau New Guinea!\n\nCaptain Kyle Coetzer and Richie Berrington both passed fifty for the home side.\n\nWatch the second innings \u27a1\ufe0f https://t.co/qR9ZrXXlOk https://t.co/GnvUbH8HBw Ben Stokes is pleased to have 'frightening talent' Jofra Archer on England's side \ud83d\udcaa \n\n#Ashes https://t.co/LDKEluzuPL Scotland are batting first in their ICC Cricket World Cup League Two match against Papua New Guinea.\n\nWATCH \u2b07\ufe0f \nhttps://t.co/qR9ZrXXlOk https://t.co/9Qa9aCvM3s One of England's best off-spinners, he represented his country in 64 Tests and 61 ODIs, taking 223 international wickets.\n\nA useful lower-order batsman, he also has 2,214 runs to his name, including 10 half-centuries.\n\nHappy birthday John Emburey! https://t.co/33JD6AMY5Y \"The games are going to be much more competitive and it brings a lot of purpose to the Test matches you play\"\n\nKohli is pumped about the ICC World Test Championship!\n\nhttps://t.co/u1RS7Spjxm Steve Smith has been ruled out of the third Ashes Test at Headingley. \n\n#Ashes https://t.co/yEgb65x0NI He looks on Gracefully \ud83d\udc40 https://t.co/SuBvriaETo Deandra Dottin \ud83c\udfc5 \ud83c\udfc5 \nJason Holder \ud83c\udfc5 \nShai Hope \ud83c\udfc5 \nKeemo Paul \ud83c\udfc5 \n\nStar players shine at the annual West Indies awards!\n\nhttps://t.co/qZAdTn3aVL \"That bouncer of his is a huge asset and he's going to keep on doing it.\"\n\nStokes promises more \ud83d\udd25 from Archer.\n\nhttps://t.co/vfFhwKZGfQ Amy Satterthwaite is set to take a break from cricket to start a family.\n\nhttps://t.co/LsHdhflRZ3 \ud83c\uddf3\ud83c\uddff's Kane Williamson and \ud83c\uddf1\ud83c\uddf0's Akila Dananjaya have been reported for suspect bowling action after the first Test in Galle.\n\nhttps://t.co/mYHAaIs1vu The sweetest news of the day! \n\nCongratulations! \ud83d\udc76\n\n#babysatterhuhu https://t.co/7iZR3WaxaZ Kane Williamson \u2716\ufe0f\nTrent Boult \u2716\ufe0f\n\nNew Zealand have named a 14-member squad for T20I series against Sri Lanka.\n\nDetails \ud83d\udc47\n\nhttps://t.co/huG6ZHmDay Lots of questions for Kane Williamson and his New Zealand to answer ahead of their next Test against Sri Lanka!\n\n\ud83c\uddf3\ud83c\uddff fans, what changes would you make to the playing XI? https://t.co/soNxsSiDq4 Handshakes all-round for Marnus Labuschagne after a very impressive innings!\n\nWill he be in the Australia side for the next Test at Headingley?\n\n#Ashes https://t.co/JqXzOPUMSI \ud83d\udc49 Called up midway through the Test\n\ud83d\udc49 Makes a crucial half-century\n\ud83d\udc49 Shines on #Ashes debut \n\nRate Marnus Labuschagne's performance at Lord's out of 10: https://t.co/WcAnDOiYQq Cornwall has been playing first-class cricket since 2014, and in that time he has scored 2224 runs and taken 260 wickets in 55 games. \n\nhttps://t.co/CvSigwAhWA Your favourite ground to watch cricket is ________________? https://t.co/8kUKHOUWL2 \u261d\ufe0f https://t.co/S3TElOSt09 #NewCoverPic https://t.co/MsssVphY7Z Happy birthday Sheldon Cottrell!\n\nDoes he have the best celebration in cricket? https://t.co/OLEXVvrgBY ICYMI\n\nEngland announced their squad for the third Ashes Test which starts on Thursday at Headingley.\n\nhttps://t.co/zTbnDyTP8n", "emojis": {}, "interests": {"test": 466, "live": 282, "ash": 262, "follow": 235, "series": 213, "sri": 175, "south": 175, "day": 173, "win": 170, "cricket": 164, "birthday": 155, "wicket": 137, "match": 125, "west": 113, "century": 107, "new": 104, "today": 93, "side": 91, "victory": 84, "ball": 80, "time": 77, "report": 77, "world": 76, "captain": 76, "bat": 74, "run": 70, "smith": 69, "fifty": 68, "score": 67, "game": 67, "team": 67, "made": 63, "play": 61, "start": 61, "toss": 59, "player": 56, "scored": 56, "happy": 55, "men": 54, "take": 52, "batsman": 51, "year": 51, "get": 51, "cup": 48, "lead": 45, "bowling": 45, "batting": 44, "zimbabwe": 43, "make": 42, "performance": 41, "going": 40, "squad": 39, "action": 39, "took": 39, "need": 38, "set": 37, "lunch": 37, "home": 36, "joe": 35, "way": 34, "see": 34, "session": 34, "rain": 34, "taken": 33, "average": 33, "chase": 32, "record": 32, "look": 32, "ben": 32, "think": 31, "career": 31, "hundred": 31, "preview": 31, "lost": 31, "coach": 31, "end": 30, "debut": 30, "hit": 29, "skipper": 29, "khan": 29, "oval": 29, "qualifier": 28, "opener": 28, "partnership": 27, "watch": 27, "winning": 27, "tri": 27, "top": 26, "bowler": 26, "taking": 25, "bowl": 25, "put": 25, "root": 25, "tea": 25, "looking": 24, "finish": 24, "yesterday": 24, "opening": 24, "got": 24, "rounder": 24, "tour": 23, "man": 23, "half": 23, "archer": 23, "led": 22, "crease": 22, "come": 22, "tomorrow": 22, "championship": 22, "agarwal": 22, "country": 22, "head": 22, "knock": 22, "leading": 22, "warner": 21, "require": 21, "star": 21, "stand": 20, "hat": 20, "trick": 20, "cricketer": 20, "league": 20, "spinner": 20, "keep": 20, "want": 19, "order": 19, "moment": 19, "form": 19, "find": 19, "full": 19, "old": 19, "guinea": 18, "part": 18, "help": 17, "beat": 17, "level": 17, "trailing": 17, "field": 17, "born": 16, "class": 16, "return": 15, "claim": 15, "finch": 15, "philander": 15, "dean": 15, "news": 15, "stream": 15, "seal": 14, "finished": 14, "breakthrough": 14, "scoring": 14, "gone": 14, "quinton": 14, "work": 14, "hasan": 14, "perry": 14, "praise": 13, "picked": 13, "lot": 13, "turn": 13, "trophy": 12, "know": 12, "total": 12, "mark": 12, "saw": 12, "sweep": 12, "returned": 12, "struck": 12, "lose": 12, "fight": 12, "holder": 12, "rory": 12, "winner": 11, "give": 11, "pat": 11, "brilliant": 11, "left": 11, "format": 11, "resume": 11, "summer": 11, "marsh": 11, "break": 11, "catch": 11, "taker": 11, "abandoned": 11, "broad": 11, "place": 10, "featured": 10, "kapp": 10, "went": 10, "caption": 10, "continue": 10, "guess": 10, "lord": 10, "front": 10, "name": 10, "result": 10, "unbeaten": 10, "josh": 10, "injury": 9, "arm": 9, "added": 9, "first": 9, "getting": 9, "week": 9, "coming": 9, "effort": 9, "pair": 9, "pick": 9, "pant": 9, "group": 9, "position": 9, "becomes": 9, "history": 9, "read": 9, "legend": 9, "haul": 9, "round": 9, "super": 9, "reduced": 9, "bring": 9, "story": 9, "loss": 9, "fighting": 9, "secure": 9, "back": 9, "jack": 9, "broken": 9, "retain": 9, "came": 8, "best": 8, "big": 8, "member": 8, "target": 8, "style": 8, "one": 8, "post": 8, "appearance": 8, "conclusion": 8, "scorer": 8, "centurion": 8, "shah": 8, "given": 8, "rest": 8, "dream": 8, "said": 8, "reach": 8, "spot": 8, "sealed": 8, "trouble": 8, "raj": 8, "title": 8, "go": 8, "become": 8, "global": 8, "lee": 8, "streak": 8, "colin": 8, "leach": 8, "maxwell": 7, "party": 7, "maiden": 7, "talking": 7, "morning": 7, "focus": 7, "seen": 7, "spare": 7, "tournament": 7, "opportunity": 7, "love": 7, "former": 7, "gain": 7, "experience": 7, "table": 7, "bad": 7, "campaign": 7, "ton": 7, "thriller": 7, "pacer": 7, "keeper": 7, "two": 7, "development": 7, "hour": 7, "good": 7, "singh": 7, "defeat": 7, "second": 7, "beth": 7, "number": 7, "woman": 7, "watching": 6, "chance": 6, "use": 6, "five": 6, "restrict": 6, "finishing": 6, "pressure": 6, "giving": 6, "stage": 6, "wow": 6, "excited": 6, "done": 6, "light": 6, "hamza": 6, "advantage": 6, "declare": 6, "captaincy": 6, "right": 6, "say": 6, "bit": 6, "ground": 6, "semi": 6, "dhoni": 6, "retirement": 6, "achievement": 6, "champion": 6, "board": 6, "sune": 6, "thrilling": 6, "white": 6, "plan": 6, "feeling": 6, "batter": 6, "extend": 6, "cut": 6, "crossed": 6, "begin": 6, "bounce": 6, "hope": 6, "approach": 5, "face": 5, "well": 5, "confirmed": 5, "breaking": 5, "felt": 5, "clash": 5, "reduce": 5, "try": 5, "vice": 5, "ranked": 5, "three": 5, "wishing": 5, "move": 5, "plenty": 5, "jersey": 5, "life": 5, "retired": 5, "eye": 5, "rate": 5, "brought": 5, "add": 5, "qualify": 5, "making": 5, "silva": 5, "laura": 5, "working": 5, "improve": 5, "leave": 5, "continued": 5, "may": 5, "hand": 5, "highest": 5, "spin": 5, "amazing": 5, "dale": 5, "fall": 5, "contest": 5, "powered": 5, "hut": 5, "sport": 5, "remains": 5, "talent": 5, "losing": 5, "halfway": 5, "battle": 5, "remove": 5, "milestone": 5, "save": 5, "peter": 5, "retaining": 5, "surat": 5, "memory": 5, "spell": 5, "da": 5, "show": 5, "beginning": 5, "complete": 5, "fixture": 5, "update": 5, "duck": 5, "interval": 5, "line": 5, "thinking": 5, "pull": 5, "roach": 5, "ended": 4, "decision": 4, "convert": 4, "qualified": 4, "blazing": 4, "power": 4, "exciting": 4, "counting": 4, "restricted": 4, "quick": 4, "could": 4, "inspiration": 4, "backing": 4, "hong": 4, "body": 4, "sam": 4, "open": 4, "something": 4, "travis": 4, "wrap": 4, "starred": 4, "middle": 4, "fire": 4, "camp": 4, "gave": 4, "delivery": 4, "van": 4, "trap": 4, "amir": 4, "replace": 4, "age": 4, "martin": 4, "selection": 4, "enjoy": 4, "stop": 4, "remember": 4, "medal": 4, "amy": 4, "leadership": 4, "beating": 4, "following": 4, "beauty": 4, "thought": 4, "trying": 4, "resistance": 4, "trail": 4, "struggling": 4, "jess": 4, "leg": 4, "fan": 4, "lance": 4, "magic": 4, "anything": 4, "list": 4, "season": 4, "superb": 4, "slip": 4, "servant": 4, "keeping": 4, "stadium": 4, "fifth": 4, "slipped": 4, "whilst": 4, "everything": 4, "person": 4, "fell": 4, "meet": 4, "talk": 4, "repeat": 4, "washed": 4, "drawn": 4, "somerset": 4, "hall": 4, "impact": 4, "event": 4, "towards": 4, "wade": 4, "happening": 4, "battled": 4, "sarkar": 4, "urn": 4, "shot": 4, "ross": 4, "sealing": 3, "seamer": 3, "selector": 3, "sort": 3, "warm": 3, "join": 3, "current": 3, "walk": 3, "rutherford": 3, "flying": 3, "situation": 3, "heading": 3, "alive": 3, "panel": 3, "nothing": 3, "family": 3, "care": 3, "sweeping": 3, "people": 3, "fast": 3, "mike": 3, "landmark": 3, "row": 3, "draft": 3, "passion": 3, "staff": 3, "drive": 3, "canada": 3, "guard": 3, "allan": 3, "strike": 3, "track": 3, "chose": 3, "past": 3, "fare": 3, "assignment": 3, "national": 3, "manager": 3, "missing": 3, "competition": 3, "fitness": 3, "medium": 3, "starting": 3, "epic": 3, "dad": 3, "proved": 3, "challenge": 3, "amla": 3, "job": 3, "reducing": 3, "stay": 3, "getter": 3, "technique": 3, "leaving": 3, "coaching": 3, "picture": 3, "luck": 3, "perform": 3, "declared": 3, "enjoying": 3, "mignon": 3, "bid": 3, "recover": 3, "sizzle": 3, "consistency": 3, "survive": 3, "carry": 3, "six": 3, "let": 3, "defend": 3, "blast": 3, "month": 3, "shine": 3, "silverwood": 3, "key": 3, "balance": 3, "experienced": 3, "appointment": 3, "check": 3, "heather": 3, "graham": 3, "fought": 3, "final": 3, "question": 3, "scalp": 3, "caught": 3, "duo": 3, "dismiss": 3, "host": 3, "display": 3, "zaman": 3, "decided": 3, "comeback": 3, "partner": 3, "expect": 3, "hold": 3, "north": 3, "remain": 3, "point": 3, "quality": 3, "build": 3, "pace": 3, "relive": 3, "like": 3, "cook": 3, "wait": 3, "burl": 3, "award": 3, "delay": 3, "county": 3, "worked": 3, "role": 3, "contract": 3, "combination": 3, "fame": 3, "ask": 3, "push": 3, "chasing": 3, "call": 3, "example": 3, "turning": 3, "step": 3, "responsibility": 3, "shirt": 3, "course": 3, "cross": 3, "confidence": 3, "combined": 3, "kyle": 3, "hopefully": 3, "huge": 3, "seven": 3, "sir": 3, "jimmy": 3, "hero": 3, "third": 3, "retire": 3, "pursuit": 3, "brother": 2, "forward": 2, "lata": 2, "meant": 2, "intensity": 2, "president": 2, "massive": 2, "agar": 2, "touring": 2, "withdrawn": 2, "receive": 2, "replacement": 2, "tye": 2, "holly": 2, "absence": 2, "concern": 2, "beaten": 2, "moving": 2, "bishop": 2, "discus": 2, "surprise": 2, "swing": 2, "ending": 2, "stint": 2, "amelia": 2, "jeff": 2, "represent": 2, "charge": 2, "red": 2, "term": 2, "rebuild": 2, "culture": 2, "abu": 2, "consolidate": 2, "feel": 2, "debutant": 2, "recording": 2, "hurt": 2, "bouncer": 2, "initiative": 2, "victim": 2, "attack": 2, "smashing": 2, "respond": 2, "textbook": 2, "shown": 2, "gif": 2, "priority": 2, "counterattack": 2, "soil": 2, "facing": 2, "cap": 2, "recent": 2, "removed": 2, "grace": 2, "prince": 2, "gun": 2, "academy": 2, "logie": 2, "photo": 2, "anil": 2, "everyone": 2, "control": 2, "suspended": 2, "prove": 2, "jenny": 2, "growth": 2, "agree": 2, "heart": 2, "triple": 2, "found": 2, "future": 2, "welcome": 2, "kit": 2, "improving": 2, "dig": 2, "international": 2, "premier": 2, "enforced": 2, "setup": 2, "smile": 2, "profile": 2, "seat": 2, "built": 2, "shield": 2, "flow": 2, "master": 2, "thing": 2, "received": 2, "city": 2, "figure": 2, "penultimate": 2, "march": 2, "whitewash": 2, "filled": 2, "used": 2, "inspiring": 2, "smriti": 2, "sink": 2, "inspire": 2, "black": 2, "dominance": 2, "process": 2, "daily": 2, "trapped": 2, "worried": 2, "border": 2, "heartbreak": 2, "tony": 2, "cheer": 2, "task": 2, "discipline": 2, "extended": 2, "bob": 2, "provided": 2, "incoming": 2, "dominated": 2, "mean": 2, "posted": 2, "visiting": 2, "involved": 2, "legendary": 2, "dismissal": 2, "moor": 2, "topping": 2, "chief": 2, "executive": 2, "produced": 2, "success": 2, "gate": 2, "answer": 2, "close": 2, "celebrate": 2, "venue": 2, "told": 2, "frustrate": 2, "collapse": 2, "opposition": 2, "equalling": 2, "referee": 2, "realize": 2, "dominate": 2, "sight": 2, "chosen": 2, "clinch": 2, "scare": 2, "wrist": 2, "mood": 2, "shastri": 2, "farewell": 2, "brett": 2, "meaning": 2, "shape": 2, "surrey": 2, "expectation": 2, "reality": 2, "announce": 2, "persistent": 2, "stress": 2, "plane": 2, "momentum": 2, "idea": 2, "august": 2, "anyone": 2, "cause": 2, "thank": 2, "lock": 2, "outing": 2, "bowed": 2, "park": 2, "interest": 2, "conceded": 2, "cooper": 2, "dutch": 2, "encounter": 2, "knight": 2, "night": 2, "mentor": 2, "energy": 2, "wonder": 2, "steven": 2, "weather": 2, "heap": 2, "oes": 2, "redemption": 2, "latest": 2, "drizzle": 2, "lift": 2, "drill": 2, "reply": 2, "tonight": 2, "lane": 2, "episode": 2, "arena": 2, "review": 2, "failure": 2, "mir": 2, "management": 2, "forced": 2, "change": 2, "morgan": 2, "grow": 2, "pollard": 2, "tweet": 2, "tribute": 2, "stopped": 2, "bench": 2, "dust": 2, "assessment": 2, "karma": 2, "force": 2, "couple": 2, "incredible": 2, "savour": 2, "four": 2, "pad": 2, "upcoming": 2, "consistent": 2, "ethic": 2, "chapter": 2, "drama": 2, "achieve": 2, "feat": 2, "concussion": 2, "substitute": 2, "blackwood": 2, "storm": 2, "belief": 2, "believe": 2, "needing": 2, "hopped": 1, "roller": 1, "coaster": 1, "wedding": 1, "case": 1, "resting": 1, "blueprint": 1, "anam": 1, "amin": 1, "ameen": 1, "opt": 1, "closed": 1, "thanks": 1, "ramp": 1, "switched": 1, "jordan": 1, "mighty": 1, "barras": 1, "sacrifice": 1, "celebrated": 1, "signature": 1, "leap": 1, "neb": 1, "turner": 1, "manage": 1, "emulate": 1, "proof": 1, "enough": 1, "ruthless": 1, "madeline": 1, "penna": 1, "ferling": 1, "elbow": 1, "ken": 1, "choose": 1, "doubt": 1, "samson": 1, "schedule": 1, "russel": 1, "hip": 1, "enthralling": 1, "spend": 1, "strengthening": 1, "touched": 1, "scale": 1, "switch": 1, "kicking": 1, "hanif": 1, "union": 1, "dear": 1, "impression": 1, "goal": 1, "finding": 1, "brad": 1, "teenage": 1, "cracking": 1, "lungi": 1, "brink": 1, "shy": 1, "ule": 1, "laid": 1, "boycott": 1, "reminder": 1, "castled": 1, "enforce": 1, "wresting": 1, "domination": 1, "pictured": 1, "rightmost": 1, "cameo": 1, "welsh": 1, "dot": 1, "sun": 1, "bash": 1, "burst": 1, "roll": 1, "phoebe": 1, "overcome": 1, "king": 1, "angler": 1, "building": 1, "seize": 1, "mission": 1, "emerald": 1, "isle": 1, "quarter": 1, "bill": 1, "festival": 1, "band": 1, "cover": 1, "accustomed": 1, "patel": 1, "spectacle": 1, "speak": 1, "billy": 1, "double": 1, "royal": 1, "visit": 1, "interim": 1, "betty": 1, "lewis": 1, "sitting": 1, "sweeper": 1, "none": 1, "cool": 1, "trio": 1, "clock": 1, "ticking": 1, "food": 1, "onus": 1, "hud": 1, "riot": 1, "yeah": 1, "montage": 1, "volume": 1, "dev": 1, "girl": 1, "mantelpiece": 1, "brain": 1, "structure": 1, "stepped": 1, "tit": 1, "whatever": 1, "knockout": 1, "enthusiasm": 1, "heartening": 1, "foot": 1, "gas": 1, "promising": 1, "maintain": 1, "piece": 1, "nail": 1, "biting": 1, "fallen": 1, "shoulder": 1, "metropolis": 1, "rise": 1, "defence": 1, "joshi": 1, "great": 1, "count": 1, "wrapped": 1, "spoke": 1, "cent": 1, "standing": 1, "ten": 1, "matter": 1, "routing": 1, "holding": 1, "defense": 1, "variety": 1, "flower": 1, "bend": 1, "merchant": 1, "lone": 1, "support": 1, "mirror": 1, "image": 1, "tagged": 1, "deb": 1, "travel": 1, "watched": 1, "mel": 1, "excellence": 1, "kept": 1, "hunt": 1, "hospitality": 1, "reception": 1, "ace": 1, "train": 1, "calf": 1, "approaching": 1, "rule": 1, "claw": 1, "steady": 1, "journey": 1, "mind": 1, "saying": 1, "shut": 1, "departed": 1, "lea": 1, "notching": 1, "waugh": 1, "unstoppable": 1, "department": 1, "highlight": 1, "slid": 1, "avoid": 1, "lived": 1, "potato": 1, "farm": 1, "farmer": 1, "toe": 1, "seam": 1, "edition": 1, "disposal": 1, "bother": 1, "regret": 1, "settle": 1, "son": 1, "information": 1, "decider": 1, "ary": 1, "devastating": 1, "morne": 1, "whose": 1, "practice": 1, "eight": 1, "ninth": 1, "grit": 1, "determination": 1, "bay": 1, "stunning": 1, "staring": 1, "fading": 1, "tail": 1, "stump": 1, "shouldered": 1, "sniff": 1, "disarray": 1, "nine": 1, "barrier": 1, "high": 1, "problem": 1, "voice": 1, "headed": 1, "baa": 1, "prowess": 1, "nig": 1, "sending": 1, "grip": 1, "flyer": 1, "nelson": 1, "direct": 1, "basil": 1, "vigil": 1, "company": 1, "resilient": 1, "counter": 1, "aspire": 1, "living": 1, "response": 1, "breathe": 1, "selected": 1, "commanding": 1, "guide": 1, "disturbed": 1, "almost": 1, "would": 1, "ray": 1, "dar": 1, "dom": 1, "loving": 1, "kexy": 1, "impetus": 1, "bang": 1, "decent": 1, "ability": 1, "moody": 1, "western": 1, "invitational": 1, "cricketing": 1, "exit": 1, "outfit": 1, "fortress": 1, "bank": 1, "replicate": 1, "salma": 1, "contribute": 1, "pool": 1, "ran": 1, "bottom": 1, "sewn": 1, "doubled": 1, "rebuilt": 1, "dog": 1, "thrash": 1, "intimidate": 1, "fiery": 1, "gearing": 1, "mona": 1, "babu": 1, "showcase": 1, "option": 1, "poised": 1, "ave": 1, "effect": 1, "video": 1, "wally": 1, "ura": 1, "breakout": 1, "vote": 1, "ser": 1, "rent": 1, "lifting": 1, "dimension": 1, "excitement": 1, "forty": 1, "terrific": 1, "wilt": 1, "brilliance": 1, "lightning": 1, "fierce": 1, "competitor": 1, "laud": 1, "deserve": 1, "spoilsport": 1, "decade": 1, "succeed": 1, "economy": 1, "bade": 1, "spirit": 1, "renowned": 1, "chair": 1, "dressed": 1, "singing": 1, "stuff": 1, "successor": 1, "priest": 1, "anna": 1, "island": 1, "boy": 1, "confident": 1, "conquer": 1, "rewarding": 1, "swung": 1, "pope": 1, "recall": 1, "waller": 1, "click": 1, "era": 1, "phiz": 1, "predominantly": 1, "rainfall": 1, "chipping": 1, "scun": 1, "fracture": 1, "pleasing": 1, "initial": 1, "gosh": 1, "annoy": 1, "air": 1, "faith": 1, "according": 1, "striking": 1, "tied": 1, "aspiration": 1, "axed": 1, "contact": 1, "meeting": 1, "catching": 1, "paying": 1, "spent": 1, "equation": 1, "tackle": 1, "physical": 1, "disability": 1, "miller": 1, "fielder": 1, "single": 1, "increasing": 1, "choosing": 1, "topic": 1, "fearless": 1, "generation": 1, "harmer": 1, "console": 1, "forehand": 1, "lat": 1, "ambrose": 1, "iron": 1, "chink": 1, "fashion": 1, "send": 1, "crowned": 1, "blistering": 1, "flowing": 1, "rod": 1, "din": 1, "spread": 1, "overnight": 1, "cast": 1, "grown": 1, "china": 1, "admired": 1, "system": 1, "ba": 1, "complicated": 1, "analysis": 1, "hesitation": 1, "peach": 1, "fizz": 1, "undefeated": 1, "recipient": 1, "rapid": 1, "booked": 1, "dowd": 1, "laker": 1, "chahar": 1, "harry": 1, "remodel": 1, "pringle": 1, "childhood": 1, "idol": 1, "act": 1, "road": 1, "cruise": 1, "ket": 1, "smash": 1, "finalist": 1, "nation": 1, "someone": 1, "mig": 1, "demolish": 1, "vain": 1, "absolute": 1, "carnage": 1, "mammoth": 1, "elect": 1, "anchor": 1, "gaw": 1, "draw": 1, "brisk": 1, "delaying": 1, "hanging": 1, "roulette": 1, "snap": 1, "steal": 1, "everybody": 1, "tell": 1, "wearing": 1, "trip": 1, "glory": 1, "diving": 1, "running": 1, "square": 1, "tidy": 1, "pas": 1, "passing": 1, "stroke": 1, "seventh": 1, "fern": 1, "elite": 1, "calk": 1, "mutual": 1, "admiration": 1, "society": 1, "flu": 1, "gore": 1, "robin": 1, "thow": 1, "fud": 1, "absorbing": 1, "brutal": 1, "sil": 1, "blow": 1, "happen": 1, "machine": 1, "dose": 1, "motivation": 1, "ahead": 1, "aspiring": 1, "edge": 1, "originally": 1, "clinging": 1, "gallery": 1, "grill": 1, "autograph": 1, "accolade": 1, "surpass": 1, "carried": 1, "stretcher": 1, "showing": 1, "hate": 1, "respect": 1, "fact": 1, "bent": 1, "proven": 1, "reprieve": 1, "regain": 1, "strong": 1, "becoming": 1, "every": 1, "gill": 1, "sorry": 1, "gaz": 1, "bracken": 1, "fortunate": 1, "comfortable": 1, "included": 1, "sense": 1, "buy": 1, "business": 1, "attempt": 1, "legacy": 1, "kim": 1, "garth": 1, "progress": 1, "fault": 1, "fine": 1, "clark": 1, "regular": 1, "split": 1, "finger": 1, "singer": 1, "pain": 1, "bond": 1, "maw": 1, "thwart": 1, "cleaning": 1, "earn": 1, "mile": 1, "registered": 1, "fillip": 1, "removing": 1, "ride": 1, "genius": 1, "outfield": 1, "vision": 1, "strength": 1, "kind": 1, "cost": 1, "assessed": 1, "waking": 1, "amount": 1, "tried": 1, "tick": 1, "bucket": 1, "scrapping": 1, "destination": 1, "pitching": 1, "outside": 1, "umpire": 1, "stead": 1, "dug": 1, "worry": 1, "weave": 1, "definition": 1, "perpetuate": 1, "transmigration": 1, "determine": 1, "nature": 1, "existence": 1, "odds": 1, "unlocked": 1, "obtain": 1, "status": 1, "blade": 1, "setting": 1, "account": 1, "ongoing": 1, "bailey": 1, "icon": 1, "beloved": 1, "even": 1, "deliver": 1, "peace": 1, "note": 1, "jet": 1, "finally": 1, "carter": 1, "relentless": 1, "pump": 1, "mar": 1, "nick": 1, "tactic": 1, "short": 1, "maker": 1, "youngster": 1, "inside": 1, "struggle": 1, "wot": 1, "minute": 1, "simply": 1, "training": 1, "slipping": 1, "begun": 1, "ship": 1, "bannerman": 1, "dempster": 1, "excuse": 1, "swinger": 1, "slow": 1, "bird": 1, "superman": 1, "attitude": 1, "aged": 1, "quote": 1, "glad": 1, "brand": 1, "hell": 1, "sleepless": 1, "spoken": 1, "ultimate": 1, "biter": 1, "gaun": 1, "forget": 1, "ill": 1, "veteran": 1, "wish": 1, "bowing": 1, "pipped": 1, "moulded": 1, "hey": 1, "ring": 1, "prepare": 1, "relationship": 1, "glass": 1, "bravo": 1, "enterprising": 1, "scintillating": 1, "beach": 1, "pau": 1, "courtesy": 1, "invention": 1, "present": 1, "headband": 1, "golden": 1, "continental": 1, "republic": 1, "turkey": 1, "succession": 1, "millionth": 1, "surge": 1, "thumb": 1, "jap": 1, "fitting": 1, "pioneer": 1, "nil": 1, "firstly": 1, "house": 1, "grind": 1, "grab": 1, "willie": 1, "clive": 1, "feature": 1, "sabina": 1, "advice": 1, "contain": 1, "broke": 1, "armer": 1, "safe": 1, "mandate": 1, "mock": 1, "obituary": 1, "sporting": 1, "feared": 1, "dashed": 1, "restore": 1, "bow": 1, "long": 1, "astonishing": 1, "create": 1, "environment": 1, "clint": 1, "search": 1, "swift": 1, "blood": 1, "tay": 1, "gorgeous": 1, "shake": 1, "page": 1, "fold": 1, "depending": 1, "youth": 1, "abbas": 1, "arise": 1, "certainly": 1, "female": 1, "anti": 1, "corruption": 1, "tribunal": 1, "hearing": 1, "classic": 1, "emotion": 1, "pry": 1, "convincing": 1, "kiss": 1, "peck": 1, "cheek": 1, "somehow": 1, "transition": 1, "phase": 1, "cod": 1, "preach": 1, "press": 1, "patience": 1, "rattled": 1, "room": 1, "resumption": 1, "swinging": 1, "learning": 1, "weighed": 1, "debate": 1, "surrounding": 1, "together": 1, "nip": 1, "carve": 1, "performer": 1, "axe": 1, "slew": 1, "pavilion": 1, "describe": 1, "butcher": 1, "settled": 1, "sent": 1, "creep": 1, "pup": 1, "stayed": 1, "predict": 1, "sum": 1, "reft": 1, "camera": 1, "away": 1, "pitch": 1, "else": 1, "guy": 1, "stopping": 1, "ankle": 1, "ree": 1, "clearing": 1, "throwback": 1, "grey": 1, "sky": 1, "recognition": 1, "bridge": 1, "preparation": 1, "tenth": 1, "jay": 1, "buzz": 1, "installment": 1, "football": 1, "stepping": 1, "nat": 1, "invent": 1, "frightening": 1, "purpose": 1, "gracefully": 1, "asset": 1, "hug": 1, "celebration": 1}}