{"username": "BBCBreaking", "words": {"say": 211, "police": 192, "trump": 166, "president": 153, "people": 137, "deal": 106, "find": 91, "may": 91, "year": 82, "attack": 81, "man": 78, "government": 76, "court": 76, "follow": 72, "murder": 69, "leader": 68, "time": 67, "medium": 66, "vote": 65, "age": 64, "election": 62, "leave": 62, "day": 61, "minister": 59, "secretary": 57, "fire": 53, "live": 51, "house": 49, "win": 48, "state": 47, "world": 46, "death": 44, "party": 43, "city": 43, "labour": 42, "shoot": 42, "report": 42, "kim": 42, "latest": 41, "take": 41, "parliament": 39, "russia": 39, "north": 35, "crash": 34, "make": 33, "end": 33, "new": 32, "injure": 30, "airport": 30, "woman": 30, "give": 29, "former": 29, "family": 29, "reaction": 28, "men": 28, "cup": 27, "south": 27, "confirm": 27, "work": 27, "miss": 27, "chief": 26, "summit": 26, "agreement": 26, "car": 26, "get": 26, "hospital": 26, "supreme": 25, "sir": 25, "lead": 24, "become": 24, "air": 24, "agent": 24, "plane": 24, "life": 24, "league": 24, "country": 24, "spy": 24, "agree": 23, "set": 23, "hit": 23, "show": 23, "body": 23, "home": 23, "face": 22, "common": 22, "suspect": 22, "go": 22, "group": 22, "nerve": 22, "decision": 21, "back": 21, "border": 21, "bill": 20, "emergency": 20, "rescue": 20, "cave": 20, "suspicion": 19, "week": 19, "white": 19, "prince": 19, "use": 19, "investigation": 19, "moment": 19, "manager": 19, "kill": 19, "withdrawal": 19, "coverage": 19, "case": 19, "terror": 18, "defence": 18, "bid": 18, "stop": 18, "inquiry": 17, "power": 17, "cabinet": 17, "football": 17, "jail": 17, "run": 17, "force": 17, "rule": 17, "suspend": 17, "national": 17, "board": 17, "control": 17, "explosion": 17, "war": 17, "champion": 17, "campaign": 17, "come": 16, "delay": 16, "canada": 16, "letter": 16, "person": 16, "search": 16, "tory": 16, "duke": 16, "row": 16, "pilot": 16, "school": 16, "security": 16, "street": 16, "opposition": 16, "strike": 16, "boy": 16, "investigate": 16, "office": 16, "incident": 16, "poison": 16, "news": 15, "die": 15, "extension": 15, "operation": 15, "june": 15, "break": 15, "star": 15, "corruption": 15, "daughter": 15, "quit": 15, "couple": 15, "number": 15, "close": 15, "job": 15, "prime": 15, "official": 15, "motion": 14, "union": 14, "match": 14, "ban": 14, "duchess": 14, "do": 14, "agency": 14, "palace": 14, "oil": 14, "head": 14, "know": 14, "actor": 14, "lawyer": 14, "gunman": 14, "poisoning": 14, "van": 14, "move": 13, "law": 13, "place": 13, "council": 13, "train": 13, "ministry": 13, "way": 13, "leadership": 13, "china": 13, "link": 13, "term": 13, "capital": 13, "test": 13, "plan": 13, "meet": 13, "result": 13, "confidence": 13, "defeat": 13, "sri": 13, "best": 13, "manslaughter": 12, "victory": 12, "turkey": 12, "believe": 12, "full": 12, "assault": 12, "peace": 12, "hong": 12, "abuse": 12, "prison": 12, "record": 12, "action": 12, "tell": 12, "harry": 12, "club": 12, "beat": 12, "declare": 12, "fight": 12, "drone": 12, "majority": 12, "officer": 12, "mission": 12, "title": 12, "resignation": 12, "coach": 12, "month": 12, "sack": 12, "arrest": 12, "dame": 12, "statement": 12, "lorry": 11, "order": 11, "japan": 11, "today": 11, "history": 11, "referendum": 11, "step": 11, "mother": 11, "exit": 11, "risk": 11, "jet": 11, "challenge": 11, "post": 11, "judge": 11, "see": 11, "girl": 11, "coast": 11, "chancellor": 11, "accuse": 11, "rape": 11, "health": 11, "administration": 11, "tax": 11, "appeal": 11, "free": 11, "station": 11, "premier": 11, "hotel": 11, "son": 11, "journalist": 11, "chemical": 11, "lose": 10, "driver": 10, "send": 10, "tusk": 10, "return": 10, "reach": 10, "prize": 10, "conservative": 10, "executive": 10, "abortion": 10, "pay": 10, "help": 10, "queen": 10, "three": 10, "channel": 10, "united": 10, "block": 10, "high": 10, "hold": 10, "support": 10, "rise": 10, "mass": 10, "custody": 10, "resign": 10, "shooting": 10, "part": 10, "passenger": 10, "army": 10, "role": 10, "reject": 10, "baby": 10, "general": 10, "firm": 10, "base": 9, "deputy": 9, "mike": 9, "northern": 9, "ground": 9, "situation": 9, "stand": 9, "staff": 9, "presenter": 9, "wife": 9, "interest": 9, "try": 9, "york": 9, "series": 9, "actress": 9, "storm": 9, "story": 9, "terrorism": 9, "stay": 9, "trade": 9, "foreign": 9, "continue": 9, "night": 9, "semi": 9, "director": 9, "scandal": 9, "picture": 9, "attorney": 9, "relationship": 9, "toll": 9, "six": 9, "remain": 9, "spokesman": 9, "response": 9, "inflation": 9, "rate": 9, "probe": 9, "first": 9, "intelligence": 9, "brett": 9, "supermarket": 9, "carry": 8, "travel": 8, "call": 8, "source": 8, "backstop": 8, "footballer": 8, "charge": 8, "island": 8, "peter": 8, "candidate": 8, "gas": 8, "bank": 8, "fell": 8, "partner": 8, "system": 8, "bridge": 8, "land": 8, "top": 8, "process": 8, "ambassador": 8, "contest": 8, "four": 8, "international": 8, "arsenal": 8, "green": 8, "team": 8, "department": 8, "analysis": 8, "brazil": 8, "flight": 8, "release": 8, "fraud": 8, "town": 8, "misconduct": 8, "senate": 8, "cliff": 8, "debate": 7, "park": 7, "retain": 7, "decide": 7, "host": 7, "game": 7, "performance": 7, "vice": 7, "commission": 7, "sex": 7, "involve": 7, "table": 7, "join": 7, "brother": 7, "obituary": 7, "seek": 7, "crime": 7, "evidence": 7, "wow": 7, "cut": 7, "crisis": 7, "sit": 7, "grand": 7, "winner": 7, "bomb": 7, "blast": 7, "father": 7, "expose": 7, "sentence": 7, "act": 7, "trial": 7, "economy": 7, "east": 7, "governor": 7, "hunt": 7, "interview": 7, "contempt": 7, "connection": 7, "aircraft": 7, "race": 7, "deliver": 7, "chain": 7, "bus": 7, "change": 7, "unemployment": 7, "real": 7, "justice": 7, "open": 7, "tsunami": 7, "chairman": 7, "wound": 7, "scene": 7, "castle": 7, "want": 6, "vehicle": 6, "speaker": 6, "attempt": 6, "king": 6, "withdraw": 6, "need": 6, "impeachment": 6, "start": 6, "save": 6, "congress": 6, "begin": 6, "area": 6, "suggest": 6, "question": 6, "victim": 6, "mail": 6, "lady": 6, "suspension": 6, "right": 6, "tour": 6, "fail": 6, "line": 6, "west": 6, "business": 6, "founder": 6, "jack": 6, "five": 6, "coalition": 6, "conviction": 6, "river": 6, "affect": 6, "reduce": 6, "multiple": 6, "royal": 6, "data": 6, "course": 6, "information": 6, "ben": 6, "military": 6, "remove": 6, "claim": 6, "mark": 6, "university": 6, "film": 6, "visit": 6, "plant": 6, "drive": 6, "child": 6, "embassy": 6, "dutch": 6, "surrey": 6, "flee": 6, "bail": 6, "singer": 6, "khan": 6, "list": 6, "wall": 6, "smith": 6, "bring": 6, "fund": 6, "shutdown": 6, "walk": 6, "sight": 6, "company": 6, "helicopter": 6, "water": 6, "update": 6, "draft": 6, "nominee": 6, "diver": 6, "ant": 6, "trap": 6, "fear": 6, "allow": 5, "accord": 5, "nation": 5, "sign": 5, "amendment": 5, "put": 5, "book": 5, "chaos": 5, "veteran": 5, "protest": 5, "marathon": 5, "shopping": 5, "writer": 5, "read": 5, "enter": 5, "cook": 5, "buy": 5, "operate": 5, "hack": 5, "era": 5, "attacker": 5, "member": 5, "surgery": 5, "zone": 5, "watch": 5, "fall": 5, "newspaper": 5, "player": 5, "photo": 5, "missile": 5, "killing": 5, "old": 5, "slam": 5, "amber": 5, "rudd": 5, "poll": 5, "extradition": 5, "ask": 5, "approve": 5, "lee": 5, "rail": 5, "major": 5, "hurricane": 5, "ruth": 5, "blow": 5, "one": 5, "side": 5, "stage": 5, "worker": 5, "page": 5, "mosque": 5, "tanker": 5, "gulf": 5, "student": 5, "moon": 5, "concern": 5, "earthquake": 5, "shut": 5, "done": 5, "plea": 5, "bailey": 5, "look": 5, "hill": 5, "bet": 5, "meeting": 5, "accept": 5, "raid": 5, "round": 5, "space": 5, "ford": 5, "form": 5, "collapse": 5, "tiger": 5, "tourist": 5, "burn": 5, "name": 5, "gold": 5, "wake": 5, "dead": 5, "tower": 5, "store": 5, "warn": 5, "verdict": 5, "nick": 5, "counter": 5, "fashion": 5, "immigration": 5, "watchdog": 5, "announce": 5, "wreckage": 5, "lake": 5, "cancer": 5, "birth": 5, "drama": 5, "transport": 5, "comedy": 5, "disruption": 5, "fuel": 5, "bush": 5, "violence": 5, "thousand": 5, "hurt": 5, "synagogue": 5, "owner": 5, "republic": 5, "condition": 5, "hostage": 5, "traffic": 4, "push": 4, "liberal": 4, "tournament": 4, "request": 4, "market": 4, "jury": 4, "negotiator": 4, "address": 4, "shop": 4, "clash": 4, "sun": 4, "mayor": 4, "shock": 4, "ruling": 4, "ash": 4, "invitation": 4, "boat": 4, "wicket": 4, "review": 4, "wed": 4, "crew": 4, "author": 4, "spark": 4, "nine": 4, "decade": 4, "quits": 4, "democrat": 4, "journey": 4, "ship": 4, "restaurant": 4, "lewis": 4, "launch": 4, "leak": 4, "impose": 4, "commander": 4, "breach": 4, "level": 4, "macron": 4, "settle": 4, "racing": 4, "build": 4, "designer": 4, "none": 4, "husband": 4, "loss": 4, "benjamin": 4, "hall": 4, "approach": 4, "song": 4, "reopen": 4, "season": 4, "baker": 4, "radio": 4, "think": 4, "rod": 4, "easter": 4, "gunfire": 4, "counsel": 4, "cathedral": 4, "custom": 4, "deadlock": 4, "damage": 4, "departure": 4, "throw": 4, "receive": 4, "ferry": 4, "isle": 4, "march": 4, "catholic": 4, "fly": 4, "captain": 4, "planet": 4, "package": 4, "worcester": 4, "statistic": 4, "rhapsody": 4, "battle": 4, "gay": 4, "lie": 4, "criminal": 4, "charity": 4, "musical": 4, "eve": 4, "greater": 4, "cross": 4, "retailer": 4, "pair": 4, "volcano": 4, "anti": 4, "august": 4, "sport": 4, "conference": 4, "prosecutor": 4, "wage": 4, "grace": 4, "access": 4, "respond": 4, "brain": 4, "campaigner": 4, "steal": 4, "harassment": 4, "century": 4, "bos": 4, "tube": 4, "plot": 4, "good": 4, "treatment": 4, "acid": 4, "privacy": 4, "red": 4, "suicide": 4, "brigade": 4, "sky": 4, "navy": 4, "pending": 4, "building": 4, "garden": 4, "sergeant": 4, "wedding": 4, "drink": 4, "san": 4, "expel": 4, "hope": 3, "conspiracy": 3, "constable": 3, "mean": 3, "hurdle": 3, "everything": 3, "abandon": 3, "ceremony": 3, "throne": 3, "broadcaster": 3, "substance": 3, "stab": 3, "valley": 3, "gove": 3, "avoid": 3, "jean": 3, "deadline": 3, "consider": 3, "key": 3, "racist": 3, "independence": 3, "athlete": 3, "knife": 3, "literature": 3, "polish": 3, "typhoon": 3, "pave": 3, "relation": 3, "phone": 3, "rory": 3, "shot": 3, "territory": 3, "racism": 3, "transfer": 3, "cause": 3, "track": 3, "princess": 3, "respect": 3, "franco": 3, "keep": 3, "remains": 3, "church": 3, "harper": 3, "duty": 3, "adviser": 3, "surge": 3, "draw": 3, "point": 3, "soldier": 3, "demand": 3, "zimbabwe": 3, "phase": 3, "landfall": 3, "gunshot": 3, "error": 3, "type": 3, "dispute": 3, "kent": 3, "alliance": 3, "landmark": 3, "play": 3, "tonight": 3, "grid": 3, "resolve": 3, "network": 3, "met": 3, "evacuation": 3, "failure": 3, "condemn": 3, "status": 3, "craft": 3, "penalty": 3, "refugee": 3, "speech": 3, "anna": 3, "smuggle": 3, "arson": 3, "drug": 3, "inquest": 3, "super": 3, "roger": 3, "labor": 3, "pressure": 3, "citizenship": 3, "tommy": 3, "democracy": 3, "finish": 3, "angelique": 3, "nominate": 3, "sea": 3, "joe": 3, "senator": 3, "threat": 3, "landing": 3, "stroke": 3, "arm": 3, "cult": 3, "airliner": 3, "cover": 3, "press": 3, "scrap": 3, "village": 3, "love": 3, "engine": 3, "accident": 3, "villa": 3, "video": 3, "steel": 3, "celebrity": 3, "museum": 3, "grow": 3, "half": 3, "introduce": 3, "blasphemy": 3, "barcelona": 3, "direct": 3, "suffer": 3, "merger": 3, "yesterday": 3, "devastate": 3, "wave": 3, "roll": 3, "seven": 3, "stag": 3, "television": 3, "nothing": 3, "waste": 3, "movement": 3, "position": 3, "art": 3, "comedian": 3, "doubt": 3, "killer": 3, "option": 3, "principle": 3, "stabbing": 3, "event": 3, "trust": 3, "non": 3, "bind": 3, "black": 3, "begum": 3, "confirmation": 3, "atlantic": 3, "kensington": 3, "suspicious": 3, "detention": 3, "meng": 3, "ramus": 3, "kelly": 3, "independent": 3, "culture": 3, "road": 3, "gang": 3, "illness": 3, "discuss": 3, "single": 3, "armed": 3, "ongoing": 3, "panel": 3, "prove": 3, "pentagon": 3, "paddy": 3, "runway": 3, "foundation": 3, "committee": 3, "exchange": 3, "advice": 3, "surround": 3, "price": 3, "rapist": 3, "parole": 3, "criticism": 3, "odds": 3, "stadium": 3, "relate": 3, "bar": 3, "service": 3, "fix": 3, "budget": 3, "lion": 3, "threaten": 3, "sell": 3, "summer": 3, "crowd": 3, "minibus": 3, "lift": 3, "region": 3, "doctor": 3, "coroner": 3, "ball": 3, "anger": 3, "seal": 3, "musk": 3, "reveal": 3, "giant": 3, "worth": 3, "self": 3, "cricket": 3, "franklin": 3, "soul": 3, "period": 3, "exposure": 3, "german": 3, "bel": 3, "conte": 3, "minute": 3, "flood": 3, "chapel": 3, "torture": 3, "human": 3, "theft": 3, "silence": 3, "site": 3, "interior": 3, "eyewitness": 3, "extent": 3, "consumer": 3, "hawking": 3, "trailer": 2, "study": 2, "ensure": 2, "identify": 2, "timetable": 2, "happen": 2, "range": 2, "opportunity": 2, "negotiate": 2, "legislation": 2, "pick": 2, "pause": 2, "let": 2, "penny": 2, "atmosphere": 2, "door": 2, "extend": 2, "protect": 2, "democratic": 2, "offensive": 2, "second": 2, "sander": 2, "replace": 2, "sue": 2, "write": 2, "protester": 2, "bullet": 2, "parade": 2, "celebrate": 2, "fee": 2, "hale": 2, "effect": 2, "operator": 2, "oust": 2, "remember": 2, "voltage": 2, "swim": 2, "fury": 2, "production": 2, "jordan": 2, "publish": 2, "evening": 2, "seize": 2, "agenda": 2, "twitter": 2, "halt": 2, "complete": 2, "limit": 2, "advise": 2, "behaviour": 2, "consulate": 2, "stour": 2, "dobson": 2, "speed": 2, "youth": 2, "devote": 2, "add": 2, "triumph": 2, "financier": 2, "contact": 2, "energy": 2, "distribution": 2, "problem": 2, "scheme": 2, "reverse": 2, "teenage": 2, "hour": 2, "commissioner": 2, "dam": 2, "target": 2, "revoke": 2, "temperature": 2, "ballot": 2, "string": 2, "stuff": 2, "hand": 2, "precaution": 2, "knock": 2, "fourteen": 2, "collision": 2, "vessel": 2, "assistance": 2, "studio": 2, "bomber": 2, "diplomat": 2, "alan": 2, "incredible": 2, "sixth": 2, "barry": 2, "ray": 2, "blue": 2, "panorama": 2, "billionaire": 2, "customer": 2, "enrichment": 2, "broadcast": 2, "horse": 2, "frank": 2, "disappearance": 2, "speculation": 2, "tie": 2, "tweet": 2, "goal": 2, "negotiation": 2, "apple": 2, "contract": 2, "enemy": 2, "field": 2, "climate": 2, "massive": 2, "supplier": 2, "opera": 2, "chance": 2, "leg": 2, "reporter": 2, "credit": 2, "crown": 2, "retrial": 2, "autumn": 2, "gun": 2, "background": 2, "saw": 2, "pedro": 2, "hazard": 2, "county": 2, "resound": 2, "uncover": 2, "chef": 2, "treble": 2, "marriage": 2, "province": 2, "bibi": 2, "spend": 2, "shrine": 2, "lone": 2, "soe": 2, "rid": 2, "sacking": 2, "emperor": 2, "stake": 2, "district": 2, "lyra": 2, "collusion": 2, "stone": 2, "structure": 2, "destruction": 2, "spread": 2, "spire": 2, "main": 2, "coup": 2, "ail": 2, "pub": 2, "sig": 2, "scenario": 2, "prosecution": 2, "politics": 2, "whip": 2, "backing": 2, "speedboat": 2, "absence": 2, "conspire": 2, "article": 2, "sovereignty": 2, "minimum": 2, "fleet": 2, "cardinal": 2, "pell": 2, "clock": 2, "choice": 2, "aviation": 2, "authority": 2, "notice": 2, "mutilation": 2, "capsule": 2, "ocean": 2, "sorry": 2, "fighter": 2, "gesture": 2, "praise": 2, "check": 2, "tension": 2, "handling": 2, "prepare": 2, "alfonso": 2, "aid": 2, "competition": 2, "republican": 2, "maduro": 2, "goalkeeper": 2, "resume": 2, "sister": 2, "rio": 2, "touchdown": 2, "publicist": 2, "route": 2, "cooper": 2, "wheel": 2, "speeding": 2, "date": 2, "nurse": 2, "serve": 2, "succeed": 2, "bishop": 2, "issue": 2, "militant": 2, "responsibility": 2, "complex": 2, "bottom": 2, "bangkok": 2, "bakery": 2, "blood": 2, "grayling": 2, "talk": 2, "tribute": 2, "object": 2, "solar": 2, "treat": 2, "terry": 2, "fault": 2, "activity": 2, "pull": 2, "retire": 2, "toddler": 2, "gain": 2, "martin": 2, "survive": 2, "trigger": 2, "rocket": 2, "heart": 2, "accounting": 2, "wing": 2, "weekend": 2, "involvement": 2, "cannon": 2, "tear": 2, "turn": 2, "emma": 2, "mistake": 2, "cab": 2, "aide": 2, "ons": 2, "legend": 2, "quarter": 2, "value": 2, "achievement": 2, "squirrel": 2, "birthday": 2, "booker": 2, "device": 2, "explain": 2, "offer": 2, "bullying": 2, "provide": 2, "cake": 2, "nomination": 2, "manger": 2, "breakfast": 2, "heterosexual": 2, "quake": 2, "disaster": 2, "flaw": 2, "conversation": 2, "duo": 2, "overturn": 2, "lot": 2, "undermine": 2, "future": 2, "berlin": 2, "florence": 2, "burt": 2, "rogue": 2, "costa": 2, "widow": 2, "approval": 2, "entertainment": 2, "knifeman": 2, "direction": 2, "blame": 2, "grade": 2, "increase": 2, "motorway": 2, "cricketer": 2, "parker": 2, "protection": 2, "pregnancy": 2, "anyone": 2, "midwife": 2, "chuckle": 2, "championship": 2, "effort": 2, "style": 2, "submarine": 2, "fra": 2, "fox": 2, "heartbreak": 2, "seed": 2, "bit": 2, "maria": 2, "silva": 2, "stun": 2, "aum": 2, "execute": 2, "eric": 2, "female": 2, "wait": 2, "sweep": 2, "fifth": 2, "rally": 2, "policy": 2, "rev": 2, "gosport": 2, "memorial": 2, "blaze": 2, "soap": 2, "parachute": 2, "lawsuit": 2, "conduct": 2, "management": 2, "appoint": 2, "producer": 2, "visa": 2, "zoo": 2, "escape": 2, "reform": 2, "surrender": 2, "emery": 2, "spencer": 2, "novelist": 2, "ken": 2, "bride": 2, "describe": 2, "ignorance": 2, "safety": 2, "attend": 2, "haemorrhage": 2, "fierce": 2, "breast": 2, "screen": 2, "shout": 2, "finch": 2, "avenue": 2, "yak": 2, "rebel": 2, "admit": 2, "average": 2, "index": 2, "driving": 2, "ulster": 2, "assistant": 2, "replacement": 2, "gymnastics": 2, "dart": 2, "hip": 2, "headquarters": 2, "mor": 2, "warner": 2, "be": 2, "hawk": 2, "detective": 2, "property": 2, "knowledge": 2, "sud": 1, "lifting": 1, "maintain": 1, "dignity": 1, "register": 1, "industrial": 1, "morning": 1, "container": 1, "iyo": 1, "ascent": 1, "chrysanthemum": 1, "minority": 1, "matter": 1, "consort": 1, "disloyalty": 1, "develop": 1, "dementia": 1, "prog": 1, "welcome": 1, "decline": 1, "comply": 1, "dismay": 1, "setback": 1, "sublime": 1, "superlative": 1, "golf": 1, "solution": 1, "geography": 1, "integrity": 1, "conflict": 1, "prolongation": 1, "stability": 1, "congressman": 1, "qualifier": 1, "huckle": 1, "word": 1, "incursion": 1, "artillery": 1, "behalf": 1, "legal": 1, "daily": 1, "mirror": 1, "contender": 1, "colonial": 1, "erne": 1, "leading": 1, "artery": 1, "blockage": 1, "newsreader": 1, "publication": 1, "policewoman": 1, "flat": 1, "chest": 1, "defy": 1, "complaint": 1, "naga": 1, "third": 1, "regard": 1, "businesswoman": 1, "lux": 1, "lock": 1, "transcript": 1, "engagement": 1, "blight": 1, "formal": 1, "dictator": 1, "mausoleum": 1, "apply": 1, "forget": 1, "ditch": 1, "wear": 1, "blackface": 1, "hear": 1, "amount": 1, "displeasure": 1, "stick": 1, "stuck": 1, "gala": 1, "magazine": 1, "debris": 1, "impact": 1, "oval": 1, "urn": 1, "cancel": 1, "bell": 1, "otto": 1, "sam": 1, "felicity": 1, "exam": 1, "correct": 1, "disagree": 1, "pledge": 1, "annex": 1, "correspondence": 1, "refuse": 1, "forward": 1, "os": 1, "fine": 1, "oppose": 1, "pointless": 1, "speak": 1, "category": 1, "random": 1, "account": 1, "flurry": 1, "hearing": 1, "rep": 1, "survival": 1, "limited": 1, "verge": 1, "meaning": 1, "bury": 1, "cheng": 1, "abolish": 1, "burglary": 1, "ruler": 1, "carbon": 1, "monoxide": 1, "rocky": 1, "brawl": 1, "holiday": 1, "hub": 1, "cell": 1, "utility": 1, "outage": 1, "affecting": 1, "warden": 1, "benefit": 1, "output": 1, "possess": 1, "weapon": 1, "policeman": 1, "recovery": 1, "alert": 1, "bigotry": 1, "supremacy": 1, "crossing": 1, "disqualification": 1, "carl": 1, "beech": 1, "lapse": 1, "shipwreck": 1, "caid": 1, "presidency": 1, "obscenity": 1, "patel": 1, "appointment": 1, "dover": 1, "netball": 1, "seizure": 1, "revolutionary": 1, "guard": 1, "goddard": 1, "strong": 1, "suspected": 1, "anime": 1, "baron": 1, "dismiss": 1, "distraction": 1, "mathematician": 1, "note": 1, "powerful": 1, "telescope": 1, "map": 1, "cosmos": 1, "yard": 1, "census": 1, "questionnaire": 1, "ross": 1, "militia": 1, "terminator": 1, "port": 1, "pundit": 1, "lob": 1, "flag": 1, "podium": 1, "legislature": 1, "spray": 1, "smash": 1, "overrun": 1, "chamber": 1, "stockpile": 1, "uranium": 1, "pregnant": 1, "croydon": 1, "feel": 1, "ease": 1, "lut": 1, "foot": 1, "handshake": 1, "made": 1, "bloc": 1, "clinch": 1, "sweltering": 1, "kamala": 1, "tez": 1, "convert": 1, "cock": 1, "load": 1, "retaliate": 1, "mind": 1, "petition": 1, "footage": 1, "activist": 1, "vie": 1, "left": 1, "expert": 1, "woodland": 1, "maestro": 1, "scale": 1, "icon": 1, "lam": 1, "introduction": 1, "select": 1, "tha": 1, "outcry": 1, "blanket": 1, "someone": 1, "pension": 1, "mali": 1, "inhabit": 1, "wish": 1, "sally": 1, "extra": 1, "sound": 1, "salute": 1, "winger": 1, "tycoon": 1, "derby": 1, "ghazi": 1, "serving": 1, "nationalist": 1, "tea": 1, "publisher": 1, "mistreatment": 1, "insolvency": 1, "supply": 1, "addition": 1, "entrepreneur": 1, "frighten": 1, "formula": 1, "arcade": 1, "thrash": 1, "stunning": 1, "shorten": 1, "bob": 1, "computer": 1, "kyle": 1, "allegation": 1, "priest": 1, "going": 1, "final": 1, "trick": 1, "image": 1, "bundle": 1, "joy": 1, "appear": 1, "unbelievable": 1, "actually": 1, "elephant": 1, "beam": 1, "mum": 1, "fresh": 1, "asthma": 1, "pollution": 1, "deny": 1, "jockey": 1, "ruby": 1, "walsh": 1, "retirement": 1, "development": 1, "sadness": 1, "caster": 1, "testosterone": 1, "abdication": 1, "monarch": 1, "singleton": 1, "hood": 1, "core": 1, "regulator": 1, "curfew": 1, "riot": 1, "emotion": 1, "bib": 1, "topple": 1, "surface": 1, "please": 1, "grant": 1, "kingdom": 1, "hole": 1, "unveil": 1, "heat": 1, "umbrella": 1, "nuisance": 1, "homeland": 1, "tri": 1, "botched": 1, "outcome": 1, "unity": 1, "division": 1, "drag": 1, "stalemate": 1, "compromise": 1, "regret": 1, "harmony": 1, "intend": 1, "drop": 1, "shepherd": 1, "special": 1, "liaison": 1, "encourage": 1, "speaking": 1, "estuary": 1, "squire": 1, "thanks": 1, "recognize": 1, "short": 1, "soviet": 1, "tram": 1, "inspire": 1, "well": 1, "ana": 1, "forty": 1, "public": 1, "abundance": 1, "caution": 1, "stem": 1, "sao": 1, "solve": 1, "confusion": 1, "avalanche": 1, "civil": 1, "cox": 1, "fan": 1, "athletics": 1, "govern": 1, "box": 1, "recorder": 1, "everyone": 1, "climber": 1, "mountain": 1, "dragon": 1, "earth": 1, "astronaut": 1, "thought": 1, "afternoon": 1, "luke": 1, "perry": 1, "prodigy": 1, "flint": 1, "breathe": 1, "procedure": 1, "extradite": 1, "rent": 1, "accusation": 1, "composer": 1, "conductor": 1, "wise": 1, "sketch": 1, "bribery": 1, "migration": 1, "railway": 1, "propose": 1, "supa": 1, "cleric": 1, "prevent": 1, "overcome": 1, "hijack": 1, "crystal": 1, "violent": 1, "empire": 1, "dudley": 1, "abduction": 1, "breakaway": 1, "crush": 1, "honda": 1, "closure": 1, "berger": 1, "gape": 1, "ann": 1, "welsh": 1, "coherent": 1, "strategy": 1, "lord": 1, "avert": 1, "outbreak": 1, "flu": 1, "hakeem": 1, "unprecedented": 1, "cinema": 1, "glom": 1, "training": 1, "reading": 1, "branch": 1, "bowl": 1, "equal": 1, "hardy": 1, "regular": 1, "quiz": 1, "secure": 1, "ugly": 1, "acquittal": 1, "tech": 1, "raise": 1, "seventh": 1, "obstruction": 1, "witness": 1, "patient": 1, "estate": 1, "prospect": 1, "catastrophe": 1, "every": 1, "uncertainty": 1, "bitterness": 1, "ivory": 1, "dropping": 1, "humanity": 1, "consent": 1, "sturgeon": 1, "asylum": 1, "barrier": 1, "design": 1, "thwart": 1, "deploy": 1, "equipment": 1, "method": 1, "bale": 1, "could": 1, "front": 1, "cole": 1, "mine": 1, "mental": 1, "ultima": 1, "patrol": 1, "known": 1, "fabulous": 1, "gate": 1, "tarmac": 1, "python": 1, "twiggy": 1, "egma": 1, "rising": 1, "music": 1, "poise": 1, "iceland": 1, "swear": 1, "expect": 1, "restrict": 1, "arrival": 1, "rest": 1, "troop": 1, "hamper": 1, "dying": 1, "relax": 1, "ticket": 1, "personality": 1, "nearly": 1, "mick": 1, "bug": 1, "lifeline": 1, "graham": 1, "delaying": 1, "renegotiate": 1, "facilitate": 1, "ratification": 1, "defer": 1, "yoi": 1, "stampede": 1, "sanction": 1, "ted": 1, "hug": 1, "yachtswoman": 1, "cargo": 1, "cape": 1, "horn": 1, "virgin": 1, "recognition": 1, "oversee": 1, "led": 1, "pete": 1, "punk": 1, "band": 1, "disconnect": 1, "tail": 1, "rotor": 1, "uphold": 1, "wilder": 1, "heavyweight": 1, "morgan": 1, "shadow": 1, "vest": 1, "wash": 1, "beach": 1, "mast": 1, "example": 1, "reservation": 1, "invasion": 1, "project": 1, "plead": 1, "shrink": 1, "aftermath": 1, "treasury": 1, "scientist": 1, "gene": 1, "brave": 1, "academic": 1, "pardon": 1, "deport": 1, "include": 1, "sha": 1, "recover": 1, "grasp": 1, "political": 1, "declaration": 1, "gaz": 1, "unidentified": 1, "bulletin": 1, "restore": 1, "rouge": 1, "genocide": 1, "camp": 1, "reconcile": 1, "conscience": 1, "stormy": 1, "command": 1, "divorce": 1, "genius": 1, "superhero": 1, "creator": 1, "marvel": 1, "spider": 1, "panther": 1, "discovery": 1, "paradise": 1, "long": 1, "twelve": 1, "jeff": 1, "session": 1, "mid": 1, "skelter": 1, "reinstate": 1, "hate": 1, "crouch": 1, "crackdown": 1, "launder": 1, "spinal": 1, "implant": 1, "bulger": 1, "boston": 1, "gangster": 1, "khu": 1, "murderer": 1, "threshold": 1, "income": 1, "stamp": 1, "ownership": 1, "chairwoman": 1, "controversial": 1, "far": 1, "hoddle": 1, "ill": 1, "swift": 1, "meal": 1, "retail": 1, "escalator": 1, "savage": 1, "urgent": 1, "clarification": 1, "vei": 1, "twenty": 1, "radical": 1, "preacher": 1, "invite": 1, "farm": 1, "fulham": 1, "college": 1, "possession": 1, "milkman": 1, "deference": 1, "thrive": 1, "spring": 1, "small": 1, "airfield": 1, "wigan": 1, "punishment": 1, "striker": 1, "henry": 1, "pastor": 1, "shale": 1, "discrimination": 1, "strip": 1, "pile": 1, "alias": 1, "infertile": 1, "enable": 1, "arc": 1, "still": 1, "tap": 1, "gallery": 1, "hut": 1, "dyke": 1, "degree": 1, "teen": 1, "warfare": 1, "impunity": 1, "palmer": 1, "freshly": 1, "jubilation": 1, "desperation": 1, "stricken": 1, "career": 1, "last": 1, "senior": 1, "inform": 1, "determine": 1, "allergy": 1, "eat": 1, "baguette": 1, "sexual": 1, "sale": 1, "association": 1, "testimony": 1, "identity": 1, "interfere": 1, "sexually": 1, "predator": 1, "amid": 1, "knockout": 1, "testify": 1, "cable": 1, "auction": 1, "pocket": 1, "several": 1, "impasse": 1, "pharmacy": 1, "caravan": 1, "hail": 1, "disrepute": 1, "rescuer": 1, "repeat": 1, "create": 1, "buffer": 1, "separate": 1, "comment": 1, "accuser": 1, "monetary": 1, "inflict": 1, "correction": 1, "ako": 1, "eye": 1, "coli": 1, "jimmy": 1, "wick": 1, "scorer": 1, "establishment": 1, "predict": 1, "mac": 1, "miller": 1, "theorist": 1, "charm": 1, "swagger": 1, "bandit": 1, "deliverance": 1, "alcohol": 1, "intoxication": 1, "bland": 1, "portrayal": 1, "adopt": 1, "definition": 1, "whole": 1, "helm": 1, "tarin": 1, "naa": 1, "crossrail": 1, "underground": 1, "coca": 1, "cola": 1, "coffee": 1, "payday": 1, "lender": 1, "wonga": 1, "compensation": 1, "unmarried": 1, "parent": 1, "allowance": 1, "decease": 1, "hero": 1, "pope": 1, "quarrel": 1, "finance": 1, "purpose": 1, "bond": 1, "generation": 1, "apology": 1, "monsoon": 1, "assembly": 1, "voice": 1, "prayer": 1, "proportion": 1, "clearance": 1, "affray": 1, "tragedy": 1, "danger": 1, "camera": 1, "outside": 1, "raft": 1, "medicine": 1, "touch": 1, "permission": 1, "brunswick": 1, "struggle": 1, "fut": 1, "growth": 1, "struggling": 1, "reputation": 1, "tremor": 1, "flying": 1, "net": 1, "stoke": 1, "soil": 1, "opponent": 1, "nelson": 1, "splash": 1, "application": 1, "moray": 1, "rigging": 1, "changer": 1, "shape": 1, "kit": 1, "kat": 1, "finger": 1, "wafer": 1, "dup": 1, "warplane": 1, "mourn": 1, "missing": 1, "deliberate": 1, "sank": 1, "columbine": 1, "population": 1, "android": 1, "cement": 1, "judgment": 1, "corporation": 1, "guy": 1, "conclusion": 1, "victorious": 1, "cro": 1, "trophy": 1, "bottle": 1, "fake": 1, "trip": 1, "nursing": 1, "header": 1, "accomplish": 1, "gear": 1, "dream": 1, "christening": 1, "quarantine": 1, "dawn": 1, "ninety": 1, "crucially": 1, "creation": 1, "hang": 1, "luxury": 1, "saman": 1, "oxygen": 1, "lost": 1, "consciousness": 1, "execution": 1, "environmental": 1, "toxin": 1, "handle": 1, "item": 1, "moor": 1, "scored": 1, "col": 1, "dier": 1, "countess": 1, "chester": 1, "learn": 1, "dive": 1, "recede": 1, "archbishop": 1, "alive": 1, "wrongdoing": 1, "compete": 1, "saved": 1, "gazette": 1, "shotgun": 1, "reshape": 1, "tackle": 1, "dump": 1, "assume": 1, "score": 1, "guarantee": 1, "like": 1, "reunite": 1, "facility": 1, "expand": 1, "aim": 1, "condemnation": 1, "defraud": 1, "rebellion": 1, "tenacity": 1, "fortitude": 1, "justification": 1, "marijuana": 1, "cesspool": 1, "bias": 1, "total": 1, "junction": 1, "epileptic": 1, "react": 1, "mackintosh": 1, "copyright": 1, "dirty": 1, "den": 1, "scathing": 1, "engineering": 1, "urgency": 1, "relief": 1, "federation": 1, "ame": 1, "document": 1, "clearer": 1, "depart": 1, "model": 1, "discount": 1, "light": 1, "raglan": 1, "disarray": 1, "endorsement": 1, "neck": 1, "bag": 1, "room": 1, "employer": 1, "legality": 1, "grandmother": 1, "giver": 1, "spade": 1, "apartment": 1, "detail": 1, "expansion": 1, "colorado": 1, "austerity": 1, "cordon": 1, "hardware": 1, "card": 1, "jaguar": 1, "indoors": 1, "aluminium": 1, "ally": 1, "assassination": 1, "abhorrent": 1, "repugnant": 1, "submerge": 1, "balcony": 1, "migrant": 1, "citizen": 1, "designate": 1, "yes": 1, "constitution": 1, "revolution": 1, "reschedule": 1, "landslide": 1, "carer": 1, "answer": 1, "hammer": 1, "somerset": 1, "hopefully": 1, "petrol": 1, "pray": 1, "god": 1, "hostility": 1, "display": 1, "reason": 1, "payment": 1, "bureau": 1, "exclusive": 1, "arrange": 1, "confirmed": 1, "successor": 1, "vital": 1, "memory": 1, "beginning": 1, "propaganda": 1, "reception": 1, "enormous": 1, "greet": 1, "marry": 1, "bright": 1, "sunshine": 1, "glimpse": 1, "explode": 1, "accompany": 1, "eruption": 1, "barmaid": 1, "intent": 1, "consult": 1, "cladding": 1, "hem": 1, "focus": 1, "indifference": 1, "cost": 1, "squad": 1, "che": 1, "stagecoach": 1, "politician": 1, "freed": 1, "bonfire": 1, "inaugurate": 1, "amidst": 1, "protagonist": 1, "stalwart": 1, "thank": 1, "choose": 1, "serial": 1, "disrupt": 1, "frightened": 1, "rabbit": 1, "financial": 1, "unmask": 1, "hakim": 1, "tip": 1, "arrive": 1, "axe": 1, "homeless": 1, "care": 1, "undergo": 1, "fairground": 1, "middle": 1, "restart": 1, "rotten": 1, "share": 1, "steven": 1, "award": 1, "coke": 1, "dust": 1, "shah": 1, "chosen": 1, "merge": 1, "heartbroken": 1, "removal": 1, "peninsula": 1, "divide": 1, "bruise": 1, "excite": 1, "inventor": 1, "million": 1, "mount": 1, "naked": 1, "waffle": 1, "commemoration": 1, "bear": 1, "delight": 1, "finalist": 1, "bow": 1, "debut": 1, "voter": 1, "registration": 1, "pool": 1, "fitness": 1, "commonwealth": 1, "dale": 1, "canel": 1, "rue": 1, "print": 1, "literacy": 1, "anxiety": 1, "controversy": 1, "environment": 1, "unfit": 1, "advertising": 1, "envoy": 1, "aggression": 1, "allied": 1, "conclude": 1, "accomplished": 1, "accountability": 1, "referee": 1, "hundred": 1, "eastern": 1, "organization": 1, "many": 1, "metropolitan": 1, "golfer": 1, "reed": 1, "drove": 1, "bode": 1, "spokeswoman": 1, "ice": 1, "hockey": 1, "collide": 1, "silver": 1, "burglar": 1, "blake": 1, "dialogue": 1, "cousin": 1, "antelope": 1, "shooter": 1, "becomes": 1, "apartheid": 1, "count": 1, "junk": 1, "lab": 1, "pacific": 1, "midland": 1, "safari": 1, "expulsion": 1, "pulse": 1, "shell": 1, "improve": 1, "mortgage": 1, "ram": 1, "rioting": 1, "rap": 1, "loop": 1, "arena": 1, "suit": 1, "sixty": 1, "alarm": 1, "switch": 1, "inferno": 1, "southern": 1, "pain": 1, "detain": 1, "sedition": 1, "remainder": 1, "siege": 1, "warrant": 1, "analytics": 1, "inspector": 1, "dangerous": 1, "taker": 1, "allegiance": 1, "elite": 1, "kier": 1, "prohibition": 1, "dowd": 1, "negligence": 1, "pablo": 1, "parcel": 1, "nix": 1, "engineer": 1, "professor": 1, "abbey": 1, "newton": 1, "dean": 1, "depot": 1, "nag": 1, "measure": 1, "transition": 1, "enjoy": 1, "implementation": 1, "certainty": 1, "text": 1, "towards": 1, "businessman": 1, "native": 1, "meddle": 1, "retaliation": 1, "maker": 1, "marmite": 1, "dove": 1, "fico": 1, "freeze": 1, "asset": 1, "attendance": 1, "buyer": 1, "double": 1, "illusion": 1, "physicist": 1, "ultimatum": 1, "rex": 1, "argentine": 1, "tale": 1, "highly": 1, "spate": 1, "bombardier": 1, "dash": 1, "smoke": 1, "dodd": 1}, "tweets": "Maurice Robinson, 25, charged with manslaughter over deaths of 39 people found in trailer in Essex, police say https://t.co/AGd5gMJ72Q England through to Rugby World Cup final, with 19-7 win over New Zealand, eliminating All Blacks hope of a third consecutive World Cup victory\n\nhttps://t.co/aNrUtjB05o https://t.co/UzMScj8KJD Russian serviceman shoots dead eight fellow soldiers and injures two more on base in Siberia, officials say https://t.co/tYC8FQ4SUd Two held on suspicion of manslaughter and conspiracy to traffic people over bodies found in lorry in Essex - police https://t.co/cHrJhdpthl UK PM Boris Johnson says if Parliament \"genuinely want more time to study\" his new Brexit deal, \"they can have it, but they have to agree to a general election on December 12\" \n\nhttps://t.co/pLnhpdlRlm https://t.co/6UldqFjCrM PM says he will give MPs more time to debate Brexit deal but only if they agree to 12 December general election https://t.co/w8lZstR4Jo 39 people found dead in a lorry in Essex were Chinese nationals, it is understood\nhttps://t.co/326AUVV7Rd President Trump announces lifting of sanctions on Turkey after its ceasefire in offensive against Syrian Kurds https://t.co/3Ju6AIu8pV \u201cIn order to ensure we maintain the dignity of the people who have sadly lost their lives, we will be moving the lorry and the trailer\u201d\n\nDeputy Chief Constable Pippa Mills says \u201cthis will be a lengthy inquiry\u201d and \u201cwe are yet to identify\u201d the bodies \n\nhttps://t.co/5yQIACXWce https://t.co/wCbktSUSIx Police believe the lorry, found to be carrying 39 bodies, travelled from Zeebrugge, Belgium to Purfleet\n\nThe vehicle registered in Bulgaria, was found at Waterglade Industrial Park in Grays early this morning\n\nhttps://t.co/4g63DQjGxH https://t.co/dfEmluky82 Police say 39 bodies found in lorry container in Essex - driver has been arrested https://t.co/g5oUDlCfWV UK PM Boris Johnson loses vote on timetable for Brexit bill, meaning government could push for a general election\n\nhttps://t.co/C8OwqNZq0x Brexit bill clears its first hurdle as MPs back the deal by 329 to 299 - but key timetable vote is yet to come https://t.co/9iYO6b2o9D \"If Parliament refuses to allow Brexit to happen... and decides to delay everything until January or possibly longer... the bill will have to be pulled\" - UK PM Boris Johnson confirms he will call a general election if his Brexit bill is rejected\n\nLatest: https://t.co/Du13GDQ1eu https://t.co/jPifpp0mgs No 10 to abandon Brexit bill if MPs vote down timetable for its debate and EU confirms delay https://t.co/TfoocjxsWq In a rare and ancient ceremony, Japan\u2019s emperor formally proclaims his ascent to the Chrysanthemum throne. https://t.co/sEezvPSJlC Justin Trudeau's Liberal Party is set to retain power but as a minority government, according to projections by Canada's national broadcaster, CBC News\nhttps://t.co/94iEWBOnbe \"Today's motion is in substance the same as Saturday's motion and the House has decided the matter, today's circumstances are in substance the same as Saturday's circumstances\" - Speaker says it would be \"repetitive and disorderly\" to vote on Brexit deal\n\nhttps://t.co/7nLQlraJ6y https://t.co/rfdatG08pP Government attempt to give MPs new vote on Brexit deal on Monday rejected by Speaker https://t.co/vfCKBqd8oV Thailand's King Vajiralongkorn strips his royal consort of her titles and military ranks for disloyalty https://t.co/jvGZgCfLOu RT @BBCSport: Former professional footballers are three and a half times more likely to develop dementia than people of the same age range\u2026 RT @bbcrugbyunion: FT: Japan 3-26 South Africa\n\nIt has been a wonderful tournament for the host nation, but it ends here. South Africa prog\u2026 Two 17-year-old boys die after stabbing in Milton Keynes, Thames Valley Police say https://t.co/fjEhbBvRlM RT @bbcrugbyunion: FT: Wales 20-19 France\n\nThey trailed for almost the entire game, but took the lead when it mattered! Wales through again\u2026 Cabinet minister Michael Gove insists UK will leave EU by 31 October, despite government letter asking for extension https://t.co/1XXjLKOo1M Boris Johnson will send letter to EU by 00:00 BST to request a Brexit delay, but he will not sign it - No 10 source https://t.co/7VSWMrBeED \u201cI welcome today\u2019s vote \u2013 it's an emphatic decision by this House that has declined to back the prime minister\u2019s deal today\u201d\n\nLabour leader Jeremy Corbyn says the PM must \u201cnow comply with the law\u201d\n\nLive updates: https://t.co/Nf6SfLAeRC\n#BrexitDebate https://t.co/xnNLFrlX8W Boris Johnson says the opportunity to have a meaningful Brexit vote \"has been passed up\"\n\nUK PM says he's not \"daunted or dismayed\" by MPs backing Letwin amendment, saying he \"will not negotiate a delay to Brexit\"\n\nhttps://t.co/VAzJ7IQqgO #BrexitVote https://t.co/Z8yqI2Uxgy UK PM Boris Johnson says he will put bill on deal to leave EU to MPs next week, in attempt to avoid delay https://t.co/vGdIhuzoKo In new setback for Boris Johnson, MPs back move to delay Brexit deal until necessary legislation passed \n\n#BrexitDebate \n\nhttps://t.co/ImQiQVC6mg https://t.co/zQOuAmCDNT RT @bbcrugbyunion: FT: New Zealand 46-14 Ireland\n\nSublime, superior - pick your own superlative for that @AllBlacks performance. They've cr\u2026 RT @bbcrugbyunion: FULL TIME! England 40-16 Australia \n\nEngland are the first to book a place in the semi-finals of #RWC2019 after a suprem\u2026 Turkey agrees to pause operation in northern Syria to let Kurdish-led forces withdraw - US Vice-President Mike Pence https://t.co/Z2yi5IPMRS One of President Trump's golf resorts in Florida will host the G7 summit next June, White House announces https://t.co/hinqUzwW8J Irish PM Leo Varadkar says the backstop has been replaced in the revised #BrexitDeal - adding it's a \"unique solution, one that recognises the unique history and geography of Northern Ireland\" and an agreement that \"could become permanent\"\n\nLive updates: https://t.co/3aRuaeZozT https://t.co/xP109LoGIB #BrexitDeal ensures \"integrity of single market\" &amp; allows us to avoid \"chaos and atmosphere of conflict between EU &amp; UK\" - President of the European Council Donald Tusk adds \"door will always be open\" for UK return to EU\n\nLive updates: https://t.co/3aRuafgZrr https://t.co/xwKqY2O4ee \"We have a deal so why should we have a prolongation?\"\n\nEU Commission President Jean-Claude Juncker says there is no need to extend the Brexit deadline, after UK and EU reach new #BrexitDeal \n\nLatest: https://t.co/0i3FYxauDg https://t.co/hBEZRFmUfx Former England international footballer Paul Gascoigne cleared of sex assault on train - jury still considering lesser charge https://t.co/1Ci9502dgM \"For me, since day one, what really matters are the people, the people of Northern Ireland and Ireland, what really matters is peace\" - Michel Barnier outlines the four key points in Brexit negotiations involving the island of Ireland\nLatest: https://t.co/0i3FYxs5uO https://t.co/vZwps8G88l \"The EU and the UK were fully committed to protect peace and stability on the island of Ireland\" - EU chief negotiator Michel Barnier says Brexit discussions \"have been difficult, but we have delivered\"\n\nhttps://t.co/XDLy5AR6iD https://t.co/Dd5MWVYHSj European Commission president Jean-Claude Juncker says Brexit deal is a \"fair and balanced agreement for the EU and the UK\" \n\nhttps://t.co/FZGarqZUOZ PM Boris Johnson says the UK and EU have agreed \"great new deal\" for Brexit https://t.co/D9Asukjk9Q Elijah Cummings, veteran US Democratic congressman heavily involved with Trump impeachment inquiry, dies at 68 https://t.co/FVz0eQno6a Hong Kong leader's 'state of the union' address dissolves into chaos as legislators protest https://t.co/MNqjqr3LIW President of Bulgaria Football Union resigns following racist abuse of England players during Euro 2020 qualifier in Sofia https://t.co/MmybwYSAIr Margaret Atwood &amp; Bernardine Evaristo named joint winners of #BookerPrize2019 after the judges break rules by declaring a tie https://t.co/OLSXSPot76 One of the UK's most prolific paedophiles, Richard Huckle, has been found stabbed to death in prison https://t.co/DqogNGN7Y9 Spanish court gives nine Catalan politicians and activists long jail terms for roles in 2017 independence referendum https://t.co/M4rqG0bgRy RT @BBCSport: Kenya's Brigid Kosgei has broken the 16-year-old women's marathon word record held by Britain's Paula Radcliffe as she retain\u2026 Kenyan Eliud Kipchoge becomes the first athlete to run a marathon in under two hours, completing the 26.2 miles in 1:59:40\n\nhttps://t.co/u4WDHVKOA1 https://t.co/MUfJmCJFjA Police say man held following knife attack in Manchester has been arrested on suspicion of terror offences https://t.co/QqICDjMe09 Man in his 40s arrested on suspicion of serious assault after several people stabbed at Arndale shopping centre in Manchester, police say there have been no fatalities\n\nhttps://t.co/KeahjZN7i7 Four people injured after reports of stabbings at the Arndale shopping centre in Manchester https://t.co/z4jwZPFFz6 Ethiopia's prime minister Abiy Ahmed - who made peace with bitter foe Eritrea - wins Nobel Peace Prize https://t.co/J4pIewThaF Nobel Prize for Literature for 2018 and 2019 given to Polish writer Olga Tokarczuk and Austrian writer Peter Handke https://t.co/EHgF0cGnKs Turkish forces step up air strikes and ground offensive, as their incursion into Kurdish-held areas of northern Syria enters second day https://t.co/d4KGDUEs4V RT @BBCSport: World Rugby has confirmed that England's World Cup match against France has been cancelled because of Typhoon Hagibis.\n\nRead:\u2026 Turkish troops are starting their ground offensive in northern Syria after earlier air and artillery strikes, says defence ministry\n\nhttps://t.co/VsheIidMn0 https://t.co/MZIx7LgfB1 Turkish troops enter northern Syria, says President Erdogan, setting up a potential clash with Kurdish-led forces https://t.co/d7AAd579iO German police say one person has been arrested and they are working to \"stabilise the situation\"\n\nhttps://t.co/xTixPJLDMt At least two people shot dead in eastern German city of Halle, police searching for suspect https://t.co/tW6tazX2Ql Scottish judges delay decision on whether court can sign Brexit extension letter on behalf of UK prime minister https://t.co/Hnpl8JBugV All 555 Thomas Cook stores to be bought by rival Hays Travel in a move that could save up to 2,500 jobs https://t.co/y5qPlVjdfL White House tells US Democratic leaders it will not co-operate with impeachment inquiry, paving way for constitutional clash with Congress https://t.co/VQvQjRTBQ2 Legal action aimed at forcing UK PM Boris Johnson to send letter asking for Brexit extension dismissed, by Scottish court \n\nhttps://t.co/oqjuHb5N4r White House says Turkey to begin Syria operation soon, with US forces no longer in the immediate area https://t.co/szRfFje3Of Second whistleblower comes forward in the impeachment inquiry into US President Donald Trump, lawyers tell US media https://t.co/Qo07oYoIrO Prince Harry begins legal action against owners of the Sun and Daily Mirror, in relation to alleged phone-hacking https://t.co/k5oH2rfgdY Former Tory MP Rory Stewart to stand as an independent Mayor of London candidate https://t.co/ziN97aGBJf Former Tory leadership contender Rory Stewart to leave Conservative party and will not stand at the next election https://t.co/1HX06DVCp6 Hong Kong\u2019s chief executive uses a colonial-era emergency law to ban face masks https://t.co/JWTXAZS768 Reports suggest attacker, shot dead by police in Paris, is member of staff\nhttps://t.co/lDodg6e4pI https://t.co/LuOXM8u4B9 A knife-wielding attacker kills four police officers at police HQ in Paris, before being shot dead\nhttps://t.co/erNE1mWAuh Man shot dead by police after attacking officers with a knife in central Paris, French media say\n\nhttps://t.co/VcoFa8tSV1 Northern Ireland's abortion law breaches UK's human rights commitments, High Court in Belfast rules https://t.co/JQIXPKIskl Leading US Democratic presidential candidate Bernie Sanders, 78, cancels events after surgery for artery blockage https://t.co/F2J30uPL1J UK publishes #Brexit proposals to the EU, including plans to replace the Irish backstop with an \"all-island regulatory zone\" https://t.co/ktzbhR9qaV Former BBC and ITN newsreader, and Question Time presenter, Peter Sissons has died aged 77, his agent says https://t.co/QfZev7hUVm RT @BBCPolitics: UK PM Boris Johnson says he will table \"constructive and reasonable proposals\" on Brexit today, pledging \"we will under no\u2026 \"I lost my mother and now I watch my wife falling victim to the same powerful forces\"\n\nPrince Harry says he and Meghan, the Duchess of Sussex, are suing the Mail on Sunday newspaper over the publication of a letter written by the duchess \n\nhttps://t.co/Iihzec0OOw US ex-policewoman who shot dead her neighbour inside his Dallas flat found guilty of murder https://t.co/Yrz3EqbpSM Protester in Hong Kong shot in the chest by live bullet, police source confirms to BBC, as thousands defy protest ban in territory on communist China's 70th anniversary\n\nLatest: https://t.co/abfzeMl4zj https://t.co/G4ZzEVy7Yn A huge military parade begins in Beijing to celebrate 70 years of communist rule in China. Follow our live updates https://t.co/gRpvXbTTdP BBC reverses decision to partially uphold complaint against presenter Naga Munchetty over comments on racism https://t.co/t8vwVveDo3 Cardiff City told to pay transfer fee of 6m euros (\u00a35.3m) to Nantes for Emiliano Sala, the player who died in plane crash in January while travelling to join his new club https://t.co/SmRLo6MFrN Jihadists attack military base where US soldiers train commandos in Somalia, causing casualties - reports https://t.co/syEKZfyZmY Conservative Sebastian Kurtz's party on track to win Austrian election with more than third of vote - exit polls https://t.co/TyPUvTfMKl RT @BBCSport: Wales have done it! \n\nThey have beaten Australia at the Rugby World Cup.\n\nAustralia 25-29 Wales\n\nhttps://t.co/QKt4Pq7QOj #bbc\u2026 UK PM Boris Johnson says there was \"no interest to declare\" regarding links with US businesswoman Jennifer Arcuri https://t.co/IxyyWYmrO8 RT @BBCSport: FT: Japan 19-12 Ireland\n\nThe hosts have pulled off a huge shock to beat Ireland!\n\nReaction: https://t.co/vBwGOHtm3O\n\n#RWC2019\u2026 Three years after her murder, the brother of Pakistani social media star Qandeel Baloch is jailed for life. https://t.co/LUX5jHp7Xp White House officials tried to \"lock down\" transcript of Trump controversial call to Ukraine leader - whistleblower https://t.co/4AM0OSVtvj Obituary: Jacques Chirac, the two-term French president who championed the EU\n\nhttps://t.co/Lz9wy3bbbi https://t.co/JZ5gMGgZ4H Princess Beatrice's engagement to Edoardo Mapelli Mozzi announced by her parents, the Duke and Duchess of York https://t.co/bACF987Rgl Jacques Chirac, former French president whose later years were blighted by corruption scandals, has died aged 86 https://t.co/JyyWamOBsg Details of a controversial phone call at the centre of President Trump\u2019s impeachment inquiry are released https://t.co/ZpHEACAzmE US Democrats have opened a formal impeachment inquiry into President Trump over claims that he sought political help from Ukraine\n\nLatest developments: https://t.co/6N4Syut5t9 https://t.co/1nzCvoC0VN Formal impeachment inquiry into President Trump to be launched by Democrats - US media reports https://t.co/TLF8SKMsBw UK PM Boris Johnson says he \"strongly disagrees\" with #SupremeCourt's ruling that suspending Parliament was unlawful, but the government will \"respect\" it\n\nLatest developments: https://t.co/GRKCPnShgG https://t.co/3z6d4VaaDH PM Boris Johnson tells BBC the government will respect Supreme Court ruling that suspending Parliament was unlawful https://t.co/R2ny7wvDxr \"Parliament has not been prorogued. This is the unanimous judgement of all 11 justices\"\n\nUK Supreme Court President Lady Hale QC says \"it is for Parliament... to decide what to do next\" after suspension is ruled unlawful \n\nLatest: https://t.co/bAeCN3kLLP https://t.co/OsvF3NPRag UK Supreme Court President Lady Hale QC says UK PM Boris Johnson's suspension of Parliament was unlawful as it \"had the effect of frustrating or preventing Parliament from carrying out its constitutional functions\"\n\nhttps://t.co/bAeCN3kLLP https://t.co/rgBsdm1IkV Spanish dictator Francisco Franco's family loses divisive fight to keep his remains in state mausoleum https://t.co/9SGaeW9H69 UK PM Boris Johnson's decision to suspend Parliament for five weeks was unlawful, Supreme Court rules https://t.co/loqFdu2Wym National Crime Agency finds \"no evidence\" of criminal offences, after allegations against https://t.co/lIwX8ijk7p and Arron Banks https://t.co/PPVGtqZLJJ Google does not have to apply the \"right to be forgotten\" across world, Europe's top court rules https://t.co/ZFlqoN2ZET Man held on suspicion of attempted murder after two Sussex police officers hit by car https://t.co/zWUr0bsvy8 Tour operator Thomas Cook collapses after last-ditch rescue talks fail, putting 9,000 UK jobs at risk, CAA confirms https://t.co/ZJ26gIUe7i Labour's Tom Watson tells BBC a bid to oust him as deputy leader is a \"sectarian attack\" on party's \"broad church\" https://t.co/CWCvWK4hkL Canada's PM Justin Trudeau admits he can't remember how often he wore blackface, as row deepens ahead of election https://t.co/hG09CHbPAN Supreme Court hearing on whether UK PM's suspension of Parliament was lawful ends - decision due \"early next week\" https://t.co/EsvLn6lIb3 David Cameron's remarks on Queen and Scottish vote led to 'an amount of displeasure' at the Palace, source tells BBC https://t.co/muLPmyj7Pk Pilot of Belgian F16 has now been safely taken down from high-voltage line in France, which he had got stuck in after ejecting from the plane https://t.co/WZkimm37Ha Pilot of Belgian F16 jet stuck on high-voltage line after ejecting from plane in western France https://t.co/w30XsfrW3D Photo shows Canadian PM Justin Trudeau in brownface at private school gala in 2001 - Time magazine report https://t.co/3HiGEt91uT Saudi Arabia displays drone and missile debris, which it says show oil attacks \u201cunquestionably sponsored by Iran\u201d https://t.co/h6KfO6OwSN Three teenagers charged with murder of PC Andrew Harper, who was killed on duty in Berkshire, UK prosecutors say https://t.co/NDLoW30dPG President Trump names Robert C O'Brien as new National Security Adviser, replacing John Bolton who was fired last week\n\nhttps://t.co/C3IE5zBcQv Fire breaks out in boarding school outside Liberian capital Monrovia, killing at least 23 children https://t.co/2uE3wrnJ5F US officials say they have identified the locations in Iran from where drones and missiles were launched against Saudi oil facilities on Saturday\n\nhttps://t.co/wuQxdqpxn8 https://t.co/7Ckc5093Hz American Sarah Thomas, 37, becomes first person to swim the English Channel four times non-stop https://t.co/ImPDKuNuCM Oil prices surge amid nerves over the impact on global supplies of Saturday's attack on Saudi oil facilities https://t.co/sxI8rvfzGQ England win final Test at the Oval by 135 runs to draw Ashes series 2-2; Australia retain the urn https://t.co/nhio63uCfg RT @BBCSport: WOW, WOW, WOW.\n\nThe United States needed half a point to retain....\n\n... Europe won all three of their final matches to regai\u2026 Lib Dem members vote to cancel #Brexit if they win a majority at the next UK general election \n\nhttps://t.co/MIisSAe1qo RT @BBCSport: What a fight!\n\nTyson Fury is pushed to the final bell and defeats Otto Wallin on points. \n\nReaction on @5liveSport \nand @BBCS\u2026 Saudis cut oil and gas production after drone attacks, with possible consequences for world prices https://t.co/moIXwXsVjD Ex-Conservative MP Sam Gyimah defects to the Liberal Democrats https://t.co/Wa7lUsmU41 Yemen's Houthi rebels say they were behind overnight attacks on Saudi oil facilities, using 10 drones https://t.co/oCkWT6ZbLo US actress Felicity Huffman sentenced to 14 days in prison after paying $15,000 (\u00a311,500) to have her daughter's exam answers secretly corrected in 2017\n\nhttps://t.co/2QDTfPiZd6 Boris Johnson\u2019s suspension of UK Parliament is unlawful, judges at Scotland\u2019s highest civil court rule https://t.co/TRsc5jWvpJ President Trump sacks John Bolton, saying he disagreed with many of the US national security adviser's suggestions https://t.co/kHuAUztQmf Israeli PM Netanyahu makes controversial pledge to annex Jordan Valley in occupied West Bank if re-elected next week https://t.co/ft7GKSA7IZ Brexit crisis: UK PM Boris Johnson fails for second time to get MPs' backing for early general election https://t.co/sWbPOLJGL3 MPs vote to force ministers to publish correspondence over suspending Parliament, and no-deal Brexit planning papers https://t.co/NHr91Rj8xo John Bercow says he will stand down as Commons Speaker at next election or on 31 October, whichever comes first https://t.co/TtQitRcqqg UK Parliament will be suspended from the end of Monday's sitting until 14 October, Downing Street confirms\n\nhttps://t.co/AHZIGTrsQz https://t.co/hkAxwC6nh3 Australia retain Ashes with 185-run win over England on tense final evening of fourth Test at Old Trafford https://t.co/ZQ4c8LJKy3 Donald Trump calls off Afghan peace negotiations with Taliban, after US soldier was killed in Kabul attack https://t.co/WIEPaDtWYQ RT @BBCSport: A fairytale of New York.\n\nTeenager Bianca Andreescu has beaten 23-time Grand Slam winner Serena Williams in the Women's #USOp\u2026 UK Work and Pensions Secretary Amber Rudd resigns from government, saying she cannot stand by while loyal Conservatives are expelled https://t.co/xzcyJDc9TN UK's House of Lords approves legislation aimed at blocking a possible no-deal #Brexit \n\nhttps://t.co/fX9d9SZx0v https://t.co/pUFlxxedCd Labour and other UK opposition parties agree not to back PM\u2019s demand for general election before October EU summit https://t.co/PPI9pBxi5C Challenge to UK PM Boris Johnson's decision to suspend Parliament rejected, London's High Court says https://t.co/k94xzQ8hxE Robert Mugabe, Zimbabwe's first post-independence leader, dies at the age of 95 https://t.co/oiTAYrTl3S Jo Johnson, brother of UK PM, quits as Tory MP and minister saying he is \"torn between family and national interest\" https://t.co/uLtbw0I80L Despite claims peers would hold up bill ruling out no-deal Brexit, the Tories and Labour struck agreement overnight. https://t.co/1VJGyhasSz Boris Johnson says Jeremy Corbyn is the first leader of the opposition to \"refuse the invitation to an election\", after the prime minister fails to get the support of MPs for an early poll\n\nLatest: https://t.co/WRnFuywh25 https://t.co/U41S8Tf8wc Boris Johnson fails to get MPs' backing for an October general election, after a day of #Brexit debate\n\nLatest: https://t.co/WRnFuywh25 https://t.co/7e6vlYLi8O Boris Johnson says the only way forward is an early election after MPs back law aimed at blocking a no-deal Brexit https://t.co/T2oG8wnRA2 #Brexit delay bill, aimed at blocking no deal, is approved by UK MPs by 327 votes to 299\n\nThe bill now passes to the House of Lords\n\nLatest: https://t.co/W1z2SZj0iD UK MPs vote by 329 to 300 to back a bill aimed at blocking a no-deal #Brexit on 31 October\n\nLatest updates: https://t.co/h8f6Lp8ChV https://t.co/g8WqRUrKAa Hong Kong's leader bows to a key demand of protesters, saying she will fully withdraw contentious extradition bill https://t.co/oFORu73ORA Boris Johnson\u2019s plan to suspend UK Parliament ahead of Brexit deadline is lawful, judge in Scotland rules https://t.co/VS7G8WdsOV \"He wants to table a motion for a general election \u2013 fine. Get the bill through first, in order to take no deal off the table\"\n\nJeremy Corbyn says Labour will back an election once a no-deal #Brexit is ruled out in law\n\nLatest: https://t.co/4U5EQ2Yqno https://t.co/WVI4oMm8JE Boris Johnson says he will ask MPs to approve an early general election, if they vote on Wednesday to block a no-deal #Brexit\n\nLatest: https://t.co/0e7bItzoW1 https://t.co/RtZhu5N4Kp Boris Johnson loses key Brexit vote as MPs opposed to no deal take control of House of Commons business https://t.co/AaS8wQLssI Brexit: MPs against no deal clear first hurdle in attempt to seize control of Commons agenda \u2013 follow debate live https://t.co/02Pha2ckgf Tory MP Phillip Lee defects to Lib Dems, leaving UK government with no working majority in Commons https://t.co/EGHDNIoTte HS2 rail link's first phase faces delay of up to five years as costs rise to more than \u00a380bn https://t.co/2oHC2V6hz5 UK PM Boris Johnson says he doesn't want a general election and urges MPs not to vote for \"another pointless delay\" #Brexit \n\nhttps://t.co/YigRKmjhkJ UK PM Boris Johnson expected to speak outside Downing Street to set out choices facing MPs\n\nLatest: https://t.co/fUkwVPKJKF https://t.co/kGyRldAMES Major rescue operation under way in California after fire on a boat with more than 30 people on board https://t.co/g5sqgqFXHV Hurricane Dorian is upgraded to a category five storm, just as it is about to make landfall in the Bahamas https://t.co/q2oR8bjJQX A mass random shooting in the Texas city of Odessa has left 'multiple gunshot victims', local police say https://t.co/i6BJPeGXmQ Twitter co-founder Jack Dorsey's account hacked - retweets flurry of highly-offensive messages https://t.co/Ls5kEFitlW Judge refuses to order temporary halt to Boris Johnson's plan to suspend UK Parliament, ahead of full hearing https://t.co/MfcDdL5rEP Ruth Davidson MSP announces she is stepping down as leader of the Scottish Conservatives\n\nhttps://t.co/U5Flssoycj Italy's populist Five Star agrees coalition deal with centre-left PD in blow to the far-right League https://t.co/e37Lzh1Mco RT @BBCSport: Bolton Wanderers' survival has been secured after Football Ventures (Whites) Limited complete its protracted takeover of the\u2026 Ruth Davidson on verge of quitting as leader of Scottish Conservatives, BBC Scotland understands https://t.co/SgW0xVrJss The Queen approves order to suspend UK Parliament from early September to 14 October - just before Brexit deadline https://t.co/6OLmWNavwa Government expected to suspend Parliament from mid-September, meaning MPs have limited time to stop no-deal Brexit https://t.co/6QDIT1IfgY RT @BBCSport: League One side Bury have been expelled from the English Football League.\n\nFull story \u27a1 https://t.co/q9758VDEi1 #BuryFc #bbcf\u2026 In one of the greatest Ashes matches of all time, England beat Australia by one wicket in the third test \ud83c\udfcf\n\nhttps://t.co/lTmaDYIAq7 https://t.co/35GamCqzY5 Boris Johnson tells BBC News the chances of the UK leaving the EU without a deal are now \"touch and go\" https://t.co/S9Wtrms7tl British Airways admits it emailed passengers \"in error\" when it advised them their flights were cancelled https://t.co/LZktzJryGO Prince Andrew says \"at no stage\" did he \"see or suspect\" type of behaviour that led to Jeffrey Epstein's conviction https://t.co/zUsRobC0mm Simon Cheng, UK consulate worker from Hong Kong detained in mainland China, is released, his Facebook page says https://t.co/0Jz19BRHBQ British Airways pilots to strike on 9, 10 and 27 September in dispute over pay, union Balpa says https://t.co/3EpBjhdEqT Police confirm body of young boy found in the River Stour in Kent is that of six-year-old Lucas Dobson https://t.co/wEzxLRn4LJ US moves to abolish migrant custody limits so children can be detained indefinitely https://t.co/5czR7E7e9h High Court in Dublin approves bid by Ryanair to stop proposed Ireland-based pilot strike on Thursday and Friday https://t.co/nDHTIAJ3u4 Body found by police searching for six-year-old Lucas Dobson, who fell into the River Stour in Kent on Saturday https://t.co/avGb8RrVFO Government to review high-speed rail link HS2 - with a \u201cgo or no-go\" decision by the end of the year https://t.co/6MxieoWMv9 After a blistering attack on coalition partner Matteo Salvini, Italy's prime minister says he will resign https://t.co/PfWhepMmYS Man charged with murder of police officer Andrew Harper, killed while investigating a burglary in Berkshire https://t.co/YTEHd87i2d Kabul wedding bomb blast - 63 killed, 182 injured in Saturday's attack, interior ministry says https://t.co/9P6mN0FL7a PC Andrew Harper died of \"multiple injuries\", UK police say, as they are given more time to question 10 suspects https://t.co/WSMlzpzbC5 Youth charged with murder of \"devoted father\" Peter Duncan, who was stabbed in Newcastle on Wednesday https://t.co/b8gebTDfYz Sudan's ruling military council and civilian opposition alliance sign landmark power-sharing deal, after months of protests following toppling of ruler Omar al-Bashir https://t.co/gskkzI43Sn Police officer killed while attending reported burglary in Berkshire, with 10 arrested on suspicion of his murder https://t.co/QCJWb2BlRG Israel bars two US members of Congress and Israel critics Rashida Tlaib and Ilhan Omar, deputy foreign minister says https://t.co/jQljOqKw48 Gibraltar drops legal proceedings against the crew of an Iranian supertanker detained since 4 July https://t.co/3JLonSwD5O Post-mortem results show 'no suspicion of foul play' in death of teenager Nora Quoirin - Malaysian police https://t.co/KythIgt9JH RT @BBCSport: Liverpool add to their Champions League triumph by winning the #SuperCup on penalties.\n\nReaction \ud83d\udc49 https://t.co/OpkPQNpuVp #b\u2026 Footballer Emiliano Sala, who died in a plane crash over the English Channel, had been exposed to high levels of carbon monoxide\n\nhttps://t.co/MoTz8ey0fc US rapper ASAP Rocky found guilty of assault during Stockholm brawl and given suspended sentence https://t.co/VCkQl0Qvwq A body found in the search for a vulnerable girl who went missing on holiday in Malaysia is Nora Quoirin, police confirm\n\nhttps://t.co/kFbjvRsjDq Hong Kong airport suspends flights for a second day because of anti-government protests https://t.co/h4GsRQgVfS Police searching for missing teenager Nora Quoirin in Malaysia say they have found a body. https://t.co/lZgvh62SrO Hong Kong airport cancels flights as anti-government protests at the busy international hub go into fourth day https://t.co/lvnLMCPIXF A shooting at a mosque in Norway is being investigated as a possible act of terrorism, police say https://t.co/o0ZmMA6CZ7 US financier Jeffrey Epstein found dead in his cell while awaiting trial on sex trafficking charges, US media report https://t.co/lfXOylpyPB Utility suppliers confirm nearly one million people affected by UK #powercut tonight\n\n@beisgovuk spokesperson says they're \"in contact with National Grid and Energy Distribution Networks\" adding \"the system has returned to normal\u201d\n\nhttps://t.co/UJc4guLRy9 National Grid says the outage was caused by \"issues with two power generators\" but says the problem has now been resolved\n\nhttps://t.co/DTZ5LMyGs2 Network Rail says trains across large parts of England were stopped after a \"power surge on the National Grid\" but its signalling system has now come back online\n\nhttps://t.co/DTZ5LMyGs2 Major power failures reported across large areas of the UK, affecting trains, airports and traffic lights https://t.co/mUXpE1MyF8 Church warden guilty of murdering an author after attempting to benefit from his will https://t.co/vwNvK8PjYq The UK economy's output fell by 0.2% between April and June, its worst performance since 2012 https://t.co/f5pMP74t3r Man charged with attempted murder and possessing offensive weapon after London attack that injured police officer https://t.co/yz2zDz00Sj UK train companies will stay part of Interrail scheme, reversing Wednesday's decision, operators group says https://t.co/lucje1MuS6 Explosion at military base in northern Russia kills two people and injures six more, officials say https://t.co/5A6tC337zu A policeman stabbed in a \"frenzied\" machete attack in east London will make a recovery, Met Police says https://t.co/ZKJ2r1u8qh Canada police find bodies of two teenage fugitives suspected of three murders, including US-Australian couple https://t.co/CWkdJu2BiD Ryanair pilots vote to strike in row over pay and conditions with union announcing plans for two 48-hour walkouts https://t.co/rUIcNJ0AAu Row over Kashmir deepens as Pakistan downgrades ties with India, expelling high commissioner and suspending trade https://t.co/BJ2FPwXTtH Hundreds of residents of Whaley Bridge, Derbyshire, can return home - six days after a dam alert sparked evacuation https://t.co/5mxS2U9BNa BA cancels almost 100 flights, with more than 200 others delayed due to IT failure https://t.co/uyjDmb9KgH US novelist Toni Morrison, the first African American woman to win the Nobel Prize for Literature, has died aged 88 \n\nhttps://t.co/d63Wlp3Oa9 https://t.co/hoYn7Tdrmk RT @BBCSport: Chelsea's board have apologised \"unreservedly\" after a report found young footballers were targeted for years at the club by\u2026 Tuesday's strike at Heathrow has been cancelled as the union and the airport reach a deal over workers' pay https://t.co/mayuhV4N76 President Trump says US must condemn bigotry, racism and white supremacy, following mass shootings in Texas and Ohio https://t.co/s9sBRqzqQv Indian government announces plans to revoke special status for Indian-administered Kashmir - amid massive protests https://t.co/5Hy8W36ATB Iran seizes another foreign tanker in the Gulf, Iranian state media say https://t.co/DnUP6eDKMn Nine killed and 16 injured in Dayton, Ohio, shooting - second US mass shooting in 24 hours https://t.co/mcFpYrAr4U Flyboarding Frenchman Franky Zapata makes first successful Channel crossing on his jet-powered craft https://t.co/NE3bt9ja3a More than 600 detained in Moscow during unauthorised protest at disqualification of local election candidates https://t.co/GNSVCZprSp The Tories lose Brecon and Radnorshire by-election to the Lib Dems, reducing new PM Boris Johnson's majority to one. https://t.co/bBglQEAn21 North Korea has fired multiple unidentified 'projectiles' off its east coast, according to the South Korean military https://t.co/oYfk0mZUNf Sudan suspends all schools and colleges nationwide amid unrest over killing of student protesters on Monday \n\nhttps://t.co/IJDbnxQ44R Last Thursday's 38.7C in Cambridge confirmed as highest temperature ever officially recorded in UK https://t.co/AVBlDYKZJh Fight between rival gangs in northern Brazilian prison has left more than 50 dead, officials say https://t.co/Q8S6rvYiiv Carl Beech jailed for 18 years for making false allegations of murder and child sexual abuse against public figures https://t.co/1wQ8EjqPGE US government schedules five executions, reversing two-decade lapse in federal use of death penalty https://t.co/dP02DQm3Pa Up to 150 people may have drowned in shipwreck off the coast of Libya, UN refugee agency says https://t.co/tGYR982NSm Tunisia's first freely-elected president Beji Caid Essebsi has died, aged 92, the country's presidency says https://t.co/UZ5SvXF8vk Puerto Rico Governor Ricardo Rossell\u00f3 is to step down after leaked obscenity-laden messages sparked protests. https://t.co/LJzmfFlDwk Dominic Raab named as foreign secretary by UK PM Boris Johnson \n\nFollow live updates: https://t.co/KELeqsDdyw https://t.co/ImaoSI3sZ9 Priti Patel appointed as home secretary by UK PM Boris Johnson\n\nFollow live updates: https://t.co/XkNwEJYXIO https://t.co/WLPGRqoCwN Sajid Javid has been appointed chancellor by UK PM Boris Johnson\n\nFollow live updates: https://t.co/Zuad9Z32t2 https://t.co/S3Q7Q82dRk RT @BBCPolitics: UK Foreign Secretary Jeremy Hunt, Boris Johnson's Tory leadership rival, quits cabinet\n\nLive updates as UK PM appoints top\u2026 Boris Johnson says Brexit \"doubters\" are wrong and UK will leave EU on 31 October, in his first speech as PM https://t.co/lZQ96SBxom RT @BBCPolitics: Boris Johnson has become the new UK prime minister, after his official appointment by the Queen \n\nLive updates: https://t.\u2026 Boris Johnson elected new Conservative leader in ballot of party members and will become UK PM on Wednesday https://t.co/608LPbJI5r Football star Cristiano Ronaldo will not face charges after being accused of rape, US prosecutors say https://t.co/JK80CmiM5N Jo Swinson becomes first female Liberal Democrat leader, after beating Sir Ed Davey in poll of party members https://t.co/PzUtpYUBuK Man found guilty of making false allegations of murder and child sexual abuse against string of UK public figures https://t.co/0WJ6Gelni9 Conservative MP for Dover Charlie Elphicke charged with three counts of sexual assault against two women https://t.co/nnE3zBZw0x India successfully launches Chandrayaan-2 mission to the Moon, where it is due to land in September https://t.co/mBzbE7KLPp RT @BBCSport: He's done it!\n\nIreland's Shane Lowry wins #TheOpen at Royal Portrush.\n\nHis first major title is the stuff of dreams.\n\n\ud83d\udc49 https\u2026 RT @BBCSport: They\u2019ve done it! New Zealand win the Netball World Cup!\n\nAustralia 51 \u2013 52 New Zealand\n\nThey\u2019ve broken Australia\u2019s winning st\u2026 Philip Hammond tells BBC he intends to resign as chancellor to Theresa May if Boris Johnson becomes UK PM https://t.co/iyr8BXJwLY RT @BBCPolitics: \u201cI\u2019m going to resign\u201d \n\nThe chancellor Philip Hammond tells #Marr that he is going to hand in his resignation to Theresa M\u2026 British Airways suspends flights to Egyptian capital Cairo for seven days \"as a precaution\" https://t.co/HAWAuQuVa3 One of the tankers seized in the Gulf has been allowed to continue its journey, after the ship was boarded by armed guards, the tanker's operator said https://t.co/LT5I2Xahhw UK Foreign Secretary Jeremy Hunt says he is \"extremely concerned\" by the seizure of two tankers by Iran \u2013 one British flagged, one British owned https://t.co/LT5I2Xahhw British-flagged oil tanker has been seized in the Gulf by Iranian Revolutionary Guard, Iran media say https://t.co/92V0o6m8Tv James Goddard, 29, who shouted abuse at MP Anna Soubry outside Parliament admits public order offences in court https://t.co/HsKgBfju3X Strong earthquake shakes Athens, knocking out telecoms and power in parts of the Greek capital https://t.co/jrz3ffjBex Fourteen people injured, some seriously, after two cars are involved in a collision in Stevenage, Hertfordshire https://t.co/uI9EEmiqgx Iran says a \u201cforeign tanker\u201d it detained has been smuggling oil \u2013 but it hasn't yet been confirmed it's the same vessel Iran says it gave assistance to on Sunday\nhttps://t.co/hYS67To3Pj RT @BBCPolitics: MPs vote to block the next UK PM shutting down Parliament in order to push through a no-deal #Brexit, by 315 votes to 274\u2026 Iran says foreign oil tanker it gave assistance to in the Gulf on Sunday has been impounded for smuggling oil https://t.co/hg6a8EYuNO Suspected arson attack at top Japan anime studio leaves at least 10 dead, police say https://t.co/obgUQoVF1S Ebola crisis in DR Congo is a public health emergency of international concern, WHO says, after more than 1,600 die https://t.co/O3ePdTTcIt Manchester bomber's brother, Hashem Abedi, arrested for murder after being extradited to the UK from Libya https://t.co/ws63Pj4Bkf Iraqi Kurdistan attack: Reports now say one Turkish diplomat was among two people killed https://t.co/pCRY7OLJ4R Mexican drug baron El Chapo is sentenced to life in prison plus 30 years by a US court https://t.co/Lz3GHm02e3 Three Turkish diplomats shot dead at restaurant in Iraqi Kurdish city of Erbil, security sources tell the BBC https://t.co/jPpvY7KAwu Sudan's ruling military council and opposition leaders sign power-sharing accord after all-night talks to end crisis https://t.co/8SH0XXYfHA EU Parliament narrowly approves Ursula von der Leyen as new head of European Commission https://t.co/L2ixOYZ3a2 The three London Bridge attackers, who killed eight and injured 48 in 2017, lawfully killed by police, inquest says https://t.co/IZkbYC2MzP The four US congresswomen attacked by President Trump in a series of racially charged tweets, dismiss his remarks as a distraction \n\nhttps://t.co/qMkkJFmA70 President Trump redoubles attack on Democratic congresswomen, accusing them of \"hating our country\" https://t.co/089gYZz4QL Alan Turing, World War Two codebreaker and mathematician, will be the face of new Bank of England \u00a350 note https://t.co/YpRMivamd2 RT @BBCSport: ENGLAND HAVE DONE IT!\n\nAn incredible game. It went down to A SUPER OVER and they held their nerve to get it done. We have nev\u2026 RT @BBCSport: HE\u2019S DONE IT!\n\nAN INCREDIBLE WIN FOR NOVAK DJOKOVIC!\n\nTHE #WIMBLEDON CHAMPION RETAINS HIS TITLE!\n\nFIVE TIMES!\n\ud83c\udfc6\ud83c\udfc6\ud83c\udfc6\ud83c\udfc6\ud83c\udfc6\n\n7-6 1-6\u2026 RT @BBCSport: Lewis Hamilton wins the #BritishGP for the SIXTH time \ud83c\udfc6\ud83c\uddec\ud83c\udde7\n\nAnd it's into the history books for the most victories in British\u2026 Storm Barry strengthens to hurricane with sustained winds of 75mph (120km/h) as it closes in on Louisiana coast https://t.co/mSjszB1txk RT @BBCSport: She's done it! \ud83d\udc4f\ud83d\udc4f\ud83d\udc4f\n\nSimona Halep beats Serena Williams 6-2 6-2 to win her second Grand Slam and first #Wimbledon title.\n\nLive\u2026 Powerful X-ray telescope which will help scientists map the cosmos lifts off from Baikonur, Kazakhstan https://t.co/typWQT16D3 UK police launch criminal investigation into leak of diplomatic emails which were critical of Trump administration https://t.co/3UcBGV3aeN RT @BBCSport: Game, set, match: Roger Federer \u2705\n\nHe's beaten Rafael Nadal 7-6 1-6 6-3 6-4.\n\nAn incredible performance \ud83d\udc4f\n\nLive reaction @BBC\u2026 I underestimated MPs' \"entrenched\" views on Brexit, says Theresa May, in her final BBC interview as prime minister https://t.co/q9vOokYmDa RT @BBCSport: Novak Djokovic is into his SIXTH #wimbledon final!\n\nThe defending champion beats Roberto Bautista Agut 6-2 4-6 6-3 6-2.\n\nHe'l\u2026 US Labor Secretary Alex Acosta resigns amid pressure over his brokering of plea deal for financier Jeffrey Epstein https://t.co/KuINl3fJkW Man who stabbed a passenger to death in a row on a train found guilty of murder https://t.co/7sewUhNoSm Former Blue Peter presenter John Leslie charged over sexual offence in December 2008, Scotland Yard says https://t.co/tzdHWpyEPS The Trump administration abandons attempts to add a question on citizenship to the 2020 US census questionnaire https://t.co/LKKOSGb1JU RT @BBCSport: ENGLAND HAVE DONE IT! \n\nAn eight wicket win over Australia puts them into Sunday's final against New Zealand. \n\nA dominant di\u2026 RT @BBCSport: Serena Williams has absolutely stormed into the #Wimbledon final!\n\nShe's beaten Barbora Strycova 6-1 6-2.\n\nLIVE @BBCOne\n\ud83d\udc49 htt\u2026 Stephen Yaxley-Lennon, known as Tommy Robinson, jailed for nine months at Old Bailey over contempt of court https://t.co/A2BTevpfZV The US says it is concerned French plans to impose a 3% tax on tech giants unfairly targets US companies https://t.co/ZuSwxuC2il Top Labour figures interfered in anti-Semitism disciplinary process, ex-party officials tell BBC's Panorama https://t.co/bxC6HjOlJB RT @bbctms: WICKET!\n\nNew Zealand are into the World Cup final! \n\nIndia all out for 221. \n\nLive \ud83d\udc49 https://t.co/llEjudI63g\n#INDvsNZ #bbccrick\u2026 Sir Kim Darroch resigns as UK ambassador to US amid row over leaked emails critical of Trump administration https://t.co/fusix2CYzu US billionaire Ross Perot, who twice ran for president as an independent, has died aged 89, his family says https://t.co/DANwoWTgcP President Trump renews attack on UK ambassador Darroch over leaked emails, saying \"we will no longer deal with him\" https://t.co/vldRtENnC2 Congolese militia commander Bosco \"The Terminator\" Ntaganda found guilty of war crimes including rape and murder https://t.co/l6O6pPu2QZ British Airways fined \u00a3183m over a customer data breach last year https://t.co/kihxoXHBzF RT @BBCSport: That's number four! \n\nThe #USA are the Women's World Cup winners 2019.\n\nThey have beaten the Netherlands 2-0 in Lyon to win t\u2026 Centre-right New Democracy party on course to win Greek general election, exit polls suggest https://t.co/aE38FmNO7Z Foreign Office launches inquiry into leak of UK ambassador's memos which criticised the Trump administration https://t.co/FYqWTVXEMn Iran announces new breach of 2015 international nuclear deal, pushing uranium enrichment beyond permitted level https://t.co/ribTfOhSvT France and Iran have agreed to look at conditions for resuming talks on the nuclear dispute, President Macron says https://t.co/vKxXhf3oOX RT @BBCSport: FT: England 1-2 Sweden \n\n#SWE have finished third at the #FIFAWWC, the #Lionesses will have to settle for fourth place. \n\n\u27a1 h\u2026 Ship carrying 41 rescued migrants arrives in Italian port despite a ban on it doing so, defying Italy's government https://t.co/2pRdWCBLk4 Ex-English Defence League leader Tommy Robinson found guilty of contempt of court over Facebook broadcast https://t.co/51hdCRnw0J Racing pundit John McCririck, who for many years was the face of British horse racing, has died at a London hospital aged 79\n\nhttps://t.co/EVI0lOB4pO RT @BBCSport: \ud83d\udea8 THE DEFENDING CHAMPION IS OUT\ud83d\udea8\n\nFrom a set up, Angelique Kerber loses to Lauren Davis 6-2 2-6 1-6 \n\nThe  women's #wimbledon\u2026 William Hill plans to close about 700 betting shops across the UK, putting 4,500 jobs at risk https://t.co/7wUwE0nUwP RT @BBCSport: Frank Lampard is the new Chelsea head coach.\n\nIn full: https://t.co/g89wiFLsHx\n\n#ChelseaFC #bbcfootball https://t.co/MoCOs088\u2026 Australian Alek Sigley who went missing in North Korea is \"released and safe\", Australian PM confirms. https://t.co/5xhFmvgwZm RT @BBCSport: FT Netherlands 1-0 Sweden\n\nThe Netherlands are into their first ever Women's World Cup final! \ud83d\udc4f\ud83c\uddf3\ud83c\uddf1\n\nLive reaction @BBCOne \ud83d\udc49 ht\u2026 China's ambassador to the UK summoned to the Foreign Office following \"unacceptable\" Hong Kong comments https://t.co/7bcWPreZNk Police probing Suzy Lamplugh's disappearance 33 years ago search land in Worcestershire after \"new information\" https://t.co/Sr8HjVbV8l Rahul Gandhi resigns as leader of India's main opposition Congress party, ending weeks of speculation https://t.co/bXipRZFIKV Two people have died after being struck by a train in South Wales https://t.co/Z74Lu8olY8 Boy delivered after mother stabbed to death in south London on Saturday has died in hospital, police say https://t.co/v1he8T77wF RT @BBCSport: FT: England 1-2 USA\n\nThe journey has come to an end for England at the semi-final stage as holders #USA book their place in t\u2026 Ursula von der Leyen is first woman nominated to lead European Commission, after days of wrangling over top EU jobs https://t.co/CoorhoYL2q Fourteen killed in fire on board Russian submersible vessel in the Northern Barents Sea, Russian media report https://t.co/dFCrE3y5uC Protesters tie British colonial flag to podium in Hong Kong's legislature and spray graffiti on walls, after smashing their way into main government building \n\nhttps://t.co/QdTmAPgpGB https://t.co/CAlI2Skvtg Hong Kong protesters overrun parliament chamber after storming main government building https://t.co/dV7myE1u7G Iran has breached a limit on stockpile of enriched uranium set under 2015 nuclear deal with world powers - sources https://t.co/dtVkav4IPi Pregnant woman fatally stabbed in Croydon named by police, as second person arrested in connection with her death https://t.co/94HRf4i8cn Kim Jong-un said the meeting was \"very significant\" and \"this means we can feel at ease and meet each other with positive answers\"\n\nMr Kim accepted Mr Trump's invitation to meet at DMZ, which he sent via tweet on Saturday\n\nMore: https://t.co/ZBPA2uHgEQ https://t.co/0lUT9H8M0M Here is the moment US President Donald Trump became the first sitting US president to set foot in North Korea\n\nThe two leaders met in the demilitarised zone - Mr Trump says Mr Kim invited him over\n\nRead live updates: https://t.co/4EVuh2fyOm https://t.co/u3iMPyhdWy Donald Trump shares symbolic handshake with North Korea's Kim Jong-un in demilitarised zone between the Koreas https://t.co/Q7S8aRrqqA Trump says he will meet North Korean leader Kim Jong-un at DMZ shortly https://t.co/1DEjJza6yj RT @BBCSport: FT\n\nSweden have done it!\n\nThey've beaten Germany in a major tournament for the first time since 1995 - and the #FIFAWWC semi-\u2026 A woman who was about eight months pregnant has been stabbed to death in south London, police say https://t.co/hUjoEqaE6l RT @BBCSport: FT\n\nHISTORY MADE! \n\nThe Netherlands reach the #FIFAWWC semi-finals for the first time ever!\n\n#ITA 0-2 #NED \n\n#ITANED reaction\u2026 RT @BBCSport: FT! France 1-2 USA.\n\nFrance's late goal wasn't enough in the end. Megan Rapinoe takes #USA to the #FIFAWWC semi-finals.\n\nThey\u2026 After 20 years of negotiation, EU and South American economic bloc Mercosur clinch trade deal https://t.co/lpDQSqhI6Q France records its all-time hottest temperature, a sweltering 44.3C. Here's why it's so unusual https://t.co/ytdt8Q8mwc Former VP Joe Biden sharply criticised at Democratic 2020 debate by Senator Kamala Harris over civil rights record. https://t.co/kmBbSL0tyr Sir Jonathan Ive to leave Apple after two decades as its chief designer https://t.co/C3U9DTm1N0 RT @BBCSport: They've done it! \ud83d\ude4c \n\nFT: Norway 0-3 England\n\nEngland are heading to the Women's World Cup semi-finals for the second consecut\u2026 UK Ministry of Defence says Typhoon planes escorted Air India aircraft to Stansted, after what the airline now calls a \"security threat\" https://t.co/VIjX0FTYea Passenger plane makes \"precautionary landing\" at Stansted airport due to bomb threat, Air India says https://t.co/CLFuQCmygN Hillsborough match commander David Duckenfield to face retrial over deaths of 95 football fans in 1989 https://t.co/EzJG1cLJ5C President Trump signs new sanctions against Iran, targeting - among others - Supreme Leader Ayatollah Khamenei https://t.co/Z09mbzxGKT RT @BBCSport: Not good news for #NUFC fans. Rafael Ben\u00edtez will leave Newcastle United when his contract expires at the end of this month.\u2026 Former Labour deputy PM John Prescott is in hospital after having a stroke, his family says https://t.co/xFGzcMlOhb Ruling party in Turkey set to lose city of Istanbul after re-run mayoral election in big blow for President Erdogan https://t.co/jXpKvmlKuR Ethiopia's army chief confirmed dead after being shot in the capital in attack apparently linked to regional unrest https://t.co/KC2G1q1NGL Jack Letts, who left UK to join the Islamic State group, tells BBC he had been an \"enemy of Britain\" https://t.co/iN0IyKdsec Parents of Muslim convert dubbed \"Jihadi Jack\" guilty of funding terrorism in 2015 but not guilty of another charge https://t.co/N77YYjhhcX President Trump says the US military was \"cocked and loaded to retaliate\" against Iran, but he changed his mind 10 minutes before planned strikes https://t.co/PyhkDJXtBv By-election to be held in Brecon and Radnorshire after petition to remove Tory MP convicted of false expenses claim https://t.co/7gmwSubTxz Mark Field suspended as UK Foreign Office minister after footage shows him 'grabbing' climate activist https://t.co/tdRFR8JmrA Jeremy Hunt to face Boris Johnson in race to be next UK PM after Michael Gove is eliminated in latest Tory leadership ballot https://t.co/kB5cAsIJg9 https://t.co/Oa2mjgvgUU Sajid Javid out of Tory leadership contest leaving three contenders vying for the job and to be next PM https://t.co/znOO2X7bNK Campaigners win legal challenge over UK government's decision to allow arms sales to Saudi Arabia at Court of Appeal https://t.co/dyuzONm4Hs Leader of sex cult Nxivm Keith Raniere found guilty of all charges against him in New York court https://t.co/EwVUk1ghAy Man arrested in connection with death of footballer Emiliano Sala on suspicion of manslaughter https://t.co/4zarRfopPJ Four left in race to be next PM as Rory Stewart knocked out of the Tory leadership contest winning just 27 votes https://t.co/obL08QRiLv Three of four suspects guilty over 2015 militant raid on Kenya's Garissa University in which nearly 150 people died https://t.co/c1IaDJt1vF Four men charged with murder after MH17 airliner shot down over Ukraine in 2014 https://t.co/gOpNlvhW5R Saudi crown prince should be investigated over evidence he is liable for Jamal Khashoggi's murder, UN expert says https://t.co/rqtkULBWCu Dominic Raab knocked out of Tory leadership race, leaving five candidates to be next PM https://t.co/mQRbhu0zQj Egypt's former president, Mohammed Morsi, who was ousted by the military in 2013, dies in court, state TV says https://t.co/ZgsJMt3Te8 RT @BBCSport: Gary Woodland is the #USOpen champion.\n\nThe American held off world number one Brooks Koepka to win his first major.\n\nhttps:/\u2026 RT @BBCSport: Maurizio Sarri has left his role as Chelsea manager and joined Serie A champions Juventus.\n\nFull story \ud83d\udc49 https://t.co/mkXhK6O\u2026 Massive power cut hits all of Argentina and Uruguay, supplier says, affecting about 48m people https://t.co/XIKkL9ASlQ Obituary: Franco Zeffirelli, a maestro who worked on an epic scale in film, theatre &amp; opera\n\nhttps://t.co/zZdSiTA9ho Film director and cultural icon Franco Zeffirelli dies aged 96, Italian media reports https://t.co/Vzc80AlHDS Hong Kong leader Carrie Lam announces suspending introduction of controversial extradition law after mass protests https://t.co/YxhjzN6Ap7 Carers guilty of murdering 19-year-old woman whose death they covered up for 20 years - her body has not been found https://t.co/NXXIzP6tn1 White House Press Secretary Sarah Sanders to leave her post at the end of June, US President Donald Trump says \n\nhttps://t.co/2qdGUwgGbl US Secretary of State Pompeo blames Iran for \"blatant assault\" on oil tankers in Gulf of Oman earlier on Thursday https://t.co/AN0j2U3ZZF Boris Johnson tops Tory leadership poll with 114 votes in first round of contest to select new leader and next PM https://t.co/xNETldgjW0 MPs reject chance to take control of Parliament's timetable, blocking the latest attempt to stop no-deal Brexit https://t.co/esMNt6CtJV RT @BBCSport: Britain's four-time champion Chris Froome has been ruled out of the Tour de France after breaking his leg in a crash.\n\n\ud83d\udc49 http\u2026 RT @BBCSport: FT! USA 13-0 Thailand.\n\nThe biggest ever result in World Cup football.\n\nWow. \n\n#USA 13-0 #THA \n\n\ud83d\udcbb https://t.co/9oOq4PHnui\n\n#C\u2026 Drugs charges against Russian investigative reporter Ivan Golunov dropped after massive public outcry https://t.co/b94KBXmbxM BBC to scrap blanket free TV licences for over-75s; only households where someone gets pension credit still eligible https://t.co/hXAaYJ8jWm Nearly 100 people killed in attack in central Mali village inhabited by Dogon ethnic group, reports say https://t.co/ogxQv2fLNm RT @BBCSport: Rafa Nadal just LOVES the #FrenchOpen! \n\nHe's beaten Dominic Thiem to take the crown for a 12th time \ud83d\udc51\n\nFull story: https://t\u2026 Trump says the US has reached a deal with Mexico, 'indefinitely' suspending threatened trade tariffs https://t.co/12JZo0Lveg \"I still love Richard and miss him dreadfully, and wish that none of this had happened\"\n\nSally Challen speaks after being freed, as her murder conviction for killing her husband is reduced to manslaughter https://t.co/ttijYYQmts https://t.co/bYeHVDGN3c Nasa to allow tourists to visit the International Space Station from 2020 https://t.co/4kTTlG5J7c An abused woman will not face a retrial for killing her husband after UK prosecutors accepted her manslaughter plea https://t.co/o5KvN7AdME Labour holds off Brexit Party to narrowly win the Peterborough by-election with a majority of 683 https://t.co/TQQAmocERm RT @BBCSport: England lose in a semi-final again. \n\n#NED  3-1 #ENG \n\nThe Netherlands with two unanswered goals in Extra time.\n \nLive #Natio\u2026 Ford confirms its engine plant in Bridgend will close in autumn 2020, with the loss of 1,700 jobs https://t.co/mXJpAfJr4o Ford's engine plant in Bridgend, South Wales, will close by the end of next year, sources say https://t.co/6IjOXIdMnU The Queen officially welcomes President Trump to Buckingham Palace, with the sound of a gun salute in the background\n\n#TrumpUKVisit latest updates: https://t.co/4zaqzAiNZz https://t.co/yG3bG7qAVz Rescuers hunting missing climbers in Indian Himalayas say they saw five bodies from the air, believed to be dead https://t.co/9zv20NVDpl US President Donald Trump arrives in UK for three-day state visit \n\nFollow latest updates: https://t.co/4zaqzAiNZz #TrumpUKVisit https://t.co/7LSJrnlaeZ RT @BBCSport: LIVERPOOL ARE CHAMPIONS LEAGUE WINNERS! \n\n\ud83c\udfc6\ud83c\udfc6\ud83c\udfc6\ud83c\udfc6\ud83c\udfc6\ud83c\udfc6\n\n#UCLfinal https://t.co/nkycOivUrg https://t.co/0E2V394F7x RT @BBCSport: Former Arsenal winger Jose Antonio Reyes has died in a car accident aged 35, Spanish club Seville have announced.\n\nMore \u27a1 htt\u2026 At least 11 killed in mass shooting in US state of Virginia https://t.co/zdk66YhkgZ British retail tycoon Sir Philip Green charged in the US with four counts of misdemeanour assault https://t.co/NWqxwpTeB2 Israel to hold fresh elections after Benjamin Netanyahu fails to form coalition https://t.co/8TVfPsZ0Oy RT @BBCSport: FT: Chelsea 4-1 Arsenal \n\nCHELSEA WIN THE EUROPA LEAGUE! \n\nGiroud, Pedro and a double from Hazard on their crowning night in\u2026 RT @BBCSport: FT: Aston Villa 2-1 Derby County \n\nASTON VILLA ARE PREMIER LEAGUE. \n\nAnwar El Ghazi and John McGinn with the goals that see #\u2026 Austrian Chancellor Sebastian Kurz loses vote of confidence in parliament after coalition collapse over secret video https://t.co/xDDO9Abcn9 EU elections: Major losses expected for mainstream parties - follow the results live https://t.co/v4wgk88mFv Watch live and follow all the EU election results as they come in across the UK and Europe\n\nLatest updates: https://t.co/LFoutbU0wt https://t.co/c1nx2eIWT2 Ten workers arrested over alleged abuse of patients at Whorlton Hall hospital following BBC Panorama investigation https://t.co/c0xWzgQqjs Two boys - aged 14 and 13 - die after incident at house in Sheffield, with four other children still in hospital https://t.co/4i7MSzGWWK A tearful Theresa May says serving as prime minister has been \"the honour of my life\", saying she is proud to have been the second female leader of the UK\n\nLive updates: https://t.co/uYam3l51Iz https://t.co/5apujgBm4f \"It is in the best interests of the country for a new prime minister to lead\"\n\nUK Prime Minister Theresa May announces she will resign on Friday 7 June\n\nLive updates: https://t.co/uYam3l51Iz https://t.co/Y35iYJPvef Theresa May to quit as Conservative leader on 7 June, paving way for contest to decide new UK prime minister https://t.co/ecGT8c1zqF US unveils 17 new charges against Wikileaks co-founder Julian Assange, who is facing extradition from the UK https://t.co/spFdt8BHET Hindu nationalist Narendra Modi scores resounding victory in Indian general election, securing second five-year term https://t.co/LAvEhJJn4o The Tiger Who Came To Tea author Judith Kerr has died at the age of 95, her publisher HarperCollins says https://t.co/Q0bM10r7Hg \"I no longer believe that our approach will deliver on the referendum result\"\n\nAndrea Leadsom's letter to the UK prime minister as she quits her cabinet role over #Brexit\n\nhttps://t.co/d2Hx5o0qZx https://t.co/4tbHc1PeiP Andrea Leadsom resigns cabinet role saying she no longer believes government's approach will deliver Brexit https://t.co/MairqjlJqV Abuse and mistreatment of vulnerable adults at Whorlton Hall specialist hospital in County Durham uncovered by BBC https://t.co/C9CCCuVcp7 British Steel to enter insolvency, putting 5,000 UK jobs directly at risk and a further 20,000 in the supply chain https://t.co/qKh2DqzUEW Theresa May says MPs will get vote on whether to hold another referendum if they back EU Withdrawal Agreement Bill https://t.co/yO9VzBTp4P 1,000 jobs to go at Jamie Oliver's UK restaurant chain, as all but 3 of its 25 branches are closed, administrators confirm https://t.co/UAfRyh9EYP British celebrity chef Jamie Oliver\u2019s restaurants set to go into administration, putting up to 1,300 jobs at risk https://t.co/RRrYtWmpkZ Christchurch mosque attacker Brenton Tarrant formally charged with terrorism in addition to 51 charges of murder https://t.co/eyXpuSXO96 Niki Lauda obituary: The F1 champion, pilot, and entrepreneur who was once frightened to drive https://t.co/3qmbmmqh1D Former Formula 1 champion Niki Lauda has died aged 70, his family says https://t.co/W6lTrOcHI6 Explosion hits tourist bus near Grand Egyptian Museum at pyramids, media reports say https://t.co/xEZuX0zheE The Netherlands' Duncan Laurence wins the 2019 Eurovision Song Contest with his song Arcade https://t.co/J64jDGhJoj Austrian Chancellor Sebastian Kurz calls for snap election after his deputy resigns over corruption scandal https://t.co/O1bxb3EDLX Manchester City are first men's team to win the English domestic treble, after thrashing Watford 6-0 in FA Cup final https://t.co/9O3VZo28tq RT @BBCSport: FT: Man City 6-0 Watford\n\nStunning by Manchester City.\n\nThey have won the FA Cup and completed the domestic treble.\n\nYou have\u2026 \"I said I was going to burn for you and I am, every single day\" - Australian PM Scott Morrison on shock election win https://t.co/RpB1VgX4sR Bill Shorten, leader of Australia's centre-left opposition Labor party, concedes after unexpected election defeat https://t.co/gof1JGezqo Austria's Vice-Chancellor Heinz-Christian Strache resigns, day after a video mired him in corruption scandal https://t.co/cXJpNO6F50 #Brexit talks between Labour and the Conservatives end without agreement, with Jeremy Corbyn saying negotiations have \"gone as far as they can\" https://t.co/ucvjlqZ1ak Taiwan's parliament becomes the first in Asia to legalise same-sex marriage https://t.co/1owGYn8MjY Three Britons and a South African killed after small aircraft crashes near Dubai airport, authorities say https://t.co/RP4WXt4j7b Bob Hawke, Australia's charismatic Labor prime minister for much of the 1980s, dies aged 89 https://t.co/3KlTguiQ92 President Trump declares a national emergency to protect US computer networks from \"foreign adversaries\" https://t.co/UQfJmRls5x ITV cancel production of Jeremy Kyle show following death of guest https://t.co/aGTFCyVexO Obituary: Doris Day, the all-American girl who became one of the world's biggest stars\n\nhttps://t.co/YZVzwjFwfJ https://t.co/fKaGbjkZYA Hollywood star Doris Day, whose films made her one of the biggest female stars of all time, has died aged 97 https://t.co/JBhWGTteoe Swedish prosecutors reopen inquiry into a rape allegation made against Wikileaks co-founder Julian Assange https://t.co/BNZlnj6BvQ RT @BBCSport: Brighton have sacked manager Chris Hughton.\n\nhttps://t.co/iiqYGnfauw #BHAFC https://t.co/5xqaEHRX7K RT @BBCSport: \ud83d\udd35 MAN CITY ARE CHAMPIONS \ud83d\udd35\n\nThe first Premier League side to win back-to-back titles since 2009.\n\nWhat a team. What a season\u2026 Gunmen burn down church during Mass and kill six people, including priest, in Burkina Faso, reports say https://t.co/12AA5CRZ5h At least three gunmen attack a five-star hotel in Gwadar in Pakistan's Balochistan province, officials say https://t.co/SH59MutX5x Four foreign hostages freed by French forces in West African country of Burkina Faso, French government says\n\nhttps://t.co/xwn6OPk5w4 The UK economy grew 0.5% in the first three months of 2019, official figures show. https://t.co/w9ffzgx2a7 RT @BBCSport: GOAL!\n\nEden Hazard scores for Chelsea! \n\nChelsea 4-3 Eintracht Frankfurt\n\nCHELSEA ARE GOING TO THE FINAL!\n\nLive: https://t.co\u2026 RT @BBCSport: FULL TIME: \n\nValencia 2-4 Arsenal. (Agg 3-7). \nAubameyang's hat-trick puts Arsenal in the final. \n\nChelsea 1-1 Frankfurt. (Ag\u2026 Broadcaster Danny Baker fired from BBC Radio 5 live after tweeting \"royal baby\" image of chimpanzee https://t.co/DTjVW3r8T2 RT @BBCSport: FT: Ajax 2-3 Tottenham (3-3 agg) \n\nWHAT HAS JUST HAPPENED? \n\nLucas Moura's second half hat-trick gives Spurs a remarkable, in\u2026 Harry and Meghan name their baby son Archie Harrison Mountbatten-Windsor\n\nhttps://t.co/RGfVNp0RLf #BabySussex https://t.co/wZusAzWfOj \u201cWe\u2019re just so thrilled to have our own little bundle of joy\u201d\n\nPrince Harry and Meghan, the Duke and Duchess of Sussex, introduce their new baby son to the world https://t.co/RGfVNoJgmF https://t.co/VhijbrW01F Prince Harry and Meghan, the Duke and Duchess of Sussex, appear in public with their new baby son for the first time\n\nhttps://t.co/zzguTWGzuE https://t.co/fx1oldu9gj Pakistan confirms Asia Bibi, Christian woman who spent years on death row convicted of blasphemy, left for Canada https://t.co/oYfAMDSVJj Iran pulls out of \"some commitments\" under international 2015 nuclear deal, a year after US abandoned accord https://t.co/iyLpQXEdNG Explosion reported outside a major Sufi Muslim shrine in the Pakistani city of Lahore - local media. https://t.co/6HAMmswsfd RT @BBCSport: UNBELIEVABLE!!!\n\nLIVERPOOL HAVE ACTUALLY DONE IT!\n\nLiverpool 4-0 Barcelona (4-3 agg)\n\n#LIVBAR reaction: https://t.co/JR8YU2Wr\u2026 British soldier killed by elephant in Malawi during anti-poaching operations https://t.co/lctC4vJwEw Here's the first picture of newly-freed Reuters Myanmar journalists Wa Lone and Kyaw Soe Oo https://t.co/9jYoJ5WkrL https://t.co/E7jtDGYACo Jailed Reuters journalists Wa Lone and Kyaw Soe Oo are freed in Myanmar after amnesty. https://t.co/jIUbQY3XVq It's a boy - a beaming Prince Harry says mum and baby \"doing incredibly well\" https://t.co/t0Xt0K0J3f The Duchess of Sussex has gone into labour with her first child, Buckingham Palace says https://t.co/5dEtyRl29O Russian plane makes emergency landing at Moscow airport after fire breaks out on board, state media report https://t.co/IVqpKumO5F Actor Peter Mayhew, famous for playing Chewbacca in Star Wars, has died aged 74 https://t.co/cnvghq70Nq https://t.co/wfvTmkS3Yf Fresh inquest into death of girl, 9, who had asthma attack thought to have been linked to pollution near London home https://t.co/r1gE6nCQiR \"I strenuously deny that I was in any way involved in this leak\" from the National Security Council meeting\n\nGavin Williamson responds to UK PM Theresa May after he was sacked as Defence Secretary  https://t.co/4zl7cSsj7e https://t.co/4WDAc627a7 RT @BBCSport: Jockey Ruby Walsh has announced his retirement after riding joint favourite Kemboy to victory in the Punchestown Gold Cup.\n\nM\u2026 International Development Secretary Penny Mordaunt appointed UK Defence Secretary following sacking of Gavin Williamson https://t.co/g0x4LBluR9 \"It is therefore with great sadness that I have concluded that I can no longer have full confidence in you\"\n\nUK PM Theresa May's letter to Gavin Williamson sacking him as Defence Secretary https://t.co/g0x4LBluR9 https://t.co/GGVMRyysYM UK Defence Secretary Gavin Williamson sacked over Huawei leak https://t.co/O0yOlwgYmt Wikileaks co-founder Julian Assange sentenced to 50 weeks in jail for breaching bail conditions https://t.co/SkqLyQTOVW Athlete Caster Semenya loses challenge against rules restricting testosterone levels in female runners https://t.co/DOk1jEi9PR Japan's Emperor Naruhito inherits the symbols of imperial power, a day after his father Akihito abdicated https://t.co/qPMFO36ezT President Trump has been briefed on events in Venezuela, where army says it confronting group of \"military traitors\" https://t.co/OL7hwNqtIv Emperor Akihito gives abdication address, becoming first Japanese monarch to give up throne in two centuries https://t.co/0HzW1ez7DL US Deputy Attorney General Rod Rosenstein resigns after a rocky relationship with President Donald Trump https://t.co/LtDbczQdxI John Singleton, who directed Oscar-nominated Boys N The Hood, dies at 51 after suffering stroke, family confirms https://t.co/fzfk1FhVhv Debenhams names 22 stores which are to close in the UK in 2020, affecting 1,200 staff https://t.co/PccSkMHcdH Sri Lanka revises down death toll from Sunday's blasts by more than 100, to \"about 253\", health ministry says https://t.co/zXVjo61Gzq UK advises against all but essential travel to Sri Lanka, after Easter Sunday attacks killed more than 350 people https://t.co/hgKcZ8rGXV Former US Vice-President Joe Biden announces 2020 presidential run, saying \"core values of nation at stake\" https://t.co/zAPPc6ybIk Merger between Sainsbury's and Asda blocked by regulator on grounds it would lead to higher prices https://t.co/xP8JyiKaHb US President Donald Trump will make state visit to UK from 3-5 June, Buckingham Palace announces https://t.co/f16D46B5IK The number of people who died in the Easter Sunday attacks in Sri Lanka has risen sharply to 290, police say. https://t.co/hBmuVh1egc Sri Lankans are waking up in shock after yesterday's devastating attacks. More than 200 were killed as a wave of bomb blasts hit on Easter Sunday: https://t.co/gWuKkgjpd9\n\nOur rolling coverage continues: https://t.co/TkH5p7oXQN https://t.co/ZjuQTNcAYi Ukraine's incumbent President Petro Poroshenko concedes victory to TV comic Volodymyr Zelensky after exit polls https://t.co/aYBkdGqKrq Ukrainian comedian Volodymyr Zelensky elected president with more than 70% support, exit polls suggest https://t.co/jfLrNt0hmL Three Britons &amp; two people holding joint US/British citizenship among more than 200 killed in Sri Lanka attacks, country's foreign ministry says\n\nhttps://t.co/IvYiWDaWFE At least 207 killed and over 400 injured in Sri Lanka attacks, police say\n\nLatest developments: https://t.co/TkH5p7oXQN https://t.co/5WbpOOVMx2 Seven people arrested over Sri Lanka attacks, as government says most of the eight blasts were suicide bombings\n\nhttps://t.co/IvYiWDaWFE Sri Lanka's government declares nationwide curfew from 18:00 to 06:00 local time, following wave of attacks\n\nLatest developments: https://t.co/TkH5p7oXQN https://t.co/e9ssoFetIy Two dead in fresh explosion in district of Dehiwala, Colombo, police sources say\n\nSri Lanka attacks latest: https://t.co/TkH5p7oXQN https://t.co/T6OKzWPpJJ Sri Lanka attacks\n\n\u2022 Six blasts hit churches &amp; hotels\n\u2022 At least 137 dead\n\u2022 Hundreds injured\n\nLatest developments: https://t.co/TkH5p7oXQN https://t.co/HAr7Eeumij At least 100 people reported killed in Sri Lanka attacks, with death toll expected to rise further https://t.co/L5KtZQxJIG Explosions have been reported at two churches in Sri Lanka as Christians celebrate Easter https://t.co/9YZ2yJbU2J Seven killed in attack on Afghan ministry of information in Kabul, now declared over by officials https://t.co/UfFw7973SB Explosion and gunfire heard in Afghan capital Kabul as ministry of information HQ comes under attack https://t.co/PuCdOOaPqK Two men, aged 18 and 19, arrested in connection with murder of Northern Irish journalist Lyra McKee https://t.co/RwEFVC3F7s Journalist killed in Londonderry during rioting on Thursday night named by police as 29-year-old Lyra McKee https://t.co/znLtERvNvc Trump tried to get Special Counsel Mueller fired, report just published into Russia collusion says https://t.co/8rbl6kU1OS At least 28 people dead in tourist bus crash on Portuguese island of Madeira, national news agency says https://t.co/5o2wXjUeDj Peru's two-time president Alan Garc\u00eda dies after shooting himself as police came to arrest him https://t.co/B4C1xuFOoM JUST IN: French official says the stone structure of Notre-Dame has been saved from \"total destruction\"  \n\nThe latest: https://t.co/Gxo173gnbZ https://t.co/420PI8A6Gv Structure of Notre-Dame saved from total destruction, Paris fire official says https://t.co/jpEv1jhr8u Parisian firefighters say they are \"not sure\" if they will be able to stop the Notre-Dame fire from spreading to second tower\n\nFollow our live page for the latest https://t.co/Gxo173xYAz https://t.co/aFLos0KYsv The moment the Notre-Dame cathedral spire collapsed\n\n#NotreDame latest: https://t.co/qtVHI2MEuG https://t.co/Cc80Q3WcQQ \"Our Lady of Paris in flames. Emotion of a whole nation... I'm sad tonight to see this part of us burn\" - French President Emmanuel Macron tweets as Notre-Dame cathedral burns \n\nhttps://t.co/ZhCzw3bIB7 https://t.co/wY4XXk61zf Main spire of Notre-Dame cathedral has collapsed in fire, latest images show https://t.co/5DJCAHCS6X Famed Notre Dame cathedral in Paris is ablaze, firefighters say https://t.co/4ooa4mWe82 Tiger Woods wins Masters at Augusta, his first major title since 2008 https://t.co/6MIqvzc6Hr RT @BBCSport: \ud83c\udfc6 1997 \n\ud83c\udfc6 2001\n\ud83c\udfc6 2002\n\ud83c\udfc6 2005\n\ud83c\udfc6 2019\n\nTIGER WOODS WINS THE MASTERS AGAIN! \n\n5x champion at Augusta.\n\n\ud83d\udcfa @BBCTwo \n\ud83d\udcbb https://t.co\u2026 Sudan military chief steps down a day after staging coup to topple long-time leader Omar al-Bashir https://t.co/bEW3VW0oD0 Israel fails in bid to be fourth nation to land spacecraft on Moon as its Beresheet craft crashes on lunar surface https://t.co/vGYBfJ1IDj Sudan's President Omar al-Bashir forced to resign and \"is being held in a secure place\", defence minister confirms in live television address\n\nLive updates: https://t.co/1nkPqYLDEe https://t.co/QmZ5YaYyPw After nearly 30 years in power, Sudan president Omar al-Bashir has been ousted and arrested, defence minister says https://t.co/l2UlK1BC8Y Wikileaks co-founder Julian Assange arrested after seven years in Ecuador's embassy in London, UK police say https://t.co/ldi9HvlMGV South Korea's ban on abortion has been ruled unconstitutional in a historic court decision https://t.co/W9FST0uhh2 @eucopresident \u201cThe choices we now face are stark and the timetable is clear\" \u2013 UK PM Theresa May says \u201cnothing is more pressing or more vital\u201d than delivering #Brexit after agreeing an extension with the EU until 31 October\n\nhttps://t.co/UKstUg8Gqf https://t.co/3m7QzXXSXX \"Please do not waste this time\" - @eucopresident Donald Tusk says \"European Council [has] decided to grant the United Kingdom a flexible extension... [for #Brexit] until the 31st October\" \n\nhttps://t.co/UKstUg8Gqf https://t.co/fjuZnTQ3Rr EU leaders and UK agree \"flexible extension\" of Brexit until 31 October, following an emergency summit in Brussels https://t.co/pisuhsrEWI Australian Prime Minister Scott Morrison announces general election will be held on 18 May https://t.co/skcwaKziyK This is the first ever photo of a black hole, unveiled today after a decade of work by scientists https://t.co/6mFoo6ktyc https://t.co/0nD8R5mVeQ Israeli general election on course for a dead heat with nearly all votes counted, local media report https://t.co/vmtOtTuOon No clear winner in Israeli general election, exit polls suggest https://t.co/MCIsS3xyPE Control of ailing UK department store chain Debenhams falls into hands of lenders, but stores continue to trade https://t.co/SzCSQ0kgTt Nine Hong Kong 'Umbrella movement protesters' found guilty of public nuisance https://t.co/vbkPUBlRHb President Trump says US Homeland Security Secretary Kirstjen Nielsen is leaving her position https://t.co/k6VUpW0Tri RT @BBCSport: Tiger roll wins the Grand National!\n\nhttps://t.co/8pvEbGaVAQ   \n\n#grandnational #GrandNational2019 https://t.co/bFNHJKnGKv Botched IRA warning call caused or contributed to 21 deaths in 1974 Birmingham pub bombings, inquest jury finds https://t.co/GqqnahLkUM UK PM Theresa May writes to EU requesting #Brexit extension until 30 June 2019 - and says leaving with a deal is the \"best outcome\"\n\nhttps://t.co/J6OcCvtAyG UK PM Theresa May will write to European Council President Donald Tusk to request further delay to #Brexit, sources say\n\nhttps://t.co/AwsVEWcWMW Ethiopian Airlines crew could not stop Boeing 737 repeatedly nosediving despite following recommended procedures, report finds\nhttps://t.co/1Sig7vXw0J Ethiopian Airlines crew in Boeing 737 crash \"could not control\" jet despite following procedures, report finds https://t.co/Zehv5oMYO9 MPs vote by majority of one to force UK PM to ask for Brexit extension to avoid any no deal scenario https://t.co/XzBq0lrDKj Talks between Theresa May and Jeremy Corbyn to find Brexit deal \"constructive\", both Downing Street and Labour say https://t.co/gC7aqavrGH Prosecution seek retrial in Hillsborough case after jury fail to reach verdict on match commander David Duckenfield https://t.co/fDMvGtGgHR Jeremy Corbyn says he is \"very happy to meet\" UK PM Theresa May for #Brexit talks, but adds Labour's proposals to \"ensure\" there is a customs union with the EU will be on the table\n\nhttps://t.co/9tWIlokUTX https://t.co/2SorBS0J4f Algeria's President Abdelaziz Bouteflika resigns after weeks of mass protests - state news agency https://t.co/nf422qGTUk \"This is a decisive moment in the story of these islands and it requires national unity to deliver the national interest\" \n\nUK PM Theresa May offers to work with Labour leader Jeremy Corbyn to break #Brexit deadlock\n\nhttps://t.co/zEeFMMJz94 #Brexit https://t.co/fGOcVn3hcw \"This debate, this division cannot drag on much longer... It is doing damage to our politics\" - UK PM Theresa May confirms she is seeking further \"short\" extension to departure from EU\n\nhttps://t.co/zEeFMMJz94 #Brexit https://t.co/xtLA1CVwDk Theresa May says UK needs extension to Brexit and offers to work with Labour's Jeremy Corbyn to end stalemate https://t.co/2bXXLk2ZkS No deal more likely but can still be avoided, says EU's Brexit negotiator Michel Barnier after MPs reject options https://t.co/q5q1uMVHJM \"My party refuses to compromise, I regret therefore that I can no longer sit for this party\" - emotional Conservative MP Nick Boles quits party whip after #indicativevotes2 and is applauded in Commons\n\nReaction &amp; analysis: https://t.co/FMx4xZ0rGR https://t.co/vJ9YhtMVRk For a second time, none of MPs' proposed #Brexit options wins clear backing in Commons #indicativevotes2\n\nReaction &amp; analysis: https://t.co/PZ6GXTwXdZ Japan unveils the name of its new imperial era, set to begin on 1 May, as \"Reiwa\" - signifying order and harmony https://t.co/cAAz9wH6h5 Life imitates art? Comedian who played TV president wins first round of Ukraine presidential election - exit poll https://t.co/L2MArqud2w \"The House has been clear, this deal now has to change. If the prime minister can't accept that then she must go, now\"\n\nLabour leader Jeremy Corbyn responds after MPs reject the government's #Brexit withdrawal agreement\n\nReaction &amp; analysis: https://t.co/vMv3u7Dygv https://t.co/DbLUr4o2Oy PM Theresa May says \"we are reaching the limits of this process in this House\", saying UK will now probably have to take part in European elections after MPs rejected her #Brexit withdrawal agreement\n\nLatest: https://t.co/kuVOCAn3v1 https://t.co/QS5nrcdcrY UK MPs reject PM Theresa May\u2019s EU withdrawal agreement by 344 votes to 286, throwing #Brexit plans into further doubt\n\nLatest reaction &amp; developments: https://t.co/su8QUmIdpI https://t.co/yaQCSXee0E Commons vote on EU withdrawal agreement planned for Friday in fresh bid to break Brexit deadlock https://t.co/EI0IvZKE40 #Brexit deadlock: None of UK MPs' proposed options secures clear backing in Commons vote https://t.co/wSnjCxuBYL \u201cI am prepared to leave this job earlier than I intended in order to do what is right for our country and our party\" - UK PM Theresa May confirms she will quit if her #Brexit deal is passed\n\nhttps://t.co/Y8RyOLP74J https://t.co/3Qslw9A2I1 Theresa May tells Conservative MPs she will not remain as UK PM for the next phase of #Brexit negotiations\n\nLive updates https://t.co/gCEqrqmBlF https://t.co/qco3BBz0sj Prosecutors drop charges against actor Jussie Smollett which alleged he staged a homophobic attack - US media https://t.co/GXNEmP6bQz Algeria army chief calls for President Bouteflika to be declared unfit to rule, in TV address after weeks of unrest https://t.co/rWvWymVSBz Speedboat killer Jack Shepherd, found guilty in his absence after fleeing UK, agrees to be extradited from Georgia https://t.co/Gwda7cgnxn UK MPs vote to take control of Commons business in unprecedented move to try to find majority for any #Brexit option https://t.co/Q13HcCrp9w @BBCPolitics Read US Attorney General William Barr's 4-page letter summarising the findings from the Special Counsel's investigation https://t.co/fcsoitJsjs President Trump's campaign \"did not conspire\" with Russia during 2016 election, Robert Mueller's report says https://t.co/BCbfAPxduU Syrian Democratic Forces announce defeat of Islamic State group, as final territory falls in Syria https://t.co/Pc9CqsiO18 In a statement, the White House says it has not \"received or been briefed on the Special Counsel's report\" \n\nFor more on the #MuellerReport \ud83d\udc49 https://t.co/3xMgYHQZp9 This is the letter the US Attorney General sent to senior figures in Congress informing them that the Mueller report had been submitted after 22 months' work\n\nWhat might happen next?\n\nhttps://t.co/mOwpTUCRey https://t.co/J6oP8JYPBA Special Counsel Robert Mueller submits report on alleged Trump-Russia collusion - US media https://t.co/A79Ze5ifqV North Korea withdraws from inter-Korean liaison office opened last year to encourage talks with South Korea https://t.co/NRhw4GO9WY The death toll in a huge blast at a chemical plant in eastern China jumps to 44, with 90 injured, state media say https://t.co/uCLhGWFjK2 RT @BBCNews: @BBCBreaking \"I do not believe that we should be revoking Article 50\"\n\nUK PM Theresa May speaking after the EU agrees a plan t\u2026 European Council President Donald Tusk tells media that EU leaders agree to delay the #Brexit process\n\n- 22 May, if MPs approve UK PM's withdrawal deal next week, or\n- 12 April, if the deal fails\n\nhttps://t.co/OEVXvmfrcp https://t.co/eB1mu6nbIm EU agrees Brexit delay until 22 May if MPs approve withdrawal deal next week, or 12 April if they do not https://t.co/kUTH2MDwAp UK police confirm body recovered from Humber Estuary on Wednesday is that of missing 21-year-old Libby Squire https://t.co/4qKWfvC8qy Israeli PM Benjamin Netanyahu thanks US President after he tweeted \"it is time for the United States to fully recognize Israel\u2019s Sovereignty over the Golan Heights\" https://t.co/aCgQL1l1je President Trump tweets that US will recognise Israeli sovereignty over Golan Heights, seized from Syria in 1967 war https://t.co/QTjv32tW5h Brazilian former President Michel Temer arrested in corruption investigation, media reports say https://t.co/EwYGWHxcp0 River ferry sinks in tourist area near Mosul in Iraq, killing at least 40 people, many reportedly women and children https://t.co/qYPyxrprvh Teenager who killed Alesha MacPhail, 6, on Isle of Bute, admits crime and is detained for minimum of 27 years https://t.co/mQ0o4mX8VT New Zealand will ban all types of semi-automatic weapons used in Christchurch attacks, says PM Jacinda Ardern https://t.co/MP3XTDhAmS Theresa May tells the British public \"I'm on your side\" and it's \"high time\" MPs made a decision over Brexit https://t.co/amvzuihqeW Short extension to Brexit \"possible\" if MPs approve UK PM Theresa May's deal next week - EU's Donald Tusk says\n\nhttps://t.co/xrOnEfQ3Rv https://t.co/2adHbDEgwL Theresa May \"won't be asking for long extension\" to Brexit in letter to EU, says No 10 https://t.co/GXmfIrRjTy Leader of Kazakhstan since independence from Soviet Union in 1991, Nursultan Nazarbayev, announces his resignation https://t.co/ksE89gZC4z UK unemployment fell by 35,000 between November and January to 1.34 million, figures show https://t.co/pajlfFyV6x Dutch police arrest wanted man following a shooting in the city of Utrecht which left three people dead https://t.co/8OedeSbMlE Three people killed in shooting in Dutch city of Utrecht, mayor says - police hunt suspect\n\nhttps://t.co/vXELPs9nXY Man fires on passengers in tram in Dutch city of Utrecht, several people reported injured, eyewitnesses say https://t.co/W58KptX5ZZ PM Jacinda Ardern says New Zealand's cabinet backs gun law changes 'in principle' after Christchurch shootings https://t.co/I1RH7KU5iC British counter-terrorism police are investigating a non-fatal stabbing of a 19-year old in Surrey, saying \u201cit has hallmarks of a terror event, inspired by the far right\u201d https://t.co/exSSQcADt5 RT @BBCSport: FT: Wales 25-7 Ireland\n\nThat\u2019s it! Wales are Six Nations Grand Slam champions!\n\nWell played, @WelshRugbyUnion\n\nReaction \ud83d\udc49 htt\u2026 RT @BBCSport: Al Boum Photo wins the Cheltenham Gold Cup.\n\n\ud83d\udcfb @5liveSport\n\nReaction \ud83d\udc49 https://t.co/i7jbXXpFqO #bbcracing https://t.co/anA95h\u2026 Forty people dead in New Zealand mosque attacks, PM Jacinda Ardern confirms https://t.co/1tVsfneMG6 New Zealand Police say four people are in custody after attacks at two mosques led to \"multiple fatalities\" https://t.co/xphlHvnuj4 Gunshots heard near mosque in Christchurch, New Zealand, local media report, as police warn of a \"critical incident\" https://t.co/fZo3nWMEud A public vote would be a \"realistic option to break the deadlock\", says Labour leader Jeremy Corbyn as UK MPs vote to seek a delay to #Brexit\n\nFollow live updates: https://t.co/9ddOkuwSLK https://t.co/IAi1Sbcbyr UK MPs vote by 412 to 202 to ask the EU for #Brexit to be delayed beyond 29 March\n\nFollow live updates: https://t.co/9ddOkuwSLK https://t.co/9eLIQRVU2f RT @BBCPolitics: MPs reject amendment to take control of #Brexit process and force a series of indicative votes on the way forward, by 314\u2026 Former British soldier faces murder charges over two Bloody Sunday killings in Londonderry in 1972 https://t.co/PMH6ULcNEq Labour leader Jeremy Corbyn says \"Parliament must now take control\" of the #Brexit process, after UK MPs vote to reject leaving the EU without a deal\n\nhttps://t.co/r6u92tA4AD https://t.co/C5GYADhPeZ UK PM Theresa May says #Brexit options \"are the same as they always have been\", warning \"no Brexit at all\" would damage \"fragile trust\" between British public and MPs\n\nhttps://t.co/r6u92tA4AD https://t.co/MoUpYcT3Jj UK MPs support amended government motion which rejects no-deal #Brexit at any time by 321 to 278\n\nhttps://t.co/fiA9J8O12Z UK MPs reject a no-deal #Brexit by 312 to 308 in a non-binding vote https://t.co/qZADz7lP7Y https://t.co/nyyjgJ38k0 Boeing suspends entire global fleet of 737 Max aircraft \"out of an abundance of caution\" https://t.co/y8SoKWQunP Trump orders all Boeing 737 Max 8 planes to be grounded after two crashes in five months https://t.co/6LWYlTLYaE Trump's ex-campaign chief Paul Manafort jailed for 43 more months on charges stemming from Russia investigation https://t.co/e4JMN8eWI9 Children killed in school shooting near Sao Paulo in Brazil, governor confirms https://t.co/oPdFQhR83X The UK will cut tariffs and not introduce new controls on the Irish border in the event of a no-deal Brexit https://t.co/6eSdD19HJ2 The most senior Catholic ever convicted of child sexual abuse, Australian Cardinal George Pell, jailed for 6 years https://t.co/aLwkmftWfj Labour's Jeremy Corbyn says UK PM's #Brexit deal is \"clearly dead\", saying Theresa May has \"run down the clock, and the clock has been run down on her\"\n\n#BrexitVote latest: https://t.co/B1iEVm5bdm https://t.co/PsL8De5COq UK PM Theresa May says MPs now face \"an unenviable choice\" of what to do next, stressing that \"voting against the deal and for an extension does not solve the problem\"\n\n#BrexitVote latest: https://t.co/B1iEVm5bdm https://t.co/MKfBMfiO1Q UK MPs vote against Theresa May\u2019s revised EU withdrawal deal by 391 to 242, throwing #Brexit plans into confusion\n\n#BrexitVote latest: https://t.co/B1iEVm5bdm https://t.co/NmegGFBm60 Two climbers die and two are injured in an avalanche on Ben Nevis, Police Scotland say https://t.co/jKH3fiF8jH Boeing 737 Max passenger jets stopped from flying in UK airspace after Ethiopia air crash - Civil Aviation Authority https://t.co/cWLGe98ntN Attorney General Geoffrey Cox says \"legal risk remains unchanged\" in updated #Brexit deal and UK would have no legal means of exiting without EU agreement\n\nhttps://t.co/spbbTj0W4e Attorney general says changes in EU withdrawal deal \"reduces risk\" of UK being \"indefinitely\" held in the backstop https://t.co/JYk0oCArXj PM has secured \"legally binding\" changes to Brexit deal, says Cabinet Office minister day ahead of MPs' vote https://t.co/5tZHT90E1A Algeria's President Bouteflika pulls out of race for fifth term and postpones elections, amid nationwide protests https://t.co/T2B0odgxZx RT @BBCSport: Zidane: Announced. \n\nZinedine Zidane has returned as Real Madrid manager just 10 months after leaving the Spanish giants.\n\nMo\u2026 Birmingham City fan jailed for 14 weeks for attacking Aston Villa captain Jack Grealish during match on Sunday\n\nhttps://t.co/pyhZu3x6tK RT @BBCSport: Russian athletes will remain banned from international competitions until further notice, says athletics' governing body.\n\nIn\u2026 Angus Sinclair, thought to be Scotland's worst serial killer, has died at the age of 73 https://t.co/54b57XT4Mw \"Black box\" flight recorder found after Ethiopian Airlines crash in which 157 people died - Ethiopian state media https://t.co/QrXP3WJsgQ Indonesian woman accused of killing Kim Jong-nam with VX nerve agent to be freed, as charges dropped. https://t.co/ZePpxmRfN9 Everyone on board Ethiopian Airlines jet died in crash, spokesman says - victims were from 33 nationalities\n\nLive updates: https://t.co/yXWOHt8cQd https://t.co/J8z7FfMZMC Ethiopian Airlines passenger jet crashes on flight from Addis Ababa to Nairobi, prime minister sends condolences https://t.co/BlWMwX7XzV Bodies of missing British climber Tom Ballard and Italian Daniele Nardi found on mountain in Pakistan https://t.co/IafrxDR1pY The baby of Shamima Begum - the teenager who fled London to join the Islamic State group - has died, a Syrian Democratic Forces spokesman says\n\nhttps://t.co/dVoiJRTEAN Mother, 37, jailed for 11 years after becoming first person in UK to be convicted of female genital mutilation https://t.co/XdjA2217jz \u201cAnd there we have confirmation of splashdown. Dragon has returned to planet Earth\u201d\n \nWatch the moment SpaceX capsule lands in Atlantic Ocean after completing demo flight to International Space Station \n\nhttps://t.co/WSAdHieLiA https://t.co/McN0HDeebK Splashdown! America's new commercial astronaut capsule completes its demo flight, landing in the Atlantic Ocean https://t.co/pWMHPOVQV7 Andrew Hill \u201ctruly sorry\" for part he played in the deaths of 11 people at Shoreham Airshow, after being cleared at the Old Bailey in London\n\nhttps://t.co/0plKqnFoMj https://t.co/5d6WoWSmNj Pilot Andrew Hill found not guilty of manslaughter over 2015 Shoreham Airshow crash, in which 11 people died https://t.co/beWdNhgy5r Frenchman is convicted of murdering four people at Brussels Jewish Museum in 2014 after returning from Syria war https://t.co/E0nych0gtP Teenager dies after being stabbed in West Kensington in London, police say\n\nhttps://t.co/xgfPTNBOmb Fashion chain LK Bennett - which has 41 shops and 480 staff in the UK - goes into administration https://t.co/8fDUUjR7OB 17-year-old boy arrested after death of woman and child at house in Ipswich, in the east of England https://t.co/Lgs3SfLWjJ Suspicious package sent to Glasgow University believed to be linked to devices found in London on Tuesday - police https://t.co/O2Ey2e8qem A man thought to be in his 20s has died after being stabbed in Leyton, east London, on Wednesday afternoon - police https://t.co/AZeP5ANdzC Man guilty of organising acid attack on his three-year-old son at a shop in Worcester https://t.co/vAiqd08kjN Ex-Nissan boss Carlos Ghosn released on bail set at $9m after more than 100 days in detention in Japan https://t.co/HJCGKa4PM8 RT @BBCSport: OH MY \ud83e\udd2f\n\nAjax have absolutely STUNNED Real Madrid to knock them out of the #UCL! \n\nReport: https://t.co/StVtbmvkUM https://t.\u2026 UK counter-terror police are investigating three \"small improvised explosive devices\" found at Heathrow Airport, London City Airport &amp; London's Waterloo station\n\nhttps://t.co/7Y3qsIj1Wm Ex-Nissan boss Carlos Ghosn granted bail by Tokyo court, Japanese media report https://t.co/QHudLNk3k0 Top minister in Canadian PM Justin Trudeau's cabinet quits in growing political crisis over alleged corruption case https://t.co/2fn09JhOvq Actor Luke Perry, star of Beverly Hills, 90210 and Riverdale, dies at age of 52 after suffering stroke last week https://t.co/scpYohWG1K Venezuela's self-declared interim leader Juan Guaid\u00f3 arrives at Caracas airport, where he faces risk of arrest https://t.co/knkM8hmffP The Prodigy's Keith Flint, singer on hits such as Firestarter and Breathe, dies aged 49\n\nhttps://t.co/1FkPQpUMCO https://t.co/RIYqrXiTAI Canada begins procedure to extradite to US Huawei chief executive Meng Wanzhou, but court must make final decision https://t.co/GQKLewPALh The moment Indian fighter pilot Abhinandan Varthaman crosses Pakistan border, following his release two days after his jet was shot down over Pakistan-administered Kashmir \n\nhttps://t.co/2JUwGMq3Qu https://t.co/nEJqfnpRTy Captured Indian pilot crosses Pakistan border in what Pakistan PM says is a \"peace gesture\" after recent clashes https://t.co/Jhyelxldq8 The family of American who died after being released from North Korean jail criticise Trump praise for Kim Jong-un https://t.co/WDvnnnPNgI UK government's 'Right to Rent' scheme asking landlords to check tenants' immigration status incompatible with human rights, High Court rules\nhttps://t.co/lc69kDh5Xb UK government pays \u00a333m to Eurotunnel after accusation of \"secretive\" process over no-deal Brexit ferry contracts https://t.co/1Q1VaYx7yo North Korea says its position will not change even if US seeks further talks, after Trump-Kim summit https://t.co/Ck2Hxy2Iz5 Andre Previn, Oscar-winning film composer, conductor, and star of famed Morecambe and Wise sketch, dies at 89 https://t.co/tken5WGM4t Israeli attorney general seeks charges against PM Benjamin Netanyahu in alleged fraud and bribery case https://t.co/BhbDXSsQiV Woman who killed husband in hammer attack after 'decades of abuse' faces retrial after murder verdict quashed https://t.co/jWlROVYYdT Captured Indian pilot to be freed Friday as a peace gesture, Pakistani PM Imran Khan says, amid tension over Kashmir https://t.co/kAqF6in0wt Net migration from EU to the UK drops to 10-year low - Office of National Statistics\n\nhttps://t.co/MJKHyAV2vl Trump-Kim summit talks break up early and White House says no agreement has been reached https://t.co/UOC1YxCv8l Donald Trump and Kim Jong-un sit down for a day of talks, with nuclear weapons and peace on the agenda. https://t.co/eOZxM95xRY MP Chris Williamson suspended from the Labour Party following remarks about the party's handling of anti-Semitism https://t.co/3xPiTCvub2 At least 12 dead after fire erupts in main railway station Ramses in Egypt's capital, Cairo https://t.co/WhUkXJhcya Pakistan says it shot down two India Air Force jets in its airspace in Kashmir and arrested one pilot on the ground https://t.co/IXgfeCezyb Nigerian President Muhammadu Buhari has been re-elected in a result rejected by the main opposition party https://t.co/4gFvSwyUAr RT @BBCSport: It's official.\n\nBrendan Rodgers is the new manager of Leicester City.\n\n\ud83d\udc49 https://t.co/u7t4ZAAH8F https://t.co/YeGuLf9spq UK PM Theresa May to propose Commons votes on no-deal Brexit and Brexit delay, if MPs reject her plan next month https://t.co/FQ9sUpA2of India confirms it has launched air strikes against militants, drawing a Pakistani military response https://t.co/Rp5W5Iivn5 North Korea's Kim Jong-un arrives in Vietnam from China\n\nhttps://t.co/VWmvt3gsUV Cardinal George Pell guilty of sexual abuse in Australia, becoming the top Catholic cleric convicted of such crimes https://t.co/qWJefERfBL Labour says it is prepared to back another EU referendum to prevent a \"damaging Tory #Brexit\" \n\nhttps://t.co/vuK6yy3K7y UK has warmest February day on record with temperatures hitting 20.3C in Wales https://t.co/Zcd743jDun Eyes on the prize.\n\nGreen Book wins Best Picture at #Oscars2019.  \nLive #Oscars2019 coverage https://t.co/baLZVeWgYR and winners list https://t.co/5D01SaLsoZ https://t.co/1vFrgqh2UC Best Director: Alfonso Cuaron, Roma\n\nLive #Oscars2019 coverage https://t.co/baLZVeWgYR and #Oscars winners list https://t.co/5D01SaLsoZ https://t.co/x8Hc5PO4f7 \"Ooh it's genuinely quite stressful!\" Olivia Colman is overcome as she wins best actress Oscar for The Favourite https://t.co/Zl9mAKkwZd And Olivia Colman just won Best Actress in a Leading Role for The Favourite \n\nLive #Oscars2019 coverage and https://t.co/baLZVeWgYR #Oscars winners list https://t.co/5D01SaLsoZ https://t.co/Oloi6LYCUx And the Oscar for best Actor in a Leading Role goes to Rami Malek, Bohemian Rhapsody\n\nLive #Oscars2019 coverage and https://t.co/baLZVeWgYR #Oscars winners list https://t.co/5D01SaLsoZ https://t.co/I7KwSVH02k Bangladeshi airline makes emergency landing in Chittagong following an \"attempted hijack\" https://t.co/TsrFHUeMAh RT @BBCSport: Claude Puel has left his role as manager of Leicester City following Saturday's 4-1 defeat to Crystal Palace in the Premier L\u2026 RT @BBCSport: FT: Wales 21-13 England\n\nThe defining match of this year's #SixNations? Wales have beaten England after an absorbing battle i\u2026 Violent clashes break out on Venezuela-Colombia border, that was shut to stop aid arriving - follow our live updates https://t.co/rivKJl0Y14 Singer R Kelly has been charged with sexual offences in Illinois, US media report https://t.co/sGv0fIpKCN Actor Jussie Smollett suspended from US TV series Empire after charges of faking assault, producers say https://t.co/MvO2El7otB The 16-year-old who murdered Alesha MacPhail, six, on Isle of Bute can be named as Aaron Campbell, judge rules https://t.co/kJx9qB4pPP RT @BBCSport: Chelsea have been banned from signing new players in the next two transfer windows \n\ud83d\udc49 https://t.co/q8yauusi27 #CFC https://t.\u2026 Labour MP for Dudley North, Ian Austin, says he is quitting the party - but has no plans to join Independent Group https://t.co/jJy7itD2Pk A 16-year-old boy is found guilty of the abduction, rape and murder of six-year-old Alesha MacPhail on Isle of Bute https://t.co/MahhUkMmso Three MPs - Sarah Wollaston, Heidi Allen and Anna Soubry - leave the Tory party to join Labour breakaway group https://t.co/F32zMjb75s Proposed merger between Sainsbury's and Asda could lead to worse deal for shoppers, warns competition watchdog https://t.co/r9NnI9jMIb Joan Ryan becomes eighth Labour MP to quit the party for Independent Group, citing \"culture of anti-Jewish racism\" https://t.co/OM02wCkQMQ Shamima Begum, who joined Islamic State in Syria aged 15, to lose her UK citizenship, family\u2019s lawyer says https://t.co/PQngJOKkJb Superstar fashion designer Karl Lagerfeld dies, aged 85, in Paris, French media report https://t.co/gS8G5OhHFQ Coalition of 16 US states sues Trump administration over decision to declare emergency over border wall https://t.co/hZUin4vLdd \"The US cannot crush us\" - boss of Chinese telecoms giant Huawei tells BBC about pressure on his firm and daughter https://t.co/cLo6FERPXF Japanese carmaker Honda set to announce closure of Swindon plant in 2022, putting 3,500 jobs at risk, sources say https://t.co/AOg17XBcJG UK MPs Chuka Umunna, Luciana Berger, Chris Leslie, Angela Smith, Mike Gapes, Gavin Shuker and Ann Coffey quit Labour https://t.co/HXhplLVwro Veteran Welsh Labour MP Paul Flynn dies at the age of 84, his local party annnounces https://t.co/ai7VqeqPVQ British regional airline Flybmi goes into administration, with all its flights cancelled https://t.co/C6SVl37QWQ Nigerian presidential election delayed for a week - election commission https://t.co/rquNPXtrEu Five dead and several injured after gunman opened fire at an industrial park in Illinois, police say. https://t.co/Mfi3LKkQwx Man charged with murders of three elderly men in Exeter https://t.co/1ntxf6Fqm0 Family of teenager Shamima Begum - who fled to join IS - call for UK government to bring her back \"urgently\" https://t.co/MHbYi603Wm \"We want to stop drugs... criminals and gangs from coming into our country\"\n\nTrump says he will declare a national emergency to fund a wall on the Mexico border\n\nhttps://t.co/fnkJ7yPjyT https://t.co/CjuTO4vw2o President Trump confirms he'll use emergency powers to build a wall on Mexico's border, saying \"walls work\" https://t.co/jeO7voqgnt President Trump will declare national emergency to get funding for border wall, says top Republican https://t.co/k3rB6KICW7 \"Vote shows there is no majority for the prime minister's course of action\"\n\nGovernment \"cannot keep ignoring Parliament... without a coherent plan\" - Labour leader Jeremy Corbyn responds as UK PM Theresa May suffers fresh #Brexit defeat https://t.co/NiQcjegPHS https://t.co/eYRZJ5avB6 PM Theresa May suffers a fresh defeat in Commons vote on her Brexit strategy by 303 to 258 https://t.co/pGwngjICUY Duke of Edinburgh will not face prosecution over road crash near Sandringham in January, CPS says https://t.co/kI4bSyC9hw UK inflation rate falls to 1.8% in January, down from 2.1% the previous month, Office for National Statistics says https://t.co/81wnyBYZQC Mexican drug lord Joaqu\u00edn \"El Chapo\" Guzm\u00e1n found guilty in US trial https://t.co/xTUEOoL6IB \"Gang of extremists\": Trump's White House is condemned by Venezuela's under-fire Nicolas Maduro in BBC interview https://t.co/c5SM2viFAe Gordon Banks, England\u2019s 1966 World Cup-winning goalkeeper, has died aged 81 https://t.co/mmtHVCq2mj Democrats and Republicans reach agreement in principle to fund the US government and avert another partial shutdown https://t.co/vU8PXjN3qb Man, 43, detained on suspicion of arson in connection with fire at a medical centre in Tamworth, Staffs, police say https://t.co/zhIaUpRr08 Horse racing in Britain will resume on Wednesday after a six-day shutdown following an outbreak of equine flu https://t.co/3fySGMwohT Bahraini footballer and refugee Hakeem al-Araibi leaves Thai jail after Bahrain withdraws extradition request https://t.co/x0L0TmSyLh The Duke of Edinburgh is to voluntarily give up his driving licence, Buckingham Palace says https://t.co/35eFtXMGNK Thai king says his sister's unprecedented bid to run for prime minister is \"inappropriate\" - palace statement https://t.co/EvcqGvgKuP Obituary: Albert Finney, the actor who transformed British theatre &amp; cinema and became a Hollywood star https://t.co/nhiQxR3jZd https://t.co/gcsAXEf9P4 Man and woman arrested in connection with the death of four children in a house fire in Stafford on Tuesday https://t.co/UQlu652ti8 Oscar-nominated British actor Albert Finney has died aged 82 after a short illness https://t.co/CHB361glom Ten people die in fire at Flamengo football club's training ground in Rio de Janeiro, Brazilian media report https://t.co/GhMy4F4Zvd Thai king's sister joins election race to become Thailand's next prime minister https://t.co/13bPH27Jju Body recovered from wreckage of crashed plane is that of Cardiff City player Emiliano Sala, Dorset Police say https://t.co/4cAi2Q49L4 The body found in wreckage of plane carrying footballer Emiliano Sala and pilot David Ibbotson has been recovered https://t.co/gjW5pVPwFU Two men die after falling while walking on Ben Hope in Sutherland, Police Scotland say https://t.co/8vng5igbmW US President Donald Trump expected to visit UK in December for Nato summit https://t.co/FkGRaABFTs US President Donald Trump announces a second summit with North Korean leader Kim Jong-un in Vietnam in late February\n\n#SOTU https://t.co/zFC2dSynzQ https://t.co/I8lMxYWIoW Police searching for missing 19-year-old Reading student Daniel Williams find a body in a lake near the university https://t.co/JxoJfFTeXA Four children have died in a house fire in Staffordshire, say police https://t.co/BdSpuZggWZ Body seen in wreckage of plane carrying missing footballer Emiliano Sala, Air Accidents Investigation Branch says https://t.co/V0ZH98DzvQ UK, Spain and France among European countries now recognising Juan Guaido as the interim president of Venezuela\n\nhttps://t.co/pK4ziotq1s Touchdown! New England Patriots defeat Los Angeles Rams 13-3 to win sixth #SuperBowl https://t.co/PIaDbH5dNq https://t.co/dkxKAinhBz RT @BBCSport: \ud83c\udfc8\ud83c\udf89THE NEW ENGLAND PATRIOTS ARE SUPER BOWL CHAMPIONS! \ud83c\udf89 \ud83c\udfc8 \n\nThey make history with a record-equalling sixth #SuperBowl win! \ud83c\udfc6\ud83c\udfc6\u2026 Wreckage from plane which disappeared with Cardiff City's Emiliano Sala and pilot on board found in English Channel https://t.co/U5eqGobaY5 Mother of three-year-old girl becomes first person in UK to be found guilty of female genital mutilation https://t.co/FOWnNdtkVf Comedian Jeremy Hardy, regular on Radio 4's The News Quiz, has died of cancer, publicist confirms https://t.co/gZ1EzaMlhF Irish backstop is \"part of the Withdrawal Agreement, and the #WithdrawalAgreement is not open for re-negotiation\" - @eucopresident Donald Tusk responds after UK PM Theresa May backed to reopen #Brexit negotiations\n\nhttps://t.co/w154AYCj8S Labour leader Jeremy Corbyn says he will meet UK PM Theresa May to discuss his party's approach to the #withdrawalagreement\n\nLive #Brexit coverage: https://t.co/axZavRgGH5 https://t.co/hRG4vgKUmc \"It is now clear that there is a route that can secure a substantial and sustainable majority in this House for leaving the EU with a deal\" - UK PM Theresa May reacts after MPs back her bid to change #withdrawalagreement\n\nLive #Brexit coverage: https://t.co/axZavQZ5iv https://t.co/GTHTnsyAhp UK MPs back Theresa May's bid to change #Brexit deal by requiring alternatives to Irish border \"backstop\" plan #WithdrawalAgreement  https://t.co/TdJTR9KtkQ UK MPs back alternative move to stop no-deal #Brexit, in non-binding vote #WithdrawalAgreement https://t.co/TdJTR9KtkQ The moment MPs reject Yvette Cooper's amendment which sought an extension of Article 50 if MPs have not approved the #WithdrawalAgreement by 26 February\n\nLive #Brexit coverage: https://t.co/axZavRgGH5 https://t.co/BfUQ3XoQn5 MPs reject plan aimed at preventing no-deal Brexit if Theresa May cannot get her deal through House of Commons https://t.co/2IYzQ0n0ip RT @BBCSport: Conor McGregor has been suspended for six months and fined $50,000 for his part in the ugly scenes which marred UFC 229 in Oc\u2026 Canadian Bruce McArthur admits killing eight men, most of them with links to Toronto's Gay Village neighbourhood https://t.co/4EZY13M0iK Peterborough MP Fiona Onasanya, who lied to police about being behind the wheel in a speeding car, jailed for three months\n\nhttps://t.co/OJEcVG1imO PM Theresa May to ask EU to reopen withdrawal agreement, she tells cabinet https://t.co/1hZxwC5oWH Pakistan's top court rejects challenge to acquittal of Christian woman Asia Bibi on blasphemy charges https://t.co/Q7b77PLorD US justice department charges Chinese tech firm Huawei with multiple counts of fraud, raising US-China tensions https://t.co/eh9aMHIl2v US imposes sanctions on Venezuela's state-owned oil firm and urges military to accept peaceful power transfer https://t.co/XgjaZZAvpj RT @BBCSport: CHAMPION!\n\nNovak Djokovic wins a record seventh Australian Open men's singles title with a straight sets victory over Rafael\u2026 RT @BBCSport: CHAMPION!\n\nNaomi Osaka wins the Australian Open women's singles title for the first time with a dramatic victory over Petra K\u2026 \"Walls should not be controversial... walls work\" - President Donald Trump lays out the case for his border wall as he announces deal to temporarily end US government shutdown \n\nLatest on the continuing talks: https://t.co/fvJJFMJmSE https://t.co/SeJUG2Iz3E \"We have reached a deal to end the shutdown\" - President Donald Trump announces details of deal reached to temporarily end the longest government shutdown in US history \n\nhttps://t.co/fvJJFMJmSE https://t.co/ifFPzKrEU8 US partial shutdown to be lifted temporarily as President Trump announces deal to fund government while talks go on https://t.co/soGpqQUjrh Flights halted into New York's LaGuardia Airport due to air traffic control staff shortages as US shutdown continues https://t.co/yKXfDVAqwb Greek parliament votes narrowly to back unpopular deal on renaming neighbour North Macedonia, settling 27-year row https://t.co/6ZW1GD5IaG Trump ally Roger Stone charged with seven counts in Mueller probe, including obstruction and witness-tampering https://t.co/lqsCkc6QTr Search for missing footballer Emiliano Sala and pilot David Ibbotson called off after rescuers fail to find plane https://t.co/8imbUQtrsA Ex-Scottish First Minister Alex Salmond charged with two attempted rapes and multiple sexual assaults https://t.co/sA4sgRqQTK Former Scotland First Minister Alex Salmond arrested by police https://t.co/HoZsoZZT9x Donald Trump says he will not deliver his State of the Union speech until after the government shutdown is over https://t.co/rCBPx0L2NQ Venezuela gives all US diplomats 72 hours to leave after Trump recognises opposition as \"legitimate\" leaders \n\nhttps://t.co/OWtGXiUoqS US President Donald Trump says he recognises Venezuelan opposition leader Juan Guaid\u00f3 as interim president https://t.co/hSMsxr258V Man convicted of killing date in speedboat crash in UK hands himself in to police in Georgia after months on run https://t.co/js5whXb5Eq US police arrest 36-year-old nurse after patient in a vegetative state gave birth https://t.co/3RcTGpygMU President Trump's ban on transgender people serving in military to go ahead after Supreme Court ruling https://t.co/88iDKC7tCG Premier League footballer Emiliano Sala was on plane missing over the English Channel, French authorities confirm https://t.co/SPFjElQrbs RT @BBCSport: Huddersfield have appointed Jan Siewert to succeed David Wagner as manager.\n\nMore: https://t.co/FGC6jcYEMn https://t.co/X39p0\u2026 DR Congo court rejects opposition appeal against presidential election result, upholding victory of Felix Tshisekedi https://t.co/QdbBI491sy Trump offers Democrats deal on immigration in bid to end shutdown but top Democrat Pelosi calls it \"unacceptable\" https://t.co/edz3WEREm3 Police investigate suspected car bomb in Londonderry, with vehicle on fire at Bishop Street Court House. https://t.co/iURzstW4Tm Man arrested on suspicion of murder by police investigating moped death of teenager Jaden Moodie in east London https://t.co/YWiZGq0cQW Donald Trump will hold second summit with North Korea's leader Kim Jong-un at end of February, White House says https://t.co/j5ngOLlIkx Duke of Edinburgh involved in car crash near Sandringham Estate but not injured, Buckingham Palace says https://t.co/M5ap61Ac2l Hitachi to suspend work on nuclear plant, in Anglesey, north Wales, putting thousands of jobs at risk https://t.co/di9F1e4Aq9 Labour leader Jeremy Corbyn calls on UK government to remove \"once and for all the prospect of the catastrophe of a no-deal #Brexit\" after PM Theresa May wins confidence vote\n\nhttps://t.co/sQNa5Vp7Tu https://t.co/aekre2xqwD UK PM Theresa May invites leaders of other parties to meet with her to discuss #Brexit, starting tonight, after government wins confidence vote\n\nhttps://t.co/sQNa5Vp7Tu https://t.co/DmxZ5YWe0j Theresa May's government survives a no confidence vote by 325 to 306 - but has yet to get MPs to back a Brexit plan\n\nhttps://t.co/sQNa5Vp7Tu https://t.co/VG6bKJqDCM Armed attack at Nairobi hotel is now over, Kenya's president says, after sporadic gunfire continued overnight https://t.co/mGb6JdW74L Labour leader Jeremy Corbyn tables motion of no confidence in UK PM Theresa May's government after heavy defeat in MPs' #BrexitVote\n\nLatest: https://t.co/JXfWlrcIzk https://t.co/DbHiJcQVMZ \"Every day that passes without this issue being resolved means more uncertainty, more bitterness and more rancour\" - UK PM Theresa May reacts to huge government loss in #BrexitVote\n\nLatest: https://t.co/JXfWlrcIzk https://t.co/V5uXaFQITg Labour leader Jeremy Corbyn tables no confidence motion in Theresa May's government after #BrexitVote defeat\n\nhttps://t.co/yP9wknEBDq UK PM Theresa May loses MPs\u2019 #BrexitVote on her deal by 432 votes to 202 - the biggest government defeat since 1924\n\nLatest: https://t.co/JXfWlrujXU https://t.co/V5eytNPfLl Follow our ongoing #BrexitVote coverage on a night of political drama in Westminster\n\nhttps://t.co/JXfWlrujXU https://t.co/JNgVbytZ80 Militant group Al-Shabaab claims responsibility for terror attack at Nairobi hotel complex \n\nLatest updates: https://t.co/cvQTSYb7Ra https://t.co/jSbTtBW0lI Explosions and gunfire reported around hotel complex in Kenyan capital, Nairobi https://t.co/5QlnnDWDo4 International Criminal Court frees Ivory Coast ex-leader Gbagbo, dropping charges of crimes against humanity charges https://t.co/kBLbT4Wl4i RT @BBCSport: David Wagner has left Huddersfield Town as manager by mutual consent with the club bottom of the Premier League.\n\nMore: https\u2026 Mayor of Polish city who was stabbed onstage at a charity event dies of his injuries, Gdansk hospital says https://t.co/uJKKSUiR2R RT @BBCSport: Roberto Bautista Agut wins! \n\nThe Spaniard takes victory over Andy Murray 6-4 6-4 6-7 (5-7) 6-7 (4-7) 6-2.\n\nAnd there ends a\u2026 Scottish First Minister Nicola Sturgeon refers herself to standards panel over handling of Alex Salmond allegations https://t.co/NQZQigQRBf Saudi teenager Rahaf al-Qunun, who fled her family and got stranded in Bangkok, has arrived in Canada after being granted asylum https://t.co/78dZoOoNUS French officials now say two people were killed in the suspected gas explosion in central Paris https://t.co/JiSPTN5WRs Four people killed in central Paris after an explosion from a suspected gas leak caused a huge fire at a bakery https://t.co/KMHpQ6ThNF Four working single mothers win High Court challenge over their universal credit payments https://t.co/XHLgnduaN3 Family of London teenager Jayden Moodie say he was not linked to gangs and was \"murdered in cold blood\" https://t.co/P9AVQUNLu2 Opposition candidate Felix Tshisekedi wins DR Congo presidential election, electoral commission says https://t.co/gA8EJeJqud Car believed to be involved in murder case of Jayden Moodie, 14, found by police in London https://t.co/SUt5k6RXqI Democrats say Trump slammed the table and walked out of shutdown talks, while president calls meeting waste of time https://t.co/bVAeLkSRY6 MPs vote to force the government to announce new Brexit plans within three days if PM's deal fails in the Commons https://t.co/P8dTKlYaIF A Saudi woman who fled her family and refused to leave a Bangkok hotel given refugee status by UN, Australia says https://t.co/8mHejj4XL4 Australian police responding to suspicious packages found at foreign consulates in Melbourne https://t.co/aobcNTLVxo President Trump demands funding for a \"steel barrier\" along the border with Mexico to halt a \"crisis\" https://t.co/1cmXQeIsUX MPs defeat UK government and back measures designed to thwart no-deal Brexit preparations https://t.co/grkTVYCH5d Heathrow Airport says flights have resumed after departures were halted amid drone sighting reports https://t.co/asTHzwAn69 Military are preparing to deploy anti-drone equipment at Heathrow \"should it prove necessary\", says British Transport Minister Chris Grayling https://t.co/asTHzwAn69 Departures at London\u2019s Heathrow airport stopped after drone sighting https://t.co/7kXhnSDkbJ Military says it has seized power in oil-rich Gabon, where the ailing leader's family has ruled for 50 years https://t.co/QA79azyW1m Sandra Oh. \n\nGlenn Close. \n\nRami Malek and Bohemian Rhapsody. \n\n#GoldenGlobes2019 https://t.co/tMQgNxEJg4\n\nWinners list here: https://t.co/EXlVpWNxz0 #GoldenGlobes2019: Bohemian Rhapsody wins Best Motion Picture (Drama) https://t.co/EXlVpWNxz0 #GoldenGlobes2019: Rami Malek wins Best Actor (Drama) for Bohemian Rhapsody https://t.co/EXlVpWNxz0 #GoldenGlobes2019: Glenn Close wins Best Actress (Drama) for The Wife https://t.co/EXlVpWNxz0 #GoldenGlobes2019: Green Book wins Best Motion Picture (Comedy or Musical) https://t.co/EXlVpWNxz0 #GoldenGlobes2019: Olivia Colman wins Best Actress (In A motion Picture - Comedy or Musical) for The Favourite https://t.co/EXlVpWNxz0 #GoldenGlobes2019: Alfonso Cuaron wins Best Director (Motion Picture) for Roma https://t.co/EXlVpWNxz0 #GoldenGlobes2019: Michael Douglas wins Best Actor (In A Television series - Musical or Comedy) for The Kominsky Method https://t.co/EXlVpWNxz0 #GoldenGlobes2019: Christian Bale wins Best Actor (In A Motion Picture - Comedy or Musical) for Vice https://t.co/EXlVpWNxz0 #GoldenGlobes2019: Mahershala Ali wins Best Supporting Actor (In A Motion Picture) for Green Book https://t.co/EXlVpWNxz0 #GoldenGlobes2019: Sandra Oh wins Best Actress (In A Television Series - Drama) for Killing Eve https://t.co/EXlVpWNxz0 #GoldenGlobes2019: Regina King wins Best Supporting Actress (In A Motion Picture) for If Beale Street Could Talk\n\nhttps://t.co/EXlVpWNxz0 Darren Pencille, 35, is charged with murder of Lee Pomeroy, 51, stabbed to death on a train in front of his son https://t.co/g1mW3DutsS Donald Trump says US strike in Yemen killed Jamal al-Badawi, al-Qaeda militant behind deadly 2000 attack on USS Cole https://t.co/05mwBAq9uw Gold mine collapse in Afghanistan kills at least 30, officials say https://t.co/FtLdjy4RS9 Two British special forces soldiers seriously injured after being hit by missile in an Islamic State attack in Syria https://t.co/866FEhQv9A Relatives pay tribute to \"devoted family man\" Lee Pomeroy, 51, who was stabbed to death on Surrey train https://t.co/H35TwQ2q2a Suspect being sought for stabbing of a man on train in Surrey has been arrested, British Transport Police say https://t.co/MVSKjAAAtV A man has been shot dead by police during an \"intelligence-led\" operation in Coventry, the West Midlands force says https://t.co/jyptRI99r3 Man stabbed to death on a train in Surrey was with his 14-year-old son who witnessed the \"horrific\" attack, police say https://t.co/QBA7Xu6rM6 Man stabbed to death on board a train near Horsley in Surrey, the BBC understands https://t.co/ju3iq8GnD2 North Korea's ambassador to Italy goes into hiding with wife, South Korea spy agency says https://t.co/pdmj6grvVA China successfully lands robotic mission on Moon's far side, state media say https://t.co/MwO8fb63D7 Iranian and Briton held in Manchester suspected of arranging \"movement of migrants\" across Channel - Crime Agency https://t.co/jaExnzwWUB Several people killed in train accident on bridge spanning two Danish islands, authorities say https://t.co/ALNVhAeJWw Man held over Manchester New Year's Eve terror attack has been detained under the Mental Health Act, say police https://t.co/VPjYZg2rqY Signals from Nasa probe confirm it survived flyby of Ultima Thule, most distant object ever explored in Solar System https://t.co/yh81HtPOsG \"We are treating this as a terrorist investigation\" - Greater Manchester Police confirm counter terrorism police are investigating the New Year's Eve stabbing outside Manchester station, which injured three \n\nhttps://t.co/Seq5Xj8uog https://t.co/IvMFgrhrdU Manchester stabbing which injured three people being treated as \"terrorist investigation\", say police https://t.co/qqNSzFS0CT Two UK Border Force boats to return from abroad to patrol Channel in response to migrants crossing - home secretary https://t.co/W3VQnIEYYz Actress Dame June Whitfield, known for her roles in sitcoms Terry and June and Absolutely Fabulous, has died aged 93 https://t.co/pU2db41Sro Hanover airport currently closed after car is driven through gate and onto the tarmac near runway - police https://t.co/Id0c0WNosl He's a Sir and he's OK: Monty Python's Michael Palin knighted; Twiggy &amp; Gareth Southgate also among New Year Honours https://t.co/igJ7EgMA4k Casualties as tourist bus hit by blast near Cairo pyramids, Egyptian officials and media say https://t.co/JEMtjDOROD Rising number of migrants attempting to cross English Channel declared \"major incident\" by UK home secretary https://t.co/ZZXiqXty3Q Three men found guilty of murder after explosion at Leicester shop that killed five people https://t.co/vhwoAJGeVq Music retailer HMV poised to enter administration for the second time in six years, a move that would affect 2,200 staff https://t.co/non6ebpyxj Three British tourists, including a child, have died after their vehicle crashed while crossing a bridge in Iceland https://t.co/Nv5r7ktn4b President and First Lady have made Christmas visit to US troops in Iraq, White House confirms https://t.co/QxyfnGwMvV Governor of Puebla, one of Mexico's most populous states, killed in aircraft crash only days after being sworn in https://t.co/3PauZCvSsr Birmingham Airport says it must \"temporarily suspend services\" following air traffic control fault https://t.co/YANiqsmP3s Donald Trump announces dep defence secretary Shanahan as acting Pentagon chief following James Mattis's resignation https://t.co/7MORSGt7S2 Police investigating Gatwick Airport disruption say damaged drone has been found and is being forensically examined https://t.co/5tcOqNtQz2 Pair questioned over drone sightings that closed Gatwick airport released without charge, Sussex Police say https://t.co/Xjwm0GHqHj At least 222 people have died, and more than 800 are injured in Indonesia tsunami, officials now say\n\nLive updates: https://t.co/Swzujmgh1z https://t.co/ifVsTIBf3L At least 168 people have died and more than 700 are injured in Indonesia tsunami, and officials expect this to rise \n\nLive updates: https://t.co/RmUXZOiB17 A tsunami linked to the erupting Krakatoa volcano in Indonesia has killed at least 62 people, with 584 injured https://t.co/SMPuxtM0EZ At least 20 people killed in Indonesia after tsunami believed to be caused by activity at Krakatoa volcano https://t.co/8EgC58gT3W Former Liberal Democrats leader Paddy Ashdown dies aged 77 following short illness, party spokesperson says https://t.co/GPBnQxMMFK Top US official in fight against Islamic State group quits over President Trump's decision to pull troops from Syria https://t.co/VnP3oS3GLZ Flights resume after latest Gatwick Airport suspected drone sighting\n\nLive updates: https://t.co/vj5euyDDfn https://t.co/b7oo3bmQGT Flights at Gatwick suspended again due to new \"suspected drone sighting\", spokesman says https://t.co/F9XrVr9xeS Gatwick reopens after drone chaos causes airport to shut down but passengers told to check before travelling https://t.co/FXlsKhAXnr London's #Gatwick Airport reopens amid continuing Christmas travel chaos https://t.co/AoKKfPrQYc\n\nLandings still restricted, thousands remain stranded. Follow the latest updates here https://t.co/AlQImKjAGc #Gatwick disruption: Runway currently available, limited number of aircraft scheduled for departure and arrival, officials say \n\nLive coverage continues: https://t.co/AlQImKjAGc \u201cYou have the right to have a defence secretary whose views are better aligned with yours,\u201d Jim Mattis tells US President Donald Trump in resignation letter\nhttps://t.co/CdbJZ4Q39d https://t.co/iyhRWalqsM US Defence Secretary Jim Mattis to retire at the end of February, President Donald Trump says https://t.co/jDfQ1F1PEB Passengers are not to travel to Gatwick unless advised to by their airlines, airport chief says \n\nLive updates: https://t.co/uLe3M7kGiP https://t.co/PfPsBke5dP Gatwick to remain closed for the rest of Thursday, and Friday's situation is \"fluid\", airport chief says https://t.co/lQY7CH6sL0 UK interest rates kept on hold at 0.75% by Bank of England https://t.co/SUeGxsa15P President Trump's troop withdrawal from Syria will hamper fight against Islamic State group, says anti-IS alliance https://t.co/tZaezKF4iT The Yemeni mother of a toddler dying in the US arrives in California to see him, after the travel ban is relaxed https://t.co/gpzH6NMHfg Flights at Gatwick Airport halted amid reports of drone flying in area https://t.co/a0bWL81967 Peterborough MP Fiona Onasanya found guilty of perverting course of justice over a speeding ticket https://t.co/QOMpNTaNqj US preparing to withdraw forces fighting Islamic State group in Syria - media reports quoting defence officials https://t.co/0tVvoZQF4d Donald Trump's troubled charity foundation dissolved after allegations it was used for private and political gain https://t.co/MNEwxxhL8b RT @BBCSport: Jose Mourinho has been sacked by Manchester United.\n\nFull story: https://t.co/XL8Mju4W1u https://t.co/ZdRd3Vuoec Man, 21, admits killing ex-partner and her mother, who were stabbed to death in Solihull in August https://t.co/w3JuA5kIvM RT @BBCSport: The winner of BBC Sports Personality of the Year 2018 is\u2026\n\n\u2b50 GERAINT THOMAS \u2b50\n\n\ud83d\udcfa\ud83d\udcfb\ud83d\udcf1 https://t.co/f24qzdA3gV \n\n#SPOTY https://t\u2026 Nearly 200 nations agree rules on implementing 2015 Paris agreement at UN climate conference after marathon talks https://t.co/7PWy6ROdDV Trump announces Mick Mulvaney to be acting chief of staff replacing John Kelly who leaves by the end of year https://t.co/G111n6bAce Facebook bug exposed photos of up to 6.8 million users, including pictures they had not posted https://t.co/Kf7i5nGIdB French police have \"neutralised\" gunman who attacked a Strasbourg Christmas market - reports quoting police sources https://t.co/MZNOFJsZgY RT @BBCPolitics: UK PM Theresa May confirms she will not fight another General Election, saying she would \"love to be able to\" but her part\u2026 Warring parties in Yemen agree to ceasefire in port city of Hudaydah, principal lifeline for two-thirds of country https://t.co/pCt4I0E0qj RT @BBCSport: The FA's chief executive Martin Glenn will step down at the end of the 2018-19 season.\n\nhttps://t.co/81NoI263QK https://t.co/\u2026 A crash involving a Turkish high-speed train causes casualties in the capital Ankara, local media say https://t.co/d34Tu7aOsz UK Prime Minister Theresa May says she will \"get on with the job of delivering #Brexit\" after surviving a #ConfidenceVote by members of her Conservative party\n\nhttps://t.co/9Vw2gOQoDc https://t.co/Ke6cTamPsc \"The parliamentary party does have confidence in Theresa May\"\n\nChairman of 1922 Committee, Sir Graham Brady says PM wins #ConfidenceVote, with 200 out of 317 Conservative MPs supporting her leadership of the party\n\nhttps://t.co/9Vw2gOQoDc https://t.co/7Delcb1vO1 UK PM Theresa May wins confidence vote with 200 out of 317 Tory MPs supporting her to stay on as leader\n\nhttps://t.co/9Vw2gOQoDc https://t.co/bafuUsZoKa Michael Cohen, ex-Trump lawyer who once said he\u2019d take a bullet for the president, given 36-month jail term https://t.co/DZGKHwEo79 \"I will contest that vote with everything I've got\" - UK Prime Minister Theresa May says she will \"stand ready to finish the job\" as no-confidence vote is triggered\n\nFollow live updates: https://t.co/gTH05gW8Yy https://t.co/TeFWGMjVCj UK Prime Minister Theresa May tells MPs that ousting her as Tory leader would mean delaying or risking Brexit https://t.co/tXh9vApc4Z Conservative MPs to vote on UK PM Theresa May's leadership \n\u25aa\ufe0f Vote to take place between 6-8pm GMT\n\u25aa\ufe0f May due to make statement\nFollow live updates: https://t.co/gTH05hdKn8 UK Prime Minister Theresa May will face a vote of no confidence in her leadership later on Wednesday https://t.co/wzta1v9ScU Huawei row: Canadian court frees Chinese telecoms executive Meng Wanzhou on bail https://t.co/aU7LZ9V1ne Strasbourg shooting latest:\n\n*Two people killed and several injured, officials say\n*Gunman pursued by officers and injured in exchange of gunfire \n*France's counter-terrorism prosecutor opens investigation\n\nhttps://t.co/ooMdRvAwzg One person confirmed killed in shooting in French city of Strasbourg, six wounded, gunman on the run, police say https://t.co/ooMdRvAwzg Gunshots fired in centre of French city of Strasbourg, at least two people hurt, police say https://t.co/TMp7VrVsMt Man held by armed officers at UK Parliament in incident which police say is not terror-related\n\nhttps://t.co/UDtjdf0S6z France's President Macron promises minimum wage rise and tax concessions in response to weeks of violent protests https://t.co/eGF4pOfNIz \"We will not renegotiate the deal, including the backstop, but we are ready to discuss how to facilitate UK ratification\" - President of the European Council, Donald Tusk responds to delayed #BrexitVote\n\nhttps://t.co/p1kQ9xdSui \"Our country deserves better than this\" - Labour leader Jeremy Corbyn attacks Theresa May's #Brexit deal, after vote on it is delayed \n\n#BrexitVote reaction &amp; analysis: https://t.co/9YFcnNsq4G https://t.co/7fJS4u719O If you take a step back, it is clear that we face a \"fundamental question.\"\n\n\"Does this House want to deliver #Brexit?\" - Theresa May poses question to the Commons\n\n#BrexitVote latest: https://t.co/CLb0CpBJD6 https://t.co/sfQS00qTgA UK PM Theresa May says she will continue talks with EU leaders after #BrexitVote deferred, but insists her deal honours result of referendum https://t.co/9YFcnNsq4G https://t.co/gsQQU4P42D \"On one issue, the Northern Ireland backstop, there remains widespread and deep concern\"\n\nThe moment UK Prime Minister Theresa May announced the Brexit vote was being postponed\n\n#BrexitVote latest: https://t.co/9YFcnNsq4G https://t.co/VQubmbDGWw UK PM says there is \"widespread and deep concern\" over Irish border backstop and confirms delay to key Brexit vote https://t.co/KQktdn8XVa Convicted paedophile Russell Bishop found guilty of murdering two nine-year-old girls in Brighton 32 years ago https://t.co/8hS3XOqEKU The UK can unilaterally revoke its withdrawal from the EU, the European Court of Justice has ruled https://t.co/pBq9QmWr5r A 26-year-old man has appeared in court in New Zealand charged with the murder of British backpacker Grace Millane https://t.co/nhRTkke6pB Police in New Zealand investigating the murder of British backpacker Grace Millane have found a body https://t.co/jaOHfIY03j Donald Trump says chief of staff John Kelly to leave job by the end of the year https://t.co/Yoi05BQYyx Six killed and 100 wounded in night-club stampede near Ancona on the east coast of Italy https://t.co/VsGaVB7JR7 New Zealand Police believe missing 22-year-old British backpacker Grace Millane has been murdered https://t.co/8Tm6BiDjnN US prosecutors seek \"substantial\" jail term for Donald Trump's former personal lawyer Michael Cohen over tax crimes https://t.co/ZgtGwLnYFS China launches rocket in first attempt to land robotic craft on the far side of the Moon https://t.co/GK4hsNkWwi Huawei executive Meng Wanzhou faces fraud charges over sanction-breaking dealings with Iran, Canada court hears https://t.co/OPtjkjrUDf Ted Baker chief executive to take leave of absence after further \"serious allegations\" amid hugging claims https://t.co/xCFulrgjuI English yachtswoman Susie Goodall rescued by cargo ship, two days after her boat capsized 2,000 miles west of Cape Horn\n\nhttps://t.co/zgXawNLfhu Germany's ruling CDU chooses Annegret Kramp-Karrenbauer as new party leader, but Merkel to stay Chancellor for now https://t.co/00NwI0RJEu Virgin Atlantic pilots to strike from 22 December to Christmas Day in dispute over union recognition, union says https://t.co/EsB3sjxzqR President Trump nominates William Barr to be new attorney-general, a post he held in 1990s, and oversee Russia probe https://t.co/V7xuqh3LED UK mobile phone company O2 says its 3G and 4G data services have been restored after a day of disruption https://t.co/JETMSm6E5k Pete Shelley, lead singer of punk band Buzzcocks, dies aged 63 of suspected heart attack https://t.co/OAaSRAEGER Brexit TV debate between Theresa May and Jeremy Corbyn on Sunday cancelled after ITV scraps plans https://t.co/E2h4J6exFH Leicester City helicopter crash pilot lost control after his pedals disconnected from tail rotor blades, report says https://t.co/qbXmG3D6sR Two ex-Tesco directors acquitted of charges of fraud and false accounting after judge dismisses case https://t.co/klQqTAaBdK Police investigating extreme right-wing activity in UK arrest three men on terror charges https://t.co/A7NAD5IFVU Government publishes Brexit legal advice in full, the day after MPs found it in contempt of UK parliament https://t.co/O5kmhaBm1c MPs approve amendment which aims to give Commons greater say should #Brexit deal be defeated in vote on 11 December\n\nFollow latest developments: https://t.co/xMNz3SwRTl https://t.co/KpjKEMhTTz The moment MPs vote to hold Theresa May's government in contempt of Parliament by 311 votes to 293\n\n#Brexit latest: https://t.co/xMNz3SwRTl https://t.co/O0Q5GT2FYV Government to publish Brexit legal advice in full, after MPs find it in contempt of UK Parliament https://t.co/PTE3k6Vs50 RT @BBCSport: Russian athletes will remain banned from international competitions after the IAAF upheld the country's suspension into 2019.\u2026 French government to suspend fuel tax rise which has led to weeks of violent protests , local media report https://t.co/48BBhPJxNM UK government may have been in contempt of Parliament by not publishing Brexit legal advice, Commons Speaker rules https://t.co/osk18Kg8GY RT @BBCSport: Mark Hughes has been sacked as Southampton manager after eight months in charge.\n\nMore: https://t.co/EWCdJdATW3 https://t.co/\u2026 RT @BBCSport: Tyson Fury and Deontay Wilder fought to a stunning draw in their WBC world heavyweight title fight in Los Angeles.\n\nReport: h\u2026 RT @BBCSport: An INCREDIBLE FIGHT.\n\nBut they can't be separated on the decisions! \n\n#WilderFury https://t.co/CSbCyH5mra #bbcboxing https://\u2026 HS2 rail chairman Sir Terry Morgan tells BBC he expects to be sacked within days, months after getting job https://t.co/97cS3bAtYs Labour's Kate Osamor quits as UK shadow minister to \"support family\" after events surrounding son's drugs conviction https://t.co/4T6ejPZhpR Dozens arrested as police and protesters clash in Paris during third weekend of \"yellow vest\" demonstrations sparked by rising fuel prices https://t.co/0dCP8dlmTX Police searching for couple missing after car washed up on beach in Scotland find two bodies https://t.co/cbjZeJSnda Flags at half-mast over White House in tribute to 41st US President George H.W. Bush, who has died aged 94, as Donald Trump says \"his example lives on\" \n\nLatest reaction: https://t.co/dshIBZWWa3 https://t.co/ackIAo2bTO Former US President George HW Bush has died at the age of 94, his son George W Bush has announced https://t.co/4eHTCWtAw0 Marriott says details of up to 500 million guests may have been accessed in breach of its reservation database https://t.co/gchHf5I8No Ukraine bars Russian men from entering the country, days after it cited fears of a Russian land invasion https://t.co/ow0acIwezA \"There would have been nothing wrong if I did do it, it was my business\" - US President Donald Trump denies involvement in Moscow project, claiming lawyer Michael Cohen is \"lying to reduce his sentence\"\n\nhttps://t.co/n2aCQKb6qn https://t.co/yrTeeA4SxB Trump ex-lawyer Michael Cohen to plead guilty to lying to Congress in relation to Russia inquiry: US media https://t.co/xPd6dSpJSZ UK's economy could shrink by 8% in immediate aftermath of no-deal Brexit, Bank of England warns https://t.co/Zes81UpPRz Brexit deal could cut GDP by 3.9% over 15 years but a no-deal could mean a 9.3% cut, says Treasury analysis https://t.co/WQVVQqDMWM Chinese scientist defends controversial claim to have created 'world's first gene-edited babies' https://t.co/cuYZzIF403 British academic Matthew Hedges praises \"brave and strong\" wife Daniela as he arrives back in UK after being pardoned by UAE\n\nhttps://t.co/yHt6bdcNVz https://t.co/hDlf37qrFx Matthew Hedges, British academic jailed for spying in UAE, arrives home in UK after being pardoned https://t.co/DYR8Ux0c2G Touchdown! @NASAInSight probe lands on Mars, mission control in Pasadena, California confirms https://t.co/fdbXMMAq5P #MarsLanding Ukraine approves martial law after clashes at sea with Russia, giving the government firm powers over citizens https://t.co/hWqXDHwYnB British academic Matthew Hedges is released from prison in the UAE after a presidential pardon\n\nhttps://t.co/qI88fKdIzH British academic Matthew Hedges, jailed for spying in the UAE, is pardoned with immediate effect https://t.co/2LtVIVgzBE Mexico says it will immediately deport nearly 500 migrants accused of trying to breach the US border near Tijuana https://t.co/B1vU6kBSTS Ukraine's navy accuses Russia of firing on and seizing some of its ships off the coast of annexed Crimea https://t.co/KDUY9dFKyO UK\u2019s withdrawal agreement from European Union approved by EU leaders, chief Donald Tusk says https://t.co/YqMLQDyprJ Director Nicolas Roeg, whose films include Don't Look Now and Performance, has died aged 90, his family says https://t.co/a4sha5240D Latest pictures: Clashes on the Champs Elysees as Paris police use tear gas and water cannon on fuel price protesters\n\nhttps://t.co/lLa7vdmwcV https://t.co/RdVJMX68P7 French police fire water cannon and tear gas at fuel price protesters in central Paris https://t.co/fn0oNHeoRy UK police officer poisoned in Salisbury Novichok attack tells BBC how his life has been turned upside down \u2013 in his first interview since it happened \n\nhttps://t.co/0el0cedMbY Police searching for missing Emma Sillett, 41, and five-year-old son in Derbyshire recover two bodies https://t.co/TaopjMyyZs \"This is the right deal for the UK\" - PM Theresa May's update on #Brexit talks, as draft agreement on future relationship 'agreed' with EU\n\nhttps://t.co/ypjXsifqaE https://t.co/l8htpKwmKX Prime Minister Theresa May says draft agreement on UK-EU relationship is \"right deal\" and is \"within our grasp\" https://t.co/iFTaujVRVN Nissan sacks its chairman Carlos Ghosn, arrested in Japan last week for financial misconduct https://t.co/LLaIp0KvPQ MI5 admits for first time it made mistake in failing to track 2017 Manchester bomber, MPs say https://t.co/oVysh8eOWR Political declaration on relationship between UK and EU after Brexit \"agreed in principle\", European Council says https://t.co/Lqpx6s7GAz British academic Matthew Hedges jailed for life, after United Arab Emirates accuses him of spying https://t.co/O6Cz4y0fNg Interpol elects South Korean as president, rejecting Russian frontrunner accused of abusing \"red notice\" system https://t.co/nIo80Zvocf Unidentified gunmen have abducted an Italian woman working for an aid organisation in south-east Kenya, police say https://t.co/gOPIqqepQV At least 40 people killed and dozens injured in an explosion near a wedding hall in Kabul - Afghan health ministry https://t.co/rHtAGlA3N3 'Black cab rapist' John Worboys must stay in prison, Parole Board says, after reconsidering his case https://t.co/aeUNZjlx3F Nissan confirms boss Carlos Ghosn arrested in Japan over allegations of financial misconduct https://t.co/nlJKdX4qIh Broadcaster, Richard Baker, who introduced the first TV news bulletin on the BBC in 1954, dies aged 93\n\nhttps://t.co/I3vpTI2mM5 https://t.co/9mL9XAMsTi Steve Barclay appointed new Brexit Secretary after Dominic Raab's resignation over draft deal https://t.co/QM8sDkPBwf Amber Rudd returns to UK cabinet as new Work and Pensions Secretary\n\nhttps://t.co/cIDAgUmsXJ Judge orders White House to restore CNN journalist Jim Acosta's access, revoked after clash with Donald Trump https://t.co/On4KQ9KYHF Cabinet minister Michael Gove is not resigning from UK government over Brexit deal, source tells BBC https://t.co/4CvVgGKPKY For the first time, two Khmer Rouge leaders have been found guilty of genocide in Cambodia in the 1970s https://t.co/f8Zj3on3wf Number of missing in California's Camp Fire leaps to 600, with the statewide death toll rising to 66. https://t.co/IvasdCjaIo UK PM Theresa May says she believes with \"every fibre of my being\" that her approach on #Brexit is the right course for the country\n\nFollow live updates: https://t.co/Dj3XzFrbNK https://t.co/LP11yKb1PP Draft #Brexit deal is \"damaging for the economy but devastating for public trust in our democracy\" - says ex-Brexit Secretary Dominic Raab in his first post resignation interview \n\nhttps://t.co/8XzgDQyWjI https://t.co/jaQh1AAAjl \"The deal you put before the Cabinet yesterday does not honour the result of the referendum\"\n\nUK Work and Pensions Secretary Esther McVey's resignation letter to PM\n\nLatest #Brexit updates: https://t.co/SxDxzUheMm https://t.co/lY51RsHnPk Work and Pensions Secretary Esther McVey resigns an hour after Brexit secretary quits post over EU withdrawal deal https://t.co/EZKdsUSwVu \"I cannot reconcile the terms of the proposed deal with the promises we made to the country\"\n\n#Brexit Secretary Dominic Raab's resignation letter to the PM\n\nLive updates: https://t.co/mG1OZfRYJ7 https://t.co/891ePbuPJU Brexit Secretary Dominic Raab has resigned saying he \"cannot in good conscience support\" draft Brexit agreement https://t.co/3HMdos3mLE EU leaders will meet on 25 November to finalise terms for Britain's departure from EU, it is confirmed https://t.co/wQIX2EsbXv White House aide Mira Ricardel moved to new role following criticism from US First Lady Melania Trump https://t.co/XkNJxaHvDS Stormy Daniels' lawyer Michael Avenatti is in custody on suspicion of domestic violence, US media report https://t.co/mExnHXtwER PM Theresa May says cabinet backs #Brexit withdrawal agreement and calls it a \"decisive step\" enabling UK to move on\n\nhttps://t.co/0ThKBhqMO7 https://t.co/gLyvmf4bcq Government bows to pressure to reduce the maximum stake on fixed-odds betting terminals from April https://t.co/OdAfTqDHmU Helicopter that crashed outside Leicester City's stadium did not respond to pilot's command, initial report says https://t.co/hZqqZbxGnM Israeli defence minister Avigdor Lieberman quits, saying ceasefire with Hamas militants is \"surrendering to terror\" https://t.co/I2w7nnQ4yV Brexit divorce deal text agreed by UK and EU negotiators; cabinet will consider on Wednesday, source tells BBC https://t.co/pcXmG5oO6Q UK unemployment increased by 21,000 to 1.38 million in three months to September, figures from ONS say https://t.co/nY8Hra9ncQ Stan Lee obituary: The genius of the superhero creator https://t.co/0EuMo0azGS Marvel Comics legend Stan Lee, brains behind Spider-Man, Black Panther and X-Men, has died at 95, family lawyer says https://t.co/a59cLOZRcQ Californian fires death toll increases to 25 after the discovery of 14 more bodies in the town of Paradise. https://t.co/ivd6MwLcNm Turkey's president says he shared recordings related to murder of Jamal Khashoggi with US, UK, Saudis and others https://t.co/0JEkroEZFr Transport minister Jo Johnson, brother of Boris, quits UK government, calling for public to have fresh say on Brexit https://t.co/wnNMfZv7Gk Man who carried out Melbourne attack dies in hospital after being shot by police, incident now being treated as terror-related\n\nhttps://t.co/iUGutlKxo4 UK economy grew 0.6% in third quarter of 2018, Office for National Statistics says https://t.co/0PVkDxHUwZ Thousand Oaks gunman identified as 28-year-old military veteran, Ian David Long, police say https://t.co/SXXQmZ7qO5 US Supreme Court judge Ruth Bader Ginsburg, 85, has fractured three ribs after a fall on Wednesday, the court says https://t.co/wCdSrpcRqR Thousand Oaks shooting latest\n\n\u2022  12 dead\n\u2022  At least 10 injured\n\u2022  Suspect found dead at scene\n\nhttps://t.co/SXXQmZ7qO5 https://t.co/334oPZZPse Twelve people killed, including a police officer, in Thousand Oaks shooting, California\n\nhttps://t.co/SXXQmZ7qO5 https://t.co/apGI8ixutN Several people killed in shooting at bar in Thousand Oaks, California, police say \n\nhttps://t.co/SXXQmZ7qO5 https://t.co/mOlcnrF8fH Police respond to mass shooting at bar in Thousand Oaks, California https://t.co/n97fakIGGc US Attorney General Jeff Sessions resigns after months of criticism from President Trump https://t.co/5Wgl7KNtn5 Democrats win back control of the House of Representatives #Midterms2018\n\nRepublicans retain control of the Senate, with key victories in Indiana, Texas and North Dakota https://t.co/wcxBJFlbjn #ElectionNight https://t.co/ZTaDBpqTgw Donald Trump's Republicans projected to retain control of Senate, with Democrats on course to win House of Representatives #Midterms2018\n\nFollow our live coverage: https://t.co/fPUJ4Fg3fB #ElectionNight https://t.co/iujXnRsMSI US mid-terms: First polls close\n\nFollow our extensive coverage &amp; analysis of results: https://t.co/sUfitgxoj1 #ElectionDay https://t.co/tvGnBinVSE Sir Jeremy Heywood, former cabinet secretary and civil service head, dies of cancer aged 56 https://t.co/KxcnEizWUh Six children have been hurt in a fairground accident in Woking, Surrey, after a Helter Skelter collapsed. https://t.co/74wHOjogQr Trump administration to reinstate all US sanctions on Iran that were removed in 2015 nuclear deal https://t.co/dZOUCEw4NI Police have launched a criminal investigation into allegations of anti-Semitic hate crimes within the UK Labour Party https://t.co/VDZoUyR45k Sports Minister Tracey Crouch resigns after row over alleged delays to fixed-odds betting machines crackdown https://t.co/Ja6Jx1S7Gc Pittsburgh synagogue shooting suspect Robert Bowers pleads not guilty to 44 charges including hate crimes https://t.co/yVy9PKWrWg Ex-Goldman Sachs bankers charged with conspiring to launder billions of dollars embezzled from Malaysian 1MDB fund https://t.co/IeO490kDtM Leave campaigner Arron Banks says National Crime Agency investigation will end \"ludicrous allegations\" about #Brexit campaign funding\n\nhttps://t.co/C8OeecNRdP Leave campaigner Arron Banks referred to National Crime Agency after investigation into Brexit campaign funding https://t.co/PDKCArn6U7 UK interest rates held at 0.75%, Bank of England says https://t.co/rgI6sLT6M4 Spinal implant helps three paralysed men walk again \u2014 BBC News has had exclusive access to the patients in the clinical trial https://t.co/x0Qr9W9FOn After eight years on death row for blasphemy, a Christian woman in Pakistan has her sentence overturned https://t.co/sOCypLVrIL RT @BBCSport: Leicester City's Premier League match at Cardiff on Saturday will go ahead following the death of owner Vichai Srivaddhanapra\u2026 James \u2018Whitey\u2019 Bulger, Boston gangster whose life of crime sparked several films, killed in jail aged 89 \u2013 US media https://t.co/HHkdMS1Khu German ex-nurse admits killing \"more or less\" 100 patients, making him country's most prolific post-War murderer https://t.co/5DiLT1ZVSQ RT @BBCSport: Real Madrid have sacked head coach Julen Lopetegui.\n\nFull story: https://t.co/imMDlKp5EW https://t.co/dQfIDfacSQ Chancellor @PhilipHammondUK brings forward tax threshold change to April 2019\n\n\u00a312,500 for lower tax rate payers, \u00a350,000 for higher rate payers, before income tax is paid\n\nFollow our live #Budget2018 updates here: https://t.co/0lqilcBQ6H https://t.co/my6mw0MTKI Stamp Duty abolished for all first-time buyers of shared ownership properties valued up to \u00a3500,000 - @PhilipHammondUK reveals in #Budget2018\n\nFollow our live updates here: https://t.co/0lqilcBQ6H https://t.co/eVKVqVvevO UK Chancellor @PhilipHammondUK gets to his feet for #Budget2018\n\nFollow our live updates here: https://t.co/0lqilcBQ6H https://t.co/1pVd07v8rL Explosion rocks the centre of Tunisia's capital, Tunis - reports say a woman has blown herself up https://t.co/pkD3hghXM7 Germany's Angela Merkel says she will step down as chancellor in 2021, following recent election setbacks https://t.co/PZIckYkVNr Germany's Angela Merkel has told her CDU party she will not run for re-election as its chairwoman - sources https://t.co/LTpVG6OkYX On board crashed Lion Air #JT610 plane:\n\n- 178 adults\n- 1 child\n- 2 babies \n- 2 pilots and 5 flight attendants \n\nMore updates: https://t.co/o5gy7wiMZu Lion Air #JT610 plane 'crashed into sea', Indonesian aviation officials confirm \n\nSearch and rescue operation now underway https://t.co/o5gy7wiMZu A Lion Air passenger plane has gone missing after taking off from Jakarta, say Indonesian officials https://t.co/aepn9PiHwV Controversial far-right candidate Jair Bolsonaro wins Brazil's presidential election https://t.co/yjs6WVOAlV Far-right candidate Jair Bolsonaro is heading for a sweeping victory in Brazil's presidential election - exit polls https://t.co/tLkU7tkQrr Leicester City confirm that chairman, Vichai Srivaddhanaprabha, was one of five people to die in helicopter crash https://t.co/dRJh4x8jqp RT @BBCSport: He\u2019s done it!\n\nLewis Hamilton becomes just the third driver to win a fifth world title.\n\nAn incredible achievement #bbcf1 #Me\u2026 Two crew members and three passengers were on board the helicopter that crashed in Leicester, BBC understands https://t.co/5iDIElPe3D Leicester City owner Vichai Srivaddhanaprabha was in his helicopter when it crashed, a source tells the BBC https://t.co/vSYdC8Hkxu Michael D Higgins has been re-elected as Irish president after receiving 56% of the country's election vote. https://t.co/08c2LakklI US officials confirm 11 people killed in a gun attack on a synagogue in Pittsburgh https://t.co/9bVxk57iGu Leicester City owner's helicopter crashes in car park outside the club's ground shortly after taking off after match https://t.co/OhaLu763Ss Pittsburgh shooting:\n\n- Gunman taken into custody after opening fire at Squirrel Hill synagogue\n- Multiple casualties, say police\n- Three police officers hurt in incident\n\nhttps://t.co/lo99MuxKLM Pittsburgh shooting: Multiple casualties, police say, after gunman opens fire at Squirrel Hill synagogue \n\nLatest: https://t.co/lo99MuxKLM https://t.co/elCcOAIhn5 Emergency situation at Pittsburgh synagogue, as police respond to reports of gunman https://t.co/4Lg7r9WdME Ex-Tottenham and England manager Glenn Hoddle in hospital after being taken ill in TV studio on 61st birthday https://t.co/70YRlWiw9V Florida man Cesar Sayoc is charged on five counts over US mail-bombings, including threatening two former presidents https://t.co/skGrB8MMHP \"These terrorising acts are despicable and have no place in our country\" - US President Donald Trump says those responsible for US mail-bombing campaign will face \"swift and certain justice\"\n\nhttps://t.co/HCngUefq8I https://t.co/RW5cZ245Ce Man, 56, arrested in Florida in connection with mail-bombing campaign was tracked down using DNA evidence, US media says\n\nhttps://t.co/seTZjkTFQW https://t.co/OIhYXmCCXA Person arrested in connection with mail-bombing campaign aimed at Trump critics, US officials say https://t.co/fPnNEStYqH Scottish Conservative leader Ruth Davidson gives birth to boy - she and partner Jen Wilson are \"delighted\" https://t.co/k5wm1YItDk Two men guilty of manslaughter of 15-year-old girl who suffered allergic reaction to a takeaway meal in Lancashire https://t.co/o8FQO1mnIx Suspicious package addressed to top Democrat Cory Booker after series of mail bombs target Trump critics - US media https://t.co/Rawa6MT2CK Man arrested on suspicion of trying to steal a Magna Carta from Salisbury Cathedral in Wiltshire https://t.co/RypAaOCMVI Google says it has sacked 48 people, including 13 senior managers, over sexual harassment claims in past two years https://t.co/gILuW792u7 Sir Philip Green \"categorically and wholly\" denies allegations of \"unlawful sexual or racist behaviour\" https://t.co/FynZJSYEhf Women allowed to join SAS for first time, UK Defence Secretary Gavin Williamson reveals\n\nhttps://t.co/JUsskMCzt0 Retail billionaire Sir Philip Green named in Parliament as man facing newspaper allegations of sexual harassment https://t.co/Wt3uqXabdu Home secretary apologises to people wrongly forced to take DNA tests to prove they were entitled to settle in UK https://t.co/KfHz4KgMnx Saudi prosecutor says murder of Saudi journalist Jamal Khashoggi in Istanbul was \"premeditated\" https://t.co/aZmTXI3g6Z US police investigate suspicious package found at New York restaurant owned by Robert De Niro, media reports say https://t.co/aDumSzZCx9 Saudi Arabia's powerful crown prince says those responsible for Jamal Khashoggi's murder will be brought to justice https://t.co/S3aPAXez3B Suspicious package sent to Bill and Hillary Clinton, officials say, days after similar device sent to George Soros https://t.co/ClTiNVvc5H Escalator malfunctions at #metro station in Rome leaving several people injured, some seriously, Italian media report https://t.co/aQizgx9rqW Turkey's President Erdogan says there is strong evidence Saudi writer Khashoggi's \"savage\" murder was premeditated https://t.co/St17qubGus \"Urgent need for clarification\" - Britain, France and Germany push Saudis to better explain journalist's killing https://t.co/jrZTAXvRMW At least 17 people reported dead and dozens hurt after passenger train derails in Taiwan https://t.co/2Vei0YTZ4A Two satellites developed in Europe and Japan begin a seven-year journey to Mercury, the planet closest to the Sun https://t.co/j5VNhx6V1P Journalist Jamal Khashoggi died after fight in consulate, initial results of probe suggest - Saudi state TV https://t.co/3EQB1gtQo6 Two men arrested on suspicion of murder over death of father killed outside his south London home on Wednesday https://t.co/OMLH7ITIzi Twenty men found guilty of being part of grooming gang that raped and abused girls as young as 11 in Huddersfield https://t.co/98KkRwbzaO Facebook hires former deputy PM Sir Nick Clegg as head of global affairs and communications https://t.co/uKbhPR2ET6 Radical preacher Anjem Choudary, jailed for inviting support for the Islamic State group, released from prison https://t.co/dRB3E95Yrz Case of BSE confirmed on farm in Aberdeenshire https://t.co/DtA9VtTS6X 180,000 people on sickness benefits to receive back payments averaging \u00a35,000 - after \u00a31.5bn UK government error https://t.co/OKn6qaJQoJ RT @BBCSport: It's off.\n\nWembley will not be sold after Fulham owner Shahid Khan withdrew his offer.\n\nMore: https://t.co/V0pWur4tbG https:/\u2026 Crimea school attack update:\n\n*At least 17 killed &amp; dozens wounded\n*Officials now say all victims died of gunshot wounds \n*18-year-old student responsible for attack &amp; has killed himself, investigators say\n\nhttps://t.co/nPv6W6FN6T Blast which killed 10 people at college in Crimean town of Kerch caused by explosive device, Russian officials say https://t.co/K6TLZncZYI UK inflation rate falls to 2.4% in September after hitting a six-month high in August https://t.co/vOznUyXC6I Canada legalises possession and use of recreational cannabis, the second country after Uruguay to do so https://t.co/Y9rZrx0xAd Anna Burns has been named the winner of this year's Man Booker Prize for her novel Milkman - becoming the first author from Northern Ireland to win the prize #ManBooker2018 https://t.co/TpMpkt0Nkc House of Commons Speaker John Bercow has told friends he's decided to stand down next summer, BBC understands https://t.co/4gOZoUmpvT Bullying and harassment claims in House of Commons should be investigated by external body, Speaker John Bercow says https://t.co/AXdx6uHZmn UK unemployment falls by 47,000 to 1.36 million in three months to August, official figures show https://t.co/hGzGApdqdM UK PM Theresa May says she still believes a Brexit deal is \"achievable\" as she updates MPs on the latest talks https://t.co/Ak3rxcdB9X Culture of \"deference\" in House of Commons has allowed bullying and harassment to thrive, report finds https://t.co/vKjCwCJxb6 Duchess of Sussex is expecting a baby in the spring, it is announced, as the royal couple begin tour of Australia https://t.co/T7WReZVD6j Angela Merkel's Bavarian ally the CSU suffers massive losses in German state election, exit polls say https://t.co/LKWwj3VUAM Small plane kills three people after crashing into crowd at airfield in German state of Hesse, reports say https://t.co/turoWW2gw0 UK, France and Germany demand Saudis provide \"complete and detailed response\" on disappearance of writer Khashoggi https://t.co/7YEPoypnqC RT @BBCSport: Wigan Warriors are the 2018 #SuperLeague Champions! \n\nThey've beaten Warrington Wolves in the #GrandFinal for the third time.\u2026 President Trump promises \"severe punishment\" if Saudi Arabia is found to have murdered journalist Jamal Khashoggi https://t.co/2YibynL1Vo RT @BBCSport: Monaco have appointed Former Arsenal striker Thierry Henry as their new head coach.\n\nMore here \ud83d\udc49 https://t.co/80kcFH2ZEU http\u2026 Minibus driver is third person to die after crash involving lorry on M4 in Berkshire on Thursday https://t.co/lS8DbZEfrF Westminster attacker Khalid Masood lawfully killed after murdering four pedestrians and police officer, inquest says https://t.co/TBpH0aZ1bH Turkish court to release US pastor Andrew Brunson, who was accused of terror links in case that hit US-Turkey ties https://t.co/UU4Ua5zDKM Fracking for shale gas can go ahead for first time in UK since it was linked to 2011 earthquakes, as legal bid fails https://t.co/xeoamQnt6t Two people die and three are seriously injured after crash between lorry and minibus on M4 https://t.co/QT2fYt5vBj US military grounds its entire fleet of F-35 fighter jets in the wake of a crash in South Carolina last month https://t.co/LBMox9b7Ag Astronauts to make emergency landing after their Russian Soyuz rocket malfunctioned on lift-off to space station https://t.co/3AfjcXfhc6 #HurricaneMichael makes landfall in northern Florida - it is expected to be the worst storm to hit the region in a century https://t.co/hUqp6V52qO Christian owners of a Northern Ireland bakery win their appeal in the so-called \"gay cake\" discrimination case https://t.co/Am5xNvrEBM Donald Trump says Nikki Haley will be leaving her post at the end of the year after doing an \"incredible job\"\nhttps://t.co/173HWS1W3w America's ambassador to the UN Nikki Haley, senior Trump cabinet member, has resigned unexpectedly, US media report https://t.co/wtHkkShpyx Firm stripped of NHS contracts after medical waste, including human body parts, from hospitals allowed to pile up https://t.co/GYtKsPsJOx BBC understands Alexander Mishkin is the name of the Salisbury poisoning suspect who entered the UK under the alias Alexander Petrov https://t.co/84AE0Uy82a Second suspect in Salisbury poisoning named by investigative website Bellingcat as Alexander Mishkin, who it says is a military doctor working for Russian intelligence https://t.co/Naqtv1D8uU Spanish court acquits ex-doctor accused of stealing newborns from mothers and supplying them to infertile couples https://t.co/3kJgKe8YKb RT @BBCSport: Enable and Frankie Dettori hold on to win the Prix de l'Arc de Triomphe for the second year in a row.\n\nMore: https://t.co/PGT\u2026 RT @BBCSport: AND STILL...\n\nKhabib Nurmagomedov makes\nConor McGregor tap out! \n\n27-0-0. Wow.\n\n\ud83d\udc49 https://t.co/nQjbQSaWXW #ufc229 #bbcufc htt\u2026 US Senate confirms Donald Trump's Supreme Court nominee, Brett Kavanaugh, as protesters removed from the gallery https://t.co/HUt7eoBbNG Chicago police officer Jason Van Dyke found guilty of second degree murder for killing unarmed black teen in 2014 https://t.co/YDqOO984GG US Supreme Court hopeful Brett Kavanaugh clears first hurdle in US Senate - final vote on nomination on Saturday https://t.co/frijvlGp4l Man found guilty of attempting to murder former Eurotunnel boss who he pushed on to Tube tracks in London https://t.co/ESD904bKi4 Nobel Peace Prize goes to campaigners against rape in warfare Nadia Murad and Denis Mukwege https://t.co/BGsYTjv4tV US charges seven Russian military agents linked to global cyber hack of doping and other agencies https://t.co/Kki9xU6EUd \"The GRU has interfered in free elections and pursued a hostile campaign of cyber attacks\" - Britain's ambassador to the Netherlands says Russian intelligence can no longer be allowed to act with \"apparent impunity\" \n\nFor the latest: https://t.co/LM9rqOFMV7 https://t.co/HIkAzibVuB Dutch security services expelled four Russians in April over plot targeting chemical weapons watchdog - officials https://t.co/FPjph8eXWm Death of police officer Keith Palmer during Westminster terror attack could \"possibly\" have been prevented if armed officers had been nearby, coroner says https://t.co/xoVpO4CRvy All five victims of last year's Westminster terror attack were \"unlawfully killed\", coroner says https://t.co/S035mfvVY7 Pret A Manger to fully label ingredients on its freshly made products after girl's death following allergic reaction https://t.co/W7irnjPhfs Zoe Ball is to take over as presenter of BBC Radio 2 Breakfast Show replacing Chris Evans https://t.co/bktiByCfki Heterosexual couples in England &amp; Wales to be given right to enter into civil partnerships rather than marriage, Theresa May announces\n\nhttps://t.co/2vYpl3kivG Number of people killed in Indonesia quake and tsunami rises to more than 1,200, officials say https://t.co/TZucu47QUz @pakhead Atmosphere transforms from anger to jubilation as police back down and let crowds into shops, @pakhead reports #Palu https://t.co/nzn6U0bHET BBC's @pakhead sees police fire shots and tear gas as desperation grows in Indonesia's disaster-stricken #Palu https://t.co/TsM9u1sKOm French singer and songwriter Charles Aznavour has died aged 94 after a career lasting more than 80 years, a spokesman says\n\nhttps://t.co/MKvYh0O3ZI RT @5liveSport: That's it!\n\nMickelson hits the water and concedes to Francesco Molinari!\n\n#TeamEurope have won the #RyderCup !!\n\n\ud83c\udf99\ufe0f\ud83d\udcfbhttps:/\u2026 At least 832 people now known to have died in Indonesian earthquake and tsunami - emergency officials https://t.co/uBzqMfoKLJ Senior Tory MPs have had their personal details exposed due to security flaw in Conservative conference app https://t.co/AF063jzOxD At least 384 people now known to have died after an earthquake and tsunami hit a coastal Indonesian city https://t.co/IprVdGRuCg US President Donald Trump orders FBI to reopen background inquiry into Supreme Court nominee Brett Kavanaugh over sexual misconduct claims\n\nhttps://t.co/ev8MJoHZyZ Brett Kavanaugh's nomination to US Supreme Court backed by Senate committee as discussions continue over FBI inquiry https://t.co/KKe4X2DRQA Facebook says the security flaw has been fixed and it has informed police. In a statement it says \"we have yet to determine whether these accounts were misused or any information accessed\" \n\nhttps://t.co/UMZ9D59j6R 50 million Facebook accounts compromised, the social network says - in all, 90m accounts will have to take action https://t.co/GL3MyqXgHF Officers searching for missing Worcester student Thomas Jones, 18, find a body in the River Severn https://t.co/Zj8Ug65gr0 Danish police seal off bridges and ferries to Sweden and Germany in a major operation https://t.co/uvVH4ANjHm Pret a Manger\u2019s allergy labelling was inadequate, says coroner in case of girl who died after eating a baguette https://t.co/93qasWccnJ Tesla chief executive Elon Musk accused of fraud by the US Securities and Exchange Commission https://t.co/Qf8jtsrv8G \"My family and my name have been totally and permanently destroyed\" - US Supreme Court nominee Brett Kavanaugh reacts to sexual assault allegations against him\n\n#KavanaughHearings https://t.co/h2XHDCCojT https://t.co/ovPMw0Clfk RT @BBCSport: The proposed \u00a3600m sale of Wembley Stadium has been unanimously backed by the Football Association's board.\n\nhttps://t.co/6sX\u2026 \"I am here today not because I want to be. I am terrified. I am here because I believe it is my civic duty to tell you what happened to me while Brett Kavanaugh and I were in high school\" - Christine Blasey Ford gives testimony in #KavanaughHearings  \n\nhttps://t.co/RGLhzWMovX https://t.co/u2E6ST0EKt The real identity of one of the Salisbury Novichock poisoning suspects is revealed by an investigative website https://t.co/5ySt719D3g China has been attempting to interfere in the mid-term elections in November, President Trump tells UN https://t.co/FkYVJlPMaW Suspects in the 1974 Birmingham pub bombings will not be named at fresh inquests, the appeal court rules https://t.co/RqzM3HkGfz \"Sexually violent predator\" Bill Cosby given three to 10-year jail term for drugging and molesting a woman in 2004 https://t.co/vNPK6YmTfA \"Stronger, safer, richer\": Donald Trump tells UN he has done more in under two years than almost any prior president https://t.co/coDul33Afk Amid concerns about his job, Trump-Russia probe chief Rod Rosenstein has \"extended conversation\" with President Trump, with further meeting planned for Thursday https://t.co/ViaAiInpsJ Rod Rosenstein, the man overseeing Trump-Russia probe, en route to White House amid reports he will offer to quit https://t.co/3kxi0m3UId RT @BBCSport: Anthony Joshua wins! \ud83e\udd4a\n\nHe\u2019s won by knockout in round 7!\n\nAJ retains his heavyweight titles. \n\nLive reaction https://t.co/e2u\u2026 Labour should be prepared to back demands for a new Brexit referendum, deputy leader Tom Watson has said. https://t.co/x9EOYEtffe The woman accusing Supreme Court nominee Brett Kavanaugh of sexual assault agrees to testify against him next week https://t.co/W5RTtIVAwN US cable giant wins rare blind auction process set by the UK's Takeover Panel. https://t.co/Lc0sggm0FL Chas Hodges - one half of the musical duo Chas &amp; Dave - has died https://t.co/sLok83mgNk Man rescued from air pocket in sunken Lake Victoria ferry, two days after it capsized with loss of around 170 lives https://t.co/l5rG7Bsa58 Several people killed in gun attack during Iranian military parade in south-west city of Ahvaz, state media says https://t.co/OweQk7y5Qp \"No-one wants a good deal more than me, but the EU should be clear I will not overturn the result of the referendum, nor will I break up my country\" - UK PM Theresa May gives Downing Street statement on #Brexit talks https://t.co/wJSsl3Rolz https://t.co/YdozXn1WMj UK PM Theresa May demands new proposals from EU to break Brexit \"impasse\" after Chequers plan rejected by EU leaders https://t.co/4IzVJBIco0 UK PM Theresa May to make statement in Downing Street on state of #Brexit negotiations at 13:45 BST\n\nhttps://t.co/SUQnGZEPKZ At least 86 bodies are found after a Tanzanian ferry overturns in Lake Victoria, officials say https://t.co/Pcy3ObgGin Multiple deaths and injuries after a shooting at a pharmacy distribution centre in Maryland - US police https://t.co/38OudkxJja After criticism of her Chequers plan by EU leaders, Theresa May stands by her #Brexit proposals as \"the only serious and credible\" option - but admits there's \"lots of hard work to be done\" to reach a deal https://t.co/7frZv4l8qo https://t.co/FhjLv7j4VU European Council President Donald Tusk says EU leaders agree Theresa May's Chequers plan for #Brexit \"will not work\" because \"it risks undermining the single market\" https://t.co/UpHoAK94GG https://t.co/H5FPZPUNN9 RT @BBCSport: The suspension of Russia's anti-doping agency (Rusada) has been lifted despite widespread opposition.\n\nFull story: https://t.\u2026 Pakistan court orders release of ex-PM Nawaz Sharif and suspends his jail sentence https://t.co/3LqxVQ6F51 Woman dies after caravan blown off cliff in Galway, Ireland as Storm Ali brings disruption to British Isles https://t.co/wubY4511gO UK inflation rate for August unexpectedly rises to 2.7%, highest in six months https://t.co/GmqT0MuLhi Moon and Kim hail new future for North and South Korea, signing wide-ranging agreement in Pyongyang https://t.co/QNzHH5gdDP Germany's spy chief forced out of job over his controversial response to reports of far-right unrest in Chemnitz https://t.co/NUAvqHojSE RT @BBCSport: Ben Stokes and Alex Hales have been charged with bringing the game into disrepute by the ECB.\n\nhttps://t.co/1mH5geVa1O https:\u2026 The US is imposing new tariffs on $200bn (\u00a3150bn) worth of Chinese goods as it escalates its trade war with Beijing https://t.co/CjuxgjX23d Thai cave rescuer Vernon Unsworth sues Elon Musk over his repeated claims the British diver is child abuser https://t.co/wJeixByjo9 Russia and Turkey to create buffer zone in Syria's northern Idlib province to separate Syrian forces and rebels https://t.co/1xjM2afBPr US Supreme Court nominee Brett Kavanaugh says sexual assault claim against him is \"completely false\" in first comment since Christine Blasey Ford revealed she is his accuser https://t.co/gU2LO1x16u International Monetary Fund warns no-deal #Brexit would inflict \"substantial costs\" on the UK economy https://t.co/qBkhE3584i Police have sealed off the Prezzo restaurant in High Street, Salisbury, following a 'medical incident' involving a man and a woman Correction: Christine Blasey Ford reveals she was teenager allegedly assaulted by Supreme Court nominee Kavanaugh https://t.co/NMZLm0Ro4C RT @BBCSport: Kenya's Eliud Kipchoge has set a new marathon world record in Berlin.\n\nhttps://t.co/D9EEUxebgM https://t.co/mb8oigT6FB At least five dead as Florence mauls US East Coast\n\n\u00b7Winds of up to 70mph (110km/h) expected for several days\n\u00b7Almost 800,000 reported without power in North Carolina\n\u00b7Storm is slowly moving down the coast to South Carolina\n \nLatest update: https://t.co/U5f71eWkvP https://t.co/wtzwZvBGwF Hurricane Florence downgraded to tropical storm\n \n\u2022 Four people killed as storm batters US East Coast\n\u2022 600,000 homes without power \n\u2022 Evacuation warnings in place for 1.7 million people\n\nLive updates: https://t.co/FnURFb8AKO https://t.co/zFloA81CSG Typhoon Mangkhut reaches northern Philippines with officials warning of possible \"very heavy damage\" https://t.co/ez3FCfWNV1 Trump's former campaign manager Paul Manafort agrees to co-operate with Mueller probe, prosecutor says https://t.co/o8VmfnfWtx #HurricaneFlorence latest\n\n\u2022 Centre of hurricane eye makes landfall\n\u2022 More than 300,000 people without power \n\u2022 Evacuation warnings in place for more than a million people\n\nLatest updates: https://t.co/kUisqRMf34 https://t.co/2uRFWAvqYf #HurricaneFlorence makes landfall on east coast of US\n\nFollow our live updates https://t.co/DEangW2yzK https://t.co/yy1qY9b4ui Two men named as suspects in poisoning of Russian ex-spy claim they were merely tourists to Salisbury Cathedral https://t.co/PFXBDyJrkf British couple who died at Egyptian hotel were killed by E. coli, the country's general prosecutor says https://t.co/PqSvcJ75N8 \"Nothing criminal\" about men named by UK over poisoning of ex-Russian spy Sergei Skripal and daughter, Putin says https://t.co/UjoGhhCn3G RT @bbctms: WICKET!\nThere it is! Anderson cleans up Shami, bowled for 0. England win the match and Jimmy Anderson takes his 564th Test wick\u2026 RT @BBCSport: Uefa plans to introduce a third European club competition alongside the Champions League and Europa League from 2021.\n\n\ud83d\udc49 http\u2026 UK unemployment fell by 55,000 in the three months to July, ONS figures say https://t.co/XYEvJ6AbkM England's leading Test run scorer Alastair Cook dismissed for 147 in his last ever innings for his country https://t.co/sMRZSXSSGt #ENGvIND https://t.co/Ro9EA1Ft0y RT @bbctms: THERE IT IS!\nWhat a moment for Alastair Cook on his last-ever Test innings he brings up his hundred! Not sure he'd have expecte\u2026 Sweden's far right makes gains in election as establishment parties deadlocked, exit polls predict https://t.co/GXIMNX2uTb 28-year-old woman charged with attempted murder after man stabbed on Saturday in Barnsley, South Yorkshire https://t.co/IQTo0Ap8cW Naomi Osaka beats Serena Williams 6-2 6-4 to win US Open - the first Japanese player to win Grand Slam singles title https://t.co/y9hsSHkKZy Woman, 28, arrested after man stabbed in Barnsley, South Yorkshire is being held on suspicion of attempted murder https://t.co/iWCXSe2gLM One person arrested after reports man had been stabbed in Barnsley town centre, as police investigate if it was an isolated incident https://t.co/iWCXSe2gLM Police responding to \"serious incident\" in Barnsley, South Yorkshire, the force says https://t.co/hIXI30hWJ9 US rapper Mac Miller found dead at his Los Angeles home aged 26 after apparent overdose, US media report https://t.co/ytKhUKCXkC Former Donald Trump aide George Papadopoulos jailed for 14 days for lying to the FBI in Russia investigation https://t.co/SIBVvJz398 BA boss \"extremely sorry\" after some customers' data stolen in \"very sophisticated criminal attack\" on website https://t.co/PGrIfzJlnG Twitter permanently bans US conspiracy theorist Alex Jones and Infowars for abusive behaviour https://t.co/6hp5VIIf7F Obituary: Burt Reynolds - full of charm &amp; swagger, he became one of Hollywood's best-known stars\n\nhttps://t.co/d1LpTUiG6o https://t.co/TtlZ8zaKDD Burt Reynolds dies, aged 82 - he starred in a string of hits in the 1970s, including Smokey and the Bandit &amp; Deliverance https://t.co/U5zINJpMH4 https://t.co/twK6iRToD1 A planned tax cut for 2.7m self-employed workers has been scrapped by the UK government https://t.co/v9Mbp69qsd US, France, Germany and Canada agree with UK that Russian government \"almost certainly\" approved Salisbury poisoning https://t.co/zEJwB5R0mT Cranberries singer Dolores O'Riordan died by drowning due to alcohol intoxication, inquest told https://t.co/CdevEV5EYs Gay sex is no longer a crime in India after a historic verdict by the Supreme Court https://t.co/GnrdzPPSuF \"This was not a rogue operation\"\n\nUK PM Theresa May says suspects in Salisbury poisoning investigation were Russian intelligence officers \n\nhttps://t.co/MUuXzsessn https://t.co/XtTnXnEtnH Two Salisbury attack suspects are believed to be Russian military intelligence officers, UK PM Theresa May says https://t.co/cC5Plpg7J4 UK police name two Russian nationals saying there is \"sufficient evidence\" to charge them over Salisbury attack https://t.co/SXGLXtBgPY Rachael Bland, BBC presenter who won praise for her honest portrayal of cancer in her blog and podcast, dies aged 40\n\nhttps://t.co/Jvc9JqIOf7 https://t.co/2W1xy7mXoV UK Labour\u2019s ruling body the NEC to adopt in full an international definition of anti-Semitism after months of rows https://t.co/crqNidbgLk Founder of Afghan militant network Jalaluddin Haqqani is dead after years of illness, the Taliban announces https://t.co/WL9DGkEoDd 2018 was joint-hottest summer on record for UK as a whole and the hottest for England, Met Office says https://t.co/dbKp5lDVPR Chris Evans reveals live on air he is to leave Radio 2 breakfast show after eight years at the helm https://t.co/xgzFkesyme Myanmar jails two Reuters journalists for seven years over their investigation into violence against Rohingyas https://t.co/csKrk4XPxD One of Latin America's largest natural history museums, in Brazil's Rio de Janeiro, has been hit by a massive fire https://t.co/hXegQI4Lsk Up in flames - dramatic images of fire at the Littlewoods Pools building, one of Liverpool's most famous landmarks https://t.co/sXBSryMSmE Janbaz Tarin, 21, charged with murders of Raneem Oudeh and her mother Khaola Saleem in Solihull https://t.co/rKisbSWW2S The United States is ending all funding for the UN's Palestinian refugee agency, the State Department says https://t.co/V2RJe5Mtft US-Canada trade talks break up without deal but negotiations will continue next week, US official confirms https://t.co/rb1dDmFCam Leader of pro-Russian self-declared Donetsk republic in eastern Ukraine killed in cafe blast, his government says https://t.co/aNFtUbsJhI Naa'imur Zakariyah Rahman jailed for life with minimum term of 30 years for plot to kill UK PM in Downing Street https://t.co/EfFMkw3ZjF London\u2019s new Crossrail underground line will not open until autumn 2019 - nine months after its scheduled launch https://t.co/ngGSraTbFT Coca-Cola is to buy the Costa Coffee chain from Whitbread for \u00a33.9bn https://t.co/f49WFwsGMa A man, 21, is arrested in Birmingham on suspicion of murdering a mother and her daughter in Solihull https://t.co/jkYhhXCCGq French actor Gerard Depardieu accused of rape and sexual assault - judicial sources. He denies the claims https://t.co/zrYcCpV2qz UK payday lender Wonga enters administration amid surge in compensation claims over interest charged to customers https://t.co/jJpFbK1iFg Veteran MP Frank Field resigns Labour whip, saying the party's leadership has become \"a force for anti-Semitism\" https://t.co/eoozL8vNI5 Unmarried NI mother wins access to widowed parent's allowance after death of her partner, in landmark court ruling https://t.co/NPn0Vj8lon Ex-SNP leader Alex Salmond resigns from the party amid sexual misconduct claims, which he denies https://t.co/2mxGt8ARaE Charity worker Nazanin Zaghari-Ratcliffe taken to prison doctors in Iran after suffering panic attacks https://t.co/9mjFsoDtUC After facing protests and slumping approval ratings, Russian President Vladimir Putin softens reforms to pensions https://t.co/YrCYRK2oC9 Police give death toll in shooting at Jacksonville, Florida as two, plus the gunman who killed himself at the scene https://t.co/lz5XpqA7Dj Florida police say the only suspect in the Jacksonville shooting is deceased at the scene https://t.co/jBXsEJvGM3 Police report fatalities in mass shooting at entertainment complex in Jacksonville, Florida https://t.co/tKF7FXMwhb Police in Jacksonville, Florida say are responding to a mass shooting at an entertainment complex https://t.co/iiQ1KcYL9P Charity worker Nazanin Zaghari-Ratcliffe has not been granted extension to temporary release in Iran, husband says https://t.co/A6NODNmwyO John McCain, Vietnam war hero turned senator and presidential candidate, has died aged 81 https://t.co/QKtuXtbG6P Pope Francis lands in Ireland\n\nFollow live reporting: https://t.co/ASSLPyq5B9 #PopeInIreland US Republican senator John McCain is discontinuing treatment for an aggressive form of brain cancer, his family says https://t.co/vKpSPZfQ6T Scott Morrison is Australia's new PM after Malcolm Turnbull is forced out by party rivals - media reports https://t.co/50FBR7T5qd Australia loses another PM to a party coup as Malcolm Turnbull is ousted by his rivals - media reports https://t.co/HtvOWXtChD Thomas Cook to remove all its customers from a hotel in Egypt as a precaution after the death of a British couple https://t.co/F97jQaYIjq UK mother Nazanin Zaghari-Ratcliffe gets three days temporary release from prison in Iran https://t.co/ROTDgakNkz Paris incident that saw two people killed, before knifeman was shot dead by police, was \"family quarrel\" - interior ministry source \n\nhttps://t.co/JSfD9p1RI7 #Trappes Knifeman in Paris kills two and injures others, before being shot dead by police - reports \n\nhttps://t.co/JSfD9p1RI7 #Trappes Australia's parliament is adjourned as PM Malcolm Turnbull battles a leadership challenge within his own party https://t.co/WzMWrQXTmq Trump's former lawyer Michael Cohen pleads guilty to violating campaign finance laws, says he did so at direction of \"the candidate\" for \"purpose of influencing election\" https://t.co/mBmNycbH39 Ex-Trump campaign chief Paul Manafort guilty of tax fraud charges, jury fails to reach verdict on 10 other counts https://t.co/MGE9MXVJHP Former Trump lawyer Michael Cohen has entered into a plea deal with US federal prosecutors in New York - US media https://t.co/rsFDlL3y0e Oscar-winning Danny Boyle will no longer direct 25th Bond film due to \"creative differences\", producers say https://t.co/aDCEisxObU Some 18 members of UK's Windrush generation who could have been wrongfully removed or detained to get formal apology https://t.co/IzAdAWOI6B \"My involvement in the events around Hillsborough has often been misrepresented\"\n\nSir Norman Bettison says he's been \"vindicated\" after all charges against him were dropped \n\nhttps://t.co/XWVa4AF4Nl https://t.co/wluhd6KetT Charges are dropped against ex-police chief Sir Norman Bettison, accused of blaming fans for Hillsborough disaster https://t.co/EfY2DZyaVP Kofi Annan, the former UN secretary-general who won the Nobel Peace Prize for humanitarian work, dies aged 80 https://t.co/lNj6TEmNPo At least 324 people die in monsoon floods in India's southern state of Kerala, the worst in a century\n\nhttps://t.co/ATcLzP0B7t https://t.co/19YpIJXF61 Former cricket star Imran Khan elected as prime minister of Pakistan in a vote at the National Assembly \n\nhttps://t.co/Fl74OvbCmJ https://t.co/FnhoFxXgl1 Aretha Franklin: The 'Queen of Soul' in her own words https://t.co/MxfBq9n0Id https://t.co/rT4RAMHHti Aretha Franklin: Celebrating the life of the 'Queen of Soul' https://t.co/6EH1t1As1N https://t.co/NTX2mg6IGw 'Queen of Soul' Aretha Franklin, whose stunning voice graced hits like Respect and I Say A Little Prayer, dies aged 76 https://t.co/Y9M3UN9fjV https://t.co/Rf8GMiLtDx Three-time Indian Prime Minister AB Vajpayee dies aged 93 https://t.co/fCCnzRBUvI More than one in four A-levels were graded A or A* this year - the highest proportion for six years https://t.co/QX6Vjsfr7w President Trump revokes the security clearance of ex-CIA director John Brennan, one of his frequent critics https://t.co/xXNyrXhLOu Sir Cliff Richard \"welcomes\" decision by BBC not to appeal against ruling over its coverage of a police raid on his home and \"hopes that outstanding issues can be resolved quickly\"\n\nhttps://t.co/qcdMNXSxZi https://t.co/773FD6Lv4n The BBC will not appeal against a ruling over its coverage of a police raid at Sir Cliff Richard's home in 2014 https://t.co/b4jzZf92ah UK inflation rate picks up to 2.5% in July, first increase since November, official figures show https://t.co/SMASwGV8wE At least 22 people killed after collapse of motorway bridge in Genoa, Italian minister says\n\nLatest: https://t.co/hesyowfkzD https://t.co/UanKiaQ41z England cricketer Ben Stokes found not guilty of affray after fight outside Bristol nightclub https://t.co/0wyhalCFaf Genoa motorway bridge collapse likely to be \"immense tragedy\", Italian transport minister says, with unconfirmed reports of many casualties\n\nhttps://t.co/GPDRHSQ6vS https://t.co/AEsN4brUsk #Westminster car attack: No other suspects identified and \"no intelligence at this time\" of further danger to Londoners, police say\n\nhttps://t.co/CprbiGZgrg Rooftop camera shows moment car crashes into barriers outside Parliament\n\nhttps://t.co/CprbiGZgrg #Westminster https://t.co/0noYclQNaR #Westminster car crash is being treated as terror attack, London police say\n\nhttps://t.co/CprbiGZgrg UK unemployment fell by 65,000 to 1.36 million in three months to June - lowest for more than 40 years, figures show https://t.co/zfUxeY4uEa London #Westminster incident update:\n\n- Man arrested after car crashes into barriers outside Parliament\n- Number of pedestrians injured, none life-threatening\n- Westminster in lockdown\n\nhttps://t.co/CprbiGZgrg https://t.co/cI77btb8T6 A number of pedestrians have been injured after car crashed into security barriers outside Parliament, London police say https://t.co/TNPrEKUPHM Man arrested after car crashes into security barriers outside Houses of Parliament https://t.co/TNPrEKUPHM Dr Hadiza Bawa-Garba's case has exposed a \"raft of concerns\" around the role of criminal law in medicine, chief executive of @gmcuk says https://t.co/Px0da2PXkg Doctor struck off over death of six-year-old Jack Adcock will be allowed to practise medicine again, UK court rules Lift off! Nasa launches the Parker Solar Probe on its mission to 'touch' the Sun https://t.co/dPxdBaG0Ic https://t.co/2Oo5TGLNFw Two men arrested in the murder investigation of a seven-year-old boy who died in a house fire in London on Tuesday https://t.co/7mrVvlJG07 All flights at Seattle airport are grounded after a passenger plane reportedly took off without permission https://t.co/Wv6BwdzAPI Canada shooting: Suspect in custody after four killed in Fredericton, New Brunswick https://t.co/3uzkeWvgQY \"Multiple fatalities\" in shooting in eastern Canada, police say - Fredericton residents told to stay in homes https://t.co/8EIpgxp8aI Mike Ashley's Sports Direct agrees to buy struggling UK department store chain House of Fraser for \u00a390m https://t.co/DZWM5fuT5o UK economic growth picks up to 0.4% between April and June https://t.co/1oMJQ64NqP Struggling department store House of Fraser calls in administrators as investors and creditors fail to reach a deal https://t.co/uyQzu8AM3B UK TV presenter Ant McPartlin to take break until 2019, missing next series of I'm A Celebrity &amp; Ant and Dec's Saturday Night Takeaway\n\nhttps://t.co/ZXJZxapwwS Ex-UK foreign secretary Boris Johnson to be investigated by panel after complaints to Tory party over burka comments https://t.co/r027nO6hZr Two Roman Catholic schools in England \"prioritised monks and reputation over protection of children\", report says https://t.co/th3Y5wCXrV Indonesian island of Lombok hit by strong magnitude 5.9 earthquake, following Sunday's tremor which killed at least 131 people\n\nhttps://t.co/Qu4doBEBtd Argentina senators vote against legalising abortion in first 14 weeks of pregnancy https://t.co/iAP3d97c3F US to impose fresh sanctions on Russia over nerve agent attack on ex-spy Sergei Skripal in UK, officials say https://t.co/y6wsQhXu5S RT @BBCSport: WOW! What a night for British sprinting. Zharnel Hughes takes the Men's 100m title!\n\nLive: https://t.co/dLJlihtVeW\n#EC2018 #b\u2026 RT @BBCSport: British record \ud83c\udf89\n\nThe joint-fastest time in the world this year \ud83d\udd25 \n\nEuropean Champion \ud83e\udd47\n\nDina Asher-Smith was FLYING! \ud83d\ude80 \n\nLiv\u2026 Death of seven-year-old London boy who died in \"suspicious\" house fire is being treated as murder, police say https://t.co/f1qz17dnbv Six men found guilty of trying to smuggle Albanian migrants in a boat across the English Channel https://t.co/6wqOSdLHTQ Iran sanctions: Trump says anyone doing business with Iran will not be doing business with US https://t.co/UErnD5DT8u German court gives long jail terms to couple who sold their son on dark net to paedophiles https://t.co/i3gJwqv9Nn Police investigating death of 28-year-old midwife Samantha Eastwood charge man, aged 32, from Stoke with her murder https://t.co/MqP6T7SAch At least 82 people have been killed in the quake that hit the Indonesian tourist island of Lombok, officials say https://t.co/PjRjNv2RNn A strong earthquake that hit Indonesia's Lombok island left at least 22 people dead, emergency officials say https://t.co/1JK1jeCTWH Barry Chuckle, half of the comedy duo the Chuckle Brothers, has died aged 73, his manager says https://t.co/4PtYpDUnIo Officials say explosive drones went off while President Nicol\u00e1s Maduro was giving a live speech, but he is unharmed https://t.co/rtmXqYmli2 UK police searching for missing midwife Samantha Eastwood find a body and arrest three men https://t.co/FoCRtnXlA9 Youngest woman to be convicted of plotting terror attack on British soil jailed for life with 13-year minimum term https://t.co/xpdOWvnVCU Emmerson Mnangagwa declared winner of Zimbabwe\u2019s presidential poll but his opponent Nelson Chamisa rejects result https://t.co/SdV49edI26 Apple has just become the first US company to hit a value of $1 trillion (that's $1,000,000,000,000) https://t.co/iA1JF5IwyQ UK interest rate rises to 0.75% - the highest level since March 2009 https://t.co/GsZXj6uOHQ Hosepipe ban for north-west England called off by supplier United Utilities, days before it was due to start https://t.co/6MYRBjgRV3 RT @BBCSport: The FA is considering putting England forward as a potential host for the 2030 World Cup.\nhttps://t.co/tdHuLU90r4 https://t.c\u2026 Former EDL leader Tommy Robinson freed on bail after winning legal challenge against contempt of court finding https://t.co/YekFys62a7 Plane with at least 80 on board crashes in Mexican city of Durango, local media report https://t.co/BrNF7LDkq8 UK man jailed for 17 years for manslaughter, after woman was splashed with acid and died 11 days later https://t.co/C23RYKyjo6 Doctors and families can agree to allow people in long-term vegetative states to die without legal application, UK Supreme Court rules https://t.co/YE3JaMzMDe RT @BBCSport: Geraint Thomas has done it! \ud83d\udc4f\ud83c\udff4\udb40\udc67\udb40\udc62\udb40\udc77\udb40\udc6c\udb40\udc73\udb40\udc7f\n\nHe's become the first ever Welshman to win the Tour de France \ud83d\udc49 https://t.co/ZtkRdPtGio\u2026 RT @BBCSport: Lewis Hamilton has won the #HungarianGP for the sixth time. \n\nHis lead in the championship is up to 24 points.\n\nReaction: htt\u2026 Five dead and five injured after car and minibus crash on A96 in Moray https://t.co/1jBgjqgX7P North Korea has returned the remains of US troops killed during the Korean War, White House confirms https://t.co/rpsPNChksr More than 1,800 migrant children in US reunited with family members by a court-ordered deadline, government says https://t.co/pzjlsaBOrN Former cricketer Imran Khan claims victory in Pakistan's election amid accusations of vote rigging by rivals https://t.co/r8z5wnYu7z BBC agrees to pay Sir Cliff Richard \u00a3850,000 within 14 days to cover his legal costs after privacy ruling https://t.co/lP9aHPHNZO Explosion reported close to the US embassy in Beijing, according to multiple eyewitness reports on social media https://t.co/f2RzOOnzre Conservatives in US Congress start impeachment process in effort to oust Deputy Attorney General Rod Rosenstein https://t.co/hbPIHoRp08 Scientists believe they've found liquid water on Mars for the first time, a potential game-changer in the search for life on the Red Planet https://t.co/sidpoRPedE Can you own a shape? Kit Kat loses its 16-year battle to trademark a four-fingered wafer bar at top EU court https://t.co/CI8XIU4wxz Suicide attacks in southern Syria kill at least 38 people - Islamic State group says it was behind the violence https://t.co/iWxeypEWIL DUP MP Ian Paisley suspended from Commons after he failed to declare holidays paid for by Sri Lankan government https://t.co/b3aKthkEfy At least 74 people killed in wildfires close to Athens, Greek fire brigade official says\n\nhttps://t.co/hXxldenh2P https://t.co/pv1gvtIsfl Israel shoots down Syrian warplane flying over its airspace in southern Golan, Israeli army says https://t.co/1q1iAVx4Wt Greek PM Alexis Tsipras declares three-day period of mourning for victims of deadly wildfires in Greece\n\nhttps://t.co/hXxldenh2P https://t.co/KP5LSZ6xso At least 60 people killed in Greece wildfires in the Attica region around Athens, local official says\n\nhttps://t.co/hXxldenh2P https://t.co/IYWXi6hb7t RT @BBCSport: Race stopped!\n\nThe 16th stage of the #TDF2018 has been put on pause due to a protest.\n\nLive: https://t.co/6AsDSFzMjQ https://\u2026 Hundreds missing and an unknown number dead after dam collapses in Laos, state news agency reports https://t.co/ET8e1BBRUI Greece wildfires:\n\n- at least 50 killed\n- more than 100 injured\n- Greece issues appeal for help\n- worst recorded wildfires since 2007\n\nhttps://t.co/hXxldenh2P https://t.co/195dFOCf3J At least 50 people now reported dead in Greece's worst wildfires in more than a decade https://t.co/0NvP8xdqDA Three men arrested in London over suspected acid attack on three-year-old boy in Worcester on Saturday https://t.co/1lyDT0owWH Three-year-old boy seriously injured in suspected \"deliberate\" acid attack in Worcester, England, police say https://t.co/UIMDWhVvOw Nine of the 17 people who died when a tour boat sank in a Missouri lake were from the same family, the governor of Missouri has told US media https://t.co/HCGwlGFy30 Novichok victim Charlie Rowley released from UK hospital, days after partner died following exposure to nerve agent https://t.co/0yVOwGyNys Two 15-year-old boys, who planned a Columbine-style shooting at a North Yorkshire school, sentenced to 12 years and 10 years in custody \n\nhttps://t.co/X5w65oJ1l4 Several people wounded in knife attack on bus in northern German city of Luebeck, reports say https://t.co/SS7enQBT3h Major medical records hack uncovered in Singapore, affecting 1.5m people (a third of the population) - government https://t.co/nu4OV6GXcq The baby girl who was in the back of an Audi that was carjacked in Birmingham has been found safe and well, and will shortly be reunited with her mother, police say https://t.co/520mlY8XNe Four-week-old baby girl in the back of an Audi carjacked in Birmingham, say police https://t.co/LFWNZhFOnN Police 'identify Russian suspects' in Novichok attack on ex-spy Sergei Skripal and his daughter Yulia in Salisbury https://t.co/JZcvjKt9Bm EU fines Google record 4.34bn euros ($5bn) for using Android operating system to illegally \"cement dominant position\" in internet search https://t.co/oJvGUdIGjN RT @BBCSport: Liverpool have agreed a world record fee with Roma for goalkeeper Alisson https://t.co/DaEYQGPqKj #LFC https://t.co/T85ZC9aRFU BBC's Director of News, Fran Unsworth, says it is 'looking at' appealing the judgment after Sir Cliff Richard wins High Court case against the corporation\n\nhttps://t.co/BxK98O44zm \"I'm choked up. I can't believe it. It's wonderful news.\" Sir Cliff Richard says after winning High Court privacy case against BBC\n\nhttps://t.co/BxK98O44zm Sir Cliff Richard awarded \u00a3210,000 in damages after winning High Court privacy case against BBC. Judge says star is entitled to further sums to be decided at later date\n\nhttps://t.co/BxK98O44zm Sir Cliff Richard has won his High Court privacy case against the BBC over its coverage of a police raid on his home https://t.co/jXb9g43ADM Elon Musk apologises to British cave rescue diver in Thailand he called \"pedo guy\" for ridiculing his mini-submarine https://t.co/fjJkSwsmFg President Donald Trump says he accepts US intelligence agencies' conclusion that Russia interfered in the 2016 election - despite declining to do so just a day ago \n\nhttps://t.co/KJGp9sl8G3 UK government narrowly wins key Brexit vote, rejecting call to stay in a customs union in \"no-deal\" scenario https://t.co/HYquaTYKv6 Unemployment fell by 12,000 in the three months to May to 1.41 million, official figures show https://t.co/txyZzQ4SZD Brexit campaign group Vote Leave is fined and referred to police for breaking electoral law https://t.co/1jWE9x7lKd UK government avoids defeat - by just three votes - on its Customs Bill after agreeing to Brexiteers' amendment https://t.co/BttpCnYbBC Victorious French World Cup team to receive their country's highest accolade, the L\u00e9gion d'Honneur https://t.co/dbzCE4xgxd \"It's great to be with you\"\n\nUS President Donald Trump shakes hands with Russian President Vladimir Putin ahead of talks in Helsinki \n\nLive coverage: https://t.co/aR2BUwILAl https://t.co/GlmQws7Jss Donald Trump says he expects to have \"extraordinary relationship\" with Vladimir Putin as they begin first summit https://t.co/vcJdgUan5q RT @BBCSport: FRANCE ARE THE WORLD CHAMPIONS!\n\nIt\u2019s ended #FRA 4-2 #CRO to give the French their second #WorldCup triumph.\n\nAllez les bleus\u2026 RT @5liveSport: Novak Djokovic has done it! \ud83d\udc51\n\nHe beats Kevin Anderson in straight sets to win his fourth #Wimbledon title \ud83d\udc4f\ud83d\udc4f\n\n\ud83c\udfc6\ud83c\udfc6\ud83c\udfc6\ud83c\udfc6\n\nReacti\u2026 UK Prime Minister Theresa May says Donald Trump told her to \"sue the EU\" https://t.co/ua2BkVnhgF https://t.co/sjan2qwTCi RT @BBCSport: Angelique Kerber is the #wimbledon champion! \ud83d\udc4f\n\nThe German beats Serena Williams to lift the trophy for the first time! \ud83d\ude4c\n \nL\u2026 RT @BBCSport: FT Belgium 2-0 England\n\nEngland leave Russia with their heads held high and their joint-best #worldcup finish since '66.\n\nBel\u2026 RT @BBCSport: He's done it! \ud83d\ude4c \n\nWHAT A MATCH! \ud83d\udd25 \n\nNovak Djokovic is through to his fifth #Wimbledon final! \n\nNadal 4-6 6-3 6-7 (9-11) 6-3 8\u2026 RT @BBCSport: IT'S OVER!\n\nGame, set, match: Kevin Anderson \u2705\n\nAfter six hours 35 minutes, he's beaten John Isner 7-6 6-7 6-7 6-4 26-24.\n\n\ud83d\udcfa\u2026 Former PM Nawaz Sharif arrested on return to Pakistan as elsewhere scores die in blasts targeting election rallies https://t.co/ZNtKUxtCWn Police say Novichok that poisoned couple in Amesbury, Wiltshire, came from small bottle found in one victim's house https://t.co/OJekuAbuYz 12 Russian intelligence officers indicted for hacking Democrat emails during 2016 election, US authorities announce https://t.co/GMJNfLiBQO Queen Elizabeth II meets US President Donald Trump at Windsor Castle \n\nhttps://t.co/3Q606Y04yc #TrumpVisitUK https://t.co/VRXtDD1PP8 The US/UK relationship is now the \"highest level of special\" - President Trump tells Chequers press conference  \n\n#TrumpVisitUK coverage: https://t.co/uh9bYPHtBx https://t.co/ZqhgglYkw2 \"Boris Johnson I think would be a great prime minister\"\n\nI also said this \"incredible woman\" Theresa May is doing a \"fantastic job\" \n\n#TrumpVisitUK coverage: https://t.co/uh9bYPHtBx https://t.co/W5UUFVSLAV \"I didn't criticise the prime minister\" in Sun interview - President Trump calls accusations \"fake news\" \n\nLatest #TrumpVisitUK developments: https://t.co/uh9bYPHtBx https://t.co/sgAbjqVUSb \"Whatever you do is ok with us, just make sure we can trade together that's all that matters\" - President Trump on #Brexit \n\nFollow: #TrumpVisitUK developments: https://t.co/uh9bYPHtBx https://t.co/i1Eir5PrsA RT @BBCSport: Chelsea have confirmed the sacking of manager Antonio Conte.\n\n#bbcfootball https://t.co/zVCdvvNKka RT @BBCSport: Look who's back! \ud83d\ude0d\n\nSerena Williams returns to familiar territory as she reaches her tenth #Wimbledon final!\n\nReaction \ud83d\udcf2 http\u2026 RT @BBCSport: Chelsea are set to announce the departure of manager Antonio Conte after two years in charge.\n\nMore here: https://t.co/2AvV7Z\u2026 RT @BBCSport: She's made it to the final! \ud83d\ude4c\n\nAngelique Kerber has beaten Jelena Ostapenko in the first women's semi-final of the day. \n\n\ud83d\udcf2 h\u2026 Donald Trump arrives in UK for two-day working trip; his first time in the country as US president \n\nFollow #TrumpUKVisit updates: https://t.co/uh9bYPHtBx https://t.co/huJoFzUCiZ Proposed deal for Rupert Murdoch's 21st Century Fox to buy Sky approved by UK government https://t.co/9ccLlahx8A President Trump says Nato countries have agreed to spend more on military budgets https://t.co/zDQjItZjgv Heartbreak for England as the team is knocked out of the World Cup by Croatia, losing 2-1 in the semi-final #ENGCRO\n\nhttps://t.co/LCICNpGGz1 #WorldCup RT @BBCSport: The defending champion is OUT.\n\nRoger Federer is beaten in the quarter-finals at Wimbledon by eighth seed Kevin Anderson.\n\nRe\u2026 The top 12 earners on the BBC's latest list of star salaries are all men - with Gary Lineker the highest paid https://t.co/sFhc7Fzzvg Novichok poisoning victim Charlie Rowley \"no longer in critical condition\", says director of nursing at Salisbury Hospital https://t.co/iAyXwE2S1n Member of German neo-Nazi gang has been found guilty of 10 racially-motivated murders after five-year trial https://t.co/AD8caMZBYn \"There was only a tiny bit of hope, but that's all we had to work with.\"\n\nThai Navy Seal chief talks about successful cave rescue mission in BBC exclusive interview https://t.co/fi2BqgpsXk https://t.co/SIIQObPy1C RT @BBCSport: FT: #FRA 1-0 #BEL \n\nFrance are into their third #WorldCup final! \n\nSamuel Umtiti's 51st minute header gives Les Bleus victory\u2026 Amesbury Novichok poisoning victim Charlie Rowley is now conscious but \"not out of the woods yet\", say doctors https://t.co/8DpOy3EmKk Conservative party vice chairs Maria Caulfield and Ben Bradley quit over Theresa May's Chequers Brexit plan https://t.co/eu5WbZqyvi RT @BBCSport: Wow! \ud83d\ude32\n\nCristiano Ronaldo is set to be confirmed as a Juventus player, with a deal agreed between the Serie A club and Real M\u2026 @DanJohnsonNews Mission accomplished!\n\nThe last members of the rescue team who were inside the cave have made it out successfully #ThaiCaveRescue\n\nhttps://t.co/iGkjnWBkol https://t.co/5eTcOrVR6x \"It really is a fantastic achievement of human endeavour\" - @DanJohnsonNews on the extraordinary challenges faced by #ThaiCaveRescue heroes \n\nhttps://t.co/iGkjnWBkol https://t.co/bbI7NfYeEJ What a sight!\n\nDozens of aircraft fly over Buckingham Palace as the Royal Air Force celebrates 100 years of its proud history\n\n#RAF100 https://t.co/UBKSb8Z0tN https://t.co/rtlNzCG0Jy #ThaiCaveRescue: All 12 boys and their football coach rescued from flooded cave system in Chiang Rai \ud83d\udc17\ud83c\uddf9\ud83c\udded \n\nhttps://t.co/buyFHgjOu1 https://t.co/Ec71Nnjhp4 Reports from the scene say 11th person has been carried out of cave in Thailand, as rescue operation continues #ThaiCaveRescue \n\nhttps://t.co/jf3rCZjANE https://t.co/NwHi6V0grV Thai cave rescue: At least one more boy brought out of cave safely in latest phase of rescue operation - reports\n\nLive updates: https://t.co/jf3rCZjANE https://t.co/s78NPnkZtk #ThailandCaveRescue: Remaining  four boys and coach may be freed today, rescue chief says https://t.co/ZND3yhW6ke\n\nLive updates: https://t.co/wyJHu9vAfh Day 3 of the #ThailandCaveRescue and divers are gearing up to save the remaining five - Follow our live reporting page for updates https://t.co/wyJHu9vAfh\n\n#\u0e1e\u0e32\u0e17\u0e35\u0e21\u0e2b\u0e21\u0e39\u0e1b\u0e48\u0e32\u0e01\u0e25\u0e31\u0e1a\u0e1a\u0e49\u0e32\u0e19 President Trump picks conservative Brett Kavanaugh for US Supreme Court, setting up a tough confirmation battle https://t.co/tn5pf9I6oW Matt Hancock appointed new health secretary to replace Jeremy Hunt \n\nhttps://t.co/OjtreyhwDR Jeremy Hunt named as new UK foreign secretary after Boris Johnson quits over Brexit, Downing Street says https://t.co/0IZozKootn Resignation statement in full from @BorisJohnson\n\nLive reaction: https://t.co/w4wKJ0BcTD https://t.co/9UCCX8X7hv Former UK foreign secretary says in resignation letter Brexit dream is dying - \"suffocated by needless self-doubt\" https://t.co/zPtdTpJ1xW Prince Louis arrives for his christening service at the Chapel Royal, St James's Palace\n\nhttps://t.co/TGe9Ld5mpM https://t.co/rmN5muoneJ Boris Johnson resigns as UK Foreign Secretary, following the resignation of Brexit Secretary David Davis https://t.co/gFKnbH5oez #ThaiCaveRescue: Four more boys have been safely taken out of the caves, bringing the total rescued to eight, the BBC understands \n\nLatest https://t.co/oySZ4DBjfj https://t.co/sUJ92mdf2J There's got to be a time we \"get a bit tougher\" with the EU and \"this should have been the time\" - David Davis tells @bbclaurak, follow latest developments https://t.co/OaxjLarLxq https://t.co/SrQZtpF8yn Dominic Raab appointed Brexit Secretary after David Davis resigns from UK government https://t.co/rrWuBon3KV #ThaiCaveRescue: Four boys rescued last night now in quarantine in Chiang Rai hospital, local officials say \n\nLive updates: https://t.co/wyJHu9vAfh Follow the latest developments on day two of the #ThaiCaveRescue as effort to rescue nine remaining people resumes\n\nhttps://t.co/wyJHu9vAfh https://t.co/bnYolbw4tD It looks \"less and less likely\" that the UK will leave the customs union and single market - read David Davis's resignation letter in full\n\nhttps://t.co/n7V3JJEP5c https://t.co/WKiyWRvUkf Follow the latest reaction &amp; developments as Brexit Secretary David Davis resigns from UK government\n\nhttps://t.co/0pl0kb17qM https://t.co/FmlF0U0wxr Brexit Secretary David Davis resigns from the UK government https://t.co/NKvP8CSd0M UK police launch murder inquiry after Dawn Sturgess, 44, dies after exposure to nerve agent Novichok https://t.co/adk3o7Sj8z Judge orders release of former Brazilian President Luiz In\u00e1cio Lula da Silva pending appeal on corruption conviction https://t.co/mrvGCgpk0K Ninety divers - 50 foreign, 40 Thai - are involved in the Thailand cave rescue, the head of the operation says https://t.co/rfRVGXGdEP Thai cave rescue: Six boys have now come out, say officials in the emergency operation\n\nLive reporting: https://t.co/rfRVGXGdEP Four boys in total have been brought out of the cave complex, Thai navy confirms in official Facebook post  https://t.co/zk3wjhCX5P\n\nLive: https://t.co/wyJHu9vAfh Two ambulances are seen leaving the cave - believed to be taking two of the boys to hospital\n\nFollow live updates: https://t.co/rfRVGXGdEP https://t.co/GPITx9JjOw The first boys from a youth football team trapped in a Thai cave for two weeks have been rescued, reports say https://t.co/PFQbRzOoYt The complex mission to rescue the 12 trapped boys and their football coach from a cave in Thailand has begun https://t.co/WJY4eaRXVW\n\nFollow our live page for more updates https://t.co/wyJHu9vAfh A rescue mission is under way to save 12 Thai boys and their football coach trapped in a cave, officials say https://t.co/Gz9Xt3DuZg Police officer being tested at hospital in Salisbury for possible exposure to nerve agent Novichok https://t.co/EsopwCQz4h PM Theresa May refuses to rule out \"preferential treatment\" for EU citizens coming to UK after Brexit https://t.co/pfiSiTxRrs RT @BBCSport: THEY'VE DONE IT!\n\nEngland have reached a #WorldCup semi-final for the first time since 1990!\n\nFT: #SWE 0-2 #ENG \n\nReaction:\n\ud83d\udcfa\u2026 \"Crucially what we have agreed is the creation of a UK-EU free trade area\" - UK PM Theresa May on \"collective\" #Brexit agreement reached by her cabinet \n\nhttps://t.co/NIauAFnQ4E https://t.co/4sGNRdSefz Cabinet has reached \"collective\" agreement on UK's future relationship with EU after Brexit, PM Theresa May says https://t.co/KeIYHg8BxM RT @BBCSport: FULL TIME: Brazil 1-2 Belgium. \nIt's all over! Belgium were left hanging on at the end but Kevin de Bruyne's stunning strike\u2026 The Thai boys trapped in waterlogged caves can walk but can't dive yet and won't be freed today - local governor https://t.co/Nw5ZSXHhzj Teenager charged with rape and murder of six-year-old Alesha MacPhail, found dead on the Isle of Bute https://t.co/HaXyT05Rnj Pakistan's ex-PM Nawaz Sharif given 10 year prison term over corruption allegations related to London luxury flats https://t.co/mMtw9hRl83 Thai cave rescue death:\n\n- Diver named as Saman Kunan\n- 'His job was to deliver oxygen, did not have enough on his way back' \n- Lost consciousness and could not be revived by colleagues https://t.co/7VUk3C9TY8 A former Thai navy diver helping to rescue the boys trapped in a cave has died while taking in supplies - officials https://t.co/7JlUsZbl14 Six more Aum Shinrikyo cult members executed following execution of leader Shoko Asahara, say Japanese media https://t.co/uRV24xFTbY Japan executes Shoko Asahara, leader of Aum Shinrikyo cult, whose 1995 attack on the Tokyo metro killed 13 people https://t.co/VpMOtgwJux Scandal-hit Scott Pruitt resigns as head of the US Environmental Protection Agency https://t.co/9t3vp9CJRz Couple involved in Amesbury poisoning exposed to toxin after handling a contaminated item, @metpoliceuk say https://t.co/x6iNpjwtLn UK home secretary calls on Russia to explain Novichok poisoning, after nerve agent linked to two victims in Amesbury https://t.co/91Jy9lNOvi \"The two people have been exposed to the nerve agent Novichok\" - UK police give update on man and woman found unconscious in Amesbury, Wiltshire \n\nhttps://t.co/ZURBif81ns https://t.co/fD29Z8T0kl Pair found unconscious in Wiltshire poisoned with same nerve agent as ex-Russian spy Sergei Skripal, police say https://t.co/m8mHjgRzXc Fire near Saddleworth Moor now being investigated as arson, Greater Manchester Police say https://t.co/ph5qyCaVUl Counter-terrorism police working on \"major incident\" in Amesbury, Wiltshire, as two people remain in critical state https://t.co/ieNaPceesZ A stunning fall from grace.\n\nFormer Malaysian leader @NajibRazak has been charged with corruption after arriving at court in the capital Kuala Lumpur\n\nhttps://t.co/EWHPamoDfV RT @BBCSport: SCORED! #WorldCup \n\n#COL: \u2705\u2705\u2705\u274c\u274c\n#ENG: \u2705\u2705\u274c\u2705\u2705\n\nEngland have won on penalties! Eric Dier!\n\nFollow the #COLENG penalty shootout l\u2026 Female healthcare worker held on suspicion of murdering eight babies at Countess of Chester Hospital https://t.co/7mqy3gDicr The boys trapped in a Thai cave will have to learn to dive or wait months for flooding to recede, army says https://t.co/VzFewV69Yi Australian archbishop Philip Wilson expected to serve home detention for covering up child abuse by priests https://t.co/WGmbhRzBs6 The moment missing Thai boys and their football coach are located over a week after going missing in a cave system\n\nFull story: https://t.co/crXaVZejY9 https://t.co/SM8mvfNuic First images of Thai children alive in cave released by Thai Navy seals rescue team\n\nLatest: https://t.co/NYBCyHF2xB https://t.co/sd0xuP8u1v \"This is still a very precarious operation\"\n\nRescuers continue pumping water from Thailand caves where 12 boys and their football coach have been found\n\nLATEST: https://t.co/JlcRNeMaty https://t.co/LNJDBBfnDp \"It could take four hours to work out if they are in any condition to move\"\n\nMedics are assessing health of 12 boys and their football coach found alive after going missing for nine days in Thailand caves\n\nLATEST: https://t.co/JlcRNeMaty https://t.co/Xj0QY1vsGk All 12 boys and their football coach found alive after nine days missing in Thailand caves - regional governor https://t.co/0cFNbuol7W RT @BBCSport: Chris Froome has been cleared of any wrongdoing following an adverse drugs test. \n\nHe's set to compete in the 2018 Tour de Fr\u2026 RT @BBCMOTD: SAVED!\n\nAspas has his penalty saved and Spain are OUT!\n\n#ESP: \u2705\u2705\u274c\u2705\u274c\n#RUS: \u2705\u2705\u2705\u2705\n\n#ESPRUS https://t.co/byGgXJZ9tL #WorldCup http\u2026 RT @BBCSport: Two-time champion Andy Murray has withdrawn from #Wimbledon on the eve of the tournament.\n\nMore: https://t.co/Ngi3D5UZQF http\u2026 Four men aged between 18 and 21 killed and two teenage girls seriously hurt in car crash in Horsforth area of Leeds https://t.co/SUfWoZDvd6 Suspect in Capital Gazette newspaper attack barricaded exits and used a pump-action shotgun that was bought legally, police say https://t.co/vsMvT4qi29 Hillsborough match commander David Duckenfield will face trial for manslaughter, a judge rules https://t.co/UvlQW01yN7 RT @BBCSport: Andy Murray will play Frenchman Benoit Paire in the first round at Wimbledon next week if the Briton decides he is fit enough\u2026 US newspaper shooting which killed five was a 'targeted attack' and threats had been sent by social media - police https://t.co/hzIfsRrmda Several people dead in shooting at newspaper building in US city of Annapolis in Maryland, officials confirm https://t.co/yVfjyyjOo6 UK tolerated \"inexcusable\" US treatment of detainees in years after 9/11 attacks, report finds https://t.co/EVkeVLSARd A Supreme Court justice is to retire, giving President Trump the chance to reshape the top US court https://t.co/OC80dTFbCL Joe Jackson, the father and manager of Michael Jackson and the Jackson Five, has died aged 89 https://t.co/5aDttDz9Fc Holders Germany knocked out of World Cup in group stage after shock 2-0 defeat to South Korea https://t.co/BZ2Vn3pM6C Army called in to help tackle moorlands fire in Greater Manchester https://t.co/l27dVc7YXW RT @BBCSport: Seven-time Wimbledon champion Serena Williams has been seeded 25th for this year's tournament, despite being outside the top\u2026 Supreme Court rules that heterosexual couples should be able to have civil partnerships, following a legal challenge https://t.co/a2r1tqK5AP Uber has been granted a licence to operate in London for 15 months, after judge rules the company is \"now fit and proper\" https://t.co/ibzz2vXomh Supreme Court backs President Donald Trump's travel ban on several Muslim-majority countries https://t.co/Sig7BESssI British man found with knives in Westminster convicted of planning terror attack and making bombs for the Taliban https://t.co/lFXoIoiPV0 Two men die and seven people seriously injured after crash between bus and lorry in Cambridgeshire https://t.co/LlgvhpQ1zu Couple who tortured and killed their nanny before dumping her body in London garden jailed for life https://t.co/hITwt8tX6e About 15 people injured, some seriously, in crash between bus and lorry on the A47 in Cambridgeshire https://t.co/XKrXWwVpEU MPs back controversial plans for third runway at London's Heathrow airport by 415 votes to 119 https://t.co/5Epk3pRm9p Turkey's President Erdogan is set to assume sweeping new powers after winning most fiercely-fought election in years https://t.co/FsTXPAbJPS \"I've been entrusted by the nation\" - Turkey's President Erdogan claims election victory based on unofficial results https://t.co/Q0jGebLkiR Turkey's Recep Tayyip Erdogan leads presidential election with a fifth of votes counted - state media https://t.co/9uNqVMlVjB England hit their biggest ever World Cup score to guarantee a place in the next round of the tournament https://t.co/a7h53FtCDc Saudi women are officially allowed get behind the wheel, as a decades-old driving ban is lifted https://t.co/EzmJezEncu Explosion rocks Zimbabwe stadium where President Mnangagwa was addressing thousands of people at campaign rally https://t.co/FdYkzGFgCR An explosion hits a rally for Ethiopia's new PM Abiy Ahmed attended by thousands of people in Addis Ababa https://t.co/JjPBGh7OSu I would like to ask how I can help reunite the children with their families \"as quickly as possible\" - @FLOTUS visits border detention facility in Texas in wake of US immigration crisis https://t.co/kondZt2qyf https://t.co/zpbQXHfOqY US police arrest a 22-year-old man over killing of US rapper XXXTentacion, media reports say https://t.co/T1HzyyMAjW Trade minister Greg Hands to quit UK government over plans to expand Heathrow Airport https://t.co/k8Rf3a2dyJ It's a girl: New Zealand\u2019s PM Jacinda Ardern becomes the second elected world leader to give birth while in office https://t.co/uplrjclOtp President Trump signs order aiming to end immigrant family separations after global condemnation of the policy https://t.co/ZONwzwAOgJ David Drumm, former head of Anglo Irish Bank, sentenced to six years in jail at Dublin Criminal Court for conspiracy to defraud and false accounting\n\nhttps://t.co/PtSi9VmjAQ Government sees off rebellion as it wins key Brexit vote by 319 to 303 https://t.co/ZCpy3YzehM Relatives have shown \"remarkable tenacity and fortitude in questioning what happened to their loved ones\" - Rt Rev James Jones reveals 456 patients died at Gosport War Memorial Hospital through inappropriate prescribing of drugs\n\nhttps://t.co/e2aXiM2TXC https://t.co/O0RJgdzn3J Some 456 patients died from opioids prescribed without justification, report into Gosport War Memorial Hospital says https://t.co/C8CFsUJZ3i Police arrest London man on suspicion of \"act likely to cause explosion\" after small blast at Southgate Tube station https://t.co/B5jm6opvFK Canada will legalise marijuana for recreational use after a landmark law passes the Senate https://t.co/z4LZPOanEk 'A cesspool of political bias' - US announces withdrawal from UN Human Rights Council https://t.co/COdiLwtzY7 RT @bbctms: WORLD RECORD: \n\n446/3. \n\nEngland beat their own record for the highest total in ODIs. \n\nhttps://t.co/HOykR4YSIA\n\n#bbccricket #E\u2026 \"It is time to review\" the use of cannabis for medicinal use - UK Home Secretary Sajid Javid tells Commons https://t.co/4VORErbMZx https://t.co/UJY2aDLhka The US rapper XXXTentacion, who topped the charts as he faced domestic violence charges, has been killed aged 20. https://t.co/bWhBAUHOj1 Three people die after being struck by train near Loughborough Junction in south London https://t.co/pqggyUIQRV Question Time's David Dimbleby to step down from BBC show after 25 years to return to \"first love\" of reporting https://t.co/tY5e37Jaik Epileptic boy, 12, to get cannabis oil for \"medical emergency\" after it was confiscated, UK home secretary says https://t.co/XcTuezGNv7 'It's devastating': Watch Glaswegians react as huge fire takes hold in city centre https://t.co/jzAbVJEQqe Fire service says no casualties reported as Glasgow School of Art suffers huge fire for second time in four years https://t.co/VpeuFXsbbG Major fire at Glasgow School of Art's Mackintosh Building, four years after huge blaze there https://t.co/H5IRqoKFHK Judge revokes bail for ex-Trump campaign chairman Paul Manafort and orders he be held in jail pending trial https://t.co/2C2tt5VZ2z President Trump slaps 25% tariffs on $50bn worth of Chinese goods, accusing Beijing of intellectual copyright theft https://t.co/FOFAGPVnbU EastEnders actor Leslie Grantham, best known as rogue \"Dirty Den\u201d in the BBC One soap, has died aged 71 https://t.co/qiFPJnb5Nq Army sergeant jailed for life for trying to murder his wife by sabotaging her parachute https://t.co/qcqclTNkjB Scathing New York State lawsuit accuses Trump Foundation of \"persistent illegal conduct\" and wants it dissolved https://t.co/ZFW20yI0Y2 Catholic Argentina's lower house backs bill legalising abortion in first 14 weeks of pregnancy, but hurdles remain https://t.co/fs7xwgUTv6 Engineering firm Rolls-Royce confirms 4,600 job cuts over two years, hitting back office and management roles in UK https://t.co/tzhNpBsqQZ \"We believe Kim Jong-un understands the urgency [of denuclearisation], that we must do this quickly.\" - US Secretary of State Mike Pompeo \n\nhttps://t.co/pKOxrrlcsZ \"No sanctions relief\" for North Korea until complete denuclearisation, US Secretary of State Mike Pompeo says https://t.co/iDcLaW1rI2 RT @BBCPolitics: The SNP's Ian Blackford is sent out of the Commons after calling for the House to sit in private - and is followed by the\u2026 RT @BBCSport: A joint bid from the United States, Canada and Mexico has won the right to host the 2026 Fifa World Cup, beating a bid from M\u2026 RT @BBCSport: The Spanish Football Federation have confirmed they have sacked Julen Lopetegui as manager, just over 24 hours before the Wor\u2026 Greece's northern neighbour to be called North Macedonia after 27 years of wrangling between the two countries https://t.co/QjARCqGsM5 MPs vote by 324 to 298 against a bid to give Parliament the decisive say on the UK Brexit deal https://t.co/C872nN0pyy Alleged member of banned British far-right group National Action admits planning to murder Labour MP Rosie Cooper \n\nhttps://t.co/awefvWXOKw #TrumpKimSummit: Donald Trump says US will be stopping \"very provocative\" war games with South Korea \n\nLive updates: https://t.co/slT5YzZ7IR https://t.co/tSE99SGEDF \"Anyone can make war, but only the most courageous can make peace\" - US President Donald Trump on \"honest, direct\" meeting with Kim Jong-un #TrumpKimSummit https://t.co/slT5YzZ7IR https://t.co/8amE1a1oZs \"The world will see a major change\" - Kim Jong-un's words as he and Donald Trump sign a \"historic\" document after #TrumpKimSummit \n\nhttps://t.co/slT5YzZ7IR https://t.co/PEVsdA1XjR When Trump met Kim. \n\nClearer photos of that moment in history https://t.co/DNFStoMXjW\n\n#trumpkimsummit \n#TrumpKim https://t.co/XIPiK6REju The moment the world's been waiting for. \n\nUS President @realDonaldTrump has met North Korea's Kim Jong-un https://t.co/DNFStoMXjW https://t.co/R0VECiUX5X Donald Trump has *just* met Kim Jong-un https://t.co/DNFStoMXjW\n\n#TrumpKimSummit\n#TrumpKim @realDonaldTrump North Korean leader Kim Jong-un has just left his Singapore hotel and joins @realDonaldTrump on his way to Sentosa summit. \n\n#TrumpKim\n#TrumpKimSummit \n\nhttps://t.co/UZ5gjnZ47w https://t.co/vQAsR5fNt3 .@realDonaldTrump has just left his hotel and is now on his way to Singapore's Sentosa island for #TrumpKimSummit. \n\nKim Jong-un expected to depart shortly. Follow our live #TrumpKim updates: https://t.co/DNFStoMXjW Today's the day: @realDonaldTrump meets North Korea's Kim Jong-un https://t.co/BWqAUTLCwN\n\n#TrumpKim \n\nFollow our live #trumpkimsummit coverage here: https://t.co/DNFStoMXjW Polish man sentenced to 16 years and nine months in jail after he was found guilty of kidnapping British model Chloe Ayling https://t.co/QiOBke2E2j Spain says it will accept rescue ship with hundreds of migrants aboard, at the centre of an international row https://t.co/CH5KOVN4Cy Discount retailer Poundworld expected to appoint administrators, putting 5,100 jobs at risk https://t.co/RjQB4jNRCS Two men have died in a light aircraft crash at Raglan, in Monmouthshire, police say https://t.co/UXaTQYkvqg RT @BBCSport: \ud83d\udc10 \ud83c\udfbe \ud83d\udc10 \ud83c\udfbe \ud83d\udc10 \ud83c\udfbe\n\nRafael Nadal has won the French Open AGAIN.\n\nReaction \ud83d\udc47\nhttps://t.co/71kAdwLqQY\n\ud83d\udcfb@5livesport\n#bbctennis #RG18 ht\u2026 North Korea's Kim Jong-un arrives in Singapore two days before historic summit with US President Trump https://t.co/rxmBbED5y7 The G7 summit ends in disarray after US President Donald Trump retracts his endorsement of a joint final statement. https://t.co/Hu0v1JWDc6 Actress Emma Thompson becomes a dame, with Liverpool legend Kenny Dalglish knighted in Queen's Birthday Honours\n\nhttps://t.co/QEEFpHq9AN https://t.co/5oZFPfD9Kh American special forces soldier killed in firefight with jihadist militants in Somalia, US military officials say https://t.co/i428JIXQZp World leaders assemble for 'family photo' at G7 summit in Canada \n\nhttps://t.co/9TJ4sS5Kev https://t.co/ZWUrmO3cV5 Man charged with manslaughter of 100-year-old woman, who died after her neck was broken in bag theft https://t.co/DJ3TaRf5HB Landmark conviction against DR Congo warlord Jean-Pierre Bemba is overturned by International Criminal Court https://t.co/4AOSFC7tTj US celebrity chef and writer Anthony Bourdain found dead in French hotel room at age of 61, his employer CNN says https://t.co/Rp7XdLkAwb RT @BBCSport: The Premier League's executive chairman Richard Scudamore is to stand down by the end of 2018 after nearly 20 years in the ro\u2026 Met Police investigating use of \"stay put\u201d policy by London Fire Brigade during Grenfell Tower fire https://t.co/XyWshIu1S3 Swedish court sentences Uzbek Rakhmat Akilov to life over murder of five people in 2017 Stockholm lorry attack https://t.co/RnMYjyvpMF Human rights campaigners lose UK Supreme Court appeal over legality of Northern Ireland's abortion law https://t.co/dWihoH5Emy Department store chain House of Fraser is to close 31 shops, including Oxford Street, affecting 6,000 jobs https://t.co/ZuVEHtV4tB Nightclub owner Peter Stringfellow has died at the age of 77, a spokesman has said https://t.co/LxZwGQCyHl After a plea from Kim Kardashian, Donald Trump agrees to free great-grandmother jailed for two decades, US media say https://t.co/qRIfx2iV27 Evacuations are ordered after a fresh blast at Guatemala's Fuego volcano sends material down the south side https://t.co/6X5GIVer41 Fashion designer Kate Spade, 55, found dead in her New York apartment, and is reported to have taken her own life https://t.co/9UT5AlM1ff Disgraced film producer Harvey Weinstein pleads not guilty to rape and sexual assault charges https://t.co/PcoOyOk2rk RT @BBCSport: Roma have been fined 50,000 euros (\u00a343,632) by Uefa following crowd disturbances at the Champions League semi-final first leg\u2026 Sky News must be sold before UK government approves 21st Century Fox's \u00a311.7bn takeover of Sky, says Culture Secretary Matt Hancock\n\nhttps://t.co/Cto6qB4YYv \"This decision has been taken based on national interest and detailed evidence\"\n\nTransport Secretary Chris Grayling tells MPs the Government backs plans for Heathrow Airport expansion \n\nhttps://t.co/32tCxfg2eD https://t.co/u8yKjGhRBd Gay couple wedding cake: US Supreme Court rules in favour of Christian baker who refused Colorado couple's request https://t.co/Y0tyCrCnfn Teenager found guilty of plotting terror attack on British Museum in London https://t.co/hUlY0q7ACn Jordan's Prime Minister Hani Mulki resigns after several days of protests against tax rises and austerity measures https://t.co/M3iIpAvwvV A minute's silence falls across the UK as the victims of the #LondonBridge terror attack are remembered, one year on \n\nhttps://t.co/hW5bq1EuRd https://t.co/fmv300uZa8 Armed police cordon off Berlin Cathedral after an officer reportedly shot a man at the building https://t.co/DdbPH9rZVJ Visa says cardholders should now be able to use their cards, with systems operating at \"close to normal\" levels, blaming earlier disruption on \"hardware failure\" https://t.co/Y4JyIZKdSS Donald Trump's summit with Kim Jong-un on 12 June is back on, the US president says, a week after it was scrapped https://t.co/WfevC3zR8i Visa says some card payments are currently failing across the UK and elsewhere in Europe https://t.co/3IJ9nksdEc Five big cats which escaped from a zoo in western Germany have been recaptured, reportedly with the help of a drone https://t.co/g32tKvh2qT Two lions, two tigers and a jaguar escape from a German zoo, with public warned to stay indoors, police say https://t.co/qUowA6ZZ4a Spain's prime minister is forced out of his job, losing a no-confidence vote triggered by a corruption scandal https://t.co/T6sskEuPSj Talks on summit between Trump and Kim Jong-un \"moving in the right direction\", secretary of state Mike Pompeo says https://t.co/PnxigeVi40 The US to put tariffs on steel and aluminium made by key allies, a move France says is \"unjustifiable and dangerous\" https://t.co/RuuMpmGgNJ RT @BBCSport: Zinedine Zidane says he is stepping down as Real Madrid boss, just five days after leading them to a third straight Champions\u2026 Lithuania and Romania assisted CIA torture of al-Qaeda suspects, European Court of Human Rights rules https://t.co/VdnWsfigYS The moment Russian journalist Arkady Babchenko, who had been reported dead yesterday, appeared at a press conference alive and well \nhttps://t.co/MOIfKzqu5h https://t.co/24iBgOVtXL \"Assassination\" of journalist Arkady Babchenko was \"staged to expose Russian agents\", says head of Ukraine's security services\n\nhttps://t.co/MOIfKzqu5h Russian journalist Arkady Babchenko, reportedly assassinated in Kiev on Tuesday, appears on TV alive and well https://t.co/Jq3liX4P2o \"Abhorrent, repugnant\" - and cancelled. ABC drops Roseanne's show after star's racist tweet about an Obama aide https://t.co/2eutMyKysP Hurricane Maria killed 4,600 people in Puerto Rico, 70 times the official toll - Harvard study https://t.co/3HplA9VkAB Two police officers killed by gunman in Li\u00e8ge were both women, city's mayor confirms\nhttps://t.co/WyTQaq20ss Belgian authorities confirm they are treating the attack in Li\u00e8ge as terrorism \nhttps://t.co/d4uJcconBF Two police officers shot dead in eastern Belgian city of Li\u00e8ge, senate chief says, with reports attacker is killed https://t.co/FTmHJQ5V71 Murder investigation launched after man was killed and several more injured when car hit people near Stockport club https://t.co/raUxSrvGY7 Man in his 80s dies after vehicle submerged in flood water in Walsall, police say https://t.co/8hmZZR6Ifh Man arrested on suspicion of murder of woman, 31, and girl, 11, in Gloucester https://t.co/5W9CiZIqiz After his dramatic rescue of a young boy from a Paris balcony, Malian migrant Mamoudou Gassama is made a French citizen https://t.co/sfdk1LesPP Italy PM-designate Guiseppe Conte gives up bid to form government amid reports president vetoed economy pick https://t.co/AbEoT2SdF0 RT @BBCSport: \ud83c\udfc6\ud83c\udfc6\ud83c\udfc6\ud83c\udfc6\ud83c\udfc6\ud83c\udfc6\ud83c\udfc6\ud83c\udfc6\ud83c\udfc6\ud83c\udfc6\ud83c\udfc6\ud83c\udfc6\ud83c\udfc6\n\nIt's heartbreak for Liverpool as Real Madrid win their 13th Champions League title.\n\nFT 3-1\n\nhttps://t.co/Hr5J\u2026 The final result in Ireland's abortion reform referendum\n\nYes 1,429,981\nNo 723,632\n\nhttps://t.co/urPAqRybLz https://t.co/8665LHVeOC Official result: Republic of Ireland votes resoundingly to overturn abortion ban with voters backing reform of constitution \n\nhttps://t.co/urPAqRybLz https://t.co/cFFqrxUyik Irish PM hails \"quiet revolution\" as early results point to \"resounding\" referendum vote for overturning abortion ban\n\nhttps://t.co/uDGzjgbeBU https://t.co/OnvOOZPHld Leaders of both Koreas meet in border zone as efforts continue to reschedule Donald Trump's summit with Kim Jong-un https://t.co/ZNdh7ZZZAk 'No' campaign spokesman accepts defeat in Ireland referendum which will allow liberalisation of abortion law \n\nhttps://t.co/urPAqRybLz https://t.co/Sq6D6x1xNK Exit polls suggest the Republic of Ireland has voted by a landslide to liberalise its strict abortion laws https://t.co/FeHK5CKrvI A 95-year-old man arrested on suspicion of murder after female carer died of head injuries, London police say https://t.co/Wttf0ezBRU Harvey Weinstein is charged with rape and a criminal sex act on two women, after months of sexual abuse allegations https://t.co/xKlFuMthOA Film producer Harvey Weinstein arrives at NY police station where he's expected to answer sexual misconduct charges https://t.co/SVJvYQ0BCT Man who attacked D-Day veteran, 96, with hammer during raid on his home in Somerset found guilty of attempted murder https://t.co/LXYx1mLb9y Australia and Netherlands formally accuse Russia of responsibility for downing MH17 passenger jet in 2014 https://t.co/zyMC4Ccbyz Hollywood mogul Harvey Weinstein expected to surrender to police on sexual misconduct charges, US media report https://t.co/NzeaFHi9FZ \"Hopefully positive things will be taking place... but if they don't, we are more ready than we have ever been before\" - President Trump on North Korea, after pulling out of summit with Kim Jong-un \n\nhttps://t.co/tAge9yswra https://t.co/QIbfSe6vp1 Two men jailed for life for murder of four children in petrol bomb attack in Greater Manchester https://t.co/fEgISmD1y5 \"You talk about your nuclear capabilities, but ours are so massive and powerful that I pray to God they will never have to be used.\" \n\nPresident Trump tells Kim Jong-un why he's cancelling planned summit\n\nhttps://t.co/nLcROnapfj In letter to Kim Jong-un, President Trump says \"tremendous anger and open hostility\" displayed in North Korea statement is reason for pulling out of summit and calls it a \"missed opportunity\"\n\nhttps://t.co/nLcROnapfj https://t.co/VjfSCaQJOn US-North Korea summit will not take place, Donald Trump says https://t.co/Kzej5c101k Army sergeant Emile Cilliers guilty of trying to murder his wife by tampering with her parachute https://t.co/OdTAyBSJZo North Korea appears to have blown up tunnels at its only nuclear test site, a key move to reducing regional tensions https://t.co/s92Pw9KS4O A couple have been found guilty of murdering their French au pair and burning her body in their garden https://t.co/8r6yRdCG4B A missile fired at flight MH17 in 2014, killing 298 people, belonged to a Russian brigade, investigators say https://t.co/yLua7Ztfui A couple have been found guilty of murdering their French au pair and burning her body in their London garden\n\nhttps://t.co/ZRwyexYiwh A missile fired at flight MH17 in 2014, killing 298 people, belonged to a Russian brigade, investigators say https://t.co/D8VQAg3Ca1 Man arrested in Hertfordshire on suspicion of preparing terrorist acts, police say https://t.co/SCbyRXldte Yulia Skripal, poisoned daughter of Russian ex-spy Sergei, says she is lucky to be alive after attack https://t.co/Pe34d0cCOr After the alleged payment to Cohen for White House talks, Ukraine\u2019s Anti Corruption Bureau drops Paul Manafort investigation\n\nhttps://t.co/NsfSjRzEzJ Cohen received at least $400,000 to fix talks between Ukraine\u2019s Poroshenko and President Trump \u2013 intelligence sources\n\nhttps://t.co/NsfSjRzEzJ BBC Exclusive: Trump lawyer Michael Cohen \u201cpaid by Ukraine\u201d to arrange White House talks in June 2017\n\nhttps://t.co/NsfSjRzEzJ Berlinah Wallace given life sentence with minimum term of 12 years for throwing sulphuric acid over former partner, which led to him ending his life https://t.co/gxOjzPBq7a RT @BBCSport: \ud83d\udd34 Confirmed \ud83d\udd34\n\nArsenal have announced Unai Emery as Arsene Wenger's successor.\n\nMore here\ud83d\udc49 https://t.co/x1kOq2Nos3 https://t.\u2026 \"There has been a change in customer shopping habits\" - Marks and Spencer Chief Executive Steve Rowe on 62% fall in annual pre-tax profits https://t.co/UpSDsTgrKf \"The great American novelist of our postwar world\" - Tributes paid to novelist Philip Roth, who has died aged 85 https://t.co/vaxhh5ZPCe President Trump says his historic summit with North Korea's Kim Jong-un next month may be delayed https://t.co/bzBWdJINR0 Supermarket giant Tesco plans to close its Tesco Direct website, putting 500 jobs at risk https://t.co/QiEbKrn4aG UK holds a minute's silence to remember the victims of the #ManchesterArena attack one year on \n\nhttps://t.co/j5FWS6OGMd https://t.co/CfxO4pHXaY Marks and Spencer to close 100 stores by 2022 saying reorganisation \"vital\" for firm's future https://t.co/2LBhVTOMgD RT @BBCSport: Arsenal are set to appoint Unai Emery as their new manager.\n\nRead more\n\ud83d\udc49 https://t.co/Z4g4asmx3i #Arsenal https://t.co/hxcv73\u2026 Ken Livingstone says he is resigning from the Labour party amid anti-Semitism row\nhttps://t.co/Pv17B4rd7I Duke and Duchess of Sussex release official photographs from their wedding day\n\nhttps://t.co/6yvDshkVs8 #RoyalWedding https://t.co/NlbXy5xMft A 72-second silence in memory of the victims marks the beginning of inquiry into Grenfell Tower fire https://t.co/yw2uIVMiyh Jailed British-Iranian Nazanin Zaghari-Ratcliffe charged in Iran with spreading propaganda, her campaign says https://t.co/oOU3I7SkC8 One of black boxes from Boeing 737 that crashed in Havana on Friday found \"in good condition\", Cuban officials say. https://t.co/OHYW3Dsy6l RT @BBCNews: Harry and his new wife Meghan have left Windsor Castle in an open-top classic sports car for their evening wedding reception a\u2026 RT @BBCSport: CHELSEA HAVE WON THE FA CUP! \ud83c\udfc6\n\nThey've beaten Man Utd 1-0.\n\nParty time for the Blues \ud83c\udf89\n\n\ud83d\udc49 https://t.co/zzvVrq4qSz #FACupFina\u2026 RT @BBCSport: Full-Time: Celtic 2-0 Motherwell. \n\nCeltic complete back-to-back trebles by clinching the Scottish Cup. Goals from Callum McG\u2026 Enormous crowds greet the Duke &amp; Duchess of Sussex as #harryandmeghan head up Long Walk and back to Windsor Castle https://t.co/XbDbyZPqJN #royalwedding https://t.co/4Fi3X8L1VB The royal couple leave St George's Chapel - and here's the kiss!\n\nhttps://t.co/XbDbyZPqJN #royalwedding https://t.co/wpcWWl3aDL The royal couple have made their vows and exchanged rings.\n\nHarry &amp; Meghan are married! \ud83c\udf89\n\nhttps://t.co/XbDbyZPqJN #royalwedding https://t.co/IziNa9xK9y And the bride arrives - Meghan Markle emerges into bright May sunshine at St George's Chapel \n\nhttps://t.co/XbDbyZPqJN #royalwedding https://t.co/UoMB6uBj6w A stunning sight! Meghan Markle's car drives down Long Walk to Windsor Castle ahead of the #royalwedding\n\nhttps://t.co/XbDbyZPqJN https://t.co/2vIueul4wN Prince Harry arrives at Windsor Castle with his brother and best man, Prince William\n\nhttps://t.co/XbDbz071Bl #royalwedding https://t.co/fDRcGHQo6q The first glimpse of bride Meghan Markle as she leaves Cliveden House Hotel for Windsor Castle https://t.co/XbDbz071Bl #royalwedding https://t.co/LCSqHQbXx2 Prince Harry &amp; Meghan Markle will become the Duke &amp; Duchess of Sussex on #royalwedding day, Buckingham Palace announces https://t.co/6k2eknMdjz 10 people have died, and another 10 were injured in shooting at Santa Fe High School - Texas Governor Greg Abbott says \n\nhttps://t.co/n5ZUtzkzO9 More than 100 people feared dead after a Boeing 737 airliner crashed and exploded near Havana airport, Cuban state media says\n\nhttps://t.co/VwVZvReA7h Boeing 737 crashes shortly after take-off from Havana, Cuban media report https://t.co/VwVZvReA7h \"I just ran as fast as I could\" - Santa Fe High School students describe shooting incident in Texas that has left up to 10 people dead \n\nhttps://t.co/n5ZUtzkzO9 https://t.co/3bvfO8OYvV Santa Fe High School shooting update:\n\n- Between eight and 10 people killed in incident, say police\n- Majority of dead 'are students'\n- A student is in custody after the attack\n\nhttps://t.co/n5ZUtzkzO9 \"This has been going on too long in our country, too many years, too many decades now\" - President Trump on reports at least eight people are dead after shooting at Santa Fe High School in Texas https://t.co/n5ZUtzkzO9 https://t.co/qbQrY9zjiW \"Multiple people have died\" - @BBCJamesCook gives the latest on the Santa Fe High School shooting https://t.co/n5ZUtz2Ypz https://t.co/awrYcEXmBX At least eight people are dead after a shooting at Santa Fe High School in Texas, reports say https://t.co/qwC5MN8BLM Russian ex-spy Sergei Skripal has been discharged from hospital after being poisoned with a nerve agent in Salisbury https://t.co/m09vK9vPg5 The Prince of Wales will accompany Meghan Markle down the aisle, Kensington Palace confirms https://t.co/lF1tHcOJ2I #royalwedding Explosive eruption at Hawaii\u2019s Kilauea volcano sends ash thousands of metres into the sky https://t.co/DunkpP2Xpu Kasim Lewis, 31, jailed for life with a minimum of 29 years at Old Bailey for murdering 22-year-old barmaid Iuliana Tudos in north London\n\nhttps://t.co/FoBoUntZAj Berlinah Wallace found guilty of throwing corrosive substance with intent at Bristol Crown Court after injuring former partner Mark van Dongen in acid attack\n\nhttps://t.co/3bjQB8avQ1 Berlinah Wallace, 48, cleared of killing boyfriend in acid attack in Bristol in 2015 https://t.co/mG58fZAScs UK government to consult on banning flammable cladding, after Grenfell review stopped short of recommending ban https://t.co/MEckLQ9heM Meghan Markle says she hopes her father \"can be given the space he needs to focus on his health\" https://t.co/wu62RigKE4 #RoyalWedding https://t.co/BVohJx9cx7 Meghan Markle says her father will not now be attending her wedding to Prince Harry on Saturday https://t.co/g5w2J6kr2V Grenfell Tower fire review concludes indifference and ignorance led \"race to the bottom\" in building safety practices with cost prioritised over safety - Dame Judith Hackitt\n\nhttps://t.co/C50KYGhR8m UK retailer Mothercare says it is to shut 50 stores as part of a restructuring plan, resulting in\nhundreds of job losses.\n\nhttps://t.co/EQ7TnSentb The maximum bet on fixed-odds betting terminals will be reduced from \u00a3100 to \u00a32, the government says https://t.co/wLmS7JM1EO Oxfam chief executive Mark Goldring to stand down after scandal over claims of sexual misconduct by staff in Haiti https://t.co/8xQExjxF8t RT @BBCSport: Gareth Southgate has named his 23-man England squad for the World Cup in Russia.\n\nTrent Alexander-Arnold and Ruben Loftus-Che\u2026 Rail services on East Coast Main Line to be brought back under UK government control, Stagecoach Group says https://t.co/z4pi33oxnS Malaysian politician Anwar Ibrahim freed from jail after being pardoned, paving the way for his return to politics https://t.co/db9NLfQPja The Trump-Kim summit is in doubt. North Korea says it may pull out if the US insists it gives up nuclear weapons https://t.co/XsbkVVIwlD North Korea cancels high-level talks with South scheduled for Wednesday because of anger over military exercises https://t.co/WMxn9D2ha9 Tom Wolfe, bestselling US author of The Right Stuff and The Bonfire of the Vanities, has died at 87, his agent says https://t.co/HuPeJQkF0e Wages in UK rising faster than inflation for first time in more than a year, figures show https://t.co/KdsD4hDlem It is now unclear whether Meghan Markle's father will attend Saturday's wedding and walk her down the aisle https://t.co/JU21d6A5qs Israel: Numbers of casualties continue to rise in deadliest day of violence since the 2014 Gaza war\n\nFor the latest: https://t.co/cFkWq2d3td https://t.co/AG48XGEbZh \"It's been a long time coming,\" President Donald Trump says as US opens its controversial new embassy in Jerusalem\n\nLatest: https://t.co/8UM2OxlhbZ https://t.co/P5yM69DWaA Ceremony to inaugurate US embassy in Jerusalem begins amidst bloody clashes near Gaza border\n\nLatest: https://t.co/8UM2OxlhbZ https://t.co/rXa2P6sbrQ Gaza health officials say at least 37 Palestinians killed and 1,300 injured by Israeli fire after clashes near border \n\nLatest: https://t.co/8UM2OxlhbZ https://t.co/dinriQYV4b Number of Palestinians killed by Israeli troops near Gaza border rises to 28, Palestinian officials say https://t.co/uZ6Fw7wJXc Deadliest clashes in weeks as nine Palestinians killed by Israeli troops ahead of new US Jerusalem embassy ceremony https://t.co/DlVUFwLv4U Indian MP and former UN diplomat Shashi Tharoor charged with aiding his wife\u2019s suicide in 2014 https://t.co/vEveSZZyUH Russian government is \"chief protagonist\" in campaign aimed at undermining European democracy - MI5 director general Andrew Parker says\n\nhttps://t.co/1m1AJceuZv Two British nationals, released after being kidnapped in a national park DR Congo, say they are 'very grateful' https://t.co/N8ZwPMUaKD Two Britons held hostage in the Democratic Republic of Congo released unharmed, Foreign Secretary Boris Johnson says https://t.co/n2SWQjybzu Members of one family were behind a wave of blasts targeting churches in the Indonesian city of Surabaya, police say https://t.co/PS4CriVELK Obituary: Dame Tessa Jowell, stalwart of New Labour &amp; key player in London's successful Olympic bid\n\nhttps://t.co/CLv47ZQMrM https://t.co/CE880sEHUm Former Labour cabinet minister Dame Tessa Jowell has died aged 70, her family announces https://t.co/1V0h1QFQW3 'Thank you for choosing different' - Israel's @NettaBarzilai on winning this year's #eurovision song contest \n\nhttps://t.co/M6lXDE0W7B https://t.co/h2XqRCqz90 Netta wins the Eurovision Song Contest for Israel https://t.co/PM1HsxFDwd Serial killer Dennis Nilsen, who claimed to have killed 16 people in the 1970s and 1980s, has died in prison https://t.co/q694vZTBg9 Watch the moment a protester storms the stage to disrupt the UK's Eurovision performance https://t.co/M1WN4yuWSw Police in Paris shoot man dead after he stabs several people in the Opera district, French media say https://t.co/AsiLMCT3hp RT @BBCSport: FT: Leinster 15-12 Racing 92\n\nIrish club Leinster have won rugby union\u2019s European Champions Cup after tense final in Bilbao.\u2026 Former Malaysian Prime Minister Najib Razak is banned from leaving the country, immigration officials say. https://t.co/GwhwcEMbNx Body found near South Queensferry confirmed by police as being that of Frightened Rabbit singer Scott Hutchison https://t.co/2DlASWlQMi Barclays boss Jes Staley fined \u00a3642,430 by Financial Conduct Authority in relation to his attempt to unmask whistleblower\n\nhttps://t.co/5743itolty First ever summit between sitting North Korean and US leaders will take place in Singapore on 12 June, Trump says https://t.co/iEL0RwXg4L UK government apologises to Libyan Abdul Hakim Belhaj who said an MI6 tip-off led to his torture by Gaddafi's forces https://t.co/YAzj6yICZg Bank of England leaves UK interest rates unchanged at 0.5% https://t.co/CJI3kNga9f President Trump greets three Americans released by North Korea as they arrive back in US at Andrews Air Force Base near Washington\n\nhttps://t.co/kee3Egl8WK https://t.co/ZfqdbYDVUT BT to axe about 13,000 jobs, most of which will be back office and middle management roles, company says https://t.co/OiDx74d0Gp A number of people feared dead after a dam bursts in Kenya, with hundreds left homeless, officials say https://t.co/Sx00dKSbre Malaysia's opposition alliance scores historic victory in general election, ending ruling party's six-decade rule https://t.co/TKv1znL5sC RT @BBCSport: Sir Alex Ferguson no longer needs intensive care after undergoing emergency surgery on Saturday for a brain haemorrhage.\n\nhtt\u2026 Two fairground workers guilty of manslaughter over death of girl, 7, on bouncy castle in Essex in 2016 https://t.co/obBcDcJcwZ Three Americans released by North Korea ahead of Trump-Kim talks, US president announces https://t.co/fbGm0KAXrk BMW recalling 312,000 cars in UK after BBC\u2019s Watchdog highlights fault that caused engines to cut out https://t.co/NK1kq9OFlo Barack Obama says Trump's decision to withdraw from the #IranDeal is a \"serious mistake\" that could leave US with choice between a nuclear-armed Iran or another war in the Middle East\n\nLatest: https://t.co/3oqFG51Tsd https://t.co/UtUopOThEO President Rouhani says he wants Iran to be ready to restart uranium enrichment \"at industrial levels\" after Trump pulls the US out of the #IranDeal\n\nLatest: https://t.co/3oqFG51Tsd https://t.co/n37Qv1Yxps Donald Trump says Iran will want a \"new and lasting deal\" and he is \"ready, willing and able\" to negotiate when Iran is ready #IranDeal https://t.co/acEpk0WCuQ \"A decaying and rotten deal\" - Trump says he will withdraw the US from Obama-era nuclear agreement with Iran https://t.co/acEpk0F16g #IranDeal https://t.co/6ATHvD1Ukg RT @BBCSport: Mark Williams has held off an incredible fight back from John Higgins to claim his third World Championship title.\n\nhttps://t\u2026 UK fugitive Jamie Acourt will not challenge extradition from Spain after arrest over alleged drug offences - court https://t.co/HLpDvqQtyH A 17-year-old boy has died after he was found with a gunshot wound in a south London street on Saturday, police say https://t.co/raYKcjeEHi Former Man Utd manager Sir Alex Ferguson has had emergency surgery for brain haemorrhage https://t.co/SxtDEJyKYC Nasa's Mars mission blasts off from California on a six-month journey to investigate the interior of the Red Planet \nhttps://t.co/oeAYLdptzS https://t.co/lWIsZSRuvG All councils have declared after #Election2018 with mixed results for main parties and Labour and Conservatives tied on projected national vote share https://t.co/BfFmrNkIWC Air France boss says he is quitting after staff at the strike-hit airline reject pay deal https://t.co/SktP7jBoon RT @BBCSport: It's official.\n\nRangers have announced that Steven Gerrard is their new manager.\n\n\ud83d\udc49https://t.co/mQC7yFnDaE https://t.co/5TpaV\u2026 Nobel committee takes rare decision not to award Prize for Literature this year because of sexual misconduct scandal https://t.co/uGb08gn1YJ With the majority of results in for #Election2018 get all the latest analysis here https://t.co/XWCUvTkQya https://t.co/bZoO7XNIho Director Roman Polanski, who pleaded guilty to sex with 13-yr-old, and disgraced comedian Bill Cosby expelled from Oscars body https://t.co/7d2cOKE3qH Fierce dust storms and thundershowers kill at least 70 people in the north of India, injuring many more https://t.co/A5eDVI0dLc RT @BBCSport: FT: \n\nAS Roma 4-2 Liverpool (6-7 agg)\n\n#LFC are into the #UCL final to face Real Madrid!\n\nhttps://t.co/2zIEL3SxWQ #ROMLIV htt\u2026 Cambridge Analytica, the firm that harvested Facebook data to help Trump in the US election, is to shut down https://t.co/StNwvzBq09 UK MPs vote against opposition motion to reveal Home Office documents on Windrush migrants https://t.co/BEVDIXgcsD \"Health Secretary tells MPs between 135 and 270 women may have had their lives shortened after missing a routine breast screening invitation due to IT error #PMQs \nhttps://t.co/gziyDi6WQD https://t.co/kftv5Eg6AP About 450,000 women in England missed an invitation for routine breast cancer screening due to NHS errors https://t.co/JI6uWkbaon RT @BBCSport: FT: Real Madrid 2-2 Bayern Munich (4-3) \n\nReal Madrid do enough... just. \n\nThey're into yet another #UCL final.\n\n#UCL #RMAFCB\u2026 Armenia in political chaos after MPs block opposition leader's bid to become PM after weeks of protests https://t.co/RGAZ8Bxj1u Bomb attack on mosque in north-east Nigerian town of Mubi kills at least 20 people, police say https://t.co/jzVRPF2d2Q Royal Bank of Scotland is to close 162 branches in England and Wales, resulting in nearly 800 job losses https://t.co/Pgof5NKLbH Israeli PM Benjamin Netanyahu reveals what he says are documents proving Iran is secretly pursuing nuclear programme https://t.co/UWKHyLBQ0z BBC Afghan reporter Ahmad Shah, 29, killed in attack in eastern Khost region, BBC says https://t.co/nEO3JCQLuy Sajid Javid chosen to be new UK home secretary after Amber Rudd resigns\n\nhttps://t.co/ohNfn6kB1C https://t.co/uTbZaG6QcX Sainsbury's confirms plans to merge with Asda, currently owned by US supermarket giant Walmart https://t.co/b8HNscMUCf Home Secretary Amber Rudd resigns, Downing Street says https://t.co/Of7gdoFeHY North Korea's nuclear test site will close in May, South Korea says. https://t.co/w00sRJDGRo British supermarket chains Sainsbury's and Asda in merger talks - although both brands expected to be retained https://t.co/WaZlqyFvoY We're heartbroken, say the parents of 23-month-old Alfie Evans, as they announce that the toddler died overnight https://t.co/HuaJV9UFIE Home Secretary Amber Rudd apologises for not being aware of \"specific\" migrant removal targets https://t.co/Y3LEgCXzYZ Man stabs at least seven teenagers to death at school in northern China, officials say https://t.co/K1RH0cnU9z Duke &amp; Duchess of Cambridge name #royalbaby Louis Arthur Charles \n\nhttps://t.co/DlrynYdFzv https://t.co/Vr80AhI0zC Leaders of North and South Korea to work to rid the peninsula of nuclear weapons after holding historic summit https://t.co/wePRi1S2xJ #interkoreansummit\n\n\u2022 Kim Jong-un crosses into South Korea\n\u2022 First North Korean leader to do so since the end of the Korean War\n\u2022 \"A new history begins now - at the starting point of history and the era of peace\" - Kim Jong-un \n\nLive updates: https://t.co/2w2e2LT9V4 https://t.co/6o3tjct5ki Kim Jong-un becomes the first North Korean leader to cross the line dividing the Koreas, ahead of a historic summit https://t.co/xbgGH43Wj4 US comedian Bill Cosby, 80, found guilty of sexually assaulting a woman 14 years ago https://t.co/LxSyOf5K04 Ex-CIA chief Mike Pompeo is confirmed as secretary of state after bruising battle in the US Senate https://t.co/B69iSF0emL President Donald Trump is to visit the UK on Friday 13 July, White House says https://t.co/WXxJTIYAgH Ruth Davidson, Scottish Tory leader, says she is pregnant and she and partner Jen Wilson \"excited\" https://t.co/fNwgdnITzu https://t.co/CAPxcJGGO4 Prince William to be Prince Harry's best man at his wedding to Meghan Markle, Kensington Palace says https://t.co/cQxX2gIuSL Danish inventor Peter Madsen given life sentence for murdering journalist Kim Wall on his submarine https://t.co/ljrIbSF166 Self-styled Indian 'godman' Asaram, who has millions of followers worldwide, found guilty of rape https://t.co/Iv6hOKgGOR Police chief names Alek Minassian, 25, as suspect in Toronto van attack that killed at least 10 people. https://t.co/pDX9pyp4Gy Nine people dead and 16 injured after van strikes pedestrians in Toronto, police in Canada say\n\nhttps://t.co/NZbRtG7T9U \"I couldn't believe what I'd seen... all these people on the streets getting hit one by one\" Toronto  collision eyewitness describes moment van driver mounted the kerb and struck pedestrians \nhttps://t.co/26YbDX2P1S https://t.co/Q2nRWktVI4 \"People were shouting stop the car\" - Eyewitness describes seeing the van hitting pedestrians \nhttps://t.co/26YbDX2P1S https://t.co/xBoky7TAij What we know so far about Toronto van strike: \n\n- Up to 10 pedestrians may have been struck \n- Extent of injuries unclear\n- Driver of van in custody. No personal details known\n- Yonge Street and Finch Avenue areas cordoned off\nhttps://t.co/26YbDX2P1S https://t.co/3nBoZ9N41U @BBCWorld \"People were shouting stop the car\" - Eyewitness describes seeing the van hitting pedestrians \nhttps://t.co/26YbDX2P1S https://t.co/niffmQVaPu @BBCWorld What we know so far about Toronto van strike: \n\n- Up to 10 pedestrians may have been struck \n- Extent of injuries unclear\n- Driver of van in custody. No personal details known\n- Yonge Street and Finch Avenue areas cordoned off\n\nhttps://t.co/26YbDX2P1S https://t.co/hp7jxDeRmS Naked gunman who killed four people at a Waffle House in Tennessee is in custody after a manhunt, police say https://t.co/0grB11nE3f Numerous pedestrians hit by van that fled the scene in Toronto, extent of injuries unknown, police say https://t.co/nRb0GuMM26 The Duke and Duchess of Cambridge show off new son outside London hospital https://t.co/lGZ2YAK7um #royalbaby https://t.co/RpcFMzIFNr Top official in Yemen's rebel Houthi movement killed in Saudi-led coalition strike, rebel-run TV channel says. https://t.co/cPIPpmvY8h Duke of Cambridge arrives at hospital with Prince George &amp; Princess Charlotte following birth of their baby brother https://t.co/lGZ2YAK7um #royalbaby https://t.co/PKt5yS5da2 National commemoration of murdered London teenager Stephen Lawrence to take place on 22 April each year, PM says https://t.co/RuydwNStOW Armenia's Prime Minister Serzh Sargsyan resigns after days of protests against him https://t.co/0tIuzFGpJg Queen's sixth great-grandchild born at 11:01 BST; both families \"delighted with the news\"\n\nhttps://t.co/3A1LZ7hXwC #royalbaby https://t.co/5tVvURQ5UP It's a boy! Duchess of Cambridge gives birth to her third child, who is fifth in line to throne #royalbaby\n\nhttps://t.co/J0yjc0RlKu https://t.co/KPm8vieWS7 Masterchef semi-finalist dies after collapsing during the @LondonMarathon, it has been confirmed\n\nhttps://t.co/7QI01SHIzP The body of Liam Colgan, who went missing on his brother's stag weekend in Hamburg, found in river Elbe https://t.co/B85iyMqbjX The sole surviving suspect from 2015 Paris attacks, Salah Abdeslam, guilty of terror charge over gunfight in Belgium https://t.co/oHY2UCFd8z Duchess of Cambridge has been admitted to hospital in the early stages of labour with her third child https://t.co/ST2R53a6fR British nationals were killed in a road crash in Saudi Arabia on Saturday, Foreign Office says https://t.co/RVqN8gbitM RT @BBCSport: What an athlete and what a performance! The Olympic Champion adds his third London Marathon win. Eliud Kipchoge, take a bow!\u2026 RT @BBCSport: What a moment for her! After making her marathon debut last year at the age of 33, Kenya's Vivian Cheruiyot has won her first\u2026 Suicide attack at voter registration centre in Afghan capital Kabul kills at least 31 people, officials say https://t.co/xDTY2BBXtl Armenian opposition leader detained amid clashes with security forces after days of protests, reports say https://t.co/HqWnpcBSpi Verne Troyer, best known for his role as Mini-Me in the Austin Powers films, has died, aged 49 https://t.co/O7nLDQQpvv Carwyn Jones says he will stand down as Wales first minister in the autumn https://t.co/gYSEkX7FN6 International chemical weapons experts have finally gone to the site of the suspected attack in Syria, Russia says https://t.co/OKUuoqXU4Z Three-year-old boy dies in swimming pool at David Lloyd fitness club in Leeds https://t.co/L6EMbpalw6 North Korean leader Kim Jong-un says there is no more need for nuclear or missile tests - South Korean reports https://t.co/zmDAJSah78 Swedish DJ Avicii, who has collaborated with the likes of Madonna and Coldplay, has died in Oman at the age of 28 https://t.co/I3yhNeGyjr Commonwealth leaders agree that Prince Charles will be the next head of the organisation, it is understood https://t.co/1YyKJk2Brr RT @BBCSport: After 22 years, 10 major trophies, more than 800 Premier League games, Arsene Wenger has announced his time as Gunners boss i\u2026 No criminal charges will be brought over the death of US musician Prince in April 2016 - Minnesota prosecutors https://t.co/j9PbzO30jN TV presenter Dale Winton, who hosted Supermarket Sweep, has died at the age of 62, his agent says https://t.co/kq5WHrcAxl Cuba's lawmakers say Miguel D\u00edaz-Canel is sole candidate to succeed Ra\u00fal Castro, bringing family's rule to an end https://t.co/PQZg521yUG President Trump confirms CIA chief secretly visited North Korean leader last week, and formed \"good relationship\" https://t.co/BSQLPl7U91 UK inflation fell to 2.5% in March, down from 2.7% in February, official figures show https://t.co/mQax9T2xtI British firm De La Rue says it will not be appealing against decision to hand contract for printing new blue UK passports to a European company\n\nhttps://t.co/3E16OGg2BX Mike Pompeo, CIA chief, met secretly with North Korean leader Kim Jong-un - reports https://t.co/YReBasLx7l Barbara Bush, former US first lady and literacy campaigner, has died aged 92 https://t.co/aescY5JAUe One person killed after US passenger jet with engine failure made emergency landing in Philadelphia, officials say.\nhttps://t.co/FNranrR1FD UK PM personally apologises to Caribbean leaders for \"anxiety caused\" over Windrush immigration controversy https://t.co/QemEN5Se5r Nerve agent used to poison Sergei Skripal and daughter delivered \"in liquid form,\" Department for Environment says https://t.co/tKCRdvxDrm Average wages went up by 2.8% in three months to February, still below 2.9% inflation rate, according to Consumer Prices Index\n\nhttps://t.co/NFxyPxTCF8 Wage rises move above rate of inflation for the first time in a year, official figures show https://t.co/TVBnEbHVSd TV presenter Ant McPartlin fined \u00a386,000 and banned from driving for 20 months, after admitting drink driving https://t.co/gjkYrXAtSq TV presenter Ant McPartlin pleads guilty to drink driving after car crash in London in March https://t.co/4y5MDQXXeF In an extraordinary attack on a sitting president, ex-FBI chief says Trump \"morally unfit\" to lead, in TV interview https://t.co/OIRgHGI9aH RT @BBCSport: Manchester City are Premier League champions. \ud83c\udfc6\n\nWest Brom beat Manchester United 1-0 at Old Trafford and that's enough for M\u2026 Sir Martin Sorrell steps down as CEO of the world's largest advertising agency, WPP https://t.co/BKBel2mKJr RT @BBCSport: What a finish!\n\nTiger Roll wins the #GrandNational in a photo finish.\n\nReaction \ud83d\udc0e\ud83d\udc49 https://t.co/j2PuHdsCo8  #bbcracing https:\u2026 \"Chemical weapons are a threat to us all\" - US ambassador to UN @nikkihaley on #SyriaStrikes  https://t.co/TYYdZbq2YK https://t.co/1iPWOYh9im Russia's envoy to UN condemns \"aggression\" against Syria which \"makes catastrophic humanitarian situation worse\" https://t.co/t0wYqkQFsQ Allied air strikes will set Syrian chemical weapons programme back for years - Pentagon https://t.co/Gv2RmIZoKy Trump hails \"perfectly executed\" strikes on Syria after alleged chemical attack, concluding \"Mission Accomplished\" https://t.co/FWlRMuKLXv Ulster and Ireland rugby players Paddy Jackson and Stuart Olding, who were cleared of rape, are sacked https://t.co/0w5CTKxakK It was \"right and legal\" to take military action in Syria - UK PM @Theresa_May makes statement on #SyriaStrikes https://t.co/YNqSuaT2e0 https://t.co/jQk1YGo5Xb Military action against Syria is \"legally questionable\" &amp; makes real accountability for war crimes less likely, Labour leader @jeremycorbyn says https://t.co/YNqSuaBrms #SyriaStrikes Air strikes on Syria were \"highly successful mission,\" says UK Defence Secretary Gavin Williamson https://t.co/7tSjQ7yMgz A US-led mission has hit several targets in Syria in what the Pentagon chief said was, for now, a \"one-time shot\" https://t.co/kdUY2yfgs4 US, UK and France strike Syrian chemical weapons sites in biggest military action against President Assad so far https://t.co/46BkjZ2W6C RT @BBCSport: Premier League clubs have voted not to use the video assistant referee (VAR) system for next season.\n\n\ud83d\udc49 https://t.co/HjHgxsq1\u2026 RT @BBCSport: Liverpool will play Roma in the Champions League semi-finals.\n\n\ud83d\udc49 https://t.co/Bk7zzGYKZW #bbcfootball #LFC #UCLDraws https://\u2026 The Duke of Edinburgh leaves King Edward VII's Hospital in London, nine days after hip replacement operation https://t.co/ZlTHRkabN1 Open University vice-chancellor Peter Horrocks resigns following vote of no confidence in his leadership https://t.co/EpIxE3YzC8 Princess Anne visits her father, the Duke of Edinburgh, at King Edward VII's hospital in London https://t.co/pI3koT54iy International chemical weapons watchdog confirms UK analysis of type of nerve agent used in Russian ex-spy poisoning https://t.co/xkqmidIR06 Yulia Skripal, poisoned daughter of Russian ex-spy Sergei, rejects Russian help \"at the moment\" as she recovers https://t.co/OLbWrjANW8 Trump tells Russia to 'get ready' for Syria missiles, in response to alleged chemical attack https://t.co/fL1LTiSNeK Death toll from military plane crash in Algeria reaches at least 247, media reports say \n\nhttps://t.co/0VUB40I7M7 Five-hundred patients showed symptoms of chemical attack in Syria's Eastern Ghouta - World Health Organization https://t.co/KuKVRceNTZ Many feared dead as military plane crashes in Algeria - media reports https://t.co/F4XUa1qdPU RT @BBCSport: FT Roma 3-0 Barcelona (Agg 4-4)\n\nRoma have knocked Barcelona out of the Champions League on away goals! \n\nThey can hardly bel\u2026 RT @BBCSport: FT Man City 1-2 Liverpool (Agg 1-5)\n\nLiverpool are into the Champions League semi-finals!\n\nReaction \ud83d\udc49 https://t.co/JxTlNUeXbd\u2026 Independent chemical weapons inspectors say they will travel to Douma in Syria after reports of toxic attack https://t.co/98KIiK1xDg British Gas to increase energy bills for dual fuel customers by an average of 5.5% - or \u00a360 a year Yulia Skripal, poisoned daughter of ex-Russian spy, has been discharged from hospital in Salisbury, BBC understands https://t.co/SuCIxzOHsB FBI raids offices of President Trump's lawyer Michael Cohen partly over payments made to porn star, US media say https://t.co/6ANogOpJxc Russia and the US exchange fierce words at UN over suspected Syria chemical weapons attack https://t.co/mRIs1pyHPx A man is jailed for at least 26 years for murdering a travel agent who was in a relationship with his ex-girlfriend. https://t.co/VBnzNJM0wY A man believed to be in his 40s has been shot dead by police in Romford, east London, Metropolitan Police say. https://t.co/b14mRirpEW Air strikes hit a Syrian military airport with loud explosions heard, Syrian state media report https://t.co/H9N4yUggSg US golfer Patrick Reed wins the US Masters to claim his first major title https://t.co/4FPMqlathy Hungary's right-wing PM Viktor Orban is set for a third election win but with a reduced majority, projections show https://t.co/jvHiyxgAU0 Trump lashes out at Russia, Iran and Assad over Syria suspected chemical attack and warns \"big price to pay\" https://t.co/7CPCRsYkEp One person is reported to be seriously injured after fire breaks out at Trump Tower in New York https://t.co/yKhjGKP9eJ Brazil's ex-President Luis In\u00e1cio Lula da Silva hands himself in to police to start a jail sentence for corruption https://t.co/c94o5UFGaW Two people were killed after a van drove into a crowd in Germany, officials say, revising an earlier toll of three https://t.co/aJvzjL5Y6M \"There are some eyewitness accounts of other culprits possibly having fled the vehicle\" - Andreas Bode Muenster Police spokesman \nhttps://t.co/Wgi0DBsyZS https://t.co/m3IaCHcRoV German police say they cordoned off the area after what they describe as a 'suspicious object' in the van. Incident is being treated as an attack but no confirmation yet of terrorism. \nhttps://t.co/Wgi0DBsyZS https://t.co/nWKtWOBNF2 4 people dead including the driver of the van - German Interior ministry says\nhttps://t.co/Wgi0DBsyZS Brazil's ex-President Lula says will surrender to police to be jailed pending appeal against corruption conviction https://t.co/3EX7UXCcml The driver of the vehicle shot himself - German police spokeswoman says\nhttps://t.co/Wgi0DBsyZS German Police say they believe there are several fatalities and around 30 people injured. \nhttps://t.co/Wgi0DBsyZS Reports of casualties in Germany after van drives into pedestrians in city of Muenster https://t.co/OVOrbRHYEF Canadian police say 14 killed as lorry and bus carrying junior ice hockey team collide https://t.co/PwMdJwgabE What a moment for English gymnastics.\n\nIt's one-two in the #GC2018 all-around gymnastics final.\n\nNile Wilson takes gold, with James Hall in Silver.\n\nMore: https://t.co/RoURTcP26Q https://t.co/5EVePHCfxf Man, 78, arrested after suspected burglar was fatally stabbed at his London home faces no further action, police say https://t.co/wGK7n3hrq4 Police investigating the murder of 17-year-old Tanesha Melbourne-Blake arrest a 30-year-old man https://t.co/Sndy3fTY3l Ex-spy Sergei Skripal no longer in critical condition, doctors say, after being poisoned by nerve agent in Salisbury https://t.co/XUiPLn61JR Catalan ex-leader leaves jail in Germany on bail and calls for immediate dialogue https://t.co/cDybQgf2L3 South Korea's disgraced former President Park Geun-hye is jailed for 24 years in a far-reaching corruption scandal https://t.co/bjtW39gdwT In a verdict being broadcast live, South Korea's former President Park Geun-hye is found guilty of abuse of power https://t.co/MyQwFTg94H RT @BBCSport: Five-time world darts champion Eric Bristow has died at the age of 60.\n\nhttps://t.co/BaGwv2fKkv https://t.co/cQIRXz4kNB Yulia Skripal, poisoned by nerve agent in UK, says she is getting stronger 'daily' after waking up a week ago\nhttps://t.co/MouWymjAht Russian state TV airs recorded conversation claimed to be between poisoning victim Yulia Skripal and her cousin https://t.co/4tmqnt3lYj Bollywood actor Salman Khan has been sentenced to 5 years in jail for poaching\nhttps://t.co/ZViXRFPvv3 Bollywood superstar Salman Khan convicted over the killing of two endangered blackbuck antelope back in 1998. https://t.co/8vso001t0K Brazil's ex-President Lula must go to prison on corruption charges pending appeal, Supreme Court judges rule by 6-5 https://t.co/x8Ch2JamS9 Facebook now believes up to 87 million users had information improperly shared with consultancy Cambridge Analytica https://t.co/r0FCp6xPjM Russia loses bid for joint inquiry into poisoning of ex-spy and daughter in UK, in vote at chemical weapons watchdog https://t.co/5414kMK6El The Duke of Edinburgh is in \"good spirits\" after a successful hip replacement operation, Buckingham Palace says https://t.co/SRUBtjEdpB RT @BBCSport: Former England and Chelsea midfielder Ray Wilkins has died in hospital at the age of 61.\n\nOur thoughts are with his friends a\u2026 Female suspect dead in shooting at YouTube HQ in San Bruno, California which has left at least four other people injured - police chief https://t.co/6HqpB0Zdv3 https://t.co/wuLSeGIRAs What we know so far:\n\n- Police say they're responding to \"active shooter\" incident at YouTube headquarters in California\n- Gunshots reported at company's San Bruno offices \n- Ambulances at the scene, authorities warn public to stay away\n\nhttps://t.co/6HqpB0Zdv3 https://t.co/LytsLNZpKv Shots reported near YouTube headquarters in California - police at scene in San Bruno https://t.co/b6JVep8SH5 Dutch lawyer based in London becomes first person to be jailed in FBI's Trump-Russia inquiry after a plea deal https://t.co/95jjOUWFn2 The Duke of Edinburgh admitted to hospital in London for planned surgery on his hip https://t.co/MJl6NVUPgq South African anti-apartheid campaigner Winnie Mandela has died aged 81, her personal assistant says https://t.co/krdVvFLYAp Centre-left candidate Carlos Alvarado takes an unassailable lead in Costa Rica's presidential election count https://t.co/ZKiZf3Zmf5 The junk is down. The remains of an eight-tonne defunct Chinese space lab have come down over the South Pacific https://t.co/tWT7dtWvq2 Two-month-old girl has died after going into cardiac arrest at West Midland Safari Park, West Mercia Police say https://t.co/n0UJcdnBrq RT @BBCSport: Anthony Joshua wins by unanimous decision!\n\nGet the reaction here: https://t.co/YK3iBeCfMM #bbcboxing #JoshuaParker https://t\u2026 Russia more than doubles number of UK diplomats expelled in spy poisoning row https://t.co/oGWaFQPLcW She's back. Nobel winner Malala Yousafzai visits the Pakistan town where she was shot returning from school in 2012 https://t.co/GeXtdxtcEj Arnold Schwarzenegger undergoes emergency open heart surgery in Los Angeles https://t.co/Cn2hdHcIzu Russia intensifies row over UK spy poisoning by ordering the expulsion of more diplomats from 23 western countries https://t.co/FDWeGCvhdZ Widow of gunman who killed 49 people at Pulse nightclub in Florida two years ago is found not guilty of helping him https://t.co/OYcBlOUhyy Five dead and 350 hurt in clashes with Israeli army as thousands of Palestinians protest at Gaza border - officials https://t.co/8TrYc5jvO0 Israeli shelling reportedly kills a Palestinian in Gaza, where tension is high ahead of a protest along the border https://t.co/JvGlm63xEX Russia expels 60 US diplomats and closes St Petersburg consulate in response to American action over spy poisoning https://t.co/UcuMYOScqs French ex-President Sarkozy to face trial for corruption, days after charges in separate Libya funds case, media say https://t.co/kz7GpbWP1k Yulia Skripal, daughter of ex-Russian spy, \"improving rapidly\" and no longer in critical condition, four weeks after Salisbury poisoning\n\nhttps://t.co/xeS1qoX7y5 Barclays to pay $2bn to settle a lawsuit over mortgage fraud claims in the run-up to the financial crisis, US says https://t.co/PqW3wr8Skg RT @BBCSport: Darren Lehmann is to quit his role as head coach of Australia at the end of the current Test match against South Africa.\n\nMor\u2026 French police arrest man in Grenoble after group of soldiers were almost hit by a car while jogging near their barracks https://t.co/9vx48aKlTJ Driver on the run after trying to ram car into group of soldiers out jogging near barracks in southeast France https://t.co/s9bJkfP0J3 Rioting and a fire at a police station in Venezuela have left 68 people dead, officials confirm https://t.co/zogox9naMw Scores of detainees are feared dead after a fire at a Venezuelan police station during an escape bid https://t.co/73HfUSrHCJ Nobel Peace Prize winner Malala Yousafzai returns to Pakistan for the first time since being shot by the Taliban https://t.co/MJtRH7z2qo UK police probing poisoning of ex-spy and daughter believe first contact with nerve agent came from their front door https://t.co/k2FrMiqd0r Drink-driver, who knocked down and killed three teenagers as they walked to a party in London, jailed for 13 years https://t.co/rXFvlgp4jl Ulster rugby players Paddy Jackson and Stuart Olding cleared of raping woman at Mr Jackson\u2019s house in June 2016 https://t.co/lLDpgJeike Man held and items seized over Hatton Garden heist three years ago in which \u00a314m worth of jewellery stolen https://t.co/7T0EhwDoFg RT @BBCSport: Steve Smith and David Warner have been banned by the Indian Premier League over their recent ball-tampering.\n\nFull story: htt\u2026 Parole Board decision to release black-cab rapist John Worboys overturned by High Court, after challenge by victims https://t.co/0vESYMQrNz Parole Board chairman Nick Hardwick to resign, BBC learns, ahead of challenge over case of rapist John Worboys https://t.co/LcH100EtOA After days of speculation, China's news agency confirms North Korea's leader Kim Jong-un has visited China https://t.co/qi7hbF6P8c RT @BBCSport: Cricket Australia are to send captain Steve Smith, vice-captain David Warner and batsman Cameron Bancroft home from South Afr\u2026 Fire crews were \"out of the loop\" and took two hours to attend after the Manchester Arena attack, a report says https://t.co/9qIDgmp6UP \"Today 14 member states have decided to expel Russian diplomats\" - @eucopresident Donald Tusk on co-ordinated action against Russia following Salisbury poisoning https://t.co/rN4CccSimk https://t.co/qggaERAJFB Germany &amp; France are each expelling four Russian diplomats &amp; other European countries are following suit, over nerve agent attack on Russian ex-spy in UK https://t.co/8QlOZwsDUu Sixty Russian diplomats in US being expelled amid co-ordinated response to poisoning of Russian ex-spy in UK https://t.co/EU2iEM1xLg Fire exits were blocked &amp; the alarm was switched off when an inferno engulfed a Russian shopping centre, killing 64 people, investigators say https://t.co/YWidx9ewX7 Southern Health NHS Foundation Trust fined \u00a32m after admitting failures that led to deaths of two patients https://t.co/QAXG5PWiJG Man admits causing death of brothers aged six and two in hit and run in Coventry last month https://t.co/Rnuny9sK80 64 people now known to have died in Russian shopping centre fire - emergencies minister says\n\nhttps://t.co/u2QYvVLpQW A shopping centre blaze in the Russian city of Kemerovo kills at least 37, with dozens missing, including children https://t.co/qpO5LElZrc Jeremy Corbyn 'sincerely sorry for the pain' caused by anti-Semitism within the Labour Party https://t.co/hw17g3oLym German police detain Catalan ex-leader Carles Puigdemont, who is wanted in Spain for sedition, his lawyer says https://t.co/kqE4XnAJGs Australia cricket captain Steve Smith steps down for remainder of test match against SA over ball tampering scandal https://t.co/YNj2n1O7nv A Qantas airliner has just made history, completing the first scheduled non-stop flight between Australia and the UK https://t.co/DzfvBgVXBt A French police officer who swapped places with a hostage in a supermarket siege dies of his injuries. https://t.co/Q2QGXgV9sh UK information commissioner granted warrant to search London offices of data analytics firm Cambridge Analytica https://t.co/HC39uVDZhp Labour leader Jeremy Corbyn sacks Owen Smith from shadow cabinet after he called for second EU referendum https://t.co/ENGGcxfQUi Two lorry drivers jailed over crash on M1 in Buckinghamshire that killed eight people last year https://t.co/XawD7WXrU9 Police inspector guilty of murdering his wife, a detective constable, who was found strangled in a Cheshire lake https://t.co/TcNXpemGtk Gunman, 26-year-old Redouane Lakdim, reported to have killed three people, is now dead - French government sources say #Tr\u00e8bes\nhttps://t.co/e1iEyArxhf \"Dangerous and devious\" teenager jailed for life for Parsons Green Tube bombing, in which 51 people injured https://t.co/eTigOv8EUI Armed police shoot hostage-taker after storming supermarket in southern French town of #Tr\u00e8bes https://t.co/hpG6MAmZDU \"Everything leads us to believe it is a terror attack\" - French President Emmanuel Macron on ongoing #Tr\u00e8bes hostage situation https://t.co/cABeHf80xK https://t.co/Ez29rtrSIl At least two people now feared dead in #Tr\u00e8bes hostage situation, with three more wounded and situation ongoing - French Interior Ministry source says https://t.co/cABeHf80xK At least one person feared dead after gunman \"claiming IS allegiance\" takes hostages at #Tr\u00e8bes supermarket in France https://t.co/cABeHf80xK What we know so far about hostage situation in #Tr\u00e8bes, France:\n\n- Elite police surrounding Super U shop, gunman inside\n\n- Shots fired at policemen earlier, wounding one\n\n- Gunman \"claims to be in Islamic State group\"\n\nLatest: https://t.co/cABeHf80xK https://t.co/6McLy3uTqm Hostages taken at a supermarket after shots fired near Montpellier in southern France, French media report https://t.co/fJi12w6yYC President Trump replaces US National Security Adviser H R McMaster with Bush-era defence hawk John Bolton https://t.co/TkBEsW0JoQ \"It really has been completely surreal\" - @wiltshirepolice Chief Constable Kier Pritchard reads statement from Detective Sergeant Nick Bailey, officer discharged from hospital after Salisbury poisoning https://t.co/lyQlglHkCx https://t.co/4uAopAvYxq Detective Sergeant Nick Bailey discharged from hospital after nerve agent attack in Salisbury earlier this month https://t.co/PEjTFruC6p Donald Trump imposing tariffs on $50bn of Chinese goods imports over \"intellectual property theft\" - officials https://t.co/tMHvx95Fso Doctors given go-ahead to take blood samples from Sergei Skripal and his daughter Yulia for testing by the Organisation for the Prohibition of Chemical Weapons https://t.co/IaXDJSCz0d John Dowd, Donald Trump's lead lawyer in Russia inquiry resigns, US media report https://t.co/UrRPWVd1ns Six dead in explosion at chemical plant in Czech Republic https://t.co/XJ2v1xJC8C Pilot of jet that crashed at Shoreham air show, killing 11 men, to be charged with manslaughter by gross negligence https://t.co/0DBIAlJ8Pz Facebook's Zuckerberg: \"We made mistakes\" over Cambridge Analytica situation https://t.co/szg6INOSlk Peru's President Pedro Pablo Kuczynski is to resign amid vote-buying scandal, government sources say https://t.co/E9UntpLq4b TV host Ant McPartlin charged with drink driving after crash in south-west London https://t.co/cxJkJbHsLw Fashion retailer New Look says it will close 60 stores resulting in the loss of up to 980 jobs https://t.co/RL7r1HDQVo Suspect killed in the Austin parcel bombing case is named by US media as 23-year-old Mark Anthony Conditt https://t.co/pdBxzg1SRJ Unemployment in the UK increased by 24,000 to 1.45m in the three months to January, says the Office for National Statistics.\n\nhttps://t.co/jkG1I30jWL Suspect in series of parcel bombings in Austin, Texas, is dead after major police operation - US media report https://t.co/P4MPQ97VkJ At least 26 killed, more wounded, in suspected suicide bomb attack near shrine in Afghan capital Kabul - officials https://t.co/Rev3I2gJE4 Nigerian village stunned as many of 110 schoolgirls kidnapped by Islamist militants in February are freed - reports https://t.co/l2TS3Wqeij Myanmar president Htin Kyaw, close ally of de facto leader Aung San Suu Kyi, resigns, says his office https://t.co/36nOMeit1j Texas police report new explosion in Austin, with at least one person injured https://t.co/Lg5U2Zt3Dc Texas police report new explosion in Austin, with at least one person injured Cambridge Analytica suspends boss Alexander Nix amid row over use of Facebook data https://t.co/VSlpIsQUTe Engineer killed but pilot survived Red Arrows jet crash in north Wales earlier, RAF spokesman says https://t.co/Te4ebY3opa Ashes of Professor Stephen Hawking will be interred at Westminster Abbey near the graves of Sir Isaac Newton and Charles Darwin, says the Dean of Westminster \n\nhttps://t.co/e0WydFKbmk Red Arrows Hawk jet crashes after incident at RAF Valley in north Wales, Ministry of Defence says https://t.co/TfgyU1YvD6 FBI is investigating a blast at a FedEx depot in Texas, in the wake of four explosions in recent weeks https://t.co/NAg1Kgggy7 UK inflation fell to 2.7% in February, as measured by Consumer Prices Index, down from 3% in January https://t.co/biny3NxmJY ITV's Saturday Night Takeaway will not air this week as host Ant McPartlin \"returns to treatment\" after arrest https://t.co/mkQiT4EcfQ Man charged with attempted murder after car driven into nightclub in Gravesend, Kent, on Saturday https://t.co/luVxPBuNpF EU citizens arriving in the UK during the transition period will enjoy \"the same rights and guarantees\" as those present before Brexit - Michel Barnier\nhttps://t.co/2FtRgsZlBN  #brexit Brexit Secretary David Davis said that the agreement represented a\n\"significant step\" on ensuring a time-limited implementation period after Brexit which would deliver the certainty demanded by business.\nhttps://t.co/2FtRgsZlBN #Brexit EU's Brexit negotiator Michel Barnier says there are still outstanding issues relating to Irish border: \"We are not at the end of the road and there is a lot of work still to be done.\"  https://t.co/2FtRgsZlBN #brexit The joint legal text for draft withdrawal agreement will go to the European Council of EU leaders for approval at Thursday's summit - Michel Barnier says https://t.co/2FtRgsZlBN #Brexit EU's negotiator Michel Barnier hails \"decisive step\" towards UK's orderly withdrawal from EU https://t.co/2FtRgsHKdd #Brexit https://t.co/DLE0MSo22X Putin secures fourth term as Russian leader with at least 73.9% of vote, exit polls say - a bigger win than in 2012 https://t.co/A5L9K8SUDa Turkish-backed forces have taken full control of centre of Syrian-Kurdish city of Afrin, Turkey's president says https://t.co/TRu8yluvTJ RT @bbcrugbyunion: FT: England 15-24 Ireland\n\nWhat a performance from Ireland! They are the 2018 Six Nations Grand Slam champions!\n\n\ud83d\udc49https:\u2026 Russia to expel 23 British diplomats amid tensions over nerve agent attack on former spy in Salisbury https://t.co/a3Uy3sRuRY US justice department fires FBI official Andrew McCabe, who was criticised by President Donald Trump https://t.co/3osMcVzK5y UK police launch murder investigation after death of Russian businessman Nikolai Glushkov in south-west London https://t.co/hOL7dbj5hF RT @BBCSport: \"Native River\" has won the Gold Cup! #CheltenhamFestival \n\nFollow live reaction here \ud83d\udc49 https://t.co/qQVWFLWCN5 https://t.co/O\u2026 Fraud charges against former South African President Jacob Zuma are reinstated, prosecutors say https://t.co/mAcbB3bhaX Ahmed Hassan, 18, is convicted of attempted murder over the Parsons Green Tube bombing in London in September https://t.co/WqclkxKIGb At least four dead in Florida university bridge collapse as the search for survivors continues https://t.co/hVg2XbR8ep Newly constructed university bridge collapses in Miami 'leaving people trapped' https://t.co/cV2h9epGf4 US places sanctions on Russians accused of meddling in the 2016 presidential election https://t.co/0B7WVKRmf0 Ex-spy poisoning first offensive use of nerve agent in Europe since World War II - UK, US, France and Germany say https://t.co/Pd728nkkEQ Neville Hord jailed for at least 30 years for stabbing to death Jodie Willsher, who was working at an Aldi supermarket in Yorkshire https://t.co/6hpckDUNmO Man pleads guilty to murdering Aldi worker Jodie Willsher, who was stabbed in Yorkshire store in December https://t.co/M43VnIUu3Z Russia will soon expel UK diplomats in retaliation for Britain's response to poisoning of ex-spy - Russian media https://t.co/7zOz2DkNeN Anglo-Dutch consumer goods giant Unilever, maker of Marmite and Dove soap, is to abandon its London HQ https://t.co/byDzOfYvVt Slovak PM Robert Fico says he is ready to resign after murder of journalist, provided no early polls are called https://t.co/EH6krWdVnE \"We will freeze Russian state assets wherever we have the evidence that they may be used to threaten the life or property of UK nationals or residents\" - Prime Minister Theresa May https://t.co/NICIjaztob \"There will be no attendance or indeed members of the Royal family at this summer's World Cup in Russia\" - Prime Minister Theresa May says\n\nhttps://t.co/NICIjaztob Jim Bowen, best known for hosting darts-based game show Bullseye, has died at the age of 80 https://t.co/Gvso54hxmC UK to expel 23 Russian diplomats, PM Theresa May says, after nerve agent attack on former double agent in Salisbury\n\nhttps://t.co/KnwyxZirZs https://t.co/8WM5Bmebw1 All Toys R Us UK stores expected to close in next six weeks, after attempts to find buyer failed, BBC understands https://t.co/aQ3YnpD3Kg UK calls for urgent meeting of UN Security Council over poisoning of a former Russian double agent in Salisbury https://t.co/XGGIqJxzPc \"Life would be tragic if it weren't funny.\" \n\n\"The greatest enemy of knowledge is not ignorance, it is the illusion of knowledge.\" \n\n- One of the world's best loved scientists, Stephen Hawking https://t.co/G53z7w97oe\n\nMore: https://t.co/xDjv0LB2n4 https://t.co/e9wd3qfyjO Physicist Stephen Hawking has died at the age of 76, a spokesman for his family has said https://t.co/ZfW9MSXCbL @theresa_may US President Donald Trump has said the US is \"with the UK all the way\" over the poisoning\nof Sergei Skripal and his daughter, @10DowningStreet says https://t.co/Y2cJraTGh2 @theresa_may Russian Embassy in UK says Moscow \"will not respond to London's ultimatum\" until given access to samples of the nerve agent https://t.co/Y2cJraTGh2 \"As soon as we get the facts straight, if we agree with them, we will condemn Russia or whoever it may be\" - President Trump on Salisbury poisoning https://t.co/fiPPBhAZFc https://t.co/wv5kWRIK2e US President Donald Trump sacks Secretary of State Rex Tillerson, replacing him with CIA chief Mike Pompeo https://t.co/aH2ISF3HeK Turkish army says it has surrounded northern Syrian town of Afrin as part of offensive against Kurdish fighters https://t.co/r7XYp3lfAR RT @BBCSport: It's all over for Mauricio Pellegrino.\n\nSouthampton have sacked their Argentine manager with eight games left of season.\n\nMor\u2026 Russia's Foreign Ministry calls @theresa_may's remarks a \"fairy tale\" after her statement on the Salisbury poisoning https://t.co/U4h0vZGZUF \"Highly likely\" Russia was responsible for poisoning Sergei &amp; Yulia Skripal in Salisbury - UK PM Theresa May https://t.co/U4h0vZpow5 https://t.co/QnT5r0V0SG Former Russian spy &amp; his daughter poisoned in Salisbury by \"military grade nerve agent of a type developed by Russia\" - UK PM Theresa May https://t.co/U4h0vZpow5 https://t.co/cDHz6f2wHP French fashion designer Hubert de Givenchy, famed for styling Audrey Hepburn and Jackie Kennedy, dies aged 91 https://t.co/DmQ1JNL8AK Kathmandu airport crash: Police sources say 40 people have been killed. 31 died at the airport and nine in hospital. A further nine are missing. #Kathmanduairport\n\nhttps://t.co/bqU7YuZMFL A 17-year-old boy is jailed for 10 and a half years for a spate of acid attacks on moped riders in London https://t.co/3tOPvsMv75 Officials in Nepal say at least 27 people have been killed and at least 20 injured in the Bangladeshi passenger plane crash. https://t.co/bqU7YuZMFL Photos posted on social media show the wreckage of the plane identified in local media as S2-AGU, a Bombardier Dash 8 Q400. https://t.co/bqU7YuZMFL https://t.co/qWTf4Yp82l Authorities say seventeen people on board have been rescued so far. The number of casualties is unconfirmed. https://t.co/bqU7YuZMFL The plane, operated by Bangladeshi airline US-Bangla, veered off the runway. Officials say 67 people are thought to be on board, and a number of people have been injured. https://t.co/bqU7YuZMFL https://t.co/Cy9AEcNSKB Smoke seen at Kathmandu international airport in Nepal amid reports of plane crash https://t.co/wO324nHURX Comedian Sir Ken Dodd has died at the age of 90, his publicist has said. https://t.co/NcMi4AdBa9", "emojis": {}, "interests": {"police": 192, "say": 178, "trump": 166, "president": 153, "people": 137, "deal": 106, "may": 91, "year": 82, "attack": 81, "found": 80, "man": 78, "government": 76, "court": 76, "leader": 68, "time": 67, "medium": 66, "vote": 64, "election": 62, "day": 61, "minister": 59, "secretary": 57, "murder": 55, "live": 51, "house": 49, "state": 47, "aged": 47, "world": 46, "death": 44, "party": 43, "city": 43, "fire": 43, "labour": 42, "report": 42, "kim": 42, "latest": 41, "parliament": 39, "russia": 39, "win": 37, "following": 37, "follow": 35, "shooting": 35, "north": 35, "crash": 34, "new": 32, "injured": 30, "airport": 30, "woman": 30, "former": 29, "family": 29, "poisoning": 29, "reaction": 28, "end": 28, "men": 28, "cup": 27, "south": 27, "missing": 27, "chief": 26, "summit": 26, "agreement": 26, "car": 26, "hospital": 26, "supreme": 25, "sir": 25, "air": 24, "agent": 24, "plane": 24, "life": 24, "take": 24, "league": 24, "country": 24, "spy": 24, "hit": 23, "body": 23, "home": 23, "show": 22, "common": 22, "group": 22, "nerve": 22, "set": 21, "leave": 21, "decision": 21, "left": 21, "border": 21, "bill": 20, "saying": 20, "emergency": 20, "rescue": 20, "killing": 20, "cave": 20, "suspicion": 19, "week": 19, "white": 19, "prince": 19, "shot": 19, "done": 19, "get": 19, "investigation": 19, "moment": 19, "manager": 19, "withdrawal": 19, "coverage": 19, "case": 19, "terror": 18, "made": 18, "defence": 18, "bid": 18, "work": 18, "inquiry": 17, "age": 17, "cabinet": 17, "football": 17, "jail": 17, "national": 17, "control": 17, "explosion": 17, "war": 17, "champion": 17, "campaign": 17, "delay": 16, "power": 16, "canada": 16, "letter": 16, "person": 16, "tory": 16, "face": 16, "duke": 16, "row": 16, "pilot": 16, "school": 16, "security": 16, "street": 16, "opposition": 16, "board": 16, "boy": 16, "office": 16, "incident": 16, "news": 15, "extension": 15, "operation": 15, "june": 15, "run": 15, "corruption": 15, "daughter": 15, "couple": 15, "number": 15, "job": 15, "prime": 15, "official": 15, "motion": 14, "die": 14, "led": 14, "union": 14, "confirmed": 14, "match": 14, "duchess": 14, "star": 14, "ruling": 14, "agency": 14, "palace": 14, "oil": 14, "leaving": 14, "suspect": 14, "confirm": 14, "murdering": 14, "actor": 14, "lawyer": 14, "gunman": 14, "van": 14, "back": 13, "law": 13, "place": 13, "council": 13, "train": 13, "given": 13, "ministry": 13, "way": 13, "leadership": 13, "ban": 13, "china": 13, "term": 13, "capital": 13, "plan": 13, "said": 13, "close": 13, "confidence": 13, "defeat": 13, "sri": 13, "best": 13, "manslaughter": 12, "victory": 12, "agree": 12, "turkey": 12, "believe": 12, "full": 12, "assault": 12, "peace": 12, "hong": 12, "abuse": 12, "prison": 12, "record": 12, "becomes": 12, "action": 12, "harry": 12, "club": 12, "drone": 12, "stop": 12, "majority": 12, "strike": 12, "officer": 12, "investigating": 12, "use": 12, "mission": 12, "title": 12, "resignation": 12, "head": 12, "coach": 12, "month": 12, "arrest": 12, "dame": 12, "statement": 12, "lorry": 11, "japan": 11, "today": 11, "history": 11, "referendum": 11, "mother": 11, "exit": 11, "risk": 11, "jet": 11, "test": 11, "force": 11, "challenge": 11, "quits": 11, "judge": 11, "make": 11, "winning": 11, "girl": 11, "coast": 11, "chancellor": 11, "rape": 11, "health": 11, "administration": 11, "known": 11, "tax": 11, "freed": 11, "station": 11, "premier": 11, "sacked": 11, "hotel": 11, "son": 11, "journalist": 11, "chemical": 11, "give": 10, "driver": 10, "move": 10, "tusk": 10, "break": 10, "prize": 10, "conservative": 10, "executive": 10, "abortion": 10, "fight": 10, "queen": 10, "three": 10, "channel": 10, "united": 10, "high": 10, "mass": 10, "custody": 10, "part": 10, "find": 10, "accused": 10, "passenger": 10, "army": 10, "role": 10, "reject": 10, "result": 10, "baby": 10, "general": 10, "firm": 10, "order": 9, "deputy": 9, "come": 9, "lead": 9, "mike": 9, "northern": 9, "become": 9, "agreed": 9, "step": 9, "situation": 9, "stand": 9, "staff": 9, "presenter": 9, "wife": 9, "pay": 9, "interest": 9, "york": 9, "suspend": 9, "taken": 9, "fired": 9, "series": 9, "actress": 9, "post": 9, "story": 9, "terrorism": 9, "stay": 9, "suspected": 9, "trade": 9, "foreign": 9, "night": 9, "semi": 9, "appeal": 9, "director": 9, "scandal": 9, "picture": 9, "attorney": 9, "relationship": 9, "toll": 9, "six": 9, "spokesman": 9, "response": 9, "inflation": 9, "rate": 9, "probe": 9, "first": 9, "intelligence": 9, "brett": 9, "supermarket": 9, "source": 8, "backstop": 8, "reach": 8, "footballer": 8, "charge": 8, "island": 8, "peter": 8, "working": 8, "searching": 8, "candidate": 8, "told": 8, "help": 8, "gas": 8, "bank": 8, "suspended": 8, "hold": 8, "fell": 8, "partner": 8, "resign": 8, "wedding": 8, "search": 8, "system": 8, "met": 8, "bridge": 8, "going": 8, "continue": 8, "process": 8, "ambassador": 8, "meet": 8, "linked": 8, "contest": 8, "four": 8, "international": 8, "arsenal": 8, "green": 8, "quit": 8, "team": 8, "department": 8, "analysis": 8, "brazil": 8, "flight": 8, "release": 8, "fraud": 8, "town": 8, "misconduct": 8, "senate": 8, "cliff": 8, "debate": 7, "park": 7, "retain": 7, "game": 7, "performance": 7, "vice": 7, "commission": 7, "sex": 7, "involved": 7, "ground": 7, "travel": 7, "table": 7, "rule": 7, "join": 7, "beaten": 7, "brother": 7, "obituary": 7, "crime": 7, "evidence": 7, "wow": 7, "cut": 7, "crisis": 7, "grand": 7, "winner": 7, "storm": 7, "bomb": 7, "blast": 7, "father": 7, "sentence": 7, "trial": 7, "economy": 7, "east": 7, "governor": 7, "leaf": 7, "interview": 7, "contempt": 7, "top": 7, "building": 7, "connection": 7, "sent": 7, "aircraft": 7, "race": 7, "deliver": 7, "chain": 7, "bus": 7, "declared": 7, "change": 7, "remain": 7, "used": 7, "unemployment": 7, "real": 7, "justice": 7, "tsunami": 7, "chairman": 7, "scene": 7, "castle": 7, "want": 6, "carrying": 6, "vehicle": 6, "call": 6, "speaker": 6, "attempt": 6, "king": 6, "host": 6, "stabbing": 6, "backing": 6, "return": 6, "need": 6, "impeachment": 6, "shopping": 6, "congress": 6, "area": 6, "suggest": 6, "question": 6, "victim": 6, "mail": 6, "lady": 6, "suspension": 6, "right": 6, "tour": 6, "line": 6, "west": 6, "support": 6, "business": 6, "rise": 6, "founder": 6, "jack": 6, "five": 6, "coalition": 6, "conviction": 6, "river": 6, "exposed": 6, "went": 6, "multiple": 6, "hunt": 6, "royal": 6, "data": 6, "course": 6, "information": 6, "landing": 6, "ben": 6, "military": 6, "claim": 6, "mark": 6, "university": 6, "film": 6, "visit": 6, "plant": 6, "child": 6, "embassy": 6, "dutch": 6, "surrey": 6, "fled": 6, "bail": 6, "singer": 6, "khan": 6, "list": 6, "wall": 6, "smith": 6, "fund": 6, "shutdown": 6, "open": 6, "company": 6, "helicopter": 6, "trying": 6, "water": 6, "update": 6, "draft": 6, "nominee": 6, "diver": 6, "ant": 6, "trapped": 6, "feared": 6, "allow": 5, "decided": 5, "nation": 5, "sign": 5, "amendment": 5, "put": 5, "book": 5, "withdraw": 5, "chaos": 5, "veteran": 5, "protest": 5, "marathon": 5, "writer": 5, "read": 5, "cook": 5, "begin": 5, "era": 5, "attacker": 5, "member": 5, "surgery": 5, "zone": 5, "watch": 5, "newspaper": 5, "player": 5, "declare": 5, "link": 5, "remains": 5, "photo": 5, "missile": 5, "old": 5, "slam": 5, "amber": 5, "rudd": 5, "blocking": 5, "poll": 5, "extradition": 5, "ask": 5, "approve": 5, "lee": 5, "rail": 5, "major": 5, "hurricane": 5, "ruth": 5, "one": 5, "side": 5, "stage": 5, "see": 5, "worker": 5, "page": 5, "based": 5, "mosque": 5, "act": 5, "stopped": 5, "affecting": 5, "tanker": 5, "gulf": 5, "lose": 5, "student": 5, "making": 5, "moon": 5, "land": 5, "earthquake": 5, "plea": 5, "bailey": 5, "hill": 5, "meeting": 5, "raid": 5, "round": 5, "space": 5, "ford": 5, "collapse": 5, "tiger": 5, "tourist": 5, "name": 5, "gold": 5, "dead": 5, "tower": 5, "forced": 5, "store": 5, "verdict": 5, "nick": 5, "counter": 5, "fashion": 5, "go": 5, "immigration": 5, "watchdog": 5, "announce": 5, "driving": 5, "wreckage": 5, "lake": 5, "cancer": 5, "birth": 5, "armed": 5, "drama": 5, "transport": 5, "comedy": 5, "disruption": 5, "fuel": 5, "bush": 5, "violence": 5, "thousand": 5, "hurt": 5, "synagogue": 5, "walk": 5, "owner": 5, "taking": 5, "brought": 5, "republic": 5, "condition": 5, "hostage": 5, "base": 4, "traffic": 4, "lost": 4, "liberal": 4, "according": 4, "tournament": 4, "request": 4, "market": 4, "jury": 4, "negotiator": 4, "address": 4, "enter": 4, "clash": 4, "tell": 4, "sun": 4, "mayor": 4, "shock": 4, "fail": 4, "got": 4, "ash": 4, "sitting": 4, "struck": 4, "invitation": 4, "facing": 4, "boat": 4, "wicket": 4, "review": 4, "crew": 4, "returned": 4, "author": 4, "sparked": 4, "nine": 4, "decade": 4, "democrat": 4, "journey": 4, "ship": 4, "restaurant": 4, "lewis": 4, "launch": 4, "leak": 4, "commander": 4, "breach": 4, "level": 4, "look": 4, "macron": 4, "racing": 4, "betting": 4, "ending": 4, "designer": 4, "none": 4, "husband": 4, "loss": 4, "benjamin": 4, "form": 4, "hall": 4, "came": 4, "approach": 4, "song": 4, "gone": 4, "reopen": 4, "season": 4, "kill": 4, "baker": 4, "radio": 4, "thought": 4, "becoming": 4, "rod": 4, "easter": 4, "gunfire": 4, "counsel": 4, "saved": 4, "cathedral": 4, "custom": 4, "deadlock": 4, "damage": 4, "departure": 4, "throwing": 4, "ferry": 4, "isle": 4, "march": 4, "catholic": 4, "flying": 4, "captain": 4, "planet": 4, "package": 4, "worcester": 4, "statistic": 4, "rhapsody": 4, "battle": 4, "shut": 4, "seen": 4, "backed": 4, "gay": 4, "investigate": 4, "criminal": 4, "charity": 4, "sighting": 4, "musical": 4, "supporting": 4, "eve": 4, "greater": 4, "rising": 4, "retailer": 4, "pair": 4, "volcano": 4, "anti": 4, "august": 4, "sport": 4, "conference": 4, "prosecutor": 4, "wounded": 4, "wage": 4, "grace": 4, "access": 4, "respond": 4, "brain": 4, "campaigner": 4, "harassment": 4, "century": 4, "bos": 4, "tube": 4, "good": 4, "treatment": 4, "acid": 4, "privacy": 4, "red": 4, "suicide": 4, "brigade": 4, "sky": 4, "navy": 4, "pending": 4, "garden": 4, "sergeant": 4, "know": 4, "drink": 4, "san": 4, "expel": 4, "hope": 3, "conspiracy": 3, "moving": 3, "constable": 3, "push": 3, "hurdle": 3, "everything": 3, "ceremony": 3, "throne": 3, "broadcaster": 3, "substance": 3, "valley": 3, "took": 3, "gove": 3, "send": 3, "avoid": 3, "jean": 3, "deadline": 3, "key": 3, "racist": 3, "independence": 3, "athlete": 3, "knife": 3, "literature": 3, "polish": 3, "typhoon": 3, "starting": 3, "save": 3, "operate": 3, "paving": 3, "relation": 3, "phone": 3, "rory": 3, "leading": 3, "territory": 3, "racism": 3, "transfer": 3, "beat": 3, "princess": 3, "sought": 3, "respect": 3, "franco": 3, "church": 3, "harper": 3, "duty": 3, "adviser": 3, "surge": 3, "point": 3, "soldier": 3, "demand": 3, "zimbabwe": 3, "block": 3, "phase": 3, "landfall": 3, "gunshot": 3, "error": 3, "type": 3, "dispute": 3, "kent": 3, "alliance": 3, "landmark": 3, "play": 3, "tonight": 3, "grid": 3, "resolved": 3, "network": 3, "evacuation": 3, "failure": 3, "status": 3, "crossing": 3, "craft": 3, "penalty": 3, "refugee": 3, "speech": 3, "anna": 3, "gave": 3, "arson": 3, "concern": 3, "drug": 3, "inquest": 3, "super": 3, "roger": 3, "labor": 3, "pressure": 3, "citizenship": 3, "tommy": 3, "democracy": 3, "settle": 3, "angelique": 3, "nominated": 3, "sea": 3, "joe": 3, "senator": 3, "threat": 3, "stroke": 3, "remove": 3, "cult": 3, "airliner": 3, "press": 3, "breaking": 3, "village": 3, "love": 3, "engine": 3, "accident": 3, "villa": 3, "video": 3, "steel": 3, "celebrity": 3, "museum": 3, "stunning": 3, "burn": 3, "half": 3, "introduce": 3, "blasphemy": 3, "barcelona": 3, "sacking": 3, "suffering": 3, "merger": 3, "yesterday": 3, "devastating": 3, "wave": 3, "seven": 3, "television": 3, "nothing": 3, "waste": 3, "movement": 3, "position": 3, "warning": 3, "seek": 3, "sit": 3, "art": 3, "comedian": 3, "accept": 3, "doubt": 3, "killer": 3, "option": 3, "principle": 3, "event": 3, "trust": 3, "non": 3, "binding": 3, "black": 3, "begum": 3, "confirmation": 3, "atlantic": 3, "kensington": 3, "suspicious": 3, "shop": 3, "detention": 3, "meng": 3, "handling": 3, "ramus": 3, "kelly": 3, "independent": 3, "culture": 3, "coming": 3, "road": 3, "gang": 3, "illness": 3, "discus": 3, "single": 3, "ongoing": 3, "panel": 3, "pentagon": 3, "paddy": 3, "runway": 3, "foundation": 3, "committee": 3, "exchange": 3, "advice": 3, "getting": 3, "lying": 3, "giving": 3, "price": 3, "rapist": 3, "parole": 3, "criticism": 3, "odds": 3, "stadium": 3, "related": 3, "fall": 3, "bar": 3, "service": 3, "removed": 3, "budget": 3, "blown": 3, "lion": 3, "sold": 3, "summer": 3, "crowd": 3, "minibus": 3, "wake": 3, "lift": 3, "region": 3, "doctor": 3, "coroner": 3, "ball": 3, "anger": 3, "musk": 3, "giant": 3, "worth": 3, "self": 3, "buy": 3, "cricket": 3, "franklin": 3, "soul": 3, "start": 3, "period": 3, "exposure": 3, "german": 3, "bel": 3, "conte": 3, "minute": 3, "chapel": 3, "human": 3, "theft": 3, "silence": 3, "site": 3, "resulting": 3, "interior": 3, "eyewitness": 3, "extent": 3, "consumer": 3, "hawking": 3, "trailer": 2, "study": 2, "ensure": 2, "identify": 2, "timetable": 2, "meaning": 2, "happen": 2, "abandon": 2, "opportunity": 2, "negotiate": 2, "legislation": 2, "pick": 2, "pause": 2, "let": 2, "penny": 2, "atmosphere": 2, "door": 2, "considering": 2, "protect": 2, "democratic": 2, "broken": 2, "offensive": 2, "setting": 2, "bought": 2, "second": 2, "hacking": 2, "sander": 2, "replace": 2, "falling": 2, "protester": 2, "bullet": 2, "parade": 2, "celebrate": 2, "fee": 2, "causing": 2, "track": 2, "tried": 2, "hale": 2, "decide": 2, "effect": 2, "keep": 2, "operator": 2, "oust": 2, "remember": 2, "hearing": 2, "voltage": 2, "stuck": 2, "draw": 2, "fury": 2, "production": 2, "jordan": 2, "publish": 2, "evening": 2, "agenda": 2, "twitter": 2, "halt": 2, "stepping": 2, "blow": 2, "limited": 2, "complete": 2, "advised": 2, "behaviour": 2, "consulate": 2, "stour": 2, "dobson": 2, "speed": 2, "youth": 2, "devoted": 2, "add": 2, "triumph": 2, "financier": 2, "contact": 2, "energy": 2, "distribution": 2, "problem": 2, "scheme": 2, "reversing": 2, "teenage": 2, "hour": 2, "commissioner": 2, "dam": 2, "condemn": 2, "revoke": 2, "reducing": 2, "temperature": 2, "ballot": 2, "beating": 2, "string": 2, "stuff": 2, "hand": 2, "precaution": 2, "concerned": 2, "fourteen": 2, "collision": 2, "smuggling": 2, "vessel": 2, "assistance": 2, "studio": 2, "bomber": 2, "diplomat": 2, "alan": 2, "incredible": 2, "sixth": 2, "barry": 2, "ray": 2, "blue": 2, "impose": 2, "panorama": 2, "billionaire": 2, "ran": 2, "customer": 2, "enrichment": 2, "broadcast": 2, "horse": 2, "frank": 2, "disappearance": 2, "speculation": 2, "storming": 2, "accepted": 2, "tweet": 2, "goal": 2, "negotiation": 2, "apple": 2, "heading": 2, "contract": 2, "enemy": 2, "field": 2, "climate": 2, "massive": 2, "supplier": 2, "opera": 2, "chance": 2, "leg": 2, "reporter": 2, "credit": 2, "crown": 2, "reduced": 2, "retrial": 2, "autumn": 2, "gun": 2, "background": 2, "saw": 2, "pedro": 2, "hazard": 2, "county": 2, "serving": 2, "resounding": 2, "uncovered": 2, "chef": 2, "frightened": 2, "treble": 2, "marriage": 2, "province": 2, "grew": 2, "bibi": 2, "shrine": 2, "lone": 2, "soe": 2, "emperor": 2, "stake": 2, "blocked": 2, "waking": 2, "holding": 2, "district": 2, "lyra": 2, "rioting": 2, "collusion": 2, "stone": 2, "structure": 2, "destruction": 2, "spreading": 2, "spire": 2, "main": 2, "coup": 2, "agreeing": 2, "ailing": 2, "roll": 2, "pub": 2, "sig": 2, "scenario": 2, "prosecution": 2, "politics": 2, "whip": 2, "reaching": 2, "staged": 2, "speedboat": 2, "absence": 2, "received": 2, "article": 2, "sovereignty": 2, "minimum": 2, "warn": 2, "fleet": 2, "grounded": 2, "cardinal": 2, "pell": 2, "clock": 2, "choice": 2, "aviation": 2, "authority": 2, "notice": 2, "mutilation": 2, "capsule": 2, "ocean": 2, "sorry": 2, "fighter": 2, "gesture": 2, "praise": 2, "check": 2, "tension": 2, "prepared": 2, "alfonso": 2, "aid": 2, "competition": 2, "republican": 2, "maduro": 2, "goalkeeper": 2, "resume": 2, "sister": 2, "rio": 2, "touchdown": 2, "publicist": 2, "route": 2, "cooper": 2, "wheel": 2, "speeding": 2, "date": 2, "nurse": 2, "succeed": 2, "bishop": 2, "issue": 2, "militant": 2, "responsibility": 2, "complex": 2, "bottom": 2, "bangkok": 2, "bakery": 2, "blood": 2, "prove": 2, "grayling": 2, "talk": 2, "tribute": 2, "object": 2, "solar": 2, "treating": 2, "terry": 2, "closed": 2, "driven": 2, "cross": 2, "fault": 2, "acting": 2, "activity": 2, "pull": 2, "retire": 2, "toddler": 2, "dying": 2, "gain": 2, "posted": 2, "martin": 2, "surviving": 2, "finish": 2, "triggered": 2, "mean": 2, "rocket": 2, "heart": 2, "accounting": 2, "wing": 2, "surrounding": 2, "weekend": 2, "involvement": 2, "reduce": 2, "cannon": 2, "tear": 2, "turned": 2, "emma": 2, "mistake": 2, "failing": 2, "cab": 2, "resigned": 2, "aide": 2, "ons": 2, "legend": 2, "calling": 2, "carried": 2, "quarter": 2, "fixed": 2, "achievement": 2, "squirrel": 2, "birthday": 2, "threatening": 2, "booker": 2, "device": 2, "explain": 2, "receive": 2, "offer": 2, "wound": 2, "bullying": 2, "cake": 2, "nomination": 2, "hack": 2, "plot": 2, "manger": 2, "breakfast": 2, "heterosexual": 2, "quake": 2, "disaster": 2, "flaw": 2, "seal": 2, "revealed": 2, "conversation": 2, "duo": 2, "overturn": 2, "lot": 2, "undermining": 2, "future": 2, "imposing": 2, "berlin": 2, "florence": 2, "stolen": 2, "burt": 2, "scrapped": 2, "rogue": 2, "costa": 2, "approval": 2, "entertainment": 2, "knifeman": 2, "direction": 2, "blaming": 2, "increase": 2, "motorway": 2, "cricketer": 2, "parker": 2, "direct": 2, "struggling": 2, "protection": 2, "pregnancy": 2, "anyone": 2, "midwife": 2, "chuckle": 2, "plotting": 2, "championship": 2, "ordered": 2, "effort": 2, "operating": 2, "appealing": 2, "submarine": 2, "fra": 2, "fox": 2, "heartbreak": 2, "losing": 2, "bit": 2, "maria": 2, "accomplished": 2, "faced": 2, "sight": 2, "silva": 2, "helping": 2, "aum": 2, "executed": 2, "eric": 2, "female": 2, "fifth": 2, "rally": 2, "policy": 2, "rev": 2, "gosport": 2, "memorial": 2, "blaze": 2, "soap": 2, "parachute": 2, "lawsuit": 2, "conduct": 2, "management": 2, "appoint": 2, "producer": 2, "visa": 2, "zoo": 2, "escape": 2, "torture": 2, "reform": 2, "surrender": 2, "burning": 2, "emery": 2, "spencer": 2, "novelist": 2, "ken": 2, "bride": 2, "describe": 2, "ignorance": 2, "safety": 2, "attend": 2, "haemorrhage": 2, "fierce": 2, "breast": 2, "screening": 2, "shouting": 2, "seeing": 2, "finch": 2, "avenue": 2, "yak": 2, "rebel": 2, "admitted": 2, "average": 2, "index": 2, "ulster": 2, "assistant": 2, "replacement": 2, "gymnastics": 2, "dart": 2, "hip": 2, "headquarters": 2, "mor": 2, "warner": 2, "be": 2, "hawk": 2, "detective": 2, "property": 2, "knowledge": 2, "sud": 1, "lifting": 1, "maintain": 1, "dignity": 1, "travelled": 1, "registered": 1, "industrial": 1, "morning": 1, "container": 1, "iyo": 1, "ascent": 1, "chrysanthemum": 1, "minority": 1, "matter": 1, "consort": 1, "disloyalty": 1, "develop": 1, "dementia": 1, "range": 1, "prog": 1, "welcome": 1, "declined": 1, "comply": 1, "dismayed": 1, "setback": 1, "sublime": 1, "superlative": 1, "golf": 1, "solution": 1, "geography": 1, "integrity": 1, "conflict": 1, "prolongation": 1, "extend": 1, "stability": 1, "congressman": 1, "qualifier": 1, "huckle": 1, "word": 1, "incursion": 1, "artillery": 1, "behalf": 1, "legal": 1, "forcing": 1, "daily": 1, "mirror": 1, "contender": 1, "colonial": 1, "erne": 1, "artery": 1, "blockage": 1, "newsreader": 1, "suing": 1, "publication": 1, "written": 1, "policewoman": 1, "flat": 1, "chest": 1, "defy": 1, "complaint": 1, "naga": 1, "third": 1, "regarding": 1, "businesswoman": 1, "lux": 1, "lock": 1, "transcript": 1, "engagement": 1, "blighted": 1, "formal": 1, "dictator": 1, "mausoleum": 1, "apply": 1, "forgotten": 1, "ditch": 1, "wore": 1, "blackface": 1, "amount": 1, "displeasure": 1, "gala": 1, "magazine": 1, "debris": 1, "boarding": 1, "swim": 1, "impact": 1, "oval": 1, "urn": 1, "cancel": 1, "bell": 1, "otto": 1, "sam": 1, "felicity": 1, "paying": 1, "exam": 1, "corrected": 1, "disagreed": 1, "pledge": 1, "annex": 1, "correspondence": 1, "refuse": 1, "forward": 1, "os": 1, "fine": 1, "opposed": 1, "seize": 1, "pointless": 1, "speak": 1, "category": 1, "random": 1, "account": 1, "hacked": 1, "flurry": 1, "rep": 1, "survival": 1, "verge": 1, "bury": 1, "cheng": 1, "abolish": 1, "burglary": 1, "ruler": 1, "carbon": 1, "monoxide": 1, "rocky": 1, "brawl": 1, "holiday": 1, "hub": 1, "cell": 1, "utility": 1, "affected": 1, "outage": 1, "warden": 1, "benefit": 1, "output": 1, "possessing": 1, "weapon": 1, "policeman": 1, "recovery": 1, "alert": 1, "targeted": 1, "bigotry": 1, "supremacy": 1, "powered": 1, "disqualification": 1, "carl": 1, "beech": 1, "lapse": 1, "shipwreck": 1, "caid": 1, "presidency": 1, "obscenity": 1, "patel": 1, "appointment": 1, "dover": 1, "netball": 1, "seizure": 1, "revolutionary": 1, "guard": 1, "goddard": 1, "strong": 1, "knocking": 1, "shutting": 1, "anime": 1, "baron": 1, "accord": 1, "dismiss": 1, "distraction": 1, "mathematician": 1, "note": 1, "powerful": 1, "telescope": 1, "map": 1, "cosmos": 1, "yard": 1, "census": 1, "questionnaire": 1, "ross": 1, "militia": 1, "terminator": 1, "pushing": 1, "finished": 1, "port": 1, "pundit": 1, "lob": 1, "tie": 1, "flag": 1, "podium": 1, "legislature": 1, "spray": 1, "smashing": 1, "overrun": 1, "chamber": 1, "limit": 1, "stockpile": 1, "uranium": 1, "pregnant": 1, "croydon": 1, "feel": 1, "ease": 1, "lut": 1, "foot": 1, "handshake": 1, "bloc": 1, "clinch": 1, "sweltering": 1, "kamala": 1, "tez": 1, "convert": 1, "cocked": 1, "loaded": 1, "retaliate": 1, "mind": 1, "petition": 1, "footage": 1, "activist": 1, "vying": 1, "arm": 1, "expert": 1, "woodland": 1, "maestro": 1, "worked": 1, "scale": 1, "icon": 1, "lam": 1, "introduction": 1, "covered": 1, "select": 1, "tha": 1, "outcry": 1, "scrap": 1, "blanket": 1, "someone": 1, "pension": 1, "mali": 1, "inhabited": 1, "miss": 1, "wish": 1, "sally": 1, "extra": 1, "sound": 1, "salute": 1, "hunting": 1, "winger": 1, "tycoon": 1, "derby": 1, "ghazi": 1, "nationalist": 1, "tea": 1, "publisher": 1, "mistreatment": 1, "insolvency": 1, "supply": 1, "addition": 1, "entrepreneur": 1, "drive": 1, "formula": 1, "arcade": 1, "thrashing": 1, "shorten": 1, "bob": 1, "computer": 1, "kyle": 1, "allegation": 1, "priest": 1, "final": 1, "trick": 1, "image": 1, "bundle": 1, "joy": 1, "appear": 1, "spent": 1, "abandoned": 1, "unbelievable": 1, "actually": 1, "elephant": 1, "beaming": 1, "mum": 1, "fresh": 1, "asthma": 1, "pollution": 1, "deny": 1, "jockey": 1, "ruby": 1, "walsh": 1, "retirement": 1, "riding": 1, "development": 1, "sadness": 1, "caster": 1, "testosterone": 1, "abdication": 1, "monarch": 1, "singleton": 1, "directed": 1, "hood": 1, "core": 1, "regulator": 1, "risen": 1, "rolling": 1, "curfew": 1, "emotion": 1, "bib": 1, "staging": 1, "topple": 1, "surface": 1, "please": 1, "grant": 1, "kingdom": 1, "hole": 1, "unveiled": 1, "heat": 1, "umbrella": 1, "nuisance": 1, "homeland": 1, "tri": 1, "botched": 1, "outcome": 1, "write": 1, "unity": 1, "division": 1, "drag": 1, "seeking": 1, "stalemate": 1, "compromise": 1, "regret": 1, "harmony": 1, "intended": 1, "drop": 1, "shepherd": 1, "try": 1, "conspire": 1, "special": 1, "liaison": 1, "encourage": 1, "speaking": 1, "estuary": 1, "squire": 1, "thanks": 1, "recognize": 1, "short": 1, "soviet": 1, "tram": 1, "inspired": 1, "well": 1, "ana": 1, "forty": 1, "public": 1, "abundance": 1, "caution": 1, "stemming": 1, "sao": 1, "voting": 1, "solve": 1, "confusion": 1, "avalanche": 1, "civil": 1, "cox": 1, "fan": 1, "athletics": 1, "governing": 1, "box": 1, "recorder": 1, "everyone": 1, "climber": 1, "mountain": 1, "dragon": 1, "earth": 1, "astronaut": 1, "afternoon": 1, "knock": 1, "growing": 1, "luke": 1, "perry": 1, "prodigy": 1, "flint": 1, "breathe": 1, "procedure": 1, "extradite": 1, "rent": 1, "accusation": 1, "composer": 1, "conductor": 1, "wise": 1, "sketch": 1, "bribery": 1, "migration": 1, "railway": 1, "propose": 1, "supa": 1, "drawing": 1, "cleric": 1, "prevent": 1, "overcome": 1, "hijack": 1, "crystal": 1, "violent": 1, "empire": 1, "dudley": 1, "abduction": 1, "breakaway": 1, "crush": 1, "honda": 1, "closure": 1, "berger": 1, "gape": 1, "ann": 1, "welsh": 1, "bring": 1, "build": 1, "coherent": 1, "strategy": 1, "lord": 1, "condemned": 1, "avert": 1, "outbreak": 1, "flu": 1, "hakeem": 1, "unprecedented": 1, "cinema": 1, "glom": 1, "training": 1, "walking": 1, "reading": 1, "branch": 1, "bowl": 1, "equalling": 1, "hardy": 1, "regular": 1, "quiz": 1, "secure": 1, "ugly": 1, "lied": 1, "acquittal": 1, "tech": 1, "raising": 1, "seventh": 1, "settling": 1, "obstruction": 1, "witness": 1, "patient": 1, "estate": 1, "prospect": 1, "catastrophe": 1, "continued": 1, "every": 1, "uncertainty": 1, "bitterness": 1, "ivory": 1, "dropping": 1, "humanity": 1, "consent": 1, "sturgeon": 1, "asylum": 1, "barrier": 1, "designed": 1, "thwart": 1, "deploy": 1, "equipment": 1, "method": 1, "bale": 1, "could": 1, "front": 1, "cole": 1, "mine": 1, "mental": 1, "ultima": 1, "patrol": 1, "fabulous": 1, "gate": 1, "tarmac": 1, "python": 1, "twiggy": 1, "egma": 1, "music": 1, "poised": 1, "affect": 1, "iceland": 1, "sworn": 1, "expect": 1, "restricted": 1, "arrival": 1, "rest": 1, "kept": 1, "troop": 1, "hamper": 1, "relaxed": 1, "ticket": 1, "fighting": 1, "personality": 1, "nearly": 1, "mick": 1, "bug": 1, "lifeline": 1, "graham": 1, "delaying": 1, "renegotiate": 1, "facilitate": 1, "ratification": 1, "deferred": 1, "yoi": 1, "stampede": 1, "sanction": 1, "ted": 1, "hugging": 1, "yachtswoman": 1, "cargo": 1, "cape": 1, "horn": 1, "virgin": 1, "recognition": 1, "oversee": 1, "pete": 1, "punk": 1, "band": 1, "disconnected": 1, "tail": 1, "rotor": 1, "upheld": 1, "wilder": 1, "fought": 1, "heavyweight": 1, "morgan": 1, "shadow": 1, "vest": 1, "washed": 1, "beach": 1, "mast": 1, "example": 1, "reservation": 1, "entering": 1, "invasion": 1, "project": 1, "plead": 1, "shrink": 1, "aftermath": 1, "treasury": 1, "scientist": 1, "gene": 1, "brave": 1, "academic": 1, "pardon": 1, "deport": 1, "firing": 1, "seizing": 1, "include": 1, "sha": 1, "recover": 1, "grasp": 1, "political": 1, "declaration": 1, "gaz": 1, "unidentified": 1, "bulletin": 1, "restore": 1, "rouge": 1, "genocide": 1, "camp": 1, "reconcile": 1, "conscience": 1, "stormy": 1, "command": 1, "divorce": 1, "consider": 1, "genius": 1, "superhero": 1, "creator": 1, "marvel": 1, "spider": 1, "panther": 1, "discovery": 1, "paradise": 1, "long": 1, "twelve": 1, "jeff": 1, "session": 1, "mid": 1, "skelter": 1, "reinstate": 1, "hate": 1, "crouch": 1, "crackdown": 1, "conspiring": 1, "launder": 1, "spinal": 1, "implant": 1, "bulger": 1, "boston": 1, "gangster": 1, "khu": 1, "murderer": 1, "threshold": 1, "income": 1, "stamp": 1, "ownership": 1, "valued": 1, "chairwoman": 1, "controversial": 1, "far": 1, "opening": 1, "hoddle": 1, "ill": 1, "swift": 1, "tracked": 1, "meal": 1, "target": 1, "steal": 1, "retail": 1, "escalator": 1, "savage": 1, "urgent": 1, "clarification": 1, "vei": 1, "twenty": 1, "radical": 1, "preacher": 1, "inviting": 1, "farm": 1, "fulham": 1, "college": 1, "possession": 1, "milkman": 1, "deference": 1, "thrive": 1, "spring": 1, "small": 1, "airfield": 1, "provide": 1, "wigan": 1, "punishment": 1, "striker": 1, "henry": 1, "pastor": 1, "shale": 1, "discrimination": 1, "stripped": 1, "pile": 1, "alias": 1, "stealing": 1, "infertile": 1, "enable": 1, "arc": 1, "still": 1, "tap": 1, "gallery": 1, "hut": 1, "dyke": 1, "degree": 1, "teen": 1, "warfare": 1, "impunity": 1, "palmer": 1, "freshly": 1, "jubilation": 1, "desperation": 1, "stricken": 1, "career": 1, "lasting": 1, "senior": 1, "informed": 1, "determine": 1, "allergy": 1, "eating": 1, "baguette": 1, "sexual": 1, "sale": 1, "association": 1, "testimony": 1, "identity": 1, "interfere": 1, "sexually": 1, "predator": 1, "amid": 1, "extended": 1, "knockout": 1, "testify": 1, "cable": 1, "auction": 1, "pocket": 1, "several": 1, "impasse": 1, "pharmacy": 1, "caravan": 1, "hail": 1, "ranging": 1, "disrepute": 1, "rescuer": 1, "repeated": 1, "create": 1, "buffer": 1, "separate": 1, "comment": 1, "accuser": 1, "monetary": 1, "inflict": 1, "sealed": 1, "correction": 1, "ako": 1, "eye": 1, "coli": 1, "jimmy": 1, "wick": 1, "scorer": 1, "establishment": 1, "predict": 1, "mac": 1, "miller": 1, "theorist": 1, "charm": 1, "swagger": 1, "starred": 1, "bandit": 1, "deliverance": 1, "alcohol": 1, "intoxication": 1, "bland": 1, "portrayal": 1, "adopt": 1, "definition": 1, "whole": 1, "helm": 1, "tarin": 1, "naa": 1, "crossrail": 1, "underground": 1, "coca": 1, "cola": 1, "coffee": 1, "payday": 1, "lender": 1, "wonga": 1, "compensation": 1, "unmarried": 1, "widowed": 1, "parent": 1, "allowance": 1, "deceased": 1, "hero": 1, "pope": 1, "quarrel": 1, "finance": 1, "purpose": 1, "bond": 1, "generation": 1, "apology": 1, "monsoon": 1, "assembly": 1, "voice": 1, "prayer": 1, "graded": 1, "proportion": 1, "clearance": 1, "affray": 1, "tragedy": 1, "danger": 1, "camera": 1, "outside": 1, "raft": 1, "medicine": 1, "touch": 1, "permission": 1, "brunswick": 1, "fut": 1, "growth": 1, "reputation": 1, "tremor": 1, "smuggle": 1, "net": 1, "stoke": 1, "soil": 1, "opponent": 1, "nelson": 1, "value": 1, "finding": 1, "splashed": 1, "application": 1, "moray": 1, "rigging": 1, "cover": 1, "changer": 1, "shape": 1, "kit": 1, "kat": 1, "fingered": 1, "wafer": 1, "dup": 1, "warplane": 1, "mourning": 1, "deliberate": 1, "sank": 1, "columbine": 1, "style": 1, "population": 1, "android": 1, "cement": 1, "looking": 1, "judgment": 1, "corporation": 1, "guy": 1, "conclusion": 1, "victorious": 1, "ended": 1, "cro": 1, "sue": 1, "trophy": 1, "bottle": 1, "think": 1, "fake": 1, "trip": 1, "spend": 1, "seed": 1, "nursing": 1, "header": 1, "fly": 1, "flooded": 1, "gearing": 1, "dream": 1, "christening": 1, "quarantine": 1, "dawn": 1, "ninety": 1, "begun": 1, "tested": 1, "crucially": 1, "creation": 1, "hanging": 1, "luxury": 1, "saman": 1, "oxygen": 1, "consciousness": 1, "execution": 1, "environmental": 1, "toxin": 1, "item": 1, "moor": 1, "scored": 1, "col": 1, "dier": 1, "countess": 1, "chester": 1, "learn": 1, "dive": 1, "wait": 1, "flooding": 1, "recede": 1, "archbishop": 1, "serve": 1, "covering": 1, "alive": 1, "wrongdoing": 1, "compete": 1, "withdrawn": 1, "gazette": 1, "shotgun": 1, "reshape": 1, "tackle": 1, "seeded": 1, "tortured": 1, "dumping": 1, "assume": 1, "sweeping": 1, "score": 1, "guarantee": 1, "like": 1, "reunite": 1, "facility": 1, "expand": 1, "aiming": 1, "condemnation": 1, "defraud": 1, "rebellion": 1, "shown": 1, "tenacity": 1, "fortitude": 1, "justification": 1, "cause": 1, "marijuana": 1, "cesspool": 1, "bias": 1, "total": 1, "topped": 1, "junction": 1, "epileptic": 1, "react": 1, "mackintosh": 1, "copyright": 1, "dirty": 1, "den": 1, "scathing": 1, "engineering": 1, "urgency": 1, "relief": 1, "federation": 1, "stopping": 1, "ame": 1, "document": 1, "clearer": 1, "waiting": 1, "depart": 1, "model": 1, "discount": 1, "light": 1, "raglan": 1, "disarray": 1, "endorsement": 1, "neck": 1, "bag": 1, "room": 1, "employer": 1, "legality": 1, "free": 1, "grandmother": 1, "giver": 1, "spade": 1, "apartment": 1, "detailed": 1, "expansion": 1, "colorado": 1, "austerity": 1, "cordon": 1, "hardware": 1, "card": 1, "jaguar": 1, "indoors": 1, "aluminium": 1, "ally": 1, "assassination": 1, "expose": 1, "abhorrent": 1, "repugnant": 1, "submerged": 1, "flood": 1, "balcony": 1, "migrant": 1, "citizen": 1, "designate": 1, "yes": 1, "constitution": 1, "revolution": 1, "reschedule": 1, "landslide": 1, "carer": 1, "answer": 1, "hammer": 1, "somerset": 1, "accuse": 1, "hopefully": 1, "petrol": 1, "pray": 1, "god": 1, "hostility": 1, "displayed": 1, "reason": 1, "payment": 1, "bureau": 1, "fix": 1, "exclusive": 1, "arrange": 1, "successor": 1, "vital": 1, "memory": 1, "beginning": 1, "propaganda": 1, "reception": 1, "enormous": 1, "greet": 1, "married": 1, "bright": 1, "sunshine": 1, "glimpse": 1, "exploded": 1, "accompany": 1, "eruption": 1, "barmaid": 1, "intent": 1, "consult": 1, "banning": 1, "cladding": 1, "hem": 1, "focus": 1, "indifference": 1, "cost": 1, "bet": 1, "squad": 1, "che": 1, "stagecoach": 1, "politician": 1, "bonfire": 1, "inaugurate": 1, "amidst": 1, "protagonist": 1, "stalwart": 1, "thank": 1, "choosing": 1, "serial": 1, "disrupt": 1, "rabbit": 1, "financial": 1, "unmask": 1, "hakim": 1, "tip": 1, "arrive": 1, "axe": 1, "homeless": 1, "care": 1, "undergoing": 1, "fairground": 1, "middle": 1, "restart": 1, "rotten": 1, "tied": 1, "share": 1, "steven": 1, "award": 1, "coke": 1, "dust": 1, "reveal": 1, "proving": 1, "shah": 1, "chosen": 1, "merge": 1, "heartbroken": 1, "removal": 1, "rid": 1, "peninsula": 1, "dividing": 1, "bruising": 1, "excited": 1, "inventor": 1, "million": 1, "mounted": 1, "naked": 1, "waffle": 1, "commemoration": 1, "born": 1, "delighted": 1, "finalist": 1, "bow": 1, "debut": 1, "voter": 1, "registration": 1, "swimming": 1, "pool": 1, "fitness": 1, "commonwealth": 1, "dale": 1, "sweep": 1, "canel": 1, "formed": 1, "rue": 1, "printing": 1, "literacy": 1, "anxiety": 1, "controversy": 1, "poison": 1, "environment": 1, "unfit": 1, "advertising": 1, "envoy": 1, "aggression": 1, "allied": 1, "concluding": 1, "accountability": 1, "referee": 1, "hundred": 1, "eastern": 1, "organization": 1, "many": 1, "metropolitan": 1, "golfer": 1, "reed": 1, "drove": 1, "bode": 1, "spokeswoman": 1, "ice": 1, "hockey": 1, "collide": 1, "silver": 1, "burglar": 1, "blake": 1, "dialogue": 1, "cousin": 1, "antelope": 1, "shooter": 1, "apartheid": 1, "count": 1, "junk": 1, "lab": 1, "pacific": 1, "midland": 1, "safari": 1, "expulsion": 1, "widow": 1, "pulse": 1, "shelling": 1, "improving": 1, "mortgage": 1, "ram": 1, "raping": 1, "loop": 1, "arena": 1, "suit": 1, "sixty": 1, "alarm": 1, "switched": 1, "inferno": 1, "southern": 1, "pain": 1, "detain": 1, "sedition": 1, "remainder": 1, "siege": 1, "warrant": 1, "analytics": 1, "inspector": 1, "dangerous": 1, "shoot": 1, "taker": 1, "allegiance": 1, "elite": 1, "wounding": 1, "kier": 1, "testing": 1, "prohibition": 1, "dowd": 1, "negligence": 1, "pablo": 1, "parcel": 1, "nix": 1, "engineer": 1, "professor": 1, "abbey": 1, "newton": 1, "dean": 1, "depot": 1, "nag": 1, "measured": 1, "transition": 1, "enjoy": 1, "implementation": 1, "certainty": 1, "text": 1, "towards": 1, "businessman": 1, "native": 1, "meddling": 1, "retaliation": 1, "maker": 1, "marmite": 1, "dove": 1, "fico": 1, "provided": 1, "freeze": 1, "asset": 1, "threaten": 1, "attendance": 1, "hosting": 1, "buyer": 1, "double": 1, "illusion": 1, "physicist": 1, "ultimatum": 1, "rex": 1, "surrounded": 1, "argentine": 1, "tale": 1, "highly": 1, "grade": 1, "styling": 1, "spate": 1, "bombardier": 1, "dash": 1, "smoke": 1, "dodd": 1}}